url,place,time,description,sources,id,place.name,place.org.name,place.org.surname,place.org.title,place.org.time,place.org.deprecated,place.org.note,place.org.place,place.org.description,place.org.sources,place.org.tags,place.org.image,place.org.id,place.org.dirName,place.org.url,place.org.events,place.org.type,place.org.places,place.org.kind,place.org.parent,place.place,place.org,place.place.name,place.place.surname,place.place.title,place.place.time,place.place.deprecated,place.place.note,place.place.place,place.place.description,place.place.sources,place.place.tags,place.place.image,place.place.id,place.place.dirName,place.place.url,place.place.events,place.place.type,place.place.locations,place.place.elevation,place.org.parent.name,place.org.parent.surname,place.org.parent.title,place.org.parent.time,place.org.parent.deprecated,place.org.parent.note,place.org.parent.place,place.org.parent.description,place.org.parent.sources,place.org.parent.tags,place.org.parent.image,place.org.parent.id,place.org.parent.dirName,place.org.parent.url,place.org.parent.events,place.org.parent.type,place.org.parent.places,place.org.parent.kind,place.org.parent.parent.name,place.org.parent.parent.surname,place.org.parent.parent.title,place.org.parent.parent.time,place.org.parent.parent.deprecated,place.org.parent.parent.note,place.org.parent.parent.place,place.org.parent.parent.description,place.org.parent.parent.sources,place.org.parent.parent.tags,place.org.parent.parent.image,place.org.parent.parent.id,place.org.parent.parent.dirName,place.org.parent.parent.url,place.org.parent.parent.events,place.org.parent.parent.type,place.org.parent.parent.places,place.org.parent.parent.kind,place.org.parent.parent.parent.name,place.org.parent.parent.parent.surname,place.org.parent.parent.parent.title,place.org.parent.parent.parent.time,place.org.parent.parent.parent.deprecated,place.org.parent.parent.parent.note,place.org.parent.parent.parent.place,place.org.parent.parent.parent.description,place.org.parent.parent.parent.sources,place.org.parent.parent.parent.tags,place.org.parent.parent.parent.image,place.org.parent.parent.parent.id,place.org.parent.parent.parent.dirName,place.org.parent.parent.parent.url,place.org.parent.parent.parent.events,place.org.parent.parent.parent.type,place.org.parent.parent.parent.places,place.org.parent.parent.parent.kind,place.org.parent.parent.parent.parent,place.org.parent.parent.parent,place.org.parent.parent
https://rr0.org/time/1/8/9/2/index.html#1892-01,Clifton (Indiana),,,,,,,,,,,,,,,,"",place,"",,1892-01,"en le mercredi 27 Près de , pluie d'insectes inconnus.","""Shower of Worms"",s1,"""",Daily Democrat de Hamilton (Ohio),1892-02-01",1892-01
https://rr0.org/time/1/8/9/2/index.html#1892-03,Moscou (Russie),,,,,,,,,,,,,,,,"",place,"",,1892-03,"en le mardi 12 Près de , on voit dans le ciel 1 phénomène émettant un puissant cône de lumière.","Article de Svet,s2,"""",""1892-03-17 < UFO-Aktuelt, journal de UFO Swenden"",",1892-03
https://rr0.org/time/1/8/9/2/index.html#1892-04,Przemyśl (Autriche-Hongrie),,,,,,,,,,,,,,,,"",place,"",,1892-04,"en le samedi 16 À : On a observé ce samedi un point lumineux apparu au-dessus de Jaroslaw dans une direction Nord-Est. Cet objet était sphérique et émettait, à la fois vers le haut et vers le bas, des rayons lumineux à la brillance électrique et de forme conique. À l'aide de jumelles, il est devenu évident qu’il ne s'agissait ni d’une planète ni d’une étoile puisque l'objet était en vol stationnaire à environ 600 m au-dessus du sol et qu'il s'est mis à exécuter des cercles de 4 ou 5 km de rayon. On peut penser qu'il s'agit d’un ballon dont l’équipage effectuait une reconnaissance avec une lampe électrique. Un samedi soir à Skien (Norvège), des personnes voient pénétrer dans la pièce où ils se trouvent une boule de feu enveloppée d'un halo bleu clair brillant, avec une longue traînée rouge, et se déplacer très rapidement.","Czas,s3,"""",,1892-04-20,OVNIs en Pologne,s4,""""""Cielebiaś, Piotr"""""",""Le temps présent, 2018, pp. 20-21"",,Drammens Tidende Og Buskeruds Blad,s5,"""",1892-04-10,-27",1892-04
https://rr0.org/time/1/8/9/2/index.html#1892-06,Paris (Texas),,,,,,,,,,,,,,,,"",place,"",,1892-06,"en le dimanche 5 le matin A , observation d'un front orageux accompagnés de lueurs en rangée.","""Indian Territory"",s6,"""",Daily News de Galveston (Texas),1892-06-17",1892-06
https://rr0.org/time/1/8/9/2/index.html#1892-07,Oshkosh (Wisconsin),,,,,,,,,,,,,,,,"",place,"",,1892-07,"en le mercredi 13 21 h A , anomalies atmosphériques.","""Phenomena"",s7,"""",Daily Northwestern de Oshkosh (Wisconsin),1892-07-14",1892-07
https://rr0.org/time/1/8/9/2/index.html#1892-08,Bjelina (Serbie),,,,,,,,,,,,,,,,"",place,"",,1892-08,"en A , pluie de poissons vivants. le mardi 30 A Waxhachie (Texas), on observe dans le ciel une sorte de ballon se déplacer dans les airs vers le nord-ouest. Certains entendent un homme saluer.","503,s8,""""""""""""""Curious Showers"""""""", Chambers's journal of popular literature, science and arts, Grande Bretagne, 10"""""",""1893-08, pp. 526-527"",,""What Was It?"",s9,"""",Daily News de Galveston (Texas),1892-09-02",1892-08
https://rr0.org/time/1/8/9/2/index.html#1892-09,Gainesville (Floride),,,,,,,,,,,,,,,,"",place,"",,1892-09,"en le samedi 20 A , on observe une grande quantité de matériau comme de grandes feuilles blanches, de quelques 50 yards ou plus de longueur.","The UFO Evidence (NICAP,s10,""""""Proceedings, Entomological Society of Washington D.C., Vol.II/ Hall, Richard H."""""",,1964",1892-09
https://rr0.org/time/1/8/9/2/index.html,,1892,"Mon ami, Bob McCaw, était allongé sur l'herbe face à la maison de ma ferme près de vieux bureau de poste par un nuit sombre et j'étais avec lui. Nous vîmes une lumière venir de la maison de mon oncle à 1 mile d'où nous étions. Cette lumière brillante arriva à moins de 100 yards d'où nous nous trouvions et s'arrêta. Nous pensâmes que c'était Sim McLean venant nous voir, et partirent donc à sa rencontre. La lumière commença à voyager vers l'est, vers la maison de mon oncle. Bob et moi arrivèrent à la barrière entre la résidence de mon oncle et ma ferme et pensèrent là que nous avions suivi la lumière assez loin, et commencèrent donc à nous diriger vers le sud vers la maison du père de Bob. La lumière démarra au-dessus de nous et nous la suivîmes à nouveau, d'abord à l'ouest puis à l'est, et elle resta au-dessus de nous tout le temps jusqu'à ce que nous arrivions à la maison de W. McCaw. Nous avions suivi cette lumière sur des miles et partions dans la maison de M. McCaw, ravis de nous éloigner de cette chose étrange. En peu de temps M. McCaw sortit hors de la maison et je le suivais et lui parlais de la lumière. Nous regardâmes au nord de la maison et la lumière était perchée sur l'écurie de notation à 100 yards de nous. Nous retournâmes dans la maison quelque peu dérangés par tout cela. - ""Quelques minutes plus tard Lizzie McCaw, la soeur de Bob, arriva dans la cuisine et nous dit que quelqu'un devait aller chercher le Dr. Bird à Whitewood, parce que Sarah, une petite soeur, âgée de 10 ans, était très malade. Elle était malade depuis près de 8 semaines. Bob McCaw sella son cheval noir au buckboard de M. McCaw et conduisit 9 miles jusqu'à Whitewood, où il trouva le Dr. Bird. - ""Lorsqu'ils rejoignirent l'étable sur la ferme McCaw la lumière était toujours au sommet du bâtiment. Sarah mourut cette nuit-là"" - Je n'ai jamais entendu que cette lumière étrange ait été vue depuis dans le district. Il y a reste aujourd'hui quelques-uns d'entre nous old-timers de cette bande de pionniers. Ceux restant qui connaissent cette apparence étrange de la lumière sont Sim Farrel, de Kipling ; Charlie Serey; de Whitewood ; Sim McLean et le Dr. Bird, de Winnipeg et Sam McCaw, de Pipestone, qui se souvint de la lumière de ""Bob et Dan"". C'est une histoire vraie, nous étions jeunes à cette époque, en 1892, mais nous sommes vieux maintenant. Nous n'avons pas, cependant, oublié l'incident de la lumière apparaissait et la mort de la petite Sarah cette nuit humide et sombre.","Leader Post Regina,s11,"""",""p. 14, Saskatchewan"",1938-12-01,Hounslow Press,s12,""""""Jo-Anne Christensen, Ghost stories of Saskatchewan Toronto, Ont."""""",""c 1995. 143 p. ; 23 cm. at page 134. Includes bibliographical references (p. 141-143) ISBN for this book is 0888821778. The main library of the University of Saskatchewan has a copy, the call no. is BF 1472.C3C47 1995"",",1892