type,events,url,place,time,description,sources,id,place.name,place.org,place.place.id,place.place.events,place.place.locations,place.place.elevation,place.place.dirName,place.org.type,place.org.dirName,place.org.events,place.org.id,place.org.places,place.org.kind,place.org.parent.type,place.org.parent.dirName,place.org.parent.events,place.org.parent.id,place.org.parent.places,place.org.parent.kind,place.org.parent.parent,place.org.parent,place.place,place.org.parent.parent.type,place.org.parent.parent.dirName,place.org.parent.parent.events,place.org.parent.parent.id,place.org.parent.parent.places,place.org.parent.parent.kind,place.org.parent.parent.parent.type,place.org.parent.parent.parent.dirName,place.org.parent.parent.parent.events,place.org.parent.parent.parent.id,place.org.parent.parent.parent.places,place.org.parent.parent.parent.kind,place.org.parent.parent.parent.parent,place.org.parent.parent.parent
case,"",https://rr0.org/time/1/9/5/5/07/index.html#1955-07-03T03:30,Stockton (Ohio),,,"","",,,1955-07-03T03:30,"le Dessin de l'observation du 3 A , dans les phares de leur voiture, Mme Symmonds aperçoit sur le bas-côté de la route 4 Êtres qu'elle pense Être d'abord des animaux, d'une taille allant de 1,05 m et 1,20 m, vêtus d'une cape gris verdâtre sans boutons. L'un d'entre eux, se tient penché, un bâton (piqué au sol ?) entre ses mains. Leurs bras sont trop longs pour leur taille, avec de longs doigts griffus. Les épaules sont carrées, larges et robustes. Ils ont une grosse tête pour leur corps, des yeux énormes sans paupières réfléchissant une lumière rougeâtre, un nez long pointu et crochu, une petite bouche sans lèvres. Lorsque la voiture approche l'un d'eux s'écarte, se tourne vers elle, les bras levés. Il porte un genre de chapeau mou à bords rabattus. Aucun ovni n'est observé.",""""",CUFOS,s1,"""",,,"""","""",Davis & Bloecher 1978,s2,"""",pp. 149-160,,"""","""",Bowen 1969,s3,"""",,181,"""","""",Inforespace n° 50,s4,"""",mars 1980,23-24,""""",1955-07-03T03:30
case,"",https://rr0.org/time/1/9/5/5/07/index.html,,1955-07,"Les travaux du ""Ranch"" a Groom Lake sont terminés et ont coûté 800 000 $. Il consiste en 3 hangars, une tour de contrôle, le hall du mess, une piste, et de nombreux mobile-homes.",""""",Skunk Works,s5,""""""Rich, Ben"""""",,1994,""""",1955-07
case,"",https://rr0.org/time/1/9/5/5/07/index.html,Raritan (New Jersey),,,"","",,,1955-07,A pluie de clous.,"",1955-07
case,"",https://rr0.org/time/1/9/5/5/07/index.html#1955-07-22T05:30,Cincinatti (Ohio),,,"","",,,1955-07-22T05:30,"le Ed Mootz travaille dans son jardin lorsque quelques gouttes d'une pluie rouge et chaude tombent sur ses bras et ses mains. En quelques instants, il se trouve au milieu d'une pluie rouge. Au-dessus de lui, dépassant d'autres, un nuage particulier : Ce n'était pas un gros nuage, mais il avait certainement des couleurs étranges. Il était vert sombre, rouge et rose, évalué à 1000 pieds d'altitude. Ce qui est particulièrement étrange est que la pluie paraît concentrée sur son jardin, sur son pêcher en particulier. La pluie est d'un rouge, huileux, collant, comme du sang : Le rouge qu'il avait [le nuage] correspondait à la couleur de la substance qui me toucha ainsi que l'arbre. Je pouvais voir que ce qui pleuvait sur moi venait de ce nuage. Toute vie végétale ayant été touchée meurt peu après (son pêcher le jour suivant). Une équipe de l'USAF arrive rapidement pour prendre des échantillons. Les résultats ne sont pas connus.",""""",Orbit (CRIFO),s6,""""""Stringfield, L. H."""""",1955-09,04,"""","""",Cincinatti Post,s7,"""",""3 février 1975 < Le Grand livre du mystérieux, sélection du Reader's Digest"",,""""",1955-07-22T05:30
case,"",https://rr0.org/time/1/9/5/5/07/index.html#1955-07-23,Burbank,,,"","",,,1955-07-23,le ou le dimanche 24 Couverture du Daily Express le 30 Le 1er prototype de U-2 est amené à Groom Lake depuis Lockheed Skunk Works à via un avion de transport C-124.,""""",Skunk Works,s8,""""""Rich, Ben"""""",,1994,"""","""",Peebles,s9,"""",""Curtis, Dark Eagles, Presido Press"",1995,""""",1955-07-23
case,"",https://rr0.org/time/1/9/5/5/07/index.html#1955-07-29,Columbus (Nebraska),,,"","",,,1955-07-29,"le A , observation. Peter MacNab photographie un sillage suspect sur le Loch Ness.",""""",,s10,"""",,3673,""""",1955-07-29
case,"",https://rr0.org/time/1/9/5/5/07/index.html#1955-07-30,,1955-07-30,le Le Daily Express fait sa Une sur les soucoupes volantes.,"",1955-07-30