url,place,time,description,sources,id,place.name,place.org.name,place.org.surname,place.org.title,place.org.time,place.org.deprecated,place.org.note,place.org.place,place.org.description,place.org.sources,place.org.notes,place.org.tags,place.org.image,place.org.id,place.org.dirName,place.org.url,place.org.events,place.org.type,place.org.parent,place.org.places,place.org.kind,place.place,place.org,place.place.name,place.place.surname,place.place.title,place.place.time,place.place.deprecated,place.place.note,place.place.place,place.place.description,place.place.sources,place.place.notes,place.place.tags,place.place.image,place.place.id,place.place.dirName,place.place.url,place.place.events,place.place.type,place.place.parent,place.place.locations,place.place.elevation,place.org.parent.name,place.org.parent.surname,place.org.parent.title,place.org.parent.time,place.org.parent.deprecated,place.org.parent.note,place.org.parent.place,place.org.parent.description,place.org.parent.sources,place.org.parent.notes,place.org.parent.tags,place.org.parent.image,place.org.parent.id,place.org.parent.dirName,place.org.parent.url,place.org.parent.events,place.org.parent.type,place.org.parent.parent.name,place.org.parent.parent.surname,place.org.parent.parent.title,place.org.parent.parent.time,place.org.parent.parent.deprecated,place.org.parent.parent.note,place.org.parent.parent.place,place.org.parent.parent.description,place.org.parent.parent.sources,place.org.parent.parent.notes,place.org.parent.parent.tags,place.org.parent.parent.image,place.org.parent.parent.id,place.org.parent.parent.dirName,place.org.parent.parent.url,place.org.parent.parent.events,place.org.parent.parent.type,place.org.parent.parent.parent.name,place.org.parent.parent.parent.surname,place.org.parent.parent.parent.title,place.org.parent.parent.parent.time,place.org.parent.parent.parent.deprecated,place.org.parent.parent.parent.note,place.org.parent.parent.parent.place,place.org.parent.parent.parent.description,place.org.parent.parent.parent.sources,place.org.parent.parent.parent.notes,place.org.parent.parent.parent.tags,place.org.parent.parent.parent.image,place.org.parent.parent.parent.id,place.org.parent.parent.parent.dirName,place.org.parent.parent.parent.url,place.org.parent.parent.parent.events,place.org.parent.parent.parent.type,place.org.parent.parent.parent.parent,place.org.parent.parent.parent.places,place.org.parent.parent.parent.kind,place.org.parent.parent.places,place.org.parent.parent.kind,place.org.parent.places,place.org.parent.kind,place.org.parent.parent.parent,place.org.parent.parent
https://rr0.org/time/1/9/0/8/index.html#1908-01,Brownsville (Texas),,,,,,,,,,,,,,,,,"",place,,"",,1908-01,"en Entre le dimanche 12 08 h à le dimanche 12 09 h A , on voit passer un vaisseau aérien auquel est attaché un habitacle, survolant le Rio Grande vers le Mexique. le mardi 28 Dans le Norfolk (Angleterre), des employés de la Norwich Transportation Company en garde de nuit voient se déplacer à grande vitesse un objet globulaire sombre avec une sorte de structure sur son côté.","""Aerial Craft"",s1,"""",Daily Herald de Brownsville (Texas),1908-01-13,Mysterious Britain,s2,"""",,",1908-01
https://rr0.org/time/1/9/0/8/index.html#1908-02,Lorain,,,,,,,,,,,,,,,,,"",place,,"",,1908-02,"en le jeudi 20 19 h Dans le sud de , observation d'un ballon ou vaisseau aérien avec 4 feux à l'arrière et 1 projecteur à l'avant, ainsi qu'un occupant.","Lorain News < ""'Seein' Things' At Lorain"",s3,"""",Evening Telegram de Elyria (Ohio),1908-02-24",1908-02
https://rr0.org/time/1/9/0/8/index.html#1908-03,,1908-03,en.,"""Ship Has Narrow Escape From Meteor Falling At Sea / Master and Crew of Ocean on Reaching Philadelphia Tell of Unusual Experience Which Befell Them"",s4,"""",""Tribune de Chicago (Illinois), 18 mars 1908, p. 4"",",1908-03
https://rr0.org/time/1/9/0/8/index.html#1908-04,Notodden (Norvège),,,,,,,,,,,,,,,,,"",place,,"",,1908-04,"en le le lendemain A , un aéronef en forme d'oeuf d'un métal inconnu, contenant 2 occupants venant de Mars, atterrissent en détresse et ne peuvent repartir (décrit comme canular)..","FRI Presse,s5,"""",""avril 1908,"",,Syn Og Segn,s6,"""",1947,127,BA,s7,"""",,-30,UFO-Observatøren,s8,"""",""mai 1983, 8"",,""A Meeting With A Meteor"",s9,"""",""Post de Washington (DC), 26 avril 1908, p. 2"",",1908-04
https://rr0.org/time/1/9/0/8/index.html#1908-06,,1908-06,"en le mardi 30 le mardi 30 07:15 Explosion de Tunguska (Sibérie). le mardi 30 5 h après cette explosion du bout du monde, la Grande-Bretagne est éblouie par un coucher de Soleil étincellant. Le Times relatera l'événement : la nuit est si claire que les londoniens peuvent lire leur journal dans la rue, à minuit, sans avoir recours à l'éclairage de la ville ! Un journaliste décrit ainsi cette nuit du 30 juin : Le ciel était clair comme en plein jour et sillonné de nuages de lumière rose ; de ma vie, je n'ai assisté à quelque chose d'aussi stupéfiant.","",1908-06
https://rr0.org/time/1/9/0/8/index.html#1908-07,,1908-07,"en le samedi 11 Le célèbre explorateur russe V. K. Arsenyev marche le long du fleuve Gobilli, quand il fait cette rencontre : Je vis une trace sur le sentier qui ressemblait à une empreinte de pas humain. Mon chien Alpha s'immobilisa, puis grogna, et soudain quelque chose remu tout près, se traînant d'un pas lourd au milieu des buissons. Pourtant, cette chose ne s'enfuit pas, elle s'arrêta juste à côté de nous, invisible, parfaitement statique. Nous restâmes ainsi pendant plusieurs minutes... Puis je me penchais, ramaissais une pierre et la lançais vers les buissons. Il se passa alors quelque chose d'inattendu : j'entendis un battement d'ailes. Quelque chose de grand et de noir émergea du brouillard et s'envola au-dessus de la rivière. Un instant plus tard, cette chose avait disparu dans la brume épaisse. Mon chien, complètement terrorisé, se blottit à mes pieds. Après le souper, je parlai de cet incident aux hommes et de la tribu Udehe. Ils se lancèrent dans un récit très animé à propos d'un homme qui pouvait voler dans les airs. Des chasseurs avaient souvent aperçu ses traces qui s'évanouissaient soudain, de telle manière que la seule explication possible était que ""l'homme"" s'était posé sur le sol avant de s'envoler de nouveau.","""Forerunner of the Flying 'Lady' of Vietnam ?"" FSR vol. 19,s10,""""""Petrenko, Yuri B."""""",""n ° 2, mars-avril 1973, p. 29-30"",",1908-07
https://rr0.org/time/1/9/0/8/index.html#1908-09,Huntington,,,,,,,,,,,,,,,,,"",place,,"",,1908-09,"en le mardi 29 le soir A , des gens sont convaincus d'avoir vu un vaisseau aérien voguer dans les cieux au nord de la ville.","""'Northern Indiana News and Gossip',s11,""""""""""""""Northern Indiana News and Gossip"""""""", Sentinel de Fort Wayne (Indiana), 1er octobre 1908, p. 3 < Flood, Chuck"""""",""Fort Wayne (IN) Sentinel, October 1, 1908"""", Magonia Exchange, 3 janvier 2007"",",1908-09
https://rr0.org/time/1/9/0/8/index.html#1908-10,Delphos (Ohio),,,,,,,,,,,,,,,,,"",place,,"",,1908-10,"en le samedi 17 16 h A l'Est de , on voit au loin un objet aérien difficile à identifier.","""Heard About Town"",s12,"""",Daily Bulletin de Van Wert (Ohio),-20",1908-10
https://rr0.org/time/1/9/0/8/index.html#1908-12,,1908-12,en,"",1908-12
https://rr0.org/time/1/9/0/8/index.html,Bridgewater (Massachusetts),,,,,,,,,,,,,,,,,"",place,,"",,1908,"Vue en coupe d'une machine de guerre aérienne dans une fiction d'anticipation A , John E. Flynn, Philip S. Prophett et d'autres personnes voient un objet sphérique noir portant des lumières stationner et survoler la ville.","La Guerre Infernale,s13,""""""Robida, Albert"""""",,1908,,s14,"""",,",1908
https://rr0.org/time/1/9/0/8/index.html,,1908,"Fondation du Bureau d'Investigation, qui deviendra plus tard le FBI.","",1908
https://rr0.org/time/1/9/0/8/index.html,Delaware (USA),,,,,,,,,,,,,de,org/us/de,,"",org,,,,,,,,,,,,,us,org/us,,"",org,,"",country,",,,,,,,,,,,,,,,"""",place,,""38.45,-75.03333333333333"",,,,,,,,,,,,,,,,,"""",place,,""39.833333333333336,-75.78333333333333"",",region,,,,,,,,,,,,,,,,"",place,,"38.45,-75.03333333333333",,1908,"Sur la Côte du , le bateau anglais Le Mohican se dirigeant vers Philadelphie sous les ordres du capitaine Urghart est entouré d'un épais nuage lumineux qui aimante tout à bord. On remarque que l'aiguille de la boussole est devenue folle. Lorsque les marins tentent de déplacer les chaines sur le pont métallique, ils s'aperçoivent qu'elles y sont collées. Le nuage s'élève soudain et est observé quelque temps au-dessus de la mer.","",1908$org_us_de
https://rr0.org/time/1/9/0/8/index.html,Colombie Britannique (Canada),,,,,,,,,,,,,,,,,"",place,,"",,1908,"En , observation de cheveux d'ange.","",1908