url,place,dateTime,description,sources,id,place.name,place.org.dirName,place.org.code,place.org.places,place.org.kind,place.org.parent,place.place,place.org,place.place.locations,place.place.elevation,place.place.dirName,place.place.data,place.org.parent.dirName,place.org.parent.code,place.org.parent.places,place.org.parent.kind,place.org.parent.parent.dirName,place.org.parent.parent.code,place.org.parent.parent.places,place.org.parent.parent.kind,place.org.parent.parent.parent.dirName,place.org.parent.parent.parent.code,place.org.parent.parent.parent.places,place.org.parent.parent.parent.kind,place.org.parent.parent.parent.parent,place.org.parent.parent.parent,place.org.parent.parent
https://rr0.org/time/1/9/8/3/06/index.html,,1983-06,"Orchidée, de la société grenobloise Symag : un micro à l'architecture novatrice.","",1983-06
https://rr0.org/time/1/9/8/3/06/index.html#1983-06-02,,1983-06-02,Lancement de Venera 15.,"",1983-06-02
https://rr0.org/time/1/9/8/3/06/index.html#1983-06-07,,1983-06-07,Lancement de Venera 16.,"",1983-06-07
https://rr0.org/time/1/9/8/3/06/index.html#1983-06-12,,1983-06-12,"Pioneer 10, le plus lointain engin jamais construit par l'homme, atteint l'orbite de Pluton.","",1983-06-12
https://rr0.org/time/1/9/8/3/06/index.html,,1983-06,1er vol du HALSOL à Groom Lake. HALSOL est un UAV de haute altitude fonctionnant à l'énergie solaire. Le programme d'essais dure 2 mois.,"Dark Eagles,s1,""""""Peebles, Curtis"""""",Presido Press,1995",1983-06
https://rr0.org/time/1/9/8/3/06/index.html#1983-06-20,,1983-06-20,Remise du rapport l'Enigme OVNI.,"",1983-06-20
https://rr0.org/time/1/9/8/3/06/index.html#1983-06-18,,1983-06-18,"à vendredi 24 Sally Ride de la 1ʳᵉ américaine de l'espace, à bord de Challenger.","",1983-06-18
https://rr0.org/time/1/9/8/3/06/index.html#1983-06-30,,1983-06-30,"Kathie Davis, ressent la ""présence"" d'un humanoïde tenant son bras et insérant l'objet semblable à un stylo dans son oreille. David souffre en effet d'un inconfort et d'une défaillance auditive","p. 43,s2,"""",,,(p. 44) Régression hypnotique en novembre 1984 < Hopkins,s3,"""",B. (1987). Intruders. New York. Random House.,",1983-06-30