type,events,url,place,time,description,sources,id,place.name,place.org,place.place.id,place.place.events,place.place.locations,place.place.elevation,place.place.dirName,place.org.type,place.org.dirName,place.org.events,place.org.id,place.org.places,place.org.kind,place.org.parent,place.place,place.org.parent.type,place.org.parent.dirName,place.org.parent.events,place.org.parent.id,place.org.parent.places,place.org.parent.kind,place.org.parent.parent.type,place.org.parent.parent.dirName,place.org.parent.parent.events,place.org.parent.parent.id,place.org.parent.parent.places,place.org.parent.parent.kind,place.org.parent.parent.parent,place.org.parent.parent.parent.type,place.org.parent.parent.parent.dirName,place.org.parent.parent.parent.events,place.org.parent.parent.parent.id,place.org.parent.parent.parent.places,place.org.parent.parent.parent.kind,place.org.parent.parent.parent.parent,place.org.parent.parent
case,"",https://rr0.org/time/1/9/3/5/index.html#1935-01,Addis Abebba (Ethiopie),,,"","",,,1935-01,"en le mercredi 9 Couverture de Astounding Stories n° 4, vol. 5 de juin Couverture de Wonder Stories n° 68 de juillet Visible de , éclipse considérée comme un signe de guerre et de calamités..",""""",Street & Smith publications < Collection Les Treece-Sainclair < UFOPOP,s1,"""",,,"""","""",Continental publications < Collection Les Treece-Sainclair < UFOPOP,s2,"""",,,"""","""",Paris Match,s3,""Martini"",,23,"""","""",""Steersman on Pilot Boat Dazzled and the Boat Shaken as Fireball Hits Water"",s4,"""",""Popular Astronomy, janvier 1935, vol. 43, n°1, pp. 69-70"",,""""",1935-01
case,"",https://rr0.org/time/1/9/3/5/index.html#1935-04,,1935-04,en Couverture de Amazing Stories ce mois-là,"",1935-04
case,"",https://rr0.org/time/1/9/3/5/index.html#1935-08,Fontainebleau (Seine-et-Marne),,,"","",,,1935-08,"en le mardi 6 A , M. E. van Ameyden van Duyn observe en compagnie de Madame sans Gêne et d'autres témoins un météore.",""""",""De Vurrbol Langs Den Hemel"",s5,"""",""Het Vaderland (Pays Bas), édition du matin"",11,""""",1935-08
case,"",https://rr0.org/time/1/9/3/5/index.html#1935-10,Addis Abebba (Ethiopie),,,"","",,,1935-10,"en À , alors que les troupes italiennes viennent d'envahir le pays, l'africaniste Pierre Ichac se trouve dans la ville qui s'attend à être bombardée. Un jour, alors qu'il se promène, il voit à un carrefour une foule regardant en l'air et montrant quelque chose dans le ciel limpide : une sorte de ""disque"" brillant de couleur ""argentée"" et parfaitement immobile. Ichac a son appareil photographique, mais l'objet était vraiment trop petit pour réussir un bon cliché, et il préfère fixer l'image de la foule. Le ""disque"" reste plusieurs minutes sans le moindre mouvement. Les éthiopiens croient à un avion italien, mais découragés de ne pas voir les ombres tomber, détournent les yeux du phénomène. Alors que Ichac fait de même, l'objet disparaît. D'autres sources indiquent que le ""disque"" brilla au-dessus d'un Bordj saharien durant 3 jours. (On apprendra plus tard qu'il s'agissait de Vénus, particulièrement brillante à ce moment). le samedi 26 14 h Près de Hermosilla (Mexique), un avion en route vers Los Angeles observe un corps aériens aux couleurs rouges et vertes changeantes.",""""",La chronique des ovnis,s6,""""""Bougard, Michel"""""",,1977,"""","""",Le livre noir des soucoupes volantes,s7,""""""L'illustration n° 4841, p. 481, 14 décembre 1935 < Durrant, H."""""",1978,75,"""","""",Paris Match,s8,""""""Cartier, Raymond"""""",23 octobre 1954,18,"""","""",Bulletin de la Société Astronomique de France,s9,"""",,1936,"""","""",""Mexican Plane Sights Colorful Aerial Body"",s10,"""",Times de Los Angeles,27,""""",1935-10
case,"",https://rr0.org/time/1/9/3/5/index.html,Toten (Norvège),,,"","",,,1935,"A , manifestation de poltergeists.",""""",Modern mysteries of the world,s11,""Bord/Bord"",1989,346,""""",1935