description,events,eventType,id,place,sources,time,type,url,place.dirName,place.elevation,place.events,place.id,place.locations,place.name,place.type
"en le mercredi 9 janvier Couverture de Astounding Stories n° 4, vol. 5 de juin Couverture de Wonder Stories n° 68 de juillet Visible de , éclipse considérée comme un signe de guerre et de calamités..","",sighting,1935-01$AddisAbebbaEthiopie,,,"",,"",Addis Abebba (Ethiopie),place,""""","""",s1,"""",,Street & Smith publications < Collection Les Treece-Sainclair < UFOPOP,"""","""",s2,"""",,Continental publications < Collection Les Treece-Sainclair < UFOPOP,""Martini"","""",s3,"""",,Paris Match,"""","""",s4,"""",,""Steersman on Pilot Boat Dazzled and the Boat Shaken as Fireball Hits Water""",1935-01,event,https://rr0.org/time/1/9/3/5/index.html#1935-01
en Couverture de Amazing Stories ce mois-là,"",sighting,1935-04$,,"",1935-04,event,https://rr0.org/time/1/9/3/5/index.html#1935-04
"en le mardi 6 août A , M. E. van Ameyden van Duyn observe en compagnie de Madame sans Gêne et d'autres témoins un météore.","",sighting,1935-08$FontainebleauSeineetMarne,,,"",,"",Fontainebleau (Seine-et-Marne),place,""""","""",s5,"""",,""De Vurrbol Langs Den Hemel""",1935-08,event,https://rr0.org/time/1/9/3/5/index.html#1935-08
"en À , alors que les troupes italiennes viennent d'envahir le pays, l'africaniste Pierre Ichac se trouve dans la ville qui s'attend à être bombardée. Un jour, alors qu'il se promène, il voit à un carrefour une foule regardant en l'air et montrant quelque chose dans le ciel limpide : une sorte de ""disque"" brillant de couleur ""argentée"" et parfaitement immobile. Ichac a son appareil photographique, mais l'objet était vraiment trop petit pour réussir un bon cliché, et il préfère fixer l'image de la foule. Le ""disque"" reste plusieurs minutes sans le moindre mouvement. Les éthiopiens croient à un avion italien, mais découragés de ne pas voir les ombres tomber, détournent les yeux du phénomène. Alors que Ichac fait de même, l'objet disparaît. D'autres sources indiquent que le ""disque"" brilla au-dessus d'un Bordj saharien durant 3 jours. (On apprendra plus tard qu'il s'agissait de Vénus, particulièrement brillante à ce moment). le samedi 26 octobre à 14 h à en 15 Près de Hermosilla (Mexique), un avion en route vers Los Angeles observe un corps aériens aux couleurs rouges et vertes changeantes.","",sighting,1935-10$AddisAbebbaEthiopie,,,"",,"",Addis Abebba (Ethiopie),place,"""""""Bougard, Michel"""""","""",s6,"""",,La chronique des ovnis,""""""L'illustration n° 4841, p. 481, 14 décembre 1935 < Durrant, H."""""","""",s7,"""",,Le livre noir des soucoupes volantes,""""""Cartier, Raymond"""""","""",s8,"""",,Paris Match,"""","""",s9,"""",,Bulletin de la Société Astronomique de France,"""","""",s10,"""",,""Mexican Plane Sights Colorful Aerial Body""",1935-10,event,https://rr0.org/time/1/9/3/5/index.html#1935-10
"A , manifestation de poltergeists.","",sighting,1935$TotenNorvege,,,"",,"",Toten (Norvège),place,"""Bord/Bord"","""",s11,"""",,Modern mysteries of the world",1935,event,https://rr0.org/time/1/9/3/5/index.html