url,place,time,description,sources,id,place.name,place.org.dirName,place.org.code,place.org.places,place.org.kind,place.org.parent,place.place,place.org,place.place.locations,place.place.elevation,place.place.dirName,place.place.events,place.org.parent.dirName,place.org.parent.code,place.org.parent.places,place.org.parent.kind,place.org.parent.parent.dirName,place.org.parent.parent.code,place.org.parent.parent.places,place.org.parent.parent.kind,place.org.parent.parent.parent.dirName,place.org.parent.parent.parent.code,place.org.parent.parent.parent.places,place.org.parent.parent.parent.kind,place.org.parent.parent.parent.parent,place.org.parent.parent.parent,place.org.parent.parent
https://rr0.org/time/1/9/4/7/07/02/index.html,,1947-07-02,"Tôt le matin, Fred Lee Crisman est au téléphone avec Kenneth E. Arnold. Le B-25 où se trouvaient Brown et Davidson s'est écrasé près de Kelso. Tous deux sont morts. L'un des moteurs de l'avion a mystérieusement pris feu 20 mn après l'envol. Les fragments ne sont pas retrouvés. Arnold organise une expédition à Maury Island en compagnie de Crisman et Dahl, mais il s'avère que le moteur de leur bateau rend l'âme. Crisman promet de rappeler Arnold dès que le problème serait résolu. Il ne le fera jamais. Et ne rendra pas non plus les photographies. Il est devenu introuvable — d'après Dahl, il a quitté la ville pour affaires; d'après d'autres sources, il a été vu pour la dernière fois montant à bord d'un avion militaire en partance pour l'Alaska. Puis le fils de Dahl disparaît à son tour. De plus, il semble que quelqu'un ait truffé de micros la chambre d'hôtel d'Arnold, transmettant aux journaux locaux les détails de ses conversations, même celles qu'il eut seul avec Brown et Davidson. Il contacte un autre officier de renseignements, un certain major Sanders, qui lui fait obstruction. Arnold, désormais profondément ébranlé, quitte la ville. Explication officielle : canular monté par les gardes-côtes pour se faire de la publicité. Cependant, ils ne sont pas poursuivis.","",1947-07-02
https://rr0.org/time/1/9/4/7/07/02/index.html,,1947-07-02,"Un violent orage dans la région de Corona, au nord-ouest de Roswell.",",s1,""""""Bourdais, Gildas"""""",,2000",1947-07-02
https://rr0.org/time/1/9/4/7/07/02/index.html#1947-07-02T21:50,,1947-07-02T21:50,Dan Wilmot et son épouse aperçoivent un engin de forme ovale filant dans le ciel en direction du Nord-Ouest.,",s2,""""""Lagrange, Pierre"""""",,1996,Bourdais 2000-05,s3,"""",,",1947-07-02T21:50
https://rr0.org/time/1/9/4/7/07/02/index.html,,1947-07-02,"William Woody (témoin) et son père voient un météore brillant, blanc avec une queue rouge, traverser le ciel.","Bourdais 2000-05,s4,"""",,",1947-07-02
https://rr0.org/time/1/9/4/7/07/02/index.html,,1947-07-02,"Dans la nuit, William Ware Brazel, un fermier habitant près de Corona, entend dans la nuit une grande explosion pendant l'orage.","Bourdais 2000-05,s5,"""",,",1947-07-02