url,place,time,description,sources,id,place.name,place.org.name,place.org.surname,place.org.title,place.org.time,place.org.deprecated,place.org.note,place.org.place,place.org.description,place.org.sources,place.org.notes,place.org.tags,place.org.image,place.org.id,place.org.dirName,place.org.url,place.org.events,place.org.type,place.org.parent,place.org.places,place.org.kind,place.place,place.org,place.place.name,place.place.surname,place.place.title,place.place.time,place.place.deprecated,place.place.note,place.place.place,place.place.description,place.place.sources,place.place.notes,place.place.tags,place.place.image,place.place.id,place.place.dirName,place.place.url,place.place.events,place.place.type,place.place.parent,place.place.locations,place.place.elevation,place.org.parent.name,place.org.parent.surname,place.org.parent.title,place.org.parent.time,place.org.parent.deprecated,place.org.parent.note,place.org.parent.place,place.org.parent.description,place.org.parent.sources,place.org.parent.notes,place.org.parent.tags,place.org.parent.image,place.org.parent.id,place.org.parent.dirName,place.org.parent.url,place.org.parent.events,place.org.parent.type,place.org.parent.parent.name,place.org.parent.parent.surname,place.org.parent.parent.title,place.org.parent.parent.time,place.org.parent.parent.deprecated,place.org.parent.parent.note,place.org.parent.parent.place,place.org.parent.parent.description,place.org.parent.parent.sources,place.org.parent.parent.notes,place.org.parent.parent.tags,place.org.parent.parent.image,place.org.parent.parent.id,place.org.parent.parent.dirName,place.org.parent.parent.url,place.org.parent.parent.events,place.org.parent.parent.type,place.org.parent.parent.parent.name,place.org.parent.parent.parent.surname,place.org.parent.parent.parent.title,place.org.parent.parent.parent.time,place.org.parent.parent.parent.deprecated,place.org.parent.parent.parent.note,place.org.parent.parent.parent.place,place.org.parent.parent.parent.description,place.org.parent.parent.parent.sources,place.org.parent.parent.parent.notes,place.org.parent.parent.parent.tags,place.org.parent.parent.parent.image,place.org.parent.parent.parent.id,place.org.parent.parent.parent.dirName,place.org.parent.parent.parent.url,place.org.parent.parent.parent.events,place.org.parent.parent.parent.type,place.org.parent.parent.parent.parent,place.org.parent.parent.parent.places,place.org.parent.parent.parent.kind,place.org.parent.parent.places,place.org.parent.parent.kind,place.org.parent.places,place.org.parent.kind,place.org.parent.parent.parent,place.org.parent.parent
https://rr0.org/time/1/9/5/3/11/index.html#1953-11-01,Gjersjoen Bridge (Norvège),,,,,,,,,,,,,,,,,"",place,,"",,1953-11-01,"le Le Figaro n° 2862 du 21, titrant : Voici, établi sur les rapports officiels le dossier des ""soucoupes volantes"" A , M. Trygve, Mme Buflot et 1 voisin voient 1 objet s'élever derrière une colline, osciller au-dessus d'un lac, suivre leur automobile et s'arrêter devant eux à ras du sol. Ils font halte et ressentent des picotements jusqu'à ce que l'engin décolle verticalement. Une montre cesse de fonctionner et de nombreuses personnes témoigneront du fait que la peinture de l'automobile était passée du beige foncé au vert brillant.","FSR 56,s1,"""",5,",1953-11-01
https://rr0.org/time/1/9/5/3/11/index.html#1953-11-03,Londres (Angleterre),,,,,,,,,,,,,,,,,"",place,,"",,1953-11-03,"le , des milliers de personnes observent un objet circulaire et de couleur blanche émettant ou réfléchissant une forte lumière. Certains le décrivent se déplaçant à une vitesse énorme tandis que d'autres le voient pratiquement statique. L'objet est aussi détecté au radar à 18593 m. Une 1ʳᵉ explication évoque un ballon, mais une vérification montre qu'aucun ballon de cet n'a été lâché d'Angleterre. Finalement, il est vérifié qu'un ballon du projet Moby Dick lâché 6 jours plus tôt par l'USAF depuis la base de Holloman (USA) avait quitté sa course et au lieu de retomber au sol avait continué à voler vers l'Europe.","StratoCat,s2,"""",,",1953-11-03
https://rr0.org/time/1/9/5/3/11/index.html#1953-11-15,Oklahoma,,,,,,,,,,,,,,,,,"",place,,"",,1953-11-15,"Le point lumineux photographié par Stuart le 15 le En , l'astronome amateur Léon Stuart teste son nouvel appareil photo. Il prend des clichés de la Lune, quand soudain, il aperçoit sur elle un point très lumineux. Sur la pellicule, le point est bel et bien là, au sud-est du grand cratère Pallas. Pour Stuart, aucun doute : il s'agit d'un impact de météorite (Le Dr. Léon Stuart est probablement le 1er et le seul être humain dans l'histoire à avoir photographié un impact sur la Lune. En effet, un évènement de cette importance a la chance d'arriver à peut prêt une fois tous les 100 000 ans).","",1953-11-15
https://rr0.org/time/1/9/5/3/11/index.html#1953-11-20,Villacoublay,,,,,,,,,,,,,,,,,"",place,,"",,1953-11-20,"le Compte-rendu d'observations personnelles du lieutenant Jean Demery, de la base aérienne 107, à.","",1953-11-20
https://rr0.org/time/1/9/5/3/11/index.html#1953-11-23,,1953-11-23,le Disparition de Kinross.,"",1953-11-23