description,events,id,place,sources,time,type,url,place.name,place.org,place.place.dirName,place.place.elevation,place.place.events,place.place.id,place.place.locations,place.org.dirName,place.org.events,place.org.id,place.org.kind,place.org.parent,place.org.places,place.org.type,place.place,place.org.parent.dirName,place.org.parent.events,place.org.parent.id,place.org.parent.kind,place.org.parent.parent.dirName,place.org.parent.parent.events,place.org.parent.parent.id,place.org.parent.parent.kind,place.org.parent.parent.parent,place.org.parent.parent.places,place.org.parent.parent.type,place.org.parent.places,place.org.parent.type,place.org.parent.parent,place.org.parent.parent.parent.dirName,place.org.parent.parent.parent.events,place.org.parent.parent.parent.id,place.org.parent.parent.parent.kind,place.org.parent.parent.parent.parent,place.org.parent.parent.parent.places,place.org.parent.parent.parent.type
"le , 1 témoin dans sa voiture observe 1 objet de forme cylindrique de couleur aluminium. Pendant 1 minute il observe 1 forte lumière orangée venant d'un cylindre d'environ 1 m de diamètre. Aucun bruit n'est remarqué.","",1995-10-01T02:45,"Etables-sur-Mer, Côtes d'Armor",,,,"",,"","""SEPRA"","""",s1,"""",,,",1995-10-01T02:45,sighting,https://rr0.org/time/1/9/9/5/10/index.html#1995-10-01T02:45
le Découverte de la 1ʳᵉ planète extra-solaire.,"",1995-10-06,,"",1995-10-06,sighting,https://rr0.org/time/1/9/9/5/10/index.html#1995-10-06
"le Atterrissage d'un ovni sur le en plein Santiago (Chili). Diverses observations dans les communes de Santiago (Chili), notamment à Rancagua (Chili), à 100 km au Sud. L'un des témoins voit un objet qui s'élève en lançant une lumière si forte qu'il ne peut continuer à la regarder.","",1995-10-07,Cerro San Cristobal (Chili),,,,"",,"",""""","""",s2,"""",,2007,,"""","""",s3,"""",,2007,",1995-10-07,sighting,https://rr0.org/time/1/9/9/5/10/index.html#1995-10-07
"le En Italie, un prêtre du , monseigneur Corrado Balducci, déclare à la télévision nationale que les extraterrestres existent.","",1995-10-08,Vatican,,,,"",,"","",1995-10-08,sighting,https://rr0.org/time/1/9/9/5/10/index.html#1995-10-08
"Au cours d'une émission de télévision sur TF1, le présentateur Jacques Pradel propose une interview de Valery Pavlovitch Bourdakov, scientifique russe membre de l'Agence Spatiale et de l'Académie des Sciences de son pays. Lorsque Bourdakov était l'un des adjoints de l'ingénieur Sergueï Korolev, le patron des programmes de fusées de l'ex-URSS, ce dernier lui fit d'étonnantes confidences : un jour de 1948, Joseph Staline avait demandé à Korolev de venir au Kremlin pour étudier les rapports d'observations d'ovnis collectés par les espions. Après 3 jours passés à examiner toute cette documentation, Korolev dit à Staline que le problème était sérieux mais qu'il ne menaçait pas la sécurité de l'URSS. Toutefois, il recommande de suivre de près l'évolution de la situation. Parmi les rapports, selon Bourdakov, certains étaient relatifs à l'incident de Roswell sur la récupération d'un appareil inconnu et d'autres faisaient état de corps d'extraterrestres décédés qui avaient été découverts en cette occasion.","",1995-10,,""""","""",s4,"""",,,",1995-10,sighting,https://rr0.org/time/1/9/9/5/10/index.html
"le , 2 témoins situés à 2 endroits différents observent durant quelques s 1 sphère lumineuse avec une trainée et semblant chuter. Aucun bruit n'est perçu (de ce qui est probablement une rentrée atmosphérique).","",1995-10-15T18:30,Coulange-sur-Yonne (Yonne),,,,"",,"","""SEPRA"","""",s5,"""",,,",1995-10-15T18:30,sighting,https://rr0.org/time/1/9/9/5/10/index.html#1995-10-15T18:30
A. Zolotov (scientifique et ufologue) est assassiné à Tver.,"",1995-10,,"",1995-10,sighting,https://rr0.org/time/1/9/9/5/10/index.html