url,place,dateTime,description,sources,id,place.name,place.org.dirName,place.org.code,place.org.places,place.org.kind,place.org.parent,place.place,place.org,place.place.locations,place.place.elevation,place.place.dirName,place.place.data,place.org.parent.dirName,place.org.parent.code,place.org.parent.places,place.org.parent.kind,place.org.parent.parent.dirName,place.org.parent.parent.code,place.org.parent.parent.places,place.org.parent.parent.kind,place.org.parent.parent.parent.dirName,place.org.parent.parent.parent.code,place.org.parent.parent.parent.places,place.org.parent.parent.parent.kind,place.org.parent.parent.parent.parent,place.org.parent.parent.parent,place.org.parent.parent
https://rr0.org/time/1/9/8/2/02/index.html#1982-02-01T23:20,"Saint Herblain, Loire Atlantique",,"",,,,1982-02-01T23:20,"Couverture du n° de Fate ce mois-ci à le lendemain, plusieurs astronomes amateurs observent avec leurs jumelles une quinzaine d'objets qui se déplacent dans la direction sud-sud-est sans faire de bruit. De forme légèrement allongée et colorés, ils sont très lumineux. Aucun changement de forme ou de couleur n'est remarqué durant l'observation.",",s1,""GEPAN"",,",1982-02-01T23:20
https://rr0.org/time/1/9/8/2/02/index.html#1982-02-21,"Guenange, Moselle",,"",,,,1982-02-21,", 2 personnes observent dans le ciel point rouge brillant se déplaçant vers le sud (La même observation avait été faite en janvier 1981 et 1982 par un autre témoin. La description fait penser à une observation astronomique, hypothèse qui ne peut être vérifiée faute d'éléments).",",s5,""GEPAN"",,",1982-02-21
https://rr0.org/time/1/9/8/2/02/index.html#1982-02-26,"Yonne, Bourgogne",,"",,,,1982-02-26,"Dans l', plusieurs témoins voient dans le ciel et durant quelques s 1 forme circulaire orangée se déplaçant sud-ouest/nord-est suivie dans son sillage par une trainée lumineuse (Les descriptions et dessins faits par les personnes indiquent qu'ils ont probablement été témoins d'une rentrée atmosphérique).",",s6,""GEPAN"",,",1982-02-26
https://rr0.org/time/1/9/8/2/02/index.html#1982-02-27,"Montereau, Seine-et-Marne",,"",,,,1982-02-27,"soirée, une personne observe depuis chez elle, à 100 m de distance environ, des flammes orangées s'échappant d'une grosse boule. 20 mn plus tard, 3 boules apparaîssent à 1 m du sol, émettant des lumières de couleurs différentes. Aucun bruit n'est perçu.",",s7,""GEPAN"",,",1982-02-27
https://rr0.org/time/1/9/8/2/02/index.html,,1982-02,"A Groom Lake, 1er vol de Tacit Blue (démonstrateur de technologie furtive).","Communiqué de Presse de l'Air Force du 1er avril 1996,s8,"""",,",1982-02