url,place,dateTime,description,sources,id,place.name,place.org.dirName,place.org.code,place.org.places,place.org.kind,place.org.parent,place.place,place.org,place.place.locations,place.place.elevation,place.place.dirName,place.place.data,place.org.parent.dirName,place.org.parent.code,place.org.parent.places,place.org.parent.kind,place.org.parent.parent.dirName,place.org.parent.parent.code,place.org.parent.parent.places,place.org.parent.parent.kind,place.org.parent.parent.parent.dirName,place.org.parent.parent.parent.code,place.org.parent.parent.parent.places,place.org.parent.parent.parent.kind,place.org.parent.parent.parent.parent,place.org.parent.parent.parent,place.org.parent.parent
https://rr0.org/time/1/9/5/3/08/index.html#1953-08-03%2000:04,Amarillo (Texas),,"",,,,1953-08-03T00:04,"C. S. Brown, chef de la tour de contrôle de l'aéroport, observe un objet rond et réfléchissant ou translucide volant de manière rectiligne, s'arrêter pendant , repartir, s'arrêter à nouveau, être rejoint par un objet semblable puis partir dans différentes directions au bout de.","Cas Blue Book n° 2663 non résolu,s1,"""",,",1953-08-03T00:04
https://rr0.org/time/1/9/5/3/08/index.html#1953-08-05/06,Rapid City (Dakota du Sud),,"",,,,1953-08-05,Au-dessus des jets observent des ovnis visuellement et au radar.,"",1953-08-05
https://rr0.org/time/1/9/5/3/08/index.html#1953-08-16%2020:30,Tours (France),,"",,,,1953-08-16T20:30,"Claude Pasquier voit 2 disques volant très bas et très lentement, suivant une ligne droite avec un bruit ""dur"".","Anatomy 65,s2,""""""Vallée, Jacques"""""",,141",1953-08-16T20:30
https://rr0.org/time/1/9/5/3/08/index.html#1953-08-18,Ciudad Valleys (Mexico),,"",,,,1953-08-18,"(date approximative) le soir, Salvador Villanueva (40 ans, chauffeur de taxi), observe 2 êtres hauts de 1,20 m, portant une combinaison avec une large ceinture brillante, perforée, un col métallique et, au dos, 1 petite boîte luisante de couleur noire. Ils ont 1 casque sous le bras. L'observateur pense qu'il s'agit de pilotes de race indienne. L'un d'eux lui parle en espagnol, liant les mots entre eux avec un accent bizarre. Ils discutent de sujets banals jusqu'à l'aube, quand ils regagnent leur engin, de 13 m de diamètre, par une trappe située sous le disque inférieur. L'observateur s'enfuit lorsqu'il est invité à les suivre. L'objet s'éleva en oscillant sur lui-même puis s'élance verticalement à toute vitesse.","Hurnanoids 32,s3,""""""Bowen, Charles"""""",,",1953-08-18
https://rr0.org/time/1/9/5/3/08/index.html#1953-08-20,près de Cronat (Saône-et-Loire),,"",,,,1953-08-20,"1er tir de la Redstone. par un temps très clair, , une automobiliste circulant sur la route de Décize à Mâcon, aperçoit devant elle 1 phénomène ovale, rouge-feu, paraissant 3 fois plus gros que la pleine Lune, qui descend vers la Terre, traverse la route à 300 m devant l'auto, puis remonte à la verticale et disparaît.","""Dans notre ciel et sur notre sol"" in ""Soucoupes Volantes"",s4,""""""Marey, George"""""",""Forces Aériennes Françaises (revue Mensuelle de l'Armée de l'Air) n° 245, mars 1968"",",1953-08-20
https://rr0.org/time/1/9/5/3/08/index.html#1953-08-23,Port Moresby (Papouasie Nouvelle Guinée),,"",,,,1953-08-23,"Vers le milieu de la journée A , Tom Drury, alors secrétaire d'état de l'ancien Département de l'Aviation Civile du gouvernement australien, observe et filme un phénomène comme un ""trait"" argenté sorti d'un nuage et grimpant très vite vers le nord-ouest","Drury's official report,s5,"""",e.g. copy on National Archives of Australia file series MP1279/1 control symbol 99/1/478,,Australian (Le rapport d'origine de Drury ne contenait initialement pas de mention de virage à angle droit) Flying Saucer Magazine,s6,""""""Jarrold, Edgar R. (director)"""""",""Australian Flying Saucer Bureau (Sydney, New South Wales), 1955-02, p. 2"",,Australian Flying Saucer Review vol. 1 n° 1,s7,"""",""1960-01, p. 5"",,""Drury film - 1953 - right angle turns?"",s8,"""",UFOs - scientific research,2014-10-05",1953-08-23
https://rr0.org/time/1/9/5/3/08/index.html#1953-08-27%2021:45,Greensville (Mississippi),,"",,,,1953-08-27T21:45,", un pilote de l'USAF, un sergent-chef et d'autres personnes, observent depuis le sol une lumière effectuer des mouvements sinueux durant.","Cas Blue Book n° 2692 non résolu,s9,"""",,",1953-08-27T21:45