url,place,time,description,sources,id,place.name,place.org.name,place.org.surname,place.org.title,place.org.time,place.org.deprecated,place.org.note,place.org.place,place.org.description,place.org.sources,place.org.tags,place.org.image,place.org.id,place.org.dirName,place.org.url,place.org.events,place.org.type,place.org.places,place.org.kind,place.org.parent,place.place,place.org,place.place.name,place.place.surname,place.place.title,place.place.time,place.place.deprecated,place.place.note,place.place.place,place.place.description,place.place.sources,place.place.tags,place.place.image,place.place.id,place.place.dirName,place.place.url,place.place.events,place.place.type,place.place.locations,place.place.elevation,place.org.parent.name,place.org.parent.surname,place.org.parent.title,place.org.parent.time,place.org.parent.deprecated,place.org.parent.note,place.org.parent.place,place.org.parent.description,place.org.parent.sources,place.org.parent.tags,place.org.parent.image,place.org.parent.id,place.org.parent.dirName,place.org.parent.url,place.org.parent.events,place.org.parent.type,place.org.parent.places,place.org.parent.kind,place.org.parent.parent.name,place.org.parent.parent.surname,place.org.parent.parent.title,place.org.parent.parent.time,place.org.parent.parent.deprecated,place.org.parent.parent.note,place.org.parent.parent.place,place.org.parent.parent.description,place.org.parent.parent.sources,place.org.parent.parent.tags,place.org.parent.parent.image,place.org.parent.parent.id,place.org.parent.parent.dirName,place.org.parent.parent.url,place.org.parent.parent.events,place.org.parent.parent.type,place.org.parent.parent.places,place.org.parent.parent.kind,place.org.parent.parent.parent.name,place.org.parent.parent.parent.surname,place.org.parent.parent.parent.title,place.org.parent.parent.parent.time,place.org.parent.parent.parent.deprecated,place.org.parent.parent.parent.note,place.org.parent.parent.parent.place,place.org.parent.parent.parent.description,place.org.parent.parent.parent.sources,place.org.parent.parent.parent.tags,place.org.parent.parent.parent.image,place.org.parent.parent.parent.id,place.org.parent.parent.parent.dirName,place.org.parent.parent.parent.url,place.org.parent.parent.parent.events,place.org.parent.parent.parent.type,place.org.parent.parent.parent.places,place.org.parent.parent.parent.kind,place.org.parent.parent.parent.parent,place.org.parent.parent.parent,place.org.parent.parent
https://rr0.org/time/1/9/8/5/02/index.html#1985-02-01,"Bozel, Savoie",,,,,,,,,,,,,,,,"",place,"",,1985-02-01,"le , plusieurs témoins vont apercevoir durant 3 s une lueur particulière. Passant très rapidement au-dessus d'eux, ils voient 1 boule de couleur verte suivie d'un flux conique allant de la couleur jaune clair au rouge éclatant. Ce phénomène d'une grande beauté reste silencieux (Bien que divers éléments fassent penser à une rentrée atmosphèrique, aucune autre information n'a pu être recueillie sur ce phénomène).",",s1,""GEPAN"",,",1985-02-01
https://rr0.org/time/1/9/8/5/02/index.html#1985-02,"Aldudes, Pyrênées Atlantiques",,,,,,,,,,,,,,,,"",place,"",,1985-02,"le mois suivantavril 1985 (début du mois) A , plusieurs témoins voient 1 forme quasi circulaire émettant de la lumière blanche et des lumières clignotantes rouges et vertes. Le phénomène se déplace à une vitesse élevée. Lors d'une observation, ce phénomène qui se déplace va s'immobiliser puis de déplacer sur la gauche, s'immobiliser à nouveau avant de revenir à sa position initiale. Un phénomène lumineux de même type sera apercu dans les Ardennes et en Espagne les 2, 3 et 4 février. Ces observations seront largement commentées par la presse.",",s2,""GEPAN"",,",1985-02
https://rr0.org/time/1/9/8/5/02/index.html#1985-02-21T22:00,Bais (Mayenne),,,,,,,,,,,,,,,,"",place,"",,1985-02-21T22:00,"le , 2 témoins observent une boule lumineuse jaune et très brillante qui change de couleur pour devenir rouge vif. Durant 20 mn les témoins observent un phénomène stationnaire et silencieux qui disparaîtra progressivement. Le témoin principal ainsi que plusieurs autres personnes pourront également faire cette observation les nuits suivantes (Il s'agit probablement de l'observation d'une étoile particulièrement bien visible dans le ciel dégagé de ces nuits d'hiver).",",s6,""GEPAN"",,",1985-02-21T22:00
https://rr0.org/time/1/9/8/5/02/index.html#1985-02-22,Abondance (Haute Savoie),,,,,,,,,,,,,,,,"",place,"",,1985-02-22,"le , plusieurs témoins voient dans le ciel étoilé et clair 1 phénomène lumineux particulier. D'un noyau de couleur vert se détachent des flèches vertes ; des lumières rouges clignotent également régulièrement du noyau. Le déplacement du phénomène lumineux est lent et l'observation durera environ 1 h (Suite à un appel à témoin lancé dans la presse locale, un témoin d'une observation similaire ayant eu lieu le 31 janvier se manifestera. Les données recueillies n'ont pas été suffisantes pour analyser l'hypothèse d'une observation astronomique).",",s7,""GEPAN"",,",1985-02-22
https://rr0.org/time/1/9/8/5/02/index.html#1985-02-24T19:30,Falaise (Calvados),,,,,,,,,,,,,,,,"",place,"",,1985-02-24T19:30,"le , plusieurs témoins dans un même secteur voient tomber 1 boule rouge rosé : une explosion est également entendue (L'enquète démontrera qu'il s'agissait des effets d'une fusée de détresse lancée sans intention particulière par une personne, les témoins ayant vu la fumée rouge rosé de la fusée puis le parachute en dérive avec le vent).",",s8,""GEPAN"",,",1985-02-24T19:30
https://rr0.org/time/1/9/8/5/02/index.html#1985-02-25,"Saint Sulpice de Royan (Charente-Maritime, Poitou Charentes)",,,,,,,,,,,,,,,,"",place,"",,1985-02-25,"le , 2 agriculteurs découvrent dans un champ un cylindre mystérieux.","",1985-02-25
https://rr0.org/time/1/9/8/5/02/index.html#1985-02-31,,1985-02-31,le Observation similaire à cette du le vendredi 22 à février 1985 à 19:40.,",s9,""GEPAN"",,",1985-02-31