description,events,eventType,id,place,sources,time,type,url,place.dirName,place.elevation,place.events,place.id,place.locations,place.name,place.type
"le , Mme Raymond Dupui, mère au foyer, voit évoluer entre 12 et 15 objets ronds et argentés.","",sighting,1947-09-03T12:15$OswegoOregon,,,"",,"",Oswego (Oregon),place,""""","""",s1,"""",,",1947-09-03T12:15,event,https://rr0.org/time/1/9/4/7/09/index.html#1947-09-03T12:15
"le Le général Schulgen, de l'USAF, confirme une nouvelle fois au FBI que ni l'U.S. Army ni l'U.S. Navy n'ont le moindre projet de recherche en matière de construction aéronautique pouvant être apparenté aux disques volants.","",sighting,1947-09-05$,,"",1947-09-05,event,https://rr0.org/time/1/9/4/7/09/index.html#1947-09-05
"le Entre et Honolulu, les pilote et co-pilote d'un appareil de la Pan-American voient une lumière blanc-bleu approcher et se changer en 2 lueurs rougeâtres jumelles avant de s'en aller. Le pilote estime la vitesse de la lumière à 1000 nœuds environ.","",sighting,1947-09-12$Midway,,,"",,"",Midway,place,""""","""",s2,"""",,""Reported Sightings of Flying Objects As of 1 August 1948""",1947-09-12,event,https://rr0.org/time/1/9/4/7/09/index.html#1947-09-12
"le Le responsable du FBI de intercepte un message confidentiel de l'Air Force indiquant que l'armée doit s'occuper des témoins crédibles et laisser aux petits copains du FBI les cas douteux et les affaires de sièges de W-C. John Edgar Hoover, patron du FBI, s'étrangle de colère et envoie, furibond, une lettre au général George Clement McDonald, du Pentagone, dans laquelle il annonce cesser toute investigation sur le sujet. À partir de ce jour, le FBI niera officiellement toute implication dans les enquêtes sur les ovnis.","",sighting,1947-09-15$SanFrancisco,,,"",,"",San Francisco,place,"",1947-09-15,event,https://rr0.org/time/1/9/4/7/09/index.html#1947-09-15
"le , un radar MEW repére une cible à 89 miles et suit sa trace sur 19 miles, où elle s'évanouit. La vitesse était de 840-900 miles/h. La mesure de vitesse, faite par une bonne équipe sur un suivi de 70 miles, est considérée précise.","",sighting,1947-09-16$FukuokaJapon,,,"",,"",Fukuoka (Japon),place,""""","""",s3,"""",,""Reported Sightings of Flying Objects As of 1 August 1948""",1947-09-16,event,https://rr0.org/time/1/9/4/7/09/index.html#1947-09-16
"le Établissement officiel de l'USAF. Son première secrétaire, W. Stuart Symington, prête serment.","",sighting,1947-09-18$,,"",1947-09-18,event,https://rr0.org/time/1/9/4/7/09/index.html#1947-09-18
"le Le général Nathan F. Twining fait son rapport au président Harry S. Truman. Le général George Catlett Marshall insiste pour que son contenu reste secret. D'après les documents MJ, Twining et le Dr. Bush concluent que le disque doit être un appareil de reconnaissance de faible portée, en raison de sa taille ainsi que de l'absence apparente de toute provision de carburant.","",sighting,1947-09-19$,,"",1947-09-19,event,https://rr0.org/time/1/9/4/7/09/index.html#1947-09-19
"le Le nombre de témoignages et la qualité des observateurs, souvent fort crédibles, amènent le général Twining à suggérer la création d'une commission d'étude des rapports, qui deviendra par la suite le projet Sign. Il qualifie par écrit à cette date les observations de réalité et non visions ou inventions (...) approchant probablement la forme d'un disque, émettant l'hypothèse que ces objets puissent être des engins américains développés dans le cadre de quelque projet hautement confidentiel inconnu ou d'origine étrangère (et donc probablement soviétique).","",sighting,1947-09-23$,,"",1947-09-23,event,https://rr0.org/time/1/9/4/7/09/index.html#1947-09-23
"le Selon les documents MJ, création du groupe MJ-12 sur l'ordre secret exécutif spécial du président Truman, sur recommandation du docteur Vannevar Bush et du Secrétaire James Vincent Forrestal, qui feront partie des 1ers membres aux côtés du vice-amiral Roscoe Henry Hillenkoetter, général Twining, général Hoyt Sanford Vandenberg, docteur Detlev Wulf Bronk, docteur Jerome Clarke Hunsaker, Sidney W. Souers, Gordon Gray, docteur Donald H. Menzel, général Robert M. Montague et du docteur Lloyd Viel Berkner.","",sighting,1947-09-24$,,"",1947-09-24,event,https://rr0.org/time/1/9/4/7/09/index.html#1947-09-24