type,events,url,place,time,description,sources,id,place.name,place.org,place.place.id,place.place.events,place.place.locations,place.place.elevation,place.place.dirName,place.org.type,place.org.dirName,place.org.events,place.org.id,place.org.places,place.org.kind,place.org.parent,place.place,place.org.parent.type,place.org.parent.dirName,place.org.parent.events,place.org.parent.id,place.org.parent.places,place.org.parent.kind,place.org.parent.parent.type,place.org.parent.parent.dirName,place.org.parent.parent.events,place.org.parent.parent.id,place.org.parent.parent.places,place.org.parent.parent.kind,place.org.parent.parent.parent,place.org.parent.parent.parent.type,place.org.parent.parent.parent.dirName,place.org.parent.parent.parent.events,place.org.parent.parent.parent.id,place.org.parent.parent.parent.places,place.org.parent.parent.parent.kind,place.org.parent.parent.parent.parent,place.org.parent.parent
case,"",https://rr0.org/time/1/9/9/7/08/index.html#1997-08-04T22:00,Nogent-le-Roi (Eure-et-Loir),,,"","",,,1997-08-04T22:00,"le , 1 témoin en train de dîner observe 1 lumière jaune se déplaçant au-dessus des arbres. Cette lumière forme 3 arcs de cercle.",""""",PAN classé C,s1,""SEPRA"",,,""""",1997-08-04T22:00
case,"",https://rr0.org/time/1/9/9/7/08/index.html#1997-08-06,,1997-08-06,le Video prétendue d'ovni à Mexico.,"",1997-08-06
case,"",https://rr0.org/time/1/9/9/7/08/index.html#1997-08-09,Saint Jorioz (Haute-Savoie),,,"","",,,1997-08-09,"le Un avion de la Swissair, alors qu'il se trouve à 7500 m d'altitude et relie Philadelphie à Boston, est frôlé à moins de 100 m par un objet plutôt allongé, sans ailes. L'enquête, ouverte par l'aviation civile, ne permet pas d'identifier l'intrus qui, par ailleurs, n'a pas été détecté au radar. en 22 À , un témoin qui observe le ciel avec son neveu est intrigué par le passage de 1 point lumineux très brillant qui se déplace lentement. La durée de l'observation est de l'ordre de 30 à 40 s. L'observation est silencieuse. Nous ne disposons que de peu d'informations, mais nous pouvons supposer que le témoin a probablement vu le passage d'un aéronef ou d'un satellite.",""""",PAN classé B,s2,""SEPRA"",,,""""",1997-08-09
case,"",https://rr0.org/time/1/9/9/7/08/index.html#1997-08-15T05:00,Saint André (Réunion),,,"","",,,1997-08-15T05:00,"le , 1 marchand ambulant faisant la tournée du pain observe 1 objet lumineux stationnaire à 40 m environ du sol. Après avoir observé le phénomène durant 10 à 15 mn, le témoin repart, mais quand il s'arrête de nouveau vers un autre client, constate que l'objet est à nouveau à proximité, stationnaire à 30 m environ du sol. A ce moment le témoin prend peur et repart à grande vitesse, mais l'objet le suit sur une trajectoire parallèle à la sienne et à la même vitesse. L'objet, dont le diamètre estimé est de 5 m, circule silencieusement, adaptant sa vitesse à celle de la voiture. Il a une forme de tortue avec 2 phares blancs. L'engin suivra le témoin dans une ruelle au fond de laquelle se trouve un client, faisant demi-tour comme la voiture et le suivant jusqu'à la maison de sa sœur à environ 2 km. Le phénomène s'arrête alors et le témoin réveille sa sœur qui, avec son mari et son fils, observeront le phénomène fixe pendant 20 mn environ. Le témoin repart pour sa tournée, mais sa sœur continuera à observer le phénomène jusqu'à sa disparition derrière une falaise. Depuis cette date la sœur du témoin dit observer de nouveau le phénomène lorsqu'il fait beau mais beaucoup plus loin. Aucune explication n'a pu être apportée à cette observation de longue durée d'un phénomène semblant avoir un comportement ""intelligent"" par rapport au témoin.",""""",PAN classé D,s3,""SEPRA"",,,""""",1997-08-15T05:00
case,"",https://rr0.org/time/1/9/9/7/08/index.html#1997-08-16,Saintes (Charente maritime),,,"","",,,1997-08-16,"le , 2 jeunes garçons en vacances dans un camping observent pendant quelques instants 3 points lumineux scintillant dans le ciel et se déplaçant à vitesse importante.",""""",PAN classé C,s4,""SEPRA"",,,""""",1997-08-16
case,"",https://rr0.org/time/1/9/9/7/08/index.html#1997-08-19,Norfolk (Angleterre),,,"","",,,1997-08-19,"le Dans le comté du , David Spoor ne porte aucun intérêt particulier au phénomène ovni. Ce jour-là, il bricole tranquillement dans son jardin derrière sa maison quand il remarque un objet bizarre traversant le ciel. C'était un vaisseau cylindrique lumineux de couleur blanche se rappelle Spoor. Il se déplaçait silencieusement d'Ouest en Est à haute altitude. Il semblait entouré de lumières stroboscopiques puissantes, qui clignotaient de manière aléatoire de temps à autre. Mais elles ne paraissaient pas rattachées au fuselage du vaisseau. Spoor a un caméscope à portée de main (il l'avait récemment emprunté à un ami pour enregistrer un événement familial) ; il peut ainsi filmer le vaisseau alors qu'il traverse le ciel. La bande vidéo est d'une qualité exceptionnelle, mais ce film n'est que le premier d'une série qui va affoler toute la communauté des ufologues.","",1997-08-19
case,"",https://rr0.org/time/1/9/9/7/08/index.html#1997-08-24T20:00,Paris (Paris (Île-de-France (France))),org,org/fr/idf/75/75000,"",75000,","""",""48.85666666666667,2.3519444444444444"",,",city,org,org/fr/idf/75,"",75,","""",""48.85666666666667,2.3519444444444444"",,",department,org,org/fr/idf,"",idf,","""",""48.852222,2.3175"",,",region,org,org/fr,"",fr,"",country,,,"","48.85666666666667,2.3519444444444444",,,1997-08-24T20:00,"le un témoin observe 2 phénomènes lumineux dans le ciel dont le comportement est étrange pour des aéronefs. Il prend une série de clichés (qui seront expertisés Une fois éliminé les traces de produits et impacts divers dûs au développement, les photos laissent effectivement apparaitre une forme en pentagone sensiblement conforme à la description qu'il en avait faite. Compte tenu de l'interdiction de vol de l'espace aérien, une enquête est menée mais aucune explication n'a pu être apportée).",""""",PAN classé D,s5,""SEPRA"",,,""""",1997-08-24T20:00$org_fr_idf_75_75000
case,"",https://rr0.org/time/1/9/9/7/08/index.html#1997-08-27,"Lorraine (Meurthe-et-Moselle,         etc.)",,,"","",,,1997-08-27,"le le mercredi 27 04:45 Dans des départements de , plusieurs témoins observent le passage très rapide de 1 boule verte traversant le ciel avec une trainée jaune orangé. Le phénomène, silencieux dure 2 à 3 s. Les caractéristiques de ces témoignages sont conformes à l'observation probable d'une rentrée atmosphérique. le mercredi 27 21:45 A Lyon (Rhône), 3 témoins de retour de leur travail observent l'évolution de 1 objet triangulaire (ou plutôt rond selon les témoignages) qui se déplace silencieusement, à faible altitude et dans le plus grand silence. L'engin est équipé de 2 gros phares et en arrivant au-dessus des témoins 1 des phares est braqué quelques instants sur eux. 1 des témoins croit distinguer 2 silhouettes à l'intérieur d'un habitacle vitré (Aucune explication n'a été donné à cette observation qui aurait pu être un hélicoptère si les témoins n'avaient pas insisté sur le silence absolu dans le déplacement de l'objet). vers le mercredi 27 23 h A Villambard (Dordogne), 1 témoin observe 6 boules lumineuses tournant dans le ciel. Au bout d'un moment 5 des sphères disparaissent pour laisser place 1 grosse sphère laiteuse (3 fois le soleil couchant) qu'il observera durant 30 mn environ. Le témoin appelle sa mère qui observera seulement la grosse sphère blanche (Bien que l'enquête ne l'ai pas démontré, l'observation décrite fait penser aux effets produits sur les nuages par des projecteurs laser publicitaires) (SEPRA: PAN classé B).",""""",PAN classé B,s6,""SEPRA"",,,"""","""",Pan classé D,s7,""SEPRA"",,,""""",1997-08-27
case,"",https://rr0.org/time/1/9/9/7/08/index.html#1997-08-29,Firminy (Loire),,,"","",,,1997-08-29,"le en août 1997, plusieurs témoins sont alertés par le comportement anormal des animaux de la ferme. En se rendant sur place, ils observent 1 lueur blanche de forme arrondie, avec un cerceau extérieur et l'intérieur serti de petits cercles lumineux, projetant des faisceaux lumineux en direction du sol. L'ensemble se déplace en tournant sur lui-même. A 2 h, alors que les témoins vont se coucher, le phénomène est toujours présent (Bien qu'aucun élément de l'enquête ne permet de le valider, il semble bien que cette observation soit le reflet sur les nuages d'un projecteur laser publicitaire pouvant fonctionner dans un rayon de 8 à 10 km).",""""",PAN classé B,s8,""SEPRA"",,,""""",1997-08-29