type,events,url,place,time,description,sources,id,place.name,place.org.type,place.org.dirName,place.org.events,place.org.id,place.org.places,place.org.kind,place.org.parent,place.place,place.org,place.place.id,place.place.events,place.place.locations,place.place.elevation,place.place.dirName,place.org.parent.type,place.org.parent.dirName,place.org.parent.events,place.org.parent.id,place.org.parent.places,place.org.parent.kind,place.org.parent.parent.type,place.org.parent.parent.dirName,place.org.parent.parent.events,place.org.parent.parent.id,place.org.parent.parent.places,place.org.parent.parent.kind,place.org.parent.parent.parent.type,place.org.parent.parent.parent.dirName,place.org.parent.parent.parent.events,place.org.parent.parent.parent.id,place.org.parent.parent.parent.places,place.org.parent.parent.parent.kind,place.org.parent.parent.parent.parent,place.org.parent.parent.parent,place.org.parent.parent
case,"",https://rr0.org/time/1/9/5/7/01/index.html#1957-01-16T20:00,fort worth,,,"","",,,1957-01-16T20:00,"couverture du n° de amazing stories de ce mois-ci, montrant un ""petit homme vert"" le entre et lubbock (texas), les équipages usaf de 2 b-25s voient un objet blanc et rond faire des manœuvres rapides, avec des effets sur la radio et le compas.",""""",Weinstein,s1,"""",Dominique,,""""",1957-01-16T20:00
case,"",https://rr0.org/time/1/9/5/7/01/index.html#1957-01-17,Yokohama (Japon),,,"","",,,1957-01-17,"le en janvier 1957 à 10:47 À , Yusuke Matsumura photographie une soucoupe et crée de la CBA. L'amiral Delmer S. Farney déclare qu'aucun appareil terrestre n'est capable de reproduire les performances des objets volants observés, pénétrant notre atmosphère.",""""",""Saucer over Yokohama"",s2,"""",,1957,"""","""",""High Speed Objects Reported in the Sky"",s3,"""",The New York Times,-17,""""",1957-01-17
case,"",https://rr0.org/time/1/9/5/7/01/index.html#1957-01-21,,1957-01-21,"le Rapport du Renseignement de l'Armée sur une grande boule de métal brillante, un disque et d'autres ovnis au-dessus de la base APO de l'Armée.",""""",UFO Evidence,s4,"""",4,,""""",1957-01-21
case,"",https://rr0.org/time/1/9/5/7/01/index.html#1957-01-24,Indiana,,,"","",,,1957-01-24,"le Jan. 24, 1957: Los Angeles Times aviation writer Dewey Linze examines flying saucer found in the Hollywood Hills En , un pilote commercial et de nombreuses autres personnes voient 4 lumières blanches brillantes alignées et un objet en queue plus grand, en forme d'œuf et pulsant.",""""",""Flying saucer found in Hollywood Hills"",s5,""""""Harrison, Scott"""""",LA Times,2013-08-30,"""","""",""That Time Gloria Swanson Discovered a UFO in the Hollywood Hills!"",s6,""STEPHEN RUTLEDGE"",WOW report,2018-07-28,"""","""",UFO Evidence,s7,"""",5,,""""",1957-01-24
case,"",https://rr0.org/time/1/9/5/7/01/index.html,,1957-01,Donald E. Keyhoe est nommé à la tête du NICAP.,"",1957-01
case,"",https://rr0.org/time/1/9/5/7/01/index.html,Milowka (Pologne),,,"","",,,1957-01,"Au-dessus de , plusieurs témoins voient un objet blanchâtre. Il est argenté, certains pensent, et rond comme un chapeau. Il se déplace horizontalement à une altitude estimée à 500 m et a un diamètre d'environ 20 m. L'objet brillait comme un miroir dans le Soleil avant de partir à grande vitesse.",""""",Hobana,s8,"""",Ion & Weverbergh,,""""",1957-01
case,"",https://rr0.org/time/1/9/5/7/01/index.html,Milowka,,,"","",,,1957-01,"A , un couple marié est au balcon de leur appartement lorsqu'ils voient 3 sphères brillantes dans le ciel, toutes de taille égale et à la même distance les unes des autres.",""""",Hobana,s9,"""",Ion & Weverbergh,,""""",1957-01