description,events,eventType,id,place,sources,time,type,url,place.dirName,place.elevation,place.events,place.id,place.locations,place.name,place.sources,place.type
"samedi 1 janvier Gravure dans Scientific American Publication d'un récit décrivant l'invention de M. Moses S. Cole, de... Il est dit que ce vaisseau peut s'élever, descendre, être dirigé et propulsé dans toute direction à la volonté du pilote, donnant des détails complets sur la manière dont l'aéronef a été construit - un ballon gonflé de forme semi-sphéroïde, tandis qu'au est attaché un ballon semblable - piloté et dirigé.","",sighting,1887-01$GreytownNicaragua,,,"",,"","Greytown, Nicaragua","",place,"""""""""""""""A Novel Form of Aerial Vessel"""""""", Scientific American, 1er jan 1887 < Taylor, Bill"""""","""",s1,"""",,""A picture and a thousand words""",1887-01,event,https://rr0.org/time/1/8/8/7/index.html#1887-01
"mardi 22 mars à 20 h A ? des centaines de personnes voient pendant 30 mn, au sommet de Telegraph Hill, 1 lueur non identifiée aux formes et couleurs changeantes à côté d'un poteau électrique portait des lampes.","",sighting,1887-03$SaintLouisMissouri,,,"",,"","Saint Louis, Missouri","",place,""""","""",s2,"""",,""A Mysterious Light""",1887-03,event,https://rr0.org/time/1/8/8/7/index.html#1887-03
"mardi 3 mai À pluie jaune (pluie de soufre des anciens). vendredi 4 mars à 09 h À Oshkosh, Wisconsin, observation de 3 cercles lumineux autour du soleil.","",sighting,1887-05$Fontainebleau,,,"",,"",Fontainebleau,"",place,""""","""",s3,"""",,,"""","""",s4,"""",,""Three Circles Seen""",1887-05,event,https://rr0.org/time/1/8/8/7/index.html#1887-05
"lundi 20 juin à 16 h À , juste après une tempête énorme, passant ramasse une grosse boule de glace, étonnante par la chaleur du jour inhabituelle pour la saison. Tout d'abord, on pense qu'il s'agit d'un grand grêlon qui, à travers des conditions climatiques monstrueuses, est tombé de lui-même. Mais lorsque l'enveloppe de glace fond on s'aperçoit qu'à l'intérieur il y avait une pierre ou un caillou de forme oblongue, décrit par H. Sudre (professeur de l'École Normale de Tarbes) comme un disque blanc laiteux faisant 5 mm d'épaisseur et 13 mm de diamètre, avec un poids de 2 g. Plus inhabituel encore, la pierre de gypse (ou sulfate de chaux hydraté) apparait avoir été taillée et formée par l'homme (très régulier (...) Il a été assurément travaillé). Des scientifiques s'interrogent sur le problème. Les membres de l'Académie Française discutent du sujet sous tous les angles.","",sighting,1887-06$TarbesFrance,,,"",,"",Tarbes (France),"",place,""""","""",s5,"""",,Annales de la Société des Météorologues,""""""""""""""Une pierre dans un grêlon"""""""", La Nature (Paris), 1887, 2 (23 juillet)"""""","""",s6,"""",,,""""""""""""""Grêlon contenant une pierre"""""""", L'Année Scientifique et Industrielle, 31 (1887)"""""","""",s7,"""",,,""""""Nature, 36 (28 juillet 1887)"""""","""",s8,"""",,311-2,""""""Oliver Lanard Fassig. Bibliography of Meteorology. U.S. Signal Service, 1889. """"""""M.G. Tissandier - Sur un grêlon contenant une masse pierreuse."""""""" Annuaire de la Société Météorologique de France, 35 (1887)"""""","""",s9,"""",,,""""""Fort, C. H."""""","""",s10,"""",,The Book of the Damned,"""","""",s11,"""",,""Mystery of the 'Red Rains' in Japan""",1887-06,event,https://rr0.org/time/1/8/8/7/index.html#1887-06
"vendredi 8 juillet après-midi À , observation d'un phénomène lumineux spectaculaire dû à un nuage masquant le soleil à l'ouest. jeudi 21 juillet A Nancy, France, pluie de fourmis.","",sighting,1887-07$SandersvilleGeorgie,,,"",,"","Sandersville, Georgie","",place,""""","""",s12,"""",,""A Strange Phenomenon"","""","""",s13,"""",,",1887-07,event,https://rr0.org/time/1/8/8/7/index.html#1887-07
"lundi 15 août à 05 h à 5 À , de nombreuses personnes sont réveillées par une lueur orangée baignant tous les environs.","",sighting,1887-08$PittsburgPennsylvanie,,,"",,"","Pittsburg, Pennsylvanie","",place,""""","""",s14,"""",,""Neighborhood News""",1887-08,event,https://rr0.org/time/1/8/8/7/index.html#1887-08
"vendredi 12 août Non loin de , à 10 miles nautiques de Cape Race, Océan Atlantique, par un temps lourd, le capitaine Moore du paquebot britannique Siberia voit 1 boule de feu montant de la mer qui flotte penant quelques s à 4 m au-dessus de la mer, et disparait par la suite. D'autres sources indiquent plusieurs passagers ont été témoins et que la boule a atteint une altitude de 50 pieds, volé contre le vent, et s'est approchée du navire. L'observation aurait duré 5 mn, avant qu'elle ne disparaisse vers le sud-est.","",sighting,1887-11$Newfoundland,,,"",,"",Newfoundland,"",place,""""","""",s15,"""",,Article du Nieuwe Amersfoortsche Courant de Amersfoort (Pays Bas),"""","""",s16,"""",,Article du Texelse Courant de Texel (Pays Bas),"""","""",s17,"""",,Nature,""""""Flammarion, Camille"""""","""",s18,"""",,Thunder and Lightning,"""","""",s19,"""",,American Meteorological Journal,""""""L'Astronomie, 1887-76 < Fort, Charles"""""","""",s20,"""",,The Book of the Damned,"""","""",s21,"""",,BSAF,"""","""",s22,"""",,,""""""Vallée, Jacques"""""","""",s23,"""",,",1887-11,event,https://rr0.org/time/1/8/8/7/index.html#1887-11
"dimanche 13 novembre A , pluie de sang.","",sighting,1887-12$FayNuihIndochine,,,"",,"","Fay-Nuih, Indochine","",place,""""","""",s24,"""",,",1887-12,event,https://rr0.org/time/1/8/8/7/index.html#1887-12