url,place.name,place.org,place.place.name,place.place.surname,place.place.title,place.place.time,place.place.deprecated,place.place.note,place.place.place,place.place.description,place.place.sources,place.place.tags,place.place.image,place.place.id,place.place.dirName,place.place.url,place.place.events,place.place.type,place.place.parent,place.place.locations,place.place.elevation,time,description,sources,id,place.org.name,place.org.surname,place.org.title,place.org.time,place.org.deprecated,place.org.note,place.org.place,place.org.description,place.org.sources,place.org.tags,place.org.image,place.org.id,place.org.dirName,place.org.url,place.org.events,place.org.type,place.org.parent.name,place.org.parent.surname,place.org.parent.title,place.org.parent.time,place.org.parent.deprecated,place.org.parent.note,place.org.parent.place,place.org.parent.description,place.org.parent.sources,place.org.parent.tags,place.org.parent.image,place.org.parent.id,place.org.parent.dirName,place.org.parent.url,place.org.parent.events,place.org.parent.type,place.org.parent.parent.name,place.org.parent.parent.surname,place.org.parent.parent.title,place.org.parent.parent.time,place.org.parent.parent.deprecated,place.org.parent.parent.note,place.org.parent.parent.place,place.org.parent.parent.description,place.org.parent.parent.sources,place.org.parent.parent.tags,place.org.parent.parent.image,place.org.parent.parent.id,place.org.parent.parent.dirName,place.org.parent.parent.url,place.org.parent.parent.events,place.org.parent.parent.type,place.org.parent.parent.parent,place.org.parent.parent.places,place.org.parent.parent.kind,place.org.parent.places,place.org.parent.kind,place.org.places,place.org.kind,place
https://rr0.org/time/1/9/8/0/12/index.html,Hessdalen     (Norvège),,,,,,,,,,,,,,,,"",place,,"",,1980-12,"Couverture de Fate ce mois-là, titrant sur ""un ciel rempli d'ovnis"" À , début d'une longue vague d'observations de phénomène curieux, essentiellement des boules jaunes, de puissantes lumières blanc-bleu et des groupes de lumières multicolores, voire des objets non lumineux visibles de jour seulement. Les trajectoires peuvent être diverses ; les phénomènes sont enregistrés sur divers appareils, parfois au radar.","",1980-12
https://rr0.org/time/1/9/8/0/12/index.html#1980-12-15,sud-est de Londres,,,,,,,,,,,,,,,,"",place,,"",,1980-12-15,"le Au et dans le Kent (Royaume-Uni), de nombreux témoins, dont Timothy Good, observent 1 phénomène volant lumineux de forme conique. L'avant est rouge, le centre argenté et l'arrière bleu étincelant.","",1980-12-15
https://rr0.org/time/1/9/8/0/12/index.html#1980-12-17,Sevenoaks (Kent),,,,,,,,,,,,,,,,"",place,,"",,1980-12-17,le Une chaîne de télévision anglaise diffuse un court extrait d'un film de 30 mn tourné près de montrant l'objet inconnu de l'avant-veille. Le film est authentifié par 15 témoins.,"",1980-12-17
https://rr0.org/time/1/9/8/0/12/index.html#1980-12-27,Watton (Norfolk),,,,,,,,,,,,,,,,"",place,,"",,1980-12-27,"le le samedi 27 03 h Les radars de la base RAF de perçoivent un inconnu survolant la mer du Nord en direction de la côte. Il disparaît des écrans aux alentours de la forêt de Rendlesham. À peu près au même moment, près de cette forêt, les agents de sécurité à la porte de la base USAF de la RAF de Woodbridge voient des lumières descendre du ciel vers les arbres. On leur accorde la permission d'enquêter et ils quittent la base dans une Jeep. le samedi 27 05:30 Incident de Rendlesham : alors qu'il sert en tant que commandant de base à la Base Aérienne de Bentwaters dans le sud de l'Angleterre, le colonel Charles I. Halt observe et enquête sur divers objets anormaux apparus dans le ciel de la Forêt de Rendlesham. Les observations interviennent en 2 nuits distinctes lors de la semaine suivant Noël.","",1980-12-27
https://rr0.org/time/1/9/8/0/12/index.html#1980-12-29,,1980-12-29,le Incident Cash/Landrum.,"",1980-12-29