url,place,time,description,sources,id,place.name,place.org.name,place.org.surname,place.org.title,place.org.time,place.org.deprecated,place.org.note,place.org.place,place.org.description,place.org.sources,place.org.tags,place.org.image,place.org.id,place.org.dirName,place.org.url,place.org.events,place.org.type,place.org.places,place.org.kind,place.org.parent,place.place,place.org,place.place.name,place.place.surname,place.place.title,place.place.time,place.place.deprecated,place.place.note,place.place.place,place.place.description,place.place.sources,place.place.tags,place.place.image,place.place.id,place.place.dirName,place.place.url,place.place.events,place.place.type,place.place.locations,place.place.elevation,place.org.parent.name,place.org.parent.surname,place.org.parent.title,place.org.parent.time,place.org.parent.deprecated,place.org.parent.note,place.org.parent.place,place.org.parent.description,place.org.parent.sources,place.org.parent.tags,place.org.parent.image,place.org.parent.id,place.org.parent.dirName,place.org.parent.url,place.org.parent.events,place.org.parent.type,place.org.parent.places,place.org.parent.kind,place.org.parent.parent.name,place.org.parent.parent.surname,place.org.parent.parent.title,place.org.parent.parent.time,place.org.parent.parent.deprecated,place.org.parent.parent.note,place.org.parent.parent.place,place.org.parent.parent.description,place.org.parent.parent.sources,place.org.parent.parent.tags,place.org.parent.parent.image,place.org.parent.parent.id,place.org.parent.parent.dirName,place.org.parent.parent.url,place.org.parent.parent.events,place.org.parent.parent.type,place.org.parent.parent.places,place.org.parent.parent.kind,place.org.parent.parent.parent.name,place.org.parent.parent.parent.surname,place.org.parent.parent.parent.title,place.org.parent.parent.parent.time,place.org.parent.parent.parent.deprecated,place.org.parent.parent.parent.note,place.org.parent.parent.parent.place,place.org.parent.parent.parent.description,place.org.parent.parent.parent.sources,place.org.parent.parent.parent.tags,place.org.parent.parent.parent.image,place.org.parent.parent.parent.id,place.org.parent.parent.parent.dirName,place.org.parent.parent.parent.url,place.org.parent.parent.parent.events,place.org.parent.parent.parent.type,place.org.parent.parent.parent.places,place.org.parent.parent.parent.kind,place.org.parent.parent.parent.parent,place.org.parent.parent.parent,place.org.parent.parent
https://rr0.org/time/1/9/5/4/10/28/index.html#1954-10-28,La Faute-sur-Mer (Vendée),,,,,,,,,,,,,,,,"",place,"",,1954-10-28,"le , des témoins indépendants voient un ""mobile"" disparaître rapidement vers le sud-est.","""Soucoupes volantes"",s1,"""",La Vendée Libre Paraissant le dimanche,-31",1954-10-28
https://rr0.org/time/1/9/5/4/10/28/index.html,,1954-10-28,"L'Aurore de ce jour-là, relatant l'arrêté du maire de Châteauneuf-du-Pape Un journal rapporte l'arrêté pris le maire de Châteauneuf-du-Pape.","L'Aurore,s2,"""",jeudi 28 octobre 1954,,""Interdiction aux soucoupes volantes de survoler Châteauneuf-du-Pape"",s3,"""",L'Est Républicain,-29,""M. le Maire ne plaisante pas,s4,"""",""aussi les 'soucoupes ou cigares atterrissant à Chateauneuf-du-Pape seront mis en fourrière si le garde champêtre les attrape'"""", Le Haut Marnais Républicain, 29 octobre 1954, p. 1"",",1954-10-28
https://rr0.org/time/1/9/5/4/10/28/index.html,Isla de Lobos (Uruguay),,,,,,,,,,,,,,,,"",place,"",,1954-10-28,"À , une sentinelle s'apprête à tirer sur 3 êtres qui se tiennent près d'un disque à coupole posé sur la plate-forme d'un phare. Elle est aussitôt paralysée et ressent la prémonition qu'il lui est inutile de faire feu. L'équipage regagne l'ovni qui décolle à la verticale, bourdonne, s'incline et disparaît en silence à très grande vitesse.","",1954-10-28
https://rr0.org/time/1/9/5/4/10/28/index.html,Yaoundé (Cameroun),,,,,,,,,,,,,,,,"",place,"",,1954-10-28,"À , un chien attire l'attention par ses grognements sur un énorme disque immobile, violemment illuminé, alors vu par de nombreuses personnalités de la ville, dont le chef de l'hôpital. L'objet à la forme d'un champignon et porte à sa base un cylindre se balançant dans les airs.","Vallée 1966,s5,"""",,",1954-10-28
https://rr0.org/time/1/9/5/4/10/28/index.html,Miho (Japon),,,,,,,,,,,,,,,,"",place,"",,1954-10-28,Observation à la base aérienne de.,"Cas Blue Book n° 3281 non résolu,s6,"""",,",1954-10-28
https://rr0.org/time/1/9/5/4/10/28/index.html,Rome (Italie),,,,,,,,,,,,,,,,"",place,"",,1954-10-28,A observation de Clare Booth Luce.,"",1954-10-28