description,events,id,place,sources,time,type,url,place.name,place.org,place.place.dirName,place.place.elevation,place.place.events,place.place.id,place.place.locations,place.org.dirName,place.org.events,place.org.id,place.org.kind,place.org.parent,place.org.places,place.org.type,place.place,place.org.parent.dirName,place.org.parent.events,place.org.parent.id,place.org.parent.kind,place.org.parent.parent,place.org.parent.places,place.org.parent.type,place.org.parent.parent.dirName,place.org.parent.parent.events,place.org.parent.parent.id,place.org.parent.parent.kind,place.org.parent.parent.parent,place.org.parent.parent.places,place.org.parent.parent.type
"le Couverture du n° de Fate de ce mois-ci sur la ""chasse aux soucoupes"" par les militaires A , le chef d'escadron du corps de Marine US D. R. Higgin, aux commandes de son jet F3D-2, observe durant quelques secondes un objet métallique en forme de delta, de 22 pieds de long and 10 de large, avec un aileron à son sommet, descendre avec un angle de 25 à 300 sous l'appareil dirigeant une formation, et au-dessus de son l'appareil.","",1954-05-10T12:40,Elsinore (Californie),,,,"",,"",""""","""",s1,"""",,2994,",1954-05-10T12:40,sighting,https://rr0.org/time/1/9/5/4/05/index.html#1954-05-10T12:40
"le A l'aéroport National de , 3 policiers de l'air de l'USAF observent à 3 reprises durant 45 s environ, 2 vives lumières voler droit, faire un virage à 90°, et disparaître progressivement.","",1954-05-11T10:45,Washington (D. C.),,,,"",,"",""""","""",s2,"""",,2997,",1954-05-11T10:45,sighting,https://rr0.org/time/1/9/5/4/05/index.html#1954-05-11T10:45
Donald E. Keyhoe annonce que 2 satellites artificiels gravitent autour de la Terre ; ils défient les lois de la physique et leur orbite est très irrégulière. Il ne s'agit pas d'engins fabriqués par l'homme.,"",1954-05,,"",1954-05,sighting,https://rr0.org/time/1/9/5/4/05/index.html
"le À la base aérienne de , 2 personnes sont témoins de l'atterrissage d'un appareil en forme de lentille, de la taille d'une maison. Il atterrit près d'une voie de chemin de fer, soulevant un nuage de sable dans le désert. L'un des témoins décide de s'approcher mais, pris de panique, s'enfuit.","",1954-05-18T19:00,Cannon (Nouveau Mexique),,,,"",,"",""""","""",s3,"""",,,",1954-05-18T19:00,sighting,https://rr0.org/time/1/9/5/4/05/index.html#1954-05-18T19:00
"le le jeudi 20 02 h Nigel Frapple rentre chez lui à bicyclette après un bal à. À 5 km de Burton, au croisement de Redlynch, il voit une lumière ""terrifiante"" dans un champ, et saute de bicyclette pour observer, caché dans un buisson. A 2,50 m ou 3 m de lui environ, il voit un objet circulaire de 15 m de diamètre environ, en survol à 6 m du sol environ. Malgré sa brillance, ""de la couleur d'une flamme"" orangée, l'objet semble métallique. Après 1 mn environ, l'objet se déplace vers le nord-ouest de Bruton, accélérant et s'élevant à grande vitesse. L'objet ne fait pratiquement aucun bruit à part un léger ""bruissement"", et est accompagné d'une lumière plus faible à quelque distance (en 1964 Frapple écrira à Bowen qu'il avait aussi été attiré par un son pulsant et que, le lendemain, un examen du champ, opéré avec un journaliste de la radio, a révélé que l'herbe avait été écrasée sur une surface de 30 m de diamètre, roussie par endroits). La nuit Doreen Heffer, de Shobley (près de Ringwood, dans le Hampshire), voit un objet brillant la survoler. Elle fait une description très semblable à celle de Frapple.","",1954-05-20,"Wincanton (Somerset, Angleterre)",,,,"",,"",""""","""",s4,"""",""13 juin 1954 < Bowen, C., En quête d'humanoides"",15,Sunday Dispatch,""""""Vallée, Jacques"""""","""",s5,"""",,200,cas n° 3,""""""Bowen, Charles"""""","""",s6,"""",,16,En quête d'humanoides",1954-05-20,sighting,https://rr0.org/time/1/9/5/4/05/index.html#1954-05-20
"le , l'ingénieur des autoroutes R. W. Dring et l'ingénieur Geert Tibma observent durant 45 s l'ascension superficielle d'une vive lumière.","",1954-05-22T21:15,La Porte (Indiana),,,,"",,"",""""","""",s7,"""",,3009,",1954-05-22T21:15,sighting,https://rr0.org/time/1/9/5/4/05/index.html#1954-05-22T21:15
"le , Mme L. K. Stevens observe un objet oblong et très blanc voler extrêmement vite, puis clignoter au bout de 8 à 10 s.","",1954-05-31T10:15,Concord (New Hampshire),,,,"",,"",""""","""",s8,"""",,3020,",1954-05-31T10:15,sighting,https://rr0.org/time/1/9/5/4/05/index.html#1954-05-31T10:15