type,events,url,place,time,description,sources,id,place.name,place.org,place.place.id,place.place.events,place.place.locations,place.place.elevation,place.place.dirName,place.org.type,place.org.dirName,place.org.events,place.org.id,place.org.places,place.org.kind,place.org.parent.type,place.org.parent.dirName,place.org.parent.events,place.org.parent.id,place.org.parent.places,place.org.parent.kind,place.org.parent.parent.type,place.org.parent.parent.dirName,place.org.parent.parent.events,place.org.parent.parent.id,place.org.parent.parent.places,place.org.parent.parent.kind,place.org.parent.parent.parent.type,place.org.parent.parent.parent.dirName,place.org.parent.parent.parent.events,place.org.parent.parent.parent.id,place.org.parent.parent.parent.places,place.org.parent.parent.parent.kind,place.org.parent.parent.parent.parent,place.org.parent,place.place,place.org.parent.parent.parent,place.org.parent.parent
case,"",https://rr0.org/time/1/9/9/0/04/index.html#1990-04-05,,1990-04-05,"le 1er vol du petit lanceur américain Pégase, pesant 18 t.","",1990-04-05
case,"",https://rr0.org/time/1/9/9/0/04/index.html#1990-04-04,Lièges (Belgique),,,"","",,,1990-04-04,le Près de Photographie de Petit-Rechain.,"",1990-04-04
case,"",https://rr0.org/time/1/9/9/0/04/index.html,,1990-04,"La revue Science & vie fait sa première page avec le sous-marin MHD. Suit un article qui évoque les percées récemment réalisée dans ce domaine : les navires de surface et les sous-marins vont connaître bientôt une véritable révolution, grâce à la propulsion électromagnétique, découlant des progrès récents en matière de supraconduction. L'article comporte une photo d'une vedette construite par les japonais, prête pour les essais, équipée de 2 propulseurs MHD, identiques à celle que Jean-Pierre Petit a fait naviguer 10 ans plus tôt dans un petit bassin d'eau salée sur le plateau de l'émission Temps X de TF1. Une illustration décrit l'accélérateur pariétal que Petit à expérimenté en 1975, sans mentionner Petit.",""""",,s1,""""""Petit, J.-P."""""",,1991,""""",1990-04
case,"",https://rr0.org/time/1/9/9/0/04/index.html,Tagresk (Russie),,,"","",,,1990-04,"L'ovni de Tagsek A , un autre ""triangle volant"" est photographié (ci-contre).","",1990-04
case,"",https://rr0.org/time/1/9/9/0/04/index.html#1990-04-12T12:17,Bléré (Indre-et-Loire (Centre-Val de Loire (France))),org,org/fr/cvl/37/37027,"",37027,","""",""47.325833333333335,0.9905555555555555"",,",city,org,org/fr/cvl/37,"",37,","""",""47.422777777777775,0.8441666666666667"",,",department,org,org/fr/cvl,"",cvl,","""",""47.5,1.75"",,",region,org,org/fr,"",fr,"",country,,,"","47.325833333333335,0.9905555555555555",,,1990-04-12T12:17,"le , 1 témoin circulant en voiture est ""survolé"" par une ombre en forme de raie (poisson) qui traverse sa trajectoire. Cette ombre assez sombre laisse supposer au témoin qu'il a été survolé par 1 objet à basse altitude volant aux environs de 60 à 80 km/h.",""""",PAN classé C,s2,""SEPRA"",,,""""",1990-04-12T12:17$org_fr_cvl_37_37027
case,"",https://rr0.org/time/1/9/9/0/04/index.html#1990-04-19,Calais (Pas-de-Calais),,,"","",,,1990-04-19,"le , 1 témoin observe depuis chez lui 4 lumières clignotantes pendant environ 15 mn.",""""",PAN classé C,s3,""SEPRA"",,,""""",1990-04-19
case,"",https://rr0.org/time/1/9/9/0/04/index.html#1990-04-25,,1990-04-25,le Lancement du télescope spatial Hubble.,"",1990-04-25
case,"",https://rr0.org/time/1/9/9/0/04/index.html#1990-04-30T22:30,Montmarault (Allier (Auvergne-Rhône-Alpes (France))),org,org/fr/ara/03/3186,"",3186,","""",""46.318333333333335,2.9555555555555557"",,",city,org,org/fr/ara/03,"",03,","""",""46.416666666666664,3.1666666666666665"",,",department,org,org/fr/ara,"",ara,","""",""45.833333,4.666667"",,",region,org,org/fr,"",fr,"",country,,,"","46.318333333333335,2.9555555555555557",,,1990-04-30T22:30,"le , observation dans la région d'Orléans par 3 témoins indépendants d'une lumière rouge de la taille apparente de la lune. Le phénomène circulait en biais vers la terre sans bruit. 1 témoin a indiqué une excitation particulière de ses chiens. Le phénomène a duré quelques s. La description faite par les témoins peut faire penser à une rentrée atmosphérique, mais n'a pu être identifié (SEPRA: Cas classé D).","",1990-04-30T22:30$org_fr_ara_03_3186