description,events,eventType,id,place,sources,time,type,url,place.dirName,place.elevation,place.events,place.id,place.locations,place.name,place.sources,place.type
le,"",sighting,1989-11-02$,,"",1989-11-02,event,https://rr0.org/time/1/9/8/9/11/index.html#1989-11-02
"le Près de la frontière germano-belge, du côté de Raeren, M. G., ayant des responsabilités techniques très importantes pour la ville d'Eupen, observe un objet volant étrange muni de phares anormalement puissants, volant très lentement à la hauteur de la cîme des arbres.","",sighting,1989-11-03$,,"",1989-11-03,event,https://rr0.org/time/1/9/8/9/11/index.html#1989-11-03
le L'émission Ciel Mon Mardi consacre un plateau aux ovnis.,"",sighting,1989-11-07$,,"",1989-11-07,event,https://rr0.org/time/1/9/8/9/11/index.html#1989-11-07
le Chute du mur de Berlin.,"",sighting,1989-11-09$,,"",1989-11-09,event,https://rr0.org/time/1/9/8/9/11/index.html#1989-11-09
"le Lancement de Cobe, pour la mesure du rayonnement fossile à 3° K.","",sighting,1989-11-18$,,"",1989-11-18,event,https://rr0.org/time/1/9/8/9/11/index.html#1989-11-18
"le , 1 femme observe à sa fenêtre le passage rapide d'une forme ressemblant à 2 cylindres superposés d'une longueur totale de 10 fois celle d'un avion. L'objet est rouge-orangé et entouré de flammes. Aucun bruit n'est détecté. Le témoin réveille son mari qui peut constater le phénomène (Le phénomène qui par certains côtés peut faire penser à une rentrée atmosphérique n'a pas été identifié).","",sighting,1989-11-22T02:00$MirecourtVosges,,,"",,"",Mirecourt (Vosges),"",place,"""SEPRA"","""",s1,"""",,PAN classé D",1989-11-22T02:00,event,https://rr0.org/time/1/9/8/9/11/index.html#1989-11-22T02:00
"le Au , 1 homme observe 3 points lumineux en forme de triangle. Son état d'énervement interdit toute audition par les gendarmes (Lors de l'audition le 14 décembre, le témoin utilisera un article de presse pour faire sa déposition en relatant 5 disques orangés. Ces informations contradictoires ne permettront aucune analyse).","",sighting,1989-11-25T22:10$HavreSanvicSeineMaritime,,,"",,"","Havre Sanvic, Seine Maritime","",place,"""SEPRA"","""",s2,"""",,PAN classé C",1989-11-25T22:10,event,https://rr0.org/time/1/9/8/9/11/index.html#1989-11-25T22:10
le,"",sighting,1989-11-29$,,"",1989-11-29,event,https://rr0.org/time/1/9/8/9/11/index.html#1989-11-29
"le le jeudi 30 03 h Linda Cortile part se coucher. Son mari dort déjà. Elle commence presque aussitôt à ressentir un engourdissement paralysant qui part de ses pieds pour gagner son corps tout entier. En raison de son expérience passée, elle sait qu'il s'agit du prélude à un enlèvement. Elle tente de réveiller son mari, mais en vain. en 3Linda Cortile s'aperçoit qu'un être gris vient d'apparaître dans la chambre et jette un oreiller dans sa direction. Puis elle est totalement paralysée et se sent la tête vide, bien qu'elle ne souviendra vaguement de quelqu'un palpant sa colonne.","",sighting,1989-11-30$,,""""","""",s3,"""",,Témoignage de Cortile à Budd Hopkins",1989-11-30,event,https://rr0.org/time/1/9/8/9/11/index.html#1989-11-30