type,events,url,place,time,description,sources,id,place.name,place.org,place.place.id,place.place.events,place.place.locations,place.place.elevation,place.place.dirName,place.org.type,place.org.dirName,place.org.events,place.org.id,place.org.places,place.org.kind,place.org.parent.type,place.org.parent.dirName,place.org.parent.events,place.org.parent.id,place.org.parent.places,place.org.parent.kind,place.org.parent.parent,place.org.parent.parent.type,place.org.parent.parent.dirName,place.org.parent.parent.events,place.org.parent.parent.id,place.org.parent.parent.places,place.org.parent.parent.kind,place.org.parent.parent.parent.type,place.org.parent.parent.parent.dirName,place.org.parent.parent.parent.events,place.org.parent.parent.parent.id,place.org.parent.parent.parent.places,place.org.parent.parent.parent.kind,place.org.parent.parent.parent.parent,place.org.parent,place.place,place.org.parent.parent.parent
case,"",https://rr0.org/time/1/9/2/7/index.html#1927-01,Naarden (Pays Bas),,,"","",,,1927-01,"en le mercredi 12 16:30 A , un témoin observe dans les nuages un point sombre et parfois flou se désagréger puis se réunir.",""""",""Een Luchtverschijnel"",s1,"""",""Het Vaderland (Pays Bas), édition du soir"",14,""""",1927-01
case,"",https://rr0.org/time/1/9/2/7/index.html#1927-07,,1927-07,"en (ou 1928): Nous vîmes, ainsi que de nombreuses personnes, un cylindre radiant volant vers l'Est au-dessus du village Piatra-Olt (Roumanie) à une vitesse fantastique et sans le moindre bruit. L'objet était plus grand que la Lune. Il était jaune et éclairait tant les rues que l'on aurait pu se croire au milieu de la journée. Il explosa en l'air en une fontaine d'étincelles rouges.",""""",Eremencu Petre,s2,"""",,,""""",1927-07
case,"",https://rr0.org/time/1/9/2/7/index.html#1927-10,Zanesville (Ohio),,,"","",,,1927-10,"en le vendredi 28 A Thomas Townsend Brown effectue des expériences à son Laboratoire de Physique Expérimentale sur la force agissant sur les conducteurs chargés. Le dispositif prend 2 formes, comme décrit dans un manuscrit intitulé Tapping Cosmic Energy daté de ce jour, qui est à l'époque soumis pour publication au magazine Physical Review, mais refusé.","",1927-10
case,"",https://rr0.org/time/1/9/2/7/index.html#1927-11,,1927-11,"en le lundi 14 10:45 A 100 miles environ au sud de l'île de Sable (latitude 42,22 N, longitude 61,05 O), le capitaine du navire Ile de France signale un mystérieux avion blanc survolant son navire.",""""",""Mystery Plane Spotted At Sea"",s3,"""",Reno Evening Gazette,1927-11-14,""""",1927-11
case,"",https://rr0.org/time/1/9/2/7/index.html,,1927,"Le 1er dispositif de germanium à l'état solide (semiconducteur) de Henry T. Moray est soumis au Bureau des Brevets des Etats-Unis, et est rejeté en raison du fait qu'il ne peut fonctionner sans cathode excitée.","",1927