url,place,dateTime,description,sources,id
https://rr0.org/time/1/9/8/9/10/index.html,,1989-10,"À Montbeliard (Doubs), un rapport établit par un agent du contrôle aérien rend compte d'un appel téléphonique d'un témoin concernant une observation depuis plusieurs jours d'un phénomène lumineux. 2 points lumineux rouges et verts sont stationnaires au-dessus de l'aérodrome SEPRA : PAN classé C.","",1989-10
https://rr0.org/time/1/9/8/9/10/index.html,,1989-10,"À Pleuneuf-Val André, Côtes-d'Armor, un couple observe à travers un velux 1 point très lumineux pendant quelques instants. Le lendemain, ils constatent des herbes et des souches fraichement calcinées Après enquête, il s'avère que les souches avaient été partiellement brulées volontairement. Quant à la lueur, observée également par un autre témoin, il s'agit vraisemblablement de la conjonction des planètes Saturne, Jupiter et Uranus avec la lune qui ne pouvait être observée que dans une direction précise SEPRA: Cas classé B.","",1989-10
https://rr0.org/time/1/9/8/9/10/index.html,,1989-10,"À Privas, Ardèche, 1 homme ouvre les volets de sa maison. Il observe alors 1 objet très brillant de la taille d'une assiette, immobile dans le ciel. Vers 06:50 un 2d objet plus petit semble sortir de l'autre auquel il reste relié par un rayon lumineux. Le rayon s'est alors coupé et l'objet le plus petit est descendu vers le sol, puis est remonté vers le gros et tous les 2 se sont éloignés lentement vers le sud. Un article de presse indique que 2 autres témoins ont observé le même phénomène d'une durée exceptionnellement longue et auquel aucune explication n'a pu être donnée SEPRA : PAN classé D.","",1989-10
https://rr0.org/time/1/9/8/9/10/index.html,,1989-10,La navette spatiale lance Galileo en direction de Jupiter.,"",1989-10
https://rr0.org/time/1/9/8/9/10/index.html,,1989-10,"À Eragny (Val-d'Oise), observation d'un nuage en forme de cornet à glace avec une seule boule Gazette du Val-d'Oise, 16 juillet 1997.","",1989-10
https://rr0.org/time/1/9/8/9/10/index.html,,1989-10,"Un peu avant 16:00 À Aubigny-sur-Nere (Cher), 1 témoin observe 1 objet ressemblant à un avion, mais qui disparaît très rapidement à l'horizon SEPRA : PAN classé C. À Benagues (Ariège), 1 témoin voit le passage rapide de 1 boule de feu durant 3 ou 4 secondes Il s'agit vraisemblablement d'une rentrée dans l'atmosphère SEPRA : PAN classé B.","",1989-10
https://rr0.org/time/1/9/8/9/10/index.html,,1989-10,"12:10 A Cergy-Pontoise (Val-d'Oise), observation de 1 boule lumineuse se dirigeant du nord-ouest vers le sud-est Gazette du Val-d'Oise, 16 juillet 1997. 18:30 A Domont (Val-d'Oise), observation pendant 15 mn d'une grosse masse argentée apparemment distante de plusieurs km Gazette du Val-d'Oise, 16 juillet 1997. A Jouy-le-Moutier (Val-d'Oise), observation d'une masse sombre d'apparence métallique, allongée et immobile. À 18:57, elle clignote Gazette du Val-d'Oise, 16 juillet 1997.","",1989-10
https://rr0.org/time/1/9/8/9/10/index.html,,1989-10,"A Pierrelaye (Val-d'Oise), le long de l'A 15, 2 boules collées et argentées sont visibles pendant 10 mn Gazette du Val-d'Oise, 16 juillet 1997.","",1989-10
https://rr0.org/time/1/9/8/9/10/index.html,,1989-10,"Au Trou Normand (Manche), le propriétaire d'un champ découvre dans celui-ci une grande zone calcinée de forme irrégulière, mesurant près de 17 m de long sur 4 m dans sa partie le plus large. Au niveau de la trace, il n'y a plus aucune trace de végétation, la terre est noire et le sol est spongieux et enfoncé de 10 à 15 cm par rapport au niveau moyen du pré. Une ligne à haute tension 20 kV longe la parcelle à 50 m environ de la trace. Les prélèvements par carrotage sont effectués sur la zone brulée montrent que la terre est brûlée sur 2 à 3 cm de profondeur et la couleur grise des argiles montre que le sol a été élevé à une forte température. Les échantillons de terre prélevés dans la zone suspecte présentent une forte odeur de produits pétroliers Les expertises menées confirment la présence de kérosène dans les échantillons. Ces résultats d'analyse suggèrent l'hypothèse d'un larguage de kérosène effectué par un avion volant à basse altitude et à faible vitesse. Ce kérosène a pu être enflammé par le passage à travers la ligne à haute tension. En effet, lors de l'enquête, il avait été remarqué de fort grésillements de la ligne au niveau de la jonction de certains isolateurs. Des étincelles ont pu se produire qui ont enflammé le nuage d'hydrocarbure. Cette hypothèse est confortée par un témoin qui a observé une très grande flamme bleue sur la zone, couleur typique de la combustion d'hydrocarbures SEPRA: Cas de type B Patenet, J. : ""Quelques enquêtes du GEPAN"", Phénomènes Aérospatiaux Non-Identifiés - Un défi à la science, Le cherche midi, avril 2007, pp. 58-59.","",1989-10