url,place,time,description,sources,id,place.name,place.org.name,place.org.surname,place.org.title,place.org.time,place.org.deprecated,place.org.note,place.org.place,place.org.description,place.org.sources,place.org.notes,place.org.tags,place.org.image,place.org.id,place.org.dirName,place.org.url,place.org.events,place.org.type,place.org.parent,place.org.places,place.org.kind,place.place,place.org,place.place.name,place.place.surname,place.place.title,place.place.time,place.place.deprecated,place.place.note,place.place.place,place.place.description,place.place.sources,place.place.notes,place.place.tags,place.place.image,place.place.id,place.place.dirName,place.place.url,place.place.events,place.place.type,place.place.parent,place.place.locations,place.place.elevation,place.org.parent.name,place.org.parent.surname,place.org.parent.title,place.org.parent.time,place.org.parent.deprecated,place.org.parent.note,place.org.parent.place,place.org.parent.description,place.org.parent.sources,place.org.parent.notes,place.org.parent.tags,place.org.parent.image,place.org.parent.id,place.org.parent.dirName,place.org.parent.url,place.org.parent.events,place.org.parent.type,place.org.parent.parent.name,place.org.parent.parent.surname,place.org.parent.parent.title,place.org.parent.parent.time,place.org.parent.parent.deprecated,place.org.parent.parent.note,place.org.parent.parent.place,place.org.parent.parent.description,place.org.parent.parent.sources,place.org.parent.parent.notes,place.org.parent.parent.tags,place.org.parent.parent.image,place.org.parent.parent.id,place.org.parent.parent.dirName,place.org.parent.parent.url,place.org.parent.parent.events,place.org.parent.parent.type,place.org.parent.parent.parent.name,place.org.parent.parent.parent.surname,place.org.parent.parent.parent.title,place.org.parent.parent.parent.time,place.org.parent.parent.parent.deprecated,place.org.parent.parent.parent.note,place.org.parent.parent.parent.place,place.org.parent.parent.parent.description,place.org.parent.parent.parent.sources,place.org.parent.parent.parent.notes,place.org.parent.parent.parent.tags,place.org.parent.parent.parent.image,place.org.parent.parent.parent.id,place.org.parent.parent.parent.dirName,place.org.parent.parent.parent.url,place.org.parent.parent.parent.events,place.org.parent.parent.parent.type,place.org.parent.parent.parent.parent,place.org.parent.parent.parent.places,place.org.parent.parent.parent.kind,place.org.parent.parent.places,place.org.parent.parent.kind,place.org.parent.places,place.org.parent.kind,place.org.parent.parent.parent,place.org.parent.parent
https://rr0.org/time/1/9/8/9/10/index.html#1989-10-02,Montbeliard (Doubs),,,,,,,,,,,,,,,,,"",place,,"",,1989-10-02,"le , un rapport établit par un agent du contrôle aérien rend compte d'un appel téléphonique d'un témoin concernant une observation depuis plusieurs jours d'un phénomène lumineux. 2 points lumineux rouges et verts sont stationnaires au-dessus de l'aérodrome.",",s1,""SEPRA"",,",1989-10-02
https://rr0.org/time/1/9/8/9/10/index.html#1989-10-08T22:30,"Pleuneuf-Val André, Côtes-d'Armor",,,,,,,,,,,,,,,,,"",place,,"",,1989-10-08T22:30,"le , un couple observe à travers un velux 1 point très lumineux pendant quelques instants. Le lendemain, ils constatent des herbes et des souches fraichement calcinées (Après enquête, il s'avère que les souches avaient été partiellement brulées volontairement. Quant à la lueur, observée également par un autre témoin, il s'agit vraisemblablement de la conjonction des planètes Saturne, Jupiter et Uranus avec la lune qui ne pouvait être observée que dans une direction précise).","Cas classé B,s2,""SEPRA"",,",1989-10-08T22:30
https://rr0.org/time/1/9/8/9/10/index.html#1989-10-14T05:40,"Privas, Ardèche",,,,,,,,,,,,,,,,,"",place,,"",,1989-10-14T05:40,"le , 1 homme ouvre les volets de sa maison. Il observe alors 1 objet très brillant de la taille d'une assiette, immobile dans le ciel. Vers en octobre 1989 à 06:50 un 2d objet plus petit semble sortir de l'autre auquel il reste relié par un rayon lumineux. Le rayon s'est alors coupé et l'objet le plus petit est descendu vers le sol, puis est remonté vers le gros et tous les 2 se sont éloignés lentement vers le sud. Un article de presse indique que 2 autres témoins ont observé le même phénomène d'une durée exceptionnellement longue et auquel aucune explication n'a pu être donnée.",",s3,""SEPRA"",,",1989-10-14T05:40
https://rr0.org/time/1/9/8/9/10/index.html#1989-10-18,,1989-10-18,le La navette spatiale lance Galileo en direction de Jupiter.,"",1989-10-18
https://rr0.org/time/1/9/8/9/10/index.html#1989-10-20T20:30,Eragny (Val-d'Oise),,,,,,,,,,,,,,,,,"",place,,"",,1989-10-20T20:30,"le , observation d'un nuage en forme de cornet à glace avec une seule boule.","Gazette du Val-d'Oise,s4,"""",,-16",1989-10-20T20:30
https://rr0.org/time/1/9/8/9/10/index.html#1989-10-26,Aubigny-sur-Nere (Cher),,,,,,,,,,,,,,,,,"",place,,"",,1989-10-26,"le Un peu avant 16:00 À , 1 témoin observe 1 objet ressemblant à un avion, mais qui disparaît très rapidement à l'horizon. À Benagues (Ariège), 1 témoin voit le passage rapide de 1 boule de feu durant 3 ou 4 secondes (Il s'agit vraisemblablement d'une rentrée dans l'atmosphère).",",s5,""SEPRA"",,,,s6,""SEPRA"",,",1989-10-26
https://rr0.org/time/1/9/8/9/10/index.html#1989-10-27,Cergy-Pontoise (Val-d'Oise),,,,,,,,,,,,,,,,,"",place,,"",,1989-10-27,"le en octobre 1989 à 12:10 A , observation de 1 boule lumineuse se dirigeant du nord-ouest vers le sud-est. en octobre 1989 à 18:30 A Domont (Val-d'Oise), observation pendant 15 mn d'une grosse masse argentée apparemment distante de plusieurs km. A Jouy-le-Moutier (Val-d'Oise), observation d'une masse sombre d'apparence métallique, allongée et immobile. en octobre 1989 à 18:57, elle clignote.","Gazette du Val-d'Oise,s7,"""",,-16,Gazette du Val-d'Oise,s8,"""",,-16,Gazette du Val-d'Oise,s9,"""",,-16",1989-10-27
https://rr0.org/time/1/9/8/9/10/index.html#1989-10-28T19:30,Pierrelaye (Val-d'Oise),,,,,,,,,,,,,,,,,"",place,,"",,1989-10-28T19:30,"le , le long de l'A 15, 2 boules collées et argentées sont visibles pendant 10 mn.","Gazette du Val-d'Oise,s10,"""",,-16",1989-10-28T19:30
https://rr0.org/time/1/9/8/9/10/index.html#1989-10-29,Trou Normand (Manche),,,,,,,,,,,,,,,,,"",place,,"",,1989-10-29,"le Au , le propriétaire d'un champ découvre dans celui-ci une grande zone calcinée de forme irrégulière, mesurant près de 17 m de long sur 4 m dans sa partie le plus large. Au niveau de la trace, il n'y a plus aucune trace de végétation, la terre est noire et le sol est spongieux et enfoncé de 10 à 15 cm par rapport au niveau moyen du pré. Une ligne à haute tension 20 kV longe la parcelle à 50 m environ de la trace. Les prélèvements par carrotage sont effectués sur la zone brulée montrent que la terre est brûlée sur 2 à 3 cm de profondeur et la couleur grise des argiles montre que le sol a été élevé à une forte température. Les échantillons de terre prélevés dans la zone suspecte présentent une forte odeur de produits pétroliers (Les expertises menées confirment la présence de kérosène dans les échantillons. Ces résultats d'analyse suggèrent l'hypothèse d'un larguage de kérosène effectué par un avion volant à basse altitude et à faible vitesse. Ce kérosène a pu être enflammé par le passage à travers la ligne à haute tension. En effet, lors de l'enquête, il avait été remarqué de fort grésillements de la ligne au niveau de la jonction de certains isolateurs. Des étincelles ont pu se produire qui ont enflammé le nuage d'hydrocarbure. Cette hypothèse est confortée par un témoin qui a observé une très grande flamme bleue sur la zone, couleur typique de la combustion d'hydrocarbures).","Cas de type B,s11,""SEPRA"",,,""Quelques enquêtes du GEPAN"",s12,""""""Patenet, J."""""",""Phénomènes Aérospatiaux Non-Identifiés - Un défi à la science, Le cherche midi, avril 2007, pp. 58-59"",",1989-10-29