description,events,id,place,sources,time,type,url,place.name,place.org,place.place.dirName,place.place.elevation,place.place.events,place.place.id,place.place.locations,place.org.dirName,place.org.events,place.org.id,place.org.kind,place.org.parent,place.org.places,place.org.type,place.place
"en le dimanche 13 février On observe simultanément dans le ciel des corps lumineux et une chute de sable. le lundi 14 février matin Une substance jaunâtre tombe sur. Elle est analysée par M. G. Boccardo et le professeur Castellani de l'Institut Technique de Gênes et trouve qu'elle contient 66 % de sable (principalement du type silice, et un peu d'argile), 15 % d'oxide de fer (rouille), 9 % de carbonate de chaux, 7 % de matière organique et le reste d'eau. La matière organique contient des particules ressemblant à des spores, des grains d'amidon, des fragments de diatomées (formes d'algues dont les parois de cellule contiennent de la silice) et des globules de cobalt bleu non-identifiés. en 3 Sur la ligne de chemin de fer de Boston et Lowell, observations répétées d'une lumière rouge (semblable à un signal d'arrêt) et du bruit d'un train invisible.","",1870-02,Gênes (Italie),,,,"",,"","""""""The Journal of the Franklin Institute, 3"""""","""",s1,"""",,1870-07-12,11,"""","""",s2,"""",Times de Ottawa (Ontario),1870-02-15,""Ghostly Signals at Woburn""",1870-02,sighting,https://rr0.org/time/1/8/7/0/index.html#1870-02
"Printemps en le mardi 22 mars Dans l'Océan Atlantique, entre l'Amérique du Sud et l'Afrique, le capitaine Banner et l'équipage du Lady of the Lake, un voilier à vapeur, observent pendant 30 mn un disque lumineux de couleur grise, dont l'arrière est entouré d'un halo et dont une sorte de queue semblable à celle d'un spermatozoïde émane du centre. Il vole contre le vent, à une altitude entre 200 et 800. Banner en fait un croquis. A , la grand-mère de Lars Lillevold voit quelque chose qu'elle décrira plus tard comme un objet volant. Elle déclare également que quelqu'un lui a fait signe depuis cet objet.","",1870-03,Ålen (Norvège),,,,"",,"","""""""Scott, R. H."""""","""",s3,"""",""Quarterly Journal of the Meterorological Society, vol. 1, Londres, 1873 - Avec croquis < Vallée, Jacques.: 1965 < Rosenberg, Samuel: """"'Ancient' UFO Reports"""", """"UFOs in History"""", Scientific Study of Unidentified Flying Objects"",1969,""Extract from log of 'Lady of the Lake'"",""""""Miller, R. Dewitt"""""","""",s4,"""",The Charleroi Mail de Charleroi (Pennsylvanie),1947-07-10,""Expert Gives Opinion On The Saucers"",""Krogh"","""",s5,"""",1984,11,Hessdalesrapporten,"""","""",s6,"""",1985,07,The Hessdalen Report,"""","""",s7,"""",1971,07,The Hessdalen Report",1870-03,sighting,https://rr0.org/time/1/8/7/0/index.html#1870-03
"en le samedi 20 août En , pluie de grands cristaux de sel dans une tempête de grêle","",1870-08,Suisse,,,,"",,"","""""""An. Rec. Sci., 1872 < The Complete Books of Charles Fort. New York"""""","""",s8,"""",""1974, p. 69 < Fitch, Donna K."",,Dover",1870-08,sighting,https://rr0.org/time/1/8/7/0/index.html#1870-08
"en Dans l', observations répétées d'une boule de feu mystérieuse.","",1870-09,état de New York,,,,"",,"",""""","""",s9,"""",""New York Times, 1870-09-25"",03,""A Remarkable Phenomenon""",1870-09,sighting,https://rr0.org/time/1/8/7/0/index.html#1870-09
"en le samedi 1 octobre Près de , observation d'un ballon hostile.","",1870-10,Paris,,,,"",,"",""""","""",s10,"""",""The Times, vendredi 7 octobre 1870, p. 4 < Theo Paijmans, Magonia Exchange"",2007-03-14,""Hostile Balloons""",1870-10,sighting,https://rr0.org/time/1/8/7/0/index.html#1870-10
"Hiver en le jeudi 1 décembre 1870 Observation d'une armée dans le ciel. La structure de givre photographiée par Clough & Kimball (Entré à la Librairie du Congrès en 1871.) Clough & Kimball (de ) réalisent une série de photos stéréoscopiques d'accumulations de givre au-sommet du Mont Washington. L'une d'elle, intitulée Architecture gelée et montrant un petit objet oblong (couteau, règle ?) posé sur la structure, sera interprêtée à tort comme un ovni en forme de cigare devant des nuages (Entré à la Librairie du Congrès en 1871.) (Dominique Caudron en propose l'explication).","",1870-12,"Concord, New Hampshire",,,,"",,"",""""","""",s11,"""",,1870-12-31,Article du St. Joseph Herald de Saint Joseph (Michigan),"""","""",s12,"""",The New York Library Digital Collections,1871,""Frost Architecture"","""","""",s13,"""",,,",1870-12,sighting,https://rr0.org/time/1/8/7/0/index.html#1870-12
"Dans l'Utah, pluie de varans.","",1870,,"",1870,sighting,https://rr0.org/time/1/8/7/0/index.html