url,place,time,description,sources,id,place.name,place.org.name,place.org.surname,place.org.title,place.org.time,place.org.deprecated,place.org.note,place.org.place,place.org.description,place.org.sources,place.org.notes,place.org.tags,place.org.image,place.org.id,place.org.dirName,place.org.url,place.org.events,place.org.type,place.org.parent,place.org.places,place.org.kind,place.place,place.org,place.place.name,place.place.surname,place.place.title,place.place.time,place.place.deprecated,place.place.note,place.place.place,place.place.description,place.place.sources,place.place.notes,place.place.tags,place.place.image,place.place.id,place.place.dirName,place.place.url,place.place.events,place.place.type,place.place.parent,place.place.locations,place.place.elevation,place.org.parent.name,place.org.parent.surname,place.org.parent.title,place.org.parent.time,place.org.parent.deprecated,place.org.parent.note,place.org.parent.place,place.org.parent.description,place.org.parent.sources,place.org.parent.notes,place.org.parent.tags,place.org.parent.image,place.org.parent.id,place.org.parent.dirName,place.org.parent.url,place.org.parent.events,place.org.parent.type,place.org.parent.parent.name,place.org.parent.parent.surname,place.org.parent.parent.title,place.org.parent.parent.time,place.org.parent.parent.deprecated,place.org.parent.parent.note,place.org.parent.parent.place,place.org.parent.parent.description,place.org.parent.parent.sources,place.org.parent.parent.notes,place.org.parent.parent.tags,place.org.parent.parent.image,place.org.parent.parent.id,place.org.parent.parent.dirName,place.org.parent.parent.url,place.org.parent.parent.events,place.org.parent.parent.type,place.org.parent.parent.parent.name,place.org.parent.parent.parent.surname,place.org.parent.parent.parent.title,place.org.parent.parent.parent.time,place.org.parent.parent.parent.deprecated,place.org.parent.parent.parent.note,place.org.parent.parent.parent.place,place.org.parent.parent.parent.description,place.org.parent.parent.parent.sources,place.org.parent.parent.parent.notes,place.org.parent.parent.parent.tags,place.org.parent.parent.parent.image,place.org.parent.parent.parent.id,place.org.parent.parent.parent.dirName,place.org.parent.parent.parent.url,place.org.parent.parent.parent.events,place.org.parent.parent.parent.type,place.org.parent.parent.parent.parent,place.org.parent.parent.parent.places,place.org.parent.parent.parent.kind,place.org.parent.parent.places,place.org.parent.parent.kind,place.org.parent.places,place.org.parent.kind,place.org.parent.parent.parent,place.org.parent.parent
https://rr0.org/time/1/9/5/4/10/05/index.html,Roverbello (Italie),,,,,,,,,,,,,,,,,"",place,,"",,1954-10-05,"A , 1 pêcheur rencontre un être vêtu de rouge qui parlait une langue inconnue.","Quincy,s1,"""",,",1954-10-05
https://rr0.org/time/1/9/5/4/10/05/index.html#1954-10-05T04:30,Loctudy (Finistère),,,,,,,,,,,,,,,,,"",place,,"",,1954-10-05T04:30,le rencontre de Pierre Lucas.,"",1954-10-05T04:30
https://rr0.org/time/1/9/5/4/10/05/index.html#1954-10-05T06:30,Mans (France),,,,,,,,,,,,,,,,,"",place,,"",,1954-10-05T06:30,"le À l'est du , sur la N23, des employés de chez Renault se rendant à leur travail voient près de la route 1 objet lumineux sur le sol. Ils ressentent alors des picotements et une sorte de paralysie. L'objet émet un jaillissement de lumière verte puis partit en volant très bas au-dessus des champs.","France-Soir,s2,"""",9 octobre 1954. Vuillequez,",1954-10-05T06:30
https://rr0.org/time/1/9/5/4/10/05/index.html#1954-10-05T07:15,Mertrud (France),,,,,,,,,,,,,,,,,"",place,,"",,1954-10-05T07:15,le rencontre.,"",1954-10-05T07:15
https://rr0.org/time/1/9/5/4/10/05/index.html#1954-10-05T15:45,Beaumont,,,,,,,,,,,,,,,,,"",place,,"",,1954-10-05T15:45,"le Des personnes se trouvant à 10 km de , près de Clermont-Ferrand (Puy-de-Dôme) décrivent un engin s'approchant d'elles en perdant de sa luminosité (devenir de plus en plus brillant ?). Lorsqu'il est à 150 m de ces personnes, celles-ci ressentent une curieuse sensation et son comme clouées sur place. Elles sentent également une odeur semblable à celle de la nitrobenzine.","Franc-Tireur,s3,"""",""La Croix, France-Soir, Le Figaro 7 octobre 1954"",,Vallée 1966,s4,"""",53,",1954-10-05T15:45
https://rr0.org/time/1/9/5/4/10/05/index.html#1954-10-05T23:00,la Rochelle,,,,,,,,,,,,,,,,,"",place,,"",,1954-10-05T23:00,"le Près de , M. et Mme Guillemoteau voient un engin de 2 à 3 m de hauteur et de 5 m de diamètre qui s'arrête à 1 m de haut, puis monte à la verticale. Des traces huileuses auraient été trouvées dans l'herbe.",",s5,""""""Vallée, J."""""",,1966",1954-10-05T23:00
https://rr0.org/time/1/9/5/4/10/05/index.html,,1954-10-05,"Dans la nuit : Joseph Roy (30 ans, mécanicien aux usines Panhard), roule à motocyclette à quelques mètres de la route de Reims à Rethel sur un chemin latéral, lorsqu'il voit face à lui une lueur vive et rougeâtre qui disparaît soudainement. Arrivé au point où il a vu la lueur, il remarque dans les champs un objet de 3 m de long, ayant la forme d'un gros obus, percé de hublots à l'avant. Il distingue également une vague silhouette. Pris de frayeur, il s'enfuit. 3 autres ouvriers auraient vu la même lueur au même endroit.","Un gros obus percé de hublots dans Le Lorrain (Nancy) Samedi 9-Dimanche 10 Octobre 1954,s6,"""",p. 7 < Sider 1997,",1954-10-05