description,events,id,place,sources,time,type,url,place.name,place.org,place.place.dirName,place.place.elevation,place.place.events,place.place.id,place.place.locations,place.org.dirName,place.org.events,place.org.id,place.org.kind,place.org.parent,place.org.places,place.org.type,place.place,place.org.parent.dirName,place.org.parent.events,place.org.parent.id,place.org.parent.kind,place.org.parent.parent,place.org.parent.places,place.org.parent.type,place.org.parent.parent.dirName,place.org.parent.parent.events,place.org.parent.parent.id,place.org.parent.parent.kind,place.org.parent.parent.parent,place.org.parent.parent.places,place.org.parent.parent.type,place.org.parent.parent.parent.dirName,place.org.parent.parent.parent.events,place.org.parent.parent.parent.id,place.org.parent.parent.parent.kind,place.org.parent.parent.parent.parent,place.org.parent.parent.parent.places,place.org.parent.parent.parent.type
"le , 2 personnes rentrant de leur travail aperçoivent une ""soucoupe volante"" qui décolle derrière l'église du village. En s'élevant rapidement, elle émet des rayons lumineux qui éblouissent les témoins. Cet engin sera vu de nouveau par 1 des 2 personnes au-dessus d'une forêt (Aucun autre témoignage et aucune trace derrière l'église ne seront recueillis).","",1980-09-03,"Pont-Audemer, Eure",,,,"",,"","""GEPAN"","""",s1,"""",,,",1980-09-03,sighting,https://rr0.org/time/1/9/8/0/09/index.html#1980-09-03
"le le vendredi 5 06:15 À , 1 témoin observe à 200 m dans le ciel 1 phénomène de forme circulaire estimé à 1 m de diamètre, émettant des faisceaux lumineux. L'observation dure 5 mn avant que le témoin ne reparte (Aucune manœuvre militaire n'a été effectuée sur ce secteur ce jour là). le vendredi 5 22:45 À Lannion, Côtes d'Armor, des témoins dans leur véhicule remarquent 2 boules rouges de la grosseur d'un poing au-dessus de la baie. Se rapprochant très rapidement du véhicule, les boules suivent la voiture même lors d'une accélération. Très lumineuses et laissant une trainée rouge, elles se rapprochent l'une de l'autre. Se réfugiant chez quelqu'un, toutes les personnes verront ces boules repartir vers la baie. Dans la nuit A Ampuis, Rhône, 1 fillette se lève pour refermer la fenètre de sa chambre ouverte par un coup de vent. Elle aperçoit dehors 1 phénomène lumineux dans le ciel à environ 100 m de son domicile. Ce phénomène est demi-arrondi, dégage une lumière très vive jaune orangée. Il est stationnaire à environ 150 m du sol. À plusieurs reprises, il va s'éteindre en laissant une lumière allumée à chaque extrémité. L'observation durera environ 30 mn sans que le phénomène ne touche le sol puis il s'éteindra définitivement.","",1980-09-05,"Jouy-le-Chatel, Seine-et-Marne",,,,"",,"","""GEPAN"","""",s2,"""",,,,""GEPAN"","""",s3,"""",,,,""GEPAN"","""",s4,"""",,,",1980-09-05,sighting,https://rr0.org/time/1/9/8/0/09/index.html#1980-09-05
"le à le mercredi 10 01:45, un témoin sur le pas de sa porte observe à 100 m sur le chemin menant à son domicile 1 lueur éclairant le panneau de signalisation. Aucune voiture et aucun bruit n'est entendu et le témoin aperçoit alors un phénomène de forme allongée qui avance par saccades à 1,50 m du sol. Le phénomène monte progressivement et disparaît dans le paysage.","",1980-09-09,"Bressuire, Deux Sèvres",,,,"",,"","""GEPAN"","""",s5,"""",,,",1980-09-09,sighting,https://rr0.org/time/1/9/8/0/09/index.html#1980-09-09
"le , des gendarmes en patrouille observent dans le ciel durant 1 heure et 30 minutes une boule lumineuse située au nord-est et se déplaçant lentement. Cette boule est de couleur jaune et présente des variations d'intensité. Le temps est très clair, la visibilité très bonne et sans Lune (Selon le GEPAN ces personnes ont fait une observation de Vénus, celle-ci étant particulièrement visible (magnitude 4,15) en cette période de l'année).","",1980-09-12T04:28,"Saint Ismier, Isère",,,,"",,"","""GEPAN"","""",s6,"""",,,",1980-09-12T04:28,sighting,https://rr0.org/time/1/9/8/0/09/index.html#1980-09-12T04:28
"le , 1 contôleur aérien en service observe à sa verticale 1 phénomène cylindrique noir est stationnaire, estimé à 300 m du sol environ, qui fait ensuite une brusque accélération et disparaît cap à l'est.","",1980-09-14T12:45,"Athis Mons, Essonne",,,,"",,"","""GEPAN"","""",s7,"""",,,",1980-09-14T12:45,sighting,https://rr0.org/time/1/9/8/0/09/index.html#1980-09-14T12:45
"le à le lundi 15 21:30, plusieurs personnes observent depuis leur domicile 1 point brillant plus gros qu'une étoile, changeant d'intensité et de couleur avant de disparaître au nord-ouest (Selon le GEPAN ces personnes ont probablement fait une observation astronomique d'Acturus particulièrement visible (magnitude 0,15) en cette période de l'année).","",1980-09-15T19:40,"Martigues, Bouches-du-Rhône",,,,"",,"","""GEPAN"","""",s8,"""",,,",1980-09-15T19:40,sighting,https://rr0.org/time/1/9/8/0/09/index.html#1980-09-15T19:40
"le la nuit à , de nombreux témoins, militaires, voient à plusieurs reprises des boules lumineuses se déplacer, avec des trajectoires variables, des disparitions et réapparitions soudaines. Le ciel était très couvert et le temps très orageux. Cette nuit-là, sur les pentes du Mont Ventoux voisin se déroule une course automobile. Bien que l'enquête ne l'ait pas démontré on peut envisager sérieusement l'hypothèse de reflets dans la nuit et sur les nuages bas des phares des voitures, les trajectoires diverses et les apparitions disparitions successives s'expliquant par la topographie du circuit automobile.","",1980-09-20,"Apt-Saint Christol, Vaucluse",,,,"",,"","""GEPAN"","""",s9,"""",,,",1980-09-20,sighting,https://rr0.org/time/1/9/8/0/09/index.html#1980-09-20
"Une trace qui aurait été laissée par un ovni en Australie le témoin, employé de ferme et gardien de, une propriété de 240 ha, est réveillé par le bruit que fait le bétail affolé ainsi que par un étrange sifflement aigu. Il se lève pour voir. Il n'y a pas de vent cette nuit-là, ni de Lune. Le témoin voit un objet en forme de dôme d'environ 4,50 m de haut et large de 7,50 m avec des lumières à son sommet, blanches, bleues et orangées. Il demeure quelque temps en vol stationnaire au-dessus d'un réservoir d'eau en béton, à environ 400 m de la maison, puis vient se poser 18 m plus loin. Le témoin enfourche une moto et arrive à moins de 15 m de l'engin. Il n'y a pas d'interférence avec son moyen de locomotion, mais le sifflement de l'ovni augmente soudainement jusqu'à devenir assourdissant. Il y a un énorme bang, puis la chose décolle. Au même moment, un souffle d'air chaud manque de jeter le témoin à terre. L'ovni laisse tomber quelques débris puis file en direction de l'est, à une hauteur du sol ne dépassant pas 30 m. Le témoin va examiner l'endroit tôt le lendemain matin. Il découvre un cercle d'herbes noircies, aplaties dans le sens contraire des aiguilles d'une montre. À l'intérieur du cercle se trouve de l'herbe verte, mais les fleurs qui y poussent ont disparu. Formant une ligne à l'est et à l'extérieur du cercle se trouve une traînée de débris - pierres, mauvaises herbes et bouses de vaches. Les jours qui suivent l'apparition, le témoin souffrira de maux de tête et de nausées, et sa montre refusera de fonctionner normalement. En outre, le réservoir au-dessus duquel l'ovni a stationné s'est vidé de 45 500 l d'eau.","",1980-09-30T01:00," White Acres, Rosedate, Victoria, Australie",,,,"",,"","",1980-09-30T01:00,sighting,https://rr0.org/time/1/9/8/0/09/index.html#1980-09-30T01:00
"William L. Moore rencontre son informateur Falcon. Lui et Stanton T. Friedman sont parvenus à interviewer 62 personnes en relation avec l'incident de Roswell, tels que Bill Brazel, Loretta Proctor et Jesse Marcel Junior.","",1980-09,,"",1980-09,sighting,https://rr0.org/time/1/9/8/0/09/index.html