description,events,eventType,id,place,sources,time,type,url,place.dirName,place.elevation,place.events,place.id,place.locations,place.name,place.org._parent,place.org.events,place.org.id,place.org.kind,place.org.places,place.org.type,place.org._parent._parent._parent._parent,place.org._parent._parent._parent.events,place.org._parent._parent._parent.id,place.org._parent._parent._parent.kind,place.org._parent._parent._parent.places,place.org._parent._parent._parent.type,place.org._parent._parent.events,place.org._parent._parent.id,place.org._parent._parent.kind,place.org._parent._parent.places,place.org._parent._parent.type,place.org._parent.events,place.org._parent.id,place.org._parent.kind,place.org._parent.places,place.org._parent.type,place.org._parent._parent,place.org._parent._parent._parent
"le à en 20, plusieurs témoins observent le déplacement à basse altitude d'un phénomène qui les intrigue. De forme circulaire ou rectangulaire selon les témoins, celui-ci émet des lumières. Il se déplace très lentement et sans aucun bruit en faisant des allers et retours. Des témoins vont observer cet objet plus de 15 minutes. Il disparait en direction de la Belgique. Lors de l'enquête, il sera constaté que ce soir-là, 1 avion belge, éclairé de façon particulière sur les ailes et le fuselage, trainait une publicité lumineuse.","",sighting,"1980-10-05T19:25$Wattrelos, Nord",,,"",,"","Wattrelos, Nord","""GEPAN"","""",s1,"""",,,PAN classé B",1980-10-05T19:25,event,https://rr0.org/time/1/9/8/0/10/index.html#1980-10-05T19:25
"le , une automobiliste aperçoit à environ 50 m de sa voiture, 1 phénomène émettant une lumière blanche de type néon. De la forme d'une fusée, ce dernier se déplace en arc de cercle au-dessus des arbres. Après un temps d'arrêt, le phénomène part à la verticale et apparaît au témoin comme une assiette renversée d'un diamètre de 1,50 m, puis disparaît totalement. Aucun bruit ne sera entendu durant l'observation.","",sighting,"1980-10-06T06:00$Montauban, Tarn et Garonne",,,"",,"","Montauban, Tarn et Garonne","""GEPAN"","""",s2,"""",,,PAN classé D",1980-10-06T06:00,event,https://rr0.org/time/1/9/8/0/10/index.html#1980-10-06T06:00
le Les contrôleurs d'approche de l' confondent pendant quelques minutes l'écho radar d'un ovni et celui du vol 402 en provenance de Pékin.,"",sighting,"1980-10-16T21:53$aéroport         de Tien Tsin, Chine,",,,"",,"","aéroport         de Tien Tsin, Chine,","",1980-10-16T21:53,event,https://rr0.org/time/1/9/8/0/10/index.html#1980-10-16T21:53
"le , plusieurs témoins voient arriver 2 phares puissants à une altitude d'environ 200 m. Lorsque les phares virent à gauche, les témoins observent un engin sombre en forme de coquille st jacques avec 2 feux rouges fixes sur les côtés. Le phénomène émet un bruit sourd (Selon le GEPAN il est très probable que les témoins ont vu un aéronef non identifié qui peut être un ballon dirigeable.).","",sighting,"1980-10-17T23:15$Saint Symphorien d'Ozon, Rhône",,,"",,"","Saint Symphorien d'Ozon, Rhône","""GEPAN"","""",s3,"""",,,PAN classé B",1980-10-17T23:15,event,https://rr0.org/time/1/9/8/0/10/index.html#1980-10-17T23:15
"le , 1 automobiliste dans une avenue aperçoit face à lui 1 disque de 10 m de diamètre, de couleur orangée et phosphorescent, portant de chaque coté des ailettes argentées de 1 m de long. Le phénomène est immobile et silencieux et estimé à 300 m du véhicule. Effrayé, l'automobiliste s'engage dans une autre rue, mais fait la même observation. Rentrant chez lui et racontant son observation à son épouse, celle-ci ne fera aucune constatation de ce type au dehors.","",sighting,"1980-10-21T02:45$Massy, Essonne",,,"",,"","Massy, Essonne","""GEPAN"","""",s4,"""",,,PAN classé C",1980-10-21T02:45,event,https://rr0.org/time/1/9/8/0/10/index.html#1980-10-21T02:45
"le , 1 témoin (pilote amateur) aperçoit depuis sa propriété plusieurs éclats lumineux dans le ciel lui faisant penser au gyrophare d'un aéronef. Il voit ensuite une flamme très lumineuse suivie d'une fumée noire. Aucun bruit n'est entendu. Pensant à un accident d'avion, il prévient la tour de contrôle la plus proche. Lors de l'enquête de gendarmerie aucun aéronef en difficulté n'a été signalé dans le secteur et aucun tir de fusée ne sera relevé dans les environs.","",sighting,"1980-10-26T10:35$Bourges, Cher",,,"",,"","Bourges, Cher","""GEPAN"","""",s5,"""",,,PAN classé C",1980-10-26T10:35,event,https://rr0.org/time/1/9/8/0/10/index.html#1980-10-26T10:35
"le à le samedi 1 novembre le soir à , 1 témoin observe 2 points fixes lumineux dans le ciel (Selon le GEPAN cette personne fait une observation de Vénus (magnitude -3,91) et de Jupiter (magnitude -1,31) particulièrement visibles en cette période de l'année).","",sighting,"1980-10-30$Couernon,     Loire-Atlantique",,,"",,"","Couernon,     Loire-Atlantique","""GEPAN"","""",s6,"""",,,PAN classé A",1980-10-30,event,https://rr0.org/time/1/9/8/0/10/index.html#1980-10-30
"le , 1 témoin à bord d'un train observe 2 points lumineux qui semblent suivre la marche du train.","",sighting,"1980-10-31T06:45$Nogent-sur-Marne, Val-de-Marne",,,"",,"","Nogent-sur-Marne, Val-de-Marne","""GEPAN"","""",s7,"""",,,PAN classé C",1980-10-31T06:45,event,https://rr0.org/time/1/9/8/0/10/index.html#1980-10-31T06:45