url,place,time,description,sources
https://rr0.org/time/1/9/5/3/04/index.html,,1953-04,"Dimanche magazine - Semaine du monde n° 24 du 18, titrant L'Allemagne et le Canada lançent des soucoupes volantes Allen Welsh Dulles renomme l'opération Artichoke en M-K-Ultra.",""
https://rr0.org/time/1/9/5/3/04/index.html,,1953-04,"A Fukuoka (Japon), le 1er lieutenant D. J. Pichon, alors qu'il pilote un intercepteur à réaction F-94B de l'USAF, observe une lumière bleu brillant descendre, accélérer, voler parallèlement au F-94, augmenter sa vitesse et clignoter avant de disparaître au bout de 45 s Cas Blue Book n° 2535 non résolu.",""
https://rr0.org/time/1/9/5/3/04/index.html,,1953-04,"A Tucson (Arizona), le sergent/S V. A. Locey observe durant 3 mn 30 s environ 3 lumières oranges Cas Blue Book n° 2542 non résolu.",""
https://rr0.org/time/1/9/5/3/04/index.html,,1953-04,Crash dans le Sud-Ouest de l'Arizona.,""
https://rr0.org/time/1/9/5/3/04/index.html,,1953-04,Promulgation de l'AFR 200-5.,""