description,events,eventType,id,place,sources,time,type,url,place.dirName,place.elevation,place.events,place.id,place.locations,place.name,place.sources,place.type
"le , plusieurs témoins dans des lieux différents ont fait l'observation d'une lumière très vive suivi de la chute d'un objet selon une trajectoire à 45 ° (Le phénomène est classé B et est identifié comme une probable rentrée atmosphérique).","",sighting,2002-10-08T22:20$PuiseauxLoiret,,,"",,"","Puiseaux, Loiret","",place,"""SEPRA"","""",s1,"""",,PAN classé B",2002-10-08T22:20,event,https://rr0.org/time/2/0/0/2/10/index.html#2002-10-08T22:20
"le Au-dessus de la , l'équipage d'un A320 effectuant un vol Lisbonne-Orly observe le passage très bref de 2 lumières très vives au dessus de leur appareil à une grande distance, estimée à plus de 35 km. La trajectoire est rapide, descendante. L'observation est probablement celle d'une rentrée atmosphérique, d'ailleurs identifiée comme telle par l'équipage.","",sighting,2002-10-16T19:30Z$LoireAtlantiquePaysDeLa					Loire,,,"",,"","Loire Atlantique, Pays de la 					Loire","",place,"""SEPRA"","""",s2,"""",,PAN classé B",2002-10-16T19:30Z,event,https://rr0.org/time/2/0/0/2/10/index.html#2002-10-16T19:30Z
"le , 2 témoins observent un groupe de 7 objets sombres animés d'un mouvement rotatif les uns par rapport aux autres. L'ensemble se déplace à faible vitesse et sans bruit. Le phénomène est observé pendant 10 mn environ.","",sighting,2002-10-20T18:40$AnnecyHauteSavoie,,,"",,"","Annecy, Haute Savoie","",place,"""SEPRA"","""",s3,"""",,PAN classé D",2002-10-20T18:40,event,https://rr0.org/time/2/0/0/2/10/index.html#2002-10-20T18:40
"le 4 scientifiques mandatés par l'Institut d' tentent de se rendent sur les lieux de l'explosion du 25 septembre, sans succès (neige, crue du fleuve).","",sighting,2002-10-21$Irkoutsk,,,"",,"",Irkoutsk,"",place,"",2002-10-21,event,https://rr0.org/time/2/0/0/2/10/index.html#2002-10-21
"le , 1 témoin observe 1 objet en forme de triangle de dimension apparente de 40 à 50 cm avec des feux aux sommets et circulant à vitesse constante selon une trajectoire rectiligne et sans aucun bruit.","",sighting,2002-10-29T19:00$LezignanAude,,,"",,"","Lezignan, Aude","",place,"""SEPRA"","""",s4,"""",,PAN classé C",2002-10-29T19:00,event,https://rr0.org/time/2/0/0/2/10/index.html#2002-10-29T19:00