url,place,time,description,sources,id,place.name,place.org.dirName,place.org.code,place.org.places,place.org.kind,place.org.parent,place.place,place.org,place.place.locations,place.place.elevation,place.place.dirName,place.place.events,place.org.parent.dirName,place.org.parent.code,place.org.parent.places,place.org.parent.kind,place.org.parent.parent.dirName,place.org.parent.parent.code,place.org.parent.parent.places,place.org.parent.parent.kind,place.org.parent.parent.parent.dirName,place.org.parent.parent.parent.code,place.org.parent.parent.parent.places,place.org.parent.parent.parent.kind,place.org.parent.parent.parent.parent,place.org.parent.parent.parent,place.org.parent.parent
https://rr0.org/time/1/9/2/9/index.html#1929-01,,1929-01,Henri Pensa suggère que les "météores" observés 3 nuits de suite au-dessus des montagnes de Rhodez soient des signaux envoyés par Mars.,"""Mars Signals Are Again Reported"",s1,"""",""Intelligencer de Edwardsville (Illinois), 25 janvier 1929, p. 2"",",1929-01
https://rr0.org/time/1/9/2/9/index.html#1929-03,Velp (Pays Bas),,"",,,,1929-03,"le mercredi 9 19:15 A , observation au nord-est d'une boule de feu suivie plusieurs autres plus petites et d'une trainée rougeâtre.","""De Vuurbol"",s2,"""",""Het Vaderland (Pays Bas), édition du soir"",",1929-03
https://rr0.org/time/1/9/2/9/index.html#1929-04,Ward (Colorado),,"",,,,1929-04,"Photo prise en avril par Edward Pline A où vit Edward Pline avec sa famille, ce dernier s'apprête à photographier la scierie, quand intervient ce qu'il décrira comme un beuglement tonitruant terrible alors qu'une chose ronde aussi grande qu'un très gros rocher se déplace en l'air au-dessus des gens. Aucun des employés de la scierie ne voit l'objet, mais ils entendent tous le son et sentirent le sol frisonner. Pline décède quelques années seulement après l'incident. le dimanche 20 05 h A 250 miles environ à l'ouest des Hébrides externes, ou à 300 miles à l'ouest la côte écossaise ouest (58,10 nord et 14,30 ouest), un chalutier britannique voit passer, hors de toute limite des vols d'essais de l'époque, un avion se dirigeant vers l'est.","Hetty Pline,s3,"""",""fille de Edward Pline, photographe"",,""Trawler Sights an Airplane Flying Far West of Scotch Coast"",s4,"""",""Daily Northwestern de Oshkosh (WI), 20 avril 1929, p. 1"",,""Report Aiplane Out on Atlantic"",s5,"""",""Lincoln (NE) Evening State Journal, samedi 20 avril 1929, p. 1"",,""Mystery Plane Is Sighted Over North Atlantic"",s6,"""",Gazette de Billings (Montana),",1929-04
https://rr0.org/time/1/9/2/9/index.html#1929-05,Açores,,"",,,,1929-05,"le mardi 30 A 500 miles des îles , un navire de ligne observe un phénomène lumineux qu'il prend pour un avion.","""Captain of Liner Tells of Sighting Mystery Airplane"",s7,"""",""Herald de Syracuse (New York), 1er juin 1929"",",1929-05
https://rr0.org/time/1/9/2/9/index.html,,1929,"Aux USA, crise boursière et économique majeure.","",1929
https://rr0.org/time/1/9/2/9/index.html#1929-06,Fermeneuve (Canada),,"",,,,1929-06,"le mercredi 12 23 h Couverture de Science Wonder Stories n° 6 de 11 A , M. Levis Brosseau (20 ans) rentre chez lui quand il voit 1 objet sombre avec une lumière jaune. Son cheval devient très nerveux. A moins de 6 m de l'objet 4 ou 5 silhouettes naines courent dans tous les sens. Il entend leurs voix enfantines aiguës puis voit l'objet sombre s'en aller avec un son semblable à celui d'une machine, et un déplacement d'air. Taille estimée de l'objet : 15 m de diamètre et 5 m de haut. le dimanche 16 23 h A Vienne (Autriche), article sur la possibilité de découverte d'autres mondes habités.","Collection Les Treece-Sainclair < UFOPOP,s8,"""",,,""Fermeneuve,s9,"""",""15 juin 1929"""" in """"Observations canadiennes d'hier et d'aujourd'hui"""", Phénomènes Spatiaux n° 18, décembre 1968, pp. 17-22"",,""Konnen win bewohnte Welter entolecken?"",s10,"""",Wiener Bilder,",1929-06
https://rr0.org/time/1/9/2/9/index.html#1929-07,"Robsart (Saskatchewan, Canada)",,"",,,,1929-07,"A , 5 personnes, dont M. Einar Rostivold, voient 1 énorme boule dont émane 1 lumière aux couleurs ardentes. Cela se passe à 25 km de cette ville. Elle atterrit lentement, s'évanouit graduellement après avoir illuminé la région entière pendant 30 mn. Fin du mois (1929, 1930 ou 1935) A Casablanca, Marcel Clairac, Conseiller (H) de la Cour de Rabat, rapport du 11/12/1969, Jean Clairac, pilote de la ligne Latécoère Toulouse-Cap Juby, observe ,durant 10 mn à haute altitude, à la verticale des rues Marseille et Bouskoura, 20 gros cigares de la taille d'un zeppelin, progressant d'est en ouest assez rapidement en formation triangulaire, pointe en avant.","Fate,s11,"""",janvier 1958,,,s12,"""",,,,s13,"""",,",1929-07
https://rr0.org/time/1/9/2/9/index.html#1929-08,,1929-08,Couverture de Science Wonder Stories cette mois-là,"",1929-08
https://rr0.org/time/1/9/2/9/index.html#1929-12,,1929-12,le samedi 7 Couverture de Argosy cette semaine-là,"",1929-12