description,events,id,place,sources,time,type,url,place.name,place.org,place.place.dirName,place.place.elevation,place.place.events,place.place.id,place.place.locations,place.org.dirName,place.org.events,place.org.id,place.org.kind,place.org.parent.dirName,place.org.parent.events,place.org.parent.id,place.org.parent.kind,place.org.parent.parent.dirName,place.org.parent.parent.events,place.org.parent.parent.id,place.org.parent.parent.kind,place.org.parent.parent.parent,place.org.parent.parent.places,place.org.parent.parent.type,place.org.parent.places,place.org.parent.type,place.org.places,place.org.type,place.org.parent,place.place,place.org.parent.parent
"En , une équipe de sauveteurs partie à la recherche de 3 alpinistes dont on n'avait plus de nouvelles retrouve après des jours pénibles d'efforts les empreintes des 3 hommes. Ils les suivent et constatent qu'elles s'arrêtent au centre d'un plan neigeux. Aucune crevasse ne pouvait les avoir engloutis et au-delà, la neige restait vierge de toute empreinte. Cependant, à partir des dernières traces, on découvre 3 trous irréguliers formant un triangle équilatéral de 12,80 m de côté. L'enquête concluera à une triple disparition dans des circonstances que les faits ne permettent pas d'établir clairement.","",1941$org_ch,Suisse,org/ch,"",ch,country,,"",org,,"""""""Schweizer Zeitung < Kolosimo, P."""""","""",s1,"""",Vallée,1965,1958 < Guieu",1941,sighting,https://rr0.org/time/1/9/4/1/index.html
en Invasion allemande de l'Union Soviétique. Les allemands testeraient un prototype de disque volant Schriever-Habermohl Model I.,"",1941-06,,"",1941-06,sighting,https://rr0.org/time/1/9/4/1/index.html#1941-06
"Début de l'été en 13 C'était au , au début de l'été 1941. La Luftwaffe avait occupé l'ancien aérodrome du Mans, au Circuit de la Sarthe, et entretenait plusieurs groupes de Messerschmitt 109, pas très rapides, mais excessivement maniables. Les pilotes allemands étaient en état d'alerte permanente et, plusieurs fois, j'ai observé d'assez près à des envolées en groupes des Messerschmitt en plein jour. Il faisait un temps magnifique, un dimanche autant que je me souvienne, et vers 13 h, le ciel très dégagé ne contenait que quelques gros cumulus, nuages d'ailleurs très écartés les uns des autres. Vers 13 h, toute la ville entendit le vacarme des avions s'envolant en hâte et je pus voir que la cause de l'alerte semblait être dans un des gros cumulus qui, à ce moment, survolait très lentement le terrain d'aviation. On pouvait voir les Messerschmitt tournoyer comme affolés autour du nuage, piquer dedans à toute vitesse, en ressortir en chandelle ou de travers, et recommencer leurs manœuvres, spectacle véritablement très joli, mais qui devait être terriblement dangereux pour les pilotes. S'agissait-il d'un exercice ordonné par le commandant du camp ou d'une alerte ? Je ne l'ai jamais su, mais il était curieux d'observer les airs terrifiés des soldats et officiers allemands casernés en ville, qui suivaient le spectacle des fenêtres des maisons. Je pus alors observer que le nuage qui, à son arrivée, semblait avoir sa base vers 300 m et culminer vers 1000 m, se mit à bourgeonner et, quand il s'écarta de l'aérodrome pour s'éloigner de la ville, il avait pris la forme d'une pyramide très haute, à coutours parfaitement nets et brillamment éclairés par le soleil ; sa pointe très aiguë devait se trouver probablement vers 3000 m, d'après une hauteur visible sur l'horizon et sa place probable sur le terrain. Mon point d'observation était à 4 km du terrain d'aviation et le nuage était environ à 5 km quand j'observais son sommet.","",1941,Mans (France),,,,"",,"",""""","""",s2,"""",,,",1941,sighting,https://rr0.org/time/1/9/4/1/index.html
"en Un scientifique allemand passe aux USA, révélant le secret d'une soucoupe récupérée par les allemands en 1937. Le renseignement militaires des USA, sous le nom de code Oz, s'empare de l'installation nazie contenant le disque, et le rapporte aux USA, manquant de peu les troupes soviétiques, qui apprendront l'existence du disque 6 mois plus tard (probablement de scientifiques allemands capturés).","",1941-07,,"",1941-07,sighting,https://rr0.org/time/1/9/4/1/index.html#1941-07
"en à en août (ou en juillet 1942 à en août 1942) en 23 A , Irene Skram et sa cousine voient un disque argenté. Il s'élève du sol au Sud-Est des témoins, à environ 300 m de là. 3 faisceaux gris suivent le disque, tournant sur leur propre axe. Il monte doucement à une hauteur de 100 m environ, lorsqu'il semble descendre à nouveau, et les 3 bobines suivant le disque tombent à environ 100 m au nord de la maison des témoins. Le disque disparaît. 2 hommes, qui ont également vu le disque (le mari de la cousine et son ami) arrivent pour récupérer les bobines, et ramènent 3 meules de foin. Rien ne semble étrange sur ces meules. Il demandent à leur voisin au Sud sans lui parler du disque, et celui-ci confirme que 3 meules de foin manquent dans sa propriété. L'objet a été observé durant 2 mn, et sa taille était d'environ 10 m de diamètre. Le diamètre de chaque meule est de 12 à 15 m, et la séparation entre chaque est de 5 à 6 m.","",1941-07,Marøy/Nordhordland (Norvège),,,,"",,"",""""","""",s3,"""",,06,UFO report form,"""","""",s4,"""",5/1966,188-09,UFO-NYT,""Bertelsen"","""",s5,"""",1980,65,UFO-80.,""Liljegren"","""",s6,"""",1987,08,A bibliography of references to UFO incidents during World War II",1941-07,sighting,https://rr0.org/time/1/9/4/1/index.html#1941-07
en en 7 Attaque japonaise de. en 8 Roosevelt demande au Congrès US de déclarer la guerre au Japon et oriente tout l'effort national vers la guerre globale.,"",1941-12,Pearl Harbor,,,,"",,"","",1941-12,sighting,https://rr0.org/time/1/9/4/1/index.html#1941-12
"Automne A , un parent de Berit Clemmensen est avec quelques amis au cinéma local. La nuit est claire et pleine d'étoiles. Soudain ils voient un phénomène lumineux à l'Ouest, se dirigeant vers le Nord-Ouest à grande vitesse. On peu le décrire comme une boule de feu lumineuse, ressemblant à un bolide à première vue. Il semble voler très bas au-dessus de Osterfjorden. Il est visible durant au moins 1/2 minute, et aucun son n'est entendu. Les témoins sont assez excités par cette expérience.","",1941,Skår/Osterøy (Norvège),,,,"",,"",""""","""",s7,"""",2/1992,09,UFO",1941,sighting,https://rr0.org/time/1/9/4/1/index.html