description,events,id,place,sources,time,type,url,place.name,place.org,place.place.dirName,place.place.elevation,place.place.events,place.place.id,place.place.locations,place.org.dirName,place.org.events,place.org.id,place.org.kind,place.org.parent,place.org.places,place.org.type,place.place,place.org.parent.dirName,place.org.parent.events,place.org.parent.id,place.org.parent.kind,place.org.parent.parent.dirName,place.org.parent.parent.events,place.org.parent.parent.id,place.org.parent.parent.kind,place.org.parent.parent.parent,place.org.parent.parent.places,place.org.parent.parent.type,place.org.parent.places,place.org.parent.type,place.org.parent.parent
"en le vendredi 19 février A , un météore tombe, dégageant une odeur infecte le dimanche 28 février Au large des côtes du Nord de la Californie, une partie de l'équipage de l'USS Supply, ravitailleur de la flotte du pacifique, dirigée par Frank H. Schofield, peut suivre les évolutions d'objets ressemblants à des météores et se précipitant par petits groupes serrés vers son navire. Les trajectoires des objets rouges brillants sont imprévisibles, piquant puis tout à coup rebondissant vers les nuages avant de disparaître à l'ouest-nord-ouest. Schofield s'est essayé à les décrire : l'un, en forme d'oeuf, semble mener l'escadrille, était 6 fois plus volumineux que le Soleil. D'autres sont de la taille du Soleil.","",1904-02,Janesville,,,,"",,"",""""","""",s1,"""",""The Janesville Daily Gazette, 1904-02-20"",04,""Meteor Strikes Near the City"","""","""",s2,"""",,,,"""","""",s3,"""",,,",1904-02,sighting,https://rr0.org/time/1/9/0/4/index.html#1904-02
"En , un fermier se trouve aux champs (...). Il voit soudain une roue de feu au-dessus des montagnes Muntii Apuseni. La roue s'approche à grande vitesse. Le fermier regarde, impuissant. Quand la roue est près de lui, elle se transforme en être vivant qui le fixe un long moment sans rien dire.","",1904,Transylvanie (Roumanie),,,,"",,"",""""","""",s4,"""",,1965,",1904,sighting,https://rr0.org/time/1/9/0/4/index.html
"A , Tom Darby, en compagnie de son frère et de sa mère, voit 2 objets d'un blanc bleuté à 400 m de distance, d'un point situé à 3 km au nord de cette ville. Ces objets planent à 2 ou 3 m au-dessus du sol, se dirigent vers une grange, se rapprochent l'un de l'autre, et on les perd de vue derrière une colline.","",1904,Rolling Prairie (Indiana),,,,"",,"",""""","""",s5,"""",,164,",1904,sighting,https://rr0.org/time/1/9/0/4/index.html
"en Début du mois Près des côtes du Maine, 3 navires voient un serpent de mer.","",1904-07,,"""""""Pharon, G. Wilfred"""""","""",s6,"""",The Sun de New York (New York),1904-07-10,""The Sea Serpent""",1904-07,sighting,https://rr0.org/time/1/9/0/4/index.html#1904-07
"en le lundi 1 août Dans l'Atlantique, le navire britannique Mohican en route pour Philadelphie alors qu'il making for le brise-lames Delaware est enveloppé d'un étrange nuage épais gris phosphorescent, magnétisant tout à bord.","",1904-08,,""""","""",s7,"""",San Francisco Call,1904-08-23,""A Good One"","""","""",s8,"""",,1904-09-23,Iowa City Daily Press,"""","""",s9,"""",Washington Times,02,""Ship Clad In Vapor Frightens the Crew"","""","""",s10,"""",""Washington Times, 1904-08-19"",05,""Liner Made a Magnet By Phosphoric Cloud"","""","""",s11,"""",Washington Bee,1904-09-03,""Ship Is Magnetized""",1904-08,sighting,https://rr0.org/time/1/9/0/4/index.html#1904-08
"en le samedi 10 décembre 1904 à 18 h A , on observe dans le ciel une lumière mystérieuse au sud de la ville. Certains l'évaluent à 2000 pieds d'altitude et pratiquement aussi brillante qu'une lumière à arc. Au bout de 30 mn elle disparaît vers le sud.","",1904-12,Tiffin (Ohio),,,,"",,"",""""","""",s12,"""",Standard d'Anaconda (Montana),1904-12-11,""Moonshine?""",1904-12,sighting,https://rr0.org/time/1/9/0/4/index.html#1904-12