description,events,eventType,id,place.dirName,place.elevation,place.events,place.id,place.locations,place.name,place.sources,place.type,sources,time,type,url,place
", 1 témoin observe en rentrant chez lui 1 point lumineux à l'horizon qui se déplace très lentement. Cette observation dure 50 mn environ. Le témoin va filmer le phénomène qui présente effectivement un point blanc très lumineux.","",sighting,1996-04-01T23:40$VerdunMeuse,,,"",,"",Verdun (Meuse),"",place,"""SEPRA"","""",s1,"""",,Cas de type C",1996-04-01T23:40,event,https://rr0.org/time/1/9/9/6/04/index.html#1996-04-01T23:40
", 1 témoin en voiture observe quelques instants 1 boule de feu avec une traînée chuter vers le sol. Le phénomène était silencieux et la boule s'est éteinte subitement en devenant rouge sombre. La description faite par le témoin correspond à l'observation d'une rentrée atmosphérique.","",sighting,1996-04-08$RodilhanGard,,,"",,"",Rodilhan (Gard),"",place,"""SEPRA"","""",s2,"""",,PAN classé B",1996-04-08,event,https://rr0.org/time/1/9/9/6/04/index.html#1996-04-08
un témoin observe depuis son appartement un objet volant de forme cylindrique avec au-dessous des lumières clignotantes. Le phénomène était silencieux et se déplaçait moins vite qu'un avion. Sa trajectoire rectiligne est ensuite devenue ascendante après un demi-tour. La durée totale de l'observation est de l'ordre de 10 mn.,"",sighting,1996-04-20T22:20$CagnySeineSaintDenis,,,"",,"",Cagny (Seine-Saint-Denis),"",place,"""GEPAN"","""",s3,"""",,Cas de type C",1996-04-20T22:20,event,https://rr0.org/time/1/9/9/6/04/index.html#1996-04-20T22:20
"Mme Terezinha Gallo Clepf (67 ans) qui dîne avec des amis au restaurant du jardin zoologique de Varginha (Brésil), quitte la table pour fumer une cigarette sous la véranda. Elle frôle alors la crise cardiaque en se trouvant nez à nez avec une créature correspondant à signalement des deux créatures capturée 01-20.","",sighting,1996-04-21T21:00$,,"",1996-04-21T21:00,event,https://rr0.org/time/1/9/9/6/04/index.html#1996-04-21T21:00
Le module Priroda s'amarre à Mir.,"",sighting,1996-04-27$,,"",1996-04-27,event,https://rr0.org/time/1/9/9/6/04/index.html#1996-04-27