url,place,time,description,sources,id,place.name,place.org.name,place.org.surname,place.org.title,place.org.time,place.org.deprecated,place.org.note,place.org.place,place.org.description,place.org.sources,place.org.tags,place.org.image,place.org.id,place.org.dirName,place.org.url,place.org.events,place.org.type,place.org.places,place.org.kind,place.org.parent,place.place,place.org,place.place.name,place.place.surname,place.place.title,place.place.time,place.place.deprecated,place.place.note,place.place.place,place.place.description,place.place.sources,place.place.tags,place.place.image,place.place.id,place.place.dirName,place.place.url,place.place.events,place.place.type,place.place.locations,place.place.elevation,place.org.parent.name,place.org.parent.surname,place.org.parent.title,place.org.parent.time,place.org.parent.deprecated,place.org.parent.note,place.org.parent.place,place.org.parent.description,place.org.parent.sources,place.org.parent.tags,place.org.parent.image,place.org.parent.id,place.org.parent.dirName,place.org.parent.url,place.org.parent.events,place.org.parent.type,place.org.parent.places,place.org.parent.kind,place.org.parent.parent.name,place.org.parent.parent.surname,place.org.parent.parent.title,place.org.parent.parent.time,place.org.parent.parent.deprecated,place.org.parent.parent.note,place.org.parent.parent.place,place.org.parent.parent.description,place.org.parent.parent.sources,place.org.parent.parent.tags,place.org.parent.parent.image,place.org.parent.parent.id,place.org.parent.parent.dirName,place.org.parent.parent.url,place.org.parent.parent.events,place.org.parent.parent.type,place.org.parent.parent.places,place.org.parent.parent.kind,place.org.parent.parent.parent.name,place.org.parent.parent.parent.surname,place.org.parent.parent.parent.title,place.org.parent.parent.parent.time,place.org.parent.parent.parent.deprecated,place.org.parent.parent.parent.note,place.org.parent.parent.parent.place,place.org.parent.parent.parent.description,place.org.parent.parent.parent.sources,place.org.parent.parent.parent.tags,place.org.parent.parent.parent.image,place.org.parent.parent.parent.id,place.org.parent.parent.parent.dirName,place.org.parent.parent.parent.url,place.org.parent.parent.parent.events,place.org.parent.parent.parent.type,place.org.parent.parent.parent.places,place.org.parent.parent.parent.kind,place.org.parent.parent.parent.parent,place.org.parent.parent.parent,place.org.parent.parent
https://rr0.org/time/1/9/5/6/07/index.html#1956-07-01,,1956-07-01,"le Affiche de Earth versus the Flying Saucers, sorti le 1er Sortie de Earth versus the Flying Saucers, prétendumment basé sur le livre Flying Saucers From Outer Space de Donald E. Keyhoe qui, en réalisant qu'il s'agissait d'une œuvre de fiction, aurait demandé à être enlevé des crédits.","""Guest blogger: Robert Barrow"",s1,""""""Barrow, R."""""",Silver Screen Saucers,-26",1956-07-01
https://rr0.org/time/1/9/5/6/07/index.html#1956-07-17,Natal (Afrique du Sud),,,,,,,,,,,,,,,,"",place,"",,1956-07-17,"le , Elizabeth Klarer dit avoir été contactée par des extraterrestres et emmenée sur Vénus, où elle aurait respiré l'air pur vénusien. 4 photos noir et blanc d'une assiette Spin-O-Reno (Un jouet que l'on fait tourner en équilibre sur un bâton comme dans certains numéros de cirque) jettée en l'air accompagnent son signalement. Elle dit avoir un message des extraterrestres indiquant que la Terre doit arrêter les essais nucléaires et former un gouvernement mondial socialiste.","",1956-07-17
https://rr0.org/time/1/9/5/6/07/index.html#1956-07-19,San Bernardino (Californie),,,,,,,,,,,,,,,,"",place,"",,1956-07-19,"le La photo prise a San Bernardino. Un objet tenu près de l'objectif par la gauche ? À , Michael Savage (15 ans) est étendu sur l'herbe à prendre des photos avec son nouvel appareil, lorsqu'un objet en forme de soucoupe gris argenté passe à ce qu'il estime 600 yards de distance, sans qu'il entende aucun bruit. Il en prend une photo qui, soumise au projet Blue Book, sera considérée comme un canular réalisé en tenant l'objet par la gauche, très prêt de l'objectif.","""Project 10073 Record Card"",s2,"""",Blue Book < Black Vault,",1956-07-19
https://rr0.org/time/1/9/5/6/07/index.html#1956-07-22,,1956-07-22,"le à le lundi 23 Paris Match n° 381 du 28 (27?) juillet, titrant : Exclusif : Photos de la soucoupe volante française Dans la nuit, un bimoteur C-131 est télescopé par une sorte d'objet rapide et lourd, comme le déclarera par la suite son pilote, le commandant Stenvers, qui en ressort par une chance inouïe. Seule la queue avait reçu le choc et aucun blessé ne fut à déplorer. Quelque chose d'inconnu avait heurté cet avion par en dessous. Selon les enquêteurs, ce vétéran, titulaire de plusieurs milliers de vols, se trompait : les rivets des plans de queue sautèrent tout seuls... Autrement dit, les rivets firent une depression, rompirent toute relation avec le Convair pour faire leur vie, sans doute...","",1956-07-22
https://rr0.org/time/1/9/5/6/07/index.html#1956-07-26,canal de Suez,,,,,,,,,,,,,,,,"",place,"",,1956-07-26,le Nasser nationalise le.,"",1956-07-26