url,place,dateTime,description,sources,id,place.name,place.org,place.place.locations,place.place.elevation,place.place.dirName,place.place.data
https://rr0.org/time/1/9/9/7/05/index.html,,1997-05,Crop circle ce mois-là à Burderop Down Apparition d'un crop circle (ci-contre) dans un champ de colza à Burderop Down (Wiltshire).,"",1997-05
https://rr0.org/time/1/9/9/7/05/index.html,,1997-05,"A Meilleraye-de-Bretagne (Loire Atlantique), un couple rentrant de leur travail observe 1 point plus lumineux que les étoiles dans le ciel. Ce point s'approche à vitesse élevée et les témoins peuvent observer une masse lumineuse importante et plutôt ronde qui passe juste au-dessus du lotissement et a disparait vers le sud. Un bruit de déplacement d'air est perçu au moment du passage du phénomène. La durée totale de l'observation est de l'ordre de 5 mn SEPRA: PAN classé D.","",1997-05
https://rr0.org/time/1/9/9/7/05/index.html,,1997-05,"Au-dessus de la Charente (Poitou Charentes), le pilote d'un boeing 767 à destination de Londres signale la descente d'un objet venant au dessus de lui qui change de direction SEPRA: PAN classé C.","",1997-05
https://rr0.org/time/1/9/9/7/05/index.html,,1997-05,"Le ministre belge de la Défense, Jean-Pol Poncelet, annonce officiellement le classement du dossier ouvert suite à la vague d'observations de 1989-1993. Motif : la signature captée par les radars des F-16 serait finalement celle d'un phénomène naturel lié à des écarts de température. Par conséquent, les centaines de témoignages doivent ""probablement"" se rapporter à l'observation du prototype LoFlyte. Déclaration des responsables américains du projet LoFlyte : le prototype n'est jamais sorti du territoire des Etats-Unis.","",1997-05
https://rr0.org/time/1/9/9/7/05/index.html,,1997-05,"(ou 25) A Gaillac (Tarn), 1 témoin observe pendant quelques s des traits lumineux avec une petite trainée à 2 endroits différents SEPRA: PAN classé C.","",1997-05