description,events,id,place,sources,time,type,url,place.name,place.org,place.place.dirName,place.place.elevation,place.place.events,place.place.id,place.place.locations,place.org.dirName,place.org.events,place.org.id,place.org.kind,place.org.parent.dirName,place.org.parent.events,place.org.parent.id,place.org.parent.kind,place.org.parent.parent.dirName,place.org.parent.parent.events,place.org.parent.parent.id,place.org.parent.parent.kind,place.org.parent.parent.parent,place.org.parent.parent.places,place.org.parent.parent.type,place.org.parent.places,place.org.parent.type,place.org.places,place.org.type,place.org.parent,place.place,place.org.parent.parent
"le , 54 cibles radar pendant 1 h 39 mn ?.","",1957-02-07T03:53-07,Las Cruces (Nouveau-Mexique),,,,"",,"",""""","""",s1,"""",,,Liste de McDonald",1957-02-07T03:53-07,sighting,https://rr0.org/time/1/9/5/7/02/index.html#1957-02-07T03:53-07
"le à le mardi 12 Au dessus de , après des secousses telluriques, on voit dans le ciel des formes lumineuses qui laissent derrière elles une traînée de vapeur et avancent à des vitesses extraordinaires.","",1957-02-11,Mansfield,,,,"",,"","",1957-02-11,sighting,https://rr0.org/time/1/9/5/7/02/index.html#1957-02-11
"le le mercredi 13 02:30 Le Directeur des Opérations de l'USAF et 3 contrôleur de tour sur 2 sites radar, le GCA et le NCOIC, repèrent plusieurs cibles volant derrière 1 avion de ligne à une distance de 8 km à 10 km, se déplaçant 2 fois plus vite. Aucune réponse IFF. Les phénomènes peuvent rester stationnaires ou se déplacer à grande vitesse. L'un d'eux se sépare en 2 cibles, un fait apparemment un virage à 180°. Les blips sont de la taille d'un B­47. L'observation dure entre en 5 [25 mn] ?. le mercredi 13 04:40 À l'AFS de , Meyer, pendant 2 heures. le mercredi 13 20 h À Marrero (Louisiane), Martin, pendant 1 h 40 mn.","",1957-02-13,Tierra Amarilla (Nouveau-Mexique),,,,"",,"","""""""Hynek, J. A."""""","""",s2,"""",chg. 7,-7,The UFO Experience,"""","""",s3,"""",,,Liste de McDonald ,"""","""",s4,"""",,,Liste de McDonald",1957-02-13,sighting,https://rr0.org/time/1/9/5/7/02/index.html#1957-02-13
"À , la police reçoit de nombreux appels à propos de phénomènes de forme ovale au-dessus de la ville. L'officier Robert Wells, parti enquêter, confirme l'observation.","",1957-02,Burbank (Californie),,,,"",,"",""""","""",s5,"""",12,,UFO Evidence",1957-02,sighting,https://rr0.org/time/1/9/5/7/02/index.html
le à le mardi 19 L'USAF donne une conférence sur l'endoctrinement ovni pour les représentants D/I.,"",1957-02-18,,""""","""",s6,"""",,,",1957-02-18,sighting,https://rr0.org/time/1/9/5/7/02/index.html#1957-02-18
"A la base aérienne de , détection pendant 24 secondes de 9 cibles radar non-identifiées.","",1957-02,Castle (Californie),,,,"",,"",""""","""",s7,"""",,,Liste de McDonald",1957-02,sighting,https://rr0.org/time/1/9/5/7/02/index.html