url,place,time,description,sources,id,place.name,place.org.name,place.org.surname,place.org.title,place.org.time,place.org.deprecated,place.org.note,place.org.place,place.org.description,place.org.sources,place.org.notes,place.org.tags,place.org.image,place.org.id,place.org.dirName,place.org.url,place.org.events,place.org.type,place.org.parent,place.org.places,place.org.kind,place.place,place.org,place.place.name,place.place.surname,place.place.title,place.place.time,place.place.deprecated,place.place.note,place.place.place,place.place.description,place.place.sources,place.place.notes,place.place.tags,place.place.image,place.place.id,place.place.dirName,place.place.url,place.place.events,place.place.type,place.place.parent,place.place.locations,place.place.elevation,place.org.parent.name,place.org.parent.surname,place.org.parent.title,place.org.parent.time,place.org.parent.deprecated,place.org.parent.note,place.org.parent.place,place.org.parent.description,place.org.parent.sources,place.org.parent.notes,place.org.parent.tags,place.org.parent.image,place.org.parent.id,place.org.parent.dirName,place.org.parent.url,place.org.parent.events,place.org.parent.type,place.org.parent.parent.name,place.org.parent.parent.surname,place.org.parent.parent.title,place.org.parent.parent.time,place.org.parent.parent.deprecated,place.org.parent.parent.note,place.org.parent.parent.place,place.org.parent.parent.description,place.org.parent.parent.sources,place.org.parent.parent.notes,place.org.parent.parent.tags,place.org.parent.parent.image,place.org.parent.parent.id,place.org.parent.parent.dirName,place.org.parent.parent.url,place.org.parent.parent.events,place.org.parent.parent.type,place.org.parent.parent.parent.name,place.org.parent.parent.parent.surname,place.org.parent.parent.parent.title,place.org.parent.parent.parent.time,place.org.parent.parent.parent.deprecated,place.org.parent.parent.parent.note,place.org.parent.parent.parent.place,place.org.parent.parent.parent.description,place.org.parent.parent.parent.sources,place.org.parent.parent.parent.notes,place.org.parent.parent.parent.tags,place.org.parent.parent.parent.image,place.org.parent.parent.parent.id,place.org.parent.parent.parent.dirName,place.org.parent.parent.parent.url,place.org.parent.parent.parent.events,place.org.parent.parent.parent.type,place.org.parent.parent.parent.parent,place.org.parent.parent.parent.places,place.org.parent.parent.parent.kind,place.org.parent.parent.places,place.org.parent.parent.kind,place.org.parent.places,place.org.parent.kind,place.org.parent.parent.parent,place.org.parent.parent
https://rr0.org/time/1/9/5/7/02/index.html#1957-02-07T03:53,Las Cruces (Nouveau-Mexique),,,,,,,,,,,,,,,,,"",place,,"",,1957-02-07T03:53,"le , 54 cibles radar pendant 1 h 39 mn ?.","Liste de McDonald,s1,"""",Index du FUFOR,",1957-02-07T03:53
https://rr0.org/time/1/9/5/7/02/index.html#1957-02-11,Mansfield,,,,,,,,,,,,,,,,,"",place,,"",,1957-02-11,"le à le mardi 12 Au dessus de , après des secousses telluriques, on voit dans le ciel des formes lumineuses qui laissent derrière elles une traînée de vapeur et avancent à des vitesses extraordinaires.","",1957-02-11
https://rr0.org/time/1/9/5/7/02/index.html#1957-02-13,Tierra Amarilla (Nouveau-Mexique),,,,,,,,,,,,,,,,,"",place,,"",,1957-02-13,"le le mercredi 13 02:30 Le Directeur des Opérations de l'USAF et 3 contrôleur de tour sur 2 sites radar, le GCA et le NCOIC, repèrent plusieurs cibles volant derrière 1 avion de ligne à une distance de 3 km à 4 km, se déplaçant 2 fois plus vite. Aucune réponse IFF. Les phénomènes peuvent rester stationnaires ou se déplacer à grande vitesse. L'un d'eux se sépare en 2 cibles, un fait apparemment un virage à 180°. Les blips sont de la taille d'un B­47. L'observation dure entre 3 minutes [25 mn] ?. le mercredi 13 04:40 À l'AFS de , Meyer, pendant 2 heures. le mercredi 13 20 h À Marrero (Louisiane), Martin, pendant 1 h 40 mn.","The UFO Experience,s2,""""""Hynek, J. A."""""",""chg. 7, cas RV-7"",,Liste de McDonald ,s3,"""",Index du FUFOR,,Liste de McDonald,s4,"""",Index du FUFOR,",1957-02-13
https://rr0.org/time/1/9/5/7/02/index.html,Burbank (Californie),,,,,,,,,,,,,,,,,"",place,,"",,1957-02,"À , la police reçoit de nombreux appels à propos de phénomènes de forme ovale au-dessus de la ville. L'officier Robert Wells, parti enquêter, confirme l'observation.","UFO Evidence,s5,"""",12,",1957-02
https://rr0.org/time/1/9/5/7/02/index.html#1957-02-18,,1957-02-18,le à le mardi 19 L'USAF donne une conférence sur l'endoctrinement ovni pour les représentants D/I.,",s6,"""",,",1957-02-18
https://rr0.org/time/1/9/5/7/02/index.html#1957-02-27T21:45,Castle (Californie),,,,,,,,,,,,,,,,,"",place,,"",,1957-02-27T21:45,"le A la base aérienne de , détection pendant 24 secondes de 9 cibles radar non-identifiées.","Liste de McDonald,s7,"""",Index du FUFOR,",1957-02-27T21:45