description,events,eventType,id,place,sources,time,type,url,place.dirName,place.elevation,place.events,place.id,place.locations,place.name,place.org._parent,place.org.events,place.org.id,place.org.kind,place.org.places,place.org.type,place.org._parent._parent._parent._parent,place.org._parent._parent._parent.events,place.org._parent._parent._parent.id,place.org._parent._parent._parent.kind,place.org._parent._parent._parent.places,place.org._parent._parent._parent.type,place.org._parent._parent.events,place.org._parent._parent.id,place.org._parent._parent.kind,place.org._parent._parent.places,place.org._parent._parent.type,place.org._parent.events,place.org._parent.id,place.org._parent.kind,place.org._parent.places,place.org._parent.type,place.org._parent._parent._parent,place.org._parent._parent
"le peu avant cette heure à ), un témoin observe dans le ciel un disque très lumineux de couleur orange, accompagné sur sa droite d'un filet de fumée. L'ensemble se déplace sans bruit perceptible. Après moins de 1 mn d'obsevation, le phénomène disparait, laissant la place à une lumière jaune.","",sighting,1980-07-04T22:30$Meudon     (Hauts-de-Seine,,,"",,"",Meudon     (Hauts-de-Seine,"""GEPAN"","""",s1,"""",,,PAN classé C",1980-07-04T22:30,event,https://rr0.org/time/1/9/8/0/07/index.html#1980-07-04T22:30
le L'Inde lance son satellite Rohini et devient la 7ème puissance spatiale.,"",sighting,1980-07-18$,,"",1980-07-18,event,https://rr0.org/time/1/9/8/0/07/index.html#1980-07-18
"le ), 1 personne aperçoit depuis chez lui une lueur orangée dans le ciel bien dégagé. Se déplaçant sur son balcon il distingue alors une demi-sphère de couleur orange vif. Ce phénomène reste stationnaire 1 mn avant de se déplacer de façon rectiligne et de disparaître en quelques s.","",sighting,1980-07-21T06:25$Saint Cyr-l'Ecole (Yvelines,,,"",,"",Saint Cyr-l'Ecole (Yvelines,"""GEPAN"","""",s2,"""",,,PAN classé C",1980-07-21T06:25,event,https://rr0.org/time/1/9/8/0/07/index.html#1980-07-21T06:25
"John Keel interviewé par David Letterman le 28 vers le ), 2 témoins rentrent chez quand ils voient 1 boule blanche de couleur très vive dans le ciel, émettant une lumière intense éclairant la campagne. Cette boule s'élève pour prendre la direction du nord après avoir effectué une manœuvre à angle droit. Elle s'est immobilise ensuite et les témoins l'observent durant 1 h malgré la brillance intense qui leur fait mal aux yeux. Ils partent se coucher, mais entendent des crépitements. Les photographies prises par 1 des témoins ne peuvent être exploitées : la pellicule est déclarée comme ""brulée"" par le photographe qui refusera de la développer. 1 des témoin rapporte avoir de nouveau vu cette boule blanche très brillante ce même jour un peu plus tard.","",sighting,1980~-07~-24~T04~:30$Issoire (Puy-de-Dôme,,,"",,"",Issoire (Puy-de-Dôme,"""GEPAN"","""",s3,"""",,,PAN classé C",1980~-07~-24~T04~:30,event,https://rr0.org/time/1/9/8/0/07/index.html#1980~-07~-24~T04~:30
"vers le Au ), 1 témoin voit pendant 40 mn, à 50 m de son domicile, 1 forme lumineuse ovale orange, statique, estimée à 80 cm de haut sur 40 cm de large, qui disparaît alors que le témoin est rentré dans sa cuisine. Aucune trace au sol n'est retrouvée. Une autre personne dira avoir été témoin un mois auparavant de la présence d'une boule lumineuse à 50 m du sol et qui se déplaçait en suivant son véhicule.","",sighting,1980~-07~-25~T02~:45$Blanc (Indre,,,"",,"",Blanc (Indre,"""GEPAN"","""",s4,"""",,,PAN classé C",1980~-07~-25~T02~:45,event,https://rr0.org/time/1/9/8/0/07/index.html#1980~-07~-25~T02~:45
"le à le lundi 28 la nuit), des témoins aperçoivent dans le ciel de Damarys-les-Lys un ovni de forme conique en sa partie supérieure et cylindrique en sa partie inférieure, d'où s'échappent des faisceaux lumineux par intervalles. Il se déplace dans l'axe est-sud.","",sighting,1980-07-27$Vaux-le-Pénil (Seine-et-Marne,,,"",,"",Vaux-le-Pénil (Seine-et-Marne,""""","""",s5,"""",28 juillet 1980 < LDLN n° 198 (octobre 1980),34,La République de Seine-et-Marne",1980-07-27,event,https://rr0.org/time/1/9/8/0/07/index.html#1980-07-27