url,place,time,description,sources,id,place.name,place.org.dirName,place.org.code,place.org.places,place.org.kind,place.org.parent,place.place,place.org,place.place.locations,place.place.elevation,place.place.dirName,place.place.events,place.org.parent.dirName,place.org.parent.code,place.org.parent.places,place.org.parent.kind,place.org.parent.parent.dirName,place.org.parent.parent.code,place.org.parent.parent.places,place.org.parent.parent.kind,place.org.parent.parent.parent.dirName,place.org.parent.parent.parent.code,place.org.parent.parent.parent.places,place.org.parent.parent.parent.kind,place.org.parent.parent.parent.parent,place.org.parent.parent.parent,place.org.parent.parent
https://rr0.org/time/1/9/5/2/04/index.html#1952-04,Hammond (Colombie Britannique),,"",,,,1952-04,"avril 1952 à 22:30 A une lueur apparaît dans le ciel dégagé en se dirigeant silencieusement vers le nord. Sa couleur vire à l'orangé et quand l'objet arrive à la verticale du témoin, sa queue semble scintiller. L'objet vire alors brusquement vers l'Ouest, s'immobilise et revient. Sa couleur devient rougeâtre. Quand l'objet atteint la zone Sud, il se dirige vers l'horizon et sa couleur passe à l'orangé, puis au vert et enfin au blanc argenté. (le mois suivant ?) avril 1952 à 19:30 A Duncanville (Texas), 2 opérateurs radar du 147ème escadron AC & W détectent un objet par radar durant 1 mn, à une vitesse estimée à 2160 miles/h.","Cas Blue Book n° 1095 non expliqué,s1,"""",,",1952-04
https://rr0.org/time/1/9/5/2/04/index.html,,1952-04,Albert K. Bender annonce la création de l'IFSB dans le courrier des lecteurs de Other Worlds.,"",1952-04
https://rr0.org/time/1/9/5/2/04/index.html#1952-04-21,,1952-04-21,"Le Toronto Globe & Mail révèle une observation à Ontario, où des milliers de témoins ont pu assister à la poursuite d'un objet cylindrique sombre par 2 chasseurs Mustang P-51. L'objet a traversé le ciel à la vitesse estimée de 2500 km/h, laissant derrière lui un sillage vaporeux. Les témoins ne perçoivent aucun bruit. Les 2 pilotes des chasseurs rentreronts bredouilles, et déclareront : Ce ne peut absolument pas être ê un avion.","",1952-04-21
https://rr0.org/time/1/9/5/2/04/index.html#1952-04-22T21:09,,1952-04-22T21:09,"A la base de l'USAF de Naha (Okinawa). l'équipage au sol d'un B-29 observe durant 10 mn un objet elliptique, suivi de 2 autres, puis encore de 2 autres, tous possèdant une lumière blanche clignotant toutes les 1 à 2, faire des manœuvres aériennes erratiques.","Cas Blue Book n° 1144 non expliqué,s17,"""",,",1952-04-22T21:09
https://rr0.org/time/1/9/5/2/04/index.html#1952-04-23,Watertown (Massachussetts),,"",,,,1952-04-23,", un ingénieur observe un objet manoeuvrant à grande vitesse.","",1952-04-23
https://rr0.org/time/1/9/5/2/04/index.html#1952-04-24,Bellevue Hill (Vermont),,"",,,,1952-04-24,"avril 1952 à 05 h A , l'équipage d'un avion de transport C-124 de l'USAF observe 3 objets circulaires bleuâtres en formation circulaire (""fingertip"") voler par 2 fois parallèlement à leur appareil durant 3 à 4 mn. avril 1952 à 14:30 A Milton (Massachusetts), 3 ingénieurs en électronique du Cambridge Research Center, dont un nommé Buruish, observent durant 1,5 mn 2 carrés plats voler de manière vascillante horizontalement, puis monter en altitude, continuer à voler sur ce nouveau palier, et s'en aller. avril 1952 à 20:10 A Clovis (Nouveau Mexique), E. L. Ellis (aide chirurgien et major de l'USAF) observe durant 5 mn de nombreuses lumières orange ambrées, parfois distinctes, parfois fusionnées, se déplacer de manière erratique. Leur vitesse varient de zero à très rapide.","Cas Blue Book n° 1147 non expliqué,s18,"""",,,Cas Blue Book n° 1148 non expliqué,s19,"""",,,Cas Blue Book n° 1151 non expliqué,s20,"""",,",1952-04-24
https://rr0.org/time/1/9/5/2/04/index.html,,1952-04,Observation de Dan Able Kimball.,"",1952-04
https://rr0.org/time/1/9/5/2/04/index.html#1952-04-27,Roseville (Michigan),,"",,,,1952-04-27,"avril 1952 à 16:15 A , H. A. Freytag et 3 autres hommes parents, dont un ministre, observent durant 45 mn un objet ovale argenté tourner, descendre puis s'arrêter. 2 objets en forme de cigare apparaissent, l'un partant vers l'est et l'autre vers l'ouest. Un 3ᵉ objet argenté en forme de cigare vole à côté à grande vitesse. avril 1952 à 20:30 A Yuma (Arizona), Melle G. S. Porter et le sergent-chef (opérateur de tour de contrôle n'étant pas en service) observent des disques d'un rouge brillant ou flamboyant, d'une taille semblable à des chasseurs. 7 observations d'un disque, l'un des 2 en formation durant 2 h. Tous vus sous le plafond nuageux des 11 000 pieds. Venu de l'horizon, un objet blanc et brillant s'immobilise à 1000 m d'altitude et à 3 km de 4 témoins en voiture. D'un diamètre de 60 m, il possède 2 rangées de hublots. Il effectue une oscillation et passe à l'orange..","Cas Blue Book n° 1160 non expliqué,s21,"""",,,Cas Blue Book n° 1163 non expliqué,s22,"""",,,,s23,""Josef Allen Hynek"",,1979,Un des cas Blue Book de ce jour ?,s24,"""",,",1952-04-27
https://rr0.org/time/1/9/5/2/04/index.html#1952-04-29,Marshall (Texas),,"",,,,1952-04-29,"avril 1952 à 15:30 A , le pilote privé R. R. Weidman observe durant 1,5 mn un objet rond voler tout droit, avec une oscillation de chaque côté. avril 1952 à 22 h Au Nord de Goodland (Kansas), le lieutenant R. H. Bauer du B-29 observe une lumière blanche en forme d'éventail pulser 3 à 4 fois par s durant 2 s.","Cas Blue Book n° 1167 non expliqué,s25,"""",,,Cas Blue Book n° 1168 non expliqué,s26,"""",,",1952-04-29