type,events,url,place,time,description,sources,id,place.name,place.org.type,place.org.dirName,place.org.events,place.org.id,place.org.places,place.org.kind,place.org.parent,place.place,place.org,place.place.id,place.place.events,place.place.locations,place.place.elevation,place.place.dirName,place.org.parent.type,place.org.parent.dirName,place.org.parent.events,place.org.parent.id,place.org.parent.places,place.org.parent.kind,place.org.parent.parent.type,place.org.parent.parent.dirName,place.org.parent.parent.events,place.org.parent.parent.id,place.org.parent.parent.places,place.org.parent.parent.kind,place.org.parent.parent.parent.type,place.org.parent.parent.parent.dirName,place.org.parent.parent.parent.events,place.org.parent.parent.parent.id,place.org.parent.parent.parent.places,place.org.parent.parent.parent.kind,place.org.parent.parent.parent.parent,place.org.parent.parent.parent,place.org.parent.parent
case,"",https://rr0.org/time/1/9/8/1/01/index.html#1981-01-01,Vaucresson (Hauts-de-Seine,,,"","",,,1981-01-01,"le ), 2 gardiens de la paix aperçoivent entre 100 et 150 m dans le ciel une lueur jaune orangé qui scintille. Tout en observant la progression de cette lumière, ils voient un engin de forme circulaire, tournant sur lui-même et qui, à une allure régulière, lente et sans bruit, semble amorcer une descente. L'engin émet différentes lumières clignotantes et laisse derrière lui une courte trainée. L'observation, qui a duré environ 1 mn, a cessé lorsque l'objet a été caché par le paysage.",""""",,s1,""GEPAN"",,,""""",1981-01-01
case,"",https://rr0.org/time/1/9/8/1/01/index.html#1981-01-08T17:00,,1981-01-08T17:00,le Cas de Trans-en-Provence.,""""",,s2,""GEPAN"",,,""""",1981-01-08T17:00
case,"",https://rr0.org/time/1/9/8/1/01/index.html#1981-01-09,Calais (Pas-de-Calais,,,"","",,,1981-01-09,"le ), plusieurs personnes voient pendant 3 à 4 mn dans le ciel 1 objet de couleur jaune-rouge et de forme allongée se déplacer à très grande vitesse sans bruit vers l'est-ouest pendant.",""""",,s3,""GEPAN"",,,""""",1981-01-09
case,"",https://rr0.org/time/1/9/8/1/01/index.html#1981-01-13,,1981-01-13,"le Un rapport officiel du lieutenant-colonel Charles I. Halt, commandant en second de la base de Bentwaters, décrivant les événements des 27 et 29 décembre, est expédié au Ministère Britannique de la Défense.","",1981-01-13
case,"",https://rr0.org/time/1/9/8/1/01/index.html#1981-01-19,Vitrolles (Bouches-du-Rhône,,,"","",,,1981-01-19,"le ), des témoins entendent un grondement et ressentent des vibrations importantes. Certains voient également des lueurs roses dans le ciel au-dessus d'une usine. Après enquête, le phénomène a été identifié comme provenant de la mise en service d'une nouvelle structure dans une raffinerie sur le secteur indiqué. Il a notamment été expliqué que les lueurs sur les nuages provenaient d'une nouvelle torchère allumée cette nuit là.",""""",,s4,""GEPAN"",,,""""",1981-01-19
case,"",https://rr0.org/time/1/9/8/1/01/index.html#1981-01-23,Reims (Marne,,,"","",,,1981-01-23,"le ), 1 témoin rentrant de son travail à cyclomoteur aperçoit 1 grosse forme ronde dans le ciel. Celle-ci émet une lumière intense orangée. D'après le témoin, elle change de position puis disparaît brusquement.",""""",,s5,""GEPAN"",,,""""",1981-01-23
case,"",https://rr0.org/time/1/9/8/1/01/index.html#1981-01-24T09:10,Pithiviers (Loiret,,,"","",,,1981-01-24T09:10,"le ), alors qu'elle circule à bord de son véhicule, une femme aperçoit malgré le brouillard 1 boule de couleur jaune feu. Celle-ci se déplace dans le sens nord-ouest/sud-est. Situé haut dans le ciel, l'objet semble en rotation sur lui-même. Cette boule disparaît dans le paysage.",""""",,s6,""GEPAN"",,,""""",1981-01-24T09:10
case,"",https://rr0.org/time/1/9/8/1/01/index.html#1981-01-26,Cuxac-Carbardes (Aude,,,"","",,,1981-01-26,"le vers janvier 1981 à 16:30 A ), 1 automobiliste circule sur une départementale. Il voit arriver sur sa gauche un phénomène en forme de cigare (cylindrique ?). Estimé d'une longueur de 5 m sur une hauteur d'environ 1,5 m, il est de couleur orange et 3 cercles blancs sont visibles sur la partie latérale droite. Celui-ci survole un champ à 4 ou 5 m du sol sans émettre de bruit et à environ 30 km/h. L'objet traverse la route passant au-dessus de la voiture qui a des ratés et s'arrête. Le témoin sort de son véhicule et regarde l'objet qui se situe alors au-dessus des arbres puis bifurque pour suivre une ligne de crêtes et disparaître. L'observation durera 30 secondes. Lors de l'enquête, le véhicule du témoin va être examiné par un garagiste : une anomalie au pont diode situé dans l'alternateur sera remarquée et les charbons de l'alternateur usés seront changés (Le GEPAN émettra l'hypothèse d'un missile de croisière). vers janvier 1981 à 23:15 A Plougastel, Finistère, un cibiste dans sa voiture aperçoit, dans le ciel clair et sans nuages, un éclair durant 3 s. Intrigué, il se penche à sa portière et voit alors 1 point lumineux blanc qui en descendant grossit rapidement. L'observation dure 6 à 7 s. La lumière émise devient alors importante puis s'éteint brusquement (Le peu d'informations recueillies dans cette description indiquent néanmoins l'observation d'une probable rentrée atmosphérique).",""""",,s7,""GEPAN"",,,"""","""",,s8,""GEPAN"",,,""""",1981-01-26
case,"",https://rr0.org/time/1/9/8/1/01/index.html#1981-01-29,Clery-Saint André (Loiret),,,"","",,,1981-01-29,"le , 1 personne observe dans le ciel un phénomène lumineux particulier. De nuit et par ciel très clair, les gendarmes contactés vont également voir un objet dont la forme ne peut être définie. Son volume est plus important que celui d'une étoile et sa luminosité et couleur varient passant du bleu au rouge et blanc. Il se déplace de façon singulière verticalement puis horizontalement et circulairement dans un espace limité à une grande vitesse. L'observation se poursuivra durant une grande partie de la nuit par une autre brigade en service nocturne.",""""",,s9,""GEPAN"",,,""""",1981-01-29
case,"",https://rr0.org/time/1/9/8/1/01/index.html,,1981-01,Interview de Felix Y. Ziegel pour un journal italien. Il y affirme détenir plus de 50000 cas dont il n'a publié (en samizdat) qu'une infime partie pour ne pas affoler la population.,"",1981-01