type,events,url,place,time,description,sources,id,place.name,place.org,place.place.id,place.place.events,place.place.locations,place.place.elevation,place.place.dirName,place.org.type,place.org.dirName,place.org.events,place.org.id,place.org.places,place.org.kind,place.org.parent.type,place.org.parent.dirName,place.org.parent.events,place.org.parent.id,place.org.parent.places,place.org.parent.kind,place.org.parent.parent,place.org.parent,place.place,place.org.parent.parent.type,place.org.parent.parent.dirName,place.org.parent.parent.events,place.org.parent.parent.id,place.org.parent.parent.places,place.org.parent.parent.kind,place.org.parent.parent.parent,place.org.parent.parent.parent.type,place.org.parent.parent.parent.dirName,place.org.parent.parent.parent.events,place.org.parent.parent.parent.id,place.org.parent.parent.parent.places,place.org.parent.parent.parent.kind,place.org.parent.parent.parent.parent
case,"",https://rr0.org/time/1/9/7/4/03/index.html#1974-03,Saint Hilaire-du-Rosier,,,"","",,,1974-03,"en , 2 témoins voient pendant en 20 un phénomène orange ovale, avec à son centre un cercle d'une couleur rouge intense.",""""",""Une section de recherche sur les ovnis à Saint-Marcellin"",s1,"""",Le Dauphiné Libéré,20,""""",1974-03
case,"",https://rr0.org/time/1/9/7/4/03/index.html#1974-03-03T05:40,Montmorency (Val d’Oise),,,"","",,,1974-03-03T05:40,"le , un ovoïde bien plus grand qu'un avion stationne immobile pendant en 2.",""""",,s2,"""",,16,""""",1974-03-03T05:40
case,"",https://rr0.org/time/1/9/7/4/03/index.html#1974-03-05,Hyères (Var),,,"","",,,1974-03-05,"le la nuit, 3 militaires de l'unité du capitaine C., commandant de l'escadron 82 de la gendarmerie mobile d', aperçoivent, vers la ferme de l'Hôpital, une forme lumineuse de faibles dimensions. Cette lumière suit la patrouille dans ses déplacements jusqu'à la Cavalerie, variant de taille en fonction de l'heure et de la position, ou elle est observée par plusieurs officiers et sous-officiers de l'escadron..",""""",Le Nouveau défi des ovnis,s3,""""""Bourret, J.-C."""""",1976,61,""""",1974-03-05
case,"",https://rr0.org/time/1/9/7/4/03/index.html#1974-03-08,Tarbes,,,"","",,,1974-03-08,"le le vendredi 8 30 M. D. roule au volant de sa 2 CV dans la région de. Il est supris par une lueur rouge : J'ai aperçu sur ma droite (...) à environ 400 ou 500 m une boule de couleur rouge orange de la grosseur du soleil. Je pense que cette boule était assez haut au-dessus du sol, sans pouvoir préciser. Elle se déplaçait en direction de Rabastens vers le nord tout en se rapprochant de ma voiture. (...) Cette boule s'est trouvée un moment face à mon véhicule. (...) A ce moment-là, elle a pris une forme plus ovale, comme un ballon de rugby. Cette boule éclairait tellement, devant et autour de moi, que je voyais comme en plein jour. Pendant qu'elle se trouvait à la hauteur de ma voiture, celle-ci ne tirait plus, elle avait des ratés, elle n'avançait pas malgré mon accélération - et ceci sur une cinquantaine de mètres au moins. Lorsque cette boule a pour ainsi dire tourné devant moi sur la nationale 21 (N 21), elle avait perdu un peu d'altitude tout en gardant toujours la même couleur, mais cette boule devenait de plus en plus grande, c'est-à-dire qu'elle devait atteindre 2 m de diamètre. Je n'ai perçu aucun bruit (...). J'ai eu très peur. (...) J'ajoute que (...) j'en ai aperçu une deuxième, plus petite, d'un rouge vif. Elle se tenait à peu près à la même hauteur que la première. De ces boules me venaient une très puissante lumière et des rayons qui m'éblouissaient. Les yeux de M. D. seront rouges et larmoyants pendant 2 jours. Plusieurs témoins ont aperçu cette nuit-là dans la région de puissantes lumières ou des boules lumineuses. Sur France Inter, Bourret interviewe Jean-Claude Ribes, alors radioastronome et chargé de recherches au CNRS.",""""",""Safari-photo en Bigorre"",s4,""""""Lagarde, F."""""",LDLN n° 138,20,"""","""",,s5,"""",,1976,""""",1974-03-08
case,"",https://rr0.org/time/1/9/7/4/03/index.html#1974-03-14T02:00,la Motte Fanjas,,,"","",,,1974-03-14T02:00,"le près de Saint-Nazaire-en-Royans, 1 témoin observe 1 énorme cigare stationné à 3 m du sol, qui le suit ensuite alors qu'il est en voiture. Lorsqu'il arrive à son domicile le phénomène disparaît en se matérialisant en énorme disque.",""""",""Une section de recherche sur les ovnis à Saint-Marcellin"",s6,"""",Le Dauphiné Libéré,20,""""",1974-03-14T02:00
case,"",https://rr0.org/time/1/9/7/4/03/index.html,,1974-03,"Aux Etats-Unis se tient une réunion de scientifiques, universitaires intéressés par le phénomène ovni. Claude Poher est au Etats-Unis à cette époque.",""""",,s7,"""",,1976,""""",1974-03
case,"",https://rr0.org/time/1/9/7/4/03/index.html#1974-03-22,,1974-03-22,"le Sur France Inter, Bourret formule une conclusion de sa série d'entretiens sur les ovnis, aux côtés de Claude Villers. Michel Monnerie y annonce que LDLN organise une soirée de surveillance du ciel national pour le lendemain.",""""",,s8,""Bourret"",,1976,""""",1974-03-22
case,"",https://rr0.org/time/1/9/7/4/03/index.html#1974-03-23,Albiosc (Alpes-de-Haute-Provence),,,"","",,,1974-03-23,"le le samedi 23 21 h Début de la soirée de surveillance du ciel national, organisée par LDLN. Malgré la publicité autour de l'opération, aucune photo n'est envoyée à l'émission. le samedi 23 23:30 Cliché pris à Albiosc (Alpes-de-Haute-Provence) le 23 Le cliché ci-contre est pris à. Il aurait été plus tard déposé sur le pare-brise du journaliste Jean Bedet, avec un mot indiquant la date et le lieu de du cliché, qui aurait été pris par un médecin (désirant rester anonyme) alors qu'il rentrait tard sur une route de campagne après une visite à un patient (Figuet, M. suspectera Jean Bedet d'être lui-même à l'origine de ce canular).",""""",,s9,""Bourret"",,1976,"""","""",LDLN n° 138,s10,"""",1974-10,22-24,"""","""",Das Geheimnis der unbekannten Flugobjekte,s11,""Hermann Bauer Vzerlag"",""Freiburg, 1976, traduit A. Schneider-H. Malthaner: Le Dossier Secret des O.V.N.I., Ed. De Vecchi"",1978,""""",1974-03-23
case,"",https://rr0.org/time/1/9/7/4/03/index.html#1974-03-25,Lafitole,,,"","",,,1974-03-25,"L'équipe Gueudelot à 06:00 à , après leur nuit de veille. Elle n'a rien vu, mais la bonne humeur est présente. Au centre Christiane Gueudelot. le Lancement de Saliout 3. Elle retombera l'année suivante.",""""",""Safari-photo en Bigorre"",s12,""""""Lagarde, F."""""",LDLN n° 138,20,""""",1974-03-25
case,"",https://rr0.org/time/1/9/7/4/03/index.html#1974-03-29,,1974-03-29,le Mariner 10 survole Mercure.,"",1974-03-29