type,events,url,place,time,description,sources,id,place.name,place.org,place.place.id,place.place.events,place.place.locations,place.place.elevation,place.place.dirName,place.org.type,place.org.dirName,place.org.events,place.org.id,place.org.places,place.org.kind,place.org.parent.type,place.org.parent.dirName,place.org.parent.events,place.org.parent.id,place.org.parent.places,place.org.parent.kind,place.org.parent.parent.type,place.org.parent.parent.dirName,place.org.parent.parent.events,place.org.parent.parent.id,place.org.parent.parent.places,place.org.parent.parent.kind,place.org.parent.parent.parent.type,place.org.parent.parent.parent.dirName,place.org.parent.parent.parent.events,place.org.parent.parent.parent.id,place.org.parent.parent.parent.places,place.org.parent.parent.parent.kind,place.org.parent.parent.parent.parent,place.org.parent,place.place,place.org.parent.parent.parent,place.org.parent.parent
case,"",https://rr0.org/time/1/9/6/8/10/index.html#1968-10-11,,1968-10-11,"le Lancement de la mission Apollo 7, 1er vol habité Apollo, avec Schirra, Cunningham et Eisele. L'Agence Téléphonique suisse annonce que lorsque la capsule Apollo 7 survolait l'Australie, la cosmonaute Cunningham signala que des corps volants non identifiés passaient à proximité de la capsule spatiale. Ignacio De Souza, qui avait avant sa rencontre la réputation d'être très robuste, meurt.","",1968-10-11
case,"",https://rr0.org/time/1/9/6/8/10/index.html#1968-10-22,,1968-10-22,le Amerissage de la capsule Apollo 7.,"",1968-10-22
case,"",https://rr0.org/time/1/9/6/8/10/index.html#1968-10-24,base de Minot (Dakota du Nord),,,"","",,,1968-10-24,"le Près de la , observation d'un ovni au-dessus d'une base de missiles nucléaires.","",1968-10-24
case,"",https://rr0.org/time/1/9/6/8/10/index.html#1968-10-25,,1968-10-25,le La sonde Zond 5 frôle la Lune à 1960 km et revient sur Terre.,"",1968-10-25
case,"",https://rr0.org/time/1/9/6/8/10/index.html#1968-10-31,,1968-10-31,le Le Rapport Condon est remis au secrétaire de l'USAF.,"",1968-10-31