description,events,eventType,id,place,sources,time,type,url,place.dirName,place.elevation,place.events,place.id,place.locations,place.name,place.org._parent,place.org.events,place.org.id,place.org.kind,place.org.places,place.org.type,place.org._parent._parent._parent._parent,place.org._parent._parent._parent.events,place.org._parent._parent._parent.id,place.org._parent._parent._parent.kind,place.org._parent._parent._parent.places,place.org._parent._parent._parent.type,place.org._parent._parent.events,place.org._parent._parent.id,place.org._parent._parent.kind,place.org._parent._parent.places,place.org._parent._parent.type,place.org._parent.events,place.org._parent.id,place.org._parent.kind,place.org._parent.places,place.org._parent.type,place.org._parent._parent,place.org._parent._parent._parent
"en le mercredi 16 mars A , J. Payot observe la lente progression horizontale d'un bolide du nord à l'est. L'objet est magnifique, conique, gros comme la Lune, orange à l'avant rond, avec des flammèches rouges en pointe arrière. Dessin.","",sighting,1938-03$Chamonix,,,"",,"",Chamonix,""""","""",s1,"""",,1938,BSAF",1938-03,event,https://rr0.org/time/1/9/3/8/index.html#1938-03
"Eté Couverture des Aventures de Buck Rogers ce mois-là Par une nuit chaude A , Sverre Brevik (21 ans) n'arrive pas à dormir. Il sort pour se détendre et apprécie la vue de la nature. Soudain, il remarque un son, comme un générateur augmentant sa vitesse. Toute la zone devient alors illuminée, le son gagne en force, lui faisant mal à la tête. À environ 20 m de lui, un objet bleuâtre s'élève. Il possède un hâlo rougeâtre autour de lui, et ce qui semble être des ouvertures autour de lui qui soufflent un échappement bleu-blanc. L'odeur est horrible, lui rappelant du caoutchouc brûlé. Ses yeux et sa gorge lui piquent. L'objet monte sans aucun son, puis retombe comme un duvet (mouvement en ""chute de feuille""). Il mesure entre 20 et 25 m de diamètre, et 2 à 3 m de haut. Le témoin a l'impression d'être observé par l'objet. Ce dernier monte à nouveau et tourne autour de la zone, à nouveau illuminée par les choses ressemblant à de l'échappement, alors qu'il disparaît sans bruit en direction du Nord. 10 ans plus tard il observera un objet identique.","",sighting,1938$Herne (Norvège),,,"",,"",Herne (Norvège),""""","""",s2,"""",,,HJEMMET,"""","""",s3,"""",""4/1970, 159-60"",,UFO-NYT,""Liljegren"","""",s4,"""",1987,02,A bibliography of references to UFO incidents during World War II",1938,event,https://rr0.org/time/1/9/3/8/index.html
"Automne (ou automne 1939) A , 2 personnes voient un étrange ""homme-crapaud"" haut de 1 m, avec une tête ronde, pas de cou et une bosse sur le devant du corps. La bouche est une grande fente rectiligne et les yeux comme des fentes plus petites. Il a la peau vert-brun, comparable au Pegamoïd, mais des mains normales. La créature marche d'une manière singulière mais élégante, la tête ondulant de bas en haut pendant que les jambes bougeent avec prudence. Poursuivie la créature accélère si vite que ses pieds deviennent presque indistincts. Environ 100 m plus loin elle disparaît complètement.","",sighting,1938$Juminda (côte esthonienne),,,"",,"",Juminda (côte esthonienne),"",1938,event,https://rr0.org/time/1/9/3/8/index.html
"en Répétition de La Guerre des mondes au théâtre Mercury. Welles (à gauche, les bras levés), Bernard Herrmann dirigeant l'orchestre radiophonique de la CBS, et aux micros les acteurs Ray Collins et Richard Wilson (chemise blanche). le dimanche 30 octobre à 20 h A , la radio CBS annonce la retransmission en direct d'une soirée de variétés donnée dans un grand hôtel. 5 mn plus tard, la musique s'interromp pour un flash d'information selon lequel l'observatoire de Jenning, dans l'Illinois, venait d'observer à la surface de la planète Mars de curieuses projections de vapeurs inexplicables. Puis, les sismographes de New York enregistrent une secousse. Quelques minutes plus tard, la voix altérée du speaker annonce qu'un objet énorme et mystérieux vient de s'abattre en flammes sur une usine de Princeton (New Jersey). On entend les sirènes hurlantes des premiers véhicules de secours. Puis, enfin, un reporter décrit ""en direct"" les scènes d'épouvante qui se déroulent sous ses yeux. Les martiens désintègrent quiconque s'approche de l'objet. Celui-ci vient d'ailleurs de s'ouvrir. Les chars et les canons sont incapables de les arrêter. Les monstres sont là. À New York, c'est la panique. Les églises sont envahies par la foule. La police reçoit des milliers d'appels. Il y a des suicides et des accouchements prématurés. Des centaines de personnes s'enfuient en désordre vers la montagne, créant des embouteillages inextricables. La police décide alors d'envahir les studios de CBS et y trouve un jeune homme de 23 ans, Orson Welles, qui achève son émission en déclarant : Rassurez-vous, c'était simplement une adaptation de La Guerre des Mondes, le roman de Herbert George Wells. Sur les 6 millions d'Américains qui écoutent l'émission, plus de 1 million auront cédé à la panique. le octobre Les medias relatent la panique de certaines personnes ayant entendu l'émission de Welles.","",sighting,1938-10$region$ny,,,"",,"43,-75",,"",us,country,"",org,"",ny,region,",,"""",,""43,-75""",org,""""","""",s5,"""",""Taking War Drama as Fact"""", New York Times, 31 octobre 1938"",01,""Radio Listeners in Panic",1938-10,event,https://rr0.org/time/1/9/3/8/index.html#1938-10
"Dans la région montagneuse de Bayan-Khara Uula (confins de la Chine et du Tibet), découverte par l'archéologue chinois Tschi Pu-tei découvre un certain nombre de tombes mystérieuses d'ancêtres des Dropas.","",sighting,1938$,,"",1938,event,https://rr0.org/time/1/9/3/8/index.html
"en le mardi 20 décembre 1938 à 17 h A , J. Bessemoulin, chef de la station ONM de Nancy-Essey, observe un engin ovoïde, à l'éclat et au diamètre comparable à celui de la Lune, progressant lentement en laissant derrière lui une traînée lumineuse durant 1' 15"". L'objet émet un léger sifflement, possède des stries mauves devant l'avant rond et des flammèches bleu pâle à l'arrière conique. Dessin en tous points semblables à celui de Chamonix, le 16 mars.","",sighting,1938-11$Pont-Saint-Vincent,,,"",,"",Pont-Saint-Vincent,""""","""",s6,"""",,1938,",1938-11,event,https://rr0.org/time/1/9/3/8/index.html#1938-11
"en Le disque récupéré par les Allemands en juillet 1937 à en août 1937 est apporté dans les mains des plus hauts scientifiques allemands au Nord de Munich. Dans les montagnes environnantes une vieille mine de sel est convertie en une installation pour étudier et reproduire, tant que possible, l'appareil. On s'aperçoit vite que ce vaisseau n'est pas un appareillage top secret d'une quelconque autre nation de la Terre. Les scientifiques nazis ont un succès incroyable en disséquant et dans la compréhension du vaisseau et de ses contenus. Aucune autre nation n'est au courant (Source à trouver).","",sighting,1938-12$,,"",1938-12,event,https://rr0.org/time/1/9/3/8/index.html#1938-12
Canadian Radio Act.,"",sighting,1938$,,"",1938,event,https://rr0.org/time/1/9/3/8/index.html
"(Ou 1939) A , un objet de 1 m de long et marron verdâtre est suivi par 2 observateurs jusqu'à ce qu'il disparaisse soudainement.","",sighting,1938$Juminda (Estonie),,,"",,"",Juminda (Estonie),"""""""Vallée, Jacques"""""","""",s7,"""",,189,Passport to magonia",1938,event,https://rr0.org/time/1/9/3/8/index.html