type,events,url,place,time,description,sources,id,place.name,place.org,place.place.id,place.place.events,place.place.locations,place.place.elevation,place.place.dirName,place.org.type,place.org.dirName,place.org.events,place.org.id,place.org.places,place.org.kind,place.org.parent.type,place.org.parent.dirName,place.org.parent.events,place.org.parent.id,place.org.parent.places,place.org.parent.kind,place.org.parent.parent.type,place.org.parent.parent.dirName,place.org.parent.parent.events,place.org.parent.parent.id,place.org.parent.parent.places,place.org.parent.parent.kind,place.org.parent.parent.parent.type,place.org.parent.parent.parent.dirName,place.org.parent.parent.parent.events,place.org.parent.parent.parent.id,place.org.parent.parent.parent.places,place.org.parent.parent.parent.kind,place.org.parent.parent.parent.parent,place.org.parent.parent.parent,place.org.parent,place.place,place.org.parent.parent
case,"",https://rr0.org/time/1/9/6/6/07/index.html,Helva,,,"","",,,1966-07,"Dans la région de , 6 Mystère 4 s'écrasent ensemble à quelques minutes de vol de Palomares, plusieurs heures après le passage au-dessus de Fréjus et du Var d'un énorme engin d'origine inconnue.","",1966-07
case,"",https://rr0.org/time/1/9/6/6/07/index.html#1966-07,Provo (Utah),,,"","",,,1966-07,en La photo déclarée comme prise depuis un C-47 à hauteur de Provo (Utah) À photographie d'une soucoupe depuis un C-47,""""",""Case 7: Photos Allegedly Taken from C-47 Cockpit"",s1,""""""Craig, R. F."""",""""Levine, N. E."""""",Rapport Condon,1968,""""",1966-07
case,"",https://rr0.org/time/1/9/6/6/07/index.html#1966-07-11,Union (Pennsylvanie),,,"","",,,1966-07-11,le Observation à.,""""",,s2,"""",,10739,""""",1966-07-11
case,"",https://rr0.org/time/1/9/6/6/07/index.html#1966-07-16T03:40,Rebouillon (Var),,,"","",,,1966-07-16T03:40,"le , à quelque distance de Draguignan, les passagers d'une voiture observent à loisir un phénomène lumineux, semblant muni de projecteurs, qui évolue au-dessus de la vallée de la Nartuby, s'immobilise, et repart.",""""",""Dans notre ciel et sur notre sol"" in ""Soucoupes Volantes"",s3,""""""Marey, George"""""",Forces Aériennes Françaises (revue Mensuelle de l'Armée de l'Air) n° 245,1968,""""",1966-07-16T03:40
case,"",https://rr0.org/time/1/9/6/6/07/index.html#1966-07-22,,1966-07-22,"le Un officier de marine américain circule le soir avec son fils John. Un objet plane au-dessus de la voiture : J'ai baissé la tête pour regarder à travers le parebrise, et je l'ai vu tout entier - il était juste devant. J'ai dit à John : 'Mon Dieu, c'est une soucoupe volante.' C'était presque comme les films de science-fiction à la télévision... Il restait suspendu là, absolument silencieux, comme un clocher d'église éclairé la nuit. Ou encore il ressemblait à ces avions-suicides japonais qui se jetaient la nuit dans les faisceaux des projecteurs - cela me les a rappelés. Il a viré sur 100 m environ - absolument comme s'il était dépité. 2 autres voitures arrivent et le mystérieux engin va s'éteindre exactement comme un thermostat dans un appareil ménager, ne laissant plus alors qu'une ombre. L'ovni disparaît dans un sillage bleuté.","",1966-07-22
case,"",https://rr0.org/time/1/9/6/6/07/index.html#1966-07-25,Vanceboro (Caroline du Nord),,,"","",,,1966-07-25,le Observation à.,""""",,s4,"""",,10781,""""",1966-07-25
case,"",https://rr0.org/time/1/9/6/6/07/index.html#1966-07-30,,1966-07-30,"le Un drone D-21 est lancé au-dessus de Point Mugu, mais retourne vers le A-12 (#135) en le détruisant. Les 2 membres d'équipage s'éjectent, mais l'un d'eux se noie avant d'être récupéré en mer. Tous les lancements de D-21 seront à compter de ce jour effectués par des B-52.",""""",Dark Eagles,s5,""""""Peebles, Curtis"""""",Presido Press,1995,""""",1966-07-30
case,"",https://rr0.org/time/1/9/6/6/07/index.html#1966~-07~-28~T22~:45,Montsoreau (Maine-et-Loire),,,"","",,,1966~-07~-28~T22~:45,"vers le Aux environs de , M. témoin (photographe à Saumur), ainsi que son épouse se promènent quand ils aperçoivent une sphère rouge traverser le ciel. La lumière répandue par la sphère est si intense qu'elle éclaire toute la campagne environnante. Elle paraît toucher le sol puis s'élever de nouveau et planer à mi-hauteur pendant quelque temps. Lacoste et sa femme, alors convaincu qu'il s'agit d'un engin militaire téléguidé, s'approchent à une distance estimée à 300 m du phénomène, qui part et est perdu de vue derrière les bois. L'observation a duré 4 mn. Le lendemaintémoin (fermier du même lieu), signale que son champ de blé a été aplati sur environ 8 m2 et recouvert d'une substance huileuse et jaunâtre. Un contrôle sera fait pour savoir si des expériences militaires n'ont pas eu lieu à cet endroit : il n'y en a eu aucune.",""""",""Dans notre ciel et sur notre sol"" in ""Soucoupes Volantes"",s6,""""""Marey, George"""""",""Forces Aériennes Françaises (revue Mensuelle de l'Armée de l'Air) n° 245, mars 1968 < Vallée"",1969,""""",1966~-07~-28~T22~:45
case,"",https://rr0.org/time/1/9/6/6/07/index.html#1966-07-31,Presque Isle (Pennsylvanie),,,"","",,,1966-07-31,le Observation au parc national de.,""""",,s7,"""",,10798,""""",1966-07-31