url,place,time,description,sources
https://rr0.org/time/1/9/7/7/01/index.html,,1977-01,"A Villebois-Lavalette (Charente), 2 personnes en voiture observent un phénomène lumineux rouge-orangé qui semble provenir d'une masse qui se déplace SE-NO sans qu'aucun bruit particulier ne soit entendu. L'observation dure une dizaine de mn durant lesquelles des étincelles sont remarquées. Le phénomène diminue progressivement et lentement avant de s'éteindre complètement. A plusieurs reprises des personnes circulant sur la route empruntée par ces automobilistes ont remarqué des étincelles provenant d'une ligne électrique orientée SE-NO GEPAN : PAN classé C.",""
https://rr0.org/time/1/9/7/7/01/index.html,,1977-01,"A Maisons-Laffite (Yvelines), 1 témoin observe 1 lumière intense provenant d'une source qu'elle ne voit pas. Aucun bruit n'est entendu durant la courte observation. La source a disparu dans une trajectoire descendante derrière les maisons en direction de la forêt domaniale. Aucune trace et aucun autre témoignage n'ont pu apporter d'autres informations concernant ce phénomène GEPAN : PAN classé C.",""
https://rr0.org/time/1/9/7/7/01/index.html,,1977-01,"Au Mans (Sarthe), 2 personnes observent un phénomène lumineux sphérique qui se déplace dans le sens sud-nord puis est-ouest. Les gendarmes constateront en direction de l'ouest le lent déplacement d'un phénomène lumineux circulaire et d'un diamètre supérieur à une étoile, qui restera visible jusqu'à 21:30 GEPAN : PAN classé C.",""
https://rr0.org/time/1/9/7/7/01/index.html,,1977-01,"A Vaucouleurs (Meuse), un automobiliste et sa passagère observent les déplacements d'une boule lumineuse orange, estimée d'un diamètre d'environ 15 cm et à 2000 m d'altitude environ. Aucune traînée et aucun bruit ne seront visibles durant l'observation. Le phénomène s'éteint progressivement à 3 reprises avant de se rallumer rapidement. Il disparait très rapidement GEPAN : PAN classé C.",""
https://rr0.org/time/1/9/7/7/01/index.html,,1977-01,"A l'Hospitalet-Merens (Ariège), une automobiliste observe et photographie un nuage ovale se déplaçant imperceptiblement du nord au sud. 2 autres témoins font la même observation. D'après la photo jointe au procés verbal, ces personnes ont vu un nuage lenticulaire GEPAN : PAN classé A.",""
https://rr0.org/time/1/9/7/7/01/index.html,,1977-01,"A Issoudun (Indre), un témoin observe au loin une lumière orange qui semble venir dans sa direction. Réveillant d'autres personnes, ces témoins vont apercevoir des boules lumineuses très rapprochées les unes des autres et de la taille d'une ballon de football. Un des phénomènes retient leur attention, semblant constitué différemment des autres : de forme rectangulaire et plus étroit à l'arrière avec des ouvertures éclairées. Ces phénomènes se déplacent sans aucun bruit. L'hypothèse de l'observation de l'évolution d'un avion de transport (présence d'un aérodrome militaire à Châteauroux) n'a pu être confirmée par manque d'informations GEPAN : PAN classé C.",""
https://rr0.org/time/1/9/7/7/01/index.html,,1977-01,"A Saint Benoit (Réunion), 3 personnes voient une colonne de vapeur ou de fumée venant du ciel. Une tache d'écume est visible à la surface indiquant la chute d'un objet dans l'océan à environ 4 km du rivage et à environ 8 à 10 km du lieu de l'observation. Aucun autre témoignage ne sera recueilli sur ce phénomène et le point de chute s'averant difficile à déterminer, aucune recherche n'a été entreprise GEPAN : PAN classé C.",""
https://rr0.org/time/1/9/7/7/01/index.html,,1977-01,"A Toulouse (Haute Garonne) depuis le 1er étage d'une habitation, une personne dans le ciel, à une altitude estimée à 500 m, un phénomène imposant, à la forme de ""ballon de rugby"" gris mat métallique, ressemblant à un dirigeable. Il se déplace sans bruit à une vitesse de 100 à 150 km/h contre le vent Témoignage du 2007-07-09 < GEPAN : PAN classé C.",""
https://rr0.org/time/1/9/7/7/01/index.html,,1977-01,"A Saint Bonnet-de-Joux (Saône-et-Loire) 2 automobilistes observent le lent déplacement d'une boule lumineuse de la taille d'un ballon de football, émettant une lumière blanche de forte intensité et se déplaçant silencieusement tout en oscillant sur son axe. Aucune distance ni vitesse de déplacement n'a pu être précisée par le témoin principal qui observera le déplacement d'un 2nd point lumineux. Le témoin quittera les lieux à 21:45 après disparition totale du phénomène GEPAN : PAN classé C.",""