url,place,time,description,sources,id,place.name,place.org.dirName,place.org.code,place.org.places,place.org.kind,place.org.parent,place.place,place.org,place.place.locations,place.place.elevation,place.place.dirName,place.place.events,place.org.parent.dirName,place.org.parent.code,place.org.parent.places,place.org.parent.kind,place.org.parent.parent.dirName,place.org.parent.parent.code,place.org.parent.parent.places,place.org.parent.parent.kind,place.org.parent.parent.parent.dirName,place.org.parent.parent.parent.code,place.org.parent.parent.parent.places,place.org.parent.parent.parent.kind,place.org.parent.parent.parent.parent,place.org.parent.parent.parent,place.org.parent.parent
https://rr0.org/time/1/9/5/7/03/index.html#1957-03-06T14:00,,1957-03-06T14:00,"À Great Meadows-Hope (New Jersey), l'attention de Martins est attirée par l'aboiement de chiens regardant en l'air un phénomène blanc de la forme d'un chapeau de derby estimé faire plus de 50 pieds de large, stationnant bas au-dessus d'un terrain à 450 pieds de distance environ avec un doux mouvement de roulis et des flammes en-dessous comme des tresses. Le phénomène décolla soudain presque verticalement vers le nord-est sans un son, disparaissant dans un blanc de nuages, après au moins 1 mn.","UFO Rpt,s4,""""""Hynek, J. A."""""",pp. 151-4,",1957-03-06T14:00
https://rr0.org/time/1/9/5/7/03/index.html#1957-03-08,Houston (Texas (USA)),org/us/tx/48-35000,48-35000,"""29.762777777777778,-95.38305555555554"",,,",city,org/us/tx,tx,"""32.756388888888885,-97.3325"",,,",region,org/us,us,"",country,,"29.762777777777778,-95.38305555555554",,,,1957-03-08,"Près de , un ovni dépasse un avion, se déplace en haut et en bas à grande vitesse.","UFO Evidence,s5,"""",""NICAP, V"",",1957-03-08$org_us_tx_48-35000
https://rr0.org/time/1/9/5/7/03/index.html#1957-03-09,San Juan (Puerto Rico),,"",,,,1957-03-09,"Près de , 1 pilote de Pan American Airways entreprend une manœuvre évasive alors qu'un phénomène flamboyant, blanc-verdâtre passe devant lui.","UFO Evidence,s6,"""",""NICAP, V"",",1957-03-09
https://rr0.org/time/1/9/5/7/03/index.html#1957-03-22,Long Beach-Aéroport de Los Angeles         (Californie),,"",,,,1957-03-22,"le vendredi 22 23:55 À , observation de 42 secondes. mars 1957 à 12:10 Observation à Point Mugu (Californie).","Liste de James E. McDonald,s7,"""",Index du FUFOR,,Liste de McDonald,s8,"""",,",1957-03-22
https://rr0.org/time/1/9/5/7/03/index.html#1957-03-23,Oxnard (Californie),,"",,,,1957-03-23,"le vendredi 22 23:15 À la base aérienne d', Beaudoin et plusieurs témoins indépendants voient manœuvrer des lumières pendant 5 h 45 mn. A Long Beach (Californie), 4 ovnis repérés sur le radar de la CAA ; nombreuses observations visuelles.","UFO Report,s9,""""""Hynek, J. A."""""",pp. 53-54,,Index du FUFOR,s10,"""",,,UFO Evidence,s11,"""",NICAP,",1957-03-23
https://rr0.org/time/1/9/5/7/03/index.html#1957-03-25,,1957-03-25,Signature du traité de Rome.,"",1957-03-25
https://rr0.org/time/1/9/5/7/03/index.html#1957-03-27T20:35,Roswell (Nouveau-Mexique),,"",,,,1957-03-27T20:35,", le lieutenant Sontheimer, pilotant pour l'USAF un C-45 de transport voit sur la gauche 3 phénomènes blancs circulaires en formation serrée sur une trajectoire de collision. Il fait immédiatement clignoter ses feux de taxi, et 1 des phénomènes fonce droit vers le haut au-dessus de lui alors que les 2 aures continuent à passer devant lui. Lorsqu'il fait clignoter ses feux de taxi (à nouveau?) les phénomènes disparaissent instantanément. L'observation a duré 6 secondes.","Weinstein,s12,"""",D.,,,s13,"""",,,Index du FUFOR,s14,"""",,",1957-03-27T20:35
https://rr0.org/time/1/9/5/7/03/index.html#1957-03-28T22:35,Reseda (Californie),,"",,,,1957-03-28T22:35,"observation d'un phénomène luisant doré en forme de cigare à approximativement 60 ° au-dessus de l'horizon à l'ouest de la ville, pendant 3 minutes.","1957 wave chronology,s15,"""",,",1957-03-28T22:35
https://rr0.org/time/1/9/5/7/03/index.html#1957-03-29,Floride,,"",,,,1957-03-29,"Au large de la côte est, en , un pilote de Pan American Airways observe une lumière brillante et pulsante, confirmée par radar.","UFO Evidence,s16,"""",""NICAP, V"",",1957-03-29
https://rr0.org/time/1/9/5/7/03/index.html,,1957-03,1ʳᵉ UFO Conference.,"",1957-03