description,events,eventType,id,place,sources,time,type,url,place.dirName,place.elevation,place.events,place.id,place.locations,place.name,place.org._parent,place.org.events,place.org.id,place.org.kind,place.org.places,place.org.type,place.org._parent._parent._parent._parent,place.org._parent._parent._parent.events,place.org._parent._parent._parent.id,place.org._parent._parent._parent.kind,place.org._parent._parent._parent.places,place.org._parent._parent._parent.type,place.org._parent._parent.events,place.org._parent._parent.id,place.org._parent._parent.kind,place.org._parent._parent.places,place.org._parent._parent.type,place.org._parent.events,place.org._parent.id,place.org._parent.kind,place.org._parent.places,place.org._parent.type,place.org._parent._parent._parent,place.org._parent._parent
en Un jour de la dernière semaine du mois : Des chasseurs voient comme 2 pleines lunes dans la nuit pendant un long moment.,"",sighting,1837-01$,,""""","""",s1,"""",""The Hagerstown Mail de Southport (Hagers-Town, Maryland, USA)"",03,""Singular Phenomenon in the Heavens""",1837-01,event,https://rr0.org/time/1/8/3/7/index.html#1837-01
en le lundi 8 mai à 21:15 L'attention de R. H. Bonnycastle alors qu'il regarde les cieux est attirée par l'apparition soudaine à l'est d'une large colonne de lumière.,"",sighting,1837-05$,,"""""""Bonnycastle, R. H."""""","""",s2,"""",,1837,American Journal of Science",1837-05,event,https://rr0.org/time/1/8/3/7/index.html#1837-05
"en le mardi 29 août à en 30 Au-dessus de Tîrgu-Neamt et Dorohoi : Dans le cours de cette nuit un météore fut vu, ou un phénomène physique. C'était une sphère, allumée, longue d'environ 12 mains et large (près de 3 m). Elle descendit dans le crépuscule et le champ entier brilla avec une lumière puissance et lumineuse.","",sighting,1837-08$,,""""","""",s3,"""",,02,Albina Românesca",1837-08,event,https://rr0.org/time/1/8/3/7/index.html#1837-08
"en Jack ""talons à ressorts"" Tard dans la nuit À , un homme d'affaire rentre du travail jusqu'à chez lui lorsqu'une figure mystérieuse saute par-dessus les barrières d'un cimetière. Les barrières font plus de 3 m de haut (10 pieds) mais la créature saute par-dessus le mur et atterri directgement sur le chemin de l'homme. Il a des oreilles pointues, de grands yeux luisants, et un grand nez pointu. C'est la première apparition de celui que l'on va appeler ""Jack talons-à-ressorts"". Plus tard, Jack attaque un groupe de 3 femmes et 1 homme. Tous réussissent à s'enfuir sauf Polly Adams. Jack lui arrache le haut de son corsage, saisi ses seins, et commencé à griffer son estomac, déchirant sa robe au niveau du ventre, comme avec des doigts plaqués de fer. L'attaque laisse Adams inconsciente, découverte plus tad par un policier. Les victimes décriront plus tard Jack comme pouvant cracher des flammes bleues : L'intrus était grand, mince et fort. Il avait un nez proéminent, des doigts osseux, extrêmement puissants, qui ressemblaient à des griffes. Il était incroyablement agile. Il portait une longue cape flottante, comme aiment en porter les gens qui vont à l'opéra, les soldats et les comédiens ambulants. Sur la tête, il avait un casque haut, paraissant en métal. Sous la cape, une combinaison moulante d'une matière brillante comme de la toile cirée ou un filet métallique. Il avait une lampe attachée sur sa poitrine. Le plus bizarre de tout : les oreilles de la créatures étaient courtes et pointues comme celles d'un animal.","",sighting,1837-09$Londres (Angleterre),,,"",,"",Londres (Angleterre),""""","""",s4,"""",,1988,",1837-09,event,https://rr0.org/time/1/8/3/7/index.html#1837-09
"Octobre A Londres (Angleterre), Mary Stevens, une servante, retourne à la maison de ses employeurs sur Lavender Hill. En traversant Cut Throat Lane dans Clapham Common, un personnage bondit d'une allée, l'ensserrant fermement dans ses bras, embrasse son visage et commence à mettre ses mains dans son corsage. Stevens crie, faisant fuir le personnage. Des hommes des environs sont alertés par les cris et arrivent rapidement sur les lieux. Ils cherchent l'assaillant, sans succès. Le jour suivant, ""Jack talons à ressorts"" frappe une nouvelle fois en un lieu proche de la résidence de Mary Stevens. Il saute devant une voiture en route faisant perdre le contrôle de celle-ci par son conducteur et provoquant un accident. Les témoins de la scène déclarent que Jack-talons-à-ressorts s'est échappé en sautant sans effort par-dessus un mur de 3 m (9 pieds). Peu après l'incident de la voiture, Jack accosta une femme près de l'église de Clapham. Peu après the carriage incident. Spring Heeled Jack accosted a women near Clapham Church. Le personnage à laissé 2 empreintes de pas profondes de 7,5 cm (3 pouces), laissant imaginer une sorte de mécanisme de ""ressorts"" dans les chaussures.","",sighting,1837$,,"",1837,event,https://rr0.org/time/1/8/3/7/index.html