url,place,time,description,sources,id,place.name,place.org.name,place.org.surname,place.org.title,place.org.time,place.org.deprecated,place.org.note,place.org.place,place.org.description,place.org.sources,place.org.tags,place.org.image,place.org.id,place.org.dirName,place.org.url,place.org.events,place.org.type,place.org.places,place.org.kind,place.org.parent,place.place,place.org,place.place.name,place.place.surname,place.place.title,place.place.time,place.place.deprecated,place.place.note,place.place.place,place.place.description,place.place.sources,place.place.tags,place.place.image,place.place.id,place.place.dirName,place.place.url,place.place.events,place.place.type,place.place.locations,place.place.elevation,place.org.parent.name,place.org.parent.surname,place.org.parent.title,place.org.parent.time,place.org.parent.deprecated,place.org.parent.note,place.org.parent.place,place.org.parent.description,place.org.parent.sources,place.org.parent.tags,place.org.parent.image,place.org.parent.id,place.org.parent.dirName,place.org.parent.url,place.org.parent.events,place.org.parent.type,place.org.parent.places,place.org.parent.kind,place.org.parent.parent.name,place.org.parent.parent.surname,place.org.parent.parent.title,place.org.parent.parent.time,place.org.parent.parent.deprecated,place.org.parent.parent.note,place.org.parent.parent.place,place.org.parent.parent.description,place.org.parent.parent.sources,place.org.parent.parent.tags,place.org.parent.parent.image,place.org.parent.parent.id,place.org.parent.parent.dirName,place.org.parent.parent.url,place.org.parent.parent.events,place.org.parent.parent.type,place.org.parent.parent.places,place.org.parent.parent.kind,place.org.parent.parent.parent.name,place.org.parent.parent.parent.surname,place.org.parent.parent.parent.title,place.org.parent.parent.parent.time,place.org.parent.parent.parent.deprecated,place.org.parent.parent.parent.note,place.org.parent.parent.parent.place,place.org.parent.parent.parent.description,place.org.parent.parent.parent.sources,place.org.parent.parent.parent.tags,place.org.parent.parent.parent.image,place.org.parent.parent.parent.id,place.org.parent.parent.parent.dirName,place.org.parent.parent.parent.url,place.org.parent.parent.parent.events,place.org.parent.parent.parent.type,place.org.parent.parent.parent.places,place.org.parent.parent.parent.kind,place.org.parent.parent.parent.parent,place.org.parent.parent.parent,place.org.parent.parent
https://rr0.org/time/1/9/6/6/10/index.html,Giant Rock (Californie),,,,,,,,,,,,,,,,"",place,"",,1966-10,"13ᵉ ""Convention Annuelle des Vaisseaux Spatiaux"" ce mois-là à Giant Rock (Californie) À , la 13ᵉ Convention Annuelle des Vaisseaux Spatiaux réunit 5000 personnes.","",1966-10
https://rr0.org/time/1/9/6/6/10/index.html#1966-10,,1966-10,Intervention de James E. McDonald pour une étude objective et publique des ovnis.,"",1966-10
https://rr0.org/time/1/9/6/6/10/index.html,,1966-10,"Suite à différentes pressions (l'opinion, Gerald Ford, Josef Allen Hynek, Coleman VonKeviczky, McDonald) le projet Blue Book est examiné par un comité de scientifiques qui propose de confier le travail d'une étude scientifique approfondie des ovnis à une université américaine dont l'impartialité ne pourrait être mise en cause. Le Congrès approuve le projet et confie cette tâche à la Commission Condon, au sein de l'université du Colorado.","",1966-10
https://rr0.org/time/1/9/6/6/10/index.html#1966-10-26,Cold Bay AFS (Alaska),,,,,,,,,,,,,,,,"",place,"",,1966-10-26,"Le Hérisson du 20, titrant sur la création du projet Colorado : Les U.S.A. décident : 300000 $ pour élucider le mystère des soucoupes volantes. En encart, le loufoque côtoie le sérieux : La princesse Negonnah et le prince Nœsam délégués de la planète Tythan au congrès des engins inconnus. le Lancement du 1er satellite Intelsat 2. Observation à.","Cas Blue Book n° 11092 non résolu,s2,"""",,",1966-10-26
https://rr0.org/time/1/9/6/6/10/index.html#1966-10-27,,1966-10-27,le Récupération d'un corps suite à un crash dans le nord-ouest de l'Arizona.,"",1966-10-27