url,place,time,description,sources
https://rr0.org/time/1/9/8/7/index.html,,1987,"1987-02-05 Le Japon lance Astro C, satellite d'étude des rayonnements X et gamma.",""
https://rr0.org/time/1/9/8/7/index.html,,1987,"1987-03-08 20:40 A Levie (Corse du Sud), plusieurs témoins entendent 1 déflagration importante. 1 autre témoin voit juste avant la déflagration 1 objet ressemblant à une étoile filante de couleur rouge. Cet objet se déplace dans le ciel à grande vitesse. Il s'agit de la rentrée rentrée atmosphérique d'un météore GEPAN: PAN classé A. 1987-03-12 06:00 A (Seloncourt, Doubs), 1 témoin voit durant P4S/5S 1 boule lumineuse d'un diamètre équivalent à celui de la pleine Lune, se déplaçant sans bruit en laissant derrière elle une légère trainée incandescente GEPAN: PAN classé C. 31 Le module Kvant (astronomie X et ultraviolet) s'amarre à la station Mir.",""
https://rr0.org/time/1/9/8/7/index.html,,1987,,""
https://rr0.org/time/1/9/8/7/index.html,,1987,"1987-07-29 ~06:45 A Toulon-sur-Arroux (Saône-et-Loire), 2 témoins en voiture voient 1 masse blanche volumineuse et brillante se déplacer rapidement au-dessus de la forêt communale. Cette masse a la couleur du métal poli et a une longueur estimée à 20 m environ. Durant les quelques secondes d'observation, aucun bruit et aucune odeur ne sont remarqués. Cette masse disparaîtra sous la ligne d'horizon SEPRA: PAN classé D. 09T23:55 A Sierentz (Haut Rhin), 1 témoin observe depuis sa fenètre une forme allongée semblable à un cigare. De cette observation qui n'a duré que quelques secondes, il ressort que cet objet avait une couleur rouge cuivré, qu'il se déplaçait très vite sans laisser de trace GEPAN: PAN classé C.",""
https://rr0.org/time/1/9/8/7/index.html,,1987,"1987-08-18 1987-08-18 06:00 A Chions (Pordenone, Italie), 2 agriculteurs observent un objet argenté lenticulaire long de 10 m environ s'approcher jusqu'à 10 m du sol. A ce moment, l'ovni émet un intense faisceau lumineux bleuâtre qui frappe 2 poules et les fait disparaître. L'objet repart ensuite rapidement et silencieusement pour disparaître derrière les nuages Le cas est enquêté par Antonio Chiumiento (CISU) Ovni-présence n° 40, août 1988, p. 3. 1987-08-18 ~22:15 A Neuvy-sur-Barangeon, près de Vierzon (Allier), 17 témoins sur 7 sites voient 1 phénomène lumineux se déplacer et rapidement sans laisser de trace et sans bruit. Pour certains ce phénomène est composé de plusieurs lueurs blanches. 1 des témoins parle d'un objet en forme de cigare SEPRA: PAN classé D LDLN 291-292.",""
https://rr0.org/time/1/9/8/7/index.html,,1987,"1987-09-02 ~20:30 A Fort-de-France (Martinique), 2 contrôleurs aériens observent pendant 30 s environ 1 phénomène lumineux au-dessus de la tour de contrôle de l'aéroport. Le phénomène est composé de 1 boule importante se déplaçant horizontalement et accompagnée de 3 ou 4 autres boules plus petites de couleur rose. Une traînée blanchâtre est laissée lors de ses déplacements. Ce phénomène qui se déroule à haute altitude et dans un ciel dégagé sera observé par d'autres témoins dans les iles voisines Le GEPAN conclura qu'il reste inexpliqué malgré certaines caractéristiques faisant penser à la rentrée d'un débris spatial GEPAN: PAN classé D. 07 A Nort-sur-Erdre (Bretagne), affaire de ""Joe le taxi"". 21 Déclaration de Ronald Reagan à la 42ᵉ Assemblée générale de l'ONU. 29 2 singes, 10 rats, mouches, sauterelles, divers microorganismes et plantes s'envolent à bord de Cosmos 1887 (Bion) pour des expériences biologiques internationales.",""
https://rr0.org/time/1/9/8/7/index.html,,1987,"1987-10-01 ~02:00 A Vernoux-en-Vivarais (Ardèche), un automobiliste et son fils aperçoivent dans la campagne plusieurs lumières distantes de plusieurs m. Cette même observation se répète lors de 3 arrêts successifs L'enquête du GEPAN montrera qu'il s'agit des phares et de 2 projecteurs de 40 watts d'un camion citerne équipé spécifiquement à l'arrière pour le ramassage du lait GEPAN: PAN classé A. 13 Crash sibérien. 04 au 18Tla nuit 1 témoin observe dans le ciel 1 point très lumineux. Suite à un article paru dans la presse régionale de nombreux autres témoins de cette observation se manifestent Il s'agit probablement de la planète Jupiter présentant avec ses satellites une intense et spectaculaire activité en cette période de l'année GEPAN: PAN classé B.",""
https://rr0.org/time/1/9/8/7/index.html,,1987,,""
https://rr0.org/time/1/9/8/7/index.html,,1987,"Hiver En Italie, sur l'autoroute du Nord, les lumières des batteries de faisceaux de Franck-Luc Dancelme sont prises pour des ovnis G. B.: ""Franck Dancelme : Vendeur de rêves"", Ouest France, 1988.",""