description,events,eventType,id,place,sources,time,type,url,place.dirName,place.elevation,place.events,place.id,place.locations,place.name,place.sources,place.type
"le , 1 témoin à bord de son voilier observe un point lumineux qui stationne à l'avant du voilier. L'objet est de forme ovale, brillante avec 1 feu rouge d'un coté et un feu vert de l'autre. Au bout de quelques instants, l'objet part à grande vitesse. Aucun bruit n'a été perçu, le moteur du voilier était en fonctionnement.","",sighting,1990-07-03T22:30$MerignacGironde,,,"",,"",Merignac (Gironde),"",place,"""SEPRA"","""",s1,"""",,PAN classé D",1990-07-03T22:30,event,https://rr0.org/time/1/9/9/0/07/index.html#1990-07-03T22:30
"le 6 spécialistes des renseignements de l'armée américaine, connus plus tard comme ""les 6 de Gulf Breeze"" abandonnent leur poste à Augsbourg (Allemagne).","",sighting,1990-07-09$,,"",1990-07-09,event,https://rr0.org/time/1/9/9/0/07/index.html#1990-07-09
"le Le SEPRA est informé via les médias de la découverte à d'un important cratère apparu dans un champ. Le cratère fait 14 m de diamètre avec une couronne de terre effrondrée de 2,5 m environ et un tumulus central de 4,5 m sur 1,5 m de hauteur. A l'examen des roches et des gros blocs remontés du sous-sol 2 hypothèses sont retenues : la chute d'une grosse météorite ou une explosion en sous sol. Un tracto-pelle est mobilisé pour explorer le cratère en procédant doucement par strates de 50 à 70 cm. L'exploration se poursuit ainsi jusqu'à 7 m de profondeur. Au fur et à mesure des investigations des fragments de tôle sont retrouvés à diverses profondeurs. 25 fragments métalliques sont ainsi récupérés (Ce qui exclut l'hypothèse de la chute d'une météorite au profit de l'explosion probable en sous-sol d'une bombe datant de la 2nde guerre mondiale. Les fragments sont expédiés au laboratoire de l'armement de la DGA dont les conclusions confirment l'hypothèse envisagée. La reconstitution de l'engin permettra en effet d'identifier une bombe incendiaire de 250 kg d'origine britannique ou américaine et probablement fabriquée en avril 1942).","",sighting,1990-07-11$BernayEure,,,"",,"",Bernay (Eure),"",place,"""SEPRA"","""",s2,"""",,Cas de type A,""""""Patenet, Jacques"""""","""",s3,"""",,""Bernay 1990"" in ""Quelques enquêtes du GEPAN""",1990-07-11,event,https://rr0.org/time/1/9/9/0/07/index.html#1990-07-11
Le crop circle apparu ce mois-là Les 6 de Gulf Breeze sont arrêtés à.,"",sighting,1990-07-14$GulfBreezeFloride,,,"",,"",Gulf Breeze (Floride),"",place,"",1990-07-14,event,https://rr0.org/time/1/9/9/0/07/index.html#1990-07-14
le Le 1er satellite pakistanais est lancé par une fusée chinoise.,"",sighting,1990-07-16$,,"",1990-07-16,event,https://rr0.org/time/1/9/9/0/07/index.html#1990-07-16
"le à le mercredi 18 la nuit, de nombreux témoins dont une patrouille de gendarmes observent jusqu'à 13 objets se déplaçant sans bruit avec des feux clignotants. L'un des témoins mentionne une forme de cerf volant (Il s'agit très probablement de confusion avec des aéronefs. Cette observation est à rapprocher avec le départ le même jour du tour de France aérien des jeunes pilotes).","",sighting,1990-07-17$SaintOmerPasdeCalais,,,"",,"",Saint Omer (Pas-de-Calais),"",place,"""GEPAN"","""",s4,"""",,Cas de type B",1990-07-17,event,https://rr0.org/time/1/9/9/0/07/index.html#1990-07-17
le : Les médias de Floride recoivent sur leurs téléscripteur une étrange dépèche demandant la libération des six de Gulf Breeze.,"",sighting,1990-07-25$,,"",1990-07-25,event,https://rr0.org/time/1/9/9/0/07/index.html#1990-07-25
Apparition d'un crop circle (ci-contre).,"",sighting,1990-07$,,"",1990-07,event,https://rr0.org/time/1/9/9/0/07/index.html