url,place,dateTime,description,sources,id,place.name,place.org,place.place.locations,place.place.elevation,place.place.dirName,place.place.data
https://rr0.org/time/1/9/8/1/08/index.html,,1981-08,"~20:30 A Roubais (Nord), 1 automobiliste aperçoit plein ouest 1 boule de feu rouge qui se scinde en 2. Diminuant progressivement et passant à une couleur plus orangée, le phénomène disparait en se confondant avec la brume. Aucun bruit n'a été entendu durant l'observation Certains éléments décrivent une probable observation du soleil couchant comme l'indiquent par ailleurs 2 des témoins GEPAN: PAN classé D.","",1981-08
https://rr0.org/time/1/9/8/1/08/index.html,,1981-08,"~22:45 A Saint Astier (Dordogne), plusieurs personnes voient 1 phénomène zigzagant à très haute altitude. La trajectoire est est-ouest et il se déplace à très grande vitesse, émettant des feux clignotant blancs et rouges. Aucun bruit n'est entendu durant l'observation qui dure moins de 5 mn GEPAN: PAN classé D. ~22:55 A Borgo (Haute Corse), 1 témoin observe durant environ 40 s et apparemment à moins de 400 m de lui 1 phénomène volant très lentement et proche du sol. A son passage, un halo de lumière éclaire le paysage. Ce phénomène de forme arrondie vers l'avant émet une flamme importante de plusieurs couleurs et se déplace sur une trajectoire est-ouest avec une légère inclinaison vers le sol. Craignant qu'il ne percute la montagne, le témoin s'attend à entendre un bruit d'impact mais rien ne se produit GEPAN: PAN classé C.","",1981-08
https://rr0.org/time/1/9/8/1/08/index.html,,1981-08,"~01:00 A Morzine (Haute Savoie), 1 personne prend des photographies du ciel étoilé depuis le parking du col de Joux. Le temps est clair, sans nuages mais au loin quelques éclairs de chaleur surgissent parfois. Son appareil photo est posé sur un trépied et chaque photo est prise avec une durée d'exposition de 1 mn 30 s. Lors du développement le témoin s'apercevoit de la présence sur ses photographies d'un phénomène lumineux qu'il n'a pas vu lors de la prise de vue, situé dans un halo à gauche de l'étoile Arcturus. Une carte du ciel ce jour là et à cette heure montre effectivement clairement Acturus dans la constellation du Bouvier GEPAN: PAN classé C.","",1981-08
https://rr0.org/time/1/9/8/1/08/index.html,,1981-08,"A Parcq (Pas-de-Calais), 1 agriculteur dans son champ observe des lumières incandescentes. Le lent déplacement nord-sud de ces objets permet au témoin de décrire une 1ère boule rouge que viennent rejoindre 2 boules blanches clignotantes. Ayant pris peur le témoin rentre chez lui où il continue d'apercevoir ces lumières GEPAN: PAN classé D.","",1981-08
https://rr0.org/time/1/9/8/1/08/index.html,,1981-08,"Entre 28 et 30 A Chateaurenard (Loiret), plusieurs personnes dont des gendarmes observent 1 point lumineux de couleur orange. Celui-ci était placé bien plus bas que les étoiles. Ce point semble clignoter et se déplacer à des vitesses variables avec des mouvements désordonnés. L'observation se poursuivra plusieurs soirs de suite par la brigade GEPAN: PAN classé D.","",1981-08