url,place,time,description,sources
https://rr0.org/time/1/9/8/2/06/index.html,,1982-06,"Le n° de Pif Gadget ce mois-ci, rééditant un succès de juillet dernier : un grand ballon se gonflant au soleil, qui génèrera certains témoignages 2 ovnis stationnent au-dessus du cosmodrome de Baikonur, Kazakhstan, URSS. L'un d'eux descend vers la plate-forme de lancement n° 1 tandis que l'autre se tient près des habitations du centre spatial. Les portiques de la plate-forme de lancement souffriront de soudures clivées et des rivets sembleront avoir été aspirés. Dans le complexe de logements, des milliers de fenêtres sont brisées ou trouées. La base est fermée 2 semaines pour réparations.",""
https://rr0.org/time/1/9/8/2/06/index.html,,1982-06,"A Nantes Château-Bougon, Loire Atlantique, plusieurs personnes dont le personnel d'une tour de contrôle d'un aéroport apercevoir un point brillant dans le ciel L'enquête montre que des pilotes ont également aperçu cet objet brillant et qu'il s'agit probablement d'un ballon stratosphérique lancé par le CNES du site de Gap et dérivant et évoluant à 30000 ou 40000 m d'altitude poussé par les vents de sud-ouest après le largage de sa charge utile GEPAN: PAN classé D.",""
https://rr0.org/time/1/9/8/2/06/index.html,,1982-06,Sortie du film E.T. de Steven Spielberg.,""
https://rr0.org/time/1/9/8/2/06/index.html,,1982-06,"A Saint Denis, Réunion, des personnes voient dans le ciel 1 forme sphérique dans un halo suivi d'un ensemble de points plus petits de couleur jaune orangé formant une trainée lumineuse. Cet ensemble se dirige lentement en ligne droite du nord-est au sud-est. L'observation dure moins de 1 mn et aucun bruit lié à ce phénomène n'est entendu D'après les descriptions du phénomène ces personnes ont probablement été témoins d'une rentrée atmosphérique GEPAN: PAN classé B.",""
https://rr0.org/time/1/9/8/2/06/index.html,,1982-06,1er vol d'un spationaute français : Jean-Loup Chrétien.,""