url,place,dateTime,description,sources,id
https://rr0.org/time/1/9/1/1/index.html,,1911,"A Saint George (Australie), observation d'un mystérieux aéronef transportant 2 hommes survolant la ville, venant de la direction du New South Wales ""Mysterious Airships"", Evening Post (Nouvelle Zélande), 1911-05-15. 1911-05-15 Sur une plage près de Yamba (Australie), on retrouve un aéronef grossièrement construit ""Mysterious Airships"", Evening Post (Nouvelle Zélande), 1911-05-15. 1911-05-21 À Evansville (Indiana), un alligator de 2 pieds de long tombe du ciel et atterrit sur le pas de la porte de Mme Hiram Winchell, qui tue rapidement la bête.","",1911
https://rr0.org/time/1/9/1/1/index.html,,1911,"1911-08-10 le soir Près de Durango (Colorado), des ranchers et autres résidents voient soudainement dans le ciel de ce qui semblait être une boule de feu d'une taille comparable à une pleine Lune. L'observation dure plusieurs heures. Le phénomène semble d'abord venir vers le sol en grandissant progressivement jusqu'à développé une taille de la moitié encore de la largeur d'une pleine lune, puis redevient finalement petit et disparaît ""Colorado Ranchers Observe Phenomenon Grow Larger"", Light de San Antonio (Texas), 1911-08-11.","",1911
https://rr0.org/time/1/9/1/1/index.html,,1911,"1911-10-21 A Winnipeg (Manitoba), un vaisseau aérien est déclaré saisi par des huissiers ""Mystery Airship Seized At Winnipeg"", News Telegram de Calgary (Alberta), 1911-10-23.","",1911
https://rr0.org/time/1/9/1/1/index.html,,1911,"1911-11-10 05:00 A Moberly (Missouri), nombre de citoyens voient un aéronef survoler la ville, à grande vitesse vers le nord-ouest ""Airship Passed Over"", Weekly Monitor de Moberly (Missouri), 1911-11-14.","",1911
https://rr0.org/time/1/9/1/1/index.html,,1911,"A New York (USA), un aéronef mystérieux survole le pont de Brooklyn UFO Roundup, 4-36.","",1911