url,place,time,description,sources
https://rr0.org/time/1/9/7/7/10/index.html,,1977-10,"A Conde-sur-Escaut (Nord), une agricultrice dans un champs est survolée un très court instant par une sphère lumineuse. D'autres personnes observeront une lueur inhabituelle à l'extrémité du champs où se situait la cultivatrice La gendarmerie prévenue 3 jours plutard ne constatera aucune trace au sol dans la zone indiquée par les témoins GEPAN : PAN classé C.",""
https://rr0.org/time/1/9/7/7/10/index.html,,1977-10,"A Saint Porchaire (Charente Maritime, France), un témoin observe au château de la Roche Courbon un phénomène brillant lançant des flammes qui stationne à 30 mn d'altitude environ. De forme oblongue, il émet des scintillements rouges et verts provenant de la partie centrale de l'objet. Une lumière qualifiée d'""étrange"" émane de l'arrière. Les gendarmes prévenus peuvent aussi observer l'objet jusqu'à 23:30 7 heures plus tard une secousse sismique est enregistrée à 35 km du lieu d'observation. Le phénomène revient le lendemain soir au-dessus du parc du château ""Des ovni en Charente Maritime"", Le Parisien Libéré, 12 octobre 1977.",""
https://rr0.org/time/1/9/7/7/10/index.html,,1977-10,Le chercheur espagnol Juan José Benitez reçoit de son gouvernement un dossier de 78 pages concernant les 12 cas les mieux authentifiés d'ovnis. Cette documentation contient des photos et un film pris par un pilote militaire.,""
https://rr0.org/time/1/9/7/7/10/index.html,,1977-10,"A Guise (Aisne), plusieurs personnes observent la présence d'un phénomène lumineux à l'horizon qu'ils ne s'expliquent pas. Des étincelles semblent jaillir d'un objet de couleur rouge qui disparaît progressivement. Aucune trace ou indice sur les lieux présumés de la présence du phénomène n'ont été retrouvés GEPAN : PAN classé C.",""
https://rr0.org/time/1/9/7/7/10/index.html,,1977-10,"Près de Dyfed (Pembrokeshire, Wales), Melle Pauline Coombs, sa mère, et ses 4 enfants reviennent en voiture chez eux à la ferme Ripperston lorsque sa mère attire leur attention sur un objet en forme de disque blanchâtre au-dessus de leur voiture, volant en direction de la mer ; curieuses les femmes roulent vers la côte, puis traversent 2 champs pour arriver au bord de l'eau. Plusieurs centaines de yards au large se trouve un rocher affleurant nommé Stack Rocks, s'élevant entre à 80 ou 100 pieds au-dessus de l'eau. Elles ne peuvent voir l'ovni, mais distinguent bien 2 humanoïdes marchant sur les rochers. Ils sont vêtus d'équipements argentés semblables à la combinaison d'un homme-grenouille ; leurs têtes (ou casques) sont extrêmement grands et rectangulaires, arrondis aux coins, sans caractéristiques observables. Ils semblent chercher quelque chose. Une ""porte"" apparaît sur face droite des rochers, glissant alternativement ouverte et fermée comme la porte d'un dumbwaiter. Un des personnages entre par cette porte et semble descendre un escalier, dispparaissant dans l'intérieur assombri, puis réapparaissant à nouveau. L'escalier n'est pas visibles des témoins. A cette descente finale, la porte se referme et disparaît. Sur le côté gauche des rochers, le 2nd personnage semble ""marcher"" à la surface de l'eau, disparaissant finalement derrière le côté gauche des rochers. Le spectacle a duré 15 mn Humcat 1977-54 Randall Jones Pugh pour BUFORA.",""
https://rr0.org/time/1/9/7/7/10/index.html,,1977-10,"Un couple est assis sur un banc face à la mer quand soudain une lumière apparaît, suî l'eau. Elle approche rapidement. Elle est éblouissante. L'objet est décrit comme immense, d'une taille estimée au triple de la pleine Lune. L'objet monte verticalement dans le ciel, effectue un quart de tour, change de couleur et disparaît soudainement Les-ovnis.com < ""Les vaches se mettent à meugler"", Sud-Ouest, 27 juillet 2009.",""
https://rr0.org/time/1/9/7/7/10/index.html,,1977-10,"Près de Marsh Gibbon (Angleterre), une famille roulant sur Station Road près du village voit soudain son moteur s'arrêter de foncê et la voiture s'arrêter. Un grand perê en combinaison argentée apparaît alors de derrière une haie sur le bord de la route, fait le tour du véhicule et disparaît derrière la haie de l'autre côté de la route. La peinture sur le véhicule aurait été trouvée écorchée. Un événement semblable sera signalé le mois suivant dans la même région HC addition # 769 Norman Oliver, Quest UFO Magazine vol. 11, n° 6.",""