description,events,eventType,id,place,sources,time,type,url,place.dirName,place.elevation,place.events,place.id,place.locations,place.name,place.type
"le à le mardi 17 19 h La mystérieuse lumière volante qui a survolé le Collège Sainte-Marie, à Oakland, puis est partie pour San Francisco. Elle est exactement comme décrite par les Sacramentiens, et semblable au croquis publié il y a quelques jours dans ""The Call"" d'après une description fournie par quelqu'un qui l'a vue Par un soir morne et pluvieux, une lumière électrique propulsée par une force mystérieuse passe à basse altitude au-dessus de la ville de , évitant habilement les hauteurs avant de disparaître. Elle est vue par des centaines de témoins. Certains décriront un objet énorme, en forme de cigare, fabriqué en aluminium et pourvu de grandes ailes. Personne ne met en doute l'origine terrestre de l'objet, certains affirmant même avoir entendu une voix s'écrier : On espère bien être à San Francisco demain midi","",sighting,1896-11-17T18:00$SacramentoCalifornie,,,"",,"",Sacramento (Californie),place,""""","""",s1,"""",,San Fransisco Call,"""","""",s2,"""",,""What Was It?"","""","""",s3,"""",,""That Mysterious Light""",1896-11-17T18:00,event,https://rr0.org/time/1/8/9/6/11/index.html#1896-11-17T18:00
"le Un objet semblable à celui observé la veille, sombre, équipé d'un projecteur et de 4 grandes ailes qui semblaient actionnées par de l'air comprimé passe au-dessus de Oak Park et de Sacramento.","",sighting,1896-11-18$,,"",1896-11-18,event,https://rr0.org/time/1/8/9/6/11/index.html#1896-11-18
"le dans la soirée, à , on observe dans le ciel une sorte de ballon avec un phare à l'avant, un projecteur mobile ventral et 2 paires d'ailes devant et derrière.","",sighting,1896-11-20$OaklandCalifornie,,,"",,"",Oakland         (Californie),place,"",1896-11-20,event,https://rr0.org/time/1/8/9/6/11/index.html#1896-11-20
le Un groupe de passagers d'un tramway d' observe un cigare ailé projetant un brillant faisceau de lumière et capable de voler contre le vent.,"",sighting,1896-11-22$OaklandCalifornie,,,"",,"",Oakland (Californie),place,"",1896-11-22,event,https://rr0.org/time/1/8/9/6/11/index.html#1896-11-22
le Sommet de la vague d'observations.,"",sighting,1896-11-26$,,"",1896-11-26,event,https://rr0.org/time/1/8/9/6/11/index.html#1896-11-26