url,place,time,description,sources,id,place.name,place.org.name,place.org.surname,place.org.title,place.org.time,place.org.deprecated,place.org.note,place.org.place,place.org.description,place.org.sources,place.org.notes,place.org.tags,place.org.image,place.org.id,place.org.dirName,place.org.url,place.org.events,place.org.type,place.org.parent,place.org.places,place.org.kind,place.place,place.org,place.place.name,place.place.surname,place.place.title,place.place.time,place.place.deprecated,place.place.note,place.place.place,place.place.description,place.place.sources,place.place.notes,place.place.tags,place.place.image,place.place.id,place.place.dirName,place.place.url,place.place.events,place.place.type,place.place.parent,place.place.locations,place.place.elevation,place.org.parent.name,place.org.parent.surname,place.org.parent.title,place.org.parent.time,place.org.parent.deprecated,place.org.parent.note,place.org.parent.place,place.org.parent.description,place.org.parent.sources,place.org.parent.notes,place.org.parent.tags,place.org.parent.image,place.org.parent.id,place.org.parent.dirName,place.org.parent.url,place.org.parent.events,place.org.parent.type,place.org.parent.parent.name,place.org.parent.parent.surname,place.org.parent.parent.title,place.org.parent.parent.time,place.org.parent.parent.deprecated,place.org.parent.parent.note,place.org.parent.parent.place,place.org.parent.parent.description,place.org.parent.parent.sources,place.org.parent.parent.notes,place.org.parent.parent.tags,place.org.parent.parent.image,place.org.parent.parent.id,place.org.parent.parent.dirName,place.org.parent.parent.url,place.org.parent.parent.events,place.org.parent.parent.type,place.org.parent.parent.parent.name,place.org.parent.parent.parent.surname,place.org.parent.parent.parent.title,place.org.parent.parent.parent.time,place.org.parent.parent.parent.deprecated,place.org.parent.parent.parent.note,place.org.parent.parent.parent.place,place.org.parent.parent.parent.description,place.org.parent.parent.parent.sources,place.org.parent.parent.parent.notes,place.org.parent.parent.parent.tags,place.org.parent.parent.parent.image,place.org.parent.parent.parent.id,place.org.parent.parent.parent.dirName,place.org.parent.parent.parent.url,place.org.parent.parent.parent.events,place.org.parent.parent.parent.type,place.org.parent.parent.parent.parent,place.org.parent.parent.parent.places,place.org.parent.parent.parent.kind,place.org.parent.parent.places,place.org.parent.parent.kind,place.org.parent.places,place.org.parent.kind,place.org.parent.parent.parent,place.org.parent.parent
https://rr0.org/time/1/9/5/4/10/17/index.html#1954-10-17T02:00,Mirande (Gers),,,,,,,,,,,,,,,,,"",place,,"",,1954-10-17T02:00,"le Le n° 505 de Voilà Europe Magazine paraît ce jour-là, titrant : Le mystère des soucoupes est résolu Dans le secteur de Raymond Baron (19 ans, cultivateur à Valentées), revient en vélomoteur d'une fête à Saint Médard. Soudain, à la hauteur de ""La Tournée d'Idrac"", à 500 m du sommet des Agrolles, il aperçoit une lumière étrange. Parvenu au niveau du point où le phénomène se situe, il ne voit plus rien. Mais, en levant les yeux, il remarque dans le ciel un globe ovale d'aspect rougeâtre entouré d'une couronne bleue qui paraît se diriger vers Mirande sans faire le moindre bruit.","Le dossier 1954 et l'imposture rationaliste,s1,""""""Sud-Ouest de Bordeaux, p. 12, 21 octobre 1954 < Sider, J."""""",""Ramuel éditeur, 1997, pp. 111-112"",",1954-10-17T02:00
https://rr0.org/time/1/9/5/4/10/17/index.html,Reims (Marne (Grand Est (France))),,,,,,,,,,,,,51454,org/fr/ges/51/51454,,"",org,,,,,,,,,,,,,51,org/fr/ges/51,,"",org,,,,,,,,,,,,,ges,org/fr/ges,,"",org,,,,,,,,,,,,,fr,org/fr,,"",org,,"",country,",,,,,,,,,,,,,,,"""",place,,""48.598888888888894,7.76"",",region,",,,,,,,,,,,,,,,"""",place,,""49,4.25"",",department,",,,,,,,,,,,,,,,"""",place,,""49.26277777777778,4.034722222222222"",",city,,,,,,,,,,,,,,,,"",place,,"49.26277777777778,4.034722222222222",,1954-10-17,"M. Mozin, tout en se rendant à pour assister à un match de football avec son ami M. Houssière, s'arrête à l'endroit où il a vu l'objet la veille pour vérifier s'il y a des traces, espérant prouver à son ami qu'il n'a pas rêvé. Dans un espace étroit entre un fossé de 1 m de large et 50 cm de profondeur et la route, 3 empreintes en demi-cercle et profondes de 8 à 10 cm sont visibles avec au centre du cercle imaginaire d'environ 1,40 m formé par ces 3 empreintes, un rond carbonisé de 20 cm de diamètre dégageant une odeur que le témoin a rapproché de celle du benzène. La voiture a dû nécessairement passer à entre 3 et 5 m de l'objet.","",1954-10-17$org_fr_ges_51_51454
https://rr0.org/time/1/9/5/4/10/17/index.html,Saint-Cyr-sur-Mer (France),,,,,,,,,,,,,,,,,"",place,,"",,1954-10-17,"A Leon B., conseiller municipal, voit un engin circulaire, de couleur orange, s'élever du sol.","Quincy,s2,"""",,",1954-10-17
https://rr0.org/time/1/9/5/4/10/17/index.html#1954-10-17T14:30,Cabasson (France),,,,,,,,,,,,,,,,,"",place,,"",,1954-10-17T14:30,"le , un homme (65 ans) chasse, accompagné de son chien, près du confluent de la Durance et du canal de Brillance, voit sur le sol à 40 m de lui, un ojet gris d'environ 4 m de long et 1 m de haut, surmonté d'un dôme d'ou sortent 2 silhouettes casquées. Le témoin s'enfuit, son chien court vers l'objet mais bat bientôt en retraite, marchant difficilement, comme partiellement paralysé.","",1954-10-17T14:30
https://rr0.org/time/1/9/5/4/10/17/index.html#1954-10-17,,1954-10-17,"le A à Mar-Vivo (La Seyne/Mer, près de Toulon), un habitant observe une ""soucoupe"" pendant 15 minutes avant de la voir se diriger vers Bandol.","""Vague 1954 - L'affaire toulonnaise ou un cas sidérant..."",s3,""""""Seray, Patrice"""""",""CNEGU, décembre 2004."",",1954-10-17
https://rr0.org/time/1/9/5/4/10/17/index.html#1954-10-17T20:30,Varigney (France),,,,,,,,,,,,,,,,,"",place,,"",,1954-10-17T20:30,"le , plusieurs témoins, dont M. Beuclair (policier), voient 1 objet brillant, rouge vif, demi-sphérique par-dessus, descendre au sol à 20 m d'eux. Des lumières rouges et blanches étaient visibles sous l'appareil.","",1954-10-17T20:30
https://rr0.org/time/1/9/5/4/10/17/index.html#1954-10-17,,1954-10-17,"Au Brusc (près de Six-Fours-les-Plages, Var), 2 pêcheurs observent une soucoupe.","""Vague 1954 - L'affaire toulonnaise ou un cas sidérant..."",s4,""""""Seray, Patrice"""""",""CNEGU, décembre 2004."",",1954-10-17