url,place,dateTime,description,sources,id,place.name,place.org.dirName,place.org.code,place.org.places,place.org.kind,place.org.parent,place.place,place.org,place.place.locations,place.place.elevation,place.place.dirName,place.place.data,place.org.parent.dirName,place.org.parent.code,place.org.parent.places,place.org.parent.kind,place.org.parent.parent.dirName,place.org.parent.parent.code,place.org.parent.parent.places,place.org.parent.parent.kind,place.org.parent.parent.parent.dirName,place.org.parent.parent.parent.code,place.org.parent.parent.parent.places,place.org.parent.parent.parent.kind,place.org.parent.parent.parent.parent,place.org.parent.parent.parent,place.org.parent.parent
https://rr0.org/time/1/9/9/6/11/index.html#1996-11-05,Marchiennes (Nord),,"",,,,1996-11-05,", 2 témoins observent le passage très rapide d'un phénomène lumineux cylindrique avec une trainée importante. Aucun bruit n'est entendu (A noter que le lieu d'observation est proche de l'aéroport de Lille et que le phénomène observé suivait la même route que les avions de ligne).",",s1,""SEPRA"",,",1996-11-05
https://rr0.org/time/1/9/9/6/11/index.html#1996-11-07,,1996-11-07,Lancement de Mars Pathfinder et MGS.,"",1996-11-07
https://rr0.org/time/1/9/9/6/11/index.html#1996-11-21T05:00,Mid et West Wales,,"",,,,1996-11-21T05:00,"jeudi 21 05 h Une violente explosion secoue le massif du Parmelan, au-dessus de la commune de Dingy-Saint-Clair (Haute-Savoie). Les rares témoins évoquent un éclair, ce qui laissera penser qu'un avion aurait pu s'écraser. Les secours sont appelés immédiatement et Dingy devint une base arrière pour les équipes de recherche (plus de 200 hommes). Journalistes, ufologues et curieux se pressent dans la petite bourgade. C'est alors que plusieurs témoins remarquent la présence de deux hommes vêtus de noir, qui ne cessent de poser des questions. Lorsque Jean-Pierre Troadec les interroge sur les raisons de leur curiosité, ils coupent court à toute discussion, tournent les talons et quittent les lieux. Étaient-ce des MIB ? jeudi 21 Dans le un des administrés du Dr Alan Williams (MP de Carmarthen East et Dinefwr) voit des lumières intenses à intervalles fréquents et très basses altitudes qu'il interprète comme un appareil triangulaire volant à basse altitude (Le MoD suggèrera qu'il s'agissait d'exercices d'appareils militaires à basse altitude).","""Released files cast light on famous Welsh ‘UFO’ sighting"",s2,""Lettre au MoD < Darren Devine"",Wales Online,2013-03-28",1996-11-21T05:00
https://rr0.org/time/1/9/9/6/11/index.html#1996-11-22T06:00,Illkirch (Bas Rhin),,"",,,,1996-11-22T06:00,", 1 témoin observe le passage très rapide de 1 boule lumineuse avec une trainée. Le phénomène décrit est probablement une rentrée atmosphérique.",",s3,""SEPRA"",,",1996-11-22T06:00
https://rr0.org/time/1/9/9/6/11/index.html#1996-11-24T16:00,Estrees-Saint Denis (Oise),,"",,,,1996-11-24T16:00,", 1 témoin observe des points et objets lumineux évoluant dans le ciel. Un autre témoin contacté par le 1er observe le phénomène en identifiant clairement l'évolution d'avions très fréquents dans la région (Il s'agit donc d'une méprise, faite par un témoin par ailleurs peu crédible).",",s4,""SEPRA"",,",1996-11-24T16:00
https://rr0.org/time/1/9/9/6/11/index.html#1996-11-26,Penderyn (Wales),,"",,,,1996-11-26,"Près de , observation d'une lumière oblongue.","""Released files cast light on famous Welsh ‘UFO’ sighting"",s5,""Darren Devine"",Wales Online,2013-03-28",1996-11-26