url,place,dateTime,description,sources,id,place.name,place.org,place.place.locations,place.place.elevation,place.place.dirName,place.place.data
https://rr0.org/time/1/9/6/5/12/index.html,,1965-12,"la nuit Frank Borman et James Lovell entendent ""quelque chose"" frapper le hublot de leur capsule Gemini 7, filant à 28000 km/h à une distance variant entre 160 et 205 km du sol terrestre. A peine remis de leur frayeur, les jeunes astronautes aperçoivent un étrange objet à proximité, entouré de particules fluorescentes.","",1965-12
https://rr0.org/time/1/9/6/5/12/index.html,,1965-12,Incident de Kecksburg.,"",1965-12
https://rr0.org/time/1/9/6/5/12/index.html,,1965-12,"Dans les Costswold Hills solitaires, un automobiliste signale avoir été doublé par un objet en forme de Land-Rover, se déplaçant à grande vitesse sans phares ni feux arrière, avec seulement une sorte de lumière clignotante au sommet. Quand le conducteur étonné met ses feux de route et essaie de le prendre en chasse, l'objet se contente de disparaître dans un nuage de brume ou de fumée FSR, 1966-03/04, p. 35 < Bowen, C., En quête d'humanoides, p. 24.","",1965-12
https://rr0.org/time/1/9/6/5/12/index.html,,1965-12,Réélection de De Gaulle.,"",1965-12
https://rr0.org/time/1/9/6/5/12/index.html,,1965-12,"A Groom Lake, un A-12 (#126) s'écrase immédiatement après son décollage. Le pilote, Vojvodich, s'éjecte et survit McIninch.","",1965-12