description,events,id,place,sources,time,type,url,place.name,place.org,place.place.dirName,place.place.elevation,place.place.events,place.place.id,place.place.locations,place.org.dirName,place.org.events,place.org.id,place.org.kind,place.org.parent.dirName,place.org.parent.events,place.org.parent.id,place.org.parent.kind,place.org.parent.parent.dirName,place.org.parent.parent.events,place.org.parent.parent.id,place.org.parent.parent.kind,place.org.parent.parent.parent,place.org.parent.parent.places,place.org.parent.parent.type,place.org.parent.places,place.org.parent.type,place.org.places,place.org.type,place.org.parent,place.place,place.org.parent.parent
"Entre le village de et Toutry, Daniel Grapin et François Bolatre, topographes, voient 1 sphère lumineuse de 3,50 m de diamètre, posée près de la N454.","",1954-10-10,"Epoisses (Côte-d'Or, France)",,,,"",,"",""""","""",s1,"""",,,",1954-10-10,sighting,https://rr0.org/time/1/9/5/4/10/10/index.html
"À , 2ᵉ atterrissage ici, vu par Marius Dewilde et son fils de 4 ans. Un disque de 6 m de diamètre, haut de 1 m environ, se pose encore sur la voie du chemin de fer. 7 petits hommes en sortent et leur parlent dans un langage inconnu. Puis l'engin disparaît sans bruit ni fumée. Des empreintes, plus larges que les précédentes, symmétriques, sont observées. Dewilde refuse de déposer sur ce cas.","",1954-10-10,"Quarouble (Nord, France)",,,,"",,"","",1954-10-10,sighting,https://rr0.org/time/1/9/5/4/10/10/index.html
"le Roger Thiriet (gardien à la prison d'Ecouvres) roule en motocyclette quand il voit soudain un objet couleur d'aluminium ayant la forme d'une assiette, avec une coupole et 2 hublots. Il a environ 2 m de diamètre, 1 m de haut et s'éloigne immédiatement.","",1954-10-10T06:30,"Charmes-la-Côte (Meurthe-et-Moselle, France)",,,,"",,"",""""","""",s2,"""",,21,France-Soir",1954-10-10T06:30,sighting,https://rr0.org/time/1/9/5/4/10/10/index.html#1954-10-10T06:30
"le , M. Bon (professeur de mathématiques) observe un disque argenté d'environ 7 m de diamètre s'élevant silencieusement d'un point situé à environ 250 m du bord de la route. Il plonge en tournoyant vers la terre jusqu'à 800 m d'altitude à peu près. Il s'envole alors à l'horizontale à une vitesse vertigineuse.","",1954-10-10T14:00,Saint-Germain-de-Livets (France),,,,"",,"",""""","""",s3,"""",""Le Figaro, Libération, Le Parisien"",14,France-Soir",1954-10-10T14:00,sighting,https://rr0.org/time/1/9/5/4/10/10/index.html#1954-10-10T14:00
"le , des témoins voient dans le ciel pendant 1 mn une énorme boule de feu passant du blanc à l'orange, laissant derrière elle une longue traînée lumineuse, qui après une trajectoire horizontale monte vers le ciel.","",1954-10-10T20:30,Apt (France),,,,"",,"",""""","""",s4,"""",Le Provencal,14,""Un objet mystérieux dans le ciel aptésien""",1954-10-10T20:30,sighting,https://rr0.org/time/1/9/5/4/10/10/index.html#1954-10-10T20:30
", Roger Gayout et sa famille voient 1 objet très brillant s'approcher très près du sol.","",1954-10-10,"Saillat-sur-Vienne (Haute-Vienne, France)",,,,"",,"",""""","""",s5,"""",,13,Le Figaro",1954-10-10,sighting,https://rr0.org/time/1/9/5/4/10/10/index.html
"le Lors de la foire de (...) l'armée avait installé un système radar ainsi que des projecteurs de DCA. (...) un des puissants projecteurs, qui balayait le ciel pour la grande joie des badauds, accrocha soudain dans son faisceau un mystérieux objet. C'était une sorte de globe lumineux, immobile en plein ciel et qui, selon l'expression de certains témoins, scintillait comme une boule d'arbre de Noël. L'officier présent estima que l'objet devait avoir au moins 50 m de diamètre, et qu'il semblait se trouver à environ 10000 m d'altitude. Pour s'assurer qu'il s'agissait pas d'un phénomène ou d'une illusion d'optique, on décida de procéder à un nettoyage complet du projecteur. On changea aussi les charbons et on ralluma. L'objet était toujours là. Pendant 3 h, l'engin resta immobile. Il ressemblait à une sorte de cigare vertical. Puis, comme rien ne se passait, ont finit par éteindre le projecteur. Le commandant Cotel, qui dirigeait le détachement de la DCA, adressa un rapport au gouverneur militaire de Metz. Il n'y a pas lieu de prendre en considération ces informations dans ce cas particulier. L'affaire fut classée. Pas un mot de l'observation faite non seulement par les techniciens mais aussi par les visiteurs, et par les habitants de Metz jusqu'au faubourgs de Sablon et de Queuleu. L'objet présentait la forme d'un petit cumulus immobile et de forme régulière. Mais sa forme, ses dimensions et sa position restaient rigoureusement identiques, de plus le ciel était parfaitement clair hormis ce cumulus supposé. Ce qui écarterait la possibilité d'un nuage. Or, un diamètre de 50 m fait beaucoup pour un ballon... Fait curieux : le radar avait balayé sans cesse le ciel durant l'observation, sans rien accrocher. Cela pouvait signifier 2 choses : soit l'objet n'était pas métallique, soit il se trouvait hors de portée utile des radars du type de celui qui fonctionnait à Metz.","",1954-10-10T23:00,Metz,,,,"",,"",""""","""",s6,"""",,1997,Sider",1954-10-10T23:00,sighting,https://rr0.org/time/1/9/5/4/10/10/index.html#1954-10-10T23:00
"(64 km de Metz, 43 km de Nancy) des habitants d'une ferme isolée, à quelques centaines de mètres de Moncourt, furent réveillés par un étrange sifflement. A travers les persiennes ils distinguèrent une lueur aveuglante qui semblait située à flanc de coteau. Quelques minutes plus tard, ils virent une sphère lumineuse s'élever verticalement et disparaître rapidement. Le lendemain, dans l'aprés-midi, les gendarmes conduits par le fermier à l'endroit ou l'étrange lumière semblait s'être posée, découvrirent des traces de calcination intense sur un chemin de terre. Des prélèvements de terre de pierres ont été effectués (...) Les résultats des analyses n'ont jamais été connus","",1954-10-10,Moncourt,,,,"",,"",""""","""",s7,"""",,1997,",1954-10-10,sighting,https://rr0.org/time/1/9/5/4/10/10/index.html