type,events,url,place,time,description,sources,id,place.name,place.org,place.place.id,place.place.events,place.place.locations,place.place.elevation,place.place.dirName,place.org.type,place.org.dirName,place.org.events,place.org.id,place.org.places,place.org.kind,place.org.parent.type,place.org.parent.dirName,place.org.parent.events,place.org.parent.id,place.org.parent.places,place.org.parent.kind,place.org.parent.parent.type,place.org.parent.parent.dirName,place.org.parent.parent.events,place.org.parent.parent.id,place.org.parent.parent.places,place.org.parent.parent.kind,place.org.parent.parent.parent.type,place.org.parent.parent.parent.dirName,place.org.parent.parent.parent.events,place.org.parent.parent.parent.id,place.org.parent.parent.parent.places,place.org.parent.parent.parent.kind,place.org.parent.parent.parent.parent,place.org.parent,place.place,place.org.parent.parent.parent,place.org.parent.parent
case,"",https://rr0.org/time/1/8/9/8/index.html#1898-01,Fort William (Ontario),,,"","",,,1898-01,"en le samedi 15 23 h À , alors qu'il se rend à son travail, un opérateur de chemins de fer voit un étrange phénomène lumineux s'approcher puis disparaître lentement. en le mois suivant Près de Salina (Kansas), une tempête de neige se met à faire tomber des blocs et boules énormes de neige.",""""",""Strange Object Seen In the Sky At Fort William"",s2,"""",Journal d'Ottawa (Ontario),17,"""","""",""Large Balls of Snow"",s3,"""",Daily Advocate de Newark (Ohio),28,""""",1898-01
case,"",https://rr0.org/time/1/8/9/8/index.html#1898-05,New Castle (Pennsylvanie),,,"","",,,1898-05,"en le lundi 2 en 1898 À , une foule de gens observe une mystérieuse lumière particulièrement brillante pendant un bon moment.",""""",""A Mysterious Light"",s4,"""",News de New Castle (Pennsylvanie),04,""""",1898-05
case,"",https://rr0.org/time/1/8/9/8/index.html#1898-07,Kiel,,,"","",,,1898-07,"en le vendredi 8 A , un objet rougi par le Soleil, large comme un arc-en-ciel, à une hauteur de 12 °, demeure brillant durant 5 mn, puis s'estompe, demeure presque stationnaire et disparaît au bout de 8 mn.",""""",Nature,s5,"""",,58-29,""""",1898-07
case,"",https://rr0.org/time/1/8/9/8/index.html#1898-10,Garland,,,"","",,,1898-10,"en le lundi 3 21 h Depuis et Sherman, au Texas, on observe un corps lumineux descendre et exploser.",""""",""Aerial Phenomena in Texas"",s6,"""",""Daily News de Galveston (Texas), 6 octobre 1898"",06,""""",1898-10
case,"",https://rr0.org/time/1/8/9/8/index.html#1898-11,,1898-11,"en le lundi 21 ""Le policier volant"" sur l'affiche d'une pièce de théâtre de J. M. Gaites montée sur les airships cette année-là Des toiles d'araignées flottantes - Un paragraphe dans le Advertiser de Mont gomery, Alabama, indique que le 21 novembre, de nombreux lots d'une substance de toile d'araignées a été vue flottant dans l'air et tombant des arbres et des feuilles au sol. Il y en avait en films de 15 ou 20 pieds de long, mais parfois des masses de quelques pouces de long et 1 pouce ou plus de large ont été observées. L'auteur du paragraphe indique qu'il ne s'agissait pas de toile d'araignée, mais que cela ressemblait aux fibres fines d'amiante, et que cela était probablement lié à la chute de météores de novembre. On dit également que cela a montré un effet phosphorescent. Comme plusieurs espèces d'araignées flottent indéfiniment dans les airs au moyen de leurs toiles délicates, le rédacteur ne voit aucune raison de penser que le phénomène mentionné ci-dessus était d'une quelconque autre nature. Il ne semble pas possible que les météores se consumant puisse d'une manière quelconque avoir produit ces toiles délicates",""""",The Air Ship: A Musical Farce Comedy (1898),s7,""""""Novak, Matthew"""""",Paleo-Future,25,"""","""",U.S.A. War Department Monthly Weather Review,s8,"""",,26,""""",1898-11
case,"",https://rr0.org/time/1/8/9/8/index.html,,1898,"Publication de La Guerre des Mondes, de H. G. Wells.","",1898