url,place,dateTime,description,sources,id
https://rr0.org/time/1/6/index.html,,,la méthode expérimentale de Francis Bacon,"",undefined
https://rr0.org/time/1/6/index.html,,,les observations instrumentées de Galilée,"",undefined
https://rr0.org/time/1/6/index.html,,,l'ardoise vierge de John Locke avant l'expérience du monde,"",undefined
https://rr0.org/time/1/6/index.html,,,l'adhésion de Isaac Newton,"",undefined
https://rr0.org/time/1/6/index.html,,,Mill,"",undefined
https://rr0.org/time/1/6/index.html,,,le scepticisme de David Hume,"",undefined