url,place,time,description,sources
https://rr0.org/time/1/6/index.html,,undefined,la méthode expérimentale de Francis Bacon,""
https://rr0.org/time/1/6/index.html,,undefined,les observations instrumentées de Galilée,""
https://rr0.org/time/1/6/index.html,,undefined,l'ardoise vierge de John Locke avant l'expérience du monde,""
https://rr0.org/time/1/6/index.html,,undefined,l'adhésion de Isaac Newton,""
https://rr0.org/time/1/6/index.html,,undefined,Mill,""
https://rr0.org/time/1/6/index.html,,undefined,le scepticisme de David Hume,""