description,events,id,place,sources,time,type,url,place.name,place.org,place.place.dirName,place.place.elevation,place.place.events,place.place.id,place.place.locations,place.org.dirName,place.org.events,place.org.id,place.org.kind,place.org.parent.dirName,place.org.parent.events,place.org.parent.id,place.org.parent.kind,place.org.parent.parent.dirName,place.org.parent.parent.events,place.org.parent.parent.id,place.org.parent.parent.kind,place.org.parent.parent.parent.dirName,place.org.parent.parent.parent.events,place.org.parent.parent.parent.id,place.org.parent.parent.parent.kind,place.org.parent.parent.parent.parent,place.org.parent.parent.parent.places,place.org.parent.parent.parent.type,place.org.parent.parent.places,place.org.parent.parent.type,place.org.parent.places,place.org.parent.type,place.org.places,place.org.type,place.org.parent.parent,place.org.parent,place.place,place.org.parent.parent.parent
"en le lundi 21 À , une énorme quantité de matériau blanc semblable à de la toile d'araignée tombe. Il est étrange pour le Soleil de se coucher comme il l'a fait ce jour-là et de ne pas devenir sombre -- le ciel est resté aussi brillant que s'il était éclairé par la Lune.","",1819-06,Osaka (Japon),,,,"",,"",""""","""",s1,"""",,,Pageant",1819-06,case,https://rr0.org/time/1/8/1/9/index.html#1819-06
"en le vendredi 13 À , chute d'un objet avec un duvet semblable à celui d'un tissu peluchant. Il est examiné par le professeur Russel Gravesnous qui ôte le duvet et trouve dessous une substance couleur [buff], pulpeuse. Une fois exposée à l'air, la substance émet une odeur aggressive et prend une couleur blême, ressemblant au sang veineux. L'objet est décrit comme étant tombé avec une lumière brillante.","",1819-08,Amherst (Massachusetts),,,,"",,"","""""""Annual Register, 63"""""","""",s2,"""",""1821 ; Edinburgh Philosophical Journal, 5-295; Annales de Chimie, 1821-67; American Journal of Science, 1-2-335 < The Complete Books of Charles Fort. New York: Dover, 1974, p. 41 < Fitch, Donna K., Strange: August Fortean Events"",,687,""""""Silliman Journal, 2, 335 < Roche, Edouard"""""","""",s3,"""",""1868, p. 75 < Deliyannis, Yannis : """"On """"viscous meteorites"""", Magonia Exchange"",14,Recherches sur les offuscations du soleil et les météores cosmiques",1819-08,case,https://rr0.org/time/1/8/1/9/index.html#1819-08
"en le samedi 9 Un corps céleste inconnu est signalé en train de traverser le disque solaire. Il ne s'agit ni d'une comète, ni d'un météore ou d'une météorite, et cet astre n'appartient à aucune catégorie connue, discernable.","",1819-10,,"",1819-10,case,https://rr0.org/time/1/8/1/9/index.html#1819-10
"(idem 9 octobre ?) Un globe flamboyant tombe sur l'île de Lethy, en Inde. Des chercheurs se rendent sur le site où le météore a été vu tomber et trouvent là une matière gélatineuse qui disparaît rapidement","",1819,,"""""""Edinburgh Philosophical Journal, 1"""""","""",s4,"""",,234,",1819,case,https://rr0.org/time/1/8/1/9/index.html
"en le mardi 2 Une pluie rouge tombe sur une région de la Hollande. le mardi 9 Une pluie noire s'abat sur le Canada pendant un tremblement de terre. le vendredi 19 Au Canada, il règne brusquement un intense obscurité en pleine journée ; des lumières célestes passent dans le ciel tandis qu'une chute de matière noire a lieu simultanément avec des secousses telluriques.","",1819-11,,"",1819-11,case,https://rr0.org/time/1/8/1/9/index.html#1819-11