description,events,id,place,sources,time,type,url,place.name,place.org,place.place.dirName,place.place.elevation,place.place.events,place.place.id,place.place.locations,place.org.dirName,place.org.events,place.org.id,place.org.kind,place.org.parent.dirName,place.org.parent.events,place.org.parent.id,place.org.parent.kind,place.org.parent.parent,place.org.parent.places,place.org.parent.type,place.org.places,place.org.type,place.org.parent.parent.dirName,place.org.parent.parent.events,place.org.parent.parent.id,place.org.parent.parent.kind,place.org.parent.parent.parent.dirName,place.org.parent.parent.parent.events,place.org.parent.parent.parent.id,place.org.parent.parent.parent.kind,place.org.parent.parent.parent.parent,place.org.parent.parent.parent.places,place.org.parent.parent.parent.type,place.org.parent.parent.places,place.org.parent.parent.type,place.org.parent,place.place,place.org.parent.parent.parent
"vers le , la gendarmerie reçoit des appels téléphoniques signalant le survol de la commune par un engin émettant une lumière vive. Sur place les gendarmes constateront un phénomène lumineux orangé qui se déplace dans le ciel dégagé à faible altitude en direction du nord-est. Des lumières clignotantes rouges et 1 lumière fixe verte émanent de l'engin (L'enquête démontrera qu'il s'agit du passage d'un aéronef de type DC-9 qui effectuait des entraînements de vols dans la région entre 20:30 et 21:15).","",1979~-04~-02~T20~:40,Beaucourt (Territoire de Belfort),,,,"",,"","""GEPAN"","""",s1,"""",,,PAN classé A",1979~-04~-02~T20~:40,case,https://rr0.org/time/1/9/7/9/04/index.html#1979~-04~-02~T20~:40
"vers le , 1 automobiliste et sa passagère sont surpris de voir 1 lumière fluorescente blanche très intense dans 1 champ ; elle éclaire le sol dans un rayon de plusieurs m. Celle-ci semble provenir d'une masse sombre aux formes arrondies plus grosse qu'une voiture. Cette observation a duré quelques secondes avant que la lumière ne s'éteigne complètement. Ce champ situé sur une crête est bordé d'un chemin communal. Aucune trace au sol n'a été retrouvée.","",1979~-04~-07~T06~:15,Cozes (Charente-Maritime),,,,"",,"","""GEPAN"","""",s2,"""",,,PAN classé C",1979~-04~-07~T06~:15,case,https://rr0.org/time/1/9/7/9/04/index.html#1979~-04~-07~T06~:15
"le Dans la région de , 2 officiers de la tribu Apache Jicarilla sont en patrouille de routine, leur véhicule les phares éteints, lorsqu'ils repérèrent l'appareil en survol à environ 50 pieds du sol avec un projecteur puissant dirigé vers le bétail.","",1979-04-08,Dulce,,,,"",,"","""""""Rommel, K. M., Jr."""""","""",s3,"""",""Winter 1975 - Spring 1979"""", Operation Animal Mutilation, Report of the district attorney, 1st judicial district, état du Nouveau-Mexique"",1980-06,""1979 Incidents"" in ""A Popular History of Livestock Mutilations in New Mexico",1979-04-08,case,https://rr0.org/time/1/9/7/9/04/index.html#1979-04-08
"vers le , des témoins observent dans le ciel 1 point lumineux qui se déplace. En s'immobilisant, il change de couleur tout en scintillant. Les gendarmes appelés sur les lieux constateront un point lumineux de la taille d'une étoile qui se déplace lentement vers l'est (Le GEPAN, bien que manquant d'information quant à la direction et la hauteur d'observation concluera qu'il s'agissait vraisemblablement d'une observation astronomique, peut-être Véga).","",1979~-04~-15~T22~:45,Chateaugiron (Ile-et-Vilaine),,,,"",,"","""GEPAN"","""",s4,"""",,,PAN classé B",1979~-04~-15~T22~:45,case,https://rr0.org/time/1/9/7/9/04/index.html#1979~-04~-15~T22~:45
"le , rentrant chez elles par un chemin de campagne, ces personnes voient une de ces lueurs se diriger rapidement vers le sol : ellent semblent venir d'un phénomène circulaire applati d'un diamètre de 2 m environ. Malgré leur observation qui a duré plusieurs mn, les témoins ne peuvent dire si le phénomène, estimé à une distance de 200 m, était posé sur le sol ou en stationnaire au-dessus du sol, car il dégageait une lumière très intense. Effrayées, elles rentreront chez elles avec des picotements dans les yeux. Aucune trace au sol ou sur l'environnement ne sera trouvée par la gendarmerie.","",1979-04-17T23:00,Courthezon (Vaucluse),,,,"",,"","""GEPAN"","""",s5,"""",,,PAN classé C",1979-04-17T23:00,case,https://rr0.org/time/1/9/7/9/04/index.html#1979-04-17T23:00
"le À , conférence spéciale sur les mutilations de bétail menée par le sénateur Schmitt. Des enquêteurs privés et officiers de maintien de l'ordre de plus de 10 états assistèrent à la conférence. en avril 1979 En Nouvelle-Zélande, observation d'une lumière non-identifiée.","",1979-04-20,Albuquerque (Nouveau-Mexique),,,,"",,"","""""""Rommel, K. M., Jr."""""","""",s6,"""",""Report of the district attorney, 1st judicial district, state of New Mexico"",1980,""Operation Animal Mutilation"",""""""Ellingham, Jimmy"""""","""",s7,"""",Stuff,30,""Schoolboys' balloon experiment mistaken for UFOs""",1979-04-20,case,https://rr0.org/time/1/9/7/9/04/index.html#1979-04-20
"vers le Aux , 1 témoin observe durant en 30 le passage d'ouest en est d'un phénomène orange apparemment gigantesque. Il disparaît brusquement sans laisser de trainée.","",1979~-04~-27~T23~:30,Pieux (Manche),,,,"",,"","""GEPAN"","""",s8,"""",,,PAN classé C",1979~-04~-27~T23~:30,case,https://rr0.org/time/1/9/7/9/04/index.html#1979~-04~-27~T23~:30