url,place,time,description,sources,id,place.name,place.org.name,place.org.surname,place.org.title,place.org.time,place.org.deprecated,place.org.note,place.org.place,place.org.description,place.org.sources,place.org.tags,place.org.image,place.org.id,place.org.dirName,place.org.url,place.org.events,place.org.type,place.org.parent,place.org.places,place.org.kind,place.place,place.org,place.place.name,place.place.surname,place.place.title,place.place.time,place.place.deprecated,place.place.note,place.place.place,place.place.description,place.place.sources,place.place.tags,place.place.image,place.place.id,place.place.dirName,place.place.url,place.place.events,place.place.type,place.place.parent,place.place.locations,place.place.elevation,place.org.parent.name,place.org.parent.surname,place.org.parent.title,place.org.parent.time,place.org.parent.deprecated,place.org.parent.note,place.org.parent.place,place.org.parent.description,place.org.parent.sources,place.org.parent.tags,place.org.parent.image,place.org.parent.id,place.org.parent.dirName,place.org.parent.url,place.org.parent.events,place.org.parent.type,place.org.parent.parent.name,place.org.parent.parent.surname,place.org.parent.parent.title,place.org.parent.parent.time,place.org.parent.parent.deprecated,place.org.parent.parent.note,place.org.parent.parent.place,place.org.parent.parent.description,place.org.parent.parent.sources,place.org.parent.parent.tags,place.org.parent.parent.image,place.org.parent.parent.id,place.org.parent.parent.dirName,place.org.parent.parent.url,place.org.parent.parent.events,place.org.parent.parent.type,place.org.parent.parent.parent.name,place.org.parent.parent.parent.surname,place.org.parent.parent.parent.title,place.org.parent.parent.parent.time,place.org.parent.parent.parent.deprecated,place.org.parent.parent.parent.note,place.org.parent.parent.parent.place,place.org.parent.parent.parent.description,place.org.parent.parent.parent.sources,place.org.parent.parent.parent.tags,place.org.parent.parent.parent.image,place.org.parent.parent.parent.id,place.org.parent.parent.parent.dirName,place.org.parent.parent.parent.url,place.org.parent.parent.parent.events,place.org.parent.parent.parent.type,place.org.parent.parent.parent.parent,place.org.parent.parent.parent.places,place.org.parent.parent.parent.kind,place.org.parent.parent.places,place.org.parent.parent.kind,place.org.parent.places,place.org.parent.kind,place.org.parent.parent.parent,place.org.parent.parent
https://rr0.org/time/1/9/7/2/03/index.html#1972-03-08,Salt Lake City (USA),,,,,,,,,,,,,,,,"",place,,"",,1972-03-08,Photographie du 8 à Salt Lake City le Observation (ci-contre) à.,"",1972-03-08
https://rr0.org/time/1/9/7/2/03/index.html#1972-03-02,,1972-03-02,"le Lancement de la sonde Pionner 10 vers Jupiter, puis vers les étoiles. Elle emporte une plaque gravée, un message codé pour d'éventuelles civilisations extraterrestres.","",1972-03-02
https://rr0.org/time/1/9/7/2/03/index.html#1972-03-18,Drocourt (Pas-de-Calais),,,,,,,,,,,,,,,,"",place,,"",,1972-03-18,"le Soir Le CNES fait le 2ème lancement de la fusée Tibère. Soir Un phénomène lumineux est observé de France, Suisse et Italie. Une veillée nocturne du Résufo, organisée ce soir-là, permet d'en collecter 36 photographies différentes. Soir À un couple rentre à pied d'un spectacle quand ils observent une boule rouge de 1m50 de diamètre à basse altitude, ils préviennent alors d'autres personnes et tout le monde admire le spectacle. L'objet parcourt par saccade la ligne de chemin de fer. Tout d'abord l'objet est immobile oscillant légèrement de gauche à droite et de bas en haut. Puis, brusquement il prend un départ fulgurant pour aller sur un autre point puis disparait un quart d'heure. Réapparait recommence. L'objet revient toujours avec le même manège à son point de départ, puis vient vers le milieu d'un champ et disparait brusquement. en mars 1972 à 19:15 À Pont de Cheruy Edouard Sessière et son fils Christian (17 ans), en voiture, sont soudain éblouis à proximité de la maison ""Cantamin"" au quartier du Brochet. La lumière provient d'un objet stabilisé à 35 m de haut. La lumière est tellement éblouissante que M. Sessière doit s'arrêter net. Elle ressemble à un arc électrique comme reflétée par des miroirs tournants. L'objet ne paraît pas métallique, son diamètre peut être de 10 m. Au bout de 2 mn il pivote en position horizontale, démarre, s'arrête 100 m plus loin pour reprendre sa position verticale et disparaître à grande vitesse en décrivant un ""S"" jaune-rose-rouge en direction de Charvieu. Le ""S"" disparaît au bout d'un quart d'heure. Effets physiques sur la montre et sur la voiture. ""crash"" ou ""boule de feu"" ayant laissé sur le flanc nord de la montagne du Trainon, à 2 km du rocher du Dromon, site de Théopolis, des tôles d'un satellite Cosmos soviétique en perdition au-dessus de la Provence.",",s1,"""",,,Ovni,s2,"""",Premier dossier complet... par Figuet M./ Ruchon J.L. ** éd. Alain Lefeuvre 1979,,""Ovni,s3,""M. Figuet/ J.L. Ruchon"",""Premier dossier complet..."""" éd. Alain Lefeuvre 1979, p. 378"",,Jean-Luc Chaumeil,s4,"""",""Le temps et les OVNI, p. 53"",",1972-03-18
https://rr0.org/time/1/9/7/2/03/index.html#1972-03-24T21:30,,1972-03-24T21:30,"le à le vendredi 24 22:30 Sur Antenne 2, numéro ""Les visiteurs de l'espace"" de l'émission 24 heures sur la 2.","""Emissions françaises récentes sur les soucoupes volantes"",s5,"""",""Phénomènes Spatiaux n° 31, mars 1972, p. 2"",",1972-03-24T21:30
https://rr0.org/time/1/9/7/2/03/index.html#1972-03-27,,1972-03-27,le Lancement de Venera 8 vers Vénus.,"",1972-03-27