url,place.name,place.org,place.place.locations,place.place.elevation,place.place.dirName,place.place.data,time,description,sources,place
https://rr0.org/time/1/9/7/2/03/index.html#1972-03-08,Salt Lake City (USA),,,,,,1972-03-08,Photographie du 8 à Salt Lake City Observation (ci-contre) à.,
https://rr0.org/time/1/9/7/2/03/index.html#1972-03-02,,1972-03-02,"Lancement de la sonde Pionner 10 vers Jupiter, puis vers les étoiles. Elle emporte une plaque gravée, un message codé pour d'éventuelles civilisations extraterrestres.",
https://rr0.org/time/1/9/7/2/03/index.html,,1972-03,"avril Le pilote et le copilote d'un avion de la petite compagnie privée américaine Newstar lancent un appel de détresse : Ici, Fox-trot, Bravo, Yankee 17 de la Newstar... Mayday !... Demande assistance en urgence... Suis perdu au nord de l'archipel des Bahamas. Compas déréglé, toute navigation rendue impossible... Réclame position par gonio... Le pilote est entré dans une zone de brouillard dense, de couleur jaunâtre, l'empêchant de faire tout repérage. Il ne voyait rien, alors que, même à vue d'œil, personne n'avait connaissance d'une perturbation dans cette zone. Puis, il semble que le pilote ait aperçu quelque chose et les liaisons radio sont définitivement interrompues.",
https://rr0.org/time/1/9/7/2/03/index.html#1972-03-18,Drocourt (Pas-de-Calais),,,,,,1972-03-18,"Soir Le CNES fait le 2ème lancement de la fusée Tibère. Soir Un phénomène lumineux est observé de France, Suisse et Italie. Une veillée nocturne du Résufo, organisée ce soir-là, permet d'en collecter 36 photographies différentes. Soir À un couple rentre à pied d'un spectacle quand ils observent une boule rouge de 1m50 de diamètre à basse altitude, ils préviennent alors d'autres personnes et tout le monde admire le spectacle. L'objet parcourt par saccade la ligne de chemin de fer. Tout d'abord l'objet est immobile oscillant légèrement de gauche à droite et de bas en haut. Puis, brusquement il prend un départ fulgurant pour aller sur un autre point puis disparait un quart d'heure. Réapparait recommence. L'objet revient toujours avec le même manège à son point de départ, puis vient vers le milieu d'un champ et disparait brusquement. 19:15 À Pont de Cheruy Edouard Sessière et son fils Christian (17 ans), en voiture, sont soudain éblouis à proximité de la maison "Cantamin" au quartier du Brochet. La lumière provient d'un objet stabilisé à 35 m de haut. La lumière est tellement éblouissante que M. Sessière doit s'arrêter net. Elle ressemble à un arc électrique comme reflétée par des miroirs tournants. L'objet ne paraît pas métallique, son diamètre peut être de 10 m. Au bout de 2 mn il pivote en position horizontale, démarre, s'arrête 100 m plus loin pour reprendre sa position verticale et disparaître à grande vitesse en décrivant un "S" jaune-rose-rouge en direction de Charvieu. Le "S" disparaît au bout d'un quart d'heure. Effets physiques sur la montre et sur la voiture. "crash" ou "boule de feu" ayant laissé sur le flanc nord de la montagne du Trainon, à 2 km du rocher du Dromon, site de Théopolis, des tôles d'un satellite Cosmos soviétique en perdition au-dessus de la Provence.",,s1,,,undefined;Ovni,s2,,Premier dossier complet... par Figuet M./ Ruchon J.L. ** éd. Alain Lefeuvre 1979,;"Ovni,s3,M. Figuet/ J.L. Ruchon,"Premier dossier complet..." éd. Alain Lefeuvre 1979, p. 378",;Jean-Luc Chaumeil,s4,,"Le temps et les OVNI, p. 53",
https://rr0.org/time/1/9/7/2/03/index.html#vendredi%2024%2021:30,,1972-03,"à vendredi 24 22:30 Sur Antenne 2, numéro "Les visiteurs de l'espace" de l'émission 24 heures sur la 2.","Emissions françaises récentes sur les soucoupes volantes",s5,,"Phénomènes Spatiaux n° 31, mars 1972, p. 2",
https://rr0.org/time/1/9/7/2/03/index.html#1972-03-27,,1972-03-27,Lancement de Venera 8 vers Vénus.,