description,events,id,place,sources,time,type,url,place.name,place.org,place.place.dirName,place.place.elevation,place.place.events,place.place.id,place.place.locations,place.org.dirName,place.org.events,place.org.id,place.org.kind,place.org.parent.dirName,place.org.parent.events,place.org.parent.id,place.org.parent.kind,place.org.parent.parent.dirName,place.org.parent.parent.events,place.org.parent.parent.id,place.org.parent.parent.kind,place.org.parent.parent.parent,place.org.parent.parent.places,place.org.parent.parent.type,place.org.parent.places,place.org.parent.type,place.org.places,place.org.type,place.org.parent,place.place,place.org.parent.parent
"le , un pilote civil expérimenté observe un objet elliptique avec une bordure lumineuse descendre rapidement, faire un tour complet puis un demi-tour 5 minutes.","",1952-07-19T02:55,"Willinston, Dakota du Nord",,,,"",,"",""""","""",s1,"""",,1492,",1952-07-19T02:55,sighting,https://rr0.org/time/1/9/5/2/07/19/index.html#1952-07-19T02:55
"le 3 objets circulaires noirs apparaissent au-dessus d', comme en 1950. Ils sont pris en chasse par des chasseurs F-86. Origine des objets des objets inconnue.","",1952-07-19T15:00,Oak Ridge,,,,"",,"","",1952-07-19T15:00,sighting,https://rr0.org/time/1/9/5/2/07/19/index.html#1952-07-19T15:00
"L'objet de Puerto Maldonado (Pérou) photographié le 19 le Au , à la frontière en jungle avec la Bolivie), l'attention de l'inspecteur des douanes Domingo Troncoso est attirée par un objet très étrange en forme de cigare volant au-dessus de la rivière. Le gros appareil en forme de dirigeable vole horizontalement et assez bas dans le ciel, passant silencieusement de droite à gauche depuis la position des observateurs. Il laisse une traînée dense de fumée épaisse, vapeur ou substance dans son sillage. L'objet apparaît comme une machine réelle, structurée, et physique et l'on peut voir son reflet dans la rivière Madre de Dios en-dessous de lui. La longueur de l'objet est estimée à 100 pieds de long. Sa vitesse est estimée à 1500 km/h.","",1952-07-19T16:30,bureau des douanes de Puerto Maldonado (Pérou,,,,"",,"","",1952-07-19T16:30,sighting,https://rr0.org/time/1/9/5/2/07/19/index.html#1952-07-19T16:30
"le 5 lueurs étranges manœuvrent au-dessus de la , de la ville de Washington et de ses environs. Ils sont notamment détectés par le radar de la CAA à l'aéroport. C'est le début de ce que l'on va appeler le carousel de Washington.","",1952-07-19T22:00,Maison Blanche,,,,"",,"","",1952-07-19T22:00,sighting,https://rr0.org/time/1/9/5/2/07/19/index.html#1952-07-19T22:00
le 8 objets inconnus survolent la Maison Blanche.,"",1952-07-19T23:30,,"",1952-07-19T23:30,sighting,https://rr0.org/time/1/9/5/2/07/19/index.html#1952-07-19T23:30
"le Au , le capitaine et pilote de l'USAF C. J. powley et sa femme observent 2 lumières ressemblant à des étoiles manœuvrer, rester stationnaire et accélérer durant en 7.","",1952-07-19T23:35,parc Elkins (Pennsylvanie),,,,"",,"",""""","""",s2,"""",,1494,",1952-07-19T23:35,sighting,https://rr0.org/time/1/9/5/2/07/19/index.html#1952-07-19T23:35