url,place.name,place.org,place.place.name,place.place.surname,place.place.title,place.place.time,place.place.deprecated,place.place.note,place.place.place,place.place.description,place.place.sources,place.place.tags,place.place.image,place.place.id,place.place.dirName,place.place.url,place.place.events,place.place.type,place.place.parent,place.place.locations,place.place.elevation,time,description,sources,id,place.org.name,place.org.surname,place.org.title,place.org.time,place.org.deprecated,place.org.note,place.org.place,place.org.description,place.org.sources,place.org.tags,place.org.image,place.org.id,place.org.dirName,place.org.url,place.org.events,place.org.type,place.org.parent.name,place.org.parent.surname,place.org.parent.title,place.org.parent.time,place.org.parent.deprecated,place.org.parent.note,place.org.parent.place,place.org.parent.description,place.org.parent.sources,place.org.parent.tags,place.org.parent.image,place.org.parent.id,place.org.parent.dirName,place.org.parent.url,place.org.parent.events,place.org.parent.type,place.org.parent.parent.name,place.org.parent.parent.surname,place.org.parent.parent.title,place.org.parent.parent.time,place.org.parent.parent.deprecated,place.org.parent.parent.note,place.org.parent.parent.place,place.org.parent.parent.description,place.org.parent.parent.sources,place.org.parent.parent.tags,place.org.parent.parent.image,place.org.parent.parent.id,place.org.parent.parent.dirName,place.org.parent.parent.url,place.org.parent.parent.events,place.org.parent.parent.type,place.org.parent.parent.parent,place.org.parent.parent.places,place.org.parent.parent.kind,place.org.parent.places,place.org.parent.kind,place.org.places,place.org.kind,place
https://rr0.org/time/1/9/8/0/05/index.html#1980-05-08,"Buxy, Saône-et-Loire",,,,,,,,,,,,,,,,"",place,,"",,1980-05-08,"A , alertée par son chien apeuré et les chiens du quartier qui aboyaient anormalement, un témoin voit au-dessus de la maison de ses voisins une ""grosse toupie d'enfant"" semblant tournoyer sur elle-même en se déplaçant dans la direction nord-sud. L'intérieur du phénomène est rouge-orangé. 2 autres personnes seront également témoins des faits. Toutes constateront que les images de leur poste de télévision avaient à ce moment disparu pour laisser place à des grésillements. A Tournon, Ardèche, des militaires en exercices de tir de nuit observent au-dessus du terrain d'entraînement 1 point émettant une lumière vive blanchâtre qui se déplace dans leur direction et se rapproche. Ce point grossit pour prendre la taille d'un ballon de football. Soudain immobile, la lumière émanant de l'objet semble éclairer davantage le terrain. Après quelques mn, le phénomène s'éloigne très rapidement pour s'immobiliser de nouveau : il a alors la taille d'un étoile. Il disparaît un peu plus tard en direction de l'ouest. A Flixecourt, Somme, des gendarmes sont appelés par un témoin, fortement impressionné, affirmant que sa chambre a soudainement été éclairée par une forte lumière, qu'il a ressenti dans cette pièce la présence d'une forme humanoïde et que par la fenêêi et sa s?ur ont pu voir le déplacement d'un phénomène lumineux en forme d'assiette (Les gendarmes ne recueillent pas de traces ou d'autres témoignages dans le secteur confirmant les dires de ces personnes. D'autres témoins présents à leur domicile dans des pièces correctement orientées auraient dû voir le phénomène compte tenu de l'ampleur décrite, ce qui n'a pas été le cas. Les chiens de garde des témoins, d'ordinaire très agressifs la nuit à la moindre lumière, n'ont pas bougé lors de ce phénomène. Enfin, l'enquête de gendarmerie a montré une certaine fragilité du témoin. L'hypothèse la plus probable est donc que le témoin a probablement été abusé par des phénomènes lumineux provenant de véhicules facilement visibles depuis la fenêtre de la chambre alors qu'il se trouvait sans doute dans un état de sensibilité particulière aux phénomènes surnaturels).",",s1,""GEPAN"",,,,s2,""GEPAN"",,,,s3,""GEPAN"",,",1980-05-08
https://rr0.org/time/1/9/8/0/05/index.html#1980-05-09,"Mariano Melgar du district de       La Joya, Arequipa, Pérou",,,,,,,,,,,,,,,,"",place,,"",,1980-05-09,"Sur la base aérienne de , alors qu'un groupe d'officiers militaires de la FAP, alors qu'il commençait sa formation quotidienne détecte la présence d'un ovni au bout de la piste à une altitude de 1800 pieds au-dessus du sol. L'objet, qui ressemble à un ballon météo utilisé pour la navigation maritime, se déplaçait au-dessus de la zone près de l'aéroport. Pour cette raison, Oscar Santa María, le pilote de l'un des chasseurs, reçut l'ordre de décoller et d'intercepter l'objet. Au bout d'un 3ᵉ passage, le pilote ouvre le feu sur l'objet sans causer de dommage apparent, se déplaçant rapidement au loin.","""Peruvian Air Force Conceals Ufo Information"",s4,"""",El Chino,-27",1980-05-09
https://rr0.org/time/1/9/8/0/05/index.html#1980-05-13%2000:05/01:10,"Roye, Somme",,,,,,,,,,,,,,,,"",place,,"",,1980-05-13T00:05,", des gendarmes en surveillance observent 1 cercle lumineux de 5 cm de diamètre au-dessus d'un péage autoroutier. Un objet immobile effectue des demi-cercles. L'observation dure puis les gendarmes se déplacent et ont l'impression que l'objet suit leur véhicule. Celui-ci se dirige vers le nord en laissant apparaître une flammèche orange de 5 cm de long environ. Il finit par disparaître sans laisser de traces.",",s5,""GEPAN"",,",1980-05-13T00:05
https://rr0.org/time/1/9/8/0/05/index.html#1980-05-15%2000:30,"Duclair, Seine Maritime",,,,,,,,,,,,,,,,"",place,,"",,1980-05-15T00:30,", 1 témoin aperçoit 1 phénomène ovoïde lumineux traversant le ciel en descendant rapidement. De couleur rouge-orangé il est suivi d'une queue. La luminosité de l'objet est bien supérieure à celle d'une étoile. L'objet disparaît en se dirigeant vers l'ouest (Aucun autre témoignage ne sera recueilli sur ce phénomène. Selon l'enquête du GEPAN cette personne a probablement été témoin d'une rentrée atmosphérique).",",s6,""GEPAN"",,",1980-05-15T00:30
https://rr0.org/time/1/9/8/0/05/index.html#1980-05-26%20~19:00,"Huningue, Haut Rhin",,,,,,,,,,,,,,,,"",place,,"",,1980-05-26,", 2 promeneurs aperçoivent un phénomène insolite dans le ciel dégagé. 1 des témoins, officier mécanicien naviguant, parle d'un objet d'apparence métallique qui sur une base ronde, a la forme, dans sa partie supérieure, d'une coupole de couleur argentée. Le phénomène est stationnaire à 200 ou 300 m du sol semble osciller sur son axe. Sa partie inférieure est plus foncée et présente par intermittence une luminescence rougeâtre. Durant des 6 minutes d'observation, aucun bruit et aucune condensation ne sont remarqués. Le phénomène disparaît dans les nuages en marquant des paliers successifs. À l'aéroport de Bâle/Mulhouse un écho radar est enregistré mais noyé dans le trafic de la navigation privée et générale et donc peu exploitable.",",s7,""GEPAN"",,",1980-05-26