description,events,id,place,sources,time,type,url,place.name,place.org,place.place.dirName,place.place.elevation,place.place.events,place.place.id,place.place.locations,place.org.dirName,place.org.events,place.org.id,place.org.kind,place.org.parent.dirName,place.org.parent.events,place.org.parent.id,place.org.parent.kind,place.org.parent.parent.dirName,place.org.parent.parent.events,place.org.parent.parent.id,place.org.parent.parent.kind,place.org.parent.parent.parent.dirName,place.org.parent.parent.parent.events,place.org.parent.parent.parent.id,place.org.parent.parent.parent.kind,place.org.parent.parent.parent.parent,place.org.parent.parent.parent.places,place.org.parent.parent.parent.type,place.org.parent.parent.places,place.org.parent.parent.type,place.org.parent.places,place.org.parent.type,place.org.places,place.org.type,place.org.parent.parent,place.org.parent,place.place,place.org.parent.parent.parent
"vers le , un témoin et son fils observent un petit point sombre immobile se détachant dans le ciel clair. Des éclairs de plusieurs couleurs sont remarqués, mais aucun bruit.","",1977~-06~-04~T11~:00,La Tronche (Isère),,,,"",,"","""GEPAN"","""",s1,"""",,,PAN classé C",1977~-06~-04~T11~:00,case,https://rr0.org/time/1/9/7/7/06/index.html#1977~-06~-04~T11~:00
"vers le , des automobilistes constatent que la route s'éclaire comme en plein jour pendant 4 à 5 s et voient une boule suivie d'une trainée qui se déplace d'ouest en est, émettant comme des crépitements et disparaissant rapidement, cachée par le paysage. D'autres témoins des environs entendront une déflagration ou verront un éclair. La gendarmerie ne relevera aucune trace de chute sur le secteur. Ces personnes ont probablement été témoins d'une rentrée atmosphérique. Centeno le 21","",1977~-06~-13~T00~:05$org_fr_bfc_39_39478,Saint-Claude (Jura (Bourgogne-Franche-Comté (France))),org/fr/bfc/39/39478,"",39478,city,org/fr/bfc/39,"",39,department,org/fr/bfc,"",bfc,region,org/fr,"",fr,country,,"",org,",,"""",,""47.23444444444444,6.030555555555556""",org,",,"""",,""46.666666666666664,5.666666666666667""",org,",,"""",,""47.39861111111111,4.5424999999999995""",org,,,"",,"47.39861111111111,4.5424999999999995","""GEPAN"","""",s2,"""",,,PAN classé B",1977~-06~-13~T00~:05,case,https://rr0.org/time/1/9/7/7/06/index.html#1977~-06~-13~T00~:05
le Mort de Werhner von Braun.,"",1977-06-16,,"",1977-06-16,case,https://rr0.org/time/1/9/7/7/06/index.html#1977-06-16
"le le samedi 18 01:55 En , de nombreux témoins indépendants voient le ciel s'éclairer avant de voir passer un grand météore. Sous hypnose, Betty Andreasson déclare se souvenir de l'enlèvement qu'elle a vécu le le mercredi 25 janvier 1967.","",1977-06-18,Californie,,,,"",,"","""""""Hendry, Allan"""""","""",s3,"""",1979,43,The UFO Handbook",1977-06-18,case,https://rr0.org/time/1/9/7/7/06/index.html#1977-06-18
le L'association des Anciens Cadres et Auditeurs de l'IHEDN termine son "Rapport sur les Phénomènes Aériens Non Identifiés".,"",1977-06-20,,"",1977-06-20,case,https://rr0.org/time/1/9/7/7/06/index.html#1977-06-20
"le Près de , un objet est photographié (ci-contre) par une source anonyme. Un objet similaire a été observé 2 ans plus tôt à Ontario (Canada).","",1977-06-21,Centeno (Argentine),,,,"",,"","",1977-06-21,case,https://rr0.org/time/1/9/7/7/06/index.html#1977-06-21
le Récupération de 5 corps suite à un crash dans le nord-ouest de l'Arizona.,"",1977-06-22,,"",1977-06-22,case,https://rr0.org/time/1/9/7/7/06/index.html#1977-06-22
"le , des témoins voient pendant en 1 2 faisceaux lumineux évoluer dans le ciel, éclairant l'espace en tournant sur eux-mêmes. La lumière apparait toutes les en 15. Prévenus en 2 et arrivés sur les lieux en 2, les gendarmes ne constatent aucun phénomène.","",1977-06-25T01:05,Saint Pol-sur-Ternoise (Pas-de-Calais),,,,"",,"","""SEPRA"","""",s4,"""",,,PAN classé C",1977-06-25T01:05,case,https://rr0.org/time/1/9/7/7/06/index.html#1977-06-25T01:05
"le En France, 1er congrès national d'ufologie d'amateurs.","",1977-06-25,,""""","""",s5,"""",GRIPHOM,1977-07-01,""Compte-rendu du 1er Congrès National d'Ufologie d'Amateurs des 25 et 26 Juin 1977""",1977-06-25,case,https://rr0.org/time/1/9/7/7/06/index.html#1977-06-25