url,place,dateTime,description,sources,id
https://rr0.org/time/1/9/7/2/09/index.html,,1972-09,La source d'énergie de la constellation du Cygne appellée "X-3" qui émettait normalement des ondes de T. S. F. commence à multiplier sa puissance par 200.,"",1972-09
https://rr0.org/time/1/9/7/2/09/index.html,,1972-09,Fin de la mission Skylab-3.,"",1972-09
https://rr0.org/time/1/9/7/2/09/index.html,,1972-09,"A Imjarvi (Finlande), Aarno Heinonen conduit son scooter sur la route de Voikoski. Il voit un petit nuage sphérique passer au-dessus de lui, qui finit par descendre et s'arrêter à environ 8 pieds du sol. De ce ""nuage"" descend la même fille de l'espace, portant cette fois un habit à pantalon brun. N'ayez pas peur, je suis votre amie d'une autre planète, lui dit-elle. La femme a des chaussures brunes et porte des gants fins. En partant, elle sourit d'une belle manière, puis tire sur l'une des antennes sur la petite sphère. Heinonen sent un tourbillon, et la fille glisse vers le haut dans le nuage globulaire, qui fait alors une ascension verticale très rapidement Humcat 1972-24 A Heinonen, Ufoika Nov. 1972 L'ovni observé le 16","",1972-09
https://rr0.org/time/1/9/7/2/09/index.html,,1972-09,Observation (ci-contre).,"",1972-09
https://rr0.org/time/1/9/7/2/09/index.html,,1972-09,Photographie le 24 au Nouveau-Mexique,"",1972-09
https://rr0.org/time/1/9/7/2/09/index.html,,1972-09,Photographie (ci-contre) de Paul Villa au Nouveau-Mexique.,"",1972-09