id_cas;cas_nom_dossier;cas_zone_nom;cas_zone_code;cas_zone_type;cas_AAAA;cas_MM;cas_JJ;cas_resume;cas_resume_web;cas_public;cas_temoignages_nb;cas_temoins_nb;cas_temoins_nb_approx;cas_nb_PAN;cas_nb_PAN_approx;cas_MinCercleInscrit_Lat;cas_MinCercleInscrit_Lng;cas_MinCercleInscrit_Err;cas_date_maj;cas_etrangete;cas_etrangete_err;cas_etrangete_calc;cas_etrangete_calc_err;cas_fiabilite;cas_fiabilite_err;cas_fiabilite_calc;cas_qte_information;cas_qte_information_calc;cas_consistance;cas_consistance_calc;cas_consistance_calc_err;cas_classification;cas_classification_calc;cas_numEtude
2;"MARIGOT (LE) (972) --.--.1937";Martinique;972;"(D) Département";1937;--;--;"Témoignage récent (11/09/1979) d'une observation ancienne faite en 1937 dans l'Est de la Martinique (le témoin ne se souvient plus de la date du jour et mois ; le premier janvier est une date donnée arbitrairement.).<br> Le témoin rapporte avoir vu à 18h le passage Ouest-Est d'un globe bien éclairé par le soleil couchant progressant lentement. Le témoin décrit le phénomène comme ayant un diamètre supérieur à la Lune. Le phénomène disparait progressivement à l'horizon. L'observation a duré prés d'une minute.<br> Aucun autre témoignage n'a été recueilli. Le GEIPAN classe de cas en C : manque de précisions.";"Observation du déplacement d'un globe éclairé par le soleil couchant ; disparition à l'horizon : manque d'information.";O;1;;;;;;;;2015-12-07;;;0.50;0.50;;;;;;;0.28;0.28;C;C;1937-01-01656
3;"[AERO MIL] ORANGE (84) 15.06.1951";Vaucluse;84;"(D) Département";1951;06;15;"Le 15 juin 1951 à 11h30 deux pilotes décollent de la base aérienne d'Orange-Caritat. Un des pilotes  est surpris de voir un engin d'apparence circulaire ou sphérique argenté et très brillant dans le ciel. Il informe son chef de patrouille qui l'aperçoit à son tour. L'engin est stationnaire et situé, d'après un des pilotes, dans le sud du massif du Pelvoux (massif des Ecrins) à la même altitude que les sommets du Pelvoux et que son avion (10 000pieds). Les deux avions poursuivent cet engin qui leur semble grossir. L'engin se déplace ensuite sur une trajectoire légèrement montante en prenant une forme oblongue. L'observation simultanée durera environ 6 minutes avant que l'engin ne disparaisse sous la forme d'un point à l'horizon.<br> L'enquête de l'époque menée par le commandant de la base confirme la crédibilité des observations.<br> On note que certaines descriptions dans ces témoignages font penser à un ballon stratosphérique observé de loin. Néanmoins du fait que l'un des pilotes signale un éloignement rapide de l'objet quant il tente de s'en rapproocher, ne convient pas à cette hypothèse. Le GEIPAN classe ce cas en D1 : phénomène étrange non identifié.";"Observations par deux pilotes en vol d'un phénomène très brillant stationnaire puis en déplacement dans le ciel ; poursuite avant disparition à l'horizon : phénomène étrange non identifié.";O;2;2;;;;;;;2017-01-16;;;0.63;0.13;;;;;;;0.78;0.23;D1;D1;1951-06-00002
4;"BIARRITZ (64) --.08.1951";Pyrénées-Atlantiques;64;"(D) Département";1951;08;--;"Témoignage récent (20/03/1975) d'une observation ancienne (le témoin ne se souvient pas de la date du jour exacte ; le cas est daté arbitrairement du 01/08/1951).<br> En aout 1951 vers minuit un témoin à Biarritz au bord d'une falaise est surpris par le passage le long de la côte d'une masse volante ayant la forme de deux assiettes à soupe accolées portant sur son pourtour des zones en forme de hublots d'où émane une fluorescence verdâtre. La trajectoire donnée par le témoin est N-S puis E-O. L'objet est vu durant 10 à 15 secondes. Effrayé le témoin se jette au sol entrainant sa femme qui verra également la masse se déplacer. Aucun bruit n'est entendu. Les témoins se relèvent mais l'objet a disparu. Un seul témoignage est recueilli.<br> Certains aspects du témoignage font penser à une observation de bolide : la durée d'observation du phénomène, l'impression de proximité, la fluorescence verdâtre. Néanmoins certains autres détails ne conviennent pas pour cette hypothèse (masse volante, changement de direction). La méconnaissance de la date précise, l'unicité du témoignage et le délai important entre l'évènement et le récit rendent ce témoignage peu consistant. Le GEIPAN classe ce cas en C par manque d'information essentielle et de recoupement.";"OBSERVATION DU DÉPLACEMENT SILENCIEUX AVEC CHANGEMENT DE DIRECTION D'UNE MASSE DE LA FORME DE DEUX ASSIETTES ACCOLLÉES AVEC DES ZONES VERT FLUORESCENT SUR LE POURTOUR, DÉPLACEMENT RAPIDE : manque d'information.";O;1;;;;;;;;2016-12-19;;;0.50;0.50;;;;;;;0.28;0.28;C;C;1951-08-00003
5;"PORT-GENTIL (GA.8) 01.06.1952";Ardennes;8;"(D) Département";1952;06;01;"Le 1er juin 1952 à 2h40 du matin, deux personnes d'un équipage d'un navire au mouillage en rade de Port-Gentil (Gabon), observent un phénomène lumineux dans le ciel. Dans un premier temps le second capitaine voit très distinctement un objet venant de l'intérieur des terres qui stoppe, vire sur la droite et reprend sa route initiale ceci à deux reprises (le deuxième virage ayant eu lieu à la verticale du navire). Il téléphone au commandant qui regarde alors avec des jumelles et qui voit durant trois minutes une lueur circulaire orange extrèmement lumineuse et phosphorescente. Celle-ci se déplace à très grande vitesse suivant une trajectoire sensiblement rectiligne. Le commandant perd de vue le phénomène.<br> Le commandant rapporte cette observation. Un croquis est réalisé (auteur inconnu).Aucun autre témoignage n'est recueilli.<br> Les hypothèses de bolide (météore) ou de tir de missile ont été émises mais non consolidées. Le GEIPAN classe ce cas D1 : phénomène étrange et non identifié.";"Observations du passage d'un phénomène lumineux avec changement de trajectoire : phénomène étrange et non identifié.";O;2;;;;;;;;2015-03-27;;;0.63;0.13;;;;;;;0.78;0.23;D1;D1;1952-06-00004
6;"CRECY-EN-PONTHIEU (80) 21.09.1952";Somme;80;"(D) Département";1952;09;21;"Témoignage récent (21/11/2010) d'une observation ancienne (21/09/1952).<br> Le témoin, alors enfant, rentre de vacances dans la voiture de ses parents, lorsqu'ils sont arrêtés par un autre automobiliste au bord d'une route. Tout proche, un engin circulaire de couleur gris métallisé stationne au-dessus d'un champ à environ 15m d'altitude. L'engin démarre subitement, puis redescend à sa position initiale et repart vers les nuages.<br> Aucun autre témoignage ne sera recueilli sur ce phénomène.<br>  Ce cas ancien d'une observation très étrange a été soumis au Geipan en 2010. Le récit ne correspond à aucune des méprises classiques. Une enquête serait bien difficile ; Comme ce cas fait partie du début de la vague d'OVNIs des années 50, le GEIPAN le publie tel quel sans enquête, afin qu'il puisse éventuellement être rapproché d'autres observations semblables.<br> Ce cas issu d'un témoin unique, relaté 58 ans après les faits, est classé ""C"" par manque d'informations.";"Observation d'un engin circulaire de couleur gris métallisé stationnant au-dessus d'un champ : manque d'informations.";O;1;;;;;;;;2014-09-10;;;0.50;0.50;;;;;;;0.28;0.28;C;C;1952-09-08193
7;"LIMOGES (87) 11.04.1953";Haute-Vienne;87;"(D) Département";1953;04;11;"Le 11 avril 1953 à 21h10 trois témoins d'un entrepôt de l'armée de l'air observent le déplacement silencieux E-O d'un gros point rouge-orangé. Le capitaine décrit un phénomène faisant un aller retour sur 45° de la voute céleste en 6 minutes selon une ligne brisée irrégulière formant des angles de 15° selon l'axe de déplacement. Le virage de 180° s'est fait également par changements de caps successifs. Les changements de caps s'effectuent toutes les secondes. Les deux autres témoins ont suivi le phénomène deux à trois minutes. Le phénomène a finalement été perdu de vue. Un seul témoignage sera recueilli.<br> Ce phénomène n'évoque aucune des méprises connues. Le GEIPAN classe ce cas en D1: phénomène étrange non identifié.";"Observations de l'aller-retour d'un phénomène lumineux rouge-orangé dans le ciel : phénomène non identifié étrange.";O;2;1;;1;;;;;2017-01-16;;;0.63;0.13;;;;;;;0.78;0.23;D1;D1;1953-04-00005
8;"VELIZY-VILLACOUBLAY (78) 03.11.1953";Yvelines;78;"(D) Département";1953;11;03;"Le 3 novembre 1953 à 19h14 (TU soit 20h14 locale) la presse rapporte plusieurs témoignages d'observations d'une sphère lumineuse blanche dans le ciel. Ce phénomène est stationnaire dans le NE du ciel peu nuageux. Un controleur rapportera son observation sur le cahier de service de la tour le 3 novembre 1953. Il fera une déposition le 20 novembre 1953 indiquant que deux autres militaires avaient également fait la même observation.<br> Une carte du ciel montre Jupiter au NE avec une forte magnitude (-2,22) et une élévation de 3,6°. Le GEIPAN classe ce cas en A :  méprise astronomique avec la planète Jupiter.";"Observation d'une sphère lumineuse blanche dans le NE du ciel : méprise astronomique avec la planète Jupiter.";O;2;;;;;;;;2015-09-23;;;0.50;0.50;;;;;;;0.28;0.28;A;C;1953-11-00006
9;"MERS-EL-KEBIR (DZ.31) --.08.1954";Autre;00;"(D) Département";1954;08;--;"Un témoin rapporte en 2012 une observation faite en juillet ou août 1954 vers 20h (voir questionnaire) à Sainte-Clotilde (commune de Mers-el-Kébir) prés d'Oran (Algérie) ; le témoin, à l'époque, avait 15 ans. Il situe par la suite son observation un jour de semaine entre le 24 et 27 août.<br>  A Saint-Clotilde, un jour en fin de journée, des personnes attablées sont soudain surprises de voir tomber du ciel un disque orange-feu, très lumineux. Il suit une trajectoire descendante vers la mer mais s'arrête en plein ciel et reste immobile au-dessus de l'horizon. Le disque repart ensuite à grande vitesse dans une trajectoire ascendante à 45° vers l'Est avant de disparaitre. L'observation aura duré environ deux minutes.<br> Un seul témoignage sera recueilli sur ce phénomène. Cependant un article du Provencal du 27 août 1954 relate une observation de bolide vu depuis Plan-de-Cuques (13) le 22 aôut 1954 à 20h.  L'hypothèse d'observation de bolide peut expliquer une grande partie de l'observation décrite dans ce cas.<br> Cependant, étant donné les nombreuses incertitudes sur ce cas : date précise inconnue, souvenir ancien donc potentiellement altéré, deuxième partie de l'observation explicable seulement par une cause physiologique non vérifiable, le GEIPAN classe ce cas « C » observation non exploitable, par manque d'informations fiables.";"Observation de la chute d'un disque lumineux orange : manque d'information.";O;;;;;;;;;2015-03-27;;;0.50;0.50;;;;;;;0.28;0.28;C;C;1954-08-08234
10;"TANGER (MA.01) 05.09.1954";Autre;MA.01;"(D) Département";1954;09;05;"Le dimanche 05 septembre 1954 à 17h15 un couple et leur fille situés à proximité du poste hertzien des P.T.T prés du cap Spartel (Maroc) observent la présence très haut dans le ciel d'une tache noire circulaire ayant approximativement des dimensions d'un avion. Un des témoins rapporte que durant 10 minutes il a pu suivre, en direction du Sud, les évolutions de ce phénomène sombre. Aucune lueur, aucune fumée ou étincelles ne sont remarquées. Aucun bruit n'est entendu. Les évolutions sont ponctuées par des arrêts brusques. Le phénomène disparait vers l'Ouest en piquant vers la mer jusqu'à disparition à l'horizon. Un seul témoignage est recueilli avec carte et schéma.<br>  L'hypothèse d'un avion provenant de la base aérienne de Rabat-Salé (base de la 8eme escadre de chasse sur avions Vampire) et effectuant des acrobaties aériennes est possible. Les points fixes pourraient correspondre au moment où le témoin voit l'avion de face. Cependant le manque d'information concernant la taille angulaire de l'objet ainsi que sa disparition au-dessus de la mer vers l'horizon ne permet pas de consolider totalement cette hypothèse.<br> Le GEIPAN classe ce cas en C par manque d'information.";"Observation des déplacements d'une tâche sombre dans le ciel ; changements brusques de direction et disparition au-dessus de la mer à l'horizon : manque d'information.";O;1;;;;;;;;2015-11-19;;;0.50;0.50;;;;;;;0.28;0.28;C;C;1954-09-00007
11;"[CD47] DE HARPONVILLE (80) VERS CONTAY (80) 07.09.1954";Somme;80;"(D) Département";1954;09;07;"Le 7 septembre 1954 vers 7h30 deux témoins se rendent à leur travail en bicyclette sur le chemin communal 47 entre Harponville (80) et Contay (80). Le temps est clair et sans brouillard. Ils  observent au sol dans un champ à 200m de la route, une forme circulaire affectée d'un mouvement oscillatoire. Les deux témoins décrivent un cylindre de couleur sombre à la  surface supérieure légèrement bombée et avec une ouverture sur le tour.<br> Intrigués, les témoins s'approchent à une centaine de mètres et voit l'objet se lever sans bruit en oblique sur une quinzaine de mètres puis à la verticale. Pendant l'ascension les témoins remarquent de la fumée gris bleue s'échappant d'un tuyau. L'observation a duré entre 4 et 5 minutes avant que le phénomène ne disparaisse dans le ciel. Les témoins apeurés partent immédiatement à la gendarmerie.<br> Le même jour, l'enquête ne constate aucune trace au sol dans le champ. Un des témoin ayant déjà vu des hélicoptères, il affirme qu'il ne s'agit pas d'un tel appareil. Aucun autre témoignage n'est recueilli. La crédibilité des témoins n'est pas mise en cause. <br> Le GEIPAN classe ce cas en D1 : phénomène non identifié étrange.";"Observations d'un objet circulaire au sol avec un mouvement d'oscillation. Décollage silencieux en oblique puis vertical en laissant échapper une fumée ; aucune trace au sol : phénomène non identifié étrange.";O;4;;;;;;;;2015-11-23;;;0.63;0.13;;;;;;;0.78;0.23;D1;D1;1954-09-00008
13;"FIGEAC (46) 27.09.1954";Lot;46;"(D) Département";1954;09;27;"Le 27 septembre 1954 vers 8h40 trois enfants (10 ans, 8,5 ans et 5 ans) se rendent à l'école sur la RN 13 à l'Est de Ceint-D'eau (Figeac (26)) croisent un personnage de petite taille qui tire un coup de feu ce qui effaye les enfants. Les deux plus grands ont remarqué auparavant une sorte de caisse dans le pré bordant la route. Les deux enfants indiquent que la caisse s'est envolée rapidement : l'ainée à midi, la cadette vers 8h40.<br>  La gendarmerie est prévenue par l'instituteur. Les enfants sont entendus par les gendarmes le lendemain matin. Aucune trace au sol n'est relevée par la gendarmerie. Aucun autre témoignage n'a été recueilli.<br> Le GEIPAN classe ce cas C par manque d'information, informations contradictoires et manque de recoupements.";"Observations par des enfants d'un personnage de petite taille et d'une ""caisse volante"" : manque d'information et de recoupements.";O;6;;;;;;;;2015-11-23;;;0.50;0.50;;;;;;;0.28;0.28;C;C;1954-09-00010
3952;"WIMEREUX (62) 02.10.1954";Pas-de-Calais;62;"(D) Département";1954;10;02;"Le 2 octobre 1954 un témoin s'apprête à photographier un dolmen vers 16 h par temps ensoleillé lorsqu'il aperçoit un objet de forme elliptique de couleur claire en déplacement SO-NE. Il prend deux photos et envoie les négatifs au journal « Radar ». La gendarmerie apprend l'évènement par la presse et ne rencontre le témoin que le 15 octobre. Les tirages n'ont été joints qu'à la première expédition du rapport (pas de photos jointes aux copies du rapport disponibles au GEIPAN).<br>  Une brève enquête sur ce cas a été menée par le GEPAN en fin des années 70. Elle conclut que les photos n'auraient pas été publiés dans le magazine « Radar » et que la recherche du témoin (âgé d'environ 58 ans à l'époque) sont restées vaines.<br>  L'observation ne dure que quelques secondes, le temps de prendre deux photos coup sur coup. Le phénomène disparait avant que le témoin ait le temps de modifier le réglage de son appareil photo. La description trop succincte et l'absence de photos ne permettent pas d'analyser cette observation ; le GEIPAN classe ce cas en C.";"Observation rapide du déplacement SO-NE d'un objet elliptique très clair dans le ciel : manque d'information";O;;;;;;;;;2015-11-19;;;0.50;0.50;;;;;;;0.28;0.28;C;C;1954-10-09216
3945;"OYE-PLAGE (62) 27.10.1954";Pas-de-Calais;62;"(D) Département";1954;10;27;"Le 27 octobre 1954 vers 23h15 un témoin marchant dans la rue (R.N. 40) aperçoit à une dizaine de mètres devant lui une lueur opalescente. Il s'agit d'un « engin » en forme de cigare dont l'avant semble plus large que l'arrière de 8 m de long et 0,80-1 m de diamètre sans hublot ou porte. Il se déplace sans bruit à environ 30 km/h à une hauteur de 20 m au-dessus de la route dont il suit les sinuosités. Il dégage une lumière blanc jaunâtre limité aux contours de l'appareil et n'éclairant pas le toit des maisons qu'il survole. Il disparaît dans une courbe de la chaussée, réapparait plus loin puis oblique brusquement sur sa gauche (vers le Sud-Ouest) à l'entrée de la commune de Marck à 5 km. Il apparaît alors immobile en forme de sphère d'un rayonnement plus intense et plus jaune. Le témoin rentre chez lui, prépare son repas, observe encore l'objet au même endroit mais après son repas l'objet a disparu. Malgré les efforts du témoin pour qu'une autre personne constate le phénomène, il sera le seul à faire cette observation.<br> Cette observation est d'une consistance moyenne avec un seul témoin a priori de bonne foi. Ce qu'il décrit n'est pas très étrange puisque ne s'agit que d'un point lumineux observé d'assez loin. Les déplacements de l'objet ne sont constatés que lorsque le témoin se déplace : arrivé à son domicile, il percevra l'objet immobile. Plusieurs hypothèses sont envisageables :<br> - une lumière très éloignée et basse sur l'horizon qui de ce fait parait suivre les déplacements du témoin ; une vérification astronomique indique seulement la planète Mars dans le direction d'observation du témoin mais elle se couche à 23h. On peut aussi envisager une lumière du port de Calais.<br> - un phare d'hélicoptère aurait pu rendre le même effet.<br> Le GEIPAN classe ce cas en C par manque de recoupements.";"Observation du déplacement silencieux et des évolutions d'un cigare blanc-jaunâtre : manque de recoupements.";O;;;;;;;;;2015-11-24;;;0.50;0.50;;;;;;;0.28;0.28;C;C;1954-10-09244
4698;"PLOEMEUR (56) 02.09.2017";Morbihan;56;"(D) Département";2017;09;02;"Le 02 septembre 2017 à 22h30 un témoin observe durant 1 à 2 minutes le passage silencieux au-dessus de Ploemeur et Lorient d'une vingtaine de lumières de couleur blanchâtre. Le témoin appelle un voisin avec son téléphone portable. Les lumières sont perdues de vue rapidement car cachées par les arbres d'un bois à proximité du domicile du témoin. Un seul questionnaire est recueilli.<br>
Le témoin a très probablement vu un vol de lanternes thaïlandaises, tout dans son témoignage reflète  la multitude de témoignages enregistrés au GEIPAN pour des lâchers de lanternes supposés comme avérés :<br>
- le témoin dit  ""Ils étaient silencieux. Une lumière scintillait sous chaque appareil, et l'éclairait. Par contre aucun feu de navigation ou feu à éclats, n'était visible."", ce qui est bien l'aspect typique d'une lanterne ;<br>
- l'ensemble se déplaçait dans le sens du vent qui est bien de SSO vers NNE, voir mesure faite à 4km de là (<b><a href=""https://www.infoclimat.fr/observations-meteo/archives/2/septembre/2017/lorient-lann-bihoue/07205.html"">Infoclimat</a></b>).<br> ;
- on est une nuit de week-end, à ciel dégagé, propice à des événements festifs.<br>

Le témoin réfute cette explication du GEIPAN car :<br>
- c'est trop gros : il est usuel qu'un témoin apprécie mal la distance d'un objet qui lui est inconnu, et par cela il évalue mal la taille de l'objet, ainsi que la vitesse. Il était plus prés qu'il le pense ;<br>
- il n'y avait pas de vent : le témoin est au pas de porte de sa maison, ce qui est un lieu non idéal pour apprécier le vent et encore moins s'agissant du vent à 100 ou 200m d'altitude (celle des lanternes) ;<br>
- le témoin est fortement impressionné et semble ne pas croire à une explication aussi simple. Il est fréquent que les témoins soient impressionnés, voir par exemple ce témoignage (<b><a href=""http://www.cnes-geipan.fr/fileadmin/geipan-doc/CHATEAUFORT__78__10.07.2011__T-Cgei_V_R__video_temoin_13072011_retouchee.avi"">CHATEAUFORT (78) 10.07.2011</a></b>). C'est aussi parce que beaucoup savent reconnaître les lanternes qu'aucun autre témoin ne s'est fait connaître cette nuit là. Notre témoin pense le contraire et se dit que des lanternes auraient forcement déclenché d'autres témoignages.<br>

Le témoin a ""vécu un moment unique"", on le comprend mais le plus probable est qu'il s'agissait de lanternes.<br>

En conséquence le GEIPAN classe le cas en B : observation probable de lanternes thaïlandaises.";"Observation du passage silencieux d'une vingtaine de lumières dans le ciel nocturne dégagé : observation probable de lanternes thaïlandaises.";O;;1;;20;;;;;2018-06-18;;;0.25;0.00;;;0.70;;0.65;;0.50;0.00;B;B;2017-09-50529
4422;"PONCEY-SUR-L'IGNON (21) 04.10.1954";Côte-d'Or;21;"(D) Département";1954;10;02;"Les 02 et 04 octobre 1954 plusieurs personnes de la commune de Poncey-sur-l'Ignon (21) vont être témoins de phénomènes qui les intriguent. Le PV fait état des deux séries d'évènements distincts dans un même secteur traités ici chronologiquement.<br> Le premier évènement a lieu le 02 octobre 1954 à Poncey-sur l'Ignon. A 19h40, une cultivatrice (T6) qui vient de traire les vaches, remarque d'abord dans le ciel ""un engin lumineux"" ""se rapportant à tout ce que l'on voit dans la presse ces jours-ci"". Le témoin rapporte qu'elle a vu « comme un rayon de lune » qui ""éclairait la cour"". Elle pense qu'il s'agit de la Lune mais découvre que celle-ci a une forme bizarre. En fixant son attention, le témoin observe alors un cylindre vertical dont elle estime la hauteur à 1,5m et le diamètre à 80cm. Il est lumineux sur toute sa surface, de couleur orange avec un reflet vert autour et se déplace debout à faible hauteur et plutôt près des bâtiments. Convaincue qu'il ne s'agit pas de la Lune mais d'un ""engin"" inconnu, elle avertit son mari, son fils et une voisine (T7). Ces derniers ont le temps de voir la lumière venant du Nord disparaître vers le Sud. La voisine (T7) décrit une boule lumineuse comme un ballon de football plus orangée qu'une ampoule électrique et se déplaçant silencieusement.<br>  Une confusion avec la Lune, peut être partiellement cachée par des nuages en mouvement, ne peut pas être exclue en dépit des dénégations du témoin. La Lune se trouve en effet très bas sur l'horizon (6°) au Sud-Ouest (azimut 220°). Dans son témoignage, le témoin T6 ne précise pas exactement son emplacement et la direction d'observation (""dans le ciel""); de plus elle n'indique pas avoir vu à la fois la Lune et ""l'engin"". Les témoins décrivent un mouvement d'éloignement à faible vitesse « vers le Sud » mais la description de la disparition est trop imprécise. Toutefois, le phénomène présente des similitudes avec d'autres récits deux jours plus tard dans la même commune (voir ci-dessous). Ce premier cas est classé C par manque d'information.<br>  La seconde série d'évènements a lieu le 04 octobre 1954 au Val d'Ignon au lieu-dit 'l'usine d'amiante"" à 1km au sud du village de Poncey-sur-l'Ignon (21). Ce lieu-dit est composé d'un groupe de bâtiments dont une partie sert d'habitation à trois familles d'ouvriers. Il est entouré au Nord, à l'Est et à l'Ouest par des prés et au Sud par un étang.<br> Vers 19h30, alors qu'elle ferme les volets de sa chambre, une jeune femme (T1) voit en direction du Nord, au-dessus d'un prunier situé dans la cour, une lumière assez forte de couleur jaunâtre, en forme de champignon, semble-t-il, ovale à la partie supérieure et ronde à la partie inférieure, se présentant comme un globe transparent éclairé de l'intérieur. Elle estime sa hauteur à une quinzaine de mètres, sa distance à 50 m et compare sa taille à celle d'une cuisinière. Aucun bruit particulier n'est entendu. Elle ne la regarde que quelques instants et ne peut préciser son état de mouvement. Prise de panique, elle prend son enfant et va chercher refuge chez une voisine (T2) qui est seule avec sa fille (T3). Aucun autre témoin n'observera ce phénomène.<br>  Vers 20h30, le gendre (T4)  et le fils (T8) de la voisine arrivent et trouvent les trois femmes apeurées. Ensemble ils vont dans le pré contigu à la cour à l'endroit dans la direction d'observation du phénomène par le T1. Ils constatent la présence d'une zone approximativement rectangulaire (1,50 x 0,50-0,70 m) creusée dans le sol (sur 5 cm) avec de la terre brisée aux deux extrémités et les mottes de terre et d'herbe répandues alentour dans un cercle d'environ 4 m de rayon. Les mottes de tailles inégales (en général 30 x 20 cm sauf deux de 60 cm) sont retournées herbe vers le bas. Deux témoins (T2 et T4) rapportent la présence de nombreux vers blancs vivants présents au milieu des traces.<br>   Vers 20h45, le second fils de la voisine (18 ans) (T5), revenant de son travail au village voisin distant de 1,5 km, aperçoit brièvement dans le ciel, un « engin » en forme de cigare sans aile, entièrement lumineux, de couleur « transparente » avec des reflets vert et orange qui traverse le ciel très rapidement en direction Nord-Sud. Apeuré par cette vision, il rentre rapidement chez ses parents. Aucun autre témoin observera ce phénomène.<br>   Les gendarmes sont prévenus le 05 octobre à 19h30 et constatent les traces au sol le soir même. Ils procèdent à l'enquête et constituent le dossier photographique le 06 octobre 1954. Ils examinent la possibilité d'une farce du gendre et du fils de la voisine (d'autant qu'en rentrant le 04 au soir ces derniers avaient l'intention de faire une farce à propos d'une soucoupe volante !) mais, après vérification de leur emploi du temps, les gendarmes rejettent cette hypothèse. D'après le T4 qui habite le quartier aucun bétail n'est en pâture dans le pré et il n'a vu personne rôder dans cet endroit la veille.<br> Un examen rapide des faits suggère quatre hypothèses pour cette deuxième observation : pour le phénomène lumineux la lune ou un phare de véhicule sur la colline voisine, et pour les traces au sol un fouissement de  terre par des sangliers à la recherche de vers ou un canular.<br>  La Lune est effectivement assez basse sur l'horizon (élévation 16°). Toutefois, elle se trouve au Sud (azimut 197°). Or le PV précise que l'observation s'est faite vers le Nord. Une reconstitution précise des lieux fondée sur des photographies (voir carte de reconstitution) confirment qu'il ne s'agit pas là d'une erreur et que la fenêtre d'où le témoin a fait sa brève observation donne bien au Nord. L'hypothèse Lune tombe.<br> Le phare d'un véhicule sur la route D26  ou dans le virage de la D103 aurait pu être visible depuis l'emplacement du témoin vers le Nord (voir carte IGN 1963 ou l'on constate que le couvert végétal est peu dense). Mais cette hypothèse ne peut être confirmée par méconnaissance du lieu très précis de l'observation et de la direction précise du phénomène. Un enquêteur privé s'est rendu sur les lieux en août 2015 pour tenter de préciser la topographie de l'observation : les lieux ont peu changé mais les habitants de 1954 n'habitent plus sur place ou sont décédés. Le GEIPAN a tenté de joindre par téléphone et courrier une des témoins mais sans succès.<br> Concernant les traces au sol, l'hypothèse des sangliers ne paraît pas en accord avec les descriptions faites de l'excavation : bords relativement nets, mottes déposées hors de l'excavation et plutôt régulières en taille et en position (retournée), vers blancs non consommés (les sangliers ont pu être dérangés). Les photographies des traces faites par la gendarmerie seront prises deux jours après l'observation. De plus, ces traces ont été piétinées par les témoins. Cette hypothèse reste acceptable mais non confirmée.<br>  L'hypothèse d'un canular monté par d'autres personnes ne peut pas être totalement exclue.<br>  Le phénomène lumineux peut-il être considéré comme la cause de la trace ? Les données disponibles ne fournissent aucune preuve directe d'un lien de cause à effet. On doit se contenter de la corrélation de direction d'observation des deux phénomènes (lumière et traces au sol) et corrélation relative de temps dans un intervalle d'une heure.<br>   Une interrogation du même ordre vaut pour les observations de 19h30 et 20h45 (T5) mais avec une association moins forte : distance de 1-1,5 km environ entre les témoins (le lieu exact de l'observation de 20h45 n'est pas précisé) et séparation d'une 1h environ. La concordance des descriptions (lumière jaunâtre ou orange, impression de transparence) reste limitée.<br>   Il y a également une certaine ressemblance des observations des 02 et 04 octobre : même commune, même heure de la journée, même lumière (« orange avec reflets verts »,   « reflets verts et oranges »), même taille apparente (« cuisinière », 1,8 x 0,8m, trace 1,50 x 0,60m).<br>  En résumé le cas d'observation du 04 octobre 1954 rapporte trois évènements : deux observations distinctes, courtes, par à chaque fois un seul témoin, d'un phénomène lumineux lointain. Puis, des traces au sol. Ces trois évènements ne sont pas associés forcément entre eux. Pour chacun de ces évènements il existe des hypothèses fragiles qui ne peuvent être confirmées. Globalement la consistance de ce cas est moyenne car elle ne contient pas d'éléments vérifiables. Son étrangeté serait forte si on pouvait corréler de façon certaine les traces au sol et les phénomènes lumineux.<br> Le GEIPAN classe par conséquent ce cas C par manque d'information : les éléments vérifiables sont trop faibles par rapport à l'étrangeté supposée du cas.<br>  Remarques : il faut savoir que durant l'année 1954 et particulièrement en octobre, la presse nationale et locale a publié un grand nombre d'articles relatant des cas d'observation supposés d'OVNI. Ce phénomène de grande ampleur a marqué la population et suscité de nombreux rapports d'observations de phénomènes qui se sont finalement avérés très banals (étoiles, planètes, avions, bolides). Dans ce procès-verbal de gendarmerie, les différents témoins font très souvent référence à ce qu'ils ont lu récemment dans la presse notamment pour décrire le phénomène.";"Observation de plusieurs phénomènes en deux jours sur une même commune : manque d'information.";O;;;;;;;;;2018-07-11;;;0.50;0.50;;;;;;;0.28;0.28;C;C;1954-10-09227
4495;"MONTREVEL (38) 10.09.2017";Isère;38;"(D) Département";2017;09;10;"Le 10 septembre 2017 entre 21h45 et 22h le témoin, qui s'occupe de son enfant, a son attention attirée par le passage rapide d'une lumière vive. L'objet est décrit comme ayant une forme ronde, en feu, de couleur jaune-orange qui tombe sans bruit. Le témoin se déplace rapidement vers la fenêtre mais la lumière a disparu. Pensant que l'objet est peut être tombé dans les environs proches du domicile, le témoin fait des recherches le lendemain matin mais celles-ci sont infructueuses.<br>

Le témoin relate le passage durant 1 à 2 secondes d'une lumière assez éblouissante qu'elle observe de sa fenêtre avec l'impression que cette forme ronde est en feu. Cette description rejoint les nombreux témoignages (au moins 25) relatant le passage d'un bolide (rentrée dans l'atmosphère d'un météoroïde) le 10 septembre à 19h29 TU (soit 21h 29, heure locale française) visible de la Meurthe-et-Moselle aux Bouches-du-Rhône, en passant par les Pyrénées-Orientales, l'Isère et la Suisse. Il semble également que le météoroïde se soit fragmenté en de multiples morceaux à la toute fin de sa trajectoire lumineuse (plus de détail sur le lien du site : <b><a href=""http://www.reforme-meteor.net/bolide-du-10-septembre-2017-19h-40m-tu/"">REFORME</a></b>.<br>
Ce bolide a aussi été détecté par 14 caméras du réseau FRIPON.<br>

L'heure indiquée par le témoin ne correspond pas tout à fait au passage du bolide mais l'indication fournie de l'horaire n'est pas très précise puisque le témoin situe son observation entre 21h45 et 22h en signalant que son radio-réveil est la bonne heure, mais elle n'a pas forcément regardé son réveil juste au moment de l'observation ce qui pourrait expliquer le décalage avec les témoignages du bolide.<br>

L'estimation d'altitude (4m de hauteur) est faite de façon intuitive. Comme le phénomène est très brillant, le témoin l'a interprété comme très proche, mais sans repère objectif. Les phénomènes de bolides, perçus souvent comme  très proches par les témoins, se produisent en fait de 100 à 50 km d'altitude, et sont donc visibles du sol sur une zone d'environ 200 km de diamètre.<br>

Malgré le décalage avec le créneau horaire donné par le témoin, l'aspect et la trajectoire décrits laissent  guère de doute sur la correspondance avec ce bolide amplement observé par ailleurs.<br>

Le GEIPAN classe ce cas ""A"" : observation très probable d'un bolide.";"Très courte observation du passage rapide d'une lumière de couleur dans le ciel avec une trajectoire descendante : observation très probable d'un bolide.";O;;1;;1;;;;;2018-10-11;;;0.20;0.00;;;0.70;;0.60;;0.42;0.00;A;A;2017-09-50434
4496;"[B.VENUS] (COTES-D'ARMOR) (22) 31.12.1994";Côtes-d'Armor;22;"(D) Département";1994;12;31;"Le GEIPAN continue à publier l'ensemble de ses archives sur son site public www.geipan.fr. Dans ses publications, figurent des cas anciens classés à l'époque (A, B, C ou D) et qui font aujourd'hui l'objet d'un réexamen, dans le seul but d'être plus pertinent dans les conclusions. Grâce à de nouveaux moyens techniques (logiciels) et à l'expérience d'enquête acquise depuis toutes ces dernières années, ce réexamen aboutit quelquefois à de nouvelles remarques voire à un changement de classification. Ce cas d'observation précédemment classé D et nommé PLERIN (22) 29.12.1994 fait partie d'un ensemble de cas réexaminés récemment.<br>  Ce cas était constitué de différentes observations faites entre le 28 et le 31 décembre 1994 en soirée ou en début de journée dans les Cotes-d'Armor : 4 témoins (T1, T2,T3,T4) rapportent en gendarmerie leurs observations qui seront toutes consignées dans le même procès-verbal. La note d'enquête ci-jointe détaille toutes les observations et tous les phénomènes observés.<br>  L'ensemble des observations est peu consistant avec des descriptions peu précises.<br> Le réexamen conduit à distinguer 3 phénomènes distincts : <br> -	PAN 1  observé par T1 et T2 le 29 décembre 1994 entre 19h00 et 19h30.<br> -	PAN 2,3,4  vus par T3 les 29, 30 et  le 31 décembre entre 6H et 6H45 (avec T4 le 31 décembre).<br> -	PAN 5 vu par T3 et T4  le 31 décembre et PAN 6 par T4 le 28 décembre.<br>  Le PAN1 présente toutes les caractéristiques de l'observation d'un orage. Les lueurs composant le PAN sont en effet comparées à un ou des éclairs : « on aurait dit comme des explosions mais à des kilomètres l'une de l'autre et toujours une à la fois », « il y avait dans le ciel des espèces d'éclairs », « ces éclairs étaient plats et très longs. Je ne peux vous dire la taille de ces éclairs », « on aurait dit comme des flashs mais beaucoup plus gros », « un nouvel éclair est apparu », « lorsque je vous dit avoir vu des éclairs, il y en un seul qui semblait se déplacer ».<br> L'hypothèse de la méprise avec un orage est renforcée par le fait que le PAN est vu vers la mer. Cette direction est d'ailleurs confirmée par les témoins : « j'ai roulé un petit moment vers la mer », « j'ai encore vu une vive lumière bleue, immense, en direction de BINIC peut-être au-dessus de la mer ». Or, la présence d'un orage en mer, visible depuis la côte, est avérée par l'enquête de gendarmerie en début de soirée du 29 décembre 1994, c'est-à-dire à un horaire cohérent avec celui de l'observation.<br>   En conséquence, le GEIPAN conclut pour le PAN 1 :   B observation probable d'un orage.<br>  Les PAN n°2, 3 et 4 présentent des caractéristiques très similaires. Ce sont des lumières blanches vives, aux mêmes horaires trois jours consécutifs, observées sur de longues durées (plus de 40 minutes pour les PAN n°3 et 4), sans mouvement et dans la même direction d'un jour sur l'autre. Ces données sont tout à fait caractéristiques d'une méprise astronomique. Une reconstitution montre la présence de planète Vénus (très forte magnitude -4,24), en direction SE (~130°)  et à une dizaine de degrés de hauteur dans le ciel.<br>  L'hypothèse d'une méprise avec Vénus est renforcée par le fait que les PAN sont vus selon une hauteur angulaire faible, au travers d'une fenêtre (celle de la cuisine de T3 et T4) orientée en SE.<br> En conséquence, GEIPAN conclut pour les PAN 2,3 et 4 :  B observation probable de Vénus.<br>   Les descriptions des PAN n°5 et 6, sont trop imprécises (faible durée, peu d'information)  et trop peu consistantes (non cohérence des témoignages) pour pouvoir être exploitées : on peut ainsi imaginer des confusions avec des lueurs quelconques : phares de voiture, lueurs urbaines, dans un contexte émotionnel chargé par les observations précédentes.<br> En conséquence, le GEIPAN conclut pour les PAN 5 et 6 :  C Manque d'informations fiables.";"Témoignages multiples (entre le 29 et le 31/12/1994) de longues observations matinales (par T3 et T4 du PV) d'un phénomène lumineux à basse altitude dans le Sud-Est : observations probables de Vénus.";O;;;;;;;;;2017-12-11;;;0.25;0.00;;;0.60;;0.65;;0.50;0.00;B;B;1994-12-09754
17;"CREPY-EN-VALOIS (60) 06.10.1954";Oise;60;"(D) Département";1954;10;06;"Le 6 octobre 1954 vers 20h plusieurs membres d'une famille observent depuis chez eux et durant environ 40 minutes un disque lumineux de couleur rouge orange d'un diamètre apparent de la moitié de la pleine Lune supportant une espèce de nacelle. L'intensité lumineuse est variable et s'allume et s'éteint alternativement. L'objet semble se trouver au dessus de Senlis et se déplace lentement vers la droite.<br> Le geipan a reçu une fiche de renseignement succincte provenant de la gendarmerie. Un seul témoignage est recueilli<br> A l'heure de l'observation le soleil est couché depuis une demi heure ; il illumine encore les objets à haute altitude comme les avions ou les ballons scientifiques. La forme décrite par les témoins et la direction d'observation vers l'Ouest vont dans ce sens. Le GEIPAN classe ce cas B : probable observation d'un ballon scientifique.";"Observation d'un disque lumineux se déplaçant très lentement : probable observation d'un ballon scientifique.";O;1;;;;;;;;2016-07-11;;;0.38;0.13;;;;;;;0.65;0.35;B;B;1954-10-00014
18;"LACROIX-SAINT-OUEN (60) 07.10.1954";Oise;60;"(D) Département";1954;10;07;"Le 7 octobre 1954 à 9h deux personnes aperçoivent à la verticale du clocher de l'église un engin de forme ovale couleur aluminium très brillant. L'engin se déplace SE-NO. La durée d'observation est d'une minute.<br> Cette observation fait l'objet d'une fiche de renseignement succincte par la gendarmerie nationale.<br> Ce type d'observation peut avoir diverses origines (reflet de soleil sur un avion, ballon, bolide). Le GEIPAN classe ce cas C par manque d'information.";"Observations du déplacement d'un engin de forme ovale couleur aluminium très brillant dans le ciel : manque d'information.";O;1;;;;;;;;2015-12-08;;;0.50;0.50;;;;;;;0.28;0.28;C;C;1954-10-00015
19;"LACROIX-SAINT-OUEN (60) 08.10.1954";Oise;60;"(D) Département";1954;10;08;"Le 8 octobre 1954 à 23h30 quatre témoins observent un engin lumineux en forme de cercle dans le ciel. Le phénomène se déplace E-O. L'observation dure quelques secondes.<br> Cette observation fait l'objet d'une fiche de renseignement succincte par la gendarmerie nationale.<br> Ce type d'observation peut avoir diverses origines (reflet de soleil sur un avion, ballon, bolide). Le GEIPAN classe ce cas en C par manque de renseignement.";"Observation d'un engin lumineux en forme de cercle dans le ciel. Le phénomène se déplace E-O : manque d'information.";O;1;;;;;;;;2015-11-23;;;0.50;0.50;;;;;;;0.28;0.28;C;C;1954-10-00016
20;"CROTOY (LE) (80) 09.10.1954";Somme;80;"(D) Département";1954;10;09;"Le 9 octobre 1954 vers 20h trois agriculteurs observent durant 45 min dans le ciel un disque orange en forme d'assiette retournée. Il disparait en direction du NO.<br> L'observation est rapportée succinctement dans un message de renseignement de la gendarmerie nationale.<br> La durée de l'observation et la forme décrite font penser à certaines méprises avec la Lune. Celle-ci est bien présente dans le ciel mais au SE et à presque 30° d'élévation ce qui ne correspond absolument pas au contexte de l'observation. Le GEIPAN classe ce cas C par manque d'information.";"Longues observations d'un disque orange en forme d'assiette retournée ; disparition au NO : manque d'information.";O;1;;;;;;;;2015-11-24;;;0.50;0.50;;;;;;;0.28;0.28;C;C;1954-10-00017
21;"(DEP) SOMME (80) 14.10.1954";Somme;80;"(D) Département";1954;10;14;"Le 14 octobre 1954 vers 17h quatre témoins aperçoivent en direction du SO et à une hauteur de 40m un appareil sphérique se déplacant sans bruit mais à très grande vitesse. L'objet a les couleurs de l'arc en ciel.<br> Le GEIPAN a reçu une fiche succincte de renseignement sans le témoignage des témoins. La description d'un objet sphérique à très grande vitesse et multicolore fait penser à un bolide. <br> Ce cas trop succinct est classé C par manque d'information.";"Observations d'un phénomène lumineux au couleur de l'arc-en-ciel : manque d'information.";O;2;;;;;;;;2015-11-24;;;0.75;0.25;;;;;;;0.53;0.25;C;C;1954-10-09218
4256;"SAINT-AMBROIX (30) 18.01.2017";Gard;30;"(D) Département";2017;01;18;"Le 18 janvier 2017 vers 10h10 un témoin observe durant 15 secondes depuis sa fenètre deux sillons intermittents de fumée grise dans le ciel dégagé. Le témoin est intrigué par ces traces inhabituelles qui ne ressemblent pas aux classiques trainées d'avion. Un seul témoignage est recueilli. <br> L'observation est assez peu étrange. Le témoin n'apporte pas d'éléments forts pour rejeter sa propre hypothèse d'avion (trainées intermittentes, absence de bruit). <br> Les trainées intermittentes sont assez caractéristiques d'appareils militaires. <br> L'absence de bruit constatée peut s'expliquer de différentes manières. Les appareils pouvaient voler à haute altitude et sans être en post-combustion (cas classique engendrant un bruit important). De plus, l'éventuel bruit des appareils a pu être couvert par les bruits extérieurs de la ville de Saint-Ambroix. Bien que le témoin ait déclaré qu'il n'y avait aucun bruit extérieur lors de l'observation, on peut toutefois noter que l'observation se déroule au cur même d'une ville de plus de 3000 habitants, avec un axe important de circulation situé à proximité du lieu d'observation, à savoir la D904, qui est une ancienne route nationale. De plus, l'observation a lieu en semaine, un mercredi matin. <br> L'hypothèse d'une méprise avec un bolide diurne fragmenté et laissant des trainées rémanentes est exclue, puisque d'une part les deux trainées de fumée sont trop écartées l'une de l'autre, et que d'autre part des accélérations ont été constatées par le témoin. De plus, ce genre de phénomène astronomique est généralement vu par de nombreux témoins. <br> Les accélérations rappellent quant à elles deux avions en manuvre. <br> Bien que le PAN n'ait pas été identifié formellement, la description fournie par le témoin laisse peu de doutes sur la méprise. La consultation trop tardive des radars militaires n'a pas permis de valider ou non cette hypothèse. <br>  Le cas est classé B : probable observation de trainées d'avions militaires.";"Observation de deux sillons particuliers de fumée dans le ciel : probable observation de trainées d'avions militaires.";O;;;;;;;;;2017-08-30;;;0.40;0.00;;;;;;;0.50;0.00;B;B;2017-01-09620
4257;"CONFLANS-SAINTE-HONORINE (78) 29.11.2016";Yvelines;78;"(D) Département";2016;11;29;"Le 29 novembre 2016 vers minuit vingt une personne se lève et reste intriguée par ce qu'elle voit au travers de la fenètre de sa salle de bain. Le témoin aperçoit une lumière scintillante qui s'agrandit et se rétrécit ainsi qu'un objet hexagonal de couleurs variées qui scintille positionné au-dessus du champ du voisin. L'observation dure une vingtaine de minutes durant lesquelles quelques photos et vidéos sont prises. Le témoin apeuré réveille son mari puis retourne se coucher.<br> Le traitement de la vidéo, en permettant de situer les lumières sur les briques de verres de la salle de bain, permet, sans le moindre doute de constater que les lumières observées par le témoin étaient dues à la déformation d'une source de lumière par des briques de verre ondulées (voir le compte-rendu d'enquête). <br> La source de lumière n'a pas été identifiée. Mais ce n'est pas nécessaire puisque l'étrangeté est expliquée et ne vient pas de la lumière elle-même.<br> Le GEIPAN classe ce cas A : observation d'un reflet d'une lumière extérieure.";"Longue observation de nuit d'un phénomène lumineux au travers d'une fenètre : observation d'un reflet d'une lumière extérieure.
";O;;;;;;;;;2017-06-06;;;0.10;0.00;;;0.80;;0.90;;0.70;0.00;A;A;2016-11-09622
4269;"BEAUVOISIN (26) 06.02.2017";Drôme;26;"(D) Département";2017;02;06;"Le 06 février 2017 vers 20h45 une automobiliste constate dans le ciel une lumière très intense. Arrivée à son domicile, le témoin continue de voir cette lumière, statique. Elle l'observe aux jumelles. L'observation dure 45 minutes puis le témoin part chez des amis. Le lendemain soir vers 19h45, le témoin fait de nouveau une observation du même phénomène situé un peu plus haut dans le ciel que la première fois. Un seul témoignage est recueilli.<br>
La description de cette observation est caractéristique d'une observation d'un astre :<br>
- la durée d'observation est longue (45mn) et le PAN évolue pas ou peu dans le ciel ;<br>
- le PAN se présente deux soirs de suite et sous un aspect et une position suffisamment identiques pour que le témoin le signale comme le même phénomène : « j'ai remarqué dans le ciel le même objet très lumineux observé hier ».<br>

Cette observation s'avère être une méprise avec la planète Vénus qui est bien présente, mais pas en Nord Ouest comme dit le témoin, mais en Ouest léger Sud Ouest. L'analyse de la photographie du témoin donnant la position du PAN par rapport au relief permet de préciser cette position et par là la correspondance avec la position de Vénus. Par ailleurs, l'indication du témoin quant à la position du PAN le lendemain une heure plus tôt est également conforme à la position de Vénus (plus haut et plus au sud). Ceci est reconstitué dans le document joint.<br>
Vénus est brillante plus que les étoiles. Les  couleurs peuvent être variées et changeantes en raison des effets atmosphériques car Vénus est souvent prés de l'horizon et donc vu sous une forte épaisseur atmosphérique.<br>

Ce cas est classé A : observation de la planète Vénus.";"Longue observation en voiture et au domicile d'une lumière très lumineuse et statique dans le ciel nocturne : observation de la planète Vénus.";O;;1;;1;;;;;2018-10-11;;;0.05;0.00;;;0.70;;0.80;;0.55;0.00;A;A;2017-02-50346
27;"[C244] DE ANDRES (62) VERS GUINES (62) 21.10.1954";Pas-de-Calais;62;"(D) Département";1954;10;21;"Le 21 octobre 1954 à 19h30 deux gendarmes observent durant au plus 15 secondes une traînée lumineuse très brillante qui traverse silencieusement le ciel à grande vitesse en direction Nord-Sud. Dans la nuit sombre avec ciel dégagé et étoiles visibles, cette traînée a la forme d'un cône avec la pointe en avant et la base prolongée par de nombreuses étincelles. Sa trajectoire est horizontale.<br>  Bien que les témoins excluent (à tort) un météore « en raison de l'importance de ses dimensions et de l'horizontalité de sa trajectoire » c'est probablement ce qu'ils ont vu.<br> Le GEIPAN classe ce cas B : probable observation du passage d'un bolide provoqué par la rentrée dans l'atmosphère d'un météoroide naturel qui se fragmente.";"Observatoins du passage silencieux N-S d'une trainée lumineuse dans le ciel : probable observation du passage d'un bolide.";O;3;;;;;;;;2015-11-24;;;0.38;0.13;;;;;;;0.65;0.35;B;B;1954-10-00024
28;"MAILLY-LE-CAMP (10) 27.10.1954";Aube;10;"(D) Département";1954;10;27;"Le mercredi 27 octobre 1954 au camp de Mailly (commune de Mailly-le-Camp) deux personnes dont un colonel observent vers 17h45 un segment très brillant se détachant sur le fond bleu-vert du ciel pur ""légèrement au Nord par rapport au soleil couchant"" (2 à 3 minutes après le coucher du soleil). L'objet est situé à une hauteur angulaire de 45° à 20°, il est décrit comme immobile durant 10 à 15 secondes pour une durée totale d'observation de 25 à 30 secondes. Ce segment semblable à du métal brillant est incliné de 30° par rapport à la verticale puis devient brusquement ponctuel sur place durant 3 secondes avant de disparaitre. Sa dimension est entre le tiers et la moitié du diamètre de la Lune soit de 10' à 15'.<br> Seul le témoignage du colonel est recueilli dans un compte rendu d'observation et certaines explications du rapport manuscrit sont illisibles. Le témoin pense qu'il a probablement vu un avion en virage éclairé par en dessous par le soleil couchant.<br> Ce type d'observation fréquent de nos jours du fait de l'intense trafic aérien est observable tous les soirs par ciel clair peu après le coucher du soleil. Le GEIPAN classe ce cas B : probable observation d'un avion éclairé par le soleil couchant.";"Observations des évolutions dans le ciel d'un segment brillant : probable observation d'un avion éclairé par le soleil couchant.";O;9;;;;;;;;2015-11-24;;;0.38;0.13;;;;;;;0.65;0.35;B;B;1954-10-09243
29;"LONG (80) 31.10.1954";Somme;80;"(D) Département";1954;10;31;"Le 31 octobre 1954, vers 20 h, un agriculteur (T1) et son employé (T2) en tracteur observent, en arrivant dans un herbage, à une vingtaine de mètre du chemin suivi, un phénomène lumineux qui les effaye. Le T1 décrit ""engin lumineux qui tournait à quelques mètres du sol"". Le T2 décrit ""une boule de feu qui tournoyait à 4m du sol environ"" avec ""des rayons de diverses couleurs vives qui l'encadraient"". Le T1 éteint les lumières du tracteur et les témoins voient l'objet s'élèver en oblique à allure « normale » vers le Sud, traverser la vallée de la rivière La Somme. Lorsque les témoins rallument les phares, l'objet apparait de nouveau, tournoie à nouveau et part vers le Sud-Ouest. Aucune trace au sol n'est vue par les témoins choqués de leur observation. Le lendemain l'agriculteur racontera à l'adjoint au maire que l'objet avait une ""forme circulaire d'un diamètre d'une table ronde ordinaire"" et avait eu l'impression d'avoir entendu ""le même bourdonnement qu'un essai d'abeille quittant sa ruche"". Les couleurs vues étaient orange, le centre de couleur bleu l'obligeant à fermer les yeux un instant et la partie supérieure plus vive.<br>  La gendarmerie apprendra par la presse cette observation et entendra verbalement les témoins puis prendra leur dépositions le 4 novembre. Les gendarmes seront conduits sur le lieu de l'observation, mais ils ne relèveront aucune trace dans l'herbe.<br> L'enquête de gendarmerie permettra également de trouver deux autres témoins : un commerçant à Long (T3)  ayant observé le même jour et la même heure ""une boule de couleur orange"" dégageant ""des lueurs de couleurs diverses semblables aux lueurs de la soudure électrique à l'arc"", ""d'un mètre de diamètre"" et se déplaçant vers le SO ""assez rapidement"". Un charcutier (T4) rapportera aux gendarmes avoir vu au-dessus des arbres bordant la Somme ""un engin de forme cylindrique"" ayant en s'éloignant vers le SO ""une forme allongée voir ovale"" et ""dégageant plusieurs lueurs de couleur orange"". Quelques instants plus tard ces deux personnes verront arriver les deux premiers témoins « la figure décomposée » par la peur.<br> ce cas d'observation avec deux groupes de deux témoins à deux endroits différents de la commune est de très bonne consistance. Il n'y a pas de doute sur l'existence du phénomène.<br> Plusieurs aspects du phénomène font penser à de la foudre globulaire : aspect tournoyant, multicolore et  aveuglant, bruit d'essaim d'abeilles. Néanmoins nous manquons d'information pour confirmer cette hypothèse (météo ressentie par les témoins, relevés météo de l'époque).<br> Le GEIPAN classe ce cas C par manque d'information météorologique.";"Observations proches des évolutions d'un phénomène lumineux de couleur : manque d'informations.";O;4;;;;;;;;2016-02-01;;;0.50;0.50;;;;;;;0.28;0.28;C;C;1954-10-00026
43;"TEMARA (MA.01) 20.11.1954";Ain;01;"(D) Département";1954;11;20;"Le 20 novembre 1954 entre minuit 30 et 3h30 plusieurs personnes vont apercevoir un phénomène lumineux dans le ciel. Un seul témoignage est recueilli. Le témoin décrit un PAN se déplaçant verticalement en zig zag à partir du SSE dans un ciel sans nuage. Le Pan est tantôt brillant tantôt sombre avec un halo.<br>  Cette longue observation d'un gros point lumineux dans le ciel fait d'abord penser à un phénomène astronomique : on constate la présence de l'étoile Sirius au SE à minuit trente se déplaçant ensuite vers le Sud. Le halo constaté peut être la conséquence d'un voile astmosphérique issu du sable du desert. Les déplacements en zig-zag peuvent être causés par  <b><a href="" http://www.cnes-geipan.fr/index.php?id=382"">l'illusion autocinétique</a></b> (une illusion de perception fréquente lorsqu'on observe un point lumineux dans l'obscurité).<br> La direction d'observation n'est pas décrite assez précisément pour que l'on puisse confirmer cette hypothèse ( azimut estimé grossièrement au SSE sans évolution dans le temps, élévation exprimée en mètres au lieu d'être estimée en degrés. Faute d'information précise concernant la position dans le ciel, le GEIPAN classe ce cas C : manque d'information.";"Très longue observation d'un phénomène lumineux dans le ciel : manque de précisions et d'informations.";O;2;;;;;;;;2015-11-24;;;0.50;0.50;;;;;;;0.28;0.28;C;C;1954-11-00030
46;"SAINT-SIMON (02) 19.01.1955";Aisne;02;"(D) Département";1955;01;19;"Le 19 janvier 1955 vers 22h10 trois personnes observent le passage d'un phénomène lumineux du NE au SO. Ils décrivent un disque lumineux blanc suivi d'une longue trainée de couleur orange. Aucun bruit n'est entendu durant les 5 secondes d'observation.<br> L'enquête de gendarmerie n'a pas permis de retrouver d'autres témoins du phénomène mis à part une personne qui aurait vu quelque chose mais qui ne peut donner une précision sur le jour.<br> Le GEIPAN classe ce cas en B : probable observation d'un bolide c'est-à-dire la rentrée atmosphérique d'un météoroide.";"Observation du passage d'un phénomène lumineux dans le ciel : probable observation du passage d'un météoroide.";O;3;;;;;;;;2015-04-03;;;0.50;0.50;;;;;;;0.28;0.28;B;C;1955-01-00033
47;"REMIREMONT (88) --.--.1955";Vosges;88;"(D) Département";1955;--;--;"Un témoin rapporte par mail en janvier 2009 trois observations de PAN. Malheureusement il ne se souvient plus de la date exacte (les deux premiers dans les années 1955/1960 à Remiremont (88) et dans la banlieue Nancy (54) et la troisième en 1975 en Guadeloupe). <br> La date du premier janvier 1955 est donnée arbitrairement pour la première observation du déplacement d'un phénomène lumineux. Le témoin rapporte avoir vu un dimanche soir vers 17h ou 18h un objet lumineux circulaire de 50 m de diamètre environ à 400 ou 500m de la route et à 50m du sol.<br> Malgré notre demande de précisions concernant chaque observation, aucun questionnaire ne nous a été retourné. Le GEIPAN classe ces observations en C : manque d'informations.";"Observations successives de phénomènes lumineux entre 1955 et 1975 : manque d'informations.";O;;;;;;;;;2015-03-27;;;0.38;0.13;;;;;;;0.65;0.35;C;B;1955-01-01950
48;"GIVET (08) 20.05.1955";Ardennes;08;"(D) Département";1955;05;20;"Le 20 mai 1955 à 2h30 du matin deux gendarmes observent le passage SE-NO d'un phénomène lumineux qui les intrigue et disparait en quelques secondes. Ce phénomène a  la forme d'un obus et il est suivi d'une trainée lumineuse et multicolore. Un rapport de gendarmerie est établit.<br> Le GEIPAN classe ce cas en B : probable observation d'un bolide c'est-à-dire la rentrée atmosphérique d'un météoroïde.";"Observations du passage SE-NO d'un phénomène lumineux suivi d'une trainée multicolore : probable observation du passage d'un météoroide.";O;2;;;;;;;;2015-04-03;;;0.38;0.13;;;;;;;0.65;0.35;B;B;1955-05-00034
49;"CAVAILLON (84) 05.06.1955";Vaucluse;84;"(D) Département";1955;06;05;"Le 5 juin 1955 à 20h55 trois témoins à Cavaillon observent 20 secondes en direction de l'Ouest du massif du Luberon un rectangle lumineux rouge-feu dans le ciel. D'abord stationnaire, le phénomène se déplacement ensuite très rapidement en changeant de forme (demi lune puis boule) en direction de l'Est. Il rétrécit puis disparait.<br> La vérification astronomique élimine la Lune. L'hypothèse avion est abandonnée. Le GEIPAN classe ce cas C par manque d'information et de recoupement.";"Observation d'un phénomène lumineux rouge feu fixe puis en déplacement de forme changeante : manque d'information.";O;1;;;;;;;;2015-04-03;;;0.50;0.50;;;;;;;0.28;0.28;C;C;1955-06-00035
50;"(DPT) SEINE-MARITIME (76) 08.04.1956";Seine-Maritime;76;"(D) Département";1956;04;08;"Le 8 avril 1956 vers 23h40-23h45 trois témoins sur la commune de La Londe (76) observent dans la nuit claire et sans Lune en direction de l'Ouest une boule rouge. Le phénomène semble stationnaire pendant plusieurs minutes puis semble se déplacer lors des déplacements des témoins. Le phénomène disparait derrière les arbres. L'observation aura duré une vingtaine de minutes.<br>  La gendarmerie recueillera trois autres témoignages pour la même date et à 23h30-23h45 : ces témoins en voiture à Elbeuf (76) décrivent une forme ronde de couleur rouge en mouvement. L'observation sera très courte (de 4 à 5 secondes) en direction d'Orival (76).<br>  Les indications disponibles ne confirment pas que les deux groupes ont vu le même phénomène.<br>  La vérification astronomique indique pour le premier goupe Vénus proche de l'horizon à environ 45° au nord de la direction d'observation, et pour le second groupe qui regarde vers le Nord aucun astre particulier n'est visible.<br> Ce cas n'est pas très étrange et les informations sont trop imprécises : le GEIPAN classe ce cas C.";"Observations par deux groupes de témoins de deux phénomènes de forme ronde et rouge dans le ciel : manque d'information.";O;11;;;;;;;;2017-10-23;;;0.50;0.50;;;;;;;0.28;0.28;C;C;1956-04-00036
51;"PARIS (75) 15.11.1956";Paris;75;"(D) Département";1956;11;15;"Le 15 novembre 1956 à 19h05 à Paris, un pilote observe depuis le sol une boule de couleur rouge vif se déplacant NO vers SE dans le ciel clair. Une seconde boule s'en détache et suit une trajectoire parabolique dirigée vers le bas durant une seconde. Aucune trainée n'est remarquée. Les deux boules s'éteignent brusquement et simultanément.<br> Un seul témoignage à l'époque est recueilli.<br> Le GEIPAN classe ce cas en B : probable observation du passage d'un bolide provoqué par la rentrée dans l'atmosphère d'un météoroide naturel qui se fragmente.";"Observation du passage NE-SW d'une boule rouge dans le ciel et fragmentation : probable observation du passage d'un bolide.";O;2;;;;;;;;2015-03-30;;;0.38;0.13;;;;;;;0.65;0.35;B;B;1956-11-00037
52;"HADJOUT (DZ.42) 03.01.1957";"Grand Est";GES;"(R) Région";1957;01;03;"Le 3 janvier 1957 à 20h22 (TU) trois témoins en vol au sud de Marengo (aujourd'hui Hadjout, Algérie) observent durant 15 secondes un objet lumineux avec une trainée verte puis rouge qui traverse le ciel selon une trajectoire régulière descendante du SO au NE.  Un seul témoignage recueilli.<br> Le GEIPAN classe ce cas B : probable passage d'un météoroide.";"Observations en vol du passage SO au NE d'un objet lumineux avec une trainée : probable passage d'un météoroide.";O;2;;;;;;;;2015-03-30;;;0.38;0.13;;;;;;;0.65;0.35;B;B;1957-01-00038
54;"(DPT) ARDENNES (08) 30.10.1957";Ardennes;08;"(D) Département";1957;10;30;"Entre le 30 octobre 1957 à 23h30 et le 31 octobre 1957 à 1h30 deux phénomènes distincts sont observés par plusieurs groupes de témoins dans les Ardennes (08).<br> Le premier groupe observe depuis Louvergny à 23h40 en direction de l'Ouest un disque rouge de grand diamètre stationnaire et qui semble se séparer en deux parties à 23h50 avant de disparaitre. La vérification astronomique donne la Lune à l'azimut 245°et une élévation à 30° apparaissant comme un demi-disque incliné. Les descriptions données correspondent mal avec la Lune (élévation et forme).<br> Le même jour un deuxième groupe sur la RN46 entre Pauvres et Mazagran observent un objet de petites dimensions avec des reflets verts se dirigeant rapidement approximativement du SE vers le NO. L'observation a duré quelques dizaines de secondes. La description des témoins fait penser au passage d'un bolide (chute de météorite).<br> Dans la même soirée un troisième groupe situé à 100m du passage à niveau de Novy-Chevrières  observe à 23h50 en direction de cette bourgade le passage dans le ciel nuageux d'un objet lumineux rouge dans le ciel couvert (voir carte). Aucun bruit n'est entendu durant l'observation. Malgré les incertitudes sur les directions d'observation, il est possible que ces témoins aient fait une méprise de la Lune située exactement dans cette direction (Lune devant laquelle des nuages auraient pu se déplacer). Cependant cette hypothèse est peu compatible avec le mouvement de l'objet tel que rapporté par les témoins.<br> Toujours le 30 octobre à 23h50 à Ambly-Fleury, un quatrième groupe observera le passage d'une lueur rouge dans le ciel dans la même direction d'observation que ce troisième groupe. Il pourrait aussi s'agir ici de l'observation temporaire de la Lune dans une trouée de nuages.<br>   Le Geipan classe ces cas en C par manque d'information et de recoupement : il pourrait s'agir d'une méprise de la Lune et d'un passage d'un bolide mais les éléments ne sont pas assez précis pour confirmer ces hypothèses.";"Observations multiples de phénomènes lumineux dans le ciel ardennais : manque d'information.";O;2;;;;;;;;2015-04-01;;;0.38;0.13;;;;;;;0.46;0.31;C;B;1957-10-00040
55;"[AERO CTL] COGNAC (16) 17.12.1957";Charente;16;"(D) Département";1957;12;17;"Le 17 décembre 1957 quatre militaires sur la base aérienne de Cognac constatent l'apparition d'un écho radar à 15h01 (TU) d'un objet se déplacant depuis 40km et disparaissant à 16km dans les échos fixes. Le temps total d'observation sur le radar est de 30 secondes ce qui correspond à une vitesse de 2 880km/h.<br>  Le même jour mais à 15h45 (TU) un autre écho radar est remarqué  à 37km et disparait à 25km. Le temps total d'observation dure 15 secondes  ce qui correspond à une vitesse de 2 880km/h également.<br> Un rapport illustré de croquis est rédigé par deux témoins.<br> LE GEIPAN classe ce cas C par manque d'information (pas d'observation visuelle).";"Observations d'échos radar sur scope : manque d'information.";O;2;;;;;;;;2015-04-03;;;0.50;0.50;;;;;;;0.28;0.28;C;C;1957-12-00041
56;"TOMBOUCTOU (ML.06) 20.03.1953";Autre;ML.06;"(D) Département";1953;03;20;"Le 20 mars 1959 à environ 20h15 deux témoins à Tombouctou (Mali) observent un point fixe lumineux orange bas sur l'horizon. Le point fixe semble se déplacer assez lentement du NE- au SO sans trainée. Le point s'éloigne et diminue de grosseur et d'intensité avant de disparaitre complètement. Un seul témoignage est recueilli.<br> Une vérification astronomique ne monte aucun astre dans la direction indiquée. De plus l'objet est en mouvement apparent. Le phénomène tel qu'il est décrit pourrait correspondre à un avion dans le lointain vu de face phare allumé. Le GEIPAN classe ce cas C par manque d'information et de recoupement.<br>";"Observation d'un point fixe lumineux orangé dans le ciel puis déplacement et disparition par baisse d'intensité : manque d'information.";O;1;;;;;;;;2015-04-03;;;0.50;0.50;;;;;;;0.28;0.28;C;C;1959-03-00042
57;"SALI (DZ.01) 14.09.1959";Ain;01;"(D) Département";1959;09;14;"Le 14 septembre 1959 à 5h10-15 du matin trois témoins au sud de Sali (Algérie) sont intrigués par les évolutions d'un corps lumineux de couleur orange dans le ciel. A 5h30 l'objet s'immobilise. Durant 40 minutes ils constatent que le corps dérive lentement vers le NE en changeant fréquemment d'aspect et de couleur (rouge à une extrémité). L'observation se fait aux jumelles. Aucune trainée et aucun bruit n'ont été constatés. L'observation durera environ une heure au total.<br> Un seul témoignage est recueilli avec deux schémas (évolution de l'objet et changement de formes). Une autre observation est notée sur le rapport. Il est décrit pour le 12 septembre 1959 à 19h l'observation d'un phénomène de couleur orange et d'un diamètre apparent d'une étoile situé à très haute altitude et se déplaçant à grande vitesse de 180° à 360° en 30 secondes environ. Aucun son particulier n'est remarqué. Un seul témoignage est recueilli.<br> Pour la première observation, du fait de la durée de l'observation, du déplacement lent et de l'heure proche du lever du soleil, le GEIPAN classe le cas en B : probable observation d'un ballon éclairé par le soleil levant. Les directions d'observation et de déplacement manquent de précisions.<br> Pour l'observation du 12 septembre également rapportée dans le témoignage, le GEIPAN propose l'hypothèse du passage d'un météoroide (courte observation du déplacement à grande vitesse d'un phénomène lumineux orangé de forme allongée à très haute altitude).";"Observation des évolutions de déplacement et de forme d'un objet lumineux orangé dans le ciel : probable observation d'un ballon.";O;2;;;;;;;;2017-10-16;;;0.38;0.13;;;;;;;0.65;0.35;B;B;1959-09-00043
58;"DAKAR (SN.DK) 24.11.1959";Autre;SN.DK;"(D) Département";1959;11;24;"Le 24 novembre 1959 aux alentours de 20h20 un témoin à bord d'un bateau au port de commerce de Dakar (Sénégal) observe le déplacement d'un phénomène lumineux composé de points lumineux et entouré d'un halo. Ce phénomène est situé au SO et à 15° de hauteur environ. La vitesse du phénomène augmente puis sa trajectoire devient descendante. Le halo s'assombrit de plus en plus et le phénomène disparait. L'observation a duré 5 minutes.<br> Dans le rapport établit par le témoin, celui-ci indique 4 bateaux dans des lieux d'observation différents pour le même phénomène sensiblement à la même heure.<br> Un seul témoignage est recueilli. La description du phénomène pourrait faire penser à un avion dans le lointain vu de face phare allumé. Le GEIPAN classe ce cas en C par manque d'information.";"Observations mulitples d'un phénomène lumineux dans le ciel : manque d'information.";O;2;;;;;;;;2015-04-03;;;0.50;0.50;;;;;;;0.28;0.28;C;C;1959-11-00044
59;"WISSOUS (91) --.--.1960";Essonne;91;"(D) Département";1960;--;--;"Témoignage récent d'une observation ancienne : le témoin parle d'une observation faite autour de 1960 sans plus de précisions (la date donnée ici est une date arbitraire de jour et mois ). <br>  En fin d'après midi, deux personnes sont sur le perron d'une maison. L'orage menace, le ciel est gris sombre. En regardant vers le N-E, ils voient une ""goutte de feu ventrue blanche"" descendre à la verticale depuis les nuages orageux. L'observation de cette ""goutte"" pointe éffilée vers le haut dure une à trois secondes : le phénomène disparait derrière un rideau d'arbres. Aucun bruit, et aucun feu au sol n'ont suivi.<br>  Le cas a été  soumis à un expert de l'étude de la foudre. L'expert confirme que ce type d'observation n'est pas rare : il arrive qu'une ou des sphères lumineuses descendent (comme la chute lente d'une fusée de détresse) de la base du cumulonimbus lors d'un temps fortement pré-orageux. Généralement, la jonction de la sphère avec le sol ou une structure donne suite à un coup de foudre isolé, presque toujours  en situation d'orage sec. Le phénomène fait partie des multiples facettes de la foudre en boule.<br> Ce cas est classé ""B"" observation probable de foudre en boule.";"Observation par temps pré-orageux, du déplacement d'une goutte de feu ventrue descendant d'un nuage : probable observation de la foudre en boule.";O;1;;;;;;;;2013-02-27;;;0.38;0.13;;;;;;;0.65;0.35;B;B;1960-07-08172
61;"PIERREFORT (15) --.--.1960";Cantal;15;"(D) Département";1960;04;--;"Témoignage récent (14 mai 2008) d'une observation ancienne : vers 7h30 un matin de 1960 (mars, avril ou mai), deux écoliers  observent depuis la route un phénomène lumineux qui les intrigue. Au bout de quelques minutes il disparaît  à l'horizon.  Aucun complément d'information n'a été produit par les témoins. Le manque de précisions et la date ancienne de l'observation rendent toute enquête difficile voir impossible.";"Observation d'un phénomène lumineux.";O;2;;;;;;;;2010-04-08;;;0.50;0.50;;;;;;;0.28;0.28;C;C;1960-04-02014
65;"LONDE (LA) (76) 13.11.1960";Seine-Maritime;76;"(D) Département";1960;11;13;"Le samedi 5 novembre 1960 vers 20h30 deux personnes constatent la présence de lueurs verte-orange-et rouge semblant provenir d'un engin qui se déplace lentement dans le ciel. Quelques jours plus tard, le 13 novembre vers 2h45 un des témoins est intrigué par une clarté de couleur verte donnant dans sa chambre. Réveillant sa compagne, celle-ci constate effectivement le clignotement de lumières de couleur verte-orange et rouge puis se rendort. Le témoin se dirige alors sur le pas de sa porte et constate la présence à 150 mètres, d'un engin circulaire de plusieurs mètres de diamètre qui atterrit sur une voie ferrée désaffectée proche de l'habitation. L'engin, silencieux, posé sur un trépied, émet des lumières oranges et vertes. L'observation durera une vingtaine de minutes avant que l'engin décolle silencieusement et disparaisse en direction du SO en émettant  alternativement des feux verts. Intrigué, le témoin rapportera son observation au reporter d'un journal régional.<br> Aucune trace ne sera retrouvée sur les lieux lors de l'enquête de gendarmerie. Les enquêteurs auditionneront plusieurs habitants et entre autres, deux employés SNCF de permanence cette nuit-là aux passages à niveaux du secteur concerné : rien de particulier n'a été remarqué par ces cheminots ce soir là.<br> Lors de l'enquête, la crédibilité du témoin principal, bien connu des autorités, est fortement contestée par l'ensemble des personnes interrogées et des représentants des autorités locales. Aucun autre témoignage sur cette observation ne viendra corroborer les dires du témoin.<br> Le GEIPAN classe ce cas ""B"" comme probablement un canular.";"Observation de l'atterrissage puis du décollage silencieux d'un engin circulaire sur une voie ferrée désaffectée : probablement un canular.";O;2;;;;;;;;2017-02-23;;;0.38;0.13;;;;;;;0.65;0.35;B;B;1960-11-00048
67;"PREMESQUES (59) 11.11.1963";Nord;59;"(D) Département";1963;11;11;"Observation faite en novembre 1963 par trois témoins et rapportée au GEIPAN en avril 2008.<br>  Le 11 novembre 1963 vers 15h ou 16h un père et ses deux fils (de 18 et 13 ans) se promenent sur un chemin de campagne et observent un phénomène lumineux qui les intrigue. Une boule lumineuse orangée est stationnaire en-dessous de nuages sombres durant plus d'une minute. En rotation par la suite, elle oscille de droite à gauche durant quelques secondes avant de disparaître à très grande vitesse dans les nuages selon une trajectoire rectiligne incurvée vers le haut. Aucun bruit, aucune trainée ne sont remarqués.<br> Aucun autre témoignage concernant ce phénomène ne sera rapporté.<br>  La restitution des faits sera faite progressivement entre 2003 et 2007 par un des témoin (l'étudiant de 18 ans). <br> L'hypothèse de l'observation du déplacement de la foudre en boule (plasma) a été réfutée, car d'une part le témoin ne confirme pas la présence d'orage lors de la promenade familiale et d'autre part il existe des différences des caractéristiques entre le phénomène observé le 11 novembre 1963 et celles connues de la foudre en boule.<br>  Le GEIPAN classe ce cas en D1 : phénomène inexpliqué, moyennement consistant (témoignage unique, ancien et phénomène lointain) mais avec un caractère d'étrangeté marqué.";"Observation d'un phénomène lumineux stationnaire sous des nuages sombres puis du déplacement rapide vers les nuages. Aucun bruit, aucune trainée : phénomène inexpliqué, moyennement consistant.";O;1;2;;;;;;;2015-06-25;;;0.63;0.13;;;;;;;0.75;0.00;D1;D1;1963-11-01791
68;"BOURGET-DU-LAC (LE) (73) --.02.1964";Savoie;73;"(D) Département";1964;02;--;"Une personne rapporte qu'en 1964, il a été témoin d'un phénomène particulier. Rentrant à la base école du Bourget vers 2h30 du matin un dimanche début mars, il s'étonnera d'apercevoir régulièrement une faible lueur de courte durée à environ 200 ou 300 m de lui. Se rapprochant du grillage du terrain militaire, il voit 5 silhouettes évoluant prés d'un engin posé au sol. La partie haute de l'objet, éclairée par la lueur, est arrondie. Les silhouettes font des allers-retours de l'intérieur de l'objet à son environnement immédiat. Brusquement la lueur s'éteint et dans un silence total l'objet s'élève d'un mètre ou deux du sol et reste stationnaire durant une à deux secondes. Le témoin décrit alors l'objet comme ayant une forme ronde ou ovale, le dessous plat, le dessus bosselé au centre et sur les cotés. Ses dimensions sont de 8 à 10 m de diamètre et sa hauteur de 2,50m à 3 m. Cet objet s'élève verticalement sans transition à très grande vitesse vers le sud. Aucun bruit n'est entendu et une sorte de trainée verticale brève apparaît ainsi que deux autres traces dans le ciel. Le lendemain le témoin se rendra sur les lieux de son observation et bien que séparé d'une dizaine de mètres du lieu exact par le grillage de la base militaire, il constatera un léger tassement de l'herbe et de quelques arbustes. Il décidera de ne parler à personne de cette observation pour laquelle nous manquons d'informations confirmées. Ces faits, a priori très étranges, rapportés très tardivement (juin 2007) par un témoin unique sont invérifiables et aucune analyse sérieuse ne peut être menée.";"Observation de silhouettes et décollage d'un objet.";O;1;1;;1;;;;;2018-08-10;;;0.50;0.50;;;;;;;0.28;0.28;C;C;1964-03-01780
70;"VALENSOLE (04) 01.07.1965";Alpes-de-Haute-Provence;04;"(D) Département";1965;07;01;"Le 1er juillet 1965 à 5h45, un agriculteur dans son champ de lavande entend un sifflement qui l'intrigue. Il se déplace pour constater qu'un engin sombre et mat qui lui est inconnu est posé sur le sol. Il observe durant 4 à 5 minutes la présence de deux personnages qui remontent très vite dans l'appareil. Ce dernier décolle et part en oblique avant de disparaitre rapidement en direction de Manosque. Une dizaine de minutes plus tard, l'agriculteur découvre des traces au sol à l'emplacement de l'engin : ces traces ont la forme d'une étoile avec un trou cylindrique au milieu dans une terre détrempée. Il revient le soir vers 20h30 avec sa fille et constate alors que la terre est devenue ""dure comme du ciment"". <br> Le lendemain matin, 2 juillet, il parle de cette affaire et très vite beaucoup de curieux se déplacent  pour voir les traces qui seront piétinées. Vers 19h30 la gendarmerie locale apprend par la rumeur publique cet évènement.<br> Le témoin sera entendu une première fois le 2 juillet 1965 à 20h par la brigade locale (voir le pv 445). Vers 22h le témoin accompagnera les gendarmes sur les lieux. Il sera de nouveau entendu de 23h15 à 23h30 pour un complément d'information.<br> Un procès-verbal de constations sur le lieu d'observation et sur les traces au sol sera établit le 3 juillet par une autre brigade (voir le pv 105) avec prises de mesure, photographies.<br> Le témoin rapportera un complément d'information très détaillé le 18 août 1965 (voir le pv 145).<br> Aucun autre témoignage ne sera recueilli. Aucun autre indice ne sera trouvé autour du lieu de l'observation par la gendarmerie.<br> A l'époque de cette observation, le GEPAN, créé en 1977, n'existait pas ; les responsables successifs du GEPAN/SEPRA/GEIPAN se sont bien sûr tous intéressés à cette affaire, ont reçu ou collectionné des documents à son sujet, sans toutefois publier d'enquête approfondie ; une enquête GEPAN aurait probablement été peu fructueuse du fait du délai depuis l'événement, et après les travaux d'investigation déjà faits par la Gendarmerie et par plusieurs enquêteurs, dont Pierre Guérin et Jacques Vallée. Vue son étrangeté, ce cas est classé « D ».";"Observation d'un engin inconnu et rencontre rapprochée ; traces au sol : phénomène non identifié.";O;1;;;;;;;;2015-06-26;;;0.75;0.25;;;;;;;0.78;0.23;D;D;1965-07-00050
71;"DE MOUSTIERS-SAINTE-MARIE (04) vers MANOSQUE (04) --.07.1965";Alpes-de-Haute-Provence;04;"(D) Département";1965;07;--;"Témoignage récent (17 aout 2009) d'une observation ancienne faite au début du mois de juillet 1965 ( la date du jour n'est pas précisée par le témoin ; une date arbitraire est donnée pour le 1er juillet 1965; le témoin ne précise pas également le lieu exact de l'observation).<br> Par un mail succinct, un témoin rapporte une observation faite depuis un véhicule sur une route indéterminée entre Moustiers-Sainte-Marie ( 04) et Manosque (04) : sur les alentours de 19h ou 19h30, lors d'un voyage dans les gorges du Verdon et en traversant un champ de lavande le témoin alors agé de 14 ans et son frère agé de 4 ans aperçoivent depuis l'arrière de la voiture une ""grosse assiette renversée dans un champ"" et ""des enfants sortant de cette assiette"". Aucune autre information n'est recueillie et aucun autre témoignage ne sera rapporté.<br> Ce cas à première vue étrange, est trop peu documenté pour une enquête (pas de lieu ni date précise). Les éléments complémentaires demandés par le Geipan n'ont pas été fournis.<br>  Ce cas est classé ""C"" enquête impossible. On remarque toutefois que la position de la Lune à son lever au Sud-Est le 11 juillet pourraît être une cause de méprise. Ceci n'explique évidemment pas les petits êtres (enfants?) observés.";"Témoignage très succinct et récent (2009) d'une observation ancienne (début juillet 1965) ; observation depuis un véhicule ""d'enfants"" sortant d'un objet en forme d'assiette retournée dans un champs de lavande : manque d'informations.";O;1;;;;;;;;2014-03-21;;;0.50;0.50;;;;;;;0.28;0.28;C;C;1965-07-02381
72;"BLOIS (41) 23.07.1965";Loir-et-Cher;41;"(D) Département";1965;07;23;"Déclaration récente d'une observation ancienne faite le  23 juillet 1965 vers 18h. Un objet d'apparence métalique en forme de triangle est immobile dans le ciel et réflêchit fortement la lumière du soleil.<br> Ce cas d'observation par de multiples témoins d'un objet lumineux fixe dans le ciel du soir a toutes les caractéristiques d'un ballon sonde stratosphérique tétraédrique.<br> L'aspect lumineux et métallique est caractéristique, l'immobilité apparente n'est pas rare, leur très haute altitude (jusqu'à 40km) rend les déplacements apparemment très lents, et les vents à cette altitude sont très variables. Le calcul d'altitude fait par le témoin est pertinent ; il est bien cohérent avec cette hypothèse de ballon sonde qui a réfléchi la lumière du soleil jusque 40 mn après le coucher du soleil.<br> On note ce soir là la présence évidente de la planète Vénus, qui était éclatante à l'ouest peu après le coucher du soleil. Il est étonnant que les témoins ne la mentionne pas ; mais elle était bien plus à l'Ouest et plus basse que le phénomène observé.<br> Le GEIPAN classe ce cas ""B"" : observation probable de ballon stratosphérique.";"Observation d'un objet immobile et brillant en forme de triangle dans le ciel : probable observation d'un ballon scientifique.";O;1;;;;;;;;2013-08-08;;;0.38;0.13;;;;;;;0.65;0.35;B;B;1965-07-02569
74;"BEAUVAIS (60) --.08.1965";Oise;60;"(D) Département";1965;08;--;"Témoignage succinct et récent (28 aôut 2009) d'une observation ancienne.<br> Au cours de l'année 1965 ou 1966, probablement en Août (le témoin reste imprécis sur la date), des personnes observent plusieurs matins de suite, une boule d'éclat métallique stationnaire située à l'Est dans le ciel à proximité d'une cheminée en démolition. Aucun bruit ne sera entendu durant les observations de ce phénomène qui finira par disparaître.<br> Aucun autre témoignage ne sera recueilli sur ce phénomène pour lequel nous manquons d'informations.";"Observations successives de la présence d'une boule  dans le ciel : manque d'informations.";O;1;;;;;;;;2012-10-16;;;0.50;0.50;;;;;;;0.28;0.28;C;C;1965-08-02422
83;"MORTEMART (87) 19.03.1967";Haute-Vienne;87;"(D) Département";1967;03;19;"Témoignage récent d'une observation ancienne pour laquelle le témoin n'avait pu dans son questionnaire donner la date exacte. Après une conversation téléphonique avec le témoin, ce dernier confirme la date du 19 mars 1967 et que les manifestations lumineuses rapportées sur Radio Limoges se sont passées dans les environs de La Chapelle-Taillefert dans la Creuse.<br> Le 19 mars 1967 vers 23h un automobiliste à la sortie du bourg de Mortemart (Haute-Vienne) est intrigué par un phénomène lumineux dans le ciel. Il s'arrête pour observer durant 10 minutes en direction du SE un objet lumineux en déplacement silencieux. Le Pan fait des arrêts successifs et l'intensité lumineuse varie durant l'observation ce qui ne permet pas au témoin de définir avec certitude une forme discoidale. L'objet fini par disparaitre à l'horizon. Aucun bruit particulier n'est entendu. Reprenant sa route, quelques minutes plus tard, l'automobiliste est de nouveau intrigué par le passage à basse altitude derrière sa voiture d'une lueur rougeâtre. Il observe quelques kilomètres plus loin en pleine campagne un dôme éclairé de l'intérieur : l'automobiliste s'arrête et constate que ce Pan semble poser sur le sol à une vingtaine de mètres de la route. Malgré l'insistance de leur fils et parce qu'impressionnés, le témoin et sa femme reprennent leur chemin pour rentrer chez eux au plus vite. Aucun autre témoignage ne sera recueilli sur ce phénomène.<br>  Cette observation a eu lieu le soir du référendum initialisé par le Général de Gaulle.<br> Ce témoignage d'un phénomène lointain étrange ne correspond à aucune des méprises classiques. Comme il a été reçu longtemps après l'observation, et que le témoin est unique, le GEIPAN le classe comme cas peu consistant, malgré la bonne qualité du témoignage.<br> Si d'autres témoignages semblables se rapprochaient de celui-ci, ce cas pourrait prendre de la consistance. Le témoin nous a indiqué par téléphone qu'il y aurait peut être pu avoir d'autres témoignages semblables près de Guéret.<br> Le GEIPAN classe ce cas ""C"" en attente d'autres témoignages.";"Témoignage récent d'une observation ancienne : multiples observations de phénomènes lumineux par un automobiliste sur son trajet de nuit : manque d'information.";O;;;;;;;;;2016-05-02;;;0.80;0.00;;;0.70;;0.70;;0.49;0.00;C;C;1967-03-08365
108;"NANTES (44) 08.10.1969";Loire-Atlantique;44;"(D) Département";1969;10;08;"Un témoin rapporte en 2010 une observation ancienne faite à l'aide d'une lunette terrestre admiral 1000 (zoom15X-60X) prêtée par un ami. Deux autres personnes présentes ont, à l'époque, observé le phénomène.<br>  Le mercredi 8 octobre 1969 à 7h10, trois personnes ont le regard attiré par un point lumineux dans le ciel. Le témoin observe alors, à travers la lunette, un objet qui se déplace lentement du Nord au Sud dans un mouvement de va-et-vient. Il décrit un disque accompagné de deux satellites tournant autour de l'élément principal. L'observation dure une vingtaine de minutes. Le témoin cesse quelques instants son observation mais ne voit plus rien à son retour.<br>  Aucun autre témoignage concernant un phénomène vu en octobre 1969 dans la région ou les régions limitrophes, ne sera recueilli au GEIPAN. <br>  L'observation d'un point lumineux dans le ciel du matin est en soi un phénomène banal : ce peut être dans ce cas Sirius ou un ballon sonde. La disparition de l'objet est aussi banale : la luminosité du ciel augmentant au lever du soleil a rendu l'objet invisible.<br> L'observation à la lunette telle que décrite par le témoin avec enthousiasme est plus étrange (satellites orbitant autour de l'objet) ; toutefois, les lunettes avec zoom sont reconnues pour être très sensibles aux aberrations optiques (flare qui provoque des images fantômes) ; le témoin affirme que cette lunette était de bonne qualité sans défaut marqué puisqu'il a pu voir précédemment les satellites de Jupiter. L'ancienneté et l'unicité du témoignage,  l'incapacité à vérifier la qualité de cette lunette ne permettent pas de se prononcer clairement sur ce témoignage : classement ""C"".";"Observation d'un point lumineux au lever du soleil avec une lunette.";O;1;;;;;;;;2011-11-22;;;0.50;0.50;;;;;;;0.28;0.28;C;C;1969-10-02635
112;"FORT-DE-FRANCE (972) --.--.1970";Martinique;972;"(D) Département";1970;--;--;"Vers 22 h depuis la terrasse de son domicile, deux personnes observent dans le ciel l'arrivée de la Caravelle venant de la Guadeloupe. Leur attention va être attirée par un phénomène lumineux blanc qui semble dans un premier temps suivre l'avion. A très grande vitesse cette boule de lumière dépasse l'avion sur une trajectoire rectiligne et disparaît à l'Ouest. Aucun bruit particulier n'est entendu durant l'observation qui est de courte durée (3 à 5 secondes). Ce  fait est rapporté plusieurs années plus tard et le témoin précise que son observation a pu se faire entre la deuxième moitié de 1969 et avant juillet 1970 (nous le datons donc au 1er janvier 1970). Aucun autre témoignage de ce type en Martinique et dans cette période n'a été recueilli sur ce phénomène pour lequel nous manquons d'informations.";"Boule de lumière blanche semblant suivre et dépasser un avion.";O;1;;;;;;;;2010-03-30;;;0.50;0.50;;;;;;;0.28;0.28;C;C;1970-01-01778
120;"(DPT) LANDES (40) --.07.1970";Landes;40;"(D) Département";1970;07;--;"Un témoin rapporte qu'au mois de juillet dans les années 1970 à 1973 (ses souvenirs quand à la date d'observation sont imprécis, nous la datons donc au 01/07/1970) vers 21h il a pu voir arriver à 300 ou 400m d'altitude un aéronef de la forme d'une soucoupe de couleur blanche ou aluminium. Il mesurait entre 6 à 8 m de diamètre ; il avançait très lentement en ligne brisée de droite à gauche. Un faisceau de lumière arrivait de deux puissants projecteurs placés à l'avant.  Appelant des membres de sa famille ils ont pu voir l'aéronef disparaître à très grande vitesse, sans bruit et dans un mouvement ascendant de 45°. Un deuxième aéronef  est alors apparu : de la forme d'un cigare blanc ou aluminium d'une trentaine de mètres et arrivant sans bruit, il était à la même altitude que le premier. Un trentaine de hublots permettait de voir une lumière douce et tamisée à l'intérieur. Il se déplaçait en ligne droite très lentement et a disparu caché par la cime des arbres. Les deux aéronefs venaient du N-NO et allaient vers le S-SE. Le témoin fait état d'un article presse sur des lumières apparues le soir en question à l'aéroport de Bordeaux. Ce témoignage très ancien donne des précisions surprenantes néanmoins nous manquons d'informations et il est trop ancien pour pouvoir enquêter.";"Observation du déplacement d'aéronefs inconnus.";O;1;;;;;;;;2010-03-30;;;0.50;0.50;;;;;;;0.28;0.28;C;C;1970-01-01784
128;"NEUVES-MAISONS (54) 02.11.1971";Meurthe-et-Moselle;54;"(D) Département";1971;11;02;"Le 02 novembre 1971 aux alentours de 19h10 et 19h40, le témoin (alors âgé de 6 ans et demi) rentre chez ses parents après un entraînement sportif. Il est alerté par un camarade de la présence d'un objet dans le ciel. Intrigué le témoin observe un objet circulaire de la forme d'une ""soucoupe"" avec deux rangées de hublots. Cet objet semble tourner sur lui-même en se déplaçant à faible altitude sans faire de bruit. L'objet est à la verticale de la rue que le témoin doit emprunter pour rentrer chez lui. Mais arrivé à un carrefour l'enfant quitte le PAN des yeux : le PAN continue sa route en ligne droite. Arrivé chez lui, malheureusement l'enfant ne reverra plus l'objet dans le ciel. Un seul témoignage sera recueilli (voir le compte rendu d'enquête).<br>

L'hypothèse d'un ballon perdu correspondrait en grande partie (trajectoire rectiligne, silence, altitude peu élevée, durée de l'observation...) mais ne peut être validée les recherches n'ayant pas permis de trouver un ballon présentant les caractéristiques décrites par le témoin (hublots, couleur, taille...). Le changement de couleur noté en fin d'observation est également un élément affaiblissant cette hypothèse.<br>
Le témoignage, riche en détails est surprenant au vu du jeune âge du témoin. Un seul des deux témoins connus a témoigné auprès du GEIPAN et a été entendu.<br>
La consistance est ici entachée par le grand délai après l'observation (45 ans) pouvant altérer le souvenir et aussi par l'enregistrement d'un seul des deux témoins.<br>

La consistance est trop faible pour valider le caractère étrange et inexpliqué de l'observation. Il n'est par exemple pas possible de vérifier certaines informations importantes et il n'est pas possible d'écarter avec des indices forts la piste d'un possible ballon d'enfant perdu.<br>
En conséquence le GEIPAN classe en le cas en C : témoignage tardif inexploitable par manque d'informations fiables";"Témoignage récent (2013) d'une observation ancienne (1971). Observation durant une minute environ du passage rectiligne et silencieux d'un objet circulaire avec deux rangées de  ""hublots"" tournant sur lui-même : manque d'informations.";O;;1;;1;;;;;2018-10-17;;;0.65;0.00;;;;;;;0.40;0.00;C;C;1971-11-08602
138;"HAUTEVILLE-LOMPNES (01) 13.12.1972";Ain;01;"(D) Département";1972;12;13;"Un témoin rapporte en juin 2009, deux observations anciennes.<br> Le 13 décembre 1972 à 23h45 environ, deux personnes en voiture sont surprises de voir un objet rond et  lumineux apparaitre dans le ciel au-dessus de Hauteville. Le phénomène de couleur blanc-jaune bleuâtre se déplace selon une trajectoire rectiligne et à très grande vitesse dans une direction Sud-Nord. Il disparait derrière l'horizon. Aucun bruit particulier ne sera entendu par les témoins durant la courte observation.<br> Aucun autre témoignage ne sera recueilli.<br>  Ce cas est moyennement étrange par sa vitesse et sa luminosité de type ""phosphorescente"", mais la consistance du témoignage et l'absence de recoupements ne permet pas de conclure.<br> Ce cas est classé C faute de témoignages indépendants et de recoupements.<br>  La deuxième observation dans la nuit du 23 au 24 aout 1985 d'un flash lumineux  en bâteau correspond probablement à un bolide, qui mènerait à un classement B pour cette seule observation.";"Observation du déplacement rapide d'un objet lumineux de couleur blanc, jaune, bleuâtre : manque d'information";O;1;;;;;;;;2007-03-22;;;0.50;0.50;;;;;;;0.28;0.28;C;C;1972-12-02331
140;"NOUMEA (988) --.--.1973";Nouvelle-Calédonie;988;"(D) Département";1973;--;--;"Un soir de 1973 vers 23h un enfant avec ses parents observent des lumières multicolores au-dessus de la baie de Magenta à Nouméa. Ces lumières sont stationnaires au-dessus de la mer. Pensant à un mouvement d'avion, les témoins sont  très étonnés en passant devant l'aérodrome de constater que celui-ci est complètement fermé. Après enquète le lendemain, aucun mouvement d'avion ou d'hélicoptère n'a été fait sur l'ensemble de l'ile. Le témoin parle d'autres personnes ayant fait des observations semblables cette nuit là mais aucune autre information n'a été recueillie sur ce phénomène pour lequel nous manquons d'informations.";"Observations de 5 lueurs multicolores au-dessus de la mer.";O;1;;;;;;;;2010-03-30;;;0.50;0.50;;;;;;;0.28;0.28;C;C;1973-01-01765
141;"CARCES (83) --.--.1973";Var;83;"(D) Département";1973;--;--;"Un témoin rapporte en 2008 une observation faite entre 1973 et 1976 sans précision de date et mois. La date donnée ici est arbitraire.<br> Le témoin, marchant seul au bord d'une route de campagne, aperçoit dans un renfoncement d'un terrain, un appareil de couleur blanche stationnaire à quelques mètres du sol. Aucun bruit de moteur n'est entendu. Se rapprochant de l'appareil, le témoin voit des flashes puis un éclairage intense autour de l'appareil qui décolle avec bruit et prend de l'altitude rapidement. L'endroit où était stationné l'engin est brûlé, noir mais sans feu.<br>  Ce cas ancien, très étrange, n'a été soumis au GEIPAN qu'en 2008, suite à une émission de télévision. En mars 2012, un expert du Geipan a longuement téléphoné au  témoin. Comme la date précise de l'observation n'est pas connue, que le témoin refuse de donner les noms de son entourage au courant de l'observation à l'époque, une enquête sérieuse est impossible. On peut aussi émettre des réserves sur la précision de la mémoire sur des faits datant de plus de 35 ans. <br> Devant ces incertitudes, le GEIPAN classe ce cas ""C"" : enquête impossible. Le GEIPAN note toutefois que le lieu d'observation n'est qu'à 10 km du camp de Canjuers, le plus grand champ de tir d'Europe occidentale, qui accueillait déjà à cette époque de nombreux engins militaires de toute sorte.";"Observation d'un engin blanc stationnaire au-dessus d'un champ et s'élevant rapidement dans le ciel : manque d'information";O;1;;;;;;;;2012-11-06;;;0.50;0.50;;;;;;;0.28;0.28;C;C;1973-01-02356
207;"CONCARNEAU (29) --.--.1974";Finistère;29;"(D) Département";1974;--;--;"Témoignage récent (le 14 mai 2008) d'une observation ancienne. En mai ou juin 1974 ou 1975 un témoin observe, depuis son appartement situé au 5eme étage, trois points lumineux fixes à une altitude d'environ 200 à 300 mètres. Après plusieurs minutes et sans bruit, ces points lumineux se rapprochent de la côte  puis s'éloignent vers le Sud.  Aucun autre témoignage et aucune autre précision n'ont été recueillis sur ce phénomène.";"Observation de trois points lumineux dans le ciel.";O;1;;;;;;;;2010-04-08;;;0.50;0.50;;;;;;;0.28;0.28;C;C;1974-05-02510
245;"SAINT-GILLES (30) 13.10.1974";Gard;30;"(D) Département";1974;10;13;"Le 10 octobre 1974 à 17h 55 une surveillante de collège est avertie par les élèves d'un phénomène particulier dans le ciel. Sortant à l'extérieur de l'établissement, le témoin aperçoit une boule de couleur argentée ainsi que deux autres petites boules. Celles-ci semblent être réliées à la première par un fil. Le témoin décide d'avertir son mari et perd de vue l'ensemble. Le lendemain on lui rapportera que les deux petites boules sont remontées dans la plus importante avant de repartir à vive allure. Aucune autre information ne sera recueillie sur ce phénomène pour lequel nous manquons de données.";"observation d'une boule dans le ciel.";O;1;;;;;;;;2010-04-02;;;0.50;0.50;;;;;;;0.28;0.28;C;C;1974-10-01768
253;"SOUGE-LE-GANELON (72) 02.11.1974";Sarthe;72;"(D) Département";1974;11;02;"Témoignage récent (2008) d'une observation ancienne.<br> Le samedi 2 novembre 1974 vers 20h30 un automobiliste et sa passagère sont surpris par le déplacement lent et silencieux d'un objet en forme de tube, noir avec trois zones de couleur rouge très foncé : deux se trouvaient aux extrémités et une au milieu. Le témoin sort de son véhicules et voit l'engin s'élèver à la verticale pour se déplacer ensuite très lentement au-dessus de la route puis des arbres avant de disparaitre. L'observation à duré plusieurs minutes avant que les témoins apeurés ne reprennent la route. Un seul témoignage est recueilli sur ce phénomène.<br> Ce cas d'observation de 1974 n'a été signalé au GEIPAN qu'en 2008, et par conséquent traité avec peu de priorité.<br> Cette observation nocturne d'un tube ""noir comme du velours"" limité par 3 disques lumineux doit être d'abord analysée avec les outils de la psychologie de la perception (illusion dite de contour ou de forme) : il est très fréquent qu'un observateur d'un ensemble de points lumineux se déplaçant ensemble reconstitue mentalement un volume limité par ces points lumineux. Dans ce cas, si la présence des 3 disques lumineux (nommés hublots par le témoin) ne fait pas de doute, l'existence du tube ne doit pas être considérée comme certaine.<br> De ce fait, le phénomène devient un ensemble de 3 disques lumineux se déplaçant lentement ensemble, ce qui peut correspondre à des objets lumineux portés par le vent, comme des lanternes thaïlandaises, très courantes de nos jours (2016), mais très peu répandues en France à cette époque. On note que l'observation a eu lieu un samedi soir à 20h30, propice à des événements festifs. C'est aussi le jour des morts ; certaines personnes honorent symboliquement leurs défunts par le lâcher de lanternes thaïlandaises.<br> Bien que cette hypothèse soit plausible, le GEIPAN ne peut la retenir, d'une part en l'absence de bulletin météo permettant de corréler le déplacement des lumières avec le vent local, d'autre part car les lanternes thaïlandaises n'étaient utilisées à l'époque que par les asiatiques ou par les touristes revenant de Thaïlande.<br> Faute de pouvoir faire ces vérifications, ou de trouver d'autres recoupements, le GEIPAN classe ce cas en catégorie C par manque d'information.";"Témoignage récent d'une observation ancienne. Observation du déplacement silencieux d'un ""tube"" noir avec trois zones de couleur rouge (deux aux extrémités et une au centre) : manque d'information.";O;;;;;;;;;2016-09-09;;;0.40;0.00;;;0.80;;0.70;;0.56;0.00;C;B;1974-11-02018
258;"MONTPELLIER (34) 19.01.1975";Hérault;34;"(D) Département";1975;01;19;"La presse relatant une observation du déplacement d'un objet inconnu faite par plusieurs personnes le 19 janvier 1975 à 18h45, la gendarmerie recherche des témoins. Deux personnes seulement souhaiteront témoigner mais uniquement sous couvert de l'anonymat.<br> L'objet a donné l'impression de tourner sur lui-même et de s'éloigner lentement vers l'horizon dans une trajectoire descendante avant de remonter rapidement et de disparaître.<br> Une autre observation du phénomène sera faite le 20 janvier 1975 à la même heure.<br> Malgré la cohérence des témoignages, ce cas est classé C par manque d'informations précises.";"Observation d'un objet tournant sur lui-même en se déplaçant.";O;2;;;;;;;;2011-11-02;;;0.50;0.50;;;;;;;0.28;0.28;C;C;1975-01-00204
261;"SAINT-JEAN-D'ANGELY (17) 15.02.1975";Charente-Maritime;17;"(D) Département";1975;02;--;"En septembre 1975 deux personnes rapportent une observation faite le 15 février 1975 vers 18h : un engin lumineux et circulaire (d'un mètre de diamètre) se déplace sans bruit à faible hauteur dans le ciel. Il se déplace d'Est en Ouest et disparaît derrière des arbres.<br> Aucun autre témoignage et aucune précision ne seront recueillis sur ce phénomène pour lequel nous manquons d'informations.";"Observation du déplacement silencieux d'un objet circulaire et lumineux au-dessus des arbres.";O;3;;;;;;;;2007-03-22;;;0.50;0.50;;;;;;;0.28;0.28;C;C;1975-02-00207
262;"NATIONAL (975) 17.02.1975";France;FR;"(N) National";1975;02;17;"Le 17 février 1975 entre 19h20 et 19h50 plusieurs témoins dans différents départements français constatent dans le ciel la présence inhabituelle d'un ou deux points  importants et particulièrement lumineux. Aucun bruit n'est entendu durant les longues observations faites par les témoins.<br> Ces témoins ont fait une observation astronomique de la conjonction des planètes Vénus et Jupiter particulièrement visible en cette période de l'année.";"Observations astronomiques d'une conjonction Vénus-Jupiter.";O;5;;;;;;;;2012-03-07;;;0.13;0.13;;;;;;;0.53;0.48;A;A;1975-02-00208
263;"CASTELNAU-DE-MONTMIRAL (81) 18.02.1975";Tarn;81;"(D) Département";1975;02;18;"Le 18 février 1975 vers minuit vingt, un témoin circulant sur un chemin vicinal est apeuré par un objet sphérique lumineux qui se déplace verticalement et oscille silencieusement dans le paysage. Aucun autre témoignage ne sera recueilli.<br> La vérification astronomique indique que la Lune est proche de son coucher à l'Ouest-Nord-Ouest (azimuth 290), en forme de demi-lune (Premier quartier). Le PV contient une copie du cadastre qui ne semble pas être orienté avec le Nord en haut ; la version actuelle du cadastre disponible par Geoportail (IGN) ne donne pas la même orientation ; avec la référence actuelle, le témoin observe aussi le phénomène à l'Ouest-Nord-Ouest avec un azimuth proche de 287 (voir carte ci-jointe), c'est-à-dire la direction de la Lune : une confusion avec la Lune, peut-être partiellement masquée pour apparaître à peu près sphérique, est envisageable.<br>  La mauvaise estimation de distance et de taille est très fréquente dans les observations de PAN, surtout pour les astres visibles proches de l'horizon. Néanmoins, avec cette hypothèse, il est difficile d'expliquer les mouvements de va-et vient du phénomène décrits par le témoin ; on peut à la rigueur envisager que des nuages bas aient pu masquer partiellement le demi-disque lunaire.<br> Comme le témoin ne mentionne pas la Lune alors qu'elle était dans la direction de son observation, il est fort probable qu'elle a joué un rôle dans l'observation.<br> En conclusion, faute de pouvoir affiner avec le témoin les déplacements apparents du phénomène, et de vérifier les conditions atmosphériques locales, le GEIPAN classe ce cas ""C"" comme phénomène non identifiable faute de données précises.";"Observation de déplacements verticaux d'un phénomène lumineux : manque d'informations.";O;1;;;;;;;;2013-06-03;;;0.50;0.50;;;;;;;0.28;0.28;C;C;1975-02-00209
264;"VERNOUX-EN-VIVARAIS (07) 25.02.1975";Ardèche;07;"(D) Département";1975;02;25;"Deux témoins observent, plusieurs soirs de suite et dans un ciel dégagé, un phénomène scintillant de forme circulaire. Certaines observations sont faites avec une lunette. <br> Une vérification astronomique permet de constater qu'à partir du 17 février 1975 une conjonction Jupiter-Vénus pouvait être observée. Ces astres s'éloignaient progressivement l'un de l'autre. La scintillation produit le reste de l'effet observé à la lunette : mouvement apparents, changements de couleurs etc<br> Ces témoins ont fait une méprise astronomique : le cas est classé A.";"Observations successives d'un phénomène scintillant : méprise astronomique.";O;2;;;;;;;;2013-06-03;;;0.13;0.13;;;;;;;0.53;0.48;A;A;1975-02-00210
319;"JEUMONT (59) 26.09.1975";Nord;59;"(D) Département";1975;09;26;"Suite à un article de presse, la gendarmerie enquête le 1er octobre 1975 sur l'observation par plusieurs témoins d'un grand phénomène orangé aperçu au loin dans le ciel des communes de Elesnes-Assevent-Boussois et Vieux-Reng le vendredi 26 septembre 1975.<br> L'enquête de gendarmerie retrouvera deux personnes aux témoignages contradictoires. Les photographies prises par un des témoins et adressées à la presse se révèleront  négatives.<br> Ces personnes ont probablement observé un phénomène lié à la région métallurgique de Charleroi en Belgique qui se trouve sur la trajectoire indiquée par les témoins.<br> Ce cas est classé B.";"Observations d'un phénomène lumineux orangé dans le ciel en direction de la Belgique.";O;3;;;;;;;;2012-12-19;;;0.38;0.13;;;;;;;0.65;0.35;B;B;1975-09-00262
338;"SAINS-RICHAUMONT (02) 01.01.1976";Aisne;02;"(D) Département";1976;01;01;"Le 1 janvier  1976 vers 19h45 plusieurs personnes dans un transport en commun observent le passage dans le ciel d'un phénomène lumineux.<br> Dans la nuit noire, une forme circulaire baignée dans une vive lueur traverse rapidement le ciel selon une trajectoire NE-SO. Aucun bruit n'est entendu lors du passage rapide de ce phénomène pour lequel nous manquons d'information.";"Observation du déplacement d'un phénomène lumineux.";O;3;;;;;;;;2010-11-15;;;0.50;0.50;;;;;;;0.28;0.28;C;C;1976-01-00278
339;"DOMENE (38) --.01.1976";Isère;38;"(D) Département";1976;01;05;"Suite à un article paru dans la presse locale (non présent dans les archives GEIPAN), plusieurs personnes témoignent en gendarmerie de leurs observations faites courant janvier 1976 (la date du 5 est indiquée pour la première observation.<br> Chaque témoin a observé à des jours, heures et lieux différents, un phénomène ou objet lumineux particulier. Un des témoins dit avoir vu un homme sortir d'un engin posé au sol et s'avancer vers lui. Effrayé, le témoin s'enfuira.il dit avoir fait le lendemain la même rencontre.<br>  La gendarmerie ne constatera aucune trace ou indice sur les lieux confirmant ou infirmant les déclarations succinctes des témoins.";"Divers témoignages d'observations d'objets lumineux suite à un article de presse: manque d'information.";O;5;;;;;;;;2017-02-23;;;0.50;0.50;;;;;;;0.28;0.28;C;C;1976-01-00279
340;"SAINT-PIERRE (974) 09.01.1976";"La Réunion";974;"(D) Département";1976;01;09;"Le 9 janvier 1976 à 7h 50 un automobiliste et sa femme observent les évolutions d'un objet brillant dans le ciel. Cet objet, de la forme d'un ballon avec le sommet tronqué, se déplace lentement et horizontalement selon une trajectoire mer-montagne en suivant les dénivellations du sol. Il disparaitra dans le paysage.<br> Aucun autre témoignage ne sera recueilli. D'après la description donnée, ces témoins ont probablement observé le déplacement d'un ballon au lever du soleil.";"Probable observation du déplacement d'un ballon.";O;1;;;;;;;;2010-11-16;;;0.38;0.13;;;;;;;0.65;0.35;B;B;1976-01-00280
341;"GRIMAUD (83) 10.01.1976";Var;83;"(D) Département";1976;01;10;"Le 10 janvier 1976 ente 7h50 et 8h50 deux personnes observent un objet sphérique très lumineux au-dessus de l'horizon. Les témoins constatent que cet objet reste stationnaire.  Il cessera graduellement d'être visible avec le lever du soleil.<br> La gendarmerie contactée  rapidement ne constatera aucun objet dans le ciel ce matin là ni le lendemain matin. Aucun autre témoignage ne sera recueilli.<br> D'après les descriptions recueillies, les témoins ont probablement observé un ballon-sonde.";"Probable observation d'un ballon-sonde au lever du jour.";O;2;;;;;;;;2010-11-16;;;0.38;0.13;;;;;;;0.65;0.35;B;B;1976-01-00281
342;"VALBONNAIS (38) 13.01.1976";Isère;38;"(D) Département";1976;01;13;"Le 13 janvier 1976 vers 23h un témoin observe aux jumelles le déplacement d'un objet de forme allongée et de couleur rouge. Aucun bruit n'est entendu et l'objet disparaît progressivement. Ce témoin fera la même observation le 15 janvier à la même heure.<br> La gendarmerie fera des observations semblables les 17 et 18 janvier entre 22h50 et 23h30 selon une trajectoire SSE-NNO.<br> Les descriptions recueillies s'apparentent aux descriptions d'observations de passage de satellite mais nous manquons de données pour valider cette hypothèse.";"Observations du lent passage d'un objet rouge en haute altitude.";O;2;;;;;;;;2011-02-17;;;0.50;0.50;;;;;;;0.28;0.28;C;C;1976-01-00282
343;"NEUVILLE-SAINT-VAAST (62) 17.01.1976";Pas-de-Calais;62;"(D) Département";1976;01;17;"Le 17 janvier 1976 vers 18h un cultivateur observe au-dessus des bois le passage d'un engin qu'il ne reconnaît pas. Celui-ci se déplace lentement d'Est en Ouest sans qu'aucun bruit ne soit entendu. Durant l'observation qui a duré une minute, le témoin constate l'allumage d'un projecteur puissant qui balaye la plaine. Le témoin partira chercher son fils mais à leur retour l'engin aura disparu.<br> Malgré l'enquête de gendarmerie, aucun autre témoignage ou informations ne seront recueillis.";"Observation du lent passage d'un engin inconnu.";O;1;;;;;;;;2010-11-17;;;0.50;0.50;;;;;;;0.28;0.28;C;C;1976-01-00283
344;"ESPALION (12) 19.01.1976";Aveyron;12;"(D) Département";1976;01;19;"Le  19 janvier 1976  vers 21h30 un témoin sortant de son domicile observe durant 3 minutes un engin en forme de disque de 2,50m de diamètre et de couleur orangé-phosphorescent. Il semble posé sur un chemin goudronné sur une ligne de crêtes. Le témoin a vu l'objet se déplacer à faible hauteur dans la vallée avant de disparaître derrière des bâtiments de ferme. Aucun bruit particulier n'a été entendu durant le déplacement de l'objet. Aucune trace particulière ne sera relevée par le témoin et son fils sur les lieux présumés de la présence de l'objet.<br> Deux autres personnes témoignerons avoir vu une lumière particulière ce soir là sur la route mais les témoignages restent tous très succincts. Le cas est classé C par manque d'information.";"Observation du déplacement d'un objet ciculaire lumineux.";O;2;;;;;;;;2011-01-06;;;0.50;0.50;;;;;;;0.28;0.28;C;C;1976-01-00284
345;"CHANTONAY (85) 24.01.1976";Vendée;85;"(D) Département";1976;01;24;"Le 24 janvier 1976 plusieurs personnes dont des gendarmes observent entre 19h40  et 22h 30 un objet lointain lumineux dans le ciel émettant des lueurs vertes et oranges . Cet objet se déplace sensiblement. Aucun bruit n'est entendu.<br> Tous ces témoins ont probablement fait une observation astronomique de l'étoile Sirius, particulièrement bien visible en cette période de l'année.";"Probable observation de l'étoile Sirius.";O;3;;;;;;;;2011-05-18;;;0.38;0.13;;;;;;;0.65;0.35;B;B;1976-01-00285
346;"CHAMBOURG-SUR-INDRE (37) 31.01.1976";Indre-et-Loire;37;"(D) Département";1976;01;31;"Le 13 janvier 1976 à 17h 50 un témoin s'émerveille de ce qu'il voit dans le ciel. Une forme lumineuse circulaire vert-émeraude ornée d'une auréole rouge cuivré passe au-dessus de lui. Sa trajectoire est rectiligne d'Ouest en Est. Aucun bruit n'est entendu. Elle disparaît très vite cachée par le paysage puis à l'horizon.<Br> Aucun autre témoignage ne sera recueilli sur ce phénomène pour lequel nous manquons d'information.";"Brève observation du passage fulgurant d'un objet vert-émeraude dans le ciel.";O;1;;;;;;;;2010-11-17;;;0.50;0.50;;;;;;;0.28;0.28;C;C;1976-01-02676
349;"LAUZET-UBAYE (04) 03.02.1976";Alpes-de-Haute-Provence;04;"(D) Département";1976;02;03;"Le 3 février 1976 vers 19h30 plusieurs témoins observent dans le ciel une lueur couleur blanc-argenté. Après s'être élevée au-dessus de la colline la lueur disparait progressivement sur le versant caché. Ce phénomène a été précédé par un bruit similaire à celui fait par un avion supersonique.<br> La gendarmerie écartera l'hypothèse d'un incendie ou de la chute d'un corps, aucune trace au sol n'ayant été remarquée sur le secteur indiqué.<br> Le cas est classé C par manque d'information.";"Observation d'une lueur précédée d'un double ""bang"".";O;4;;;;;;;;2011-01-07;;;0.50;0.50;;;;;;;0.28;0.28;C;C;1976-02-00286
350;"CHATEAURENARD (13) 05.02.1976";Bouches-du-Rhône;13;"(D) Département";1976;02;05;"Le 5 février 1976 à 0h45 deux personnes observent, dans un ensemble lumineux, un engin volant stationnaire.  Les témoins le situe à 25 mètres de la maison et à 15 mètres du sol. Deux silhouettes sont aperçues dans l'appareil qui disparaitra à vitesse lente en direction du S-SE sans qu'aucun bruit ne soit entendu.<br> Aucun indice n'a été trouvé par la gendarmerie dans le secteur indiqué et aucun autre témoignage n'a été recueilli.";"Observation du vol d'un engin, aucun bruit.";O;2;;;;;;;;2011-02-16;;;0.50;0.50;;;;;;;0.28;0.28;C;C;1976-02-00287
351;"(DPT) VENDEE (85) 09.02.1976";Vendée;85;"(D) Département";1976;02;08;"Le 9 février 1976 à 2h05 un automobiliste et ses passagers sont intrigués puis apeurés par la présence d'une masse lumineuse dans le ciel légèrement couvert. Leur observation débute à la sortie de Luçon (85). Stationnant ensuite leur véhicule à la sortie de Beugne-L'Abbé (commune de Magnils-Reigniers (Les) (85)) mais restant à l'intérieur, les témoins observent durant 2 à 3 minutes le phénomène lumineux. Ils décrivent la forme comme deux assiettes creuses l'une sur l'autre d'une vingtaine de mètres de diamètre. D'abord stationnaire à hauteur d'arbre, cette masse prend ensuite lentement de l'altitude. Aucun bruit particulier n'est entendu durant l'observation. Les témoins reprennent alors la route en direction des Sables-d'Olonne (85) et peuvent encore visuellement suivre le phénomène et le voir disparaitre à l'Ouest.
<br>  La gendarmerie prévenue aussitôt ne constatera aucune trace dans la zone indiquée. Aucun autre témoignage concernant l'observation d'un phénomène particulier à cette heure ne sera recueilli.  Aucune perturbation électrique sur le réseau dans le secteur ne sera enregistrée par E.D.F.<br> Un autre témoin rapportera avoir vu, le dimanche 8 février 1976 à 20h, deux engins silencieux et insolites passer dans le ciel.<br>  Ce cas est consistant (3 témoins), la description du lieu d'observation et du PAN observé est précise. La sincérité et la crédibilité des témoins n'ont jamais été mis en doute.<br> Le phénomène décrit présente beaucoup de caractéristiques communes (durée d'observation, forme,couleur, taille.. ) avec un phénomène connu astronomique : la Lune.<br> De plus, la Lune était bien dans la zone de ciel observée alors que les témoins n'en font pas mention.<br> Ce n'est pas la perception visuelle des témoins qui est en cause mais l'interprétation que les témoins font de leur observation à travers leur ressenti (fatigue, inquiétude, peur et croyance au phénomène OVNI ).<br> Dans la classification actuelle du GEIPAN, ce cas expliqué d'étrangeté faible est classé comme PAN A, observation liée avec une méprise de la Lune.";"Observations d'une masse lumineuse en déplacement : observations astronomiques liées avec une méprise de la Lune.";O;4;;;;;;;;2012-03-05;;;0.13;0.13;;;;;;;0.53;0.48;A;A;1976-02-00288
352;"BILLOM (63) 17.02.1976";Puy-de-Dôme;63;"(D) Département";1976;02;17;"Le 27 février 1976 ( il y a une imprécision sur la date exacte dans le PV) vers 20h50, un automobiliste observe quelques secondes et à faible altitude, le déplacement très rapide du Nord au Sud, d'une sphère rouge très brillante. <br> Plusieurs personnes du secteur interrogées, affirmeront n'avoir rien remarqué de particulier ce soir là.  Ce cas est classé en C par manque d'informations.";"Observation rapide du déplacement d'une sphère rouge.";O;1;;;;;;;;2011-01-17;;;0.50;0.50;;;;;;;0.28;0.28;C;C;1976-02-00289
354;"CAPESTERRE-DE-MARIE-GALANTE (971) 24.03.1976";Guadeloupe;971;"(D) Département";1976;03;24;"Le 24 mars 1976 le gérant d'un restaurant avise la gendarmerie que deux sphères de couleur brillante et d'un diamètre approximatif d'un mètre viennent d'être découvertes sur la plage de la feuillère (ile de Marie-Galante, Guadeloupe).<br>  La gendarmerieconstate effectivement deux sphères enterrées dans le sable à la limite de la vague déferlante et partiellement couvertes par les eaux de mer. Elles sont distantes l'une de l'autre de 14 mètres. Un revètement métallique léger (environ 5 dizièmes de millimètre) recouvre les deux sphères : sur l'une d'elle le revètement semble avoir fondu laissant apparaître un métal plus dur et plus résistant ne se rayant pas avec la pointe d'un couteau.  Le lendemain à 6h30, les objets sont dégagés par la gendarmerie et il apparaît qu'il s'agit de deux demi-sphères appartenant au même engin et s'adaptant parfaitement l'une dans l'autre. Une inscription  H 476 AC est lisible sur l'une des demi-sphères.<br> Ces engins devaient être ramenés à la brigade pour nettoyage et identification éventuelle. Mais à 10h le même jour, le maire de Capesterre de Marie-Galante, malgré l'interdiction de la gendarmerie, fera enlever ces demi-sphères pour les exposer sur la place de la mairie.<br>  Ce cas n'est pas une observation de PAN. Il concerne le recueil de deux demi-sphères métalliques sur une plage . L'origine de ces demi-sphères pourraient peut-être être retrouvée en utilisant la nomenclature trouvée à l'intérieur d'une de ces demi-sphères.";"Observation de deux demi-sphères semi-enterrées sur une plage.";O;1;;;;;;;;2011-01-25;;;0.38;0.13;;;;;;;0.65;0.35;B;B;1976-03-00291
355;"THUIR (66) 25.03.1976";Pyrénées-Orientales;66;"(D) Département";1976;03;25;"Le 25 mars 1976 vers 14h30 un automobiliste et ses passagers observent dans le ciel un engin lumineux se déplaçant Est-Ouest. De grandes dimensions et de forme ovale surmonté d'un dôme, il reste dans leur champ de vision durant une minute avant de disparaître brusquement.<br> Aucun autre témoignage ne sera recueilli sur ce phénomène.<br> Ce cas est classé D1 (voir compte rendu d'enquête).";"Observation du passage rapide d'un engin volant lumineux de forme ovale surmonté d'un dôme.";O;2;;;;;;;;2012-03-15;;;0.63;0.13;;;;;;;0.78;0.23;D1;D1;1976-03-00292
356;"SAINT-DENIS (974) 27.03.1976";"La Réunion";974;"(D) Département";1976;03;27;"Le 27 mars 1976 entre 6h 30 et 6h 55 un militaire à bord de son véhicule tombe subitement en panne. Tous les voyants lumineux sont éteints. Son attention est alors attirée par une tâche de brouillard grisâtre avec un reflet métallique. Elle se situe vers la rivière à 15 ou 20 mètres du véhicule. Passant la tête par la fenètre il suit du regard le phénomène qui s'élève et disparaît à grande vitesse au-dessus des bâtiments dans une  direction Sud Sud-Ouest. Très étonné par ce qu'il vient de voir, il constate alors que son tableau de bord est allumé et relance facilement le moteur pour repartir.<br>  Aucun autre témoignage ne sera recueilli sur ce phénoène pour lequel nous manquons d'informations.";"Observation d'un phénomène sous la forme d'une tâche de brouillard.";O;1;;;;;;;;2011-01-25;;;0.50;0.50;;;;;;;0.28;0.28;C;C;1976-03-00293
357;"ROANNE (42) 29.03.1976";Loire;42;"(D) Département";1976;03;29;"Le 29 mars 1976 à 17h10 un témoin observe et photographie un objet circulaire de couleur orangé volant dans le ciel. L'objet se déplace lentement, s'immobilise un instant avant de repartir à grande vitesse selon une trajectoire N-S. Aucun bruit n'est entendu lors du déplacement de l'objet.<br> Aucun autre témoignage ne sera recueilli sur ce phénomène pour lequel nous manquons d'informations.";"Observation du déplacement silencieux d'un objet circulaire orangé.";O;1;;;;;;;;2011-01-25;;;0.50;0.50;;;;;;;0.28;0.28;C;C;1976-03-00294
359;"SAINT-PAUL (974) 01.04.1976";"La Réunion";974;"(D) Département";1976;04;01;"Le 1er avril 1976 aux environ de 17h20 plusieurs personnes observent dans le ciel une trainée blanche qui semble plonger  dans la mer. Ils voient ensuite une masse de fumée grise qui persiste sur l'eau durant un quart d'heure avant de disparaître complètement.<br> D'après l'enquête de gendarmerie aucun aéronef provenant le l'aéroport n'était en vol après 17h. Elle ne recueillera aucun objet ou débris quelconque sur le littoral.<br> Il est probable que les témoins aient assisté à la chute en mer d'un objet mais nous manquons d'informations pour identifier ce dernier.";"Probable observation de la chute d'un objet en mer.";O;4;;;;;;;;2011-01-25;;;0.38;0.13;;;;;;;0.65;0.35;B;B;1976-04-00296
360;"PONT-SAINTE-MAXENCE (60) 05.04.1976";Oise;60;"(D) Département";1976;04;05;"Le 8 avril 1976, la gendarmerie est alertée par la presse que le 5 avril 1976 vers 21h une personne a observé un OVNI prés d'un terrain de sport. Au lieu précis de l'observation plusieurs traces d'herbes brulées sont constatées et la souche calcinée d'un arbre est retrouvée.<br> Lors de sa déposition, le témoin dit avoir aperçu une lumière passant alternativement du blanc au rouge après un jet de fumée. Il précise les dimensions d'un objet de couleur aluminium qui surplombait le ruisseau. Le témoin a entendu un léger sifflement. L'observation a duré 5 minutes.<br> L'enquête de gendarmerie déterminera que les traces ont été occasionnées par des pétards allumés par plusieurs personnes. Le témoin reconnaîtra qu'il n'a jamais vu d'engin et que les journalistes lui auraient indiqué les dimensions de l'objet qu'il a cru apercevoir.";"Explosion de pétard produisant de la fumée et des traces au sol.";O;2;;;;;;;;2007-03-22;;;0.13;0.13;;;;;;;0.53;0.48;A;A;1976-04-00297
361;"LAROQUE-TIMBAUT (47) 07.04.1976";Lot-et-Garonne;47;"(D) Département";1976;04;07;"Un témoin rapporte, le 19 juin 1976, ses trois observations de phénomènes lumineux  entre avril 1976 et juin 1976.<br> Le 7 avril 1976 vers 23h30, il remarque un objet lumineux dans le ciel de la forme d'un cigare : ce dernier se pose sur le chemin menant au domicile du témoin et produit une forte lumière dirigée dans une seule direction.<br> Au cours du mois de mai 1976, vers la même heure et pratiquement au même endroit, il remarque deux engins très lumineux  dont un semble posé sur le chemin proche du domicile. Réveillant immédiatement son frère et ses parents, ces personnes observent durant 1h30 environ ces phénomènes lumineux sans pouvoir déterminer une forme précise. Aucun bruit n'est entendu. Tout disparait brusquement. Un des témoins retrouvera à l'endroit présumé de l'atterissage des traces sur le goudron de la chaussée.<br> Le vendredi 16 juin, toujours à la même heure, le témoin remarque une forte clarté sur un terrain à proximité de son habitation. Suite à toutes ces observations il décide de témoigner.<br> Lors de l'enquête de gendarmerie, aucune constatation ne pourra être faite concernant les deux premières observations en raison de la déclaration tardive du témoin. Pour la troisème observation, le propriétaire du terrain affirmera avoir allumé, ce soir là, dans son champ un feu de bois pour faire des grillades.";"Observations successives de phénomènes lumineux.";O;3;;;;;;;;2007-03-22;;;0.50;0.50;;;;;;;0.28;0.28;C;C;1976-04-00298
362;"CRIEL-SUR-MER (76) 15.04.1976";Seine-Maritime;76;"(D) Département";1976;04;15;"Le 15 avril 1976 entre 21h et 21h30 un témoin observe, durant environ deux minutes, un phénomène lumineux orangé. Celui-ci reste stationnaire au-dessus du clocher d'une église située à deux kilomètres. Aucun bruit particulier n'est entendu. Il disparaît subitement.<br> Aucun autre témoignage n'a été recueilli sur ce phénomène pour lequel nous manquons d'informations.";"Observation d'un phénomène lumineux orangé stationnaire. Disparition subite.";O;1;;;;;;;;2007-03-22;;;0.50;0.50;;;;;;;0.28;0.28;C;C;1976-04-00299
363;"EYMET (24) 24.04.1976";Dordogne;24;"(D) Département";1976;04;24;"Alertée par des articles de journaux dans la presse locale, la gendarmerie enquête sur un phénomène particulier observé par plusieurs personnes.<br> Le 24 avril 1976 vers 16h un couple dans la campagne remarque le bruit inhabituel d'un fort déplacement d'air suivi de l'apparition à 300m d'eux de deux disques lumineux verts. Ces objets plongent soudain vers le sol très rapidement avant de disparaître. Il se produit une violente bourrasque suivie d'une chute de neige.<br> Le même phénomène se reproduira deux autres fois. Dans les environs d'autres personnes constateront au même moment des perturbations sur leurs postes de télévision.<br> Les renseignements de la brigade locale permettent de penser qu'il s'agit probablement d'un phénomène électromagnétique provoqué par un évènement météorologique local.";"Probable observation d'un phénomène électromagnétique dû à un évènement climatique.";O;1;;;;;;;;2011-02-01;;;0.38;0.13;;;;;;;0.65;0.35;B;B;1976-04-00300
366;"MATHA (17) 24.05.1976";Charente-Maritime;17;"(D) Département";1976;05;24;"Le 24 mai 1976 deux témoins observent  dans le ciel les aller-retours d'un objet brillant de forme allongée ne laissant aucune trace dans le ciel. Aucun bruit ne sera entendu durant l'observation qui durera deux ou trois minutes.<br> Ces témoins ont probablement observé les évolutions d'un aéronef en exercice mais le témoignage reste très imprécis.";"Probable observation d'évolutions d'un aéronef.";O;2;;;;;;;;2011-02-07;;;0.38;0.13;;;;;;;0.65;0.35;B;B;1976-05-00303
367;"MIRAMONT-D'ASTARAC (32) 19.05.1976";Gers;32;"(D) Département";1976;05;19;"Dans la nuit du 18 au 19 mai 1976 vers 2h du matin un témoin observe le passage N-E de deux boules coniques et rouges. Aucune trace au sol n'a été constatée aux alentours de la maison du témoin unique du phénomène.<br> Ce cas est classé C par manque d'informations.";"Observation du passage de deux boules lumineuses rouges.";O;1;;;;;;;;2011-04-12;;;0.50;0.50;;;;;;;0.28;0.28;C;C;1976-07-02733
368;"PROVENCY (89) 06.06.1976";Yonne;89;"(D) Département";1976;06;06;"Le 6 juin 1976 vers 23h35 un automobiliste observe durant quelques secondes la chute à vitesse constante d'un phénomène lumineux et son explosion. Aucun bruit n'est entendu. Pensant à un accident d'aéronef, ce témoin informe la gendarmerie.<br> L'enquête démontrera qu'aucun appareil n'a été signalé disparu. Aucun autre témoignage ne sera recueilli sur ce phénomène<br> L'automobiliste a probablement été témoin d'une rentrée atmosphérique.";"Probable observation d'une rentrée atmosphèrique.";O;1;;;;;;;;2011-02-15;;;0.38;0.13;;;;;;;0.65;0.35;B;B;1976-06-00304
370;"DIEPPE (76) 18.06.1976";Seine-Maritime;76;"(D) Département";1976;06;18;"Le 18 juin 1976 vers 21h30 deux personnes observent dans le ciel un engin lumineux qui les intrigue : il est en forme de cigare et d'une grande longueur. Cet engin vole à basse altitude et à une vitesse régulière selon une trajecoire NE-SO. Aucun bruit ne sera entendu.<br> Un seul témoignage sera recueilli sur ce phénomène pour lequel nous manquons d'informations.";"Observation d'un engin en forme de cigare.";O;1;;;;;;;;2011-02-15;;;0.50;0.50;;;;;;;0.28;0.28;C;C;1976-06-00306
372;"BISCHWILLER (67) 22.06.1976";Bas-Rhin;67;"(D) Département";1976;06;22;"Le 22 juin 1976 vers 22h 15  plusieurs personnes en voiture observent les déplacements rapides et silencieux, très haut dans le ciel, d'une lueur rouge qui les intrigue. Ce phénomène stationnaire au-dessus du terminal prétrolier serait passé ensuite au-dessus de la raffinerie de Herrlisheim-Drusenheim puis serait parti en direction du Rhin vers l'Allemagne. Un des témoin prendra plusieurs photographies mais la pellicule s'avèrera inexploitable.<br> Deux employés de la raffinerie ont fait savoir qu'ils avaient vu depuis leur domicile un objet brillant dans la direction Est-Nord-Est indiquée par le premier témoin mais aucun des gardiens de service à la raffinerie n'ont aperçu d'objet au-dessus de l'établissement. <br> Aucune autre information ne sera recueillie sur ce phénomène pour lequel nous manquons d'informations.";"Observation du passage à haute altitude d'une lueur rouge.";O;4;;;;;;;;2011-03-02;;;0.50;0.50;;;;;;;0.28;0.28;C;C;1976-06-00308
374;"JONCY (71) 25.06.1976";Saône-et-Loire;71;"(D) Département";1976;06;25;"Un témoin rapporte ses observations successives de nuit de phénomènes lumineux accompagnés de bruit de moteur.<br> L'enquête de gendarmerie concluera au passage d'un véhicule à proximité de la ferme du témoin.";"Observations successives de phénomènes lumineux correspondant aux phares d'un véhicule.";O;6;;;;;;;;2011-03-03;;;0.13;0.13;;;;;;;0.53;0.48;A;A;1976-06-00310
375;"PONT-DU-CASSE (47) 06.06.1976";Lot-et-Garonne;47;"(D) Département";1976;06;06;"Le 6 juin 1976 entre 5h40 et 7h20 un témoin observe le déplacement à haute altitude d'un objet lumineux ovoide. L'objet semble composé de deux parties lumineuses de grosseurs inégales mais comme reliées entre elles. Il se déplace lentement suivant une direction Est-Ouest.<br> Aucun autre témoignage ne sera recueilli.<br> Cette personne a probablement été témoin du passage d'un ballon stratosphérique.";"Probable observation d'un ballon stratosphérique et de sa chaine de vol.";O;1;;;;;;;;2011-02-15;;;0.38;0.13;;;;;;;0.65;0.35;B;B;1976-06-02710
376;"CHOLET (49) 02.07.1976";Maine-et-Loire;49;"(D) Département";1976;07;02;"Le 2 juillet 1976 vers 22h15 un couple observe quelques secondes et à une distance de 500m, le passage Ouest-Nord-Est de trois boules lumineuses. Elles disparaissent rapidement à l'horizon.<br> Aucune autre information ne sera recueillie sur ce phénomène pour lequel nous manquons d'information.";"Observation du passage de trois boules lumineuses.";O;2;;;;;;;;2011-03-07;;;0.50;0.50;;;;;;;0.28;0.28;C;C;1976-07-00311
378;"AVALLON (89) 07.07.1976";Yonne;89;"(D) Département";1976;07;07;"Un témoin et son petit fils observent vers 19h20 et durant une minute le passage N-S d'un objet sphérique brillant de couleur verte.<br> Aucun autre témoignage ne sera recueilli sur ce phénomène pour lequel nous manquons d'informations.";"Observation du passage d'une boule lumineuse verte.";O;1;;;;;;;;2011-04-01;;;0.50;0.50;;;;;;;0.28;0.28;C;C;1976-07-00313
380;"ENTREVAUX (04) 09.07.1976";Alpes-de-Haute-Provence;04;"(D) Département";1976;07;09;"Le 9 juillet 1976 un garde chasse est averti par un berger de la présence de traces au sol que ce dernier a constaté le 25 juin 1976. <br> Le 26 juillet 1976,l'enquête de gendarmerie confirmera la présence de traces circulaires dans la zone déterminée  mais l'origine de ces traces anciennes ne pourra être définie.";"Observation en montagne de traces au sol circulaires.";O;2;;;;;;;;2011-04-05;;;0.50;0.50;;;;;;;0.28;0.28;C;C;1976-07-00315
381;"EPINAL (88) 10.07.1976";Vosges;88;"(D) Département";1976;07;10;"Le 10 juillet 1976 vers 4h30 un automobiliste constate la présence à faible hauteur au-dessus de la route d'un engin qui le précède et qu'il ne reconnaît pas.<br> Le témoin décrit un objet d'une longueur de 4 à 5 mètres et d'un diamètre de 1 mètre environ. De couleur rouge brillant il porte une bande noire sur toute sa longueur. La partie supérieure semble surmontée d'une cabine avec une lumière clignotante. L'automobiliste s'arrête pour regarder l'appareil qui semble faire marche arrière comme pour venir vers le témoin. Ce dernier apeuré reprend immédiatement sa route.<br> Aucune autre information ne sera recueillie par la gendarmerie.";"Observation d'un engin volant suivant la route.";O;1;;;;;;;;2011-04-04;;;0.50;0.50;;;;;;;0.28;0.28;C;C;1976-07-00316
382;"SAINT-GEOIRE-EN-VALDAINE (38) 11.07.1976";Isère;38;"(D) Département";1976;07;11;"Le 11 juillet 1976 vers 22h05 deux personnes constatent la présence d'un phénomène lumineux immobile de forme circulaire et de couleur rouge vif. L'observation lointaine ( 2km environ) ne permet pas de distinguer des détails. Pendant que l'un des témoin cherche ses jumelles le phénomène se déplace vers l'Ouest puis disparaît.<br> Aucun autre témoignage n'a été recueillli.<br> L'enquête de gendarmerie qui s'est rendue sur les lieux avec les témoins a detérminé la présence d' un chemin de terre long de 50m qui rejoint à l'Ouest un chemin vicinal non classé et inconnu des témoins. <br> L'hypothèse du passage d'un véhicule est envisagée. Mais compte tenu de la distance d'observation et du peu d'éléments de détails donnés, aucun élément ne permet d''indentifier le phénomène.";"Observation du déplacement d'un phénomène lumineux manque d'informations.";O;2;;;;;;;;2007-03-22;;;0.50;0.50;;;;;;;0.28;0.28;C;C;1976-07-00317
383;"VOID-VACON (55) 13.07.1976";Meuse;55;"(D) Département";1976;07;13;"Le 13 juillet 1976 à 5h45, deux témoins finissant leur travail de nuit dans une carrière observent soudainement dans le ciel l'apparition d'une sphère blanche stationnaire qui grossit progressivement. L'observation dure 4 à 5 secondes puis le phénomène disparaît. Aucun bruit n'est entendu. <br> D'après l'enquête de gendarmerie, les observateurs se trouvaient dans l'endroit le plus élevé de la région et ils avaient un champ de vision très étendu. Le temps était ensoleillé et il n'y avait pas de nuages. Le phénomène se trouvait à la verticale de la côte de Vaucouleurs à une distance d'environ 8km.<br> A cette date et à cette heure, il est probable que ces personnes aient été témoin d'un phénomène de réflexion du soleil à peine levé.";"Probable observation d'un phénomène de réfexion du soleil levant.";O;2;;;;;;;;2011-04-05;;;0.38;0.13;;;;;;;0.65;0.35;B;B;1976-07-00318
384;"REVIN (08) 15.07.1976";Ardennes;08;"(D) Département";1976;07;15;"Le 15 juillet 1976 vers minuit, plusieurs personnes observent les évolutions d'un phénomène lumineux de plusieurs couleurs sur le mont ""Malgré Tout"" où est installé un relais T.V.. La vitesse d'évolution du phénomène est rapide mais aucun bruit n'est entendu durant les 20 mintutes d'observation.<br> Malgré une enquête de gendarmerie et des observations faites aux jumelles par des témoins, nous manquons d'informations et de précisions sur ce phénomène observé.";"Observation du déplacement d'un phénomène lumineux à la verticale d'un relais de TV.";O;4;;;;;;;;2011-04-05;;;0.50;0.50;;;;;;;0.28;0.28;C;C;1976-07-00319
385;"COLOMBES (92) 16.07.1976";Hauts-de-Seine;92;"(D) Département";1976;07;16;"Dans la nuit du 16 juillet 1976 un témoin aperçoit à 4h30  depuis une fenêtre de son domicile le passage d'un phénomène lumineux sans qu'il puisse clairement voir de forme et entendre de bruit particulier. Il définit son observation comme tout d'abord un point lumineux s'approchant et devenant une rampe de lumières pour enfin et vu de l'arrière constater deux points lumineux de couleur verte et rouge.<br> Aucun autre témoignage n'a été recueillisur ce phénomène qui est probablement une observation d'un aéronef.";"Probable observation du passage d'un aéronef.";O;1;;;;;;;;2011-04-05;;;0.50;0.50;;;;;;;0.28;0.28;C;C;1976-07-00320
386;"CHATEAUNEUF-VAL-DE-BARGIS (58) 19.07.1976";Nièvre;58;"(D) Département";1976;07;19;"Le 19 juillet 1976 vers 3h du matin un automobiliste observe quelques secondes un objet stationnaire de couleur verte et de luminosité intense. La distance d'observation est approximativement entre 300 et 400 mètres. La forme de l'objet lui fait penser à un chapeau melon. Aucun bruit particulier n'est entendu par le témoin lorsqu'à l'arrière de l'objet une couleur rougeâtre apparaît et qu'il disparait rapidement vers le N-E.<br> Aucun autre témoignage n'a été recueilli sur ce phénomène pour lequel nous manquons d'informations.";"Observation d'un phénomène stationnaire lumineux vert et disparition vers le N-E.";O;1;;;;;;;;2011-04-06;;;0.50;0.50;;;;;;;0.28;0.28;C;C;1976-07-00321
388;"CONDOM (32) 23.07.1976";Gers;32;"(D) Département";1976;07;23;"Trois personne d'un même secteur vont observer un phénomène lumineux dans la nuit du 23 eu 24 juillet 1976 aux alentours de minuit. Une vive lumière blanche et bleutée se déplace sans bruit particulier à basse altitude. Elle disparaitra en direction du Sud-Est. <br> L'enquête de gendarmerie notamment auprés d'un témoin agriculteur ne permettra pas de retrouver une trace et indice laissant supposer le passage à basse altitude d'un appareil ou objet quelconque. La végétation sur la zone de passage indiquée par le témoin principal est restée intacte et aucune anomalie provenant d'une source de chaleur ou d'un déplacement d'air ne sera constatée. <br> Les descriptions restent insuffisantes et ce phénomène est classé C par manque d'information.";"Observations du déplacement d'un phénomène lumineux.";O;3;;;;;;;;2011-04-06;;;0.50;0.50;;;;;;;0.28;0.28;C;C;1976-07-00323
390;"LAROQUE-TIMBAUT (47) 29.07.1976";Lot-et-Garonne;47;"(D) Département";1976;07;26;"Entre le 26 juillet et le 29 juillet 1976 à des heures différentes plusieurs témoins observent des phénomènes lumieux et électriques qui les intigue. Un des témoins obsservera le passage rapide d'une boule verte clignotante dans le ciel  et laissant une trainée rouge.des perturbations sur la réception TV et un incendie de compteur électrique sont constatés ces jours là.<br> L'enquête de gendarmerie rapportera plusieurs témoignages  d'observations différentes.<br> Ce cas est classé C par manque de cohérence et d'information des témoignages";"Observations de différents phénomènes lumineux.";O;3;;;;;;;;2011-04-08;;;0.50;0.50;;;;;;;0.28;0.28;C;C;1976-07-00325
391;"CHIRENS (38) 30.07.1976";Isère;38;"(D) Département";1976;07;30;"Le 30 juillet 1976 vers 14h51 un témoin est intrigué par un objet sphérique et de couleur métallique qui est stationnaire dans le ciel. Aucun bruit particulier n'est entendu durant l'observation qui dure 3 minutes avant que l'objet ne disparaisse vers l'Est.<br> Aucun autre témoignage ne sera recueilli sur ce phénomène pour lequel nous manquons d'informations.";"Observation d'un objet sphérique en vol stationnaire puis disparition vers l'Est.";O;1;;;;;;;;2011-04-11;;;0.50;0.50;;;;;;;0.28;0.28;C;C;1976-07-00326
395;"ANGLEMONT (88) 03.08.1976";Vosges;88;"(D) Département";1976;08;03;"Le 03 aout 1976 vers 11h45 un agriculteur constate dans le ciel le lent déplacement d'un appareil de forme cylindrique et de couleur aluminium qui brille constamment. L'observation dure 30 minutes avant que l'objet ne disparaisse à l'horizon.<br>  Lors de l'enquête de voisinage, plusieurs personnes ont reconnu dans la description faite de l'objet, un ballon publicitaire pour un fabricant de pneumatiques vu plusieurs fois dans la même journée.";"Observation d'un ballon publicitaire.";O;1;;;;;;;;2018-11-09;;;0.13;0.13;;;;;;;0.53;0.48;A;A;1976-08-00329
401;"SAINT-GENIES-DES-MOURGUES (34) 23.08.1976";Hérault;34;"(D) Département";1976;08;23;"Le 23 aout 1976 vers 23h 30 un cyclomotoriste constate dans le ciel la présence d'un objet rouge vif lumineux qui se déplace en direction du S-O. Arrivé à son domicile et intrigué par un bruit de moteur électrique très aigu, il sort de chez lui et voit à environ 15 m le passage en direction du N-O d'un objet lumineux de forme ovoide avec des lumières blanches et rouges.Le témoin constate que l'objet, après avoir parcouru 80m, se stabilise puis s'élève rapidement à une vitesse très importante avant de disparaître .<br>  Lors de l'enquête de gendarmerie aucun autre témoignage de ce phénomène ce soir là ne sera rapporté. Cependant le témoin déclare que finissant tardivement son travail , il a plusieurs fois été témoin de déplacements de sources lumineuses. De plus a presse locale fait état d' observations diverses en juin et août 1976 qui pourrait s'apparenter à ce phénomène.<br> L'observation présente un faible degré d'étrangeté. Une forte proportion des caractéristiques décrites par le témoin correspondent à celles de phénomènes connus : ici un hélicoptère. L'observation est explicable et l'interprétation proposée est simplement vraisemblable. Le cas est peu étrange et ne mérite pas une enquête approfondie ( identifier le vol d'hélicoptère impliqué serait d'ailleurs difficile pour un cas aussi ancien ). Le témoignage est unique et la consistance du cas est faible. Du fait de la forte ressemblance avec l'aspect d'un hélicoptère, le cas est classé « B » observation probable d'un hélicoptère.";"Probable observation du passage d'un aéronef de type hélicoptère.";O;1;;;;;;;;2012-04-06;;;0.38;0.13;;;;;;;0.65;0.35;B;B;1976-08-00335
402;"FORBACH (57) 27.08.1976";Moselle;57;"(D) Département";1976;08;27;"Le 27 aout 1976 vers 21h16 un témoin astronome amateur remarque encore une fois dans le ciel nuageux un objet qui l'intrigue. Il fait constater à une autre personne le passage d'un appareil circulaire diffusant à l'arrière une lumière sensiblement orangée.<br> Lors de l'enquête le témoin fournit un descriptif précis , un shéma de l'objet observé et la trajectoire.<br> Aucun autre témoignage ne sera recueilli. Il est probable que ce témoin ait fait successivement des observaions d'un aéronef.";"Probable observations du passage d'un aéronef.";O;1;;;;;;;;2011-04-13;;;0.38;0.13;;;;;;;0.65;0.35;B;B;1976-08-00336
403;"PLANES (66) 28.08.1976";Pyrénées-Orientales;66;"(D) Département";1976;08;28;"Le 28 aôut 1976 vers 4h30 un témoin observe dans le ciel couvert le passage d'un phénomène lumineux. Une boule rouge vif en son centre passe rapidement et silencieusement au-dessus de lui et disparaît cachée par le paysage. Le chien qui accompagne le témoin est effrayé. Cette personne voit par la suite une lueur blanche en forme de demi cercle et immobile derrière un rideau d'arbres dans la direction de disparition du phénomène.<br> Aucune trace ne sera trouvée sur les lieux et aucun autre témoignage ne sera rapporté sur ce phénomène pour lequel nous manquons d'informations.";"Observation du passage d'un phénomène lumineux dans le ciel.";O;1;;;;;;;;2011-04-13;;;0.50;0.50;;;;;;;0.28;0.28;C;C;1976-08-00337
406;"TARBES (65) 05.09.1976";Hautes-Pyrénées;65;"(D) Département";1976;09;05;"Le 5 septembre 1976 vers 7h22 une personne observe depuis le 15eme étage de son immeuble un phénomène lumineux dans le ciel qui l'intrigue. Durant une dizaine de minutes le témoin observera en direction du Sud-Est la présence au-dessus des collines de Sarrouilles (65) d'une ligne lumineuse rouge avant que celle-ci ne disparaisse vers l'Est.<br> Aucun autre témoignage ne sera recueilli sur ce phénomène.<br> L'enquête de gendarmerie fera apparaître que l'observation faite le 5 septembre est probablement en relation directe avec le passage d'un ballon sonde resté en l'air après le largage de son chargement dans un champ à Soues. Les vents étaient nuls le 4 et 5 septembre 1976 et les deux communes sont sensiblement situées dans la même direction au Sud-est de Tarbes.";"Probable observation d'un ballon sonde.";O;1;;;;;;;;2011-05-02;;;0.38;0.13;;;;;;;0.65;0.35;B;B;1976-09-00338
409;"MAGNE (86) 10.09.1976";Vienne;86;"(D) Département";1976;09;10;"Le 10 septembre 1976 à 23h15 un témoin observe le passage NO-E d'un appareil de forme ronde et de la grosseur d'un hélicoptère qui émet sucessivement et rapidement trois couleurs jaune, vert et rouge. Aucun bruit n'est entendu durant l'observation qui dure 45 secondes. La personne témoignera tardivement à la gendarmerie.<br> Aucun autre témoignage ne sera recueuilli malgré un article paru dans la presse à ce sujet. Le témoin a probablement fait une observation du passage d'un aéronef.";"Probable observation d'un aéronef.";O;1;;;;;;;;2011-05-02;;;0.38;0.13;;;;;;;0.65;0.35;B;B;1976-09-00341
410;"SAINT-VERAND (38) 12.09.1976";Isère;38;"(D) Département";1976;09;12;"Le 12 septembre 1976 vers 22h50 une famille observe un phénomène lumineux à proximité de leur domicile. Sur le pas de la porte, un des témoin sent une chaleur intense autour de son domicile et son attention est attirée par une forme elliptique d'un blanc incandescent avec un halo lumineux. Ce phénomène qui se trouve derrière des arbres dure environ deux minutes et descend vers le sol. Il disparait brusquement. Quelques instants auparavant une perturbation avait été constatée sur l'écran de télévision et un animal avait été brusquement effrayé.<br>  Le lendemain la gendarmerie ne constatera aucune trace au sol dans le secteur de l'observation. Un voisin témoignera avoir entendu vers 23h comme un coup de tonnerre et constaté une panne de lumière quelques minutes mais il n'a rien vu du phénomène.<br> Ce cas d'observation a longtemps été classé C par manque d'information. Il a été soumis dernièrement à un expert des phénomènes de foudre. Les conditions atmosphériques au moment de l'observation, la description du comportement du phénomène sont compatibles avec l'hypothèse d'une manisfestation de l'électricité atmosphérique appelée foudre en boule ou foudre globulaire.<br> Ce cas est classé B : observation probable d'un phénomène de foudre globulaire.<br>";"Observation d'un phénomène lumineux et sensation de chaleur intense par temps orageux. Brusque disparition. Observation probable d'un phénomène de foudre globulaire.";O;3;;;;;;;;2015-06-15;;;0.38;0.13;;;;;;;0.65;0.35;B;B;1976-09-00342
412;"HAUTE-GARONNE (31) 17.09.1976";Haute-Garonne;31;"(D) Département";1976;09;17;"Le 17 septembre 1976 entre 20h15 et 20h30 plusieurs personnes observent le déplacement silencieux d'un phénomène lumineux de forme sphérique. Certains témoins constatent des changements de couleurs .<br> L'enquête de gendarmerie déterminera rapidement qu'il s'agit du passage d'un ballon stratosphérique du Centre National d'Etudes Spatiales lâché à Air-Sur-Adour (40)  pour éffectuer des mesures à haute altitude. Les changements de couleurs sont produits par le phénomène de diffraction de la lumière du soleil couchan alors que les mouvements atmosphériques provoquent des déformations optiques des contours de l'objet.";"Observation du passage d'un ballon stratosphérique du CNES.";O;3;;;;;;;;2011-05-03;;;0.13;0.13;;;;;;;0.53;0.48;A;A;1976-09-00344
416;"CHATEAU-GONTIER (53) 05.10.1976";Mayenne;53;"(D) Département";1976;09;30;"Le 5 et 6 octobre 1976 entre 6h30 et 6h40 deux témoins observent la présence d'un point lumineux dans le ciel qui les intrigue. Un objet lumineux de forme ovale de couleur rouge feu parait stationnaire au Nord lors le la première observation et en lent déplacement E-O lors de la deuxième observation. La présence de cet objet dure moins d'une minute avant que le phénomène ne disparaissent soudainement. <br> Aucun autre témoignage ne sera recueilli sur ce phénomène pour lequel nous avons peu d'informations.";"Observations successives d'un phénomène lumineux.";O;3;;;;;;;;2011-05-10;;;0.38;0.13;;;;;;;0.46;0.31;C;B;1976-10-00348
418;"MONTIGNY-LES-METZ (57) 07.10.1976";Moselle;57;"(D) Département";1976;10;07;"Le 7 octobre 1976 plusieurs adolescents observent quelques secondes aux alentours de 19h, le passage rapide d'un objet au-dessus des maisons du quartier. L'objet est décrit ayant la forme d'un cigare de couleur rouge et passant sans bruit selon une trajectoire SE-NO. <br> Aucun adulte ne sera témoin de ce phénomène qui sera relayé dans la presse locale sur l'insistance d'un des parents.<br> Ces enfants ont probablement fait une observation du passage d'un aéronef, le trafic aérien étant important dans ce secteur situé  à proximité de l' aéroport de Metz.";"Probable observation du passage d'un aéronef.";O;4;;;;;;;;2011-05-04;;;0.38;0.13;;;;;;;0.65;0.35;B;B;1976-10-00350
419;"ALLEVARD (38) 10.10.1976";Isère;38;"(D) Département";1976;10;10;"Le 10 octobre 1976 entre 17h et 17h30 des personnes observent plusieurs fois un objet brillant de la forme d'un cigare portant en son centre un rond de couleur foncé. Cet objet se déplace sans bruit.<br> aucun autre témoignage ne sera rapporté. Ces témoins ont probablement fait une observation d'un aéronef de type dirigeable utilisé pour faire de la publicité.";"Probable observation du passage d'un dirigeable.";O;1;;;;;;;;2011-05-04;;;0.38;0.13;;;;;;;0.65;0.35;B;B;1976-10-00351
420;"VENON (38) 15.10.1976";Isère;38;"(D) Département";1976;10;15;"Un témoin rapporte succinctement avoir observé le 15 octobre 1976 vers 17h55 le déplacement d'un objet lumineux dans le ciel selon une trajectoire S-N. Il est apparu ensuite ayant la forme d'un cigare de grande taille et se déplacant toujours sans bruit. L'objet a disparu en prenant la direction du NE.<br> Aucun autre témoignage ne sera recueilli sur ce phénomène pour lequel nous manquons d'information.";"Observation du déplacement d'un phénomène lumineux.";O;1;;;;;;;;2011-05-04;;;0.50;0.50;;;;;;;0.28;0.28;C;C;1976-10-00352
421;"LOCMINE (56) 19.10.1976";Morbihan;56;"(D) Département";1976;10;18;"Le 19 octobre 1976 vers 23h40 une famille en voiture constate dans le ciel le déplacement d'un objet particulier doté de faisceaux lumineux à chaque extrémité. Cet objet émet des lumières vers le sol puis s'élève après avoir éteint ses faisceaux et disparait vers l'Est. Une personne dont l'habitation est située dans la vallée où s'est déroulée l'observation a constaté des perturbations sur son poste de télévision vers 23h30 mais n'a fait aucune observation directe.<br>  Aucune information permettant de valider une hypothèse n'a été recueillie auprés des différents services constactés (Météo, service radar, EDF, stations d'épuration et d'équarissage situées à proximité et fonctionnant nuit et jour).";"Observation d'un engin émettant des lumières vers le sol.";O;5;;;;;;;;2011-05-05;;;0.50;0.50;;;;;;;0.28;0.28;C;C;1976-10-00353
422;"GONDRECOURT-LE-CHÂTEAU (55) 21.10.1976";Meuse;55;"(D) Département";1976;10;21;"Le 21 octobre 1976 entre 18h30 et 18h45 trois personnes situées à deux endroits différents, observent le lent déplacement SE-NO d'une boule lumineuse de forte intensité et de couleur rouge-orangé. L'observation dure 45 secondes avant que le phénomène ne disparaisse brusquement. Un deuxième phénomène identique au premier et semblant suivre la même trajectoire est vu quelques minutes plus tard.<br> Ce phénomène est classé en C par manque d'informations.";"Observation du déplacement de deux phénomènes lumineux.";O;3;;;;;;;;2011-05-05;;;0.50;0.50;;;;;;;0.28;0.28;C;C;1976-10-00354
423;"BOUZONVILLE (57) 24.10.1976";Moselle;57;"(D) Département";1976;10;22;"Entre le 20 et le 26 octobre 1976 en soirée, plusieurs personnes situées dans le même secteur géographique font des observations de lumières multicolores semblant provenir d'un engin que personne n'identifie. Les témoins seront effrayés par ces lumières et cet engin stationaire ou en déplacement et qui émet un bruit sourd. <br>  Ce phénomène qui est classé C par manque d'informations.";"Observations successives de lumières provenant d'un aéronef.";O;5;;;;;;;;2011-05-17;;;0.50;0.50;;;;;;;0.28;0.28;C;C;1976-10-00355
424;"CHATEL-GUYON (63) 29.10.1976";Puy-de-Dôme;63;"(D) Département";1976;10;29;"Dans la nuit du 28 au 29 octobre 1976 entre 4h et 4h45 du matin  plusieurs personnes d'un phénomène lumineux dans le ciel. Un objet stationnaire de forme circulaire émet une lumière blanche très intense. Peu de précisisons sont données sur l'altitude possible de l'objet.<br> Ces personnes ont probablement fait une observation astronomique.";"Observation d'un phénomène lumineux.";O;4;;;;;;;;2011-05-09;;;0.38;0.13;;;;;;;0.65;0.35;B;B;1976-10-00356
428;"CASSIS-CARNOUX (13) 04.11.1976";Bouches-du-Rhône;13;"(D) Département";1976;11;04;"Le 4 novembre 1976 vers 21h45 plusieurs témoins observent le passage lent et silencieux d'une forme triangulaire suivant la direction Marseille -La Ciotat. L'objet est de dimensions lègèrement plus importante qu'un avion de ligne et émet une lumière rouge à l'avant et une lueur blanche à l'arrière.<br> Au cours de plusieurs services de nuit, la gendarmerie a constaté, entre 21h30 et 22h environ, le passage d'un avion de ligne d'assez fort tonnage empruntant le même itinéraire que l'objet observé.<br> Les témoins ont probablement observé le passage d'un aéronef.";"Probable observation du passage d'un aéronef.";O;4;;;;;;;;2011-05-30;;;0.38;0.13;;;;;;;0.65;0.35;B;B;1976-11-00358
429;"RIVES (38) 05.11.1976";Auvergne-Rhône-Alpes;ARA;"(R) Région";1976;11;05;"Le 5 novembre 1976 à 17h et à 20h08 des personnes observent le passage d'une lueur blanche intense dans le ciel. Ce phénomène, de forme circulaire, se déplace rapidement selon une trajectoire N-E. Aucun bruit n'est entendu durant l'observation qui dure quelques secondes.<br> Trop peu de précisions ont été données pour valider une hypothèse particulière. Ce cas est classé C par manque d'informations.";"Observation du passage d'un phénomène lumineux.";O;2;;;;;;;;2011-05-30;;;0.50;0.50;;;;;;;0.28;0.28;C;C;1976-11-00359
430;"BLIGNY (10) 11.11.1976";Aube;10;"(D) Département";1976;11;11;"Les 11, 12 et 20 novembre 1977 entre 17h30 et 18h45 un témoin observe la présence d'un objet insolite dans le ciel qui l'intrigue. De forme triangulaire et de couleurs variées, l'objet est soit statique soit en mouvement.<br> Aucun autre témoignage ne sera recueilli. Aucune observation ne sera faite pas la gendarmerie sur ce phénomène pour lequel nous manquons d'information.";"Observations périodiques de la présence d'un objet insolite dans le ciel par un seul témoin.";O;1;;;;;;;;2011-05-30;;;0.50;0.50;;;;;;;0.28;0.28;C;C;1976-11-00360
431;"LOULAY (17) 20.11.1976";Charente-Maritime;17;"(D) Département";1976;11;20;"Le 20 novembre 1976 vers 19h30 des personnes observent dans le ciel un objet de forme ronde et lumineux qui les intrigue. Cet objet semble tourner sur lui-même et une lueur est visible par intermitence. Il émet des rayons vifs jaune-orangés. L'observation dure un bon quart d'heure avant que l'objet ne disparaisse dans une trajectoire descendante.<br> Aucun autre témoignage plus précis ne sera recueilli sur ce phénomène pour lequel nous manquons d'informations.";"Observation d'un objet lumineux dans le ciel.";O;3;;;;;;;;2011-05-30;;;0.50;0.50;;;;;;;0.28;0.28;C;C;1976-11-00361
432;"MONTMEDY (55) 21.11.1976";Meuse;55;"(D) Département";1976;11;21;"Le 21 novembre 1976 à 20h55 une personne constate une trait rouge dans le ciel puis sa disparition. Elle voit ensuite, avec un autre témoin, le déplacement d'un point  lumineux blanc dans une trajectoire courbe et descendante.<br> Aucun autre témoignage ne sera recueilli sur ce phénomène pour lequel nous manquons d'informations.";"Observation du déplacement d'un point lumineux dans le ciel.";O;2;;;;;;;;2011-05-30;;;0.50;0.50;;;;;;;0.28;0.28;C;C;1976-11-00362
435;"COMMERCY (55) 20.11.1976";Meuse;55;"(D) Département";1976;11;20;"Les 20 et 21 novembre 1976 vers 17h30 plusieurs personnes observent le lent déplacement de deux points lumineux dans le ciel. Ils sont de forme arrondie. Aucun bruit n''est entendu durant les observations.<br> Ce cas est classé C par manque d'informations.";"Observations du lent déplacement de deux points lumineux dans le ciel.";O;2;;;;;;;;2011-05-30;;;0.50;0.50;;;;;;;0.28;0.28;C;C;1976-11-02762
436;"SAINT-GEOIRS (38) 25.11.1976";Isère;38;"(D) Département";1976;11;25;"Le 25 novembre 1976 vers 7h10 un cultivateur à la chasse observe au loin durant quelques secondes une lueur rouge qu'il prend pour un feu de cheminée. <br>

Dominant le paysage, il voit ensuite arriver vers lui  une lumière scintillante qui se déplace selon une trajectoire E-O. Arrivé à dix ou quinze mètres du chasseur, ce phénomène change de direction et le témoin constate alors qu'il est en présence d'un objet de forme allongée de deux mètres de long  environ. L'objet cylindrique est immobile à 10 mètres du sol et une lueur intermitente rouge se propage tout autour de l'objet. Il  se déplace ensuite sans bruit en direction du Sud, s'immobilise puis repart et disparaît caché par le paysage.<br>

Suite à l'enquête de gendarmerie, aucun autre témoignage ne sera recueilli et aucune trace ne sera retrouvée dans la zone de passage indiquée par le témoin. <br>



Il est difficile de mener une enquête à postériori sur un cas aussi ancien. L'hypothèse de l'observation d'un aéronef n'est pas retenue.<br>

Ce cas inexpliqué est peu consistant (un témoin unique). L'observation  présente un fort degré d'étrangeté (observation proche mais courte 8 à 10 sec).<br>

Dans la classification actuelle du GEIPAN, ce cas inexpliqué peu consistant avec un fort caractère d'étrangeté est classé comme PAN D1.";"Observation rapprochée du déplacement d'un objetcylindrique volant à 10m du sol avec changement de direction.";O;1;;;;;;;;2012-04-12;;;0.63;0.13;;;;;;;0.78;0.23;D1;D1;1976-11-02763
438;"ALLY (43) 01.12.1976";Haute-Loire;43;"(D) Département";1976;12;01;"Le 1er décembre 1976 plusieurs témoins observent la présence au-dessus de la ligne d'horizon d'un objet lumineux et stationnaire . L'observation durera 15 minutes avant que l'objet ne disparaisse. Aucun bruit particulier ne sera entendu.<br> Rapidement sur le lieux ,aucune observation ne sera faite par la gendarmerie et aucune trace particulière au sol ne sera découverte dans le secteur ce soir là.<br> L'enquête de gendarmerie déterminera la présence plusieurs soirs de suite et dans la direction indiquée par tous les témoins d'un phénomène lumineux disparaissant derrière la ligne d'horizon.<br> Toutes ces personnes ont fait l'observation astronomique de Vénus.";"Observations astronomiques de Vénus.";O;4;;;;;;;;2011-09-01;;;0.13;0.13;;;;;;;0.53;0.48;A;A;1976-12-00365
439;"SAINTE-MAXIME (83) 07.12.1976";Var;83;"(D) Département";1976;12;07;"Le 7 décembre 1976 vers 17h45 un chauffeur de bus et plusieurs écoliers aperçoivent à deux reprises dans le ciel le déplacement d'un phénomène sphérique lumineux. L'objet de forte clarté au-dessus de la mer se dirige lentement en direction de la terre avant de disparaitre.<br> Une des hypothèses envisagées est celle de l'observation d'un objet astronomique. Mais aucune autre information plus précise ne sera recueillie sur ce phénomène pour lequel nous manquons d'information.";"Observations du déplacement d'un phénomène lumineux.";O;1;;;;;;;;2011-09-12;;;0.50;0.50;;;;;;;0.28;0.28;C;C;1976-12-00366
440;"MEYRONNES (04) 08.12.1976";Alpes-de-Haute-Provence;04;"(D) Département";1976;12;08;"Les nuits du 8 et 9 décembre 1976 autour de 23h des militaires observent quelques secondes dans le ciel  la présence de plusieurs objets volants, de forme ronde, qu'il ne reconnaissent pas. Ils se déplacent du SE vers le NO lentement et silencieusement.<br> A une dizaine de kilomètres de distance un peloton cynophile constatera que ces même nuits leurs chiens au nombre de 10 ont hurlé à la mort inhabituellement.<br>  Un autre témoignage sera recueilli sur une observation faite 6 semaines auparavant : un témoin a aperçu au pied des crêtes une lumière rouge s'élevant dans le ciel avant de disparaitre derrière un sommet.<br>  Une surveillance sera établie du 12 au 30 décembre suite à la déposition des militaires mais aucune autre observation ne sera rapportée.<br>";"Observation de la présence et du lent déplacement d'objets volant dans la vallée. Aucun bruit entendu. Manque d'informations.";O;5;;;;;;;;2007-03-22;;;0.50;0.50;;;;;;;0.28;0.28;C;C;1976-12-00367
441;"SAINT-TROPEZ (83) 09.12.1976";Var;83;"(D) Département";1976;12;09;"Le 9 décembre 1976 un couple en promenade constate la présence d'une lueur brillante et blanche stationnaire dans le ciel. Ils sont fort étonnées des variations d'intensité lumineuse puis de son déplacement rapide et sans bruit vers le Sud-Est.<br> Aucun autre témoignage ne sera recueilli sur ce phénomène pour lequel nous manquons d'information.";"Observation de la présence d'une lueur importante dans le ciel puis de son déplacement à grande vitesse.";O;1;;;;;;;;2011-09-13;;;0.50;0.50;;;;;;;0.28;0.28;C;C;1976-12-00368
442;"VALBONNE (06) 10.12.1976";Alpes-Maritimes;06;"(D) Département";1976;12;10;"Le 10 décembre 1976 à 22h10 un témoin observe le passage E-NO d'un point lumineux se déplacant silencieusement à la vitesse équivalente à celle d'une étoile filante. De forme ovoide et de couleur argentée, le phénomène ne laisse aucune trainée lumineuse. Visible durant quelques secondes, il disparaitra caché par le paysage.<br> Le 11 décembre à 1 heure du matin un militaire observera durant 3 à 4 minutes le passage N-S d'un objet ovoide à haute altitude laissant une trainée lumineuse.<br>  Il est fortement probable que ces témoins aient assisté à des rentrées atmosphériques.";"Observations du passage de phénomènes lumineux.";O;1;;;;;;;;2011-09-13;;;0.38;0.13;;;;;;;0.65;0.35;B;B;1976-12-00369
443;"AJACCIO (2A) 14.12.1976";Corse-du-Sud;2A;"(D) Département";1976;12;14;"Le Mardi 14 décembre 1976 entre 1h15 et 1h27 du matin un automobiliste constate une lueur inhabituelle au-dessus de l'aéroport. Une boule d'un blanc intense se déplace latéralement et lentement suivie par une seconde. Elles s'immobiliseront dans un premier temps avant de s'élever rapidement et de disparaître.<br>  L'enquête de gendarmerie déterminera que cette personne a été témoin du lâcher d'un ballon sonde : toutes ses remarques décrivant parfaitement les manuvres du ballon.";"Observation d'un ballon sonde.";O;1;;;;;;;;2011-09-13;;;0.13;0.13;;;;;;;0.53;0.48;A;A;1976-12-00370
445;"RENNES-SUR-LOUE (25) 18.12.1976";Doubs;25;"(D) Département";1976;12;18;"Le 18 décembre 1976 à 5h du matin, un témoin constate par la fenètre de sa chambre une lueur de couleur rouge et une masse sombre se déplaçant dans le sens N-S à basse altitude.<br> Aucun bruit n'est entendu durant l'observation dans ce matin légèrement brumeux.<br> Aucun autre témoignage ne sera recueilli sur cette observation  pour laquellle nous manquons de d'informations.";"Observation d'une lueur rouge et du passage d'une masse sombre.";O;1;;;;;;;;2011-09-30;;;0.50;0.50;;;;;;;0.28;0.28;C;C;1976-12-00372
446;"PAJAY (38) 21.12.1976";Isère;38;"(D) Département";1976;12;21;"Un témoin rapporte une observation faite le 21 décembre 1976 entre 22h30 et 23h45 :  le témoin observe avec des jumelles un phénomène lumineux de plusieurs couleurs. Deux autres personnes observeront également le phénomène qui semble stationnaire.<br> Ces personnes ont probablement fait une observation astronomique de Sirius parfaitement visible en cette période de l'année. Les couleurs remarquées par le témoin principal sont probablement la conséquence d'une part du scintillement de l'étoile à cause des perturbations atmosphériques et d'autre part des aberrations chromatiques inhérantes aux jumelles grand public (ces aberrations provoquent des irisations autour des points très lumineux).";"Probables observations astronomique de Sirius.";O;3;;;;;;;;2011-10-19;;;0.38;0.13;;;;;;;0.65;0.35;B;B;1976-12-00373
447;"COURTINE (LA) (23) 23.12.1976";Creuse;23;"(D) Département";1976;12;23;"Le 23 décembre 1976 vers 2h20 un militaire en poste de surveillance a son attention attirée par le passage à basse altitude d'un objet de forme ronde et éclairé par plusieurs lampes émettant une lumière vive rouge. Une autre lampe rouge tourne à son sommet à la façon d'un gyrophare. L'engin se déplace lentement et émet un sifflement continu d'intensité moyenne. Il disparaît caché par un autre batiment. L'observatio aura duré 30 secondes. <br> Aucun autre témoin direct de l'observation se fera connaître. <br> Ce militaire a probablement fait une observation du passage d'un aéronef de type hélicoptère.";"Probable observation d'un aéronef de type hélicoptère.";O;1;;;;;;;;2007-03-22;;;0.38;0.13;;;;;;;0.65;0.35;B;B;1976-12-00374
448;"LA BACHELLERIE (24) 24.12.1976";Dordogne;24;"(D) Département";1976;12;24;"Le 24 décembre 1976 vers 19h15 deux témoins constatent dans le ciel les apparitions succesives de lueurs brillantes. Aucun bruit n'est entendu durant le déplacement de ces sept lueurs au total.<br> Aucun autre témoignage ne sera recueilli sur ce phénomène pour lequel nous manquons de précisions.";"Observation de sept objets volants lumineux. Certains se déplacent en oscillant avant de disparaître.";O;2;;;;;;;;2011-10-27;;;0.50;0.50;;;;;;;0.28;0.28;C;C;1976-12-00375
449;"SAINT-AMOUR (39) 26.12.1976";Jura;39;"(D) Département";1976;12;26;"Le 26 décembre 1976 vers 20h15 deux témoins observent plusieurs minutes des lumières rouges et jaunes pâle venant de l'Ouest. L'ensemble décrit des arabesques en se dirigeant lentement vers l'Est. Ce phénomène s'est produit au dessus du Mont Fevrier non loin de la station hertzienne. Les témoins ont également vu une boule rouge monter de la ligne à haute tension pour aller à la rencontre de l'ensemble lumineux et disparaître.<br> Aucun autre témoignage n'a été recueilli et l'agent de la station hertzienne à Cuisseaux n'a rien remarqué. <br> Ce cas est classé C par manque d'informations.";"Observation du déplacement silencieux et en arabesques de lumières de couleur.";O;2;;;;;;;;2007-03-22;;;0.50;0.50;;;;;;;0.28;0.28;C;C;1976-12-00376
452;"CHATEAUDOUBLE (26) 01.01.1977";Drôme;26;"(D) Département";1977;01;01;"Le GEIPAN continue à publier l'ensemble de ses archives sur son site public www.geipan.fr. Dans ses publications, figurent des cas anciens classés à l'époque (A, B, C ou D) et qui font aujourd'hui l'objet d'un réexamen, dans le seul but d'être plus pertinent dans les conclusions. Grâce à de nouveaux moyens techniques (logiciels) et à l'expérience d'enquête acquise depuis toutes ces dernières années, ce réexamen aboutit quelquefois à de nouvelles remarques voire à un changement de classification.<br>
Ce cas d'observation précédemment classé D et nommé CHABEUIL (26) 01.01.1977 a fait l'objet d'une première revisite en 2011 dans laquelle une carte du ciel jointe indiquait la présence de Vénus dans le secteur du ciel observé. La nouvelle conclusion insiste sur les éléments qui ont participé à l'étrangeté du cas à l'époque et confirme l'observation astronomique. <br>

Le 01 janvier 1977 entre 19h30 et 19h45 deux personnes circulent en voiture sur un chemin communal dans le quartier de la Serre à Valence (26). Lors de leur aller-retour sur cette route, ils sont intrigués par la présence d'un phénomène lumineux blanc de très forte intensité à basse altitude. Stationnaire en direction du Sud, le PAN de forme large s'élève ensuite rapidement pour disparaître toujours en direction du Sud. Aucun bruit n'est entendu durant la longue observation. Un troisième témoin retrouvé par les gendarmes lors de l'enquête rapporte n'avoir rien constaté de particulier ce soir là et dans son champ mais décrit une observation d'un PAN faite un an auparavant.<br>
L'observation est bien documentée grâce aux photos et reconstitutions des gendarmes. Par contre, il y a des incohérences dans les descriptions de formes ou mouvement du PAN.<br>

La quasi- stationnarité du PAN sur une durée importante (deux observations d'au moins 10mn séparées par au moins 15mn) font penser à l'observation d'un astre. Concernant l'aspect, certains points de témoignages traduisant un mouvement ou une forme large ont pu paraître étranges et conduire à écarter cette hypothèse lors de la première enquête il y 40 ans. Mais l'expérience acquise par le GEIPAN permet d'expliquer ces perceptions.<br>
La variation d'intensité lumineuse, causée par l'évolution du voile atmosphérique devant l'astre est logiquement interprétée par le témoin comme une variation (dite radiale) en distance (dans sa direction) d'un PAN qui serait à intensité constante et selon des vitesses souvent qualifiées de fulgurantes, en particulier lors de la fuite et de la disparition finale.<br>
 - le témoin T1 dit  ""à l'instant l'objet se déplaça à une vitesse vertigineuse vers le sud"" ;<br>
- le témoin T2 dit  ""Au bout d'une minute environ, cet engin a commencé à s'élever et à diminuer en grosseur. Cette manuvre a duré environ cinq secondes et à ce moment-là la boule de feu est partie vers le sud comme une étoile filante. Je précise que ceci s'est passé très rapidement.""... "" je dois ajouter que lorsque l'engin s'est envolé, j'ai eu l'impression que notre automobile partait en marche arrière"".<br>

Notons que la direction Sud de déplacement est la même que celle que les témoins attribuent à la direction du PAN, ce qui va dans le sens d'une perception de déplacement radial. Seul T1 décrit un mouvement qui pourrait laisser penser à une trajectoire non radiale avec une évolution en position dans le ciel, il dit ""se déplaça à une vitesse vertigineuse vers le sud en décrivant une courbe au départ de 45° environ"".<br>

T2 Indique une notion de taille plus importante que celle d'un astre avec des formes et des rayons projetés. Cela se produit également lors de l'observation avérée d'astres très brillants comme Vénus ou Sirius pas loin de l'horizon, l'élément le plus courant (attesté ici aussi) étant constitué par les couleurs variables et clignotements.On note que l'observation est faite en présence ou à proximité de nappes de brouillards qui ont pour effet d'accentuer les effets dispersifs de l'atmosphère sur les lumières issues de l'astre. Notons enfin que T1 ne distingue aucun effet de forme au-delà d'un point lumineux large et globalement rond et que les deux témoins font souvent référence à une étoile pour signaler le PAN.<br>

Le doute n'est guère permis quand on constate (voir reconstitution ci-jointe réalisée à partir des photos de gendarmerie) que Vénus est exactement (à un ou deux degrés prés) dans la direction du PAN (234° et non plein sud comme pensé par les témoins). Vénus a bien une trajectoire descendante jusqu'à être à quelques degrés du haut de la colline en fin de l'observation. La forte luminosité avec dispersion des rayons du fait du brouillard a pu faire penser que le PAN est posé sur la colline, du moins pour T2 car T1 a toujours situé le PAN au dessus du sol.<br>
La disparition finale du PAN résulte du passage d'un brouillard ou nuage plus épais. Les perceptions d'intelligence du PAN (départ) en réaction à la présence des témoins signalée par les phares sont de pur hasard, d'ailleurs T2 précise que la ""réaction"" du PAN a pris deux minutes (""J'ai l'impression que les lumières de notre voiture ont été gênantes car deux minutes après l'appel de phare, l'engin est parti"").<br>

Vénus est exactement dans la direction du PAN. Les écarts témoignés par rapport à l'aspect standard d'une étoile sont conformes à ceux enregistrés lors de nombreuses observations avérées de Vénus ou Sirius prés de l'horizon et ce qui ne le serait pas (mouvement non radial) n'est noté que par un témoin (T1) et pas par l'autre.<br>
En conclusion le GEIPAN classe le cas en A : observation de Vénus.

";"Longues observations d'un objet lumineux stationnaire à basse altitude ; disparition rapide et silencieuse : observations de Vénus.";O;3;3;;1;;;;;2018-06-04;;;0.05;0.00;;;0.60;;0.90;;0.55;0.00;A;A;1977-01-00377
453;"VILLEBOIS-LAVALETTE (16) 05.01.1977";Charente;16;"(D) Département";1977;01;05;"Le 5 janvier 1977 vers 18h30 deux personnes en voiture observent un phénomène lumineux rouge-orangé qui les intrigue. Celui-ci semble provenir d'une masse qui se déplace SE-NO sans qu'aucun bruit particulier ne soit entendu. L'observation durera une dizaine de minutes durant lesquels des étincelles sont remarquées. Le phénomène diminuera progresssivement et lentement avant de s'éteinte complètement. A plusieurs reprises des personnes circulant sur la route empruntée par ces automobilistes, ont remarqué des étincelles provenant d'une ligne électrique orientée SE-NO. Aucun autre témoignage ne sera recueilli sur ce phénomène pour lequel nous manquons d'informations.";"Observation du déplacement silencieux d'un phénomène lumineux.";O;2;;;;;;;;2010-08-03;;;0.50;0.50;;;;;;;0.28;0.28;C;C;1977-01-00378
454;"MESNIL-LE-ROI (LE) (78) 08.01.1977";Yvelines;78;"(D) Département";1977;01;08;"Le 8 janvier 1977 à 20h50 un témoin observe une lumière intense provenant d'un objet qu'elle ne voit pas. Aucun bruit n'est entendu durant la courte observation. L'objet a disparu dans une trajectoire descendante derrière les maisons en direction de la forêt domaniale. Aucune trace  et aucun autre témoignage n'ont pu apporter d'autres informations concernant ce phénomène.";"Observation d'un objet émetant une forte lumière.";O;1;;;;;;;;2010-08-03;;;0.50;0.50;;;;;;;0.28;0.28;C;C;1977-01-00379
455;"NATIONAL (975) 10.01.1977";France;FR;"(N) National";1977;01;10;"Le 10 janvier 1977 à partir de 20h45 plusieurs personnes sur différents départements observent dans le ciel des phénomènes lumineux qu'ils ne s'expliquent pas. Tous décrivent les déplacements silencieux et rapides d'objets lumineux rougeâtres.<br> Les gendarmes appelés immédiatement ne constateront pas ces phénomènes pour lesquels nous manquons d'informations.";"Observations du passage de phénomènes lumineux.";O;4;;;;;;;;2011-06-09;;;0.50;0.50;;;;;;;0.28;0.28;C;C;1977-01-00380
457;"BAZOGE (LA) (72) 14.01.1977";Sarthe;72;"(D) Département";1977;01;14;"Le 14 janvier 1977 vers 18h 40 deux personnes observent un objet lumineux sphérique qui les intigue. Cet objet se déplace d'abord dans le sens S-N puis E-O. Les gendarmes constateront en direction de l'Ouest le lent déplacement d'un objet lumineux de forme circulaire et d'un diamètre supérieur à une étoile. Il sera visible jusqu'à 21h30. Aucun autre témoignage ne sera recueilli sur ce phénomène pour lequel nous manquons d'informations.";"Observation des déplacements d'un objet lumineux.";O;1;;;;;;;;2010-08-03;;;0.50;0.50;;;;;;;0.28;0.28;C;C;1977-01-00382
458;"VAUCOULEURS (55) 16.01.1977";Meurthe-et-Moselle;54;"(D) Département";1977;01;16;"Le 16  janvier 1977 à 20h15 un automobiliste et sa passagère observent les déplacements d'une boule lumineuse de couleur orange et d'un diamètre d'environ 15 cm. Elle se situe à environ 2000 mètres d'altitude. Aucune trainée et aucun bruit ne seront visibles durant l'observation. L'objet s'éteint progressivement à trois reprises avant de se rallumer rapidement. L'objet a disparu très rapidement.";"Observation du déplacement d'une boule lumineuse.";O;2;;;;;;;;2010-08-03;;;0.50;0.50;;;;;;;0.28;0.28;C;C;1977-01-00383
459;"PORTE-PUYMORENS (66) 17.01.1977";Pyrénées-Orientales;66;"(D) Département";1977;01;17;"Une automobiliste observe et photographie le 17 janvier 1977 vers 17h un phénomène météorologique particulier. Un nuage de forme oval se déplace imperceptiblement sans le sens Nord-Sud. Deux autres témoins ont fait la même observation.  D'après la photo jointe au procés verbal, ces personnes ont vu un nuage lenticulaire.";"Observation d'un nuage lenticulaire.";O;1;;;;;;;;2010-08-04;;;0.13;0.13;;;;;;;0.53;0.48;A;A;1977-01-00384
460;"ISSOUDUN (36) 23.01.1977";Indre;36;"(D) Département";1977;01;23;"Le 23 janvier 1977 vers 1h45 un témoin observe au loin une lumière orange qui semble venir dans sa direction. Réveillant d'autres personnes, ces témoins vont apercevoir des boules lumineuses très rapprochées les unes des autres et de la taille d'une ballon de football.  Un des objets retient leur attention étant constitué différemment des autres : il est de forme rectangulaire et plus étroit à l'arrière avec des ouvertures éclairées. Ces objets se déplacent sans aucun bruit. L'hypothèse de l'observation de l'évolution d'un avion de transport (présence d'un aérodrome militaire à Châteauroux) n'a pu être confirmée par manque d'informations.";"Observation du déplacement d'objets lumineux.";O;2;;;;;;;;2010-08-04;;;0.50;0.50;;;;;;;0.28;0.28;C;C;1977-01-00385
461;"SAINT-BENOIT (974) 24.01.1977";"La Réunion";974;"(D) Département";1977;01;24;"Le 24 janvier 1977 à 6h 17 trois personnes voient une colonne de vapeur ou de fumée venant du ciel. Une tache d'écume est visible à la surface indiquant la chute d'un objet dans l'océan à environ 4km du rivage et à environ 8 à 10 km du lieu de l'observation.  Aucun autre témoignage ne sera recueilli sur ce phénomène et le point de chute s'averant difficile à déterminer, aucune recherche n'a été entreprise.";"Observation d'un objet chutant dans l'océan.";O;3;;;;;;;;2010-08-04;;;0.50;0.50;;;;;;;0.28;0.28;C;C;1977-01-00386
462;"VEROSVRES (71) 27.01.1977";Saône-et-Loire;71;"(D) Département";1977;01;27;"Dans le soirée du 27 janvier 1977 à partir de 20h30 deux automobilistes observent le lent déplacement d'un phénomène lumineux. Une boule de la grosseur d'un ballon de football émet une lumière blanche de forte intensité et se déplace silencieusement tout en oscillant sur son axe. Aucune distance ni vitesse de déplacement n'a pu être précisée par le témoin principal qui observera le déplacement d'un second point lumineux. Le témoin quittera les lieux à 21h45 après disparition totale du phénomène. Aucun autre témoignage ne sera recueilli sur ce phénomène pour lequel nous manquons d'informations.";"Observation du lent déplacement d'un phénomène lumineux.";O;1;;;;;;;;2010-08-04;;;0.50;0.50;;;;;;;0.28;0.28;C;C;1977-01-00387
465;"TOULOUSE (31) 26.01.1977";Haute-Garonne;31;"(D) Département";1977;01;26;"Le dernier mercredi de janvier 1977, un témoin observe depuis le 1er étage d'une habitation, un objet volant dans le ciel à 500 m d'altitude. Cet objet de la forme d'un ballon de rugby est imposant et ressemble à un dirigeable. Il se déplace à une vitesse de 100 à 150 km/h contre le vent. Sa couleur est gris mat métallique. Aucun bruit n'est entendu par le témoin. Ce témoignage très tardif (09/07/2007) ne permet pas de faire une enquête sérieuse qui pourrait valider ou non certaines  hypothèses telles que le passage d'un ballon.";"Observation d'une forme genre dirigeable.";O;1;;;;;;;;2010-03-30;;;0.50;0.50;;;;;;;0.28;0.28;C;C;1977-01-01861
467;"SAINT-MARCELLIN (38) 02.02.1977";Isère;38;"(D) Département";1977;02;02;"Le 2 février 1977 aux environs de 20h45 un témoin observe durant trois minutes environ un phénomène lumineux aux jumelles. Il décrit une forme circulaire en deux parties :  brillante et jaune pour la partie supérieure et avec une flamme rouge vif sur la partie inférieure. Le phénomène semble ensuite pivoter sur lui-même pour prendre une forme ovale sans que les couleurs ne changent d'intensité. Le témoin retournera à ses occupations avant que le phénomène disparaisse. Aucun autre témoignage n'a été recueilli sur ce phénomène pour lequel nous manquons d'informations.";"Observation d'un phénomène lumineux.";O;1;;;;;;;;2010-08-05;;;0.50;0.50;;;;;;;0.28;0.28;C;C;1977-02-00391
468;"REIMS (51) 05.02.1977";Marne;51;"(D) Département";1977;02;05;"Ce cas d'observation classé ""C"" par le GEPAN fait aujourd'hui partie d'un réexamen (voir le document Notes d'enquête).<br> Le 5 février 1977 entre 21h et 21h30 deux personnes à Reims (51) observent en direction de l'Ouest une boule lumineux semblant immobile dans le ciel. Aucun bruit n'est entendu durant l'observation de ce phénomène qui aura complètement disparu vers 21h45. <br> Ce cas est peu consistant (deux témoins, mais avec des témoignages succincts), la description du PAN observé est assez précise. La sincérité et la crédibilité des témoins n'ont jamais été mises en doute. <br>  Le phénomène décrit présente beaucoup de caractéristiques communes (durée d'observation, forme, taille, couleur) avec un objet astronomique parfaitement connu : la planète Vénus. De plus, Vénus était bien présente sur la zone du ciel observée, avec une luminosité particulièrement remarquable. <br>  Ce n'est pas la perception visuelle des témoins qui est en cause, mais l'interprétation que les témoins font de leur observation à travers leur ressenti (fatigue, observation de nuit).<br>  Dans la classification actuelle du GEIPAN, ce cas d'étrangeté faible est classé « A », observation liée avec une méprise avec Vénus.";"Observations d'un phénomène lumineux immobile et silencieux en direction de l'Ouest : observations astronomiques de Vénus.";O;2;;;;;;;;2014-09-05;;;0.13;0.13;;;;;;;0.53;0.48;A;A;1977-02-00392
470;"LEDIGNAN (30) 09.02.1977";Gard;30;"(D) Département";1977;02;09;"Le 9 février 1977 vers 18h50 plusieurs personnes constatent la présence dans le ciel d'une lueur étrange en direction du Sud-Est à ras la ligne de crête de la montagne. Tout d'abord immobile, cette lueur de forme sphérique s'est ensuite progressivement élevée en changeant de couleur et a disparu brusquement. Appelés par téléphone, les gendarmes depuis leur brigade ne constateront ni lueur anormale ni bruit sur ce phénomène pour lequel nous manquons d'informations.";"Observation du déplacement d'une forme sphérique lumineuse.";O;5;;;;;;;;2010-08-05;;;0.50;0.50;;;;;;;0.28;0.28;C;C;1977-02-00394
471;"ALBI (81) 10.02.1977";Tarn;81;"(D) Département";1977;02;10;"Le 10 février 1977 vers 5h58 deux personnes observent depuis leur domicile le déplacement silencieux d'une sphère lumineuse clignotante. La sphère disparaît rapidement vers le Nord-Nord-Ouest cachée par le paysage urbain. Aucun autre témoignage ne sera recueilli sur ce phénomène.";"Observation du déplacement silencieux d'une sphère lumineuse.";O;2;;;;;;;;2010-08-06;;;0.50;0.50;;;;;;;0.28;0.28;C;C;1977-02-00395
476;"BELLEVILLE-SUR-SAONE (71) 18.03.1977";Rhône;69;"(D) Département";1977;03;19;"Les 18,19 et 20 mars 1977 plusieurs personnes dont des gendarmes observent à partir de 20h30 la présence d'une étrange lueur dans le ciel. Celle-ci se déplace lentement et semble par moment grossir ou diminuer. La couleur peut varier du blanc au jaune orangé. La lueur disparaît vers 21h. L'hypothèse d'une observation astronomique n'a pu être confirmée par manque d'informations.";"Observations périodiques d'une lueur. Déplacement lent.";O;2;;;;;;;;2010-08-06;;;0.50;0.50;;;;;;;0.28;0.28;C;C;1977-03-00399
481;"COS (09) 02.04.1977";Ariège;09;"(D) Département";1977;04;02;"Le 2 avril 1977 entre 19h15 et 19h30 plusieurs personnes dans un véhicule remarquent dans le ciel un nuage lumineux qui les intrigue. Les témoins aperçoivent ensuite une lueur de forme allongée qui se détache lentement du nuage dans une trajectoire rectiligne . Aucun bruit particulier n'est entendu par les témoins qui se sont arrêtées sur le bas-côté. La lueur disparaîtra dans une masse nuageuse. Aucun autre témoignage ne sera recueilli sur ce phénomène pour lequel nous manquons d'informations.";"Observation d'un phénomène lumineux.";O;1;;;;;;;;2010-08-10;;;0.50;0.50;;;;;;;0.28;0.28;C;C;1977-04-00402
482;"ANGERS (49) 29.04.1977";Maine-et-Loire;49;"(D) Département";1977;04;29;"Le 29 avril 1977 à 21h15 et à 22h15 deux personnes observent le lent déplacement d'un engin en forme de cigare. Cet engin émet des lumières de différentes couleurs et se déplace parallèlement à la Maine. Malgré une observation de 10 minutes, les témoignages restent succincts. Un troisième témoin retrouvé par la gendarmerie, fera état d'une observation de trois minutes ce même jour vers 21h décrivant le déplacement  NE-SO d'une boule rouge avec une ""queue"" qui finira par ""s'éteindre"" L'hypothèse de la rentrée atmosphérique n'a pas été confirmée par manque d'informations.";"Observations d'un engin sombre en forme de cigare émettant une lumière blanche.";O;3;;;;;;;;2010-08-10;;;0.50;0.50;;;;;;;0.28;0.28;C;C;1977-04-00404
483;"CAGNES-SUR-MER (06) 30.04.1977";Alpes-Maritimes;06;"(D) Département";1977;04;30;"Le 30 avril 1977 entre  23h et 23h25 des témoins aperçoivent une lueur et entendent un bruit de crépitement ou de sifflement.  La gendarmerie sera avertie tardivement des ces faits et ne pourra trouver aucune trace ou indice sur les lieux. Les témoignages divergent sur beaucoup de données et les faits n'ont pu être déterminés avec précisions.";"Observations d'une lueur accompagnée de bruit.";O;3;;;;;;;;2017-02-23;;;0.50;0.50;;;;;;;0.28;0.28;C;C;1977-04-00405
485;"LAROCHE-PRES-FEYT (19) 11.05.1977";Corrèze;19;"(D) Département";1977;05;11;"Le 11 mai 1977 vers 23h20 une personne remarque la présence de deux énormes boules lumineuses situées à l'Est de sa maison. A 50mètres du sol, elles sont immobiles et éclairent fortement le sol. AU bout d'une minute et avant la disparition complète du phénomène, le témoin entendra un bruit de pales d'hélicoptère et verra une lumière jaune très intense éclairer le secteur. Aucun autre témoignage ne sera recueilli sur ce phénomène pour lequel nous manquons d'informations.";"Observation de deux boules oranges émettant de la lumière.";O;1;;;;;;;;2010-08-11;;;0.50;0.50;;;;;;;0.28;0.28;C;C;1977-05-00406
486;"CHATEAURENARD (45) 13.05.1977";Loiret;45;"(D) Département";1977;05;13;"Le 13 mai 1977 vers 21h 30 plusieurs témoins observent les déplacements de plusieurs points lumineux. Ils évoluent en changeant de couleurs à une grande distance que les témoins ne peuvent évaluer plus précisément. Les enchainements des déplacements vont se poursuivre jusqu'à 22h20, heure de la brusque disparition du phénomène.";"Observations d'un ballet d'un phénomène lumineux.";O;2;;;;;;;;2010-08-11;;;0.50;0.50;;;;;;;0.28;0.28;C;C;1977-05-00407
488;"COUX (07) 28.05.1977";Ardèche;07;"(D) Département";1977;05;28;"Le 28 mai 1977 à partir de 3h du matin une étudiante fait trois observations d'un phénomène lumineux qui l'intrigue . Une boule de couleur jaune se déplace lentement avant de disparaître. Aucun bruit n'est entendu lors de l'observation. Un autre témoin viendra sur les lieux de l'observation le lendemain entre 2h et 4h du matin. A la verticale de  l'endroit d'observation indiqué par le premier témoin, il constatera la présence de la Lune.  L'étudiante a probablement fait une observation astronomique de la Lune.";"Probable observation astronomique de la Lune.";O;1;;;;;;;;2010-08-11;;;0.38;0.13;;;;;;;0.65;0.35;B;B;1977-05-00409
489;"VITTEAUX (21) 30.05.1977";Côte-d'Or;21;"(D) Département";1977;05;30;"Le 30 mai 1977 à 3h30 deux personnes en voiture observent une boule lumineuse de couleur rouge-orangé au-dessus de l'agglomération de vitteaux. Cette boule se situe à basse altitude et se déplace lentement dans le sens Sud-Nord. Aucun bruit n'est entendu durant l'observation qui dure 5 à 6 minutes.<br> Ce cas ancien a fait l'objet d'un rééxamen. Grâce à de nouveaux moyens techniques (logiciels) et à l'expérience d'enquête acquise depuis toutes ces dernières années, ce réexamen aboutit quelquefois à de nouvelles remarques voire à un changement de classification explicité dans une note d'enquête.<br> Ce cas est consistant (deux témoins, dont une fonctionnaire de police), la description du PAN observé est très précise. La sincérité et la crédibilité des témoins n'ont jamais été mises en doute.<br> Le phénomène décrit présente beaucoup de caractéristiques communes (durée d'observation, forme, taille, couleur) avec un objet astronomique parfaitement connu : la Lune au coucher. De plus, la Lune était bien présente dans la zone du ciel observée alors que les témoins n'en font pas mention. Ce n'est pas la perception visuelle des témoins qui est en cause, mais l'interprétation que les témoins font de leur observation à travers leur ressenti (fatigue, conduite de nuit, Lune vue par intermittence à travers les nuages).<br> Dans la classification actuelle du GEIPAN, ce cas d'étrangeté faible est classé comme PAN A, observation liée avec une méprise avec la Lune.";"Observation de la présence d'une boule lumineuse rouge-orange dans le ciel : observation astronomique avec méprise Lune.";O;2;;;;;;;;2013-11-19;;;0.13;0.13;;;;;;;0.53;0.48;A;A;1977-05-00410
490;"BARCELONNETTE (04) 11.05.1977";Alpes-de-Haute-Provence;04;"(D) Département";1977;05;11;"Le 11 mai 1977 entre 22h05 et 22h 25 plusieurs personnes constatent la présence dans le ciel de deux objets évoluant sans bruit et émettant une vive lueur rouge par intermitence. Les témoins remarquent également que ces objets émettent une lueur blanche en direction du sol. L'enquête de gendarmerie déterminera que deux appareils ""PUMA-SA/330"" de la base école du Cannet-des-Maures (83) ont effectué un vol de nuit se livrant à des exercices (dont des éclairages au sol) dans le secteur d'habitation des témoins.";"Observations d'un vol de nuit d'hélicoptères.";O;1;;;;;;;;2010-08-11;;;0.13;0.13;;;;;;;0.53;0.48;A;A;1977-05-02608
491;"MEYLAN (38) 04.06.1977";Isère;38;"(D) Département";1977;06;04;"Le 4 juin 1977 vers 11h un témoin et son fils observent un point de petite dimensions de couleur sombre se détachant dans le ciel clair. Ce point est immobile et durant l'observation des éclairs de plusieurs couleurs sont remarqués. Aucun bruit ne sera entendu. Aucun autre témoignage ne sera recueilli sur ce phénomène pour lequel nous manquons d'informations.";"Observation d'un point immobile sombre.";O;1;;;;;;;;2010-08-12;;;0.50;0.50;;;;;;;0.28;0.28;C;C;1977-06-00411
492;"SAINT-CLAUDE (39) 13.06.1977";Jura;39;"(D) Département";1977;06;13;"Le 13 juin 1977 vers 0h 05 des automobilistes constatent que la route s'éclaire comme en plein jour pendant 4 à 5 secondes et ils voient une boule suivie d'une trainée qui se déplace d'Ouest en Est. Cette boule émet comme des crépitements. Elle disparaît rapidement cachée par le paysage. D'autres témoins dans les environs entendront une déflagration ou verront un éclair. La gendarmerie n'a relevée aucune trace de chute sur le secteur. Ces personnes ont probablement été témoins d'une rentrée atmosphérique.";"Probable rentrée atmosphérique.";O;4;;;;;;;;2010-08-12;;;0.38;0.13;;;;;;;0.65;0.35;B;B;1977-06-00412
493;"SAINT-POL-SUR-TERNOISE (62) 25.06.1977";Pas-de-Calais;62;"(D) Département";1977;06;25;"Le 25 juin 1977 à 2h 05 les gendarmes sont prévenus de la présence de phénomènes lumineux anormaux dans le ciel.  Les témoins font état d'évolutions de deux faisceaux lumineux entre 1h05 et 2h05. Ces faisceaux se déplacent dans le ciel éclairant l'espace en tournant sur eux-mêmes. La lumière apparait toutes les 15 à 20 secondes. Sur les lieux à 2h30, les gendarmes ne constateront aucun phénomène..";"Observations d'un phénomène lumineux.";O;3;;;;;;;;2010-08-12;;;0.50;0.50;;;;;;;0.28;0.28;C;C;1977-06-00413
494;"NOISY-LE-ROI (78) 02.07.1977";Yvelines;78;"(D) Département";1977;07;02;"La gendarmerie fait état de courriers relatant l'observation d'un phénomène lumineux observé le 2 juilllet 1977 par deux personnes. Un couple a observé entre 19h30 et 20h20 les évolutions de deux lumières jaune -orangé d'abord immobiles puis se déplaçant dans le ciel. Une des deux lumière disparaîtra instantanément et les témoins quitteront leur poste d'observation avant la disparition de la deuxième lumière. Les témoins ne répondront jamais à la convocation de la gendarmerie et aucun autre témoignagne ne sera recueilli sur ce phénomène pour lequel nous manquons d'informations.";"Observation d'un phénomène lumineux.";O;1;;;;;;;;2010-08-19;;;0.50;0.50;;;;;;;0.28;0.28;C;C;1977-07-00414
495;"URMATT (67) 19.07.1977";Bas-Rhin;67;"(D) Département";1977;07;19;"Le 19 juillet 1977 vers 23h un chasseur dans la fôret observe dans le ciel une boule lumineuse de plusieurs couleurs qui se déplace. Continuant son chemin vers la lisère il aperçoit, au même endroit que la boule lumineuse qui a disparu, des disques de couleur pâle de la grosseur d'une assiette. Le chasseur déconcerté se rend jusqu'à un chalet pour trouver une autre personne pouvant confirmer ce qu'il voit. Un autre témoin confirmera aux gendarmes avoir vu aux jumelles trois disques lumineux immobiles dans le ciel. Vers minuit plus aucun objet n'était visible dans le ciel. Aucun autre témoignage  pouvant apporter un complément d'information n'a été recueilli sur ce phénomène.";"Observation d'une boule et de disques lumineux.";O;2;;;;;;;;2010-08-18;;;0.50;0.50;;;;;;;0.28;0.28;C;C;1977-07-00415
496;"[D670] de SAINT-ANDRE-DE-CUBZAC (33) vers LIBOURNE (33) 20.07.1977";Gironde;33;"(D) Département";1977;07;20;"Une personne témoigne par lettre que le 20 juillet 1977 vers une heure du matin à bord de sa voiture, elle et sa fille ont pu observer durant quelques secondes un engin de la forme d'une soucoupe. Entourée d'un halo légèrement jaune, l'engin se déplacait lentement dans le ciel en tournant sur lui-même et semblait descendre vers la voiture. Mais reprenant de l'altitude, l'engin a disparu en direction de Bordeaux. Plusieurs personnes seront entendues mais aucun autre témoignage ne sera recueilli  pour confirmer ou infirmer les dires de ce témoin.";"Observation d'un engin en forme de soucoupe.";O;1;;;;;;;;2010-08-18;;;0.50;0.50;;;;;;;0.28;0.28;C;C;1977-07-00416
498;"ARBRESLE (69) 27.07.1977";Rhône;69;"(D) Département";1977;07;27;"Le 27 juillet 1977 à 3h55 des personnes d'une même famille observent durant une à deux minutes trois engins stationnant sous le plafond nuageux. Ils décrivent les engins comme ayant une forme pyramidale évaséé avec  la partie supérieure arrondie. Ils émettent une lumière blanche et de couleur d'intensité variable. Ils disparaissent silencieusement et en quelques secondes vers 4h pour réapparaître vers 4h20. Ils disparaissent ensuite définitivement dans les nuages. Aucune constatation n'a pu être faite par la gendarmerie et aucun autre témoignage n'a été recueilli.";"Observations de trois engins immobiles et brillants.";O;3;;;;;;;;2010-08-19;;;0.50;0.50;;;;;;;0.28;0.28;C;C;1977-07-00418
499;"LOUVIERS (27) 06.08.1977";Eure;27;"(D) Département";1977;08;06;"Le 6 aout 1977 à 1h 30 du matin deux personnes observent à l'extérieur de leur domicile un phénomène lumineux qui les intrigue. Une lueur de forte intensité jaune-orangée se déplace lentement, s'immobilise et les témoins aperçoivent un court instant deux petites lueurs rouges avant que la lueur ne continue son trajet. Durant les trois minutes d'observation aucun bruit n'est entendu.

Le 13 août 1977 à la même heure un des témoins observera toujours depuis son domicile un objet ovoïde posé dans un champ de l'autre côté de la rivière qui borde sa propriété. L'objet lumineux est stationné au sol et aucun bruit n'est entendu durant la dizaine de minutes d'observation.

Aucune trace ou changement particulièrs ne seront remarqués par le propriétaire du champ à l'endroit supposé du stationnement de l'objet.

La gendarmerie constatera trois trous peu profonds sans pouvoir déterminer avec exactitude l'origine de ces trous difformes. Des échantillons de terre seront prélevés. La recherche de radioactivité sera négative ainsi que les vérifications demandées auprés des services de météorologie, génie et station radar proche.

Aucun autre témoignage ne sera recueilli sur ce phénomène.";"Observation du déplacement d'un phénomène lumineux.";O;3;;;;;;;;2010-08-20;;;0.50;0.50;;;;;;;0.28;0.28;C;C;1977-08-00419
500;"SAINT-BONNET-EN-CHAMPSAUR (05) 07.08.1977";Hautes-Alpes;05;"(D) Département";1977;08;07;"La gendarmerie est alertée d'une observation rapportée dans la presse locale.<br> Le 7 août 1977 vers 1h 30 du matin, plusieurs personnnes observent un point lumineux au sommet d'une colline puis ils voient apparaître progressivement un grand triangle de couleur orange vif. Vu en totalité l'objet a la forme d'un cône et semble avancer vers eux. Pris de peur les témoins partent en voiture. Le phénomène disparaîtra caché par une haie d'arbres Revenus sur les lieux un peu plus tard avec d'autres personnes, ils n'ont plus rien observé.<br>  Sur les lieux indiqués par les témoins, aucune trace au sol n'a été constatée par la gendarmerie et aucun autre témoignage n'a été recueilli auprés de la population locale.";"Observation d'un phénomène lumineux orange et triangulaire : manque d'informations";O;3;;;;;;;;2016-10-25;;;0.50;0.50;;;;;;;0.28;0.28;C;C;1977-08-00420
501;"ERSTEIN (67) 11.08.1977";Bas-Rhin;67;"(D) Département";1977;08;11;"Suite à un article dans la presse locale indiquant qu'un témoin aurait aperçu dans le ciel un objet volant non identifié, la gendarmerie procède à la recherche d'autres témoins éventuels. Deux témoins retrouvés affirment avoir observé le 11 août 1977 vers 22h30 un objet très brillant et immobile dans le ciel. Observé aux jumelles, l'objet a des sphères émettant une lumière jaune à sa base et une sorte de gyrophare rouge qui clignote.  Il se déplace ensuite lentement sans qu'aucun bruit ne soit entendu avant de disparaître. Ces témoins ont probablement observé le passage d'un aéronef de type hélicoptère.";"Probable observation d'un aéronef.";O;2;;;;;;;;2010-08-23;;;0.38;0.13;;;;;;;0.65;0.35;B;B;1977-08-00421
502;"LILAS (LES) (93) 12.08.1977";Seine-Saint-Denis;93;"(D) Département";1977;08;12;"Le 12 août 1977 vers 23h un témoin observe dans le ciel une forme allongée peu épaisse,immobile et très lumineuse. Ce phénomène disparaît à très grande vitesse en direction du Sud-Ouest au bout de quelques secondes. Aucun autre témoignage ne sera recueilli sur ce phénomène pour lequel nous manquons d'informations.";"Observation d'un phénomène lumineux. Disparition à très grande vitesse.";O;1;;;;;;;;2010-08-23;;;0.50;0.50;;;;;;;0.28;0.28;C;C;1977-08-00422
503;"CHAUSSIN (39) 15.08.1977";Jura;39;"(D) Département";1977;08;15;"Suite à un article dans la presse locale, deux témoins sont entendus sur leur observation du 15 août 1977 vers 0h05 d'un objet lumineux en forme de boule venant du Sud-Ouest. Il se déplace lentement à faible altitude, s'arrête quelques secondes et part vers le Nord-Est à une vitesse plus élevée. Aucun bruit ne sera entendu durant l'observation de plusieurs minutes.  Aucun autre témoignage ne sera recueilli sur ce phénomène pour lequel nous manquons d'informations.";"Observation du  déplacement d'une sphère lumineuse.";O;2;;;;;;;;2010-08-23;;;0.50;0.50;;;;;;;0.28;0.28;C;C;1977-08-00423
504;"NANCY (54) 26.08.1977";Meurthe-et-Moselle;54;"(D) Département";1977;08;26;"Le 26 août 1977 vers 20h15 plusieurs personnes observent entre deux arbres un objet lumineux immobile et silencieux. Le phénomène sera observé aux jumelles avant de disparaître brusquement.";"Observations d'un objet lumineux stationnaire et silencieux.";O;3;;;;;;;;2010-08-25;;;0.50;0.50;;;;;;;0.28;0.28;C;C;1977-08-00425
506;"POUZAUGES (85) --.--.1977";Vendée;85;"(D) Département";1977;--;--;"Témoignage récent (12/07/2009) d'une observation ancienne : durant l'été 1977 (le témoin ne se souvient plus de la date exacte entre juin et août 1977), des personnes ont observé de nuit un objet lumineux dans le ciel. D'abord stationnaire, il s'est ensuite déplacé à des vitesses irrrégulières en changeant de direction. Puis il a disparu à grande vitesse vers l'Ouest. Aucun autre témoignage n'a été recueilli sur ce phénomène. Toute enquête aujourd'hui est difficile voir impossible sur ce phénomène pour lequel nous manquons d'informations.";"Observation de déplacements particuliers d'un phénomène lumineux.";O;1;;;;;;;;2010-04-02;;;0.50;0.50;;;;;;;0.28;0.28;C;C;1977-08-02483
508;"MACHILLY (74) 01.09.1977";Haute-Savoie;74;"(D) Département";1977;09;01;"D'après un courrier reçu par la gendarmerie, un témoin en vacances aurait vu le 1er septembre 1977 à 20h15 les déplacements de trois objets de la forme d'un uf légèrement applati. De couleur brillante,  ils émettaient des rayons lumineux.  Aucun autre témoignage ne sera recueilli sur le secteur d'observation, secteur par ailleurs régulièrement survolé par des avions provenant de deux aérodromes à proximité. Le témoin a probablement fait une observation d'aéronef.";"Probable observation d'un aéronef.";O;1;;;;;;;;2017-02-23;;;0.38;0.13;;;;;;;0.65;0.35;B;B;1977-09-00427
509;"TOUR-DE-SALVAGNY (LA) (69) 04.09.1977";Rhône;69;"(D) Département";1977;09;04;"Le 4 septembre 1977 vers 23h deux personnes observent dans le ciel un phénomène inhabituel. Une boule blanche très lumineuse se déplace à vive allure. Elle disparaît de la vue des témoins en s'éloignant. Aucun bruit n'est entendu durant l'observation qui a duré quelques secondes. Aucune constatation n'a pu être faite par la gendarmerie sur ce phénomène pour lequel nous manquons d'informations.";"Observation du passsage d'un objet lumineux. Aucun bruit.";O;1;;;;;;;;2010-08-30;;;0.50;0.50;;;;;;;0.28;0.28;C;C;1977-09-00428
512;"ISLE-SUR-SEREIN (89) 13.09.1977";Yonne;89;"(D) Département";1977;09;13;"Suite à un article de presse relatant l'observation par trois témoins d'un ""OVNI"", une enquête est ouverte. La gendarmerie retrouve un témoin qui affirme que le 13 septembre 1977 vers 21h30, elle a observé le déplacement N-S d'une lueur rougeâtre. Aucun bruit n'a été entendu durant l'observation. Aucune traînée sur le passage n'a été observée. Le deuxième témoin reste introuvable. Un troisième témoin sera entendu mais déclarera avoir observé un objet ovale blanc et lumineux dans les nuages le 07 septembre 1977 vers 07 heure du matin. Aucun autre témoignage concernant le phénomène du 13 septembre ne sera recueilli.";"Observation du déplacement d'un phénomène lumineux.";O;2;;;;;;;;2010-09-22;;;0.50;0.50;;;;;;;0.28;0.28;C;C;1977-09-00431
514;"MALAUCENE (84) 18.09.1977";Vaucluse;84;"(D) Département";1977;08;--;"Le 18 septembre 1977 entre 22h30 et 22h35 deux témoins observent le passage  NNE-SSO d'un phénomène lumineux de couleur orange-feu . Les témoins ont le temps de voir une forme rectangulaire qui disparaît rapidement derrière une colline. Un troisième témoin indiquera que ce jour là il n'a rien constaté mais que trois semaines auparavant il a vu une lumière importante derrière une autre colline.<BR> Aucun autre témoignage ne sera recueilli et aucune trace ne sera découverte dans les secteurs présumés de la disparition de ces phénomènes pour lesquels nous manquons d'informations.";"Observations de phénomènes lumineux.";O;3;;;;;;;;2013-04-11;;;0.50;0.50;;;;;;;0.28;0.28;C;C;1977-09-00433
515;"ISTRES (13) 23.09.1977";Bouches-du-Rhône;13;"(D) Département";1977;09;23;"Le 23 septembre 1977 vers minuit, une personne promenant son chien aperçoit durant une minute dans le ciel deux engins de forme circulaire. Le dessous est blanc lumineux et de dessus plus foncé. Les engins se dirigent dans le sens NO-SE sans aucun bruit. Ils amorceront un virage avant de prendre de l'altitude à grande vitesse et de disparaître.<br> Aucun écho imprévu ne sera capté au cours de la nuit à la tour de contrôle de la base aérienne d'Istres. Aucun autre témoignage ne sera recueilli.";"Observation du passage de deux engins.";O;1;;;;;;;;2011-04-29;;;0.50;0.50;;;;;;;0.28;0.28;C;C;1977-09-00434
516;"YONNE (89) 30.09.1977";Yonne;89;"(D) Département";1977;09;26;"Dans la soirée du 30 septembre 1977 de nombreuses personnes observent dans le ciel la présence d'objets évoluant très lentement à haute altitude et émettant des lumières clignotantes de couleurs. Les faits se sont produits au-dessus de la ville de Sens et dans la région de Brienon-sur-Armancon dans l'Yonne.<br> Il est probable que le phénomène observé soit un important trafic de circulation aérienne générale inhabituelle dans la région et dû à l'activation du circuit d'attente de Sens.";"Probable observations d'aéronefs en circuit attente d'attérissage.";O;28;;;;;;;;2010-09-27;;;0.37;0.13;;;;;;;0.65;0.35;B;B;1977-09-00435
518;"CONFLANS-SAINTE-HONORINE (78) 05.09.1977";Yvelines;78;"(D) Département";1977;09;05;"Le 5 septembre 1977 entre 22h30 et 23h15, trois personnes observent durant plusieurs minutes un phénomène insolite dans le ciel. Tous les témoins décrivent les évolutions d'une boule lumineuse rouge-orangé qui, selon les témoins, reste immobile ou se déplace de droite à gauche et de haut en bas avant de prendre une trajectoire descendante et de disparaître.<br> Aucune trace au sol n'a été retrouvée dans le secteur. Ce phénomène semble avoir suivi une trajectoire NE-O.<br> Trop peu de précisions ont été données pour valider une hypothèse particulière. Ce cas est classé C par manque d'information.";"Observations d'un phénomène rouge-orangé dans le ciel.";O;3;;;;;;;;2011-05-30;;;0.50;0.50;;;;;;;0.28;0.28;C;C;1977-09-02761
519;"SARTHE (72) 02.10.1977";Sarthe;72;"(D) Département";1977;10;02;"Le 2 octobre 1977 entre 21h 50 et 22h des automobilistes dans deux secteurs différents du départements de la Sarthe observent dans le ciel un phénomène lumineux qu'ils ne s'expliquent pas. L'objet est de forme ronde, légèrement applati sur le dessus. Il est de couleur orangé.<br> Ce cas a été initialement classé « C » par le SEPRA par manque d'information, puis ré-analysé en 2013 par un internaute qui a proposé une explication au GEIPAN, explication qui a été validée.<br> Ce cas d'observation est un cas typique de « boule suiveuse » : effet constaté lorsque les témoins voient un point ou disque lumineux  qui semble les accompagner pendant qu'ils se déplacent : en fait, cet objet très lointain est toujours dans la même direction géographique, et c'est généralement un astre. Le témoignage est très consistant avec deux groupes de témoins indépendants qui ont déposé leur témoignage en gendarmerie. Le phénomène observé est peu étrange, car fortement ressemblant à la lune<br> Le GEIPAN classe ce cas « A » : observation de la Lune.";"Observation d'un phénomène lumineux orangé semblant suivre les automobilistes : observation astronomique de la Lune.";O;4;;;;;;;;2014-09-10;;;0.13;0.13;;;;;;;0.53;0.48;A;A;1977-10-00436
521;"ESTANG (32) 08.10.1977";Gers;32;"(D) Département";1977;03;--;"Le 8 octobre 1977 à minuit et demi un automobiliste et sa passagère sont surpris par un objet lumineux qui semble survoler leur véhicule et qui se pose dans un champ en bordure de route. L'engin de forme arrondie est muni de deux tuyères crachant des flammes illuminant tout l'horizon. Les témoins restent très choqués par leur observation.<br>  Suite à l'enquète de gendarmerie, les témoins reconnaîtront avoir été trompés par deux torchères allumées et projetant, par instants et selon l'orientation du vent, de hautes flammmes vers le ciel. Ces torchères font partie d'une station de gaz et sont situées sur la crête d'un champs, lieu approximatif de l'observation faite par les deux témoins.";"Observation d'un objet brillant indentifié : effet d'optique dû à deux torchères allumées.";O;3;;;;;;;;2011-05-18;;;0.13;0.13;;;;;;;0.53;0.48;A;A;1977-10-00438
522;"SAINT-PORCHAIRE (17) 09.10.1977";Charente-Maritime;17;"(D) Département";1977;10;09;"Le 9 octobre 1977 à partir de 20h30 et jusqu'à 23h30 plusieurs personnes dont des gendarmes observent les évolutions d'un phénomène lumineux de couleurs variées non-conforme aux étoiles. Un autre phénomène lumineux sera observé toujours le même jour  vers 21h par un témoin. Celui-ci relate une observation au sol  de deux jets lumineux intensément blancs et symétriques. Une troisième observation le 12 octobre 1977 à 19h45 sera rapportée : un témoin observera deux secondes un phénomène illuminant tout son environnement et constitué de jets  lumineux de couleurs comme un soleil de feu d'artifice. L'enquête de gendarmerie ne fait pas de rapprochement entre les observations pour lesquelles nous manquons d'informations.";"Observations de phénomènes lumineux.";O;4;;;;;;;;2007-03-22;;;0.50;0.50;;;;;;;0.28;0.28;C;C;1977-10-00439
523;"SAINT-AUBIN-DE-MEDOC (33) 12.10.1977";Gironde;33;"(D) Département";1977;10;12;"Le 12 octobre 1977 à 5h 45 un automobiliste observe dans le ciel un objet entouré d'un halo orangé animé de vibrations ou d'oscillations.<br> Aucun autre témoignage ne sera recueilli sur ce phénomène par la gendarmerie ou l'observatoire de Floirac (33). Bien que le témoignage soit très succinct, cette personne a probablement observé au travers d'un nuage le soleil levant (levé ce jour à 5h20).";"Probable observation d'un effet d'optique lié au soleil levant.";O;1;;;;;;;;2010-10-14;;;0.38;0.13;;;;;;;0.65;0.35;B;B;1977-10-00440
526;"CHAMPS-SUR-TARENTAINE-MARCHAL (15) 18.10.1977";Cantal;15;"(D) Département";1977;10;18;"Le 18 octobre 1977 à 0h24 un témoin observe durant 4 minutes un point lumineux dans le ciel qui se rapproche, effectue une large courbe en perdant de l'altitude et semble s'immobiliser au-dessus d'une colline. Le témoin raconte qu'il voit alors la masse sombre d'un engin avec un hublot circulaire éméttant une lumière vive bleue et orange. Au bout de dix secondes, il disparaitra instantanément.<br> Malgré l'enquête de gendarmerie, aucun autre témoignage ne sera recueilli.";"Observation du déplacement d'un engin inconnu.";O;1;;;;;;;;2011-05-18;;;0.50;0.50;;;;;;;0.28;0.28;C;C;1977-10-00443
528;"WASSY (52) 21.10.1977";Haute-Marne;52;"(D) Département";1977;10;21;"Le 21 octobre 1977 vers 18h30 un témoin observe durant  quelques secondes le passage d'un phénomène lumineux. Une boule de couleur jaune et clignotante se déplace sur une trajectoire Ouest-Est. Aucune trainée et aucun bruit ne seront constatés.<br> L'enquête de gendarmerie ne recueillera aucun autre témoignage sur ce phénomène. Un temps particulièrement orageux et avec de nombreux éclairs sévira sur toute la région ce jour là.";"Observation du passage d'une boule lumineuse clignotante.";O;1;;;;;;;;2010-10-20;;;0.50;0.50;;;;;;;0.28;0.28;C;C;1977-10-00445
529;"GUISE (02) 24.10.1977";Aisne;02;"(D) Département";1977;10;24;"Le GEIPAN continue à publier l'ensemble de ses archives. Dans ses publications, figurent des cas anciens classés à l'époque en cas de type « C » et qui font aujourd'hui l'objet d'un réexamen, dans le seul but d'être plus pertinent dans les conclusions. Grâce à de nouveaux moyens techniques (logiciels) et à l'expérience d'enquête acquise depuis toutes ces dernières années, ce réexamen aboutit quelquefois à de nouvelles remarques voire à un changement de classification explicité dans une note d'enquête. Ce cas d'observation fait partie de cas classés « C » réexaminés (voir le document Notes d'enquête).<br> Le 24 octobre 1977 entre 17h15 et 18h00 (les heures varient selon les témoins), trois habitants de GUISE (02) observent à l'horizon la présence d'une boule de couleur rouge ou feu de laquelle se dispersent des flammèches. L'observation dure de cinq à dix minutes au bout desquelles le PAN disparaît progressivement à l'horizon.<br>  Les témoins déposent en gendarmerie les 25 et 27 octobre. En patrouille plusieurs jours de suite, les gendarmes ne constateront aucun fait anormal et ne recueilleront aucun autre témoignage. Le cas a fait l'objet d'un article de presse paru dans le journal L'Union le 26 octobre 1977 (voir le document Notes d'enquête).<br>  Ce cas est consistant (trois témoins), la description du PAN observé est assez précise. La sincérité et la crédibilité des témoins n'ont jamais été mises en doute.<br> Le phénomène décrit présente beaucoup de caractéristiques communes (durée d'observation, forme, taille, couleur) avec un objet astronomique parfaitement connu : le Soleil au coucher. En effet, le Soleil était effectivement en train de se coucher dans l'axe que les témoins indiquent.<br>  Ce n'est pas la perception visuelle des témoins qui est en cause, mais l'interprétation que les témoins font de leur observation à travers leur ressenti (étonnement).<br>   Dans la classification actuelle du GEIPAN, ce cas d'étrangeté faible est classé comme PAN A, observation liée avec une méprise avec le Soleil au coucher.";"Observations d'un phénomène lumineux rouge à l'horizon : méprise avec le Soleil au coucher.";O;3;;;;;;;;2015-11-24;;;0.13;0.13;;;;;;;0.53;0.48;A;A;1977-10-00446
530;"KOUROU (973) 27.10.1977";Guyane;973;"(D) Département";1977;10;27;"Le 27 octobre 1977 vers 6h deux personnes aperçoivent quelques secondes dans le ciel une boule de feu rouge suivie d'une longue trainée rouge et orangée. Ce phénomène se déplace d'Est en Ouest à très grande vitesse et disparaît brusquement dans le ciel. Aucun bruit n'est entendu.<br> Ces témoins ont probablement observé une rentrée atmosphérique.";"Probable observation d'une rentrée atmosphérique.";O;2;;;;;;;;2010-10-20;;;0.38;0.13;;;;;;;0.65;0.35;B;B;1977-10-00447
531;"BRETEUIL-SUR-ITON (27) 28.10.1977";Eure;27;"(D) Département";1977;10;28;"La gendarmerie est informée par voie de presse que différentes personnes ont observé plusieurs fois de suite un phénomène lumineux dans le ciel. Les descriptions des témoins varient quant à la description même du phénomène (boule ou lueur, de la couleur (blanche et rouge) clignotante ou non, se déplaçant ou stationnaire.<br> Les services de surveillance aérienne de la base 105 à Evreux-Fauville n'ont remarqué aucun phénomène particulier dans le ciel le 28 octobre 1977. Aucun autre témoignage n'a été recueilli par la gendarmerie sur ce phénomène. Ces personnes ont probablement fait une observation astronomique.";"Probable observation astronomique.";O;5;;;;;;;;2010-10-20;;;0.38;0.13;;;;;;;0.65;0.35;B;B;1977-10-00448
533;"CONDE-SUR-ESCAUT (59) 02.10.1977";Nord;59;"(D) Département";1977;10;02;"Le 2 octobre 1977 en fin de journée une agricultrice dans un champs est survolée un très court instant par un objet sphérique lumineux. D'autres personnes observeront une lueur inhabituelle à l'extrémité du champs où se situait la cultivatrice. La gendarmerie prévenue trois jours plutard ne constatera aucune trace au sol dans la zone indiquée par les témoins et aucun autre témoignage n'a été recueilli pouvant apporter davantage de précisions.";"Observation du passage d'une boule lumineuse. Lueur au sol.";O;4;;;;;;;;2010-09-30;;;0.50;0.50;;;;;;;0.28;0.28;C;C;1977-10-02653
534;"SAINT-MARS-D'OUTILLE (72) 08.10.1977";Sarthe;72;"(D) Département";1977;10;08;"Le 8 octobre 1977 entre minuit trente et une heure du matin, une personne en cyclomoteur observe le passage d'un engin qu'il ne reconnaît pas. Il  a une base plate surmontée d'une forme arrondie ; l'engin est entièrement illuminé à sa base par des feux jaunes entourant un feu rouge plus gros au centre. Le témoin effrayé relate qu'il sera suivi pendant trois kilomètres jusqu'à son domicile. L'engin s'immobilisera ensuite au-dessus de sa maison avant de repartir à très grande vitesse.<br> La description des lumières laisse à penser que ce témoin a probablement observé le passage d'un aéronef de type hélicoptère.";"Probable observation d'un aéronef.";O;1;;;;;;;;2010-10-13;;;0.38;0.13;;;;;;;0.65;0.35;B;B;1977-10-02656
535;"CASSIS (13) 09.10.1977";Bouches-du-Rhône;13;"(D) Département";1977;10;09;"Le 09 octobre 1977 vers 19h15 deux militaires en faction observent dans le ciel les évolutions d'un objet de forme ovale qui se déplace N-S. L'objet monte et descend à faible allure laissant une trainée phosphorescente derrière lui. Aucun bruit ne sera entendu durant l'observation qui dure entre 5 et 7 minutes.<br>  Quelques années auparavant une observation similaire avait été rapportée : à l'époque il s'agissait de ballons-sonde lancés depuis la base aérienne d'Istres (13).<br>";"Observation du passage d'un objet lumineux avec trainée phosphorescente.";O;2;;;;;;;;2010-11-25;;;0.50;0.50;;;;;;;0.28;0.28;C;C;1977-10-02657
536;"KOUROU (973) 16.10.1977";Guyane;973;"(D) Département";1977;10;16;"Le 16 octobre 1977 à 6 h un témoin observe depuis son balcon le déplacement de gauche à droite d'un objet brillant. Prenant rapidement de l'altitude il disparaît dans le ciel. Aucun autre témoignage ne sera recueilli sur ce phénomène pour lequel nous manquons d'informations.";"Observation du déplacement d'un objet brillant dans le ciel.";O;1;;;;;;;;2010-10-15;;;0.50;0.50;;;;;;;0.28;0.28;C;C;1977-10-02660
537;"BENQUET (40) 16.10.1977";Landes;40;"(D) Département";1977;10;16;"Le 16 octobre 1977 vers 3h30 un automobiliste et sa passagère observent le passage O-E d'un objet circulaire de couleur. Le déplacement se fait à haute altitude et à grande vitesse. La trajectoire est curviligne et l'objet a disparu derrière la végétation. Aucun signe de parasitage n'est remarqué dans le véhicule.<br> Aucun autre témoignage ne sera recueilli sur ce phénomène.";"Observation du passage d'un objet circulaire : trajectoire curviligne.";O;1;;;;;;;;2010-10-15;;;0.50;0.50;;;;;;;0.28;0.28;C;C;1977-10-02661
538;"BETHENY (51) 21.10.1977";Marne;51;"(D) Département";1977;10;21;"Le 21 octobre 1977 vers 17h15 deux témoins observent le passage d'un objet de forme allongé dans le ciel. Lumineux et de plusieurs couleurs, l'objet se déplace en laissant derrière lui une lueur qui s'atténue. Il disparaît rapidement caché par le paysage.<br> Aucun autre témoignage ne sera recueilli sur ce phénomène pour lequel nous manquons d'informations.";"Observation du passage d'un objet de forme allongée.";O;2;;;;;;;;2010-10-20;;;0.50;0.50;;;;;;;0.28;0.28;C;C;1977-10-02665
539;"BOURAIL (988) 21.10.1977";Nouvelle-Calédonie;988;"(D) Département";1977;10;21;"Le 21 octobre 1977 vers 18h30 deux personnes observent le déplacement horizontal vers l'Est d'un phénomène lumineux de forme arrondie. Le phénomène disparaît rapidement dans la masse nuageuse. Aucun bruit n'a été entendu.<br> Aucun autre témoignage ne sera recueilli sur ce phénomène pour lequel nous manquons d'informations.";"Déplacement rapide d'un phénomène lumineux dans le ciel.";O;2;;;;;;;;2010-10-20;;;0.50;0.50;;;;;;;0.28;0.28;C;C;1977-10-02666
543;"SAINT-SEBASTIEN-DE-MORSENT (27) 04.11.1977";Eure;27;"(D) Département";1977;11;04;"Un témoin raconte avoir observé le 4 novembre 1977 vers 18h15 le passage SO-NE d'une boule lumineuse.<br> Aucun phénomène de ce genre ne sera observé par la station météorologique et radar de la B.A 105 à Evreux. La presse régionale fera état de l'observation par deux autres personnes de ce phénomène pour lequel nous manquons d'information.";"Observation du passage d'une boule lumineuse.";O;1;;;;;;;;2010-10-27;;;0.50;0.50;;;;;;;0.28;0.28;C;C;1977-11-00452
544;"CHENOVE (21) 10.11.1977";Côte-d'Or;21;"(D) Département";1977;11;10;"Le 10 novembre 1977 à 7h15 deux personnes depuis leur domicile constatent dans le ciel un point lumineux immobile qui les intrigue. Vers 7h 35 l'objet se met en mouvement et les témoins observent alors un objet de couleur grisâtre, de forme oblongue parfaitement lisse suivi d'un panâche s'effaçant rapidement. La vitesse de l'objet s'accélère et l'objet disparaît rapidement derrière une colline vers 7h40. Aucun bruit n'est entendu  durant toute l'observation.<br> Aucune observation particulière ne sera faite à la tour de contrôle de la base aérienne et à la station météo de Dijon-Longvic où les conditions de visibilité au moment donné étaient assez médiocres.<br< Un témoin supplémentaire sera retrouvé sans pouvoir apporter cependant des précisions importantes sur le phénomène observé. D'après la description sérieuse faite par le témoin principal, ces personnes ont probablement observé un ballon sonde météo.";"Probable observation d'un ballon sonde météo.";O;2;;;;;;;;2010-10-27;;;0.38;0.13;;;;;;;0.65;0.35;B;B;1977-11-00453
545;"CHALONS-SUR-MARNE (51) 12.11.1977";Marne;51;"(D) Département";1977;11;12;"Le 12 novembre 1977 vers 16h53 deux personnes observent dans le ciel un objet lumineux de fome allongée d'abord stationnaire puis s'élevant progressivement dans les airs avant de disparaître instantanément dans les nuages. Aucun bruit particulier n'a été entendu durant l'observation qui a duré plus de vingt secondes Aucune manuvre militaire particulière n'a été effectuée sur le camp militaire ce jour là.<br> Ces témoins ont probablement observé le passage d'un ballon sonde météo éclairé par le soleil couchant.";"Probable observation d'un ballon météo.";O;2;;;;;;;;2010-10-27;;;0.38;0.13;;;;;;;0.65;0.35;B;B;1977-11-00454
546;"LES ANDELYS (27) 15.11.1977";Eure;27;"(D) Département";1977;11;15;"Le 15 novembre 1977 vers 6h45 un témoin en cyclomoteur aperçoit tout à coup dans le ciel un engin de forme allongée se déplaçant rapidement vers le NO. Quelques instants plus tard, le témoin constate l'éclatement de l'engin en une gerbe d'étincelles retombant vers le sol et laissant apparaître une boule de plusieurs couleurs qui poursuit la même direction avant de disparaître complètement. Aucun bruit particulier ne sera entendu durant l'observation. Un autre témoin à la même heure apercevra un phénomène lumineux suivi d'une longue trainée de plusieurs couleurs.<br> La gendarmerie ne trouvera aucune trace au sol dans le secteur concerné. Aucun autre témoignage ne sera recueilli sur ce phénomène. Ces témoins ont probablement assisté à une rentrée atmosphérique.";"Probables observations d'une rentrée atmosphérique.";O;2;;;;;;;;2010-10-28;;;0.38;0.13;;;;;;;0.65;0.35;B;B;1977-11-00455
548;"NANCY (54) 24.11.1977";Meurthe-et-Moselle;54;"(D) Département";1977;11;24;"Le 24 novembre 1977 à 7h20 un témoin observe le passage d'un objet de forme ovale de la grosseur d'un ballon de rugby. Il émet une lumière brillante et se déplace selon une trajectoire Est-Nord avant de faire demi tour, de revenir en sens contraire sur la même distance pour disparaître caché par le paysage urbain. L'observation a duré environ trente secondes sans qu'aucun bruit particulier ne soit entendu.<br> Aucun autre témoignage ne sera recueilli sur ce phénomène pour lequel nous manquons d'informations.";"Observation du passage d'un objet ovale. Changement de direction.";O;1;;;;;;;;2010-11-03;;;0.50;0.50;;;;;;;0.28;0.28;C;C;1977-11-00457
549;"SAINTE-CEROTTE (72) 26.11.1977";Sarthe;72;"(D) Département";1977;11;26;"Le 26 novembre 1977 vers 18h30 un automobiliste et sa passagère observent un phénomène lumineux qui les intrigue. Tout au long de leur trajet, le phénomène sera aperçu changeant de forme mais gardant sa couleur rouge-orangé. Il ne semble pas se déplacer.<br> Aucun autre témoignage ne sera recueilli sur ce phénomène pour lequel nous manquons de précisions.";"Observation d'un phénomène lumineux.";O;2;;;;;;;;2016-10-25;;;0.50;0.50;;;;;;;0.28;0.28;C;C;1977-11-00458
550;"COSNES-ET-ROMAIN (54) 30.11.1977";Meurthe-et-Moselle;54;"(D) Département";1977;11;30;"Le 30 novembre 1977 vers 17h35 un automobiliste aperçoit plusieurs fois sur son trajet un phénomène lumineux. Celui-ci est  composé de deux boules blanches très lumineuses entre lesquelles de nombreux points lumineux semble délimiter un appareil. Il se déplace à différentes altitudes et change de direction sans qu'aucun bruit particulier ne soit entendu. Aucun clignotement n'est remarqué sur les lumières. Aucune interférence sur la radio et sur le véhicule n'est constatée par le témoin qui perdra de vue le phénomène.<br> Aucun autre témoignage ne sera recueilli.";"Observation d'un objet délimité par des lumières.";O;1;;;;;;;;2010-11-04;;;0.50;0.50;;;;;;;0.28;0.28;C;C;1977-11-00459
551;"PARIS (75) 04.11.1977";Paris;75;"(D) Département";1977;11;04;"Le 4 novembre 1977 un témoin dans un bus observe très rapidement le déplacement sans changement d'altitude d'un objet ovoîde. L'objet disparaît rapidement caché par le paysage urbain.<br> Aucun renseignement ne sera recueilli auprés de l'observatoire de Paris sur ce phénomène pour lequel nous manquons d'information.";"Observation du passage d'un objet lumineux blanc.";O;1;;;;;;;;2010-10-27;;;0.50;0.50;;;;;;;0.28;0.28;C;C;1977-11-02667
552;"KOUROU (973) 10.11.1977";Guyane;973;"(D) Département";1977;11;10;"Le 10 novembre 1977 vers 19h des témoins dans un restaurant de Kourou observent durant un quart d'heure un objet lumineux effectuant des figures géométriques dans le ciel. Il disparaît en descendant en spirale.<br> Aucun mouvement d'avion et aucun lancement de ballon ou fusée sonde n'ont été signalés pour ce jour.<br> Un témoin se présentera à la brigade le 11 novembre 1977 pour signaler que la veille, à l'heure des faits pré-cités, il a vu atterrir, sur le parking d'un hotel de la ville, un cerf-volant muni d'une pile. Malgré les recherches entreprises, le propriétaire du cerf-volant n'a pas été retrouvé.";"Observation d'un cerf-volant.";O;3;;;;;;;;2010-10-27;;;0.13;0.13;;;;;;;0.53;0.48;A;A;1977-11-02668
554;"MONTMORILLON (86) 19.11.1977";Vienne;86;"(D) Département";1977;11;19;"Le 19 novembre 1977 vers 1h05 un automobiliste et sa passagère aperçoivent une boule de couleur rouge-orangée qui se déplace et se rapproche. Le conducteur s'arrête et le phénomène reste immobile dans une prairie à 1mètre 50 du sol et à une trentaine de mètres de la voiture. Aucun bruit n'est entendu. Le conducteur effrayé décide de reprendre sa route et de changer d'itinéraire mais il rencontrera plusieurs fois le phénomène au cours de son périple. Le phénomène a été vu durant un quart d'heure et sur neuf kilomètres par les automobilistes avant de disparaître<br> Aucune trace ou indice n'ont été retrouvés dans les différents lieux où a été observé le phénomène. Aucun phénomène particulier n'a été constaté par le responsable de l'observatoire de Floirac. Aucune manuvre militaire n'a été faite cette nuit là. <br> Aucune intervention de quelque nature que ce soit n'a été faite sur la ligne à haute tension et les transformateurs situés à proximité des routes empruntées par le conducteur. Néanmoins il est probable que la manisfestation observée puisse être attribuée à un phénomène électrique étant donné qu'elle a été vue progressant toujours à proximité de matériels conduisant et transformant de l'électricité.";"Probable observation d'un phénomène électrique.";O;2;;;;;;;;2017-12-06;;;0.38;0.13;;;;;;;0.65;0.35;B;B;1977-11-02670
556;"SAINT-CLAUDE (39) 07.12.1977";Jura;39;"(D) Département";1977;12;04;"Le 7 décembre 1977 vers 18h45 plusieurs personnes observent le passage d'un phénomène lumineux dans le ciel. Il se déplace d'Ouest en Est sans qu'aucun bruit particulier ne soit entendu. Le phénomène apparaît comme une forme allongée émettant une lumière blanche. Puis sur sa trajectoire cette forme fait place à un point lumineux rouge qui s'estompe progressivement et disparaît.<br> Au cours de l'enquête, la gendarmerie ne trouvera aucune trace au sol du passage du phénomène. Un témoin rapportera avoir vu également le 4 décembre vers 22h15 le passage d'une boule de couleur orange dans le ciel. Si ces témoignages s'apparentent aux descriptions d'observations de rentrées atmosphériques, les informations concernant ces phénomènes restent trop imprécises pour valider cette hyphothèse.";"Observation du passage d'un phénomène lumineux.";O;4;;;;;;;;2010-11-05;;;0.50;0.50;;;;;;;0.28;0.28;C;C;1977-12-00461
558;"NATIONAL (975) 13.12.1977";Occitanie;OCC;"(R) Région";1977;12;13;"Le 13 décembre 1977 entre 19h et 19h30 plusieurs témoins dans différentes régions de France ont observé le rapide passage Est-Ouest dans le ciel d'un phénomène lumineux de forme circulaire suivi d'une trainée. La plupart de ces observations ont duré quelques secondes et aucun bruit particulier n'a été entendu.<br> Au vu des descriptions données, ces personnes ont probablement été témoins d'une rentrée atmosphérique.";"Probables observations d'une rentrée atmosphérique.";O;9;;;;;;;;2011-06-09;;;0.38;0.13;;;;;;;0.65;0.35;B;B;1977-12-00463
560;"CARQUEFOU (44) 17.12.1977";Loire-Atlantique;44;"(D) Département";1977;12;17;"Le 17 décembre 1977 vers minuit plusieurs personnes d'une même famille observent quelques secondes sur le pas de la porte de leur domicile le passage d'un phénomène lumineux. Une boule de couleur jaune-orangé qui se déplace du N-E vers le Sud à très grande vistesse. Elle laisse derrière elle une clarté qui illumine la nuit.<br> Ces personnes ont vraissemblablement été témoins d'une rentrée atmosphérique.";"Probable observations d'une rentrée atmosphérique.";O;4;;;;;;;;2010-11-08;;;0.38;0.13;;;;;;;0.65;0.35;B;B;1977-12-00465
561;"SAINTE-CEROTTE (72) 18.12.1977";Sarthe;72;"(D) Département";1977;12;18;"Le 18 décembre 1977 vers une heure vingt du matin, une dizaine de personnes dans un hameau de la commune de Sainte-Cérotte (72) observent un phénomène rouge-orangé dans le ciel. Les témoins ne peuvent évaluer la distance à laquelle se trouve le phénomène et ne s'accordent pas sur sa forme. Mais tous ont remarqué les mouvements (descente et ascension) de l'objet et sa disparition progressive en direction de l'Ouest. Aucun bruit particulier n'a été entendu durant les observations de ce phénomène et aucun autre témoignage n'a été recueilli par la gendarmerie.<br> Ce cas d'observation fait partie de cas classés « C » par le GEPAN sous le nom de SAINT-CALAIS (72) 18.12.1977. Il a fait l'objet récemment d'un réexamen (voir le document Notes d'enquête).<br> Ce cas est consistant (une dizaine de témoins), la description du PAN observé est assez précise. La sincérité et la crédibilité des témoins n'ont jamais été mises en doute. Le phénomène décrit présente beaucoup de caractéristiques communes (durée d'observation, forme, taille, couleur) avec un objet astronomique parfaitement connu : la Lune au coucher. De plus, la Lune était bien présente dans la zone du ciel observée alors que les témoins n'en font pas mention.<br> Ce n'est pas la perception visuelle des témoins qui est en cause, mais l'interprétation que les témoins font de leur observation à travers leur ressenti (fatigue, observation de nuit, mauvaise interprétation de la position de la Lune).<br>  Dans la classification actuelle du GEIPAN, ce cas d'étrangeté moyenne est classé en ""A"", observation liée à une méprise avec la Lune.";"Observations multiples d'un phénomène rouge-orangé dans le ciel et disparition à l'Ouest : méprise avec la Lune au coucher.";O;7;;;;;;;;2014-09-05;;;0.13;0.13;;;;;;;0.53;0.48;A;A;1977-12-00466
563;"POUANCE (49) 20.12.1977";Maine-et-Loire;49;"(D) Département";1977;12;20;"Des observations périodiques d'un objet lumineux sont rapportées. Celles-ci ont eu lieu les 19 décembre vers 22h et  20 décembre à 4h du matin et vers 22h. Les témoins ont observé longuement à chaque fois un objet lumineux qui émetait alternativement des lumières vertes, oranges puis rouges. L'objet se déplacait en faisant des arrêts marqués.<br> Lors de l'enquête de gendarmerie des interférences TV ont été remarquées aux heures d'observations de l'objet en début de nuit. L'hypothèse de l'observatin d'un satellite de communication a été évoquée mais non validée par manque d'informations.";"Observations périodiques d'un objet lumineux : manque d'informations.";O;2;;;;;;;;2007-03-22;;;0.50;0.50;;;;;;;0.28;0.28;C;C;1977-12-00468
565;"BEAUMETTES (84) 31.12.1977";Vaucluse;84;"(D) Département";1977;12;31;"Le 31 décembre 1977 après 19h plusieurs personnes observent dans le ciel un phénomène lumineux orangé qui les intrigue. <br> Une personne ayant appris par son voisinage ces faits relatés dans la presse viendra témoigner en gendarmerie.Il affirme être à l'origine du tir d'un feu d'artifice composé de deux fusées éclairantes et de 4 fusées chinoises le 31 décembre entre 19h et 19h30 pour célébrer la fin de l'année.<br> Un autre témoignage sera recueilli sur une observation le 31 décembre 1977 aux environs de 17h. Un automobiliste apercevra dans le ciel un objet immobile dans le ciel rapidement perdu de vue. Ce témoignage reste succinct et aucun autre témoignage sur ce phénomène ne pourra apporter un complément d'information.";"Observations de lueurs de feu d'artifice.";O;4;;;;;;;;2007-03-22;;;0.13;0.13;;;;;;;0.53;0.48;A;A;1977-12-00470
567;"[D109] DE CHEMILLA (39) VERS SAINT-JULIEN-SUR-SURAN (39) 19.12.1977";Jura;39;"(D) Département";1977;12;19;"Le 19 décembre 1977 vers 2 heures du matin, un automobiliste observe, tout en circulant sur la D109, un phénomène lumineux dans le ciel. Le PAN (phénomène aérospatial non identifié) en forme de boule dont la partie supérieure est plane, émet une lueur blanchâtre et semble stationnaire au-dessus d'une vallée. Le témoin décide d'aller dans cette direction et constate que le PAN se déplace à une allure modéré en direction de l'Ouest. Il suivra le PAN une trentaine de minutes sans jamais le rattraper. Aucun autre témoignage n'a été recueilli par la gendarmerie sur ce phénomène.<br> Ce cas d'observation anciennement nommé Arinthod (39) du nom de la gendarmerie fait partie des cas classé ""C"" par manque d'informations et qui sont aujourd'hui réexaminés (voir le document Notes d'enquête).<br> Ce cas est assez consistant (un témoin, accompagné d'un chien qui réagit à la présence du PAN), la description du PAN observé est assez précise. La sincérité et la crédibilité du témoin n'ont jamais été mises en doute. Le phénomène décrit présente beaucoup de caractéristiques communes (durée d'observation, forme, taille, couleur) avec un objet astronomique parfaitement connu : la Lune au coucher. De plus, la Lune était bien présente dans la zone du ciel observée alors que le témoin n'en fait pas mention.Ce n'est pas la perception visuelle du témoin qui est en cause, mais l'interprétation que le témoin fait de son observation à travers son ressenti (fatigue, conduite de nuit). <br>  Dans la classification actuelle du GEIPAN, ce cas d'étrangeté moyenne est classé en ""A"" : observation liée avec une méprise avec la Lune gibbeuse.";"Observation dans le ciel d'un phénomène lumineux en forme de boule dont la partie supérieure est plane : méprise Lune gibbeuse.";O;1;;;;;;;;2014-09-05;;;0.13;0.13;;;;;;;0.53;0.48;A;A;1977-12-02675
568;"HURE (33) 01.01.1978";Gironde;33;"(D) Département";1978;01;01;"Le 1er janvier 1978 vers 17h15 un agriculteur observe au Sud-Ouest dans le ciel une lueur de couleur orange clignotante. Celle-ci se déplace lentement en direction du SUD. L'observation a duré deux minutes.  Aucun autre témoignage n'a été recueilli sur ce phénomène pour lequel nous manquons d'informations.";"Observation d'un objet se déplaçant lentement .";O;1;;;;;;;;2008-10-01;;;0.50;0.50;;;;;;;0.28;0.28;C;C;1978-01-00471
571;"GUEBLING (57) 07.01.1978";Moselle;57;"(D) Département";1978;01;07;"Le 7 janvier 1978 vers 4h 50 un témoin circulant à cyclomoteur aperçoit trois lumières très vives au ras du sol. Une de ces lumières très puissante se détache du groupe pour se rapprocher du témoin et le suivre jusqu'à l'entrée du village voisin avant de disparaître. Aucun bruit n'a été entendu. Aucun vol d'hélicoptère n'a été effectué dans ce secteur cette nuit là. Ce phénomène n'a pas été identifié.";"Observation de lueur vive semblant suivre le témoin.";O;1;;;;;;;;2008-10-01;;;0.75;0.25;;;;;;;0.78;0.23;D;D;1978-01-00474
573;"GUIPEL (35) 13.01.1978";Ille-et-Vilaine;35;"(D) Département";1978;01;13;"Ce cas d'observation a fait l'objet d'un nouvel examen (voir le document Notes d'enquête).<br> Le 13 janvier 1978 vers 17h40 une automobiliste puis son mari observent le lent déplacement d'un phénomène lumineux de forme rectangulaire et de couleur rouge orangé dans le ciel ; la présence d'un halo sur les grands cotés du rectangle est remarquée. Aucun bruit particulier n'est entendu durant les phases d'observation. Aucune trace au sol ne sera retrouvée et aucun autre témoignage ne sera recueilli par la gendarmerie sur ce phénomène.<br> Ce cas est consistant (deux témoins), la description du PAN observé est précise. La sincérité et la crédibilité des témoins n'ont jamais été mises en doute.<br> Le phénomène décrit présente beaucoup de caractéristiques communes (durée d'observation, forme, taille, couleur) avec un phénomène lumineux lié au Soleil : une colonne solaire. De plus, le Soleil venait à peine de se coucher sous l'horizon directement dans l'axe indiqué par les témoins. La saison hivernale et la présence de quelques nuages ont favorisé l'observation d'une colonne solaire.<br> Ce n'est pas la perception visuelle des témoins qui est en cause, mais l'interprétation que les témoins font de leur observation à travers leur ressenti (étonnement, observation d'un phénomène lumineux rare).<br> Dans la classification actuelle du GEIPAN, ce cas d'étrangeté faible est classé comme PAN A, observation liée avec une méprise avec une colonne solaire.";"Observations du lent déplacement d'un phénomène lumineux de forme rectangulaire et de couleur rouge orangé dans le ciel ; présence d'un halo sur les grands cotés du rectangle : observation d'une colonne solaire.";O;2;2;;1;;;;;2015-08-10;;;0.13;0.13;;;;;;;0.53;0.48;A;A;1978-01-00476
574;"DOL DE BRETAGNE(35) 1978";Côtes-d'Armor;22;"(D) Département";1978;01;14;"Le 14 janvier 1978 entre 5h57 et 6h45 plusieurs personnes observent quelques secondes d'importantes lueurs rouges orangées éclairant tous les environs. Deux boules lumineuses orange et bleue seront vues par un automobiliste 500m devant son véhicule. Nous manquons d'informations plus précises sur ce phénomène.";"Observation de lueurs rouges orangées.";O;5;;;;;;;;2008-11-20;;;0.50;0.50;;;;;;;0.28;0.28;C;C;1978-01-00477
575;"DRANCY (93) 1978";Seine-Saint-Denis;93;"(D) Département";1978;01;16;"Le 16 janvier 1978 vers 18h 10 deux témoins observent durant une minute un phénomène circulaire lumineux phosphorescent blanc-jaune. Il se déplace à très grande vitesse du Nord au Sud selon une trajectoire rectiligne. Lors du déplacement ils constatent  que l'objet a une forme cylindrique avec un feu rouge puis qu'une couleur verte lumineuse est visible à l'avant de l'objet. Aucun bruit n'a été entendu lors du déplacement mais le phénomène laisse  une trainée lumineuse.  Aucun autre témoignage n'a été recueilli sur ce phénomène pour lequel nous manquons d'informations.";"Observation du passage d'un phénomène lumineux.";O;2;;;;;;;;2008-10-02;;;0.50;0.50;;;;;;;0.28;0.28;C;C;1978-01-00478
576;"NOUZONVILLE (08) 1978";Ardennes;08;"(D) Département";1978;01;25;"Le 25 janvier 1978 vers 18h 30 sept enfants jouant dans la rue observent le passsage d'un engin orange de forme ovale. Des lumières rouges et blanches placées alternativement clignotent à la base de l'engin. Venant du Sud, il suit une courbe pour aller en direction de l'Ouest à la même altitude que les avions de tourisme. Les avis des enfants divergent sur le bruit entendu lors du passage de l'engin. Aucun autre témoignage n'a été recueilli sur ce passage d'un probable aéronef.";"Probable observation d'un aéronef.";O;6;;;;;;;;2008-10-02;;;0.38;0.13;;;;;;;0.65;0.35;B;B;1978-01-00479
577;"SAINT-CIERS-D'ABZAC (33) 27.01.1978";Gironde;33;"(D) Département";1978;01;27;"Ce cas d'observation fait partie des cas publiés précédemment en « D » sous le nom de GUITRES (33) 27.01.1978. Suite à la remarque d'un correspondant, le GEIPAN a consulté ses archives et a retrouvé sur ce cas un rapport d'enquête du GEPAN concluant à une classification en « A ».<br>  Le 27 janvier 1978, vers 17h45, un couple (T1 et T2) habitant SAINT-CIERS-D'ABZAC (33) observe à travers les vitres de leur maison un objet étrange dans le ciel. Le PAN, de forme plate et ovale et de couleur rouge pâle, semble faire du surplace en direction de la commune de GUITRES (33). Après 4 ou 5 minutes d'observation, le PAN accélère puis disparaît dans le ciel.<br> La gendarmerie mènera une enquête sur place ainsi que dans les communes voisines entre le 29 janvier et le 3 février 1978. Le GEPAN mandatera ensuite deux enquêteurs du CNES qui viendront sur place le 12 avril et concluront dans un premier temps à une classification « D » (inexpliqué), classification qui restera malheureusement dans la base de données du GEIPAN jusqu'au présent document.<br> Le responsable du GEPAN de l'époque complétera ensuite le rapport par sa propre conclusion en catégorie « A » ; ce rapport complémentaire fait figure de leçon d'ufologie scientifique ! <br> Ce cas est très consistant (trois témoins, dont un indépendant des deux autres), la description du PAN observé est assez précise. La sincérité et la crédibilité des témoins n'ont jamais été mises en doute.  Le phénomène décrit présente beaucoup de caractéristiques communes (durée d'observation, forme, couleur) avec la planète Mars, très proche de l'axe indiqué. <br> Dans la classification actuelle du GEIPAN, ce cas d'étrangeté moyenne est classé comme PAN A, observation liée à une méprise avec la planète Mars.";"Observation d'un objet lumineux de forme plate et ovale de couleur rouge pâle ; disparition soudaine : observation liée à une méprise avec la planète Mars.";O;2;;;;;;;;2016-09-05;;;0.13;0.13;;;;;;;0.53;0.48;A;A;1978-01-00480
579;"GORDES (84) 15.01.1978";Vaucluse;84;"(D) Département";1978;01;15;"Témoignage récent (2011) d'une observation ancienne faite le 15 janvier 1978 entre18h45 et 19h10. Les  témoins en voiture sur la D177 entre Venasque et Gordes vont faire plusieurs observations successives de phénomènes lumineux silencieux qu'ils ne s'expliquent pas et seront très impressionnés par ce qu'ils ont vu.<br> La première observation correspond à la planète Jupiter, plein Est (voir carte astro).<br>  Le témoignage correspond ensuite aux caractéristiques des lanternes thaïlandaises : points lumineux en groupe, évoluant dans le sens du vent (de Sud ouest), et durant quelques minutes.  On notera toutefois que le témoin indique des lumières blanches et rouges : même les lanternes blanches émettent plutôt une lumière jaune-orangée. (Très utilisées en Thaïlande pour les fêtes depuis des siècles, ces lanternes sont très répandues en France depuis les années 2000, mais étaient rares à cette époque en France, utilisées par les asiatiques et les touristes revenant d'Asie.) Il n'a pas été vérifié que le déplacement des lanternes était cohérent avec le vent (archives indisponibles sur le web).<br>  Les autres observations restent étranges, mais peuvent être des confusions avec la Lune (demi lune plein sud), des véhicules sur la route, suite à l'émotion de la deuxième observation. Mais ceci n'explique pas tout.<br> Ce cas est classé ""C"" : manque d'informations pour conclure, mais une des observations correspond à des lanternes thaïlandaises .";"Observations de plusieurs phénomènes lumineux silencieux dans le ciel : manque d'informations.";O;1;;;;;;;;2018-07-16;;;0.50;0.50;;;;;;;0.28;0.28;C;C;1978-01-08159
583;"[RENTREE ATMOSPHERIQUE] (NAT) FRANCE (FR) 21.02.1978";France;FR;"(N) National";1978;02;21;"Le 21 février 1978 entre 20h45 et 21h de nombreux témoins situés dans différents départements français observent quelques secondes le déplacement rapide dans le ciel de lueurs aux couleurs variées. La majorité des témoins décrit un objet de forme plutôt sphérique de la grosseur d'un ballon de football suivi d'une longue trainée lumineuse de couleur verte puis rouge-orangé. Beaucoup de témoins indiquent un déplacement vers l'Ouest et une disparition à l'horizon ou instantanée.78 témoignages sont rapportés. <br>

Le tableau  récapitulatif des lieux et heures d'observation (joint dans les éléments d'enquête) frappe par l'étendue géographique et la correspondance en heure. Ceci est en faveur d'un phénomène unique produit à haute altitude (> 50 km) et conférant une visibilité sur une grande étendue. C'est là une caractéristique clef du phénomène bien connu de rentrée atmosphérique d'un météoroïde. Ceci est conforté par une autre caractéristique clef qui est la lueur allongée et la faible durée. Une durée plus longue aurait pu conduire à considérer aussi l'hypothèse voisine portant sur la rentrée atmosphérique d'un engin spatial.<br>

De nos jours de nombreux sites enregistrent les données récoltées au sol (le plus souvent par des caméras automatiques) lors de ces rentrées, de sorte que les témoignages vers le GEIPAN sont solutionnés sans enquête particulière. L'exemple de 2016 avec plus de 20 enregistrements (joint dans le complément d'analyse <b><a href=""http://fireballs.imo.net/imo_view/event/2016/4205"">IMO</a></b>) illustre l'analogie avec cet ancien cas du  21 février 1978 à 21H.<br>

On trouve dans le complément d'analyse un florilège de descriptions de témoins qui dégage bien l'impression de déplacement rapide avec forme conique ou allongée.<br>

En conséquence le GEIPAN classe le cas en A : observations d'une rentrée de météoroïde.
";"Multiples observations en France du passage rapide d'un phénomène lumineux de couleur : observations d'une rentrée de météoroïde.";O;53;;;;;;;;2018-03-09;0.10;;0.10;0.00;;;;;;0.90;0.87;0.02;A;A;1978-02-00487
585;"ETRECHY (91) 1978";Essonne;91;"(D) Département";1978;02;19;"Le 19 février 1978 vers 4h 30 deux témoins observent une lueur qui se déplace en suivant la ligne SNCF. Cette lueur de couleur rouge et bleue se déplace très rapidement avant de disparaître. Aucun autre témoignage ne sera recueilli sur ce phénomène pour lequel nous manquons d'informations.";"Observation d'une lueur suivant la ligne SNCF.";O;2;;;;;;;;2008-10-03;;;0.50;0.50;;;;;;;0.28;0.28;C;C;1978-02-00486
588;"POYA (988) 1978";Nouvelle-Calédonie;988;"(D) Département";1978;02;14;"Le 14 février 2008 et non le 23 février comme le déclareront en premier lieu des témoins, vers 16h plusieurs personnes observent dans le ciel le passage rapide d'un objet ovale et brillant avec une trajecoite rectiligne. Aucun bruit et aucune trainée ne sont remarqués. Aucun autre témoignage ne sera recueilli sur ce phéomène pour lequel nous manquons d'informations.";"Observation d'un objet de forme ovale , déplacement rapide rectiligne";O;4;;;;;;;;2008-10-03;;;0.50;0.50;;;;;;;0.28;0.28;C;C;1978-02-00489
589;"BEAUVOIR SUR NIORT (79) 1978";Deux-Sèvres;79;"(D) Département";1978;02;26;"Le 26 février 1978 vers 2h 30 du matin plusieurs personnes ont observé une forme argentée et brillante dans le ciel. Les témoins parlent d'explosion lumineuse. Ce phénomène a disparu instantanément.aucune bruit n'a été entendu. Des partrouilles de gendarmerie ont cette nuit là observé des éclairs provenant de lointains orages. Ces témoins ont probablement observé un phénomène lumineux venant de ce passage orageux.";"Observation de lueurs bréves. Probablement orage";O;5;;;;;;;;2008-10-03;;;0.38;0.13;;;;;;;0.58;0.34;B;B;1978-02-00490
590;"CHABEUIL (26) 28.02.1978";Drôme;26;"(D) Département";1978;02;28;"Le 28 février 1978  entre 19h 30 et19h 40 une automobiliste et son fils aperçoivent un objet très lumineux orangé se déplaçant à vive allure dans le ciel du Nord au Sud.  L'observation a duré trois minutes durant laquelle aucun bruit particulier n'a été entendu. L'objet s'est stabilisé puis est reparti lentement en direction du Sud avant de disparaître instantanément.<br> Aucune trace n'a été découverte sur les lieux. Aucun autre témoignage ne sera recueilli sur ce phénomène qui reste inexpliqué.";"Observation du déplacement et de la disparition sans bruit d'un objet lumineux.";O;2;;;;;;;;2011-09-12;;;0.75;0.25;;;;;;;0.78;0.23;D;D;1978-02-00491
592;"SAUMUR (49) 1978";Maine-et-Loire;49;"(D) Département";1978;03;01;"Le 1er mars 1978 deux témopins dans leur véhicule aperçoivent dans le ciel vers 18h 30 un objet lumineuxse déplaçant lentement dans le sens S-N. L'observation dure 7 à 8 minutes. L'objet est long et volumineux ; il est principalement de couleur rouge. Aucun bruit particulier n'est entendu. Aucun autre témoignage ne sera recueilli sur ce phénomène pour lequel nous manquons d'informations.";"Observation d'un objet en forme de cigare rouge-feu";O;2;;;;;;;;2008-10-07;;;0.50;0.50;;;;;;;0.28;0.28;C;C;1978-03-00492
593;"PHALSBOURG (57) 1978";Moselle;57;"(D) Département";1978;03;07;"Le 7 mars 1978 vers 19h 15 deux témoins sur leur terrasse observent deux points rouges superposés en direction du S-SE. L'observation dure  deux minutes puis les points s'éteignent subitement. Après quelques secondes un point de la même grosseur émétant une lueur blanche apparaît et se dirige à grande vitesse vers le N-E. L'observation a duré une minute. Un autre  témoin fera une déposition concernant une observation de point limineux circulant dans le ciel mais l'heure ne correspond pas à la première observation. Aucune autre témoignage n'a été recueilli concernant ce phénomène pour lequel nous manquons d'informations.";"Observation de points lumineux, haut dans le ciel.";O;3;;;;;;;;2008-10-08;;;0.50;0.50;;;;;;;0.28;0.28;C;C;1978-03-00493
594;"BENNECOURT (78) 08.03.1978";Yvelines;78;"(D) Département";1978;03;08;"Le GEIPAN continue de publier l'ensemble de ses archives sur son site public : www.geipan.fr. Dans ses publications, figurent des cas anciens classés à l'époque (A, B, C ou D) et qui font aujourd'hui l'objet d'un réexamen, dans le seul but d'être plus pertinent dans les conclusions. Grâce à de nouveaux moyens techniques (logiciels) et à l'expérience d'enquête acquise depuis toutes ces dernières années, ce réexamen aboutit quelquefois à de nouvelles remarques voire à un changement de classification.<br>
Ce cas d'observation précédemment classé C par manque d'information et nommé BONNIERES SUR SEINE (78) 1978 fait partie d'un ensemble de cas réexaminés récemment.<br>

Le 08 mars 1978 à 6h45 une automobiliste aperçoit des lueurs de couleurs variées à travers bois provenant d'un champ. Arrivée au niveau du champ elle voit un objet gris-bleu métallisé très brillant de la forme d'un gros bol retourné. Immobile et silencieux, il émet des lumières clignotantes sur sa base. Prenant peur le témoin quitte les lieux au bout d'une minute mais revient à midi avec des collègues de travail : une empreinte circulaire au sol à cet endroit est constatée. Avertie par la rumeur publique le lendemain, la gendarmerie contacte le témoin et se rend sur place. Aucune trace particulière hormis celle d'un tracteur n'est constatée. Selon les dires du témoin, beaucoup de curieux auraient piétiné l'endroit.<br>

Nota préalable concernant un cas où les témoignages et/ou traces portent sur un phénomène explicitement décrit ou perçu au sol :<br>
- en absence de mise en évidence que le phénomène au sol ne peut être venu et/ou reparti que par les airs, la recherche d'explication dépasse les seules compétences du GEIPAN et une conclusion GEIPAN ne saurait être formulée que si la preuve ou quasi preuve est établie, sinon le GEIPAN se doit de conclure C : Inexploitable car dépasse ses seules compétences.<br>
- dans le cas contraire, l'absence de témoignages ou traces de phases ou le phénomène est hors du sol peut conduire le GEIPAN à ne pas pouvoir conclure faute d'information fiable (classement C classique GEIPAN).<br>

Nous sommes ici dans le premier cas de figure, puisque rien ne permet d'exclure que le phénomène soit arrivé ou reparti par le sol. L'examen des traces dans le champ ne prouve rien dans un sens comme dans l'autre.<br>

En conséquence GEIPAN classe C : Inexploitable car dépasse les seules compétences du GEIPAN.<br>

L'analyse que le GEIPAN peut mener dans les limites de ses compétences et expérience est la suivante :<br>
- ce qui est décrit visuellement est d'étrangeté modérée.<br>
- la description visuelle est compatible de la présence d'un véhicule avec feux dans un champ près de la route avant le lever du jour, l'observation de nuit et le caractère improbable d'un véhicule à ce moment-là ont pu favoriser une méprise.<br>
- l'étrangeté vécue en temps réel par le témoin paraît limitée car il s'est certes arrêté (qu'une minute) mais il n'a pas attendu l'évolution du phénomène.  Il est certes revenu sur les lieux, peut être aussi poussé par la réaction des collègues à son hypothèse de soucoupe.<br>

Par contre, la présence d'un véhicule à ce moment-là est étonnante et constitue l'essentiel de l'étrangeté. Elle pourrait être liée à une activité illicite, bien sûr non vérifiable, comme le braconnage par exemple.<br>

L'observation se caractérise avant tout par une faible consistance tant au niveau de l'information que de la de fiabilité :<br>
- le témoignage principal comme ceux secondaires des collègues ne sont pas spontanés mais à la demande de la gendarmerie ;<br>
- l'évolution ou disparition du phénomène n'est pas observée ;<br>
- les traces rondes ou suspectes ne sont pas constatées par la gendarmerie ;<br>
- l'étrangeté pour le témoin a pu croître par la perception de traces non usuelles, l'emballement collectif (collègues, journalistes) et impacter certains aspects de sa déposition faite ensuite ;<br>
- le témoignage des collègues non spontané, concernant les traces à description minimale et quasi-identique, ouvre une possibilité (non vérifiable) de concertation ou influence préalable.<br>
";"Observation de lumières de couleurs variées provenant d'un objet immobile dans un champ de la forme d'un ""gros bol renversé"" gris bleu métallisé et très brillant : inexploitable car dépasse les seules compétences du GEIPAN.";O;3;3;;1;;;;;2018-11-08;;;0.50;0.50;;;;;;;0.28;0.28;C;C;1978-03-00494
598;"CHATENOIS (88) 1978";Vosges;88;"(D) Département";1978;03;14;"Le 14 mars 1978 vers19h 30 plusieurs personnes observent dans le ciel un objet lumineux de forme particulière. Deux boules blanches luminescentes sont reliées entre elles par une barre rouge-orangé. L'objet stationnaire pendant un moment se déplace pour changer brusquement de direction. Les lumières sont toujours  fixes et aucun changement d'intensité n'est remarqué. Aucun autre témoignage n'a été recueilli  sur ce phénomène pour lequel nous manquons d'informations.";"Observation d'un objet lumineux avec changement de trajectoire.";O;3;;;;;;;;2008-10-09;;;0.50;0.50;;;;;;;0.28;0.28;C;C;1978-03-00498
599;"SAINT-MAIXENT L'ECOLE (79) 1978";Deux-Sèvres;79;"(D) Département";1978;03;16;"Le 16 mars vers 22h des témoins aperçoivent dans le ciel un objet de forme ovale qui scintille dans le ciel en émettant des couleurs rouge-orange. Venant du N-E il se dirige vers de le S-O à faible altitude et sans bruit. L'objet a disparu caché par le paysage.";"Observation d'un objet de forme ovale, déplacement horizontal , pas de bruit.";O;4;;;;;;;;2008-10-09;;;0.50;0.50;;;;;;;0.28;0.28;C;C;1978-03-00499
600;"ARRAS (62) 17.03.1978";Pas-de-Calais;62;"(D) Département";1978;03;17;"Ce cas d'observation fait partie de cas classés « C » en 2008 par le GEIPAN. Il a fait l'objet d'un nouvel examen (voir le document : notes d'enquête). Le 17 mars 1978 un témoin observe vers 1h 30 du matin un objet lumineux rond se déplaçant lentement dans le sens S-NO. Aucun bruit particulier n'est entendu durant l'observation de10 minutes à l'il nu puis aux jumelles. L'objet descend lentement sur l'horizon.<br>   L'enquête de gendarmerie ne permettra pas d'apporter de nouveaux éléments concernant ce phénomène. Ce cas est consistant, la description du PAN observé est assez précise. La sincérité et la crédibilité du témoin n'ont jamais été mises en doute.<br>    Le phénomène décrit présente beaucoup de caractéristiques communes (durée d'observation, forme, taille, luminosité) avec un phénomène astronomique parfaitement connu : la Lune au coucher. De plus, la Lune était bien présente sur la zone du ciel observée alors que le témoin n'en fait pas mention.   Ce n'est pas la perception visuelle du témoin qui est en cause, mais l'interprétation que le témoin fait de son observation à travers son ressenti (fatigue, étonnement). Dans la classification actuelle du GEIPAN, ce cas d'étrangeté faible est classé comme PAN A :  observation liée à une méprise de la Lune au coucher observée avec une couverture nuageuse partielle.";"Observation du lent déplacement d'un objet rond et lumineux dans le ciel : observation astronomique de la Lune à son couché.";O;1;;;;;;;;2013-06-26;;;0.13;0.13;;;;;;;0.53;0.48;A;A;1978-03-00500
601;"AGEN (47) 24.03.1978";Lot-et-Garonne;47;"(D) Département";1978;03;24;"Le 24 mars 1978 vers 22h un témoin observe depuis son habitation une éblouissante lumière rouge écarlate. Elle aperçoit alors un objet de forme rectangulaire baigné dans cette lumière. A l'intérieur de l'objet le témoin distingue deux cercles jaunes pouvant être des hublots. Cet objet se déplace horizontalement puis disparaît brutalement laissant une lègère lueur rose à l'arrière. Aucun autre information n'a été recueillie sur ce phénomène.";"Observation d'un objet de forme rectangulaire émettant une lumière éblouissante, disparition soudaine.";O;1;;;;;;;;2008-10-09;;;0.50;0.50;;;;;;;0.28;0.28;C;C;1978-03-00501
606;"LE VAUDREUIL (27) 02.04.1978";Eure;27;"(D) Département";1978;04;02;"Le 2 avril 1978 vers 23h 35 un automobiliste et sa passagère aperçoivent une lueur très forte de couleur jaune-orange . Elle apparaît presque au niveau du sol de la colline. Après avoir arrêté son véhicule, le témoin observera une demi-sphère de grandes dimensions l'autre partie étant cachée par des arbres. Elle se déplace du Nord au Sud sans qu'aucun bruit ne soit entendu. L'observation durera en tout  50 minutes environ avant que l'objet ne disparaisse sous l'affaiblissement de sa luminosité. Aucune autre information n'a été recueillie sur ce phénomène.";"Observation  à plusieurs reprises d'une sphére de grandes dimensions.";O;2;;;;;;;;2011-01-11;;;0.50;0.50;;;;;;;0.28;0.28;C;C;1978-04-00504
607;"VAUDREUIL (LE) (27) 05.04.1978";Eure;27;"(D) Département";1978;04;05;"Le 4 avril 1978 vers 2h 45 un gardien d'usine observe au dessus d'une forêt domaniale et par cinq fois une boule de couleur blanche à haute altitude dans le ciel. Cette boule de dimensions variables se déplace très vite. La boule a progressivement disparu dans le ciel. Aucun autre témoignage et aucune autre information n'ont été recueillis sur ce phénomène pour lequel nous manquons d'informations.";"Observation d'une boule blanche dans le ciel. Déplacements rapides.";O;1;;;;;;;;2010-07-06;;;0.50;0.50;;;;;;;0.28;0.28;C;C;1978-04-00505
614;"FONTVIEILLE (13) 26.04.1978";Bouches-du-Rhône;13;"(D) Département";1978;04;26;"Le 27 avril 1978 vers 22 h un automobiliste observe trois points lumineux clignotants de couleur rouge à 100 m du sol. Ne distingant au départ aucune forme précise d'où ces lumières pourraient provenir, le témoin  constate que celles-ci se déplacent lentement d' Est en Ouest. Un léger bourdonnement est entendu par le témoin. Durant l'observation,  un des points lumineux descendra plus prés du sol et l'inspectera avec ce qui semble être un projecteur. Les deux autres points lumineux resteront stationnaires. Le témoin pourra alors voir une coupole éclairée de différentes couleurs. La Presse locale fera état d'autres témoignages sur ce phénomène qui reste inexpliqué.";"observation du déplacement de trois points lumineux rouges et clignotant.";O;1;;;;;;;;2008-10-31;;;0.75;0.25;;;;;;;0.78;0.23;D;D;1978-04-00512
616;"CAEN (14) 1978";Marne;51;"(D) Département";1978;04;29;"Le 29 avril 1978 en déplacement dans la région de Verdun, un automobiliste et ses passagers aperçoivent vers 2h 30 une lueur blanche dans le ciel qui les intrigue. Un phénomène lumineux triangulaire de grandes dimensions et de couleur rouge-orangé apparaît alors, immobile dans le ciel. Arrêtant leur véhicule, aucun bruit ne sera entendu durant l'observation. Une lumière blanche  se dirige ensuite  en direction des témoins effrayés qui reprennent leur véhicule et poursuivent leur chemin.  Aucun autre témoignage concernant ce phénomène ne sera recueilli.";"OBSERVATION DE LUMIERES ÉTRANGES DANS LE CIEL LORS D'UN VOYAGE.";O;2;;;;;;;;2008-10-31;;;0.50;0.50;;;;;;;0.28;0.28;C;C;1978-04-00514
617;"SAINT-SAUVEUR (89) 30.04.1978";Bourgogne-Franche-Comté;BFC;"(R) Région";1978;04;30;"Le 30 avril 1978 vers 21h30 plusieurs témoins vont apercevoir le passage de trois boule de feu. Celles-ci disparaîtront derrière la ligne d'horizon en émettant une clarté rouge. Aucun bruit n'a été entendu. Aucune trace au sol dans le secteur considéré n'a été retrouvée sur ce phénomène pour lequel nous manquons d'informations.";"observation par diférents témoins de la descente de trois boule de feu. Disparition derrière la ligne d'horizon.";O;4;;;;;;;;2009-09-10;;;0.50;0.50;;;;;;;0.28;0.28;C;C;1978-04-00515
618;"FONTENAY LE COMTE (44) 1978";Vendée;85;"(D) Département";1978;04;29;"Le 29 avril 1978 vers 23h 30 plusieurs personnes observent une lueur orangée très longue et d'intensité variable. Cette lueur semble se déplacer d'Est en Ouest à faible hauteur. Aucune trace sur les lieux de l'apparition ne sera relevée.";"Observation d'une grande lueur à l'horizon.";O;3;;;;;;;;2008-10-31;;;0.50;0.50;;;;;;;0.28;0.28;C;C;1978-04-01878
619;"FAUVILLE (27) 23.04.1978";Eure;27;"(D) Département";1978;04;23;"Le dimanche 23 avril 1978 entre 20h35 TU et 20h51 TU, suite à un appel téléphonique, un officier de permanence opérationnelle sur la base aérienne 105 d'Evreux (27) observe un point lumineux de couleur rouge à une hauteur comprise entre 10° et 15° : sa position est estimée dans le 300 de la base d'Evreux. Le personnel de la vigie observe également le phénomène dont l'intensité lumineuse décroit. L'officier sollicite l'aide du radar qui relève à 20h44 TU un écho dans le 300 de la station à une distance de 18 nautiques et un déplacement vers le 330 à une vitesse estimée de 30 à 40 nuds. 20h51 TU marque la fin des observations visuelles et l'arrêt du radar.<br> L'officier rédige son rapport le lendemain 24 avril 1978. Le rapport d'observation radar indique la date du 24 comme date d'observation mais cette erreur semble dûe à une erreur de frappe, ce qui permet à priori de valider la simultanéité de l'observation visuelle et de la trace radar dont nous n'avons pas malheureusement l'enregistrement et dont il faut noter la très faible intensité (1/5) mais d'une durée longue (7 minutes).<br> Un seul témoignage est recueilli. L'enquête GEPAN rejette les hypothèses hélicoptère et ballon.<br> Il est étonnant que la planète Vénus très visible ce soir-là dans une position proche (azimut 296° à 299°et élévation à 4° à 1,5°) n'ait pas été mentionnée par l'officier. Néanmoins comme la position du PAN est notablement différente (azimut de 300° à 330° et élévation 10° à 15°) la méprise avec Vénus parait extrêmement peu probable.<br> La mesure radar d'intensité faible et non confirmée par l'autre radar de Cinq-Mars-La-Pile doit être considérée avec circonspection. On ne peut pas exclure un faux écho (par exemple réflexion secondaire).<br> Le GEIPAN classe ce cas en D1 : le phénomène est moyennement étrange, lointain mais le témoignage est d'une bonne consistance.";"Observation d'un point rouge dans le ciel en déplacement et faible écho radar de 7 minutes : phénomène non identifié moyennement étrange.";O;2;;;;;;;;2015-09-29;;;0.63;0.13;;;;;;;0.78;0.23;D1;D1;1978-04-01879
622;"GONESSE (95) 05.05.1978";Val-d'Oise;95;"(D) Département";1978;05;05;"Le 5 mai 1978 entre 22h 45 et 23h15 trois personnes observent le passage d'un engin à environ 50 mètres au-dessus d'elles. Aucun bruit n'est entendu alors que l'engin est de taille importante. Des  lumières de couleur différentes sont remarquées sur l'engin. A l'heure indiquée par les témoins,  l'enquète de gendarmerie permettra d'établir des passages silencieux d'aéronefs attendant leur autorisation d'atterrir à l'aéroport Charles de Gaule. Ces personnes ont probablement été témoins de passages similaires d'aéronefs.";"Probable observation du passage d'aéronefs.";O;2;;;;;;;;2009-09-10;;;0.38;0.13;;;;;;;0.65;0.35;B;B;1978-05-00516
623;"BEAUFORT EN VALLEE (49) 06.05.1978";Maine-et-Loire;49;"(D) Département";1978;05;06;"Le 6 mai 1978 vers 22h 50 plusieurs personnes observent un objet lumineux immobile dans le ciel durant plusieurs minutes. De forme sphérique et de couleur orangée, il a une intensité lumineuse irrégulière. Il disparait en se déplacant sans bruit dans une trajectoire Sud Nord-Ouest. Ces personnes ont probablement été témoins du passage d'un satellite.";"Probable observation du passage d'un satellite.";O;3;;;;;;;;2009-09-10;;;0.38;0.13;;;;;;;0.65;0.35;B;B;1978-05-00517
624;"AIGUILLES (05) 16.05.1978";Hautes-Alpes;05;"(D) Département";1978;05;16;"Le 16 mai 1978 à 21h15 deux personnes aperçoivent dans le ciel un objet de forme sphérique qui se déplace très rapidement dans une direction Nord Nord-Ouest. Cet objet est d'une luminosité très intense. Aucun autre témoignage ne sera recueilli sur ce phénomène. Ces témoins ont probablement fait une observation du passage à haute altitude d'un aéronef éclairé par le soleil.";"Probable observation du passage d'un aéronef.";O;1;;;;;;;;2009-09-10;;;0.38;0.13;;;;;;;0.65;0.35;B;B;1978-05-00518
625;"[N165] de LANDEVANT (56) vers AURAY (56) 22.05.1978";Morbihan;56;"(D) Département";1978;05;22;"Le 22 mai 1978 vers 0h15 un automobiliste et ses passagers aperçoivent une boule très lumineuse de couleur blanche argentée dans le ciel. Les témoins racontent qu'un rayon lumineux parti de cette boule percutera leur véhicule à l'arrière gauche. Aucune trace sur le véhicule ne sera retrouvée. Aucun autre témoignage ne sera recueilli sur ce phénomène pour lequel nous manquons d'informations.";"Observation d'une boule et d'un rayon lumineux.";O;1;;;;;;;;2009-09-10;;;0.50;0.50;;;;;;;0.28;0.28;C;C;1978-05-00519
626;"VIBRAYE (72) 26.05.1978";Sarthe;72;"(D) Département";1978;05;26;"Le 26 mai 1978 entre 2h et 2h15 un témoin observe depuis son domicile, les différents déplacements de plusieurs lueurs de couleurs variées au-dessus de son village. Ces lueurs cessent dès qu'un véhicule traverse la localité. Aucune autre information ne sera recueillie sur ce phénomène pour lequel nous manquons de précisions.";"Observation de plusieurs lueurs de couleurs variées.";O;1;;;;;;;;2009-09-10;;;0.50;0.50;;;;;;;0.28;0.28;C;C;1978-05-00520
627;"BAGNERES-DE-BIGORRE (65) 28.05.1978";Hautes-Pyrénées;65;"(D) Département";1978;05;28;"Le 28 mai 1978 vers 9h un témoin observe en direction du soleil levant un ensemble de halos de couleurs différentes d'où semblent partir des rayons lumineux. L'observation durera entre 6 à 10 minutes puis le phénomène disparaitra. Aucun autre témoignage de ce phénomène n'a été recueilli. Cette personne a probablement observé un nuage lenticulaire.";"Probable observation d'un nuage lenticulaire.";O;1;;;;;;;;2009-09-10;;;0.38;0.13;;;;;;;0.65;0.35;B;B;1978-05-00521
628;"OUEGOA (988) 05.05.1978";Nouvelle-Calédonie;988;"(D) Département";1978;05;05;"Le 5 mai 1978 vers 19h30 trois personnes observent une lueur rouge au-dessus d'une île. Cette lueur se déplace lentement vers le sud puis change brusquement de cap our aller vers le Nord-Ouest. Aucun bruit n'est entendu lors de l'observation que dure plus de 4 minutes. Les gendarmes observeront durant une minute le même phénomène le 12 mai. Aucune autre information ne sera recueillie sur ce phénomène pour lequel nous manquons d'informations précises.";"Observation d'une lueur rouge se déplaçant lentement. Changement brusque de cap.";O;3;;;;;;;;2009-09-10;;;0.50;0.50;;;;;;;0.28;0.28;C;C;1978-05-01887
629;"PLEMET (22) 04.06.1978";Côtes-d'Armor;22;"(D) Département";1978;06;04;"Le 4 juin 1978 entre 20h et 22h de nombreuses personnes observent le passage d'un objet de forme sphérique et très lumineux. Cet objet avance en oscillant d'Est en Ouest. Une masse plus sombre se distingue parfois sous l'objet. Toutes ces personnes ont probablement été témoin du passage d'un ballon sonde fortement éclairé par le soleil ainsi que la sonde météorologique placée sous le ballon. Les centres météorologiques de Rennes ou de Guipavas lançent fréquemment ce type d'objet dans la région.";"Probable observation d'un ballon sonde.";O;8;;;;;;;;2009-09-10;;;0.38;0.13;;;;;;;0.65;0.35;B;B;1978-06-00522
630;"PORT VILA (988) 07.06.1978";Ile-de-France;IDF;"(R) Région";1978;06;07;"Le 7 juin 1978 entre 19h30 et 20h, trois pêcheurs à bord d'un bateau observent durant plusieurs minutes un phénomène lumineux qui les intrigue. Une lumière blanche se déplace lentement en longeant la côte puis vient dans leur direction.  Arrivée à leur hauteur,  les témoins racontent  avoir vu un engin avec des flammes de couleur sortant à l'arrière sans aucun bruit. Effectuant un changement brutal de direction pour repartir vers la côte, il a disparu soudainement laissant les témoins très impressionnés. D'autres témoins ont fait une observation ce même soir mais d'après la description donnée à la gendarmerie, il s'agit probablement de l'observation d'une étoile filante. L'enquête a déterminé que pour l'observation faite par les pêcheurs, il ne pouvait s'agir ni d'un avion ou d'un bateau, ni d'un ballon sonde ou de lumières de signalisation.  Ce cas malgré une enquête poussée reste non identifié.";"Observation du déplacement d'un PAN.";O;4;;;;;;;;2009-09-10;;;0.66;0.22;;;;;;;0.74;0.26;D;D1;1978-06-00523
631;"NATIONAL (975) 15.06.1978";France;FR;"(N) National";1978;06;15;"Le 15 août 1978 entre 21h et 21h10 plusieurs témoins situés dans les départements du Gard et de l' Ardèche observent le passage SO-NE d'un phénomène lumineux rougeâtre. Les témoins décrivent une boule incandescante suivi d'une trainée. Aucun bruit n'est entendu lors de l'observation.<br> Ces personnes ont été témoins d'une probable rentrée atmosphérique.";"Probables observations d'une rentrée atmosphérique.";O;5;;;;;;;;2011-06-09;;;0.38;0.13;;;;;;;0.65;0.35;B;B;1978-06-00524
632;"GUJAN-MESTRAS (33) 19.06.1978";Gironde;33;"(D) Département";1978;06;18;"Le 19 juin 1978 entre 23h et  0h45 plusieurs personnes entendent unbruit sourd et fort puis observent un objet lumineux au-dessus de l'agglomération. De couleur orangé, l'objet est de forme ovale. Des disfonctionnements sur le réseau d'éclairage électrique de la rue sont  constatés au fur et à mesure de la présence de l'objet. Celui-ci disparaitra progressivement de la vue des témoins en prenant de l'altitude. De plus,  des automobilistes sur la RN113 en direction de Bordeaux et à hauteur de La Réole observent également un phénomène lumineux se déplaçant lentement dans le ciel orageux. L'enquête de gendarmerie et du GEPAN n'a pu établir clairement une corrélation entre ces deux observations par manque de précisions et d'informations.  Les témoins ont probablement fait une observation d'un phénomène météorologique en rapport avec le temps orageux menaçant le secteur.";"Probable observation d'un phénomène météorologique.";O;5;;;;;;;;2014-02-12;;;0.38;0.13;;;;;;;0.65;0.35;B;B;1978-06-00525
633;"TAVAUX (39) 07.06.1978";Jura;39;"(D) Département";1978;06;07;"Le 7 juin 1978 vers 20h55 un automobiliste et sa passagère observent dans le lointain ( environ 5km) un point lumineux qui les intrigue. A 21h15 un disque lumineux de couleur orange oscillant commence sa lente ascension à la verticale et disparaît dans les nuages. Seule, une trainée colorée reste visible. Suite à la la parution dans la presse de cette observation, une personne témoigne avoir vu à la même date et entre 21h30 et 21h45 un phénomène lumineux jaune orangé de forme circulaire dans le ciel. Ces observations restent inexpliquées par manque de précisions.";"observations de phénomènes lumineux dans le ciel.";O;2;;;;;;;;2009-09-10;;;0.50;0.50;;;;;;;0.28;0.28;C;C;1978-06-02391
634;"MONTELIMAR (26) 08.07.1978";Drôme;26;"(D) Département";1978;07;08;"Le 8 juillet 1978 vers 23h40 un témoin observe le passage N-S d' un objet volant allongé. Situé environ entre 1000 et 2000 m d'altitude par le témoin, il est composé d'un ensemble de quatre boules rouges non rayonnantes. Aucun bruit n'est entendu lors de l'observation de courte durée.  Aucun autre témoignage n'a été recueilli sur ce cas pour lequel nous manquons d'informations.";"Observation du passage d'un objet volant.";O;1;;;;;;;;2009-09-10;;;0.50;0.50;;;;;;;0.28;0.28;C;C;1978-07-00526
636;"BIERRE-LES-SEMUR (21) 18.07.1978";Côte-d'Or;21;"(D) Département";1978;07;18;"Le GEIPAN continue à publier l'ensemble de ses archivesur son site public www.geipan.fr. Dans  ses publications, figurent des cas anciens classés à l'époque (A,B,C ou D) et qui font aujourd'hui l'objet d'un réexamen, dans le seul but d'être plus pertinent dans les conclusions. Ce cas d'observation précédemment classé D et nommé PRECY SOUS THIL (21) 18.07.1978 fait partie d'un ensemble de cas réexaminés récemment. <br>  Vers 4h du matin dans la nuit du 17 au 18 juillet 1978 un campeur observe un phénomène lumineux stationnaire dans le ciel à faible hauteur. Le témoin décrit une boule orangée ayant la forme d'une soucoupe ou d'une assiette retournée. Le témoin prend trois clichés photographiques avant la disparition lente puis rapide du phénomène vers le Sud. Aucun bruit n'a été entendu durant l'observation. La gendarmerie n'a recueilli aucun autre témoignage dans les alentours sur ce phénomène et le développement des photographies n'a rien donné. <br> La couleur du PAN (feu, donc orange) ainsi que le fait que le PAN soit bas sur l'horizon, vers le Sud-Ouest, est tout à fait caractéristique d'un astre au coucher (Voir les notes d'enquête). <br>  Si on met de côté un instant la description de mouvement final vers le sud, on tient une explication solide du PAN. En effet la Lune est présente (vérification Stellarium) sous un Azimut de 240° qui est précisément la direction de Dompierre-en-Morvan (vue par le témoin depuis Lucenay ~240 °),  direction que l'on attribue à la phase initiale du PAN. <br>  L'hypothèse d'une méprise avec la Lune serait renforcée par le fait que sa hauteur angulaire de 2° est parfaitement cohérente avec une description d'un PAN à faible hauteur et de couleur feu (couleur de la Lune rousse se couchant). <br> Par ailleurs, il y a des nuages en formation à cette heure-là. Une partie de Lune au travers de trouées de nuages peut prendre tout type de forme et donc celle décrite par le témoin. <br>  Le mouvement final vers le Sud est très peu documenté. Il reste compatible avec la méprise Lune dans la mesure où la trouée de nuages a pu se déplacer vers le Sud ou du moins avoir un déplacement perçu « vers le Sud » lorsqu'observé depuis un cap de 240°. Or le vent est globalement vers l'Est ce jour-là (pas d'indication disponible à 4H) et peut effectivement se décomposer pour le témoin en un déplacement radial de rapprochement depuis le cap 240° (non perceptible pour le témoin) et un déplacement orthogonal à la visée à 240° qui lui est perçu comme allant vers le Sud. <br>  La très grande cohérence entre la position vraie de la Lune et la position et la description du PAN donne une bonne probabilité à l'explication Lune et le peu que l'on connaisse de la mobilité finale du PAN reste compatible de cette explication Lune. <br>  Ce n'est pas la perception visuelle du témoin qui est en cause, mais l'interprétation que le témoin fait de son observation à travers son ressenti (fatigue, étonnement). <br>  Dans la classification actuelle du GEIPAN, ce cas d'étrangeté faible est classé comme PAN B, probable observation liée avec une méprise de la Lune.";"Courte observation d'un objet stationnaire lumineux orangé en forme d'assiette retournée : probable observation de la Lune.";O;1;;;;;;;;2017-07-28;0.27;;0.27;0.00;0.70;;0.70;0.50;0.50;0.35;0.35;0.00;B;B;1978-07-00528
640;"L'UNION (31) 27.07.1978";Haute-Garonne;31;"(D) Département";1978;07;27;"Le 27 juillet 1978 vers 23h30 plusieurs témoins observent une boule de couleur rouge vif dégageant une lueur très intense. Celle-ci semble tomber du ciel à proximité de leur habitation.  Un des témoins indique qu'à minuit quarante cinq elle verra de nouveau la boule s'élever et repartir. Aucune trace de la chute d'un objet n'est retrouvé par les témoins et la gendarmerie dans le secteur. Aucune autre information sur ce phénomène ne sera recueillie.";"Observation de la chute d'un objet lumineux.";O;5;;;;;;;;2010-04-16;;;0.50;0.50;;;;;;;0.28;0.28;C;C;1978-07-00532
641;"MURAT-SUR-VEBRE (81) 30.07.1978";Tarn;81;"(D) Département";1978;07;30;"Le GEIPAN continue à publier l'ensemble de ses archives sur son site public www.geipan.fr. Dans ses publications, figurent des cas anciens classés à l'époque (A, B, C ou D) et qui font aujourd'hui l'objet d'un réexamen, dans le seul but d'être plus pertinent dans les conclusions. Grâce à de nouveaux moyens techniques (logiciels) et à l'expérience d'enquête acquise depuis toutes ces dernières années, ce réexamen aboutit quelquefois à de nouvelles remarques voire à un changement de classification. Ce cas d'observation précédemment classé D et nommé CASTRES (81) 30.07.1978 fait partie d'un ensemble de cas réexaminés récemment.<br> Dans la nuit du 29 au 30 juillet 1978, vers 3h45 du matin, un cyclomotoriste (T1) revenant d'une fête à CASTANET-LE-HAUT (34) aperçoit une immense lueur orange dans le ciel alors qu'il se trouve au lieu-dit « Le Devès », sur la commune de MURAT-SUR-VEBRE. Le PAN est également observé par un autre témoin (T2), depuis le même lieu. L'observation a duré cinq minutes, à l'issue desquelles le PAN a disparu à vitesse modérée.<br>  Une patrouille de gendarmerie prend connaissance du cas le 1er août 1978. Les deux témoins sont aussitôt interrogés. L'enquête menée sur place n'a pas permis de trouver d'autre témoin, ni de trace au sol.<br>  La direction indiquée par les deux témoins correspond précisément (à un ou deux degrés prés) à celle de la Lune (voir la note d'enquête).<br>  La Lune rousse au levant ou au couchant est à l'origine de nombreuses méprises pour les témoins (voir annales du GEIPAN sur www.geipan.fr , recherche de cas avec phénomène Lune). C'est en général la présence de nuages devant la Lune qui crée la méprise, ils la masquent suffisamment pour ne pas pouvoir la reconnaitre mais en tout en laissant apparaitre sa lueur par des trouées pouvant prendre toutes sortes de formes dont certaines étranges. La forme complexe indiquée par le témoin T1 (disque et coupoles) peut être une d'elles.<br> Les informations météo encore disponibles 40 ans après ne permettent ni de confirmer ni d'infirmer une telle configuration nuageuse.<br>  Les mouvements de balancement du PAN peuvent s'expliquer par une erreur de perception liée aux mouvements des formes nuageuses devant et autour de la Lune.<br>  Le déplacement final du PAN vers la droite constaté par T1 a nécessité une prise de contact avec le témoin. T1 évoque spontanément ce qui lui parait encore le plus étrange : « ça a disparu d'un coup » et à la question vers où ?  Il répond « vers l'avant »  « au-devant de moi. ». Il se souvient d'une fuite en distance. Quand on lui rappelle son témoignage de déplacement vers la droite, il répond qu'il y en avait un peu mais que c'était surtout vers l'avant. T1 a donc été victime de l'erreur de perception classique consistant à interpréter une évolution de l'intensité du PAN (ici sa diminution du fait de la fermeture du voile nuageux) en une évolution de distance du PAN, en l'occurrence ici en une fuite en distance.  Ce point illustre une fois de plus que les expressions des témoins ne sont pas à prendre à la lettre car elles contiennent aussi des interprétations.<br>   La très grande cohérence entre la position vraie de la Lune et la position du PAN ne laisse pas de doute sur la méprise.<br>   Ce cas est consistant (2 témoins indépendants), la description du PAN observé est assez précise. La sincérité et la crédibilité des témoins n'ont jamais été mises en doute. Ce n'est pas la perception visuelle des témoins qui est en cause, mais l'interprétation que les témoins font de leur observation face au phénomène non reconnu.<br>  Le GEIPAN classe le cas en A : observation de la Lune rousse.";"Observations par deux témoins d'un phénomène lumineux orangé ; disparition progressive : observations de la Lune rousse.";O;2;;;;;;;;2017-11-23;0.10;;0.10;0.00;0.90;;0.90;0.75;0.63;0.68;0.61;0.00;A;A;1978-07-00533
643;"PIERRE-BUFFIERE (87) 22.07.1978";Haute-Vienne;87;"(D) Département";1978;07;22;"Le 22 juillet 1978 vers 23h45 plusieurs personnes observent dans le ciel un phénomène lumieux jaune orangé très vif émétant des rayons. Durant 15 minutes un témoin observera le phénomène aux jumelles avant que cellui-ci ne disparaisse. En raison de la direction d'observation et de la position de Vénus particulièrement visible en cette période de l'année, on peut dire que les témoins ont fait une observation astronomique.";"Observation astronomique de Vénus.";O;3;;;;;;;;2010-04-28;;;0.13;0.13;;;;;;;0.53;0.48;A;A;1978-07-02412
645;"HEROUVILLE (14) 06.08.1978";Calvados;14;"(D) Département";1978;08;06;"Le 06 août 1978 deux personnes témoignent avoir observé le déplacement lent d'un objet lumineux dans le ciel.  D'après les témoins une lumière très brillante de couleur jaune s'est déplacée lentement et à une allure régulière durant trois quart d'heure en haute altitude selon une direction Sud-Est Nord-Ouest avant de disparaître de la vue des témoins. Aucun autre témoignage ne sera recueilli sur ce phénomène. Ces personnes ont probablement observé le déplacement d'un satellite.";"Probable observation d'un satellite.";O;3;;;;;;;;2010-04-28;;;0.38;0.13;;;;;;;0.65;0.35;B;B;1978-08-00534
647;"SAINT-DIZIER (52) 20.08.1978";Haute-Marne;52;"(D) Département";1978;08;20;"Le 20 août 1978 de 22h50 à 23 15 environ, 5 militaires vont observer le passage et le stationnement au-dessus d'un bâtiment d'un objet qui les intrigue. Trois points lumineux sont d'abord aperçu venant de l'Est et volent en variant constamment de disposition. Ensuite et durant deux minutes les points se regroupent en un seul de couleur orangé au-dessus d'un bâtiment. Enfin, l'objet disparaît vers le Nord dans une progression entrecoupée d'arrêts subits et d'accélérations.  Il sera perdu de vue en raison de son éloignement. Aucun bruit n'est entendu lors de l'observation. Les témoins affirment qu'ils ne peuvent confondre cette lumière nocturne observée avec une étoile ou un aéronef connu. Aucune autre observation n'a été enregistrée dans la circonscription cette nuit là.";"Observation d'un phénomène lumineux.";O;5;;;;;;;;2010-04-28;;;0.75;0.25;;;;;;;0.78;0.23;D;D;1978-08-00536
649;"MONTPELLIER (34) 31.08.1979";Hérault;34;"(D) Département";1979;08;31;"Le 31 août 1978 plusieurs personnes observent trois lueurs dans le ciel vers 21h15. Une première lueur de couleur orangée sera observée une quinzaine de minutes. Par la suite deux autres lueurs argentées apparaîssent et se déplacent rapidement avant de disparaître instantanément. Les témoins décident de se déplacer en dehors de la ville et verront de nouveau ces lueurs apparaître vers 23h. Ils les observeront durant une heure avec des jumelles. Le phénomène disparaîtra totalement vers minuit 15. Aucun autre signaglement ne sera enregistré concernant ce phénomène pour lequel nous manquons d'informations.";"Observation de plusieurs lueurs dans le ciel.";O;1;;;;;;;;2010-07-07;;;0.50;0.50;;;;;;;0.28;0.28;C;C;1978-08-00538
650;"MENTON (06) 01.09.1978";Alpes-Maritimes;06;"(D) Département";1978;09;01;"Le 1 septembre 1978 à 21h05 les trois membres d'une même famille observent  le passage  d'une lueur rouge dans le ciel. Celle-ci se déplace lentement entre le Mont saint-Michel et le Mont Angel. L'observation dure deux à trois minutes. Aucune observation ne sera faite par les gendarmes contactés aussitôt par téléphone. Aucun autre témoignage ne sera recueilli sur ce phénomène pour lequel nous manquons d'informations.";"Observation du déplacement d'une lueur dans le ciel.";O;2;;;;;;;;2010-05-03;;;0.50;0.50;;;;;;;0.28;0.28;C;C;1978-09-00539
651;"CHAMONIX (74) 04.09.1978";Haute-Savoie;74;"(D) Département";1978;09;04;"Le 4 septembre 1978 vers 22 heures un groupe de personnes constate dans le ciel un objet lumineux qui les intrigue. Cet objet de forme sphérique et de couleur blanche se déplace à la vitesse d'un avion dans une trajectoire Nord-Sud entre les sommets du secteur. Après plusieurs minutes d'observation, à l'approche d'un avion volant en sens inverse, cet objet  monte à la verticale et change de couleur avant de disparaître à très grande vitesse dans le ciel. L'enquête de gendarmerie n'a pas permis de recueillir d'autres informations. Le bruit entendu et la manoeuvre de dégagement à l'approche du deuxième avion avec allumage des feux réglementaires d'identification permettent de penser que ces témoins ont probablement vu des manuvres d'un avion à réaction militaire.";"Probable observation des manuvres d'un avion à réaction.";O;8;;;;;;;;2010-05-04;;;0.38;0.13;;;;;;;0.65;0.35;B;B;1978-09-00540
652;"CHAROLLES (71) 07.09.1978";Saône-et-Loire;71;"(D) Département";1978;09;07;"Plusieurs soirs de suite vers 21h des personnes observent le passage à très haute altitude et à vitesse constante d'un objet lumineux. Il se déplace dans le sens NE-SO. La régularité de la trajectoire, le temps de visiblité et la répétition sur deux jours, confirme l'hyphothèse d'une observation du passage d'un satellite artificiel.";"Observations succesives du passage d'un satellite.";O;6;;;;;;;;2010-05-04;;;0.13;0.13;;;;;;;0.53;0.48;A;A;1978-09-00541
653;"CORBENY (02) 08.09.1978";Aisne;02;"(D) Département";1978;09;08;"Le 8 septembre 1978 vers 19h 15 plusieurs personnes entendent un sifflement provenant du ciel puis un bruit important. Un agriculteur constatera par la suite que le toit de sa grange a subit des dégats et il retrouvera des morceaux de glace blanchâtre plus ou moins gros.  Le ciel ce jour là était nuageux. Le diamètre et le poids total du glaçon n'ont pu être déterminés car il s'est brisé en plusieurs morceaux. Certains ont été pris par des témoins et les autres ont fondu sur le sol sans laisser de traces particulières.  Aucun autre fait semblable ne s'est produit dans la région ce jour là. Ce phénomène rare est néanmoins connu en météorologie.";"Chute d'un bloc de glace.";O;5;;;;;;;;2010-05-05;;;0.13;0.13;;;;;;;0.53;0.48;A;A;1978-09-00542
656;"GLAY (25) 15.09.1978";Doubs;25;"(D) Département";1978;09;15;"Le 15 septembre 1978 entre 21h et 22 heures un témoin dans son jardin observe le passage d'Ouest en Est d'un objet volant lumineux à très haute altitude. L'objet a la forme d'un cigare éclairé par des lumières blanches. Aucun bruit n'est entendu durant l'observation. Aucun autre témoignage ne sera recueilli sur ce phénomène pour lequel nous manquons d'informations.";"Observation du déplacement d'un objet lumineux dans le ciel.";O;1;;;;;;;;2010-05-05;;;0.50;0.50;;;;;;;0.28;0.28;C;C;1978-09-00545
657;"DIJON (21) 17.09.1978";Côte-d'Or;21;"(D) Département";1978;09;17;"Le 17 septembre 1978 vers 19h50 plusieurs personnes observent dans le ciel un trait lumineux qui se déplace lentement à une altitude non précisée. Aucun bruit n'est entendu lors de l'observation. Malgré l'enquête de gendarmerie, les témoignages succincts concernant ce phénomène ne nous apportent que peu d'informations. Le cas est classé C.";"Observation du passage d'un trait lumineux dans le ciel.";O;7;;;;;;;;2010-05-06;;;0.50;0.50;;;;;;;0.28;0.28;C;C;1978-09-00546
658;"REMIREMONT (88) 24.09.1978";Vosges;88;"(D) Département";1978;09;24;"Le 24 septembre 1978 trois personnes vont observer dans le ciel un objet lumineux qui les intrigue. L'objet de couleur argenté ne fait aucun bruit et semble se balancer. Il disparaît lentement caché par le paysage. Ces témoins ont probablement observé un ballon.";"Observation d'un objet lumineux dans le ciel.";O;3;;;;;;;;2010-05-27;;;0.38;0.13;;;;;;;0.65;0.35;B;B;1978-09-00547
659;"SETE (34) 27.09.1978";Hérault;34;"(D) Département";1978;09;27;"Le 27 septembre 1978 vers 19 35 un appel téléphonique au sémaphore de Sète fait état de la présence de deux points lumineux immobiles dans le ciel. Le militaire en poste  constate la véracité des faits et la présence d'un premier objet de forme cylindrique avec une partie avant conique et brillante et d'un deuxième objet en forme de croissant apparaissant et disparaissant. Le chef de poste est contacté et constate également la présence de ces deux objets. Les objets disparaitront vers 20h20 derrière des nuages. Ces personnes ont probablement vu des ballons.";"Observation de deux objet volants lumineux dans le ciel.";O;2;;;;;;;;2010-05-27;;;0.38;0.13;;;;;;;0.65;0.35;B;B;1978-09-00548
660;"PARIS (75) 30.09.1978";Paris;75;"(D) Département";1978;09;30;"Le 30 septembre 1978 vers 23h30 deux promeneurs observent le passage d'un engin volant très bas qui les intrigue. L'objet est de forme ronde, avec un caisson brillant et des lumières rouges et jaunes. Aucun bruit n'est entendu durant les rotations de l'objet au-dessus d'un pont de chemin de fer. Aucun autre témoignage n'a été recueilli pour corroborer cette observation pour laquelle nous manquons d'informations.";"Observation d'un engin rond et brillant dans le ciel.";O;1;;;;;;;;2017-02-23;;;0.50;0.50;;;;;;;0.28;0.28;C;C;1978-09-00549
662;"MOUZON (08) 03.10.1978";Ardennes;08;"(D) Département";1978;10;03;"Le 3 octobre 1978 vers 2h du matin une personne en cyclomoteur est surpris par une forte lueur au-dessus d'un bois. Le témoin aperçoit alors un objet en forme de cigare de couleur rouge-orange encerclé d'un vert vif. Cet objet, immobile à 100 m dans le ciel, éblouit le témoin. Le cyclomoteur s'arrête de fonctionner.  L'objet disparaîtra brusquement accompagné d'un léger bourdonnement. Le cyclomoteur  fonctionnera de nouveau pour permettre au témoin effrayé de poursuivre sa route. Une autre personne a témoigné de la récidive du passage de ce genre d'engin dans le secteur sans donner davantage de précisions.";"Observation d'un objet en forme de cigare avec effet sur véhicule.";O;2;;;;;;;;2010-06-02;;;0.75;0.25;;;;;;;0.78;0.23;D;D;1978-10-00550
664;"LHUIS (01) 06.10.1978";Ain;01;"(D) Département";1978;10;06;"Le 6 octobre 1978 deux témoins observent durant 15 minutes un phénomène lumineux qu'ils ne s'expliquent pas. Ces personnes décrivent une lueur anormale rose qui se déplace lentement à environ 7 à 8 mètres du sol. Aucun bruit n'est entendu durant l'observation. Les gendarmes arrivés rapidement sur les lieux ne pourront constater le phénomène qui a disparu. Aucune autre observation de ce phénomène ne sera rapportée. La transition bois-champ cultivé est propice à des phénomènes de turbulences atmosphériques de nature thermique entrainant une distorsion de l'objet observé : à l'heure et dans la direction indiquées ce soir là, ces personnes ont probablement observé ce type de phénomène en relation avec le coucher de lune alors dans son premier quartier et très basse à l'horizon.";"Observation d'un phénomène lumineux en relation avec la Lune.";O;2;;;;;;;;2010-06-02;;;0.38;0.13;;;;;;;0.65;0.35;B;B;1978-10-00552
666;"NIERGNIES (59) 08.10.1978";Nord;59;"(D) Département";1978;10;08;"Ce cas d'observation fait partie de cas classés « C » en 2010 par le GEIPAN. Il a fait l'objet d'une nouvelle enqête (voir le document : notes d'enquête).<br>  Le 8 octobre 1978 à 22h20 deux témoins observent  au-dessus des champs face à leur habitation une sphère lumineuse de couleur feu et stationnaire. Un cercle rouge non complet entoure l'objet. Le phénomène d'une luminosité variable dure une dizaine de minutes puis disparaît progressivement dans la nuit. Aucun bruit n'est entendu durant l'observation et la disparition du phénomène. Aucun autre témoignage ne sera recueilli sur ce phénomène.<br> Le phénomène décrit présente beaucoup de caractéristiques communes (durée d'observation, forme, taille, couleur) avec un phénomène astronomique parfaitement connu : la Lune au coucher. De plus, la Lune était bien présente sur la zone du ciel observée alors que le témoin n'en fait pas mention.<br>   Ce n'est pas la perception visuelle du témoin qui est en cause, mais l'interprétation que le témoin fait de son observation à travers son ressenti. Dans la classification actuelle du GEIPAN, ce cas d'étrangeté faible est classé comme PAN A, observation liée avec une méprise avec la Lune au coucher.";"Observation d'une sphère lumineuse rouge stationnaire dans le ciel : observation de la Lune à son coucher.";O;1;;;;;;;;2007-03-22;;;0.13;0.13;;;;;;;0.53;0.48;A;A;1978-10-00554
669;"BROYES (51) 12.10.1978";Marne;51;"(D) Département";1978;10;12;"Les 12 et 13 octobre 1978 en fin d'après midi, un  automobiliste rapporte avoir observé des phénomènes lumineux se déplaçant dans le ciel. Aucun bruit n'est entendu durant les observations. Aucun autre témoignage ne sera recueilli sur ces phénomènes pour lesquels nous manquons d'informations.";"Observations successives de phénomènes lumineux.";O;1;1;;;;;;;2010-07-07;;;0.50;0.50;;;;;;;0.28;0.28;C;C;1978-10-00557
670;"NATIONAL (975) 13.10.1978";"Grand Est";GES;"(R) Région";1978;10;13;"Le 13 octobre vers 20h deux témoins sur Troyes et Reims observent le passage d'un objet de forme allongée. Des lumières colorées sont également aperçues.<br> Un des deux témoin fera une observation similaire le 18 octobre entre 19h et 20h.<br> Aucun phénomène anormal n'a été détecté au centre de détection satellite de l'Aube.<br> Le service technique de l'aérodrome de Barberey-Saint-Sulpice informera la gendarmerie qu'aucune observation inhabituelle n'a été signalée pour ces jours là.<br> Aucun autre témoignage n'a été recueilli.<br>.Ces témoins ont probablement observé le passage d'un aéronef.";"Observations du passage dans le ciel d'un objet de forme allongée.";O;2;;;;;;;;2011-06-09;;;0.38;0.13;;;;;;;0.65;0.35;B;B;1978-10-00558
671;"LABRUGUIERE (81) 15.10.1978";Tarn;81;"(D) Département";1978;10;15;"Le 15 octobre 1978 vers 18h50 plusieurs personnes à bord d'un véhicule observent deux lumières et un feu rouge fixe au-dessus des arbres en bordure de route. Poursuivant leur route ils voient un objet sans en distinguer précisément la forme avec plusieurs lumières. Aucun bruit particulier n'est entendu durant l'observation de l'objet qui semble stationnaire à une altitude d'envion 150m. Le temps de se garer pour mieux observer, l'objet a disparu et seul un point lumineux rouge est encore visible quelques instants. L'objet a disparu sans bruit et sans fumée vers l'Ouest. La passagère d'une autre automobile témoignera de l'observation d'un objet volant qui l'a intrigué ce même jour et sur la même route entre 18h30 et 18h45. Aucune autre précision ne sera receuillie sur ce phénomène pour lequel nous manquons d'information.";"Observation d'un objet en vol stationnaire.";O;6;;;;;;;;2010-06-23;;;0.50;0.50;;;;;;;0.28;0.28;C;C;1978-10-00559
672;"CASTELJALOUX (47) 23.10.1978";Lot-et-Garonne;47;"(D) Département";1978;10;23;"Le 23 octobre 1978 vers 20 un témoin, accompagné de son chien apeuré, observe durant plusieurs minutes les déplacements d'un objet lumineux projetant une lumière de couleur orange. De forme ronde, l'objet scintillant effectuera des changements de vitesse et de directions sans qu'aucun bruit particulier ne soit entendu par le témoin. Un boule de feu sera aperçue sortant de l'objet. L'objet disparaîtra soudainement. Aucun autre témoignage ne sera recueilli par la gendarmerie pour corroborer toutes les informations données par l'unique témoin.";"Observation du déplacement d'un objet en forme de disque.";O;1;;;;;;;;2010-07-06;;;0.75;0.25;;;;;;;0.78;0.23;D;D;1978-10-00560
673;"MORNANT (69) 28.10.1978";Rhône;69;"(D) Département";1978;10;28;"Le 28 octobre 1978 vers 19h10 plusieurs témoins observent le passage rapide d'Est en Ouest d'un phénomène lumineux dans le ciel. Les témoins décrivent une boule de feu avec une trainée lumineuse sur une trajectoire horizontale. Aucun bruit n'est entendu durant l'observation. Le phénomène s'étaint soudainement. Au vu des descriptions, ces personnes ont probablement été témoins d'une rentrée atmosphérique.";"Probable observation d'une rentrée atmosphérique.";O;3;;;;;;;;2010-06-25;;;0.38;0.13;;;;;;;0.65;0.35;B;B;1978-10-00561
674;"LORMES (58) 30.10.1978";Nièvre;58;"(D) Département";1978;11;02;"Le 30 octobre 1978 vers 2h30 deux campeuses entendent dans un demi sommeil un sifflement puis observent depuis l'intérieur de leur tente une lueur rouge durant 15 à 20 secondes. Dans le même temps elles ont l'impression que le sol se réchauffe. Une heure plus tard un nouveau sifflement est entendu par ces campeuses peu habituées aux bruits nocturnes de la campagne. Les jeunes filles ne regardent pas à l'extérieur de leur tente. Au lever du jour elles constateront un peu plus loin une surface brûlée sur le sol et pensent qu'un engin a pu stationner à cet endroit.  L'enquête de gendarmerie ne trouvera aucun autre témoin ayant entendu ces bruits suspects et vu ces lueurs. Par contre un témoin affirmera avoir brûlé il y a un an, à cet endroit, du bois provenant du débroussaillement de la haie et du talus bordant le pré : deux autres emplacements du même type se trouvent d'ailleurs dans le prolongement de la haie. Vers minuit les campeuses ont tenté de faire du feu avec des brindilles humides et du papier toilette : celui-ci se consume plûtot qu'il ne flambe. Il est probable que dans la nuit sous l'effet d'un coup de vent, ce papier et l'herbe se soient emflammés brusquement donnant une lueur pendant 15 à 20 secondes et ayant donné une sensation de chaleur. Le feu était situé entre la tente et l'emplacement supposé du stationnement de l'engin.";"Observation de lueurs rouges dans la nuit précédées par un sifflement.";O;3;;;;;;;;2010-06-28;;;0.29;0.13;;;;;;;0.61;0.39;B;B;1978-10-00562
675;"NATIONAL (975) 02.11.1978";Auvergne-Rhône-Alpes;ARA;"(R) Région";1978;11;02;"Le 2 novembre 1978 entre 18h45 et 19h30 plusieurs personnes dans les départements de la Loire et de la Haute -Loire observent les déplacements d'un objet lumineux composé de plusieurs lueurs de couleurs différentes.<br> Malgré des divergences dans les témoignages, tous les témoins sont intrigués par l'absence de bruit provenant de cet objet.<br> Malgré l'enquête de gendarmerie, trop peu d'informations seront recueillies pour consolider toute hypothèse.";"Observations du déplacement d'un objet lumineux dans le ciel.";O;9;;;;;;;;2011-06-09;;;0.50;0.50;;;;;;;0.28;0.28;C;C;1978-11-00563
676;"MAREUIL-SUR-LAY-DISSAIS (85) 06.11.1978";Vendée;85;"(D) Département";1978;11;06;"Le 6 novembre 1978 vers 7h30 trois personnes observent le lent déplacement d'un objet lumineux qui les intrigue. Aucun bruit ne sera entendu durant l'observation de cet objet de couleur orange. La gendarmerie contactée dans l'après midi ne pourra faire aucune constatation. Aucun autre témoignage ne sera recueilli par la gendarmerie sur ce phénomène pour lequel nous manquons de précisions.";"Observation du déplacement d'un objet lumineux.";O;3;;;;;;;;2010-07-06;;;0.50;0.50;;;;;;;0.28;0.28;C;C;1978-11-00564
677;"NATIONAL (975) 08.11.1978";France;FR;"(N) National";1978;11;08;"Le 8 novembre 1978 au petit matin, plusieurs témoins situés dans des départements différents, ont observé le passage rapide dans le ciel d'un phénomène lumineux.<br> D'après les descriptions des témoins, cet objet était suivi d'une trainée colorée dans le ciel et se déplaçait selon une trajectoire descendante. Les lieux présumés de chute de l'objet ont fait l'objet de recherches mais aucune trace au sol n'a été découverte.<br> Ces témoins ont probablement assisté à une rentrée atmosphérique.";"Porbables observations d'une rentrée atmosphérique.";O;5;;;;;;;;2011-06-09;;;0.38;0.13;;;;;;;0.65;0.35;B;B;1978-11-00565
679;"JAVERDAT (87) 14.11.1978";Haute-Vienne;87;"(D) Département";1978;11;14;"Le 14 novembre 1978 à 22h 14 un témoin observe le passage rapide SE-NO d'une boule brillante suivie d'une trainée de couleur feu. Aucun bruit n'a été entendu lors de l'observation d'une quinzaine de secondes. Cette personne a été témoin d'une probable rentrée atmosphérique.";"Observation d'une probable rentrée atmosphérique.";O;1;;;;;;;;2010-07-06;;;0.38;0.13;;;;;;;0.65;0.35;B;B;1978-11-00567
680;"POINDIMIE (988) 15.11.1978";Nouvelle-Calédonie;988;"(D) Département";1978;11;15;"Le 15 novembre 1978 entre 14h30 et 15h30, plusieurs personnes observent le passage SO-NE d'un objet lumineux qui pourrait être tombé dans le lagon sans précision exact du lieu de la chute. Des plongeurs, envoyés spéciaux du journal local, ont cherché en vain cet objet.";"Observation d'une probable rentrée atmosphérique.";O;5;;;;;;;;2010-07-28;;;0.38;0.13;;;;;;;0.65;0.35;B;B;1978-11-00568
681;"LA MURE (38) 21.11.1978";Isère;38;"(D) Département";1978;11;18;"Les 18, 19 et 21 novembre 1978 deux personnes vont observer vers le Mont Cimon et à des heures différentes, les déplacements à vitesse variable d'une boule lumineuse de teinte violette.  Aucun bruit n'est entendu. Une des observation se fera durant 3 minutes environ avant que le phénomène ne disparaisse à très grande vitesse.";"Observation des déplacements à vitesse variable d'une boule lumineuse de couleur.";O;2;;;;;;;;2010-07-26;;;0.35;0.00;;;0.90;;0.60;;0.55;0.00;D;B;1978-11-00569
683;"SAINT-JUNIEN (87) 25.11.1978";Haute-Vienne;87;"(D) Département";1978;11;25;"Le 25 novembre 1978 entre 15h30 et 15h45 un témoin est intrigué depuis son lieu de travail par un objet stationnaire dans le ciel nuageux. Cet objet de forme rectangulaire émet une lumière très brillante. Ce témoin et un collègue observeront l'objet se déplaçant à très grande vitesse et dans des directions opposées à deux reprises.   La tour de contrôle de l'aéroport de Limoges-Bellegarde confirmera les vols de deux aéronefs dans la région entre 15h20 et 16h14. Les informations disponibles sur ces observations lointaines ne permettent pas l'analyse de l'objet observé.";"Observation de déplacements rapides d'un objet lumineux.";O;2;;;;;;;;2010-07-28;;;0.50;0.50;;;;;;;0.28;0.28;C;C;1978-11-00571
685;"MAROLLES-LES-SAINT-CALAIS (72) 21.11.1978";Sarthe;72;"(D) Département";1978;11;21;"Le GEIPAN continue à publier l'ensemble de ses archives sur son site public www.geipan.fr. Dans ses publications, figurent des cas anciens classés à l'époque en cas de type « C » et qui font aujourd'hui l'objet d'un réexamen, dans le seul but d'être plus pertinent dans les conclusions. Grâce à de nouveaux moyens techniques (logiciels) et à l'expérience d'enquête acquise depuis toutes ces dernières années, ce réexamen aboutit quelquefois à de nouvelles remarques voire à un changement de classification explicité dans une note d'enquête. Ce cas d'observation (anciennement nommé Saint-Calais (72) du nom de la gendarmerie) fait partie de cas classés « C »  par le GEPAN.<br>  Le 21 novembre 1978, peu après 6h15 deux personnes observent un phénomène lumineux circulaire et rouge qui se lève à l'horizon. Ce phénomène se déplace lentement puis décroit.<br> La gendarmerie, mandatée sur le lieux à 8h, concluera à une observation astronomique de Vénus ;  ceci  ne sera confirmé par le GEIPAN qu'en 2013, du fait du doute sur l'heure précise d'observation car Vénus ne se levait ce jour-là qu'à 6h29.";"Observation d'un phénomène lumineux circulaire et rouge qui se lève à l'horizon : observation astronomique de Vénus.";O;1;;;;;;;;2013-12-03;;;0.13;0.13;;;;;;;0.53;0.48;A;A;1978-11-02606
687;"PIERREFORT (15) 03.12.1978";Cantal;15;"(D) Département";1978;12;03;"Le 3 décembre 1978 trois personnes observent entre 5 et 6 heures du matin une forte luminère éclairant le sol d'un paturage. Des luùières clignotantes rouge et bleu ont également été aperçu.  La gendarmerie n'a retrouvé aucune trace et aucun objets sur les lieux du phénomène pour lequel nous manquons d'informations.";"Observation d'un phénomène lumineux.";O;3;;;;;;;;2010-07-28;;;0.50;0.50;;;;;;;0.28;0.28;C;C;1978-12-00573
689;"SAINT-FONS (69) 06.12.1978";Rhône;69;"(D) Département";1978;12;06;"Entre le 6 et de 9 décembre 1978, un témoin observe en rentrant de son travail une forme lumineuse qui se déplace très lentement de l'Est vers le Sud.  Aucun autre témoignage ne sera recueilli sur ce phénomène pour lequel nous manquons d'informations.";"Observations successives d'un phénomène lumineux.";O;1;;;;;;;;2010-07-29;;;0.50;0.50;;;;;;;0.28;0.28;C;C;1978-12-00575
690;"COMBS-LA-VILLE (77) 07.12.1978";Haute-Savoie;74;"(D) Département";1978;12;07;"Lors d' un vol Rome-Paris, un passager observe un objet allongé brillant  et qui se déplace de droite à gauche en- dessous de l'avion. Le pilote intérrogé à l'arrivée se souviendra avoir vu à l'heure indiquée par le passager un avion brillant dans le soleil couchant et se déplaçant de la droite vers la gauche. Cet avion laissait une faible trainée de condensation derrière lui. Le témoin a probablement vu cet aéronef.";"Observation probable d'un aéronef.";O;2;;;;;;;;2007-03-22;;;0.38;0.13;;;;;;;0.65;0.35;B;B;1978-12-00576
691;"ROUSSILLON (38) 10.12.1978";Auvergne-Rhône-Alpes;ARA;"(R) Région";1978;12;09;"Le 10 décembre 1978 à partir de 6h40 plusieurs témoins dont des gendarmes observent un phénomène lumineux particulier à l'Ouest dans le ciel. Ce phénomène semble animé d'un mouvement pendulaire et ascencionnel. Il a progressivement diminué et a disparu vers 9h30. Ces témoins ont fait une observation de la planête Vénus.";"Observation astronomique de Venus.";O;7;;;;;;;;2010-07-29;;;0.13;0.13;;;;;;;0.53;0.48;A;A;1978-12-00577
692;"NATIONAL (975) 11.12.1978";France;FR;"(N) National";1978;12;11;"Le 11 décembre 1978 des témoins sur plusieurs départements observent un phénomène lumineux se déplaçant à vive allure dans le ciel sans qu'aucun bruit ne soit entendu. Une trainée est également aperçue. Ce phénomène disparaît subitement.<br> Ces personnes ont probablement observé une rentrée atmosphérique.";"Observations d'une probable rentrée atmosphérique.";O;6;;;;;;;;2011-06-09;;;0.38;0.13;;;;;;;0.65;0.35;B;B;1978-12-00578
693;"MEAUX (77) 19.12.1978";Seine-et-Marne;77;"(D) Département";1978;12;19;"Le mardi 19 décembre 1978 à 8h23 un témoin sur son balcon observe un phénomène qu'il ne reconnait pas. Dans le ciel dégagé en direction du Sud-Est de Meaux, un point lumineux oscille. L'objet disparaitra vers 9h45 caché par le soleil. Les gendarmes depuis l'appartement feront également l'observation d'un point lumineux dans la même direction et à environ 35° d'élévation. La veille à Paris deux témoins étaient intrigués par la présence dans le ciel d'un objet particulièrement brillant et une équipe de police constatait également la présence de cet objet dans le ciel.<br> L'enquete de police parisienne conclura à une observation astronomique. La vérification astronomique (voir carte celeste) indique clairement Vénus située entre 25° et 30° au S-E à l'heure indiquée.<br> Le GEIPAN classe ce cas en ""A"" : méprise astronomique avec Vénus.";"Longues observations d'un point lumineux dans le ciel : observations de Vénus.";O;1;;;;;;;;2014-03-21;;;0.13;0.13;;;;;;;0.53;0.48;A;A;1978-12-00580
694;"ARAMON (30) 20.12.1978";Gard;30;"(D) Département";1978;12;20;"Le 20 décembre 1978 vers 22h15 un témoin aperçoit de longues trainée roses dans le ciel puis deux engins en forme de toupies tournant sur elles mêmes. Durant le déplacement à très garnde vitesse des objets, le témoin principal n'a entendu aucun bruit. Un autre témoin appelé sur les lieux ne verra qu'un embrasement du ciel. Aucun autre témoignage ne sera recueilli sur ce phénomène pour lequel nous manquons d'informations.";"Observation du déplacement rapide de deux engins dans le ciel.";O;2;;;;;;;;2010-07-30;;;0.50;0.50;;;;;;;0.28;0.28;C;C;1978-12-00581
695;"COURNON (63) 24.12.1978";Puy-de-Dôme;63;"(D) Département";1978;12;24;"Le 24 décembre 1978 vers 21h deux témoins observent un objet lumineux dans le ciel. Ils constatent le déplacement à faible vitesse de l'objet qui émet des couleurs vairiées. Vers 23h un des témoins confirme avoir vu de nouveau l'objet qui a encore changé de place. Aucun autre témoignage ne viendra compléter ces dépositions très succinctes.";"Observation du déplacement d'un objet lumineux.";O;2;;;;;;;;2010-08-02;;;0.50;0.50;;;;;;;0.28;0.28;C;C;1978-12-00582
696;"VEYRE-MONTON (63) 25.12.1978";Puy-de-Dôme;63;"(D) Département";1978;12;25;"Le 25 décembre 1978 vers 16h30 trois personnes observent la chute d'un objet sphérique ou ovale de plus d'un mètre de diamètre, lisse et lumineux. Cette sphère  de plusieurs couleurs prend  feu en s'écrasant au sol. L'enquête de gendarmerie retrouvera sur le lieux de la chute des traces de terre calcinée et des morceaux différents  (ressort, plaque d'aluminium, ""chatterton"" roulé et brûlé). La nature des débris recueillis sur le lieu de la chute permet sans équivoque de conclure à un engin de fabrication humaine sans qu'il soit possible d'en déterminer la nature exacte (nacelle, ballon, cerf-volant). Il s'agit probablement d'une expérience d'amateur.";"Observation de la chute d'un objet de fabrication humaine.";O;2;;;;;;;;2010-08-02;;;0.13;0.13;;;;;;;0.53;0.48;A;A;1978-12-00583
697;"ETAMPES (91) 29.12.1978";Essonne;91;"(D) Département";1978;12;29;"Le 26 décembre 1978 vers 22h45 un témoin observe les déplacements d'un objet lumineux dans le ciel. Passant dans un nuage, cet objet émet un phénomène lumineux et monte à vitesse rapide dans le ciel en prenant une couleur rouge. Le témoin ne verra ensuite qu'un point rouge disparaître. Aucun autre témoignage ne sera recueilli sur ce phénomène.";"Observation d'un objet lumineux avec des changements de direction.";O;1;;;;;;;;2010-08-02;;;0.75;0.25;;;;;;;0.78;0.23;D;D;1978-12-00584
701;"MAULEON LICHARRE (64) 1979";Pyrénées-Atlantiques;64;"(D) Département";1979;01;02;"Dans la nuit du 1er au 2 janvier 1979 deux témoins observent durant moins de 10 secondes un objet éclairé de lumières rouges. Cet objet, qu'ils comparent à un cerf-volant, se déplace rapidement du Nord au Sud sans aucun bruit et à une altitude d'environ 100 m au-dessus de l'aglomération. Aucun autre témoin ne sera retrouvé sur ce phénomène pour lequel nous manquons d'informations.";"observation d'un objet lumineux au-dessus d'une agglomération.";O;2;;;;;;;;2008-04-22;;;0.50;0.50;;;;;;;0.28;0.28;C;C;1979-01-00586
702;"SAVERNE (67) 1979";Bas-Rhin;67;"(D) Département";1979;01;03;"Le 3 janvier 1979 deux personnes observent à 6h 50 un objet brillant à basse altitude dans la direction du Sud Sud-Est. Demi sphérique et accompagné d'une gerbe d'étincelles, cet objet se déplacera progressivement et sans bruit pour disparaître  en direction du Sud. Ces personnes sont probablement fait une observation astronomique de Vénus particulièrement visible dans le ciel à cette période (magnitude 4,46) d'après la carte du ciel.  Un automobiliste circulant vers 19h apercevra ce même jour un autre objet volant. Durant 3 à 4 secondes il voit une boule se déplaçant silencieusement à très haute altitude et sur une trajectoire Nord-Sud. Cette personne a probablement vu un ballon-sonde mais nous manquons d'informations sur ce dernier objet.";"observations d'objets dans le ciel";O;3;;;;;;;;2008-05-13;;;0.38;0.13;;;;;;;0.65;0.35;B;B;1979-01-00587
703;"BANNALEC (29) 06.01.1979";Finistère;29;"(D) Département";1979;01;06;"Le 6 janvier 1979 vers 22h une personne fait le tour de son exploitation avec son chien. Soudain celui-ci très effrayé se met à gronder et se réfugie sous un arbre. Le témoin aperçoit alors à 15 mètres de haut une forme très brillante et immobile. Un objet de forme circulaire surmonté d'un dôme émet des lumières aveuglantes et un léger bruit de soufflement. Le témoin observera l'objet durant 2 minutes depuis un bâtiment. Après un mouvement de balancement l'objet disparaitra à très grande vitesse vers l'Ouest à 22h 04. Aucun autre témoignage n'a été recueilli et aucune trace au sol n'a été observée le lendemain. D'après le bruit et le mouvement de balancement constatés, le témoin a probablement observé un hélicoptère.";"probable observation d'un hélicoptère";O;1;;;;;;;;2008-06-30;;;0.38;0.13;;;;;;;0.65;0.35;B;B;1979-01-00588
704;"NOYANT-LA-GRAVOYERE (49) 02.01.1979";Maine-et-Loire;49;"(D) Département";1979;01;02;"Le 12 janvier 1979 vers 19h 30, une personne aperçoit dans le ciel un phénomène lumineux particulier au Nord Nord-Est. Durant 20 minutes le témoin, muni de jumelles, observe une boule de feu de couleur orange de la grosseur d'un poing. Aucun bruit n'est entendu. Le phénomène a disparu dans les nuages. Aucun autre témoignage n'a été recueilli sur ce phénomène pour lequel nous manquons d'informations.";"observation prolongée d'une boule brillante";O;1;;;;;;;;2008-06-09;;;0.50;0.50;;;;;;;0.28;0.28;C;C;1979-01-00589
705;"BRIVE (19) 1979";Corrèze;19;"(D) Département";1979;01;11;"Le 11 janvier 1979 vers 6h 45,  un témoin aperçoit depuis une fenêtre un objet qui l'intrigue. Au-dessus d'une route, un objet ovale se déplace sans faire de bruit. Cet objet comporte dans sa partie inférieure six feux fixes de couleur rouge et vert. Au centre un feu jaune émet une lumière forte. Cet objet se déplace d'Est en Ouest à une vitesse réduite. D'après l'enquète le témoin a vu un avion de ligne FBOOM bimoteur qui a atteri à 6h 42 pour redécoller à 6h 59 de l'aérodrome de Brive tout proche.";"observation d'un avion de ligne";O;4;;;;;;;;2008-05-14;;;0.13;0.13;;;;;;;0.53;0.48;A;A;1979-01-00590
706;"TRELOU-SUR-MARNE (02) 13.01.1979";Aisne;02;"(D) Département";1979;01;13;"Le 13 janvier 1979 à 6h 15, un témoin observe dans la cour de son habitation un phénomène lumineux qui l'intrigue. Dans le ciel, un objet ayant la forme d'une haltère est stationnaire. Deux sphères de couleur jaune pâle et entourées d'un halo, sont reliées par une partie de couleur bleue-violette assez vive. Après quelques secondes d'observation, l'objet est parti à grande vitesse et a disparu caché par les toits des habitations. Aucun autre témoin de ce phénomène ce jour là n'a été trouvé. Le 14 janvier une autre personne est témoin d'un autre phénomène lumineux différent. Nous manquons d'informations sur ces phénomènes.";"observation d'un phénomène lumiNeux composé de deux sphères.";O;1;;;;;;;;2008-06-09;;;0.50;0.50;;;;;;;0.28;0.28;C;C;1979-01-00591
707;"COULONGES-COHAN (02) 14.01.1979";Aisne;02;"(D) Département";1979;01;14;"Ce cas d'observation fait partie de cas classés « C » en 2008 par le GEIPAN . Il a fait l'objet d'une nouvelle enquête. (voir le document : Notes d'enquête).<br> Le 14 janvier 1979 entre 5h 30 et 7h deux témoins observent, plein Est dans le ciel, un phénomène lumineux qui les intrigue. Une sphère brillante plus grosse que les étoiles se déplace sans bruit et à vitesse lente dans le sens Est-Sud. Le témoin principal ne donne pas de précisions quand à la hauteur de la sphère dans le ciel. Aucun autre témoignage ne sera recueilli sur ce phénomène. <br>  Ce cas est consistant, mais la description du PAN observé est peu précise dans le rapport de gendarmerie. La sincérité et la crédibilité du témoin n'ont jamais été mises en doute.<br>  Le phénomène décrit présente beaucoup de caractéristiques communes (durée d'observation, forme, taille, couleur) avec un objet astronomique parfaitement connu : Vénus, bien présente sur la zone du ciel observée.<br>   Dans la classification actuelle du GEIPAN, ce cas d'étrangeté faible est classé comme PAN B, observation probable de la planète Vénus, à travers une légère couche de brume ou par un effet de halo.";"Observation d'une sphère brillante se déplacant lentement : probable observation astronomique de Vénus.";O;1;;;;;;;;2013-06-26;;;0.38;0.13;;;;;;;0.65;0.35;B;B;1979-01-00592
709;"MARSEILLE EN BEAUVAISIS (60) 1979";Oise;60;"(D) Département";1979;01;19;"Le 19 janvier 1979 vers 18h 30 deux automobilistes remarquent dans le ciel deux feux blancs de forte intensité ainsi qu'une lueur rouge et orange venant d'un objet qu'ils ne peuvent définir. Un déplacement en direction du Sud-Est est constaté alors qu'aucun bruit n'est entendu. Aucun autre témoignage n'a pu être recueilli.  Lors de l'enquète, il est établi que des vols d'entrainements d'un bi-moteur ont eu lieu le 19 janvier entre 17h 30 et 19h. Cet avion possède deux puissants projecteurs à l'avant et des demi-tours ont été effectués au-dessus du secteur concerné.";"observation d'un aéronef";O;2;;;;;;;;2008-06-09;;;0.25;0.13;;;;;;;0.59;0.41;A;B;1979-01-00594
710;"DOUARNENEZ (29) 1979";Finistère;29;"(D) Département";1979;01;2-;"Entre le 24 et 28 janvier 1979 trois témoins vont observer des phénomènes particuliers sur un même secteur.  Le 24 janvier entre 7h et 7h15, un témoin relate l'observation d'un engin orangé en forme de cigare. Il se déplace lentement selon une trajectoire Nord-Sud et s'élève soudain verticalement pour disparaître à très grande vitesse en changeant de couleur. Aucune manuvre militaire de l'aéro-navale n'a été signalée à cette période de l'année et aucun autre témoignage ne sera recueilli sur ce phénomène pour lequel nous manquons d'informations. Le 28 janvier vers 22h15 deux autres personnes vont apercevoir des phénomènes lumineux. Des lueurs bleues et blanches avec un point rouge (pour un témoin) apparaissent à intervalles réguliers. D'après l'enquête de gendarmerie, ces lueurs provenaient des feux de signalisation situés en haut des mâts d'un cargo allemand en mouillage dans une baie. Cette observation différente est classée A.";"Observation d'un engin en forme de cigare et de lueurs.";O;3;;;;;;;;2008-07-01;;;0.13;0.13;;;;;;;0.44;0.41;C;A;1979-01-00595
711;"CHATEAUNEUF-DE-GALAURE (26) 25.01.1979";Drôme;26;"(D) Département";1979;01;25;"Un témoin fait deux observations distinctes à deux dates différentes : Aux alentours du 25 janvier 1979 vers 22h, ce témoin, accompagné d'une autre personne, constate que son véhicule est éclairé par un phare au-dessus de sa voiture. Prenant le temps de s'arrêter, il voit un objet de forme triangulaire qui émet des lumières de couleurs différentes mais à dominante rouge orangé. Elles sont accompagnées de deux projecteurs allumés et tournés vers le sol. L'objet avance lentement en émetant un sifflement. Bien que situé très prés du témoin (5 mètres), celui-ci ne peut évaluer la grosseur de l'objet qui disparaît ensuite derrière une colline. La deuxième observation a eu lieu aux alentours du 10 février 1979 : vers 20h et depuis son appartement, le témoin dit avoir entendu un ronflement venant de l'extérieur. Il observe alors un objet constitué de deux parties, émétant des lumières blanches et rouges et qui se déplace dans une direction Nord-Sud. Arrivé au-dessus de l'agglomération, l'objet est rejoint par une série d'ojets brillants en mouvements et émetant eux-aussi des lumières durant une demi heure. Malgré le temps important durant lequel ce phénomène lumineux a eu lieu, aucun autre témoignage ne sera recueilli sur ce phénomène pour lequel nous manquons d'informations.";"Observations d'un objet de forme triangulaire, progression lente et sifflement.";O;1;;;;;;;;2008-06-18;;;0.50;0.50;;;;;;;0.28;0.28;C;C;1979-01-00596
712;"VALENCIENNES (59) 26.01.1979";Nord;59;"(D) Département";1979;01;26;"Le 26 janvier 1979 à 0h 45 un automobiliste aperçoit à 150m environ devant lui une sphère lumineuse au ras du sol. Se rapprochant il voit que cette sphère, d'un diamètre de 4 à 5 m, est constituée de plusieurs panneaux. Des antennes mesurant 1 à 2 m sont visibles ainsi que des petites flammes bleues et blanches. Aucun bruit n'est entendu. Cette sphère a disparu en s'éloignant vers l'horizon. Aucune autre information n'a été recueillie sur ce phénomène pour lequel nous manquons de données.";"Observation d'un sphère lumineuse. Aucun bruit.";O;1;;;;;;;;2008-06-09;;;0.50;0.50;;;;;;;0.28;0.28;C;C;1979-01-00597
713;"HOURTIN (33) 29.01.1979";Gironde;33;"(D) Département";1979;01;29;"Le 29 janvier 1979 entre 20h 30 et 20h 45 un témoin observe, suite à un éclair, un point lumineux de couleur orange. Tout d'abord stationnaire, ce point commence une lente descente vers le sol tout en grossissant. Puis il prend une autre direction pour partir à l'horizontale à très grande vitesse et disparaître. Aucun bruit n'a été entendu durant l'observation qui a duré environ 2 à 3 minutes. Une hyphothèse émise par l'observatoire de Florac, contacté par la gendarmerie pour cette observation, était celle d'un phénomène de ""foudre en boule"" mais nous manquons de données pour valider ou non cette hypothèse.";"Observation d'un point lumineux à haute altitude, avec changement de direction et vitesse variable.";O;1;;;;;;;;2008-06-09;;;0.50;0.50;;;;;;;0.28;0.28;C;C;1979-01-00599
715;"AIX-EN-PROVENCE (13) 11.01.1979";Bouches-du-Rhône;13;"(D) Département";1979;01;11;"Le 11 janvier 1979 à 16h 35 deux témoins aperçoivent dans le ciel une quinzaine d'objets volants. Ils semblent mesurer entre 60 et 80 cm. De couleur métallisés, ils tourbillonnent et émettent des éclats lumineux en réfléchissant le soleil couchant. Ils se déplacent lentement sans aucun bruit vers le Sud-Est où ils disparaîtront. Un lâcher de ballon sonde a eu lieu le même jour à 12h et il est probable que les témoins aient vu des lambeaux de la nacelle ou de l'envelloppe du ballon.";"Probable observation de lambeaux de nacelle ou d'enveloppe de ballon sonde.";O;1;;;;;;;;2008-06-09;;;0.38;0.13;;;;;;;0.65;0.35;B;B;1979-01-01845
716;"NEGREPELISSE (82) 1979";Tarn-et-Garonne;82;"(D) Département";1979;01;13;"Le 13 janvier 1979 à partir de 20h plusieurs témoins observent dans le ciel un objet lumineux de différentes couleurs et qui émet des reflets. L'observation durera une trentaine de minutes. L'objet se situe à droite de la Lune sans que l'on ait d'informations sur la distance entre la lune et l'observation.  Les témoins ont probablement fait une observation astronomique qui peut être soit  Procyon (magnitude 0,40) particulièrement visible en cette période de l'année, soit Sirius dont les reflets de différentes couleurs sont bien connus et pour ce cas, accentués par l'observation aux jumelles. Jupiter est également particulièrement visisble mais à gauche de la lune, ce qui ne correspond pas au témoignage. Ces témoins se sont absentés durant trois heures et à leur retour vers 24h ils ont aperçu le même phénomène lumineux mais plus loin et qui s'était déplacé vers le Sud ce qui correspond au mouvement naturel des étoiles.";"probable observation astronomique";O;4;;;;;;;;2008-07-02;;;0.38;0.13;;;;;;;0.65;0.35;B;B;1979-01-01846
717;"SAINT-MANDE (94) 13.01.1979";Val-de-Marne;94;"(D) Département";1979;01;13;"Le 13 janvier 1979 entre 6h15 et 8h30 un témoin observe depuis chez lui un point lumineux qui l'intrigue. Ce point se déplace lentement d'Est en Ouest dans une trajectoire montante. Le témoin prendra plusieurs clichés photographiques. Les descriptions données et la carte du ciel de ce jour là indiquent que ce témoin a fait une observation astronomique de Vénus particulièrement visible en cette période de l'année (magnitude -4,41).";"probable observation de Vénus";O;1;;;;;;;;2008-07-02;;;0.13;0.13;;;;;;;0.53;0.48;A;A;1979-01-01847
719;"BOULAY-MOSELLE (57) 04.02.1979";Moselle;57;"(D) Département";1979;02;04;"Le 4 février 1979 vers 1h15 du matin, un témoin observe durant 30 secondes depuis son véhicule un objet lumineux dans le ciel. Cet objet a la forme d'une demi sphère de couleur orange qui se déplace du Sud-Ouest vers le Nord-Est dans une trajectoire horizontale. L'objet disparait progressivement en diminuant.<br>  Ce cas d'observation a été publié initialement par le GEIPAN en catégorie C, par manque d'information.<br> Un internaute, passionné d'astronomie, a repéré ce cas comme pouvant être une méprise avec la Lune à son coucher ; afin de vérifier si cette hypothèse était bonne, il est retourné sur les lieux de l'observation en février 2015, 36 ans après les faits.<br> Les orbites terrestres et lunaires sont telles que la période où la Terre et la Lune se retrouvent dans les mêmes positions relatives par rapport au Soleil correspond à 223 lunaisons, c'est-à-dire 6 585,32 jours : cette période est appelée <b><a href=""http://fr.wikipedia.org/wiki/Saros"">Saros</a></b>) ; elle est utilisée pour calculer le délai entre les éclipses de Lune ou de Soleil. On note que, après cette période qui n'est pas un nombre entier de jours, l'heure solaire n'est donc pas la même.<br> Dans notre cas, entre la date de l'observation et le jour de la reconstitution, il a fallu compter 2 fois cette période de près de 18 ans : la date exacte tombe le 25/2/2015 à 16:36, donc à une heure locale notablement différente de l'heure de l'observation.<br> Pour choisir la meilleure date de reconstitution, il faut trouver près de cette date les instants où l'azimut et la hauteur angulaire (élévation) de la Lune sont les plus proches de celles de l'observation. Deux dates s'avèrent convenables :<br> - le 23 février 2015 à 23h55, avec une Lune à 1,1° de hauteur angulaire et un azimut de 288°, une lunaison de 5 jours et une phase à deux jours du Premier Quartier.<br> - le 25 février 2015 à 1h00 (donc la nuit du 24 au 25 février), avec une Lune à 1,5° de hauteur angulaire et un azimut de 292°, une lunaison de 6 jours et une phase à la veille du Premier Quartier.<br> Pour comparaison, la position de la Lune lors de l'observation de Boulaysur-Moselle était de 1,4° de hauteur angulaire et un azimut de 286° (la reconstitution s'est donc faite avec une position de la Lune parfaitement similaire à 1979), avec une lunaison de 6,7 jours et une phase au Premier Quartier.<br>    Le GEIPAN publie intégralement le rapport d'observation de cet astronome amateur, rapport très bien documenté dont voici la conclusion :<br> « Le témoignage de l'époque correspond en de nombreux points à l'observation réalisée lors de la reconstitution : la forme est bien une demi-sphère de couleur orangée tirant sur le rouge, son inclinaison est en effet presque à l'horizontale. La durée de l'observation pouvait en effet être brève, la Lune étant basse et située proche de l'horizon. De plus on peut supposer la présence de nuages pouvant l'occulter à tout moment.<br> Le lieu d'observation figuré sur le plan joint au procès-verbal de gendarmerie présente une particularité topographique pouvant surprendre le témoin. En effet ce lieu présente une dénivellation où l'on passe d'un point coté d'altitude 324m à un point coté d'altitude 340m et cela sur une distance presque rectiligne d'environ 250m à peine. La pente est donc d'environ 6%. Cette configuration du relief peut, par exemple dans le cas d'une conduite d'un véhicule automobile, donner une illusion de jaillissement des éléments situés à l'horizon qui jusqu'alors étaient masqués par la côte.<br> Ces divers éléments confortent donc l'hypothèse d'une confusion due à la Lune vue dans des conditions particulières (aspect inhabituel de la Lune au coucher, impression de jaillissement au sommet de la côte).»<br>  Cette reconstitution tout à fait convaincante permet de classer ce cas en « A » : observation de la Lune à son coucher.<br>";"Observation d'un objet orangé en forme de demi-sphére : méprise Lune à son coucher.";O;1;;;;;;;;2015-03-30;;;0.50;0.50;;;;;;;0.28;0.28;A;C;1979-02-00601
720;"NICE (06) 06.02.1979";Alpes-Maritimes;06;"(D) Département";1979;02;06;"Le 6 février 1979 à 9h 20 un passant observe dans la ciel un phénomène lumineux qui l'intrigue. Durant deux minutes, il va apercevoir un objet  en forme de soucoupe avec des lignes bleues et jaunes à l'arrière qui disparaissent. L'objet est ensuite caché par les immeubles et lorsque le témoin le retrouve, il constate en son centre une lumière plus dense, de forme arrondie. L'objet est immobile dans un halo lumineux et forme un angle de 20° par rapport au sol. Aucun autre témoignage ne sera recueilli. A cette heure là, le soleil est très bas sur l'horizon et dans l'axe de l'observation : il s'agit probablement d'un reflet lumineux du soleil à travers les nuages.";"Observation d'un objet immobile et lumineux.";O;1;;;;;;;;2008-07-01;;;0.38;0.13;;;;;;;0.65;0.35;B;B;1979-02-00602
722;"TREVOUX (01) 1979";Ain;01;"(D) Département";1978;12;04;"Le 13 février 1979 vers 21h 45 un témoin avec ses enfants observent une boule blanche de grande dimensions qui se déplaçe dans le ciel à faible altitude dans le sens Ouest-Est. Cet objet rond et très brillant a de nombreuses lumières qui scintillent depuis l'intérieur. Trois lumières (jaune, verte et rouge) clignotent sous l'objet. Malgré une observation de deux à trois minutes, le témoin ne peut identifier l'objet. Lors de l'enquète, d'autres témoignages sur des observations similaires seront recueillis : depuis décembre 1978 le passage d'une boule blanche dans le même sens de déplacement a été constaté. Des témoins signalent également des baisses de tensions régulières dans le secteur. L'origine ne sera pas déterminée. Un autre témoin déclarera que le 4 décembre 1978 vers 18h  elle a aperçu un appareil de forme trapézoïdale et rectangulaire à sa base. Cet objet faisait du surplace à faible altitude et était éclairé par des lumières rouges. Le bruit émis ressemblait à celui d'un hélicoptère. L'hypothèse du vol d'un avion de tourisme dans cette vallée a été émise mais le centre du contrôle aérien n'a pas constaté, au niveau des radars de surveillance et contrôle, la présence d'un engin aux jours et heures indiqués. La présence d'aérodromes dans la région et la répétitivité des observations laissent à penser qu'un certain nombre d'entre elles correspondent à des aéronefs. Cependant les informations disponibles ne permettent pas de confirmer cette hypothèse.";"Observation d'un objet rond et lumineux.Temps d'observation 2 à 3 minutes";O;6;;;;;;;;2008-07-02;;;0.50;0.50;;;;;;;0.28;0.28;C;C;1979-02-00604
723;"VENISSIEUX (69) 14.02.1979";Rhône;69;"(D) Département";1979;02;14;"Le 14 février 1979 à 21h un témoin aperçoit dans le ciel une forme ronde de couleur blanche qui change de couleur tout en se déplaçant rapidement selon une trajectoire Sud Sud-Est. Aucun autre témoignage ne sera recueilli sur ce phénomène pour lequel nous manquons de données.";"observation d'une forme ronde changeant de couleur.";O;1;;;;;;;;2008-05-27;;;0.50;0.50;;;;;;;0.28;0.28;C;C;1979-02-00605
725;"SAINT-MARCEL (01) 11.03.1979 « LES POISSONS »";Ain;01;"(D) Département";1979;03;11;"Dans la nuit du 11 mars 1979 vers 0h 45 plusieurs personnes vont être témoin d'un phénomène lumineux particulier. Ils vont être éblouis par une très vive lumière de couleur bleue-verte-mauve qui  éclairera durant une minute environ le paysage environnant. Une coupure de courant touche toute la commune.<br> Un automobiliste précise qu'avec sa femme ils ont vu une masse légèrement ovale et immobile à 15 à 20 m du sol. Celle-ci s'est brusquement éteinte pour laisser apparaître un feu de couleur rouge-orangé de chaque coté de la masse.<br> Un pisciculteur réveillé dans la nuit du 11 mars par un bruit de crépitements et une lumière intense, constatera le mardi 13 mars la mort de nombreux poissons dans un de ses bassins d'élevage (1800kg au total).  Une ligne éléctrique de 10 000 volts passe au-dessus du bassin et dans la nuit du 14 au 15 mars un de ces fils cèdera : il était détérioré sur 4 à 5 mètres de long.<br>  Le responsable EDF du secteur n'a pas pu relever l'incident sur la bande de contrôle, la coupure de courant sur la commune ayant été trop brève (1 min).<br> Ces personnes ont été les témoins d'un arc électrique sur la ligne EDF qui a probablement concouru à la mort des poissons bien que les analyses aient mis en évidence une infection virale. Nous n'avons aucune information sur la nature précise de cette infection ni sur les conséquences éventuelles sur la mortalité des poissons.";"Observations d'un phénomène lumineux puissant et coupure de courant : observations et conséquences sur animaux d'un arc électrique sur la ligne EDF";O;6;;;;;;;;2007-03-22;;;0.13;0.13;;;;;;;0.53;0.48;A;A;1979-03-00607
726;"LE COTEAU (42)";Loire;42;"(D) Département";1979;03;15;"Le 15 mars 1979 vers 7h 25 cinq personnes travaillant à la réfection d'une voie ferrée aperçoivent un phénomène lumineux qui les intrigue. Une lueur orangée de la grosseur d'un ballon de football traverse lentement le ciel d'Est en Ouest dans une trajectoire descendante. L'observation qui dure environ 30 secondes permet de constater la présence d'une trainée de fumée blanche. Aucun bruit n'est entendu. L'objet va disparaître caché par le paysage. Ces personnes ont probablement été témoins d'une rentrée atmosphérique qui, compte tenu du temps d'observation peut être un débris spatial.";"Observation d'une lueur orangée traversant le ciel";O;5;;;;;;;;2008-07-02;;;0.38;0.13;;;;;;;0.65;0.35;B;B;1979-03-00608
727;"LANDIVISIAU (29) 1979";Finistère;29;"(D) Département";1979;03;18;"Le 18 mars 1979 vers 21h 15 une automobiliste et sa passagère aperçoivent un objet sombre de couleur gris fluorescent  en forme de fusée à trois mètres au-dessus de la voie express. Cet objet silencieux se déplace lentement en direction du Nord. La voiture passe rapidement sous l'objet. Au retour vers 21h 45, la même automobiliste verra, à peu prés au même endroit, une aile plate de 3 mètres carré au-dessus de la voie express. Elle décrit l'objet comme constitué d'un treillis métallique gris de quelques centimètres d'épaisseur et le tout semblant avoir un mouvement ondulatoire. L'objet survolant la voiture s'est immobilisé à 3 ou 4 mètres devant son véhicule. Impressionnée l'automobiliste accélèrera pour passer rapidement sous l'objet sans entendre de bruit particulier ou voir de lumières. Aucune source de chaleur ne semble provenir de l'objet. Ces observations n'ont  duré que quelques secondes dans de mauvaises conditions météorologiques ( pluie continue de nuit) et à proximité de l'aéroport de Brest-Guipavas. Aucune trace ne sera relevée par la gendarmerie et aucune autre information ne sera recueillie sur ce phénomène qui reste non identifié.";"Observation d'un objet en forme de fusée";O;2;;;;;;;;2011-09-29;;;0.75;0.25;;;;;;;0.78;0.23;D;D;1979-03-00609
728;"NICE (06) 1979";Alpes-Maritimes;06;"(D) Département";1979;03;19;"Le 19 mars 1979 entre 23h 10 et 23h 15 deux témoins observent depuis leur villa un phénomène lumineux qui les intrigue. Regardant par une fénètre ils voient une grosse sphère de couleur blanc bleuâtre en stationnaire à environ cinquante mètres du sol. Ce phénomène sera observé une trentaine de secondes avant de s'éteindre progressivement. Cette nuit là, un violent orange s'est abattu sur Nice  et des éclairs sillonnaient le ciel. Le témoin se rendra sur les lieux le 21 mars et apprendra que la foudre est tombée sur un pylone le 19 mars vers 23h 10 provoquant une énorme boule lumineuse. Cette personne a probablement été témoin d'un phénomène électrique dû à l'orage.";"observation d'une boule lumineuse. Temps orangeux.";O;2;;;;;;;;2008-06-03;;;0.38;0.13;;;;;;;0.65;0.35;B;B;1979-03-00610
729;"GARDOUCH (31) 21.03.1979";Haute-Garonne;31;"(D) Département";1979;03;21;"Le 21 mars 1979 vers 2h du matin, un automobiliste circulant sur la D16 entre Ayguesvives et Gardouch (31), aperçoit un phénomène lumineux qui prend des formes et des couleurs variables tout au long du trajet et semble suivre le témoin. Durant les 10 kilomètres parcourus le PAN semble parfois s'immobiliser et avoir ensuite des accélérations importantes. Arrivé chez lui, le témoin réveille son épouse qui observe également le phénomène. Le témoin prend des photos avant d'aller se coucher vers 3 h du matin. Aucun bruit particulier ne sera entendu et aucun autre témoignage ne sera recueilli par la gendarmerie.<br> L'enquète du GEPAN conclut que le témoin a probablement fait une observation astronomique d'un lever de Lune par temps brumeux (voir le compte rendu d'enquête GEPAN). Une vérification faite en 2008 sur la configuration astronomique au moment de l'observation montre également une conjonction entre la Lune, Neptune et Antarès, ce qui confirme la conclusion de l'enquête GEPAN de 1979.<br> Ce cas est classé A : observation astronomique de la Lune.";"Observation d'un objet lumineux qui semble suivre un automobiliste sur 10 kilomètres : observation astronomique de la Lune.";O;2;;;;;;;;2016-12-12;;;0.13;0.13;;;;;;;0.53;0.48;A;A;1979-03-00611
730;"CHEF-DU-PONT (50) 22.03.1979";Manche;50;"(D) Département";1979;03;22;"Le 22 mars vers 23h un témoin observe à haute altitude une boule orange de la dimension d'une balle de foot-ball. Celle-ci se déplace horizontalement en faisant un va et vient rapide; elle se déplace ensuite verticalement en émettant des reflets verts. Le même phénomène se reproduira  le lendemain à la même place et à la même heure. Aucun autre témoignage ne sera recueilli sur ce phénomène pour lequel nous manquons d'informations.";"Observation d'une boule effectuant des mouvements de va et vient";O;1;;;;;;;;2008-07-01;;;0.50;0.50;;;;;;;0.28;0.28;C;C;1979-03-00612
731;"MURVIEL LES BEZIERS (34) 1979";Hérault;34;"(D) Département";1979;02;26;"Entre 21 h30 et 22h 30 le 26 mars 1979 des automobilistes  aperçoivent dans le ciel un objet éclairé par trois feux. L'un des feu est de couleur blanche et les deux autres sont des feux clignotants vert et rouge. Cet objet se déplace rapidement en changeant de direction. Un des témoins indique qu'il a fait cette observation plusieurs fois entre février et mars. Ces personnes ont probablement fait une observation d'aéronef de type hélicoptère.";"probable observation d'aéronef";O;4;;;;;;;;2008-06-04;;;0.38;0.13;;;;;;;0.65;0.35;B;B;1979-03-00613
732;"MORGNY-LA-POMMERAYE (76) 31.03.1979";Seine-Maritime;76;"(D) Département";1979;03;31;"Le 31 mars 1979 la gendarmerie est contactée pour constater la présence d'un morceau de glace tombé sur le parking de la gare. Il n'y a ni victimes ni dégats malgré des fragments de glace éparpillés sur une trentaine de mètres. Dans un morceau de glace la présence de substances beige et rouge apparaît. Des échantillons de cette matière seront analysés pour conclure à la présence de graisse d'origine végétale ou animale provenant d'un bloc de glace qui se serait probablement détaché d'un aéronef. Le village est en effet situé en-dessous d'un couloir aérien fortement fréquenté et des conditions climatiques particulières peuvent provoquer de tels incidents.";"Observation d'un bloc de glace tombé près d'une gare.";O;1;;;;;;;;2008-06-09;;;0.38;0.13;;;;;;;0.65;0.35;B;B;1979-03-00614
733;"JEUMONT (59) 1979";Nord;59;"(D) Département";1979;01;--;"Le 25 mars 1979 entre 21h 55 et 22h 10, un témoin observe depuis son poste de surveillance de l'usine un phénomène lumineux dans le ciel qui l'intrigue. Il voit d'abord une clarté d'un blanc laiteux en forme d'arc suivie d'une boule verte avec un point rouge au milieu effectuant différents mouvements. Aucun bruit n'est entendu. Ce témoin et deux autres pompiers avaient déjà observé un phénomène lumineux en début d'année. Aucun autre témoignage  n'a pu être recueilli sur le phénomène du 25 mars pour lequel nous manquons d'informations.";"Observation d'une petite boule lumineuse.Aucun bruit.";O;5;;;;;;;;2008-06-05;;;0.50;0.50;;;;;;;0.28;0.28;C;C;1979-03-01721
734;"MONTGUYON (17) 1979";Charente-Maritime;17;"(D) Département";1979;03;22;"Le 22 mars 1979 vers 21h 25 un automobiliste et son passager aperçoivent une lumière éblouissante. Durant 2 à 3 minutes ces témoins vont pouvoir observer à une distance de 100m un objet en forme de ""tranche d'orange"" avec une lumière clignotante sur le coté gauche ainsi qu'une rangée de spots de différentes couleurs. Cet objet se déplace ensuite rapidement vers le Sud-Ouest. Un bruit de ronflement lointain a été entendu. Des photos ont été prises par un des témoins mais ne seront jamais apportées à la gendarmerie. Aucune autre information ne sera recueillie sur ce phénomène pour lequel nous manquons d'informations.";"Observation d'un objet en forme de ""tranche"" d'orange , lumineux , bruit d'avion.";O;2;;;;;;;;2008-07-01;;;0.50;0.50;;;;;;;0.28;0.28;C;C;1979-03-01722
735;"MOTTE-SERVOLEX (LA) (73) 18.03.1979";Savoie;73;"(D) Département";1979;03;18;"Le 18 mars 1979 vers 21h 45 un témoin observe depuis sa cour et durant 5 secondes un phénomène lumineux qui l'intrigue. Il voit paraître et disparaître dans des nuages deux sphères oranges d'un diamètre de 15 cm à bout de bras et qui se déplacent à trés grande vitesse d' Ouest en Sud-Est. Ces deux sphères sont espacées l'une de l'autre d'environ 50 cm. Aucun bruit n'est entendu. Malgré un appel à témoin lancé par la gendarmerie, aucun autre témoignage ne sera recueilli sur ce phénomène pour lequel nous manquons d'informations.";"Observation de deux objets se déplaçant à très grande vitesse.";O;1;;;;;;;;2010-03-15;;;0.50;0.50;;;;;;;0.28;0.28;C;C;1979-03-01853
736;"BEAUCOURT (90) 02.04.1979";"Territoire de Belfort";90;"(D) Département";1979;04;02;"Le 2 avril 1979 vers 20h40 la gendarmerie reçoit des appels téléphoniques signalant le survol de la commune par un engin émettant une lumière vive.<br> Sur place les gendarmes constateront un phénomène lumineux orangé qui se déplace dans le ciel dégagé à faible altitude en direction du Nord-Est. Des lumières clignotantes rouges et une lumière fixe verte émanent de l'engin.<br> L'enquète démontrera qu'il s'agit du passage d'un aéronef de type DC.9 qui effectuait des entrainements de vols dans la région entre 20h 30 et 21h 15. Le cas est classé A : observation d'un aéronef.";"Observation de lueurs vives à haute altitude : observation d'un avion en vol d'entrainement.";O;7;;;;;;;;2013-02-06;;;0.13;0.13;;;;;;;0.53;0.48;A;A;1979-04-00615
737;"COZES (17) 07.04.1979";Charente-Maritime;17;"(D) Département";1979;04;07;"Le 7 avril 1979 vers 6h 15 un automobiliste et sa passagère sont surpris de voir une lumière fluorescente blanche très intense dans un champs; elle éclaire le sol dans un rayon de plusieurs mètres. Celle-ci vient d'une masse sombre aux formes arrondies plus grosse qu'une voiture. Cette observation a duré quelques secondes avant que la lumière ne s'éteigne complètement. Ce champs situé sur une crête est bordé d'un chemin communal. Aucune trace au sol n'a été retrouvée. Aucun autre témoignage ne sera recueilli sur ce phénomène pour lequel nous manquons d'informations.";"Observation d'une grosse masse sombre projetant une lumière intense.";O;1;;;;;;;;2008-06-09;;;0.50;0.50;;;;;;;0.28;0.28;C;C;1979-04-00616
738;"CHATEAUGIRON (35) 1979";Ille-et-Vilaine;35;"(D) Département";1979;04;15;"Le dimanche 15 avril 1979 vers 22h 45 des témoins observent dans le ciel un point lumineux qui se déplace. En s'immobilisant, il change de couleur tout en scintillant. Les gendarmes appelés sur les lieux constateront un point lumineux de la taille d'une étoile qui se déplace lentement vers l'Est. Nous manquons d'information quand à la direction et la hauteur d'observation mais il s'agit vraisemblablement d'une observation astronomique, peut être Véga.";"Observation d'un point lumineux";O;2;;;;;;;;2008-07-02;;;0.38;0.13;;;;;;;0.65;0.35;B;B;1979-04-00617
739;"COURTHEZON (84) 1979";Vaucluse;84;"(D) Département";1979;04;17;"Plusieurs soirs du mois d'avril 1979 entre 23h et 24h deux personnes observent dans le ciel trois lumières clignotantes blanches et rouges disposées en triangle. Le 17 avril entre 23h et 23h 30 rentrant chez elles par un chemin de campagne, ces personnes voient une de ces lueurs se diriger rapidement vers le sol : elle semble venir d'un objet circulaire applati  d'un diamètre de deux mètres environ. Malgré leur observation qui a duré plusieurs minutes, les témoins ne peuvent dire si l'objet, alors à 200m, était posé sur le sol ou en stationnaire au-dessus du sol car il dégageait une lumière très intense. Effrayées elles rentreront chez elles avec des picotements dans les yeux. Aucune trace au sol ou sur l'environnement ne sera trouvée par la gendarmerie. Aucun autre témoignage ne sera recueilli sur ce phénomène pour lequel nous manquons d'informations.";"Observations de trois lueurs dans le ciel et d'un objet circulaire.";O;2;;;;;;;;2008-06-13;;;0.50;0.50;;;;;;;0.28;0.28;C;C;1979-04-00618
742;"SAINT-GERMAIN-LE-GAILLARD (50) 27.04.1979";Manche;50;"(D) Département";1979;04;27;"Le 27 avril 1979 vers 23h 30 un témoin observe durant 30 secondes le passage d'Ouest en Est d'un engin gigantesque  de couleur orange. Il disparaît brusquement  sans laisser de trainée. Aucun autre témoignage ne sera recueilli sur ce phénomne pour lequel nous manquons d'informations.";"Observation du passage d'un engin de grandes dimensions.";O;1;;;;;;;;2008-09-22;;;0.50;0.50;;;;;;;0.28;0.28;C;C;1979-04-01876
746;"SELLIERES (39) 1979";Jura;39;"(D) Département";1979;05;08;"Le 08 mai 1979 à 4h40 une automobiliste aperçoit un phénomène lumineux qui l'intrigue. Une boule lumineuse rouge orangée avec des ""antennes en tire bouchon"" se déplace et va disparaître rapidement vers le Sud-Ouest.  L'analyse des gendarmes indique qu'il ne peut pas s'agir de la lune compte tenu d'une vérification faite le lendemain à la même heure et qui montre que la lune se trouvait plus à ""gauche"" du véhicule que l'observation faite par le témoin. En fait, l'analyse précise du ciel montre que le 08 mai au moment de l'observation la lune se trouvait bien dans l'axe de l'observation et a disparu à l'heure de l'observation. Il est donc évident que le témoin est observé un coucher de lune assez lumineux. La présence de nuages a probablement provoqué des reflets ou des rayonnements et la disparition rapide indiquée par le témoin s'explique facilement par le fait qu'elle roulait elle-même en voiture. La vérification faite le 09 mai à la même heure n'est pas probante puisque la lune est alors plus à l'Ouest et plus haut sur l'horizon ce qui permet de la reconnaître sans ambiguïté.";"Observation d'un coucher de lune.";O;2;;;;;;;;2008-07-02;;;0.13;0.13;;;;;;;0.53;0.48;A;A;1979-05-00622
747;"VIENNE (38) 14.05.1979";Isère;38;"(D) Département";1979;05;14;"Le 14 mai 1979 vers 13h plusieurs personnes observent un objet brillant dans le ciel dégagé et sans vent. L'objet est de forme ovale et de couleur argentée ; il se déplace lentement en oscillant sur une trajectoire Nord Sud et perd progressivement de l'altitude. Semblant tomber derrière une colline, un des témoin part à sa recherche et verra l'objet s'élever rapidement pour disparaître. Aucun bruit n'a été entendu par les témoins. Ces personnes ont probablement vu un ballon sans que cette hypothèse soit formellement prouvée.";"Observation d'un objet argenté descendant lentement et repartant à la verticale";O;5;;;;;;;;2016-12-12;;;0.38;0.13;;;;;;;0.65;0.35;B;B;1979-05-00623
749;"LYON (69) 1979";Isère;38;"(D) Département";1979;05;25;"Le 25 mai 1979 à 1h 10 du matin deux fonctionnaires de police en service aperçoivent dans le ciel un phénomène lumineux qui se déplace et qui les intrigue. A  faible altitude quatre lumières de forme ovale et d'un ton blanc-jaune passent progressivement au-dessus d'eux puis prennent une autre direction. Il leur est impossible de dire si les lumières appartiennent à un seul objet  ou constituent des phénomènes autonomes. Un léger ronflement est entendu avant que le phénomène ne disparaisse en direction du Sud-Est caché par le paysage. Aucune interférence ne sera remarquée sur leur équipement de bord. La description faite par les témoins et la proximité de plusieurs aérodromes ( outre Lyon-Satolas) permet de penser avec une bonne probabilité que les deux fonctionnaires de police ont été témoins d'un avion en phase d'approche.";"Observation probable d'un avion en phase d'approche.";O;2;;;;;;;;2008-07-02;;;0.38;0.13;;;;;;;0.65;0.35;B;B;1979-05-00625
750;"[MER] LAT -1.22, LON -81.12 (EC.M) 26.05.1979";Maritime;EC.M;"(D) Département";1979;05;26;"Le 26 mai 1979 à 2h30 locale, deux témoins en quart sur un cargo observent durant 2 à 3 minutes un groupe de quatre échos radar juxtaposés formant un gros écho aux contours nets observé sur un radar V 22. La nature de l'écho ne correspond pas à un brouillage météo ni à une réflexion multiple des coques. Le batiment fait route dans l'océan Pacifique au Nord du Chimborazo, volcan d'Equateur .";"échos radar non identifiés";O;1;;;;;;;;2010-04-01;;;0.50;0.50;;;;;;;0.28;0.28;C;C;1979-05-00626
751;"MERFY (51) 29.05.1979";Marne;51;"(D) Département";1979;05;29;"Le 29 mai 1979 vers 23h 30 un automobiliste circulant sur une petite route de campagne est surpris de voir un objet en forme de croissant de lune orange vif venant dans sa direction. Cet objet à faible altitude semble suivre l'automobiliste tout au long de son déplacement vers le Nord-Ouest. Aucun bruit n'est entendu. L'objet sera perdu de vue.  Le lendemain, le  témoin retournera au même endroit et constatera la présence du même objet mais de couleur blanche. Celui-ci disparaitra derrière les bois en direction du Nord-Ouest. La carte du ciel ce soir là nous indique la présence à basse altitude et au Nord -Ouest de la Lune avec une magnitude de -8,91  : cette personne a  fait une observation astronomique de la Lune. L'impression de mouvement de celle-ci quand on se déplace est bien connu.";"Observation de la lune.";O;1;;;;;;;;2008-07-02;;;0.13;0.13;;;;;;;0.53;0.48;A;A;1979-05-00627
752;"AVIZE (51) 1979";Marne;51;"(D) Département";1979;05;30;"Le 30 mai 1979 deux personnes observent dans le ciel et durant 20 minutes un phénomène particulier. Un objet de la forme d'un ballon de rugby applati traverse le ciel sans le sens Sud-Est Nord-Ouest. Les témoins remarquent une trainée orange vif plus ou moins longue à la suite de l'objet qui se situe à environ 500m d'altitude. Un des deux témoin, élève pilote, ne reconnaît pas là un aéronef. Aucun autre témoignage n'a été recueilli sur ce phénomène pour lequel nous manquons d'informations comme l'heure d'observation.";"Observation d'un objet plat laissant s'échapper une traînée orange vif.";O;2;;;;;;;;2008-06-19;;;0.50;0.50;;;;;;;0.28;0.28;C;C;1979-05-00628
753;"GENTILLY (94) 1979";Val-de-Marne;94;"(D) Département";1979;05;31;"Le 31 mai 1979 à 0h 40 deux personnes vont observer un phénomène lumineux au plein Ouest dans le ciel. Durant plusieurs minutes, un objet volumineux en forme de croissant et de couleur orangé. Un autre objet est également apparu quelques instants.  La carte du ciel ce matin là indique plein Ouest la présence de Jupiter (magnitude -1,49), Pollux (magnitude 0,98) et un coucher de la Lune (magnitude-9,51). Ces personnes ont  fait une observation astronomique de cet ensemble.";"Observation  d'un coucher de lune avec une conjonction de planètes.";O;2;;;;;;;;2008-07-02;;;0.13;0.13;;;;;;;0.53;0.48;A;A;1979-05-00629
754;"LE CHATELARD (73) 1979";Savoie;73;"(D) Département";1979;05;15;"Le 15 mai 1979 entre 14h 15 et 14h 45 plusieurs personnes dans des champs aperçoivent un objet au sol puis s'envolant lentement horizontalement. De forme sphérique et de couleur métallique il se déplace en oscillant tout en suivant les formes du terrain et prend de la vitesse en se déplaçant verticalement. Certains témoins pourront le voir durant 30 minutes environ avant qu'il ne disparaisse progressivement.  Aucune information sur un éventuel lâché de ballon sonde dans le secteur n'a été recueillie mais d'après les descriptions données, ces personnes ont probablement vu un ballon.";"Observation d'un objet de couleur métal se déplaçant à environ 20 métres du sol.";O;5;;;;;;;;2008-06-18;;;0.38;0.13;;;;;;;0.65;0.35;B;B;1979-05-01720
756;"ARGILLY (21) 03.06.1979";Côte-d'Or;21;"(D) Département";1979;06;03;"Le 3 juin 1979 vers 23h 30 une automobiliste observe dans son rétroviseur une boule lumineuse orangée qui semble la suivre jusqu'à une agglomération où apeurée elle klaxonne pour avertir les habitants. Une personne sortira de chez elle mais refusera d'aller voir cette boule. Reprennant sa route, elle verra l'objet jusqu'à chez elle. Le témoin ressent des effets physiques et le tableau de bord  s'éteint. Cet objet ne fait aucun bruit et se situe à basse altitude dans le Nord Nord-Ouest. Elle ne croisera aucun véhicule et aucun autre témoignage ne sera recueilli sur ce phénomène. Malgré le manque d'informations, la carte du ciel ce soir là nous indique la présence de Jupiter paticulièrement visible ( magnitude -1,47 ), de Pollux (magnitude 0,98) et de Capella . L'hypothèse d'une observation astronomique est probable mais ne peut être confirmée. Le témoin a subi une frayeur importante qui explique probablement son comportement et les effets ressentis.";"Observation d'une boule lumineuse suivant le témoin.";O;1;;;;;;;;2008-07-02;;;0.50;0.50;;;;;;;0.28;0.28;C;C;1979-06-00630
757;"BOURGNEUF EN RETZ (44) 1979";Loire-Atlantique;44;"(D) Département";1979;06;08;"Le vendredi 8 juin 1979 entre 13h et 13h 05, plusieurs personnes ont vu un phénomène  particulier au-dessus de la baie. Ils ont aperçu en premier une fumée verticale qui s'est progressivement dissipée. Quelques minutes plus tard, un objet de forme sphérique et de couleur rouge feu a traversé le ciel selon une trajectoire rectiligne en direction du Sud-Ouest avec une courbe descendante. D'allure assez lente cet objet était suivi d'une fumée blanche ou grisâtre. Les observations ont duré quelques secondes sans qu'aucun bruit ne soit entendu. L'enquête de gendarmerie auprés de la marine a permis de savoir que des essais de fusées de détresse et éclairantes ont été réalisés. Cependant les informations fournies sont trop imprécises pour valider cette hypothèse.";"Observation d'une boule rouge avec fumée";O;6;;;;;;;;2008-07-02;;;0.50;0.50;;;;;;;0.28;0.28;C;C;1979-06-00631
758;"CHALLAIN-LA-POTHERIE (49) 10.06.1979";Maine-et-Loire;49;"(D) Département";1979;06;10;"Le 10 juin 1979 entre 3h 30 et 4h du matin et après un épisode orageux, un témoin aperçoit par une fenètre , un phénomène lumineux qui l'intrigue. Il voit dans la direction du Sud-Ouest, une lumière puissante qui se trouve au-dessus de l'horizon. Celle-ci se déplace lentement horizontalement avec parfois des allers et retours verticaux. Selon la position de la lumière, le témoin aperçoit des cercles lumineux. Une seconde lumière clignotante et venant du Nord apparait passant au-dessus de la première. Elle disparait rapidement dans la direction du Sud. A 4h du matin la lumière étant encore présente, le témoin est parti se coucher. Aucun bruit n'a été entendu et aucun autre témoignage ne sera recueilli sur ce phénomène pour lequel nous manquons d'informations.";"Observation au-dessus de l'horizon du lent déplacement d'un phénomène lumineux puis d'un autre phénomène lumineux clignotant avec une trajectoire ascendante : manque d'informations.";O;1;;;;;;;;2016-09-20;;;0.50;0.50;;;;;;;0.28;0.28;C;C;1979-06-00632
759;"SOULAINES DHUYS (10) 1979";Aube;10;"(D) Département";1979;06;15;"Le 15 juin 1979 vers 23h plusieurs personnes vont apercevoir sur l'horizon une lueur de couleur orange qui les intrigue. Cette lueur dans le Nord-Ouest semble constituée de plusieurs points lumineux. L'observation va durer une dizaine de minutes avant que tout ne s'éteigne. Ce soir là un exercice d'entrainement de tirs sol-air a eu lieu dans le camp militaire voisin situé au N-O de la position des témoins entre 23h et 23h 30. Ces personnes ont été témoins des lueurs dûes à ces tirs.";"Observation de lueurs à l'horizon dûes à des tirs militaires.";O;8;;;;;;;;2008-07-02;;;0.13;0.13;;;;;;;0.53;0.48;A;A;1979-06-00633
760;"[MER] LAT 38.02, LON 17.41 (INT) 21.06.1979";Maritime;INT;"(D) Département";1979;06;21;"Le 21 juin 1979 à 22h 25 locale plusieurs marins d'un bâtiment de la marine nationale en Mer Ionienne (lat 38°02N et long 17°41E) aperçoivent un phénomène lumineux à 15° au-dessus de l'horizon. Un point lumineux grossissant se sépare soudain en trois parties lumineuses dont l'intensité diminue progressivement. Les couleurs passent du blanc à l'orange pour redevenir blanc. La trajectoire observée est S-O Est. Le phénomène se déplaçant à grande vitesse a été observé durant une minute. Ces personnes ont probablement été témoins d'une rentrée atmosphérique.";"observation d'un rentrée atmosphérique.";O;1;;;;;;;;2009-08-12;;;0.38;0.13;;;;;;;0.65;0.35;B;B;1979-06-00634
761;"SAINT-FLORENT (45) 30.06.1979";Loiret;45;"(D) Département";1979;06;30;"Le GEIPAN continue à publier l'ensemble de ses archives sur son site public www.geipan.fr. Dans ses publications, figurent des cas anciens classés à l'époque en cas de type « A » et qui font aujourd'hui l'objet d'un réexamen. Celui-ci n'a pas pour but de diminuer ou augmenter telle ou telle catégorie de classement mais d'être plus pertinent dans les conclusions. Grâce à de nouveaux moyens techniques (logiciels) et à l'expérience d'enquête acquise depuis toutes ces dernières années, ce réexamen aboutit quelquefois à de nouvelles remarques voire à un changement de classification explicité dans une note d'enquête. Ce cas d'observation fait partie de cas classés « A » en 1979 par le GEPAN, sous le nom de COULLONS (45) 10.06.1979.<br>  Le 30 juin 1979 vers 0h30 quatre personnes dans un véhicule circulent sur la D 54 entre Saint-Florent (45) et Villemurlin (45) (voir la note d'enquête). Arrivés au chemin vers le lieu-dit Pierrefitte, ils aperçoivent au loin un phénomène de couleur rouge qui semble descendre du ciel au niveau de la route. La forme décrite varie selon les témoins (en forme de banane avec les pointes vers le ciel ou en forme de goutte). La voiture arrêtée, ils observent le PAN : aucun bruit n'est entendu, aucun signal lumineux intermitent sur le PAN ne sont remarqués. Les témoins voient alors le Pan se déplacer lentement. Apeurés, ils décident de faire demi-tour pour repartir vers Coullons afin d'avertir la gendarmerie. Un des témoins verra le PAN disparaitre derrière les arbres bordant la route. Reçus par les gendarmes à 0h55 ces derniers partent immédiatement à l'endroit indiqué sans les témoins.<br> Les premières constations la nuit même à 1h20 ne permettent pas de trouver de traces. Le lendemain, les gendarmes en compagnie des témoins retournent sur les lieux présumés du PAN et découvrent un foyer d'un diamètre de 1,60m. Les cendres sont encore chaudes. Aucune autre trace sur le sol ou dans la végétation et aucun autre témoignage ne sera recueilli. L'enquête  démontrera que l'avant-veille (le 28 juin) des agriculteurs ont allumé un feu de broussailles. Les gendarmes émettent l'hypothèse que les témoins ont certainement aperçu un tourbillon d'escarbilles provenant du feu de broussailles ce qui expliquerait la forme en poire ou goutte du phénomène ainsi que sa couleur rouge.<br> Malgré une concordance de lieux entre la position apparente du lieu du PAN et l'emplacement du foyer du feu de broussaille, l'hypothèse d'une méprise avec ce dernier convient mal avec l'observation du PAN. Aujourd'hui l'hypothèse envisageable d'une méprise avec la Lune est confortée non seulement par le fait que la Lune était en train de se coucher, ce qui est parfaitement cohérent avec la couleur rouge du PAN, mais également par le fait que son azimut (281°) correspond parfaitement à celui de l'axe de la D54. De plus, l'aspect visuel de la Lune au coucher est parfaitement cohérent avec celui du PAN tel que décrit par les témoins, le croissant lunaire étant posé sur l'horizon. Bien que les témoins ne mentionnent pas la présence de la Lune, elle était visible dans l'axe qu'ils indiquent. La parfaite cohérence entre la position vraie de la Lune, sa localisation et les descriptions fournies par les témoins ne laisse pas de doute sur la méprise. Ce n'est pas la perception visuelle des témoins qui est en cause, mais l'interprétation que les témoins font de leur observation à travers leur ressenti (fatigue, conduite, peur).<br> Le GEIPAN classe ce cas A : méprise avec la Lune au coucher.";"Observations lointaines d'un phénomène rouge en déplacement lent : méprise de la Lune au coucher.";O;4;;;;;;;;2015-09-29;;;0.13;0.13;;;;;;;0.53;0.48;A;A;1979-06-00635
762;"SALON DE PROVENCE (13) 1979";Bouches-du-Rhône;13;"(D) Département";1979;06;30;"Le 30 juin  1979 vers 23h 30 des automobilistes circulent sur une départementale lorsqu'ils aperçoivent une lueur lumineuse dans le ciel. Un point lumineux d'abord fixe se déplace progressivement en se rapporchant des témoins. Deux feux rouge et vert de chaque coté du point clignotent alternativement. Un bruit de souffle est entendu lors du passage au-dessus des témoins apeurés et une forme triangulaire est aperçue. L'engin s'éloigne rapidement vers le Sud. Ces informations correspondent  aux descriptions  de nuit de  vols d'aéronefs (bruit, géométrie et couleur des feux). Ces témoins ont probablement observé le passage d'un avion.";"Observation probable du passage d'un aéronef.";O;2;;;;;;;;2008-07-02;;;0.25;0.13;;;;;;;0.59;0.41;B;B;1979-07-00636
763;"RUEIL-MALMAISON (92) 03.06.1979";Hauts-de-Seine;92;"(D) Département";1979;06;03;"Le 3 juin 1979 à 17h 45 un témoin observe durant 7 à 8 minutes un objet étrange qui se déplace du Nord au Sud dans le ciel. Cet objet de forme triangulaire est de couleur rouge. Aucun bruit et aucune trainée n'ont été constatés par le témoin. Aucun autre témoignage n'a été recueilli sur ce phénomène pour lequel nous manquons d'informations.";"Observation d'un objet de forme triangulaire se déplaçant lentement";O;1;;;;;;;;2008-06-19;;;0.50;0.50;;;;;;;0.28;0.28;C;C;1979-06-01719
765;"FOIX (09) 04.07.1979";Ariège;09;"(D) Département";1979;07;04;"Ce cas d'observation fait partie des cas classé ""C"" en 2008 par le GEIPAN : il a fait l'objet d'un nouvel examen. (voir le document : Notes d'enquête).<br>  Le 4 juillet 1979 à 2h du matin une personne rentrant chez elle aperçoit une grosse masse de couleur rouge orangé de la forme d'un obus. Le témoin apeuré rentre chez lui et observe le phénomène durant 2 minutes : aucun bruit n'est entendu. Cette masse disparaitra dans le paysage.<br> Aucun autre témoignage ne sera recueilli sur ce phénomène.<br> Le phénomène décrit présente beaucoup de caractéristiques communes (durée d'observation, forme, taille, couleur) avec un objet astronomique parfaitement connu : la Lune au coucher. De plus, la Lune était bien présente sur la zone du ciel observée.<br> Ce n'est pas la perception visuelle du témoin qui est en cause, mais l'interprétation que le témoin fait de son observation à travers son ressenti (fatigue, peur). Dans la classification actuelle du GEIPAN, ce cas d'étrangeté faible est classé comme PAN A, observation liée avec une méprise avec la Lune.";"Observation d'une masse rouge orangé dans le ciel : observation astronomique de la Lune à son coucher.";O;1;;;;;;;;2013-06-26;;;0.13;0.13;;;;;;;0.53;0.48;A;A;1979-07-00637
766;"CHOLET (49) 10.07.1979";Maine-et-Loire;49;"(D) Département";1979;07;10;"Le 10 juillet vers 3h du matin un témoin observe par sa fenètre une masse lumineuse qui se déplace en diagonale du Nord vers l'Est. De forme ronde ou ovoïde et de couleur jaune, cet objet sera observé durant 10 à 15 minutes avant de disparaître. Aucun bruit n' a été entendu. Cette personne a probablement observé le passage d'un satellite de type Transit ou Oscar et non Skylab qui n'était plus visible en France depuis fin juin.";"Probable observation d'un satellite.";O;1;;;;;;;;2008-06-26;;;0.38;0.13;;;;;;;0.65;0.35;B;B;1979-07-00638
767;"FREJUS (83) 13.07.1979";Var;83;"(D) Département";1979;07;13;"Le GEIPAN continue à publier l'ensemble de ses archives sur son site public www.geipan.fr. Dans ses publications, figurent des cas anciens classés à l'époque (A, B, C ou D) et qui font aujourd'hui l'objet d'un réexamen, dans le seul but d'être plus pertinent dans les conclusions. Grâce à de nouveaux moyens techniques (logiciels) et à l'expérience d'enquête acquise depuis toutes ces dernières années, ce réexamen aboutit quelquefois à de nouvelles remarques voire à un changement de classification.<br>
Ce cas d'observation précédemment classé D et nommé SAINT-RAPHAEL (83) 1979 fait partie d'un ensemble de cas réexaminés récemment (voir le compte rendu d'enquête).<br>

Le 13 juillet 1979 à 13h10 deux témoins (T1 et T2) travaillant à la vigie du mont Vinaigre dans le massif de l'Esterel sur la commune de Fréjus (83) sont intrigués par les évolutions d'un objet sphérique très lumineux dans le paysage. Lors de leurs dépositions en gendarmerie, un croquis est établi et montre les déplacements successifs de cet objet (voir le PV de gendarmerie). Le T2 utilise des jumelles et décrit un objet qui descend à la verticale d'un nuage, descend de la colline par saccades, passe d'une colline à l'autre, faits des arrêts, et enfin remonte et disparaît dans un nuage. Aucun autre témoignage ne sera recueilli. Les services radars contactés par la gendarmerie n'ont rien détecté.<br>

Les conditions météorologiques au jour et à l'heure de l'observation sont un facteur clé nous permettant de comprendre et d'expliquer les déplacements complexes du PAN, qui formaient l'essentiel de l'étrangeté du cas.<br>
Ces conditions, à savoir un vent maximal observé de 34 nuds avec un écoulement de l'air turbulent dans la zone, se sont produites dans une zone au relief accidenté. Or, il suffit d'un vent minimal de 10 à 15 nuds pour qu'un ballon plus léger que l'air, comme par exemple un modèle en nylon métallisé (souvent nommé « ballon Mylar »), suive un déplacement irrégulier horizontalement et verticalement. L'impossibilité (pour tout témoin) de percevoir correctement la distance d'un phénomène inconnu, peut conduire à surévaluer les distances et donc les vitesses de déplacements à partir des déplacements angulaires (les seuls réellement perçus par les yeux), et ainsi à accroitre l'étrangeté du perçu (saut rapide d'une colline à une autre, arrêt intelligent au-dessus de la nationale.)<br>

Ces ballons Mylar, peuvent être gonflés à l'air mais le plus souvent à l'hélium et peuvent alors voler entre deux semaines et deux mois, transportés au gré des vents locaux.<br>

De tels ballons existent depuis la fin des années 70 et sont souvent de forme circulaire ou ovoïde, parfois agrémentés d'un dessin fantaisie.<br>

La visibilité de ce type de ballon est favorisée par leur enveloppe aluminée qui réfléchit fortement la lumière solaire, leur forme n'étant vraiment discernable qu'à une plus courte distance.<br>
Par ailleurs, cette forte réflexion de la lumière solaire couplée à la distance d'observation ne permet pas de distinguer ni l'éventuel dessin fantaisie ni l'appendice permettant le gonflage.<br>

En conséquence GEIPAN classe le cas en B : observation probable d'un ballon Mylar.";"Observations des évolutions silencieuses dans le paysage montagneux de l'Esterel d'un objet sphérique très lumineux : probable observation d'un ballon Mylar.";O;2;2;;1;;;;;2018-05-29;;;0.40;0.00;;;0.75;;0.75;;0.56;0.00;B;B;1979-07-00639
768;"BEAUVAIS (60)1979";Oise;60;"(D) Département";1979;07;14;"Le 14 juillet 1979 entre 21h50 et 21h 55, deux témoins aperçoivent dans le ciel à une altitude de 100 à 150 m, un objet arondi de la forme d'un chaudron et de couleur inox ou aluminium. Sa trajectoire horizontale est NE-SO et il se déplace en oscillant régulièrement et sans bruit. Des reflets apparaissent lors du déplacement. Aucun autre témoignage n'a été recueilli sur ce phénomène. D'après la description et à la date du 14 juillet beaucoup d'objets insolites se déplacent à basse altitude : ces témoins ont probablement vu le passage d'un cerf volant.";"observation d'un objet insolite de type cerf volant";O;2;;;;;;;;2008-06-30;;;0.38;0.13;;;;;;;0.65;0.35;B;B;1979-07-00640
769;"POULIGUEN (LE) (44) 16.07.1979";Loire-Atlantique;44;"(D) Département";1979;07;16;"Le GEIPAN continue à publier l'ensemble de ses archives sur son site public www.geipan.fr. Dans ses publications, figurent des cas anciens classés à l'époque (A, B, C ou D) et qui font aujourd'hui l'objet d'un réexamen, dans le seul but d'être plus pertinent dans les conclusions. Grâce à de nouveaux moyens techniques (logiciels) et à l'expérience d'enquête acquise depuis toutes ces dernières années, ce réexamen aboutit quelquefois à de nouvelles remarques voire à un changement de classification.<br>
Ce cas d'observation précédemment classé D et nommé LA BAULE (44) 1979 fait partie d'un ensemble de cas réexaminés récemment.<br>
Deux personnes (T1 et T2) observent, depuis leur domicile, un phénomène lumineux avec un halo aux couleurs rouge-orangé et jaune dans le ciel nocturne au-dessus de Pornichet. Ce phénomène de très grande taille est perçu fixe puis se déplaçant ensuite en direction de Saint-Nazaire; le halo disparaît progressivement. Aucun autre témoignage ne sera recueilli malgré des avis passés par la gendarmerie dans la presse et sur les ondes.<br>

Les deux témoins ont très probablement observé la Lune. La Lune (El 4,6°, Az 90,5) est effectivement présente très basse au-dessus de Pornichet, vu de la pointe de Penchateau.<br>
Toutes les descriptions sont conformes à une méprise avec la Lune se levant à l'horizon :<br>
- formes : des nuages sont présents cette nuit là, une présence partielle et variable (trouée) de nuages devant la Lune, peut la faire apparaître selon tous types de formes. La mention de halo est également conforme à l'effet de diffusion de la lumière de la Lune par les brumes et nuages au voisinage de la trouée. T2 distingue bien une forme centrale plutôt bien délimitée (la trouée) au sein d'un halo.T2 rapporte "" Effectivement, j'ai observé durant une minute environ, un ovni, ayant la forme d'un dôme, se détachant nettement d'un halo de couleur rouge"" ;<br>
- couleurs : selon l'épaisseur de brume ou de nuage, la couleur peut effectivement varier du rouge ou ""jaune violent"" ;<br>
- taille : la Lune avec le halo l'entourant peuvent effectivement correspondre à la largeur de Pornichet vu de la Pointe de Penchateau (3 ou 5 degrés), comme le mentionne T2.<br>
- perception de déplacement : celle-ci vient en fin d'observation, le PAN étant décrit comme fixe jusque là. T1 mentionne un déplacement vers Saint-Nazaire. Il s'agit de l'illusion classique produite par la diminution de la taille angulaire et/ou de la luminosité d'un PAN (ici la fermeture progressive de la trouée nuageuse sur la Lune), le témoin l'interprète très logiquement comme un éloignement en distance. La géographie des lieux autorise parfaitement de décrire un éloignement de distance au-delà de Pornichet, vu de la pointe de Penchateau, comme un déplacement vers Saint-Nazaire.<br>
T2 fait d'ailleurs une description très précise de ce phénomène de déplacement apparent : ""Lorsque j'ai vu cet ovni se mouvoir, il s'est déplacé progressivement d'une vitesse assez régulière au départ, puis plus vite par la suite, mais toujours avec la même progression. Il n'a pas disparu d'un coup. J'ai toujours vu ce halo qui diminuait au fur et à mesure que l'ovni s'éloignait"".<br>

Notons l'étonnement de T2 :  ""Ce qui m'a le plus frappé, c'est que ce halo ne s'est pas réfléchi soit sur l'eau, soit dans le ciel"". T2 imagine le PAN au Pornichet, donc  juste sur l'autre rive de la baie par rapport au point d'observation. Il est logique de rechercher un effet miroir (réflexion spéculaire) sur l'eau à un point milieu entre le PAN et T2. Mais la Lune, comme les nuages diffusant sa lumière, sont bien plus loin. La réflexion sur l'eau, ne peut pas être spéculaire mais uniquement par effet de diffusion, qui est bien moins intense et fonction de la rugosité de surface de l'eau (hauteur et orientation des vaguelettes) probablement pas assez forte ce soir là.<br>
En conséquence le GEIPAN reclasse le cas en A : observation de la Lune rousse.";"Observations par deux témoins d'un phénomène lumineux de grande taille aux couleurs rouge-orangé et jaune dans le ciel nocturne : observations de la Lune rousse.";O;2;2;;1;;;;;2018-07-19;;;0.10;0.00;;;0.70;;0.80;;0.55;0.00;A;A;1979-07-00641
770;"LA GARENNE-COLOMBES (92) 1979";Hauts-de-Seine;92;"(D) Département";1979;07;16;"Dans la nuit du 18 au 19 juilllet 1979, plusieurs habitants d'un même quartier entendent entre 21h 30 et 0h 15 des bruits stridents et courts. Ces personnes effrayées voient ensuite des lueurs particulières dans le ciel. Ce même phénomène recommencera le soir du 20 juillet. L'enquète de gendarmerie permettra d'établir que ces phénomènes proviennent de tirs de fusées sifflantes lancées par jeu et sans autorisation depuis le jardin d'un pavillon voisin.";"Tirs de pièces d'artifice sans autorisation.";O;8;;;;;;;;2008-07-29;;;0.13;0.13;;;;;;;0.53;0.48;A;A;1979-07-00642
771;"ANNECY (74) 1979";Haute-Savoie;74;"(D) Département";1979;07;20;"Le 20 juillet 1979 vers 10h plusieurs personnes observent dans le ciel et durant une vingtaine de minutes une forme brillante particulière. Selon l'emplacement des témoins cet objet ovoïde mesure entre 80cm et 5m de diamètre et  prend une couleur métallique ou noire. Il est tout d'abord stationnaire au-dessus d'une maison puis s'élève et s'éloigne progressivement sans aucun bruit. D'après la gendarmerie  aucune observation particulière n'a été déclarée depuis les aérodromes ou bases de la région et aucun vol d'objet publicitaire n'a été fait dans cette période. La description de l'objet et de son déplacement par les témoins restent néanmoins très proche de celle d'un ballon.";"Observation d'un objet rond, descendant et montant lentement.";O;4;;;;;;;;2008-07-29;;;0.38;0.13;;;;;;;0.65;0.35;B;B;1979-07-00643
772;"PRANLES (07) 21.07.1979";Ardèche;07;"(D) Département";1979;07;21;"Le GEIPAN continue à publier l'ensemble de ses archives sur son site public www.geipan.fr. Dans ses publications, figurent des cas anciens classés à l'époque (A, B, C ou D) et qui font aujourd'hui l'objet d'un réexamen, dans le seul but d'être plus pertinent dans les conclusions. Grâce à de nouveaux moyens techniques (logiciels) et à l'expérience d'enquête acquise depuis toutes ces dernières années, ce réexamen aboutit quelquefois à de nouvelles remarques voire à un changement de classification.<br>
Ce cas d'observation précédemment classé D et nommé LES OLLIERES (07) 1979 fait partie d'un ensemble de cas réexaminés récemment.<br>
Le 21 juillet 1979 un premier groupe de personnes (T1 et son épouse) observe de 22h45 à 23h28 la présence d'une phénomène lumineux de couleurs et stationnaire au sommet d'une ligne de crête en direction de la ""Serre de Pieroulet"". Le PAN est décrit comme un ""phare"" avec une puissante source lumineuse jaune-orange projetant un faisceau bleu tournant régulièrement sur 360° et balayant le sol. Durant l'observation de 45 minutes aucun bruit particulier n'est entendu. Le T1 s'apprête à prendre une photographie lorsque le PAN s'éteint brusquement. Le lendemain ces premiers témoins apprennent que leurs plus proches voisins (T2 et son épouse), en fermant les volets vers 23h, ont constaté la présence d'un PAN lumineux dans la même direction. T2 et son épouse ont observé le PAN une dizaine de minutes avant d'aller se coucher. La Gendarmerie est prévenue le lendemain par T1. Seuls T1 et T2 ont témoigné.<br>

Le PAN a été particulièrement bien décrit par le témoin principal T1. Son rapport nous a ainsi permis de nous rendre compte que l'apparence et le comportement du PAN était très particulier et ne correspondait à aucun phénomène connu, qu'il soit d'origine naturelle ou artificielle (voir le compte-rendu d'enquête).<br>

En effet, la seule hypothèse pourrait être un hélicoptère (car le PAN est bien stationnaire dans le ciel) utilisant un projecteur, mais dont, de manière inexplicable, le faisceau serait bleu, d'une couleur différente de celle de la source, et tournerait sans cesse sans aucun objectif de surveillance ou éclairage.<br>

Le témoin T1 étant hélas décédé, il nous a été impossible de continuer plus en avant l'enquête, qui aurait pu se poursuivre avec par exemple un entretien cognitif ou une reconstitution sur place. Les trois autres témoins n'ont pas pu être retrouvés mais il est aussi possible, presque 40 ans après les faits, qu'ils soient également décédés.<br>

Le domaine d'expertise scientifique de T1 touche de très près tout ce qui concerne la lumière et la couleur, ainsi que l'impact qu'elles ont sur leur environnement. Il se trouve que son observation porte justement sur des phénomènes lumineux et colorés entrant exactement dans son domaine d'expertise. Cette coïncidence conforte la consistance déjà factuelle compte-tenu de la précision et complétude de la description :<br>
- le témoin utilise des paramètres descriptifs qu'il maitrise ;<br>
- en termes de fiabilité, la large reconnaissance dont bénéficiait déjà le témoin T1 ne permet pas d'imaginer un désir particulier de rajouter de l'étrangeté à une observation pour se faire valoir. Au contraire l'attitude des scientifiques reconnus pousse en général à la plus grande distance par rapport au PAN.  Dans ce contexte, le témoignage est représentatif d'une réelle étrangeté vécue et d'un enjeu de connaissance pour ce scientifique.<br>

T1 n'a pas pris de photographie. Il est a priori possesseur d'appareil photographique, mais on comprend que le témoin prend son matériel au moment où le PAN disparaît.<br>

Nous pouvons regretter la qualité médiocre du témoignage de T2, peu détaillé et l'absence des deux autres témoignages, ceux des épouses.<br>
Néanmoins, le témoignage de T2, outre qu'il place le PAN dans la même direction et au même moment, confirme celui de T1 sur les points qui font l'essentiel de l'étrangeté : lueur fixe jaune/orange, lumière bleue balayant le sol. T2 ne mentionne pas le faisceau et l'étrangeté vécue parait faible (les témoins cessent d'observer et vont se coucher).<br>

Dans la méthodologie actuelle du GEIPAN, le présent niveau d'étrangeté et de consistance imposent de pratiquer une « enquête terrain » avec le témoin pour une reconstitution et un entretien cognitif. Cette dernière est susceptible d'impacter positivement et négativement l'évaluation d'étrangeté comme de la consistance. Mais elle n'est pas possible pour un cas en revisite si longtemps après. Aussi l'évaluation du présent cas est faite selon les critères actuels de prise en compte de l'étrangeté et de la consistance (Voir actualité GEIPAN <b><a href=""http://www.cnes-geipan.fr/index.php?id=181&no_cache=1&tx_ttnews[backPid]=211&tx_ttnews[tt_news]=209"">La méthodologie de classification du GEIPAN</a></b>)
comme si l'enquête terrain avait été faite et avait été totalement neutre (aucun apport en plus ou moins), ce qui est quelque fois le cas.<br>
Par contre, afin de marquer cet écart méthodologique, la classification se fait sur la base A B C D et non sur l'actuelle A B C D1/D2 qui correspond pour le classement inexpliqué à une validation plus forte du caractère inexpliqué.<br>

Ici le cas est la limite entre un cas inexpliqué et un cas inexploitable par manque de consistance dans l'état de dossier faute d'apport d'une enquête GEIPAN menée sur place.<br>

En conséquence, le cas est classé D : Phénomène étrange de consistance moyenne ou forte.";"Observations par deux groupes distincts de témoins d'un phénomène lumineux stationnaire de couleur jaune-orange projetant un faisceau bleu tournant régulièrement à 360° : phénomène étrange de consistance moyenne ou forte.";O;2;2;;1;;;;;2019-02-20;;;0.70;0.00;;;0.88;;0.88;;0.77;0.00;D;D1;1979-07-00644
773;"SAINT-LYS (31) 23.07.1979";Haute-Garonne;31;"(D) Département";1979;07;23;"Le 23 juillet 1979 vers 21h 40 une automobiliste et ses passagères observent durant plusieures minutes un objet paticulier qui les intrige. Cet objet lumineux et orangé de la forme d'un cigare de deux mètres de long se déplace rapidement dans le sens Sud-Est Nord-Ouest. Volant à 200 mètres du sol, il semble tourner sur lui-même. Il disparaît rapidement à l'horizon. Aucun autre témoignage ne sera recueilli sur ce phénomène pour lequel nous manquons de données.";"Observation d' un objet en forme de cigare tournant sur lui-même.";O;1;;;;;;;;2008-07-30;;;0.50;0.50;;;;;;;0.28;0.28;C;C;1979-07-00645
774;"COLOMBES (92) 25.07.1979";Hauts-de-Seine;92;"(D) Département";1979;07;25;"Le 25 juillet 1979 vers 21h 30 deux témoins observent dans le ciel un point lumineux orangé qui se déplace puis semble s'immobiliser.  La luminosité de ce point de petite taille décline soudain fortement. Il disparaît instantanément ne laissant qu'une traînée blanche. Aucun autre témoignage ne sera recueilli sur ce phénomène pour lequel nous manquons d'informations.";"Observation d'un point lumineux orangé avec trainée.";O;1;;;;;;;;2008-07-30;;;0.50;0.50;;;;;;;0.28;0.28;C;C;1979-07-00646
775;"HERBLAY (95) 28.07.1979";Val-d'Oise;95;"(D) Département";1979;07;28;"Dans la nuit du 27 au 28 juillet 1979 vers minuit, une personne est réveillée par une luminosité particulière dans sa chambre. Le témoin observe alors par la fenètre une boule lumineuse blanche. Celle-ci se déplace très lentement dans le sens Nord-Ouest Nord-Est sans aucun bruit. Cette boule est plus grosse que la lune. Elle disparaîtra cachée par les bâtiments. Aucun autre témoignage ne sera recueilli sur ce phénomène pour lequel nous manquons d'informations.";"Observation d'une boule se déplaçant lentement.Aucun bruit";O;1;;;;;;;;2009-10-02;;;0.50;0.50;;;;;;;0.28;0.28;C;C;1979-07-00647
776;"SAINT-PIERRE ET MIQUELON ( 989) 1979";Saint-Pierre-et-Miquelon;975;"(D) Département";1979;07;16;"Le 16 juillet 1979 vers 21h 40 deux personnes observent  un objet lumineux dans le ciel. Cet objet est de forme trapézoïdale de couleur sombre avec quatre lumières à l'avant et un feu rouge à l'arrière. D'abord stationnaire au-dessus de l'anse du Savoyard, cet objet se déplace lentement vers l'Est. Après une accélération subite, il s'est élevé à la verticale dans le ciel avant de disparaître. Aucun bruit n'a été entendu. Aucun aéronef n'a décollé ou attéri sur l'ile après 20h et aucun autre témoignage ne sera recueilli sur ce phénomène qui reste inexpliqué.";"Observation d'un objet changeant de direction et de vitesse";O;2;;;;;;;;2008-07-01;;;0.75;0.25;;;;;;;0.78;0.23;D;D;1979-07-01718
777;"TOULOUSE (31) 14.07.1979";Haute-Garonne;31;"(D) Département";1979;07;14;"Le 14 juillet 1979 vers 22h 45 un témoin au milieu de la foule venue regarder le feu d'artifice, aperçoit dans le ciel ( à 45°) le passage d'une lumière qui l'intrigue. Il observe durant 8 à 12 secondes cette luminosité qui traverse le ciel en ligne droite du Sud au Nord à une vitesse constante.  Cet objet a la forme d'un disque lumineux avec une petite queue plus floue. Le témoin constate des variations de couleurs mais aucun bruit venant de l'objet n'est perceptible. Il disparaitra rapidement. Malgré la foule présente à ce moment là, aucun autre témoignage n'a été recueilli sur ce phénomène pour lequel nous manquons d'informations.";"Observation d'un disque lumineux traversant le ciel.";O;1;;;;;;;;2011-02-23;;;0.50;0.50;;;;;;;0.28;0.28;C;C;1979-07-01862
778;"ARGENTEUIL (95) 13.07.1979";Val-d'Oise;95;"(D) Département";1979;07;13;"Le 13 juillet 1979 vers 23h 30 des témoins aperçoivent dans le ciel un objet qui attire leur attention. Une boule de la grosseur d'un ballon de foot et de couleur rouge orangé se déplace à haute altitude. Durant l'observation, cet objet changera de forme, de couleur et s'immobilisera avant de repartir à très grande vitesse et de disparaître dans l'atmosphère. Aucun autre témoignage ne sera recueilli sur ce phénomène qui reste inexpliqué.";"observation d'un objet avec changement de forme, de couleur et trajectoire.";O;1;;;;;;;;2008-06-30;;;0.75;0.25;;;;;;;0.78;0.23;D;D;1979-07-01863
780;"CARENTOIR (56) --.07.1979";Morbihan;56;"(D) Département";1979;07;--;"Témoignage récent (23/11/2009) d'une observation ancienne : en juillet 1979 (le témoin ne se souvient pas de la date exacte) deux personnes sont prises de violents maux de tête après avoir observé un éclair lumineux sur un mur de leur chambre. Ces maux de tête disparaissent en même temps que le phénomène lumineux. Regardant par la fenêtre pour déterminer l'origine de cette lumière, ces deux personnes observent plusieurs faisceaux lumineux éclairant la route. Le journal local rapportera par la suite, la présence de zones d'herbes brulées dans un champ du secteur (aucune précision sur le nom du journal local et la date de parution de l'article). Aucun autre témoignage n'a été recueilli sur cette observation ancienne pour laquelle toute enquête est difficile voir impossible.";"Observation d'un éclair lumineux et maux de tête.";O;1;;;;;;;;2010-04-02;;;0.50;0.50;;;;;;;0.28;0.28;C;C;1979-07-02484
781;"CASTETNAU-CAMBLONG (64) 15.07.1979";Isère;38;"(D) Département";1979;07;15;"Un témoin rapporte en 2011 une observation ancienne . Il ne se souvient pas de l'année et du mois exacts (entre 1979 et 1980, entre mi-juillet mi-août en fin d'après midi). La date du cas est donnée arbitrairement.<br> Observant avec une lunette astronomique le paysage, le témoin est intrigué par un objet immobile, de forme triangulaire, de couleur rouille orangé clair. L'objet est rapidement caché par une brume et un nuage. L'observation aura duré moins de 30 secondes.<br>  La forme triangulaire de l'objet, son faible déplacement font penser à un ballon tétraédrique.Certains ballons sondes sont de couleur marron-orangé, le témoin le décrit de couleur rouille. Mais les détails de la surface de l'objet décrits par le témoin correspondent mal à cette hypothèse. Comme la date précise n'est pas connue, il n'est pas possible de faire des vérifications de vent ou de lancements de ballons par Météo-France ou le CNES. Faute d'informations précises, ce cas est classé ""C""";"Temoignage récent d'une observation ancienne. Observation d'un objet triangulaire immobile de couleur rouille. Manque d'informations précises.";O;1;;;;;;;;2013-01-17;;;0.50;0.50;;;;;;;0.28;0.28;C;C;1979-07-08188
783;"ACHERES (78) 05.08.1979";Yvelines;78;"(D) Département";1979;08;05;"Le 5 août 1979 entre 23h et 23h 30 un témoin et des gendarmes observent dans le ciel  des phénomènes lumineux particuliers. Des boules de tailles et couleurs différentes brillent à gauche de la Lune.. Certaines se déplacent par à coups de gauche à droite et parfois à très grande vitesse. Elles disparaitront dans les nuages. Aucun autre témoignage ne sera recueilli sur ce phénomène pour lequel nous manquons d'informations.";"Observation de 3 boules de taille différente .";O;1;;;;;;;;2012-08-20;;;0.50;0.50;;;;;;;0.28;0.28;C;C;1979-08-00649
785;"MIREBEAU (86) 11.08.1979";Vienne;86;"(D) Département";1979;08;11;"Le 11 août 1979 vers  21h10 plusieurs personnes observent un phénomène lumineux  particulier. Alors que le soleil se couche, trois anneaux de couleur rouge -orangé sont visibles sur l'horizon en-dessous d'une couverture nuageuse. Ces disques se sont ensuite résorbés en prenant l'allure d'un trait horizontal qui a disparu rapidement vers le Nord dans les nuages. Aucun autre témoignage n'a été recueilli dans le secteur.  D'après la description des témoins, il est probable que ce phénomène soit un effet d'optique dû au soleil couchant se reflétant sur une couverture nuageuse basse.";"Observation de 3 disques lumineux.";O;1;;;;;;;;2008-07-30;;;0.38;0.13;;;;;;;0.65;0.35;B;B;1979-08-00651
788;"BELVEDERE-CAMPOMORO (2A) 22.08.1979";Corse-du-Sud;2A;"(D) Département";1979;08;22;"Le 22 août 1979 vers 22h 45 deux témoins observent un point lumineux qui les intrigue. D'abord fixe entre 100 et 150 mètres à l'aplomb du golf, il se déplace ensuite vers l'Ouest en baissant d'intensité. Le témoin a ensuite observé le point avec des jumelles et dit avoir vu deux parallélogrammes de couleur jaune.  Aucun autre témoignage ne sera recueilli sur ce phénomène. Les diverses formes observées pourraient être dûes aux aberrations des jumelles, fréquentes lorsqu'il s'agit de jumelles de qualité médiocre et que l'on observe un point lumineux. Il est probable que le phénomène observé soit un avion éclairé par le soleil.";"Observation vraisemblable d'un avion éclairé par le soleil";O;1;;;;;;;;2008-07-31;;;0.38;0.13;;;;;;;0.65;0.35;B;B;1979-08-00654
789;"BONNEUIL-SUR-MARNE (94) 28.08.1979";Val-de-Marne;94;"(D) Département";1979;08;28;"Le 28 août 1979 à 20h 45 un témoin observe aux jumelles le passage d'un avion de ligne. Il va apercevoir à l'arrière de l'avion et au-dessus une forme très lumineuse et rectangulaire. Aucun autre renseignement n'a été apporté sur ce phénomène par les brigades de gendarmes limitrophes de l'aéroport de d'Orly ou par le chef du centre de contrôle régional d'Orly Sud.";"Observation d'un objet très lumineux de forme rectangulaire de la grosseur d'un avion.";O;1;;;;;;;;2008-07-31;;;0.50;0.50;;;;;;;0.28;0.28;C;C;1979-08-00655
790;"LUS LA CROIX HAUTE (26) 1979";Drôme;26;"(D) Département";1979;08;30;"Le 30 août 1979 un cultivateur se rend dans un champ de seigle et aperçoit un rond brûlé de 10,50 mètres de diamètre. Il remarque que l'herbe est plus verte à l'intérieur du cercle que dans la prairie avoisinante. Aux environs du 20 septembre, ce même témoin découvrira que des champignons du type rosés de prés ont poussé à l'intérieur et extérieur du cercle. Ce phénomène a déjà été constaté dans les prairies du secteur.";"Observation d'un rond de champignons de 11 mètres de diamètre au sol.";O;2;;;;;;;;2008-07-31;;;0.13;0.13;;;;;;;0.53;0.48;A;A;1979-09-00665
791;"ATHIS-MONS (91) 24.08.1979";Essonne;91;"(D) Département";1979;08;24;"Temoignage récent (20/10/2012) d'une observation ancienne.<br> Un témoin rapporte avoir observé le 24 aout 1979 vers minuit, un engin de couleur argenté stationnaire mais tournant sur lui-même silencieusement  au-dessus de câbles électriques d'une zone urbaine. <br> Aucun autre témoignage n'a été recueilli sur ce phénomène.<br>  L' analyse fine du  témoignage par un psychologue universitaire laisse apparaître plusieurs incohérences et ne permet pas de considérer que les faits relatés ont été intégralement vécus, mais qu'il s'agit plus probablement d'un mélange de faits réels et d'éléments imaginés ou venant d'autres récits. La mémoire a pu confondre ces éléments après plus de 30 ans. Il faut aussi savoir que l'adolescence est aussi un âge propice à la création de ""faux souvenirs"". Une enquête 30 ans après ne ramènerait pas d'informations sûres.<br>  Ce cas est classé ""C"" par manque d'informations fiables, recoupements ou autres.";"Observation d'un engin de couleur aluminium tournant silencieusement comme une toupie et survolant les lampadaires d'un agglomération : manque d'informations fiables.";O;1;;;;;;;;2013-02-27;;;0.50;0.50;;;;;;;0.28;0.28;C;C;1979-08-08386
792;"NOIRMOUTIER (85) 1979";Vendée;85;"(D) Département";1979;09;08;"Le 7 septembre 1979 vers 4h 30 deux témoins observent, durant moins de 5 secondes, une forme ovale de couleur verte avec quatre lumières blanches et entourée d'un cercle noir. Les couleurs sont très vives et phosphorescentes. Cet objet monte très rapidement dans le ciel à 45° en suivant une direction Sud-Nord. Il s'éteint subitement. Aucun autre témoignage n' été recueilli sur ce phénomène pour lequel nous manquons d'informations.";"Observation d'un objet oval sélevant vers le ciel .Soudaine disparition.";O;2;;;;;;;;2008-11-04;;;0.50;0.50;;;;;;;0.28;0.28;C;C;1979-09-00656
793;"EVRECY (14) 1979";Calvados;14;"(D) Département";1979;09;08;"Le 8 septembre 1979 vers 4h 30 deux témoins observent depuis leur chambre le passage dans le ciel d'un objet  circulaire. Il se déplace à grande vitesse en perdant de l'altitude. Un halo lumineux orangé entoure l'objet. Voulant ouvrir la fenètre, un des témoins recevra une décharge électrique. Aucun autre témoignage ne sera recueilli sur ce phénomène et la station EDF n'a constaté aucune anomalie sur ses lignes. Ces personnes ont probablement assisté à une rentrée atmosphérique. L'épisode de la  décharge électrique reçue par un des témoins,  même si elle s'est passée au moment de l'observation, ne peut être mise en rapport direct avec le type de phénomène observé.";"Probable observation d'une rentrée atmosphérique.";O;2;;;;;;;;2008-07-31;;;0.38;0.13;;;;;;;0.46;0.31;B;B;1979-09-00657
794;"LYONS LA FORET (27) 19.09.1979";Eure;27;"(D) Département";1979;09;19;"Le 19 septembre 1979 à 22h deux témoins lors de leur jooging observent dans le ciel une lueur rouge en forme de boule  qui scintille comme une étoile. Soudain cette lueur se déplace à une vitesse vertigineuse pour s'approcher des témoins. Aucun bruit et aucun déplacement d'air et chaleur n'ont été remarqués. Décrivant une courbe, cette lueur s'immobilise 3 à 4 secondes à 200 mètres environ des témoins au-dessus de la lisière de la forêt. Une masse sombre apparaît à l'intérieur de cette lueur. Le phénomène disparaît brusquement. Aucun autre témoignage ou élément ne seront  recueillis sur ce phénomène qui reste inexpliqué.";"Observation d'une lueur rouge avec approche rapide vers les témoins.";O;2;;;;;;;;2010-03-30;;;0.75;0.25;;;;;;;0.78;0.23;D;D;1979-09-00659
795;"VOUILLE (86) 1979";Vienne;86;"(D) Département";1979;09;20;"Le 20 septembre 1979 vers 23h plusieurs personnes observent un phénomène lumineux rouge se déplaçant rapidement dans le ciel d'Ouest en Est. Un cercle d'un diamètre de 4 mètres environ est traversé par deux diagonales rouges également. Il clignote et fait grand bruit. L'objet devenu blanc disparait derrière les collines. Aucun autre témoignage ne sera recueilli sur ce phénomène pour lequel nous manquons d'informations.";"Observation d'un disque lumineux de 4 métres de diamètre.";O;4;;;;;;;;2009-05-12;;;0.50;0.50;;;;;;;0.28;0.28;C;C;1979-09-00660
796;"MAUBEUGE (59) 1979";Nord;59;"(D) Département";1979;09;23;"Le 23 septembre 1979 vers 6h plusieurs personnes  observent dans le ciel un point lumineux se déplaçant sans bruit dans la direction Nord-Est. Ce point émet des couleurs vertes et rouges. Quelques instants plus tard, la voiture des témoins est inondée d'une lumière qui couvre toute la chaussée. Soudain la lumière s'éteint et un des témoins voit une forme s'élever à 45° dans le ciel, sans aucun bruit mais laissant derrière elle une flamme rouge. L'enquète sur les lieux n'a révélé aucun indice et aucune autre information n'a été recueillie sir ce phénomène qui reste inexpliqué.";"Observation d'un objet lumineux. Brusque disparition.";O;3;;;;;;;;2008-08-01;;;0.75;0.25;;;;;;;0.78;0.23;D;D;1979-09-00661
797;"YZEURE (03) 24.09.1979";Allier;03;"(D) Département";1979;09;24;"Le 24 septembre 1979 à 7h 42 un témoin aperçoit tout d'abord dans le ciel une trainée qu'il prend pour celle d'un réacteur d'avion. Puis il remarque un objet qui reste fixe durant 10 à 15 secondes. De couleur orange, il a la forme d'un disque.  Soudain l'objet se déplace à très grande vitesse et prend une couleur blanche éclatante avant de disparaître. Aucun autre témoignage ne sera recueilli sur ce phénomène pour lequel nous manquons d'informations.";"Observation d'un objet à haute altitude";O;1;;;;;;;;2008-08-01;;;0.50;0.50;;;;;;;0.28;0.28;C;C;1979-09-00662
800;"FOUCHERANS (39) --.09.1979";Jura;39;"(D) Département";1979;09;--;"Au mois de septembre 1979 vers 18h 30, un témoin, alors qu'il est seul à l'extérieur de sa propriété, observe un objet lumineux apparaissant à l'horizon. Cet objet avance très lentement dans la direction Sud-Nord. Pensant à un avion de ligne, le témoin ne quitte pas des yeux cet objet. Celui-ci va s'arréter au-dessus de lui : le témoin observe alors un objet sphérique très brillant, de couleur gris métallisé. L'objet, après une minute d'arrêt environ, repart mais en sens inverse, atteint l'horizon en quelques secondes et disparaît définitivement. Aucun bruit particulier n'a été entendu durant l'observation. Ce témoignage très tardif (octobre 2007) et peu documenté ne permet pas de faire une enquête sérieuse qui pourrait valider ou non certaines hypothèses telles qu'un avion de ligne en virage, un ballon soumis à un cisaillement de vent etc ";"Objet sphérique lumineux faisant demi tour";O;1;;;;;;;;2010-04-01;;;0.50;0.50;;;;;;;0.28;0.28;C;C;1979-09-01779
802;"VIEILLE-EGLISE (62) 17.09.1979";Pas-de-Calais;62;"(D) Département";1979;09;17;"Le 17 septembre 1979 vers 7h 45 une personne remarque un point lumineux fixe dans le ciel. De couleur blanche et de forme ovale, ce point unique traverse ensuite rapidement et horizontalement le secteur où trois avions circulent. L'objet va disparaître vers l'Est. Après un appel à témoins lancé dans la presse locale, plusieurs personnes se mettront en rapport avec les autorités. Elles relatent l'observation ce même jour mais sur une plage horaire plus grande, du passage dans le ciel d'un objet particulier. Cependant les descriptions variées ne permettent pas d'indentifier précisément l'objet.";"observation d'un objet lumineux blanc. Déplacement rapide.";O;1;;;;;;;;2008-08-01;;;0.50;0.50;;;;;;;0.28;0.28;C;C;1979-09-01865
805;"DONCHERY (08) --.09.1979";Ardennes;08;"(D) Département";1979;09;--;"Durant le mois de septembre et jusqu'au 4 octobre 1979 un témoin et sa femme vont observer dans le ciel des points lumineux qui les intriguent. Ces points sont visibles par temps clair entre 19h et 23h 30. Ils sont de couleur rouge, vert et blanche et clignotent. L'ensemble de ces points forme une boule. Les gendarmes lors de différents services de nuit ne verront aucun fait similaire. Aucun autre témoignage ne sera recueilli sur ce phénomène pour lequel nous manquons d'informations.";"Observation de points lumineux de couleurs variées dans le ciel.";O;1;;;;;;;;2008-08-04;;;0.50;0.50;;;;;;;0.28;0.28;C;C;1979-10-00666
807;"LOUHANS (71) 1979";Saône-et-Loire;71;"(D) Département";1979;10;09;"Le 9 octobre 1979 vers 23h 30 plusieurs personnes vont apercevoir un objet volant lumineux à faible altitude. Il se déplace  en faisant un bruit impressionnant ce qui effraye certains témoins et des animaux.  Ces personnes ont probablement été témoin du passage d'un aéronef ce que confirme un des témoin qui reconnaitra les feux arrières d'un hélicoptère.";"Probable observation d'un aéronef.";O;6;;;;;;;;2008-08-04;;;0.38;0.13;;;;;;;0.65;0.35;B;B;1979-10-00668
811;"NATIONAL (975) 20.10.1979";"Grand Est";GES;"(R) Région";1978;--;--;"Le 20 octobre 1979 plusieurs personnes dans les Vosges et le Haut Rhin vont apercevoir dans le ciel un phénomène lumineux clignotant irrégulièrement. L'objet, de forme sphérique, semble se déplacer en ziz-zag et aucun bruit n'est remarqué.<br> Un an auparavant un phénomène similaire avait été constaté par des témoins.<br> Ce cas est classé C par manque d'informations.";"Observations du déplacement silencieux d'un objet sphérique et clignotant dans le ciel.";O;7;;;;;;;;2017-01-30;;;0.50;0.50;;;;;;;0.28;0.28;C;C;1979-10-00673
812;"FRESNAY-LE-COMTE (28) 25.10.1979";Eure-et-Loir;28;"(D) Département";1979;10;25;"Le GEIPAN continue à publier l'ensemble de ses archives sur son site public www.geipan.fr. Dans ses publications, figurent des cas anciens classés à l'époque (A,B,C ou D) et qui font aujourd'hui l'objet d'un réexamen, dans le seul but d'être plus pertinent dans les conclusions. Grâce à de nouveaux moyens techniques (logiciels) et à l'expérience d'enquête acquise depuis toutes ces dernières années, ce réexamen aboutit quelquefois à de nouvelles remarques voire à un changement de classification explicité dans une note d'enquête.<br> Ce cas d'observation précédemment classé D et nommé THIVARS (28) 25.10.1979 fait partie d'un ensemble de cas réexaminés récemment.<br>  Le 25 octobre 1979 vers 7h 30 une automobiliste et ses deux passagers circulent sur la D137 en direction de Chartres. Près de l'entrée de la localité de Fresnay-le-Comte ils aperçoivent au-dessus d'un bois un objet lumineux qui les intrigue. Cet objet est de couleur rouge non éblouissant mais plutôt phosphorescent (T2). Suivant les témoins il a la forme d'un trapèze isocèle (T1) ou d'un bol (T2). Aucun bruit particulier n'est entendu durant l'observation d'une durée de 15 à 20 secondes. L'objet s'élève en changeant de forme (rectangulaire puis simple trait) avant de disparaître complètement. Deux témoignages seront déposés en gendarmerie.<br> Les détails fournis par les témoins permettent d'envisager une méprise avec le Soleil levant, dans la mesure où le PAN est décrit comme phosphorescent et qu'il est comparé à un coucher de Soleil : « comme lorsque le soleil est très rouge le soir » (T2), « cette forme avait la couleur du soleil lorsqu'il est rouge et non éblouissant, comme lorsqu'il pleuvra le lendemain » (T1).<br>  Il est vérifié que le soleil était parfaitement dans la direction de l'observation est en train de se lever.<br> La présence avérée de la couverture nuageuse a très vraisemblablement empêché les témoins d'identifier le Soleil. Cette même couverture nuageuse, avec la présence probable de petites trouées ou éclaircies, le tout en mouvement du fait du vent présent ( > 15Km/h) peut d'ailleurs parfaitement expliquer l'évolution de la forme du PAN ainsi que sa disparition, le Soleil disparaissant peu à peu derrière un nuage. Il est d'ailleurs à noter que le PAN « diffusait une clarté qui éclairait le bois », ce qui est cohérent avec le Soleil.<br>  Les témoins ne mentionnent à aucun moment avoir vu le Soleil, alors qu'il était en train de se lever à l'horizon, exactement dans la direction qu'ils indiquent. La parfaite cohérence entre la position vraie du Soleil et la localisation et la description du PAN ne laisse pas de doute sur la méprise.<br>  Ce n'est pas la perception visuelle des témoins qui est en cause, mais l'interprétation que les témoins font de leur observation à travers leur ressenti (conduite, surprise, mauvaises conditions météo).<br>  En conséquence, ce cas d'étrangeté faible est classé par le GEIPAN comme PAN A : observation liée avec une méprise avec le Soleil au lever.";"Observations d'un objet rouge phosphorescent au-dessus d'un bois qui s'élève en changeant de forme avant de disparaitre : méprise avec le Soleil au lever dans un ciel couvert.";O;2;;;;;;;;2017-12-07;0.20;;0.20;0.00;0.70;;0.70;0.70;0.70;0.50;0.50;0.00;A;A;1979-10-00674
813;"TROYES (10) 10.10.1979";Aube;10;"(D) Département";1979;10;10;"Le 10 octobre 1979 vers 7h55 un témoin observe un objet insolite dans le ciel. De la forme d'un dirigeable, cet objet se déplace à vitesse constante sur une trajectoire horizontale en direction du Nord-Ouest. Aucun bruit provenant de l'objet n'est entendu durant toute l'observation. L'objet disparaitra progressivement dans le ciel.  Aucun autre témoignage ne sera recueilli  sur cet objet qui s'apparente à un dirigeable ou au Super Guppy (avion cargo remplaçé en 1996 par le Beluga) mais pour lequel nous manquons d'informations.";"Observation d'un objet volant de la forme d'un dirigeable.";O;1;;;;;;;;2010-03-29;;;0.50;0.50;;;;;;;0.28;0.28;C;C;1979-10-01866
815;"LA REOLE (33) 01.11.1979";Gironde;33;"(D) Département";1979;11;01;"Le 1er novembre 1979 vers 18h15 plusieurs témoins observent un phénomène lumineux rouge dans le ciel. Selon les témoins,  celui-ci est constitué d'une à deux boules rouges qui progressent dans le ciel sans émettre de bruit. Cet objet a une trajectoire Sud-Ouest Nord-Est. Un des témoins parle d'une trainée de feu à l'arrière de l'objet. Aucune autre information ne sera recueillie sur ce phénomène pour lequel nous manquons de données.";"Observation d'un phénomène lumineux rouge.";O;4;;;;;;;;2010-04-01;;;0.50;0.50;;;;;;;0.28;0.28;C;C;1979-11-00675
818;"(DPT) LOIRET (45) 11.11.1979";Loiret;45;"(D) Département";1979;11;11;"Le 1er décembre 1979 la gendarmerie apprend par la presse que des habitants d'une même localité ont aperçu le 11 novembre 1979 vers 18h45 des ""engins""ou ""objets"" en déplacement au-dessus de Mareau-Aux-Bois (45). Ces objets sont décrits ayant une forme ronde, avec un dôme supérieur et des lumières de couleurs clignotantes. Les témoignages sont succincts mais multiples (8 témoins). La gendarmerie trouvera un 9 eme témoin qui rapportera une observation faite le 25/11/1979 à 21h30 au-dessus de Courcy-Aux-Loges (45).<br> En raison du laps de temps écoulé entre les faits et la divulgation de ceux-ci aucune constatation n'a pu être effectuée par la gendarmerie.<br>  Aucune autre information n'a été recueillie sur ce phénomène pour lequel nous manquons de données.";"Observations du déplacement d'objets volants avec un dôme et des lumières de couleurs clignotantes : manque d'information.";O;9;;;;;;;;2017-10-26;;;0.50;0.50;;;;;;;0.28;0.28;C;C;1979-11-00678
819;"CIRCOURT (88) 14.11.1979";Vosges;88;"(D) Département";1979;11;14;"Le 14 novembre 1979 vers 17h42 un témoin, officier de l'amée de l'air en congé observe dans le ciel dégagé des phénomènes lumineux particuliers dans le ciel. Circulant  en voiture, le témoin et sa passagère voient soudain deux lumières ponctuelles couleur rouge orangé. Assez rapprochées, ellles se stabilisent à une altitude d'environ 100m au-dessus des bois et s'éteignent l'une après l'autre. Aucun bruit n'est remarqué.  30 secondes plus tard un double ""bang"" quasi simultané se produit. Le témoin pense qu'il s'agit probablement du passage du mur du son par une patrouille à haute altitude. Une minute plus tard deux lumières apparaisent à la même altitude et distance mais plus au nord que les premières. 5 secondes plus tard, ces lumières s'éteindront l'une après l'autre. La presse locale rapporte également que plusieurs personnes dans le secteur ont été témoins de ce phénomène. Aucun autre témoignage ou précision ne seront recueillis par la gendarmerie sur ce phénomène qui reste inexpliqué.";"Observation de phénomènes lumineux rouge orangé.";O;1;;;;;;;;2008-08-13;;;0.75;0.25;;;;;;;0.78;0.23;D;D;1979-11-00679
820;"REIMS (51) 15.11.1979";Marne;51;"(D) Département";1979;11;15;"Le 15 novembre 1979 vers 7h30 un témoin et son épouse aperçoivent depuis leur domicile un objet de couleur blanche et de forme triangulaire. Cet objet lumineux est tout d'abord  stationnaire puis se déplace très lentement vers le Sud-Ouest tout en s'élevant. Il disparaît progressivement dans les airs. Aucun autre témoignage ne sera recueilli sur ce phénomène pour lequel nous manquons d'informations.";"Observation du déplacement d'un objet triangulaire lumineux.";O;1;;;;;;;;2008-08-20;;;0.50;0.50;;;;;;;0.28;0.28;C;C;1979-11-00680
821;"HOMECOURT (54) 18.11.1979";Meurthe-et-Moselle;54;"(D) Département";1979;11;18;"Le 18 novembre 1979 à 3h 20 un témoin aperçoit depuis son domicile un objet circulaire fluorescent. Flanqué de deux empennages en forme de queues couleur gris-beige, l'objet se déplace à faible altitude et vitesse et de façon rectiligne dans le sens NO-SE. Aucun bruit n'est entendu durant l'observation qui n'a duré que quelques secondes. Aucun autre témoignage ne sera recueilli sur ce phénomène pour lequel nous manquons d'informations.";"Observation d'un objet fluorescent. Vrombissement";O;1;;;;;;;;2008-08-22;;;0.50;0.50;;;;;;;0.28;0.28;C;C;1979-11-00681
823;"CHÂTEAUPONSAC (87) 1979";Haute-Vienne;87;"(D) Département";1979;11;21;"Le 21 novembre 1979 un témoin aperçoit à environ 100 mètres d'elle, un objet muni de plusieurs feux dont trois rouges et un orange représentant un losange inscrit sur le plan vertical. Le feux orange remplaçe alternativement les feux rouges par rotation dans le sens des aiguilles d'une montre. Immobile et ne faisant aucune bruit l'objet stationne dans les airs. Aucune odeur particulière ne se dégage de l'engin qui a ensuite disparu vers le Nord en laissant une fumée blanchâtre. Des moutons parqués à 600 mètres de là manifestent  un grand affolement. Un deuxième témoignage sera recueilli relatant l'observation de lumières rouges repésentant un losange. Aucune trace au sol et aucun autre renseignement ne sera recueilli sur ce phénomène qui reste inexpliqué.";"Observation d'un engin en forme de losange .Comportement anormal sur des ovins.";O;2;;;;;;;;2008-08-22;;;0.58;0.13;;;0.70;;0.70;;0.64;0.11;D;D1;1979-11-00683
825;"CERGY PONTOISE (95) 1979";Provence-Alpes-Côte-d'Azur;;"(R) Région";1979;11;26;"Les noms des différents protagonistes ont été anonymisés comme sur les procés verbaux.  L'histoire qui va suivre a eu un grand retentissement auprès des médias du fait des principaux protagonistes qui n'ont jamais recherché la discrétion, bien au contraire. Les différents événements qui la composent se sont passés sur une période de temps relativement longue et dans des lieux assez divers. La quantité d'informations est donc importante et a fait, entre autres, l'objet de la note technique N°6 GEPAN référencée dans les documents du cas.  Le 26 novembre 1979 vers 05 heures du matin, le commissariat de police local reçoit un appel téléphonique de T3  qui les informe que son ""copain a été enlevé par un OVNI"". Une patrouille est immédiatement détournée sur les lieux. Sept policiers et gendarmes se retrouvent bientôt sur les lieux avec trois témoins, T3, T2 et T1, amis du disparu et témoins de ""l'enlèvement"". Les témoins expliquent qu'ils se préparaient à aller vendre des ""jeans"" sur le marché voisin, quand ils ont observé une lueur au-dessus de la route. T1 au volant de la voiture s'est dirigé vers la lueur. Celle-ci s'est alors placée au-dessus de la voiture, l'enveloppant  de brouillard et de petites boules clignotantes. Lorsque le brouillard s'est dissipé, la lueur est partie ""comme un éclair"" dans le ciel. C'est alors que T3 a constaté que T1 n'était plus dans la voiture. Devant les autorités, les trois témoins ont des attitudes très différentes, allant de l'indifférence jusqu'à une grande surexcitation. Dès les premières auditions, des divergences apparaissent dans les témoignages et les reconstitutions effectuées conduisent elles aussi à des contradictions sur l'emploi du temps des témoins la veille et le matin de la disparition, la position de la voiture au moment des faits et la trajectoire de la lueur. La gendarmerie prévient le GEPAN dès le 26 mais la presse est également avertie par l'un des témoin et dès le 27 et journalistes et enquêteurs privés affluent de toute la région. Dès le 28, radios et journaux relatent l'affaire dans tous ses détails, les avis et interprétations se multiplient au gré d'interviews diverses et variées. Cependant, aucun élément nouveau n'apparaît avant le trois décembre 1979 date à laquelle la mère de T1 informe la gendarmerie du retour de son fils et que T3 informe une radio sur le retour de son copain. Les gendarmes retrouvent effectivement T1 chez T2 en compagnie de sa famille et d'une journaliste. T1 déclare s'être retrouvé dans un champ de choux prés de l'immeuble de T2. Le GEPAN essayera de rassembler le maximum d'informations objectives sur cette affaire très largement médiatisée. Il lui sera extrêmement difficile de le faire, les témoins se dérobant  sans cesse dès qu'il s'agit de réunir des éléments concrets, préférant la compagnie des journalistes et de certains enquêteurs privés avec lesquels ils étaient beaucoup plus prolixes. Au fur et à mesure des conférences de presse et des déclarations, le discours des témoins se modifie et il devient rapidement évident aux yeux des enquêteurs du GEPAN que les faits rapportés ne sont pas crédibles. Cette hypothèse est renforcée par une analyse de sang montrant qu'il est peu probable que le ""disparu T1"" ait fait un séjour en apesanteur. La découverte d'une rangée de choux desséchés "" par la boule lumineuse"" dans le champs où est réapparu T1 relancera l'émoi dans cette petite ville. L'enquête montrera vite que ces choux étaient parfaitement normaux et avaient été délaissés par leur propriétaire pour servir d'engrais, ce que confirmera d'ailleurs une analyse d'échantillons prélevés par le GEPAN. Bien que les témoins aient toujours maintenu leurs témoignages y compris devant le procureur  de la République,  le GEPAN considère qu'il s'agit là d'une supercherie dont le déroulement discrédite le travail scientifique qu'il essaye de promouvoir.";"""L'enlèvement"" de Cergy-Pontoise.";O;14;;;;;;;;2009-08-07;;;0.38;0.13;;;;;;;0.65;0.35;B;B;1979-11-00685
829;"FOUSSERET (LE) (31) 29.11.1979";Haute-Garonne;31;"(D) Département";1979;11;29;"Le 29 novembre 1979 vers 5 heures 30, un témoin observe une lumière scintillante bleue ressemblant à un gyrophare d'ambulance. L'enquète de la gendarmerie constatera sur place le phénomène qui est clairement identifié comme une arc électrique entre deux fils d'une ligne électrique.";"Observation d'un arc électrique sur une ligne électrique aérienne.";O;1;;;;;;;;2008-06-09;;;0.13;0.13;;;;;;;0.53;0.48;A;A;1979-11-01706
830;"PONT-SAINTE-MAXENCE (60) 27.11.1979";Oise;60;"(D) Département";1979;11;27;"Le 27 novembre 1979 vers 16 heures 15, un témoin observe le passage d'un point lumineux dans le ciel durant 2 minutes environ. Aucune autre information disponible.";"Observation d'un point lumineux";O;1;;;;;;;;2008-06-09;;;0.50;0.50;;;;;;;0.28;0.28;C;C;1979-11-01707
831;"TILH (40) 26.11.1979";Landes;40;"(D) Département";1979;11;26;"Le 26 novembre vers 6h du matin un agriculteur dans un champs aperçoit à sept ou huit cents mètres de lui une source lumineuse blanche très vive. Cette lueur a un mouvement vertical de faible amplitude à cinq ou six mètres du sol. Une zone sombre de forme sphérique est aperçue sous cette lumière. L'enquète sur place ne révèlera aucune trace au sol. Aucun vol d'exercice militaire n'a été recensé à cette heure le jour de l'observation. Aucun autre témoignage ne sera recueilli sur ce phénomène pour lequel nous manquons d'informations. Les photographies prises par les gendarmes n'ont pas été retrouvées dans le dossier de gendarmerie.";"Observation d'une source lumineuse. Aucun bruit.";O;1;;;;;;;;2008-08-25;;;0.50;0.50;;;;;;;0.28;0.28;C;C;1979-11-01708
833;"PORT (LE) (974) 25.11.1979";"La Réunion";974;"(D) Département";1979;11;25;"Le 25 novembre 1979 vers 0h45 un témoin dans son jardin observe dans le ciel un phénomène lumineux particulier. Il voit deux trainées lumineuses de couleur vert pâle se déplacer parallèlement dans une direction N-O S-E.  Ces trainées sont précédées par des objets dont le déplacement très rapide se fait sans qu'aucun bruit ne soit entendu. Malgré la présence de nombreuses personnes dûe à une fête locale, aucun autre témoignage et  aucune autre information ne seront recueillis sur ce phénomène pour lequel nous manquons d'informations.";"Observation de phénomènes lumineux se déplaçant rapidement.";O;1;;;;;;;;2008-08-25;;;0.50;0.50;;;;;;;0.28;0.28;C;C;1979-11-01710
840;"PLANCOET (22) 1979";Côtes-d'Armor;22;"(D) Département";1979;12;06;"Le 6 décembre  1979 entre 21h15 et 21h 30 plusieurs personnes aperçoivent dans le ciel des phénomènes lumineux qui les intriguent. Une masse lumineuse blanche semble se déplacer d' Ouest en Est puis apparaissent 5 sources lumineuses oranges de forme différentes suivant les témoins (traits ou formes ovales). Elles  disparaitront progresssivement vers l'Est en s'éteignant progressivement. Aucun autre témoignage n'a été recueilli sur ce phénomène pour lequel nous manquons d'informations.";"Observation de lumières insolites.";O;4;;;;;;;;2008-08-26;;;0.50;0.50;;;;;;;0.28;0.28;C;C;1979-12-00694
841;"NEUVY-LE-ROI (37) 07.12.1979";Indre-et-Loire;37;"(D) Département";1979;12;07;"Ce cas d'observation a fait l'objet d'un réexamen dernièrement (voir le document Notes d'enquête).<br> Le 7 décembre 1979 vers 21h 15 plusieurs automobilistes dans le même secteur géographique aperçoivent  dans le ciel  un phénomène lumineux qui les intrigue. Celui-ci semble se déplacer à basse altitude et sera vu sous différentes formes selon les témoins (boule, parachute, L majuscule).  L'enquête ne permet pas de recueillir d'autre information, mis à part des aboiements entendus depuis une ferme des environs. <br>  Ce cas est consistant (plusieurs témoins indépendants), la description du PAN observé est précise. La sincérité et la crédibilité des témoins n'ont jamais été mises en doute. <br>   Le phénomène décrit présente beaucoup de caractéristiques communes (durée d'observation, forme, taille, couleur) avec un objet astronomique parfaitement connu : la Lune au lever. De plus, la Lune était bien présente sur la zone du ciel observée. <br>  Ce n'est pas la perception visuelle des témoins qui est en cause, mais l'interprétation que les témoins font de leur observation à travers son ressenti (fatigue, conduite de nuit).<br>  Dans la classification actuelle du GEIPAN, ce cas d'étrangeté faible est classé « A », observations liées avec une méprise avec la Lune.";"Observations par des automobilites d'un objet lumineux en direction de l'Est : observations astronomiques de la Lune.";O;3;;;;;;;;2014-09-05;;;0.13;0.13;;;;;;;0.53;0.48;A;A;1979-12-00695
842;"ARC SUR TILLE (21) 1979";Côte-d'Or;21;"(D) Département";1979;12;08;"Le 08 décembre 1979 deux  témoins depuis leur domicile aperçoivent à 9h52 un objet de la forme d'un croissant de couleur bleu-marine et blanc sans brillance. Il mesure 4 à 5 mètres de haut. Aucun bruit et aucune lumière particulière ne sont remarqués. L'objet au ras du sol se balance prés d'un bosquet. L'observation a duré une minute trente secondes à 200 m de l'objet. Il a disparu en s'envolant rapidement vers le Nord. Les témoins puis les gendarmes ne constateront aucune trace au sol.";"Observation d'un objet de 4 à 5 métres de hauteur, oscillant. Pas de bruit.Trajectoire montante.";O;4;;;;;;;;2008-09-03;;;0.75;0.25;;;;;;;0.78;0.23;D;D;1979-12-00696
844;"PARIS (75) 12.12.1979";Paris;75;"(D) Département";1979;12;12;"Le 12 décembre 1979 un veilleur de nuit observe dans le ciel un objet en forme de soucoupe volante légèrement bombée au milieur et allant en s'amincissant sur les bords. La couleur de l'objet est orangé. Une trainée de couleur violette et orangée est visible à l'arrière de l'objet. Il disparaît brusquement et à très grande vitesse à l'horizon. Aucun autre témoignage ne sera recueilli sur ce phénomène pour lequel nous manquons d'informations.";"Observation d'un objet en forme de soucoupe se déplaçant à très grande vitesse";O;1;;;;;;;;2008-08-27;;;0.50;0.50;;;;;;;0.28;0.28;C;C;1979-12-00699
845;"VILLEMONTAIS (42) 14.12.1979";Loire;42;"(D) Département";1979;12;14;"Le 14 décembre 1979 vers 21h 30 un jeune motocycliste aperçoit dans le ciel 6 objets de forme ovale et brillants. Ils se déplacent rapidement en formation trois par trois et disparaissent en direction de l'Ouest. Aucune trace sur l'environnement et aucun autre témoignage ne seront recueillis sur ce phénomène pour lequel nous manquons d'informations.";"Observation de 6 objets , forme ovale , évoluant à grande vitesse";O;1;;;;;;;;2011-01-25;;;0.50;0.50;;;;;;;0.28;0.28;C;C;1979-12-00700
847;"HAUCOURT-MOULAINE (54) 18.12.1979";Meurthe-et-Moselle;54;"(D) Département";1979;12;18;"Le GEIPAN continue à publier l'ensemble de ses archives sur son site public www.geipan.fr. Dans ses publications, figurent des cas anciens classés à l'époque (A, B, C ou D) et qui font aujourd'hui l'objet d'un réexamen, dans le seul but d'être plus pertinent dans les conclusions. Grâce à de nouveaux moyens techniques (logiciels) et à l'expérience d'enquête acquise depuis toutes ces dernières années, ce réexamen aboutit quelquefois à de nouvelles remarques voire à un changement de classification.<br> Ce cas d'observation précédemment classé D et nommé HERSERANGE (54) 1979 fait partie d'un ensemble de cas réexaminés récemment.<br>  Le 18 décembre 1979 à partir de 2h14, cinq personnes d'une même famille observent durant 15 minutes, 3 disques lumineux (la couleur varie selon les témoins du blanc au rouge-orangé) à la verticale d'une école. Ils s'éteignent et s'allument. Pour certains témoins, ces disques ont un mouvement ascendant.<br> Cette observation se caractérise d'une part par une étrangeté perçue par les témoins apparemment forte si l'on en juge par les appellations répétées d'OVNI et soucoupes et d'autre part par l'extrême pauvreté des témoignages.<br>  Il s'agit de trois disques lumineux qui s'éteignent et s'allument (dans une direction passant par la verticale de l'école). C'est l'information essentielle (qui tient presque dans une seule phrase) et commune (la phrase est quasiment répétée) aux 5 déclarations d'une même famille, les parents et les 3 enfants de 13 à 10 ans.<br>  Le peu d'informations complémentaires varie selon les témoins. Le père et la mère (T1 et T2)  indiquent (ou ont l'impression pour T2) que les disques montaient dans le ciel. Deux enfants T3 et T5 ne précisent rien du mouvement tandis que T4 ne parle pas non plus du mouvement vertical mais est le seul à avoir vu un des disques quitter les autres. La couleur des disques peut varier aussi entre témoins, orange, ou blanc, ou non précisé.<br>  On ne sait rien de la position dans le ciel, de la taille angulaire, de l'orientation des disques, du  type de contour net ou précis de ces lueurs (ce qui serait un indice sur leur matérialité ou non) etc<br>  Avec ce peu d'éléments, il n'est pas possible de rechercher une explication. On pourrait regretter que la Gendarmerie ou le GEIPAN n'aient pas procédé à des compléments d'interrogation ou à des reconstitutions, il est illusoire de le faire 40 ans après. D'un autre coté, cette observation se signale par un manque de consistance intrinsèque qui n 'encourageait pas à approfondir.<br>  En effet, quand l'étrangeté est forte, les témoignages sont rarement succincts et encore moins dupliqués. Le plus singulier ici, par rapport à la masse de témoignages GEIPAN, est l'absence d'indication sur les conditions des disparitions des PAN.  La mère et les 3 enfants se sont recouchés alors que les PAN étaient encore là ! Tout ceci fait douter de la réalité de l'étrangeté perçue.<br>  On note aussi que T1 (le père de famille) a déjà fait auparavant un grand nombre d'observations de soucoupes. Ces observations et leurs répétitions ont pu engendrer chez lui une forte charge émotionnelle qui peut expliquer qu'il ait tenu à réveiller les autres témoins, y compris les jeunes enfants, en criant ""aux soucoupes"". Ces autres témoins peuvent donc avoir été plus impressionnés (même si ce n'était peut être pas la première fois) par le ressenti de T1 que par l'observation elle-même, jusqu'à devenir solidaire de ce ressenti. Ce qui expliquerait la répétition des descriptions minimales et que tout le monde se couche en laissant le père seul avec l'observation.<br>  En conséquence le GEIPAN classe le cas en C : manque d'informations fiables.";"Observations par une famille durant 15 minutes de 3 disques lumineux clignotant dans le ciel nocturne : manque d'information.";O;5;;;;;;;;2017-12-04;;;0.60;0.00;;;0.50;;0.30;;0.15;0.00;C;C;1979-12-00702
848;"VIGEN (LE) (87) 20.12.1979";Haute-Vienne;87;"(D) Département";1979;12;20;"Le GEIPAN continue à publier l'ensemble de ses archives sur son site public www.geipan.fr. Dans ses publications, figurent des cas anciens classés à l'époque (A,B,C ou D) et qui font aujourd'hui l'objet d'un réexamen, dans le seul but d'être plus pertinent dans les conclusions. Grâce à de nouveaux moyens techniques (logiciels) et à l'expérience d'enquête acquise depuis toutes ces dernières années, ce réexamen aboutit quelquefois à de nouvelles remarques voire à un changement de classification explicité dans une note d'enquête. Ce cas d'observation précédemment classé D et nommé SOLIGNAC (87) 1979 fait partie d'un ensemble de cas réexaminés récemment. <br> Le 20 décembre 1979 vers 8h 45, trois personnes observent durant 30 à 40 secondes un phénomène lumineux et immobile dans le ciel en direction du Sud-Est. Le PAN est décrit comme une masse rouge orangé très lumineuse de forme rectangulaire, ovale ou circulaire suivant les témoignages. Les témoins signalent un temps couvert gris avec un plafond nuageux bas. Le PAN pivote brusquement pour prendre la forme d'un cigare et part en laissant s'échapper une trainée orangée virant au blanc. L'objet disparait dans les nuages. <br> Des éléments descriptifs sont faits en relation avec le soleil. « L'objet m'a rappelé un soleil couchant », « l'objet en question était plus gros que le soleil », « j'ai pensé qu'il s'agissait d'une éclipse » (voir les notes d'enquête). <br>  Le Soleil levant est précisément dans la direction d'observation et sa faible hauteur angulaire lui conférait la couleur dominante du PAN, c'est-à-dire le rouge vif.<br>  La forme variable du PAN, la courte durée de l'observation ainsi que le départ rapide du PAN s'explique par la présence des nuages ayant masqué le Soleil, visible seulement à travers une trouée de la couverture nuageuse. Ce point du phénomène est accrédité par des éléments de témoignage en faveur d'un PAN dans un ciel non homogène en couverture nuageuse. « cet objet était masqué de moitié et par intermittence d'un nuage noir », « l'engin semblait propulsé, il a ensuite disparu dans les nuages ». <br>  La présence de ciel nuageux inhomogène, la parfaite cohérence entre la position vraie du Soleil et la localisation et la description du PAN, l'absence d'observation du soleil en écart par rapport à l'observation du PAN, constituent un ensemble qui laisse aucun doute sur la méprise. <br>  Ce cas est bien consistant (trois témoins ayant déposé leur témoignage en gendarmerie), la description du PAN observé est assez précise. <br>  La méprise avec le soleil levant ou couchant n'est pas un cas rare dans les annales du GEIPAN et concerne tout type de témoin. <br>  Le GEIPAN classe le cas en A : Soleil levant.";"Observations d'un objet stationnaire orangé dans le ciel couvert au Sud-Est puis départ rapide : méprise astronomique avec le soleil levant.";O;3;;;;;;;;2017-07-28;0.20;;0.20;0.00;0.70;;0.70;0.80;0.80;0.60;0.60;0.00;A;A;1979-12-00703
854;"SONDERNACH (68) 31.01.1979";Haut-Rhin;68;"(D) Département";1979;01;31;"Le 31 décembre 1979 (et non  janvier comme il est indiqué dans le PV au paragraphe ""enquète"") entre 23h15 et 0h30, deux témoins observent dans le ciel deux lumières particulières. Celles-ci semblent parfois reliées par un ensemble de serpentins très lumineux et de plusieurs couleurs. L'observation n'a pas été continuelle et le phénomène a disparu totalement vers 1h du matin. Aucun autre témoignage ne sera recueilli sur ce phénomène pour lequel nous manquons de données.";"Observation de 2 sources de lumière.";O;2;;;;;;;;2008-10-03;;;0.50;0.50;;;;;;;0.28;0.28;C;C;1980-01-00725
855;"METZ (57) 1979";Moselle;57;"(D) Département";1979;12;03;"Le 3 décembre 1979, vers 16 heures 50, deux témoins observent un objet de forme triangulaire émettant deux trainées de fumée rouge. Au passage au-dessus d'une tour hertzienne, l'objet s'arrête quelques secondes avant de repartir. Les témoins l'ont suivi des yeux jusqu'à perte de vue, la fumée rouge étant visible jusqu'à la fin de l'observation.  Un troisième témoin a observé au même moment un point très brillant sans qu'il soit possible de faire une corrélation entre les deux observations.  L'enquête n'a pas permis d'identifier un trafic aérien correspondant aux observations et celle-ci reste inexpliquée.";"Observation d'un objet triangulaire changeant de vitesse et de direction";O;3;;;;;;;;2007-03-22;;;0.75;0.25;;;;;;;0.78;0.23;D;D;1979-12-01703
856;"PITHIVIERS (45) 1979";Loiret;45;"(D) Département";1979;12;02;"Le 2 décembre 1979 vers 18 heures 30, un couple de témoins observent  8 engins de la taille d'un avion émettant un sifflement. Ces objets émettent des lumières clignotantes, rouges, vertes, bleues et jaunes.  Ces objets se déplacent lentement et l'observation dure 20 minutes environ.  L'enquête n'a pas permis d'identifier l'origine de ces phénomènes.";"Observation de 8 engins de la taille d'un avion émettant un sifflement";O;2;;;;;;;;2007-03-22;;;0.75;0.25;;;;;;;0.78;0.23;D;D;1979-12-01704
857;"[D110] DE BRAUX (04) VERS ANNOT (04) 01.12.1979";Alpes-de-Haute-Provence;04;"(D) Département";1979;12;01;"Le 1er décembre 1979 vers 19 heures 35, un boucher revient de sa journée au marché de Braux (04). Il roule en fourgon sur un tronçon sinueux de la D110, lorsqu'il voit soudain surgir sur sa gauche une grosse boule très lumineuse, dont la couleur passe du blanc au rouge puis de l'orange au jaune. Cette boule émet un bruit strident de type bip bip. Le témoin, très effrayé, accélère mais constate que le phénomène le suit pendant environ 2 km alors que le véhicule roule à environ 70 - 80 Km/h. Au bout de 2 Km environ, le phénomène disparaît brutalement. Aucun autre témoignage ne sera recueilli par la gendarmerie. <br>  Ce cas a fait l'objet d'un premier classement ""observation non expliqué cas d'". Il fait partie des cas français médiatisés de l'époque (faire recherche OVNI ANNOT).<br>  La présente conclusion résulte d'une nouvelle enquête, rendue possible d'une part grâce aux outils numériques d'aujourd'hui et d'autre part grâce à une reconstitution sur place sur une date en cycle de Saros, c'est à dire sur une date où la Lune, le Soleil et la Terre reprennent exactement la position du jour de l'observation (voir le compte rendu d'enquête). <br> Le témoin ayant signalé la présence de la pleine Lune au départ de son trajet, il ne la mentionne paradoxalement plus par la suite alors même qu'à plusieurs endroits du parcours elle devait apparaître très lumineuse précisément dans la direction d'observation du PAN présumé. Les éléments entrevus dans la phase d'analyse préalable (à distance avec outils numériques) ont été largement confirmés par une reconstitution « in situ » menée dans des conditions optimales de similitude (cycle du Saros et météo similaire) : le témoin s'est trouvé être victime d'une illusion perceptive provoquée par l'observation soudaine de la Lune. <br> En particulier, il s'avère que chaque endroit où l'observation de la Lune s'avère possible correspond précisément à l'un des emplacements pour lesquels le témoin a décrit aux gendarmes le phénomène auquel il pense avoir été confronté. De fait, la trajectoire présumée du PAN telle qu'a pu l'imaginer le témoin apeuré correspond parfaitement à la trajectoire apparente de la Lune en regard des sinuosités de la route. L'apparition soudaine ainsi que la disparition de phénomène sont également en accord avec la visibilité de la Lune pour le conducteur d'un véhicule empruntant cette route ce jour-là. <br> L'effet de surprise est renforcé par un contexte médiatique très prégnant : l'affaire de l'OVNI de Cergy- Pontoise (95) bat son plein, et le jeune homme prétendument enlevé par l'OVNI n'a pas encore réapparu. Ces éléménts ont probablement induit un fort sentiment de peur chez le témoin qui, placé dans des conditions d'observation difficiles et un contexte peu rassurant (il était seul et loin de toute habitation) n'a pas été en mesure d'analyser sereinement la situation à laquelle il se voyait brutalement confronté. <br> Les descriptions qu'il fait du phénomène sont classiques et parfaitement comparables avec celles communément recueillies dans les cas similaires de méprise avec la Lune (méprise très fréquente). Les seuls caractères d'étrangeté qui auraient pu s'opposer quelque peu à ce scénario bien connu sont d'une part le bruit prétendument perçu durant l'observation et d'autre part le contrecoup physiologique subi dans les jours suivants (occlusion intestinale). Toutefois, aucun élément ne peut être avancé pour étayer la réalité objective du premier. Concernant le second, il s'avère probablement consécutif au stress causé par l'observation sur un terrain physiologique préexistant (deux crises antérieures similaires). <br>  En conséquence le GEIPAN classe le cas en A : observation de la Lune.";"Observation par un automobiliste d'une boule lumineuse le suivant lors de son trajet sur une route sinueuse ; disparition subite : illusion perceptive provoquée par l'observation soudaine de la Lune.";O;1;;;;;;;;2017-07-28;0.10;;0.10;0.00;;;;;;0.50;0.50;0.00;A;A;1979-12-01705
859;"DECIZE (58) 1979";Nièvre;58;"(D) Département";1979;12;05;"Le 5 décembre 1979 un témoin observe vers17h 40 une boule de la grosseur d'une orange avec un reflet orangé. Celle-ci se déplace en tournant sur elle-même et en montant et descendant alternativement. Aucun bruit n'a été entendu. L'observation a duré un quart d'heure avant que cette boule ne disparaisse en direction de S-E à très vive allure. Le lendemain à la même heure, cette boule a de nouveau été visible mais elle a changé trois fois de taille et a disparu vers l'Ouest. Un seul autre témoin a vu un phénomène semblable quelques mois avant.";"observation du déplacement d'une boule avec des reflets orangés.";O;3;;;;;;;;2008-09-02;;;0.50;0.50;;;;;;;0.28;0.28;C;C;1979-12-01871
860;"NANTES (44) 15.12.1979";Loire-Atlantique;44;"(D) Département";1979;12;15;"Le 15 décembre 1979 vers 2h du matin, un témoin observe depuis le troisième étage de son appartement un objet orange phosphorescent dans le ciel. Celui-ci à la forme d'un cigare en position verticale et se déplace sans bruit du Nord au Sud. L'objet disparaitra dans le paysage urbain. Aucun autre témoignage ne sera recueilli sur ce phénomène qui reste inexpliqué.";"Observation d'un objet en forme de cigare, phosphorescent.";O;1;;;;;;;;2008-09-04;;;0.75;0.25;;;;;;;0.78;0.23;D;D;1979-12-01872
868;"COMPIEGNE (60)1980";Oise;60;"(D) Département";1980;01;01;"Le 1er janvier 1980 plusieurs militaires en poste aperçoivent à trois reprises un phénomène lumineux dans le ciel. Une petite boule orangée apparaît subitement et successivement à 23h16, à 23h33 puis à 23h 46. Une lueur intense accompagne cet objet qui se déplace lentement et toujours sur une trajectoire horizontale. A chaque apparition au même endroit, les chiens du chenil de la base hurlent à la mort. Aucun bruit et aucune fumée n'accompagnent le déplacement de cet objet et les militaires sont certains qu'il ne s'agit pas de lumière émise par un avion ou un hélicoptère. Aucun civil n'a été témoin de ce phénomène qui reste inexpliqué.";"Observation périodique d'une boule lumineuse se déplaçant lentement sur une ligne droite.";O;4;;;;;;;;2007-03-22;;;0.75;0.25;;;;;;;0.78;0.23;D;D;1980-01-00709
870;"NEUILLY-EN-THELLE (60) 03.01.1980";Oise;60;"(D) Département";1980;01;03;"Le matin du 3 janvier 1980 à 8 h 05 un témoin fermant ses volets, aperçoit une boule rouge dans le ciel. Cette boule disparaît derrière des nuages puis réapparaît dans le ciel. Elle se déplace de façon irrégulière et à une allure très rapide. La trajectoire donnée est Sud-Est Nord-Ouest. Interpellant sa voisine, celle-ci ne verra pas l'objet décrit. Le témoin ayant pris des photographies,  les gendarmes pourront voir le négatif qui montre une tache brune. A ce jour le négatif n'a pas été retrouvé dans les archives. Aucun autre témoignage n'a été recueilli sur ce phénomène. Le témoin a probablement fait une observation astronomique de la pleine lune qui, à l'heure indiquée, se couchait et était éclairée par le soleil levant donnant à l'astre cette couleur rouge.";"observation probable de la pleine lune rougie par le soleil levant";O;1;;;;;;;;2009-09-16;;;0.38;0.13;;;;;;;0.65;0.35;B;B;1980-01-00711
871;"OISE (60) 1980";Oise;60;"(D) Département";1980;01;05;"Le 5 janvier 1980 à partir de  18h 30 plusieurs témoins observent un phénomène lumineux qui les intrigue. Une sphère émettant une lumière intense est immobile puis se déplace lentement et sans aucun bruit dans le ciel dégagé. Les couleurs ainsi que le volume varient selon les témoins. Pour certains, elle semble animée d'un mouvement rotatif sur elle-même.  Le positionnement des témoins et leur direction d'observation permet de situer le phénomène au Sud-Ouest. Le phénomène disparaîtra vers 19h 30. L'examen de la carte du ciel à cette date et heure montre que les témoins ont simplement observé la planète Vénus particulièrement visible et brillante en cette période de l'année ( magnitude - 3,8). L'heure de coucher de Vénus est d'ailleurs 19h30, comme indiqué par les témoins.";"Observation de la planète Vénus";O;7;;;;;;;;2008-04-21;;;0.13;0.13;;;;;;;0.53;0.48;A;A;1980-01-00712
874;"LE CROISIC (44) 1980";Loire-Atlantique;44;"(D) Département";1980;01;12;"Entre le 10 janvier et le 16 janvier 1980 de nombreuses personnes dont les gendarmes vont apercevoir dans le ciel un objet lumineux. Celui -ci de forme circulaire est brillant et scintille. Il se déplace lentement d'Est en Ouest. Des photographies de l'objet seront prises. Petit à petit l'objet perd de sa luminosité pour devenir orangé et disparaître. Toutes ces personnes ont fait une observation astronomique de Vénus particulièrement visible en cette période de l'année ( magnitude -3,83 le 12/01/1980 à 19h 04 et disparition dans l'océan à 20h 30).";"observaiton de Vénus";O;6;;;;;;;;2008-04-22;;;0.13;0.13;;;;;;;0.53;0.48;A;A;1980-01-00715
875;"ETAULIERS (33) 13.01.1980";Gironde;33;"(D) Département";1980;01;13;"Le 13 janvier 1980 vers 7h 10, un automobiliste de passage dans les Charente-Maritime, aperçoit un engin en forme de soucoupe. Stationnaire,  l'objet a un diamètre d'environ 5 à 6 mètres et des lumières cligotent à ses extrémités. Descendant de son véhicule, le témoin, agent des douanes,  constate alors que l'engin s'éloigne lentement à environ 30 ou 40 km/h. Ce qui étonnera le témoin c'est que durant les 5 minutes d'observation, il n'entendra aucun bruit provenant de cet engin.  Le témoin, pressé,  fera sa déposition à son arrivée en Haute-Garonne. Aucun autre témoin ne se fera connaître dans le secteur de l'observation et aucune autre information ne sera recueillie sur ce phénomène qui reste inexpliqué.";"Observation d'un engin en forme de soucoupe.";O;1;;;;;;;;2007-03-22;;;0.75;0.25;;;;;;;0.78;0.23;D;D;1980-01-00716
876;"BERNAVILLE (80) 16.01.1980";Somme;80;"(D) Département";1980;01;16;"Le 16 janvier 1980 à 19h, des témoins aperçoivent dans le ciel un phénomène lumineux particulier. Il s'agit d'une boule blanche très brillante située au S/O dans le ciel. Au cours de l'observation le phénomène change de couleurs et d'intensité lumineuse, de couleur et diminue ou grossit ; des fils semblent descendre de cet objet. Aucun bruit n'a été entendu durant tout le temps de l'observation par l'ensemble des témoins. Le phénomène s'éloigne rapidement et sera perdu de vue vers 21h. Un des témoins prendra des photos qui ne montreront rien, le film étant noir. D'après l'enquète de gendarmerie auprés de la station météorologique, aucun ballon sonde français n'a été lancé et signalé dans le secteur. Il est à noter cependant que quelques jours auparavant un ballon sonde étranger à été découvert sur une autre commune. D'après la carte du ciel, Vénus était à cette période particulièrement visible ( -3,84 ) et basse sur l'horizon au S/O. Elle disparaît également vers 21h. Ces personnes ont probablement fait une observation astronomique de Vénus.";"Probable observation de Vénus.";O;3;;;;;;;;2012-01-06;;;0.38;0.13;;;;;;;0.65;0.35;B;B;1980-01-00717
877;"LOROUX-BOTTEREAU (LE) (44) 20.01.1980";Loire-Atlantique;44;"(D) Département";1980;01;20;" Le 24 janvier 1980 entre 18h 05 et 18h 25 un témoin affirme avoir assité à l'arrivée et au départ d'un objet volant non identifié. Au début de son observation, il décrit cet objet comme étant cylindrique avec deux petits ailerons de couleur sombre sur le coté. L'objet s'étant rapproché, l'engin se stabilise ensuite à 200 mètres de haut et se trouve alors à environ 300 mètres à l'Est d'un château d'eau. Le témoin s'aperçoit à ce moment que l'objet est de forme ovale, illuminé d'une lumière jaune-orange vive, les ailerons ayant disparus. Durant l'observation qui dure 7 minutes, cette personne constatera que son poste radio-téléphone grésille anormalement et il effectuera plusieurs balayages avec un projecteur portatif.  L'objet s'éloigne brusquement en prenant rapidement de la hauteur. Le témoin apeuré part prévenir la gendarmerie. Un disfonctionnement du circuit électrique du tableau de bord de son véhicule sera constaté. Aucune autre information ne sera recueillie sur ce phénomène qui reste inexpliqué.";"Observation d'un objet volant ovale et lumineux.";O;1;;;;;;;;2007-03-22;;;0.75;0.25;;;;;;;0.78;0.23;D;D;1980-01-00718
879;"ANTILLES (971-972) 1980";Outre-Mer;971;"(D) Département";1980;01;23;"Les 23 et 24 janvier 1980 en Martinique et en Guadeloupe sont observés des phénomènes lumineux particuliers au-dessus de l'océan. Depuis divers endroits des îles entre 18h et  19h, des témoins aperçoivent un à plusieurs objets lumineux suivis ou non de trainées de  lumières multicolores. Le ciel est dégagé  et selon les témoins, qui n'ont vu ces phénomènes que quelques secondes, les objets disparaissent rapidement au fur et à mesure de leur avancée.  D'après les différentes descriptions, l'hypothèse retenue est celle de probables rentrées atmosphériques.";"Probable observations de rentrées atmosphériques.";O;18;;;;;;;;2008-04-22;;;0.38;0.13;;;;;;;0.65;0.35;B;B;1980-01-00720
880;"FAY-DE-BRETAGNE (44) 27.01.1980";Loire-Atlantique;44;"(D) Département";1980;01;27;"Le 27 janvier 1980 entre 21h 05 et 21h 10 plusieurs témoins observent dans un ciel dégagé une boule lumineuse de couleur orangé. Située bas sur l'horizon, celle-ci semble clignoter par moments. L'observation a duré 10 à 15 minutes pour certains témoins. Une observation similaire a eu lieu le lendemain.<br>  La vérification de la carte du ciel montre que ces témoignages sont probablement liés à l'observation de Vénus visible dans le OSO avec une magnitude importante de - 3,9 et une disparition à l'horizon vers 21h10.";"Observations probables de la planète Vénus.";O;9;;;;;;;;2012-10-17;;;0.38;0.13;;;;;;;0.65;0.35;B;B;1980-01-00723
882;"RAON-AUX-BOIS (88) 28.01.1980";Vosges;88;"(D) Département";1980;01;28;"Le 28 janvier 1980 vers 4 h15, un témoin circulant en voiture aperçoit à sa droite un objet lumineux. Cet objet sphérique est stationnaire à environ 40 mètres du sol et 150m du témoin. De couleur orangé, il emet une une forte lumière dirigée vers le ciel. Cet objet est lui-même compris dans un cercle plus grand et plus éclatant. Le témoin poursuit sa route et constate que l'objet semble le suivre. Aucun bruit et aucune odeur ne sont  remarqués par le témoin qui prend peur. L'objet disparaîtra peu après dans le paysage. Aucun autre témoin ni aucune autre information n'ont été recueillis sur ce phénomène pour lequel nous manquons d'informations.";"Observation d'un engin sphérique suivant le témoin.";O;1;;;;;;;;2007-03-22;;;0.50;0.50;;;;;;;0.28;0.28;C;C;1980-02-00727
883;"ROUEN (76) 25.01.1980";Seine-Maritime;76;"(D) Département";1980;01;25;"Le 25 janvier 1980 vers 22 heures, un témoin ainsi que les gendarmes appelés sur place observent  2 points lumineux plus brillants que les étoiles. Ces deux points montent lentement dans le ciel au fur et à mesure de la soirée et sont visibles les jours d'après lorsque le ciel est clair. Il s'agit probablement d'une observation d'astres.";"Observation probable d'astres";O;1;;;;;;;;2007-03-22;;;0.38;0.13;;;;;;;0.65;0.35;B;B;1980-01-01700
884;"BOURGNEUF-EN-RETZ (44) 05.01.1980";"Pays de la Loire";PDL;"(R) Région";1980;01;05;"A partir du 5 janvier 1980 et les jours d'après, de nombreux témoins ainsi que les gendarmes chargés d'enquêter sur place observent en fin d'après midi une lueur très brillante dans le ciel. La forme semble changer ainsi que les couleurs.<br> La probabilité est assez forte pour que l'observation faite soit celle de Vénus.";"Observation d'une lueur de plusieurs couleurs dans le ciel : probable observation de la planète Vénus";O;5;;;;;;;;2013-03-20;;;0.38;0.13;;;;;;;0.65;0.35;B;B;1980-01-01701
885;"CANNES (06) 01.01.1980";Alpes-Maritimes;06;"(D) Département";1980;01;01;"Le GEIPAN continue à publier l'ensemble de ses archives sur son site public www.geipan.fr. Dans ses publications, figurent des cas anciens classés à l'époque en cas de type « C » et qui font aujourd'hui l'objet d'un réexamen, dans le seul but d'être plus pertinent dans les conclusions. Grâce à de nouveaux moyens techniques (logiciels) et à l'expérience d'enquête acquise depuis toutes ces dernières années, ce réexamen aboutit quelquefois à de nouvelles remarques voire à un changement de classification explicité dans une note d'enquête. Ce cas d'observation fait partie de cas classés « C » en 1980 par le GEPAN. <br>  Le 1er janvier 1980 entre 18h 30 et 19h un automobiliste sur l'autoroute A8 dans le sens Est-Ouest observe un point lumineux et fixe vers l'ouest dans le ciel dégagé. L'observation aux jumelles permet au témoin de décrire ce point très brillant comme une boule de ficelle qui laisse entrevoir entre les brins des carrés noirs. Le témoin prendra des photographies du phénomène mais les négatifs remis ultérieurement à la gendarmerie seront transparents et vierges de toute image. Aucun autre témoignage ne sera receuilli sur ce phénomène.<br> Le phénomène décrit présente beaucoup de caractéristiques communes (durée d'observation, taille, couleur) avec un objet astronomique parfaitement connu : la planète Vénus. De plus, Vénus était bien présente dans la zone du ciel observée alors que le témoin n'en fait pas mention.<br> Ce n'est pas la perception visuelle du témoin qui est en cause, mais l'interprétation que le témoin fait de son observation à travers leur ressenti (étonnement, conduite de nuit).<br>  Dans la classification actuelle du GEIPAN, ce cas d'étrangeté faible est classé comme PAN A, observation liée à une méprise avec Vénus.";"Observation d'un point lumineux immobile dans le ciel : méprise avec Vénus.";O;1;;;;;;;;2016-09-20;;;0.13;0.13;;;;;;;0.53;0.48;A;A;1980-01-01752
886;"[A7] de LYON (69) vers AVIGNON (84) --.--.1980";Rhône;69;"(D) Département";1980;--;--;"En juillet 2008, un témoin rapporte  une observation faite de nuit en 1980 ou 1981 avec deux autres membres de sa famille sur l'axe N-S de l'autoroute Lyon-Avignon. Durant une trentaine de secondes, ils vont observer une boule lumineuse qui se divise ensuite en trois entités stationnaires avant de disparaître dans le ciel à très grande vitessse.  Nos demandes de compléments d'informations (notamment sur la date qui est ici donnée arbitrairement) sont restées sans suite à ce jour et nous manquons d'informations et de précisions sur cette observation.";"Observation d'un phénomène lumineux.";O;1;;;;;;;;2010-04-20;;;0.50;0.50;;;;;;;0.28;0.28;C;C;1980-01-02288
894;"AMBIERLE (42) 13.02.1980";Loire;42;"(D) Département";1980;02;13;"Le 13 février 1980 vers 5 h 40, un préposé des PTT  se rendant à son travail aperçoit dans un ciel dégagé un phénomène lumineux qui l'intrigue.<br> Au-dessus des monts du lyonnais, il observe durant 8 minutes, une lueur en forme de demie lune. Celle-ci est de couleur jaune-orangé et se déplace lentement sur une trajectoire Nord-Sud. Cette lueur s'estompera progressivement. Seul un autre témoin qui accompagnait la personne a pu voir le phénomène : cependant il n'a pas fait de déclaration à la gendarmerie.<br> L'examen de la carte du ciel à cette période montre la lune très peu visible (nouvelle lune le 16) et très basse sur l'horizon, mais dans la direction de l'observation. Le témoin précise qu'il n'y avait pas de lune : en fait il a probablement observé la lueur de celle-ci sans la reconnaître (magnitude -8,9).";"Automobiliste observant une lueur de forme et de grosseur d'une demi-lune : probable observation de la Lune.";O;1;;;;;;;;2015-11-24;;;0.38;0.13;;;;;;;0.65;0.35;B;B;1980-02-00733
896;"THILLOT (LE) (88) 15.02.1980";Vosges;88;"(D) Département";1980;02;15;"Vers 20h 35 le 15 février 1980, un témoin observe en direction du Sud-Ouest une sphère lumineuse. Celle-ci est située juste au-dessus d'un bâtiment. S'appuyant sur un mur pour regarder le phénomène aux jumelles, le témoin a pu constater la présence de deux boules. Celles-ci,  une rouge et une blanche située au-dessus de la première, bougeaient sans se déplacer. La position des deux boules s'est inversée et l'ensemble a disparu après avoir décrit  un ""Z"" assez large dans le ciel. L'observation a duré environ 10 minutes dans un ciel parfaitement dégagé.  Aucun autre témoin de ce phénomène,  pour lequel nous manquons de données, ne s'est présenté à la gendarmerie. Ce témoin a probablement fait une observation astronomique de Vénus ( magnitude -4) très basse sur l'horizon et qui disparaît dans le paysage urbain.";"probable observation de Vénus";O;1;;;;;;;;2008-04-21;;;0.38;0.13;;;;;;;0.65;0.35;B;B;1980-02-00735
897;"EVREUX (27) 1980";Eure;27;"(D) Département";1980;02;16;"Le 16 février 1980 entre 01h et 1h 30 du matin, trois militaires en service rapportent avoir observé un objet volant non identifié. Cet objet volait au-dessus du village. Selon les témoins, qui diffèrent sur la forme de l'objet, celui-ci projetait une lumière orange intense. Il est resté immobile durant une minute avant de s'élever rapidement et de se déplacer par paliers. L'intensité de la lumière a progressivement diminuée pour ne devenir qu'un point. Aucun autre renseignement n'a été recueilli auprés des civils du secteur. Aucune veille radar n'ayant été effectuée durant le week-end, la confirmation de la présence d'un aéronef n'a pu être faite. Ce cas est classé C par manque de données.";"Observation d'un objet se déplaçant par paliers.";O;3;;;;;;;;2007-03-22;;;0.50;0.50;;;;;;;0.28;0.28;C;C;1980-02-00736
899;"CHÂTEAUDUN (28) 1980";Eure-et-Loir;28;"(D) Département";1980;02;18;"Le 18 février 1980 plusieurs personnes  observent depuis la cour d'une habitation un phénomène lumineux particulier entouré d'un halo brumeux. Une boule lumineuse blanchâtre se tient immobile prés d'un autre objet ressemblant à un croissant de lune. Cette observation dure plusieurs minutes puis le phénomène se met à bouger de droite à gauche et de haut en bas durant une vingtaine de minutes. L'objet se déplace ensuite à grande vitesse selon une trajectoire Nord-Ouest. Son  volume semble trois fois plus grand que les astres l'environnant et il brille davantage. Il disparaîtra progressivement  en s'éloignant. Aucun bruit n'a été entendu durant l'observation. Aucun autre témoignage ne sera recueilli sur ce phénomène. Cependant quelques jours plus tard, la presse locale fera état de l'observation d'un ""clair de terre"", lumière cendrée qui accompagne la nouvelle lune et qui peut être accompagné d'effets visuels particuliers lorsque s'y ajoutent des perturbations atmosphériques.  L'examen de la carte du ciel permet de privilégier l'hypothèse d'une observation astronomique. En effet, la Lune ( magnitude -7,70) est visible jusqu'à 21h 02 puis passe en-dessous de l'horizon. A cette date (la nouvelle lune est le 16), seul un fin croissant est visible. Vénus est située juste au dessus de la lune (magnitude -4,19).  Par ailleurs, le phénomène de clair de Terre (ou lumière cendrée) est visible quand la Terre, la Lune et le Soleil sont presque alignés. Vu de notre planète, la Lune présente un très fin croissant, mais la Terre vue depuis notre satellite, est en phase pleine et brille pleinement. C'est le clair de Terre qui fait briller très faiblement la partie non éclairée de la lune. Après la nouvelle Lune le phénomène est observable le soir du troisième au cinquième jour, et avant la nouvelle Lune, ce sera le matin, du cinquième au troisième jour avant la lunaison suivante.  On peut donc dire sans risque que le témoin principal qui a fait l'observation vers et plutôt avant 21h a vu la lune (avec un clair de terre) et juste au-dessus Vénus. Les gendarmes qui ont fait l'observation à 21h 15 ont aperçu Vénus avant qu'elle ne disparaisse elle aussi sous l'horizon, la Lune ayant déjà disparu depuis une douzaine de minutes.  Il est vrai que les témoins font état de mouvements ""rapides"" et d'un déplacement rapide avant disparition. Il est probable que les témoins aient ici inconsciemment exagéré ces mouvements, du fait de la proximité de l'horizon et peut être aussi d'un phénomène de ""mouvement autocinétique"" (impression de mouvement lorsqu'on fixe intensément quelque chose).";"Observation de la Lune et de Vénus";O;3;;;;;;;;2008-04-22;;;0.13;0.13;;;;;;;0.53;0.48;A;A;1980-02-00738
900;"LES SABLES D'OLONNE (85) 24.02.1980";Vendée;85;"(D) Département";1980;02;24;"Le 24 février 1980 vers 3h 15 un groupe de jeunes gens aperçoit une lueur orangée à travers les sapins vers la plage. Se déplaçant pour avoir une meilleure visibilité, ils voient alors un très gros objet en direction de l'île d'yeu qui est au trois-quart sphérique, de couleur orangé et sans brillance. Cet engin se déplaçe à la verticale et à une vitesse très lente et constante. L'observation qui a duré une dizaine de minutes s'est terminée lorsque l'objet s'est enfoncé lentement dans l'océan laissant apparaître une lueur blanchâtre. Aucun bruit n'a été entendu. Vers 3h 05 un gendarme en patrouille aperçoit également un objet demi sphérique, plus gros qu'un quartier de lune, de couleur rouge-orangé sans brillance. Cet objet se déplace lentement et descend verticalement sans changer de forme ou de couleur.  Toutes ces personnes ont fait une observation astronomique de la lune se couchant ( à 3h 12 exactement) d'où la grosseur et la couleur orangée observées. En outre la lune était  dans son premier quartier, ce qui lui donnait son aspect de demi disque tourné vers le bas.";"Observation de la lune";O;5;;;;;;;;2012-03-02;;;0.13;0.13;;;;;;;0.53;0.48;A;A;1980-02-00740
901;"CUSSEY-SUR-L'OGNON (25) 17.02.1980";Doubs;25;"(D) Département";1980;02;17;"Le 17 février 1980 vers 20 h 45 un témoin observant le ciel aperçoit un point trés lumineux qui l'intrigue. Ce point rond est fixe,  plus gros et plus jaune que les autres étoiles. L'observation a duré plus de 10 minutes sans que le point ne semble bouger. Aucun témoin ne sera trouvé par la gendarmerie pour apporter d'autres informations. Cependant la presse locale relate que dans le secteur d'autres témoins ont fait la même observation. Après une vérification sur carte du ciel, nous constatons que dans la direction indiquée, Vénus est particulièrement visible  ( magnitude -4,01 ) en cette période de l'année. La hauteur de vénus sur l'horizon est de 8 ° au lieu des 20° indiqués par le témoin. En tenant compte d'une possible marge d'erreur concernant l'indication de la hauteur de l'objet,  l'hypothèse privilégiée est une observation de vénus. De nombreux cas d'observations sont d'ailleurs signalés durant cette période.";"Observation probable de la planète vénus";O;1;;;;;;;;2009-10-23;;;0.38;0.13;;;;;;;0.65;0.35;B;B;1980-03-00749
902;"MELUN (77) 1980";Gard;30;"(D) Département";1980;02;17;"Un témoin relate des observations de boules blanches qu'il aurait aperçu par trois fois depuis le début de l'année 1980. A chaque fois ces boules semblaient suivre le véhicule qui circulait la nuit. Elles pouvaient laisser une trainée blanche lors de leur disparition. En présence de son amie, ils verront ensemble une boule à proximité d'une maison d'habitation. Le témoin relate également sa rencontre, dans son véhicule,  avec une entité qui lui aurait dit l'avoir contacté par trois fois et l'aurait averti de l'invasion de la terre. Il décrit un homme grand et beau avec des yeux bleus et de longs cheveux. Le témoin parle d'une perte de mémoire d'une demi-heure et c'est dans un état de choc que le témoin est arrivé chez ses parents. Ramené chez lui, son état a été constaté le lendemain par un médecin.  Aucun autre témoin n'a u être trouvé et aucune autre information n'a été recueillie sur ces phénomènes qui permettraient de crédibiliser ce témoignage.";"observation de boules lumineuses et rencontre du 3 eme type.";O;2;;;;;;;;2007-03-22;;;0.50;0.50;;;;;;;0.28;0.28;C;C;1980-03-00752
903;"VALENTIGNEY (25) 29.02.1980";Doubs;25;"(D) Département";1980;02;29;"Le 29 février 1980 entre  20 heures 30 et 21h 40, deux témoins observent plusieurs fois un phénomène lumineux particulier. Un objet formé de plusieurs boules se déplace  très haut dans le ciel. Cet objet ressemble ""à une broche"" de plusieurs sphères de  couleur bleutée et rosée. La forme générale observée est ovale et sur le côté droit, une lumière plus importante et clignotante est remarquée. Aucun bruit n'est entendu durant les observations. En se déplaçant l'objet prend la forme d'une barre lumineuse et disparaît brusquement. Aucune autre information ne sera receuillie sur ce phénomène pour lequel nous manquons de données.";"Observation de plusieurs points lumineux";O;1;;;;;;;;2007-03-22;;;0.50;0.50;;;;;;;0.28;0.28;C;C;1980-02-01697
906;"SAINT-PAUL-AUX-BOIS (02) 02.03.1980";Aisne;02;"(D) Département";1980;03;02;"Le GEIPAN continue à publier l'ensemble de ses archives sur son site public www.geipan.fr. Dans ses publications, figurent des cas anciens classés à l'époque en cas de type « B » et qui font aujourd'hui l'objet d'un réexamen, dans le seul but d'être plus pertinent dans les conclusions. Grâce à de nouveaux moyens techniques (logiciels) et à l'expérience d'enquête acquise depuis toutes ces dernières années, ce réexamen aboutit quelquefois à de nouvelles remarques voire à un changement de classification explicité dans une note d'enquête. Ce cas d'observation précédemment classé B et nommé COUCY LE CHÂTEAU (02) 1980 fait partie d'un ensemble de cas réexaminés (voir la note d'enquête).<br>
Le 02 mars 1980 entre 21h45 et 22h00 quatre témoins à Saint-Paul-Aux-Bois observent en direction de Salency (02) un objet lumineux dont l'intensité lumineuse et la couleur varient. Pour trois témoins (T1, T2, T3), l'objet est en déplacement selon une trajectoire descendante. Pour T4 l'objet reste fixe. Les gendarmes appelés à 21h55 se rendent sur place immédiatement mais ne constatent rien de particulier à l'Ouest dans le ciel étoilé.<br>
Ce cas est assez consistant (quatre témoins), la description du PAN observé est assez précise. La sincérité et la crédibilité des témoins n'ont jamais été mises en doute.<br>

Le phénomène décrit présente beaucoup de caractéristiques communes (durée d'observation, forme, taille, couleur) avec un objet astronomique parfaitement connu : Vénus au coucher.<br>

De plus, Vénus était en train de se coucher à l'horizon dans la direction indiquée par les témoins.<br>

Ce n'est pas la perception visuelle des témoins qui est en cause, mais l'interprétation que les témoins font de leur observation à travers leur ressenti (fatigue, surprise).<br>

Dans la classification actuelle du GEIPAN, ce cas d'étrangeté faible est classé comme PAN A, observation liée avec une méprise avec Vénus au coucher.
";"Observations d'un objet lumineux de couleur variant d'intensité à basse altitude dans le ciel nocturne : observations de Vénus au coucher.";O;4;4;;1;;;;;2018-08-20;;;0.13;0.13;;;;;;;0.53;0.48;A;A;1980-03-00743
908;"SAINT-PORCHAIRE (17) 1980";Charente-Maritime;17;"(D) Département";1980;03;03;"Les 3 et 7 mars 1980 plusieurs personnes ont observé des phénomènes lumineux particuliers et distincts.   Le 3 mars à 22h15 une automobiliste et sa fille vont soudainement être éblouie par une lumière rouge provenant d'une boule qui se déplace en razant l'horizon. Cette boule, de la grosseur d'une ballon de foot, se déplace sans bruit dans le sens Sud-Est Nord-Ouest. Son déplacement semble se faire par palliers et à grande vitesse. Ce phénomène sera aperçu par d'autres personnes dont les gendarmes qui voient à 22h 25 un gros point lumineux rougeâtre,  5° au-dessus de l'horizon, et qui disparaîtra lentement à 22h 35 dans le Nord-Ouest. Ces gendarmes reviendront le lendemain sur les lieux et observeront aux jumelles un objet lumineux orangé produisant des éclats bleutés. Celui-ci disparaitra totalement à 22h 45 à l'horizon. Il est à noter qu'à cette période de l'année,  Vénus était particulièrement visible ( magnitude -4,10 ) et très basse sur l'horizon ( à -de 5° de l'horizon) et disparaît totalement vers 22h 38. La vitesse et la descente par palliers indiquées par les témoins est une impression donnée par le fait que l'astre est très bas et très loin sur l'horizon. Les témoins ont probablement fait, ce soir là, une observation astronomique de Vénus.  Le 7 mars 1980 vers 22h 10 ces mêmes personnes et d'autres vont être témoins d'un nouveau phénomène lumineux particulier. Rentrant chez elle et descendant de sa voiture, un témoin observe une boule lumineuse constituée de différents cercles de plusieurs couleurs. Un éclair viendra frapper le sol aux pieds de son enfant. La  boule d'un diamètre estimé entre 20 et 25 cm se déplacera d'Ouest en Nord-Ouest pour disparaître totalement. Aucun bruit ne sera entendu et aucune décharge éléctrique ne sera ressentie ; par contre une baisse de tension sur la ligne EDF sera constaté par de nombreuses personnes dans leur habitations ou sur l'éclairage public : il est a noter d'ailleurs qu' un des témoins parle d'arc électrique aperçu entre une ligne électrique et le sol. Ces personnes ont probablement été témoins d'un phénomène électrique.";"observations successives de phénomènes lumineux distincts.";O;9;;;;;;;;2008-04-21;;;0.38;0.13;;;;;;;0.65;0.35;B;B;1980-03-00745
909;"CORTE (2B) 1980";Haute-Corse;2B;"(D) Département";1980;03;03;"Le 03 mars 1980 à partir  20h 45 et durant une demi heure des témoins aperçoivent au-dessus des crètes, une boule lumineuse de la forme d'une assiette. D'après les témoins, cet objet se situe entre 100 et 200 mètres du véhicule. Lors d'un arrêt de la voiture, les témoins n'entendent  aucun bruit et ne sentent aucune odeur particulière. Sur une distance approximative de 12 kilomètres, ces personnes ont l'impression que l'objet les suit car il semble s'arrèter ou repartir en même temps que leur véhicule. L'objet a brusquement disparu et un autre phénomène lumineux rouge et conique cette fois est apparu. Dès leur arrivée chez eux, les témoins sont partis à la gendarmerie pour faire une déposition. Aucun autre témoin ou trace du phénomène n'ont  été retrouvés lors de l'enquète.  D'après la direction du trajet emprunté par les témoins entre Favello et Corté et si l'on tient compte de la route très sinueuse entre ces deux endroits, il est probable que ces personnes aient fait une observation astronomique de Vénus. Particulièrement visible en cette période de l'année ( magnitude -4,10) et très bas sur l'horizon, cet astre devait apparaître et disparaître en suivant la ligne de crêtes.";"probable observation de Vénus.";O;4;;;;;;;;2008-04-21;;;0.38;0.13;;;;;;;0.65;0.35;B;B;1980-03-00746
911;"SAINT-MENGES (08) 11.03.1980";Ardennes;08;"(D) Département";1980;03;11;"Le GEIPAN continue à publier l'ensemble de ses archives sur son site public www.geipan.fr. Dans ses publications, figurent des cas anciens classés à l'époque (A, B, C ou D) et qui font aujourd'hui l'objet d'un réexamen, dans le seul but d'être plus pertinent dans les conclusions. Grâce à de nouveaux moyens techniques (logiciels) et à l'expérience d'enquête acquise depuis toutes ces dernières années, ce réexamen aboutit quelquefois à de nouvelles remarques voire à un changement de classification.<br>

Ce cas d'observation (connu également sous le nom de VRIGNES AUX BOIS (08) 1980 a fait l'objet d'une revisite en 2007 et classé C et a été repris récemment (voir le compte-rendu d'enquête).<br>

Le 11 mars 1980 vers 21h un automobiliste (T1) est alerté par son jeune fils (T2) de la présence dans le ciel dégagé d'un phénomène lumineux ""comme une étoile"". Il semble se rapprocher et passer de la grosseur d'une pièce de monnaie à celle d'une assiette ce qui effraye les témoins. Pris de panique, l'automobiliste fait demi-tour et son fils lui indique que le point est devenu rouge. Le moteur du véhicule cale alors et la lumière s'éteint. Le véhicule fini par redémarrer après plusieurs essais. Le phénomène passe ensuite au-dessus du véhicule puis s'éloigne progressivement. Les témoins effrayés rentrent chez eux. Aucun bruit particulier n'a été entendu. L'automobiliste se présente à 22h30 à la gendarmerie et une enquête est menée sur place dès 23h40 : aucune trace au sol ou sur la végétation n'est retrouvée. Aucun autre témoignage ne sera recueilli. <br>

Les témoins ont probablement observé un aéronef venant dans leur direction, avec son (ou ses) feu(x) d'atterrissage ou son phare de recherche (hélicoptère) allumé(s). Ce feu puissant empêche la perception visuelle de toute autre signalisation lumineuse. Seul le feu de navigation gauche est brièvement aperçu par T2, soit de façon temporaire, soit en fin d'observation, avant que le PAN ne soit perdu de vue.<br>

Aucun bruit n'a été perçu, mais ce paramètre n'est pas déterminant. Il dépend en effet de nombreux facteurs, tels que la perception auditive propre des témoins, l'éloignement du phénomène, les bruits éventuels présents dans l'habitacle de la voiture Tous ces paramètres étant inconnus ainsi que la force et de la direction du vent Et surtout, lorsque le témoin affirme « je n'ai pas entendu le moindre bruit sur le phénomène » (PV), il ne précise pas si l'observation s'est faite fenêtre du véhicule ouverte ou fermée.<br>

Nous avons démontré au fil de l'enquête que les conditions de visibilité dans le véhicule des témoins limitent considérablement leur champ visuel et que l'observation s'est faite alors que le PAN restait visuellement bas sur l'horizon, y compris une fois le demi-tour effectué. Il était donc probablement encore très éloigné des témoins lorsque ceux-ci ont effectué ce demi-tour et ont occasionné, dans la panique et le stress, un enchaînement d'événements non liés au phénomène lui-même (calage du moteur, extinction des feux, non-allumage d'une lampe-torche).<br>

Les témoins sont totalement accaparés par leur stress et le désir de quitter au plus vite le lieu de l'observation, le PAN, toujours dans l'hypothèse de la confusion avec un aéronef, se trouvant encore loin des témoins a « tout le loisir », en quelque sorte, de disparaitre pour de bon de leur champ de vision, possiblement suite à un virage.<br>

T1 (le conducteur)  affirme avoir revu le point rouge du PAN « comme mon fils l'avait dit » devant lui. Nous avons pu montrer que ce point rouge, observé à cet instant, n'était probablement que la planète Mars, visible en conjonction avec la planète Jupiter, dans la direction d'observation (sud-est), face aux témoins.<br>

Paniqué et ne pensant qu'à rentrer chez lui à cet instant, T1 ne s'est pas attardé davantage sur cette observation finale de Mars, qui a probablement été très brève, ce qui ne lui a pas permis de constater que ce « point rouge » ne bougeait pas et ne pouvait donc pas être lié au PAN. La nécessité du témoin d'essayer de se concentrer sur sa conduite, de nuit et sur une route en mauvais état, lié à son état de stress renforce ce point.<br>

La disparition rapide et progressive de Mars peut tout à fait avoir été causée par le passage devant la planète d'un banc de brume épais, dont la présence est confirmée par les données météorologiques. Cette disparition contribue à l'illusion du PAN car la diminution d'intensité peut être interprétée comme l'augmentation de distance du PAN.<br>

Cette confusion finale avec la planète Mars rend caduque la seconde partie de la trajectoire du PAN telle que figurant dans les deux sources d'information relatives au cas, après son passage au-dessus du véhicule des témoins. Ils ne l'auraient finalement observé qu'en direction du nord-ouest.<br>

Concernant les phénomènes annexes de calage de moteur et d'extinction simultanée des feux de la voiture, nous avons montré qu'une panne provoquant simultanément l'arrêt immédiat et total du moteur et des feux est hautement improbable, de par la conception mécanique et électrique du véhicule du témoin.<br>

L'hypothèse que le calage ait été provoqué par une inattention de conduite de T1, dans un état de grand stress à cet instant, est plus probable. Il est par ailleurs envisageable que, par réflexe de peur et de protection inconscient (pour ne pas être « repéré »), le témoin ait délibérément coupé ses feux pour les rallumer ensuite. La peur du ridicule, en repensant rétrospectivement et à froid à cet épisode, pourrait expliquer que T1 n'ait pas souhaité le mentionner explicitement devant les enquêteurs. Ceci reste toutefois très hypothétique, aucun élément concret ne venant étayer cette hypothèse.<br>

Au vu de l'ensemble de ces points, il semble désormais inadéquat de lier les deux évènements. Le premier étant probablement un simple aéronef observé dans des conditions particulières (de nuit et de face avec un (ou des) feu(x) d'atterrissage ou un phare de recherche allumé(s)) ayant entraîné un enchaînement en cascade de réactions de panique des deux témoins, se trouvant dans un état de stress extrême.<br>

La consistance est moyenne. Il manque des données, angulaires (dimensions apparentes du PAN), testimoniales (fenêtres ouvertes ou fermées, position de T2 dans l'habitacle, témoignage de T2) et photographiques (pas de photos, ni de vidéos du phénomène). L'absence de ces données ne permet ni d'infirmer, ni d'étayer fermement une hypothèse avion qui reste néanmoins suffisamment probable pour être retenue. Le classement D (qui a existé un temps pour ce cas) est par contre exclu du fait de cette hypothèse qui en réduit l'étrangeté.

Le GEIPAN classe en B: observation probable d'un aéronef.";"Observation dans le ciel nocturne du passage rectiligne (ou légèrement courbée) et silencieux d'un phénomène lumineux de couleur (blanc puis jaune-orangé ou rouge) qui semble se rapprocher des témoins en grossissant : observation probable d'un aéronef.";O;1;1;;1;;;;;2018-07-10;;;0.35;0.00;;;0.60;;0.70;;0.40;0.00;B;B;1980-03-00748
912;"AIX EN PROVENCE (13) 17.03.1980";Bouches-du-Rhône;13;"(D) Département";1980;03;17;"le 17 mars 1980 à 20h 40, trois personnes observent un objet très lumineux qui se déplace lentement dans le sens Sud-Nord. Cet objet est de forme circulaire. Cette observation n'est pas confirmée par des gendarmes qui à plusieurs reprises regarderont le ciel dans cette direction. Aucune autre information ne sera recueillie sur ce phénomène pour lequel nous manquons d'informations.";"OBSERVATION D'UN OBJET LUMINEUX.";O;3;;;;;;;;2012-01-24;;;0.50;0.50;;;;;;;0.28;0.28;C;C;1980-03-00750
913;"EGUILLE (L') (17) 16.03.1980";Charente-Maritime;17;"(D) Département";1980;03;16;"Le GEIPAN continue à publier l'ensemble de ses archives sur son site public www.geipan.fr. Dans ses publications, figurent des cas anciens classés à l'époque (A, B, C ou D) et qui font aujourd'hui l'objet d'un réexamen, dans le seul but d'être plus pertinent dans les conclusions. Grâce à de nouveaux moyens techniques (logiciels) et à l'expérience d'enquête acquise depuis toutes ces dernières années, ce réexamen aboutit quelquefois à de nouvelles remarques voire à un changement de classification.<br>
Ce cas d'observation précédemment classé D et nommé EGUILLE (L') (17) 16.03.1980 (mais connu également sous le nom de ROYAN (17) 1980) fait partie d'un ensemble de cas réexaminés récemment (voir le compte rendu d'enquête).<br>
Le 16 mars 1980 vers minuit trente, trois témoins sont intrigués par la présence d'une masse lumineuse de couleur jaune orangé dans le ciel nocturne couvert et bas. Durant 45 minutes, malgré des allées et venues (notamment pour prévenir la gendarmerie), les témoins vont suivre les déplacements silencieux du phénomène. Ce dernier disparaît rapidement entre Marennes et Rochefort (17). Un croquis représentant le déplacement du PAN et le paysage aux alentours est joint au procès-verbal, ainsi qu'un plan de situation et qu'une planche photographique annotée avec la position du PAN. Aucun autre témoignage ne sera recueilli.<br>
Seules deux hypothèses ont été retenues, étudiées et exploitées ; qui sont finalement assez proches l'une de l'autre.<br>
Celle de l'impact sur la basse couche nuageuse du projecteur d'un braconnier (en bateau ou à pieds) pêchant la civelle (les pêcheurs « officiels » ne sortant jamais le dimanche), est plausible au regard de la position privilégiée des témoins, situés à proximité immédiate et observant dans l'axe de la Seudre, rivière où cette pêche se pratique. Les pêcheurs utilisent de puissants projecteurs qui, braqués vers le ciel, peuvent donner cet aspect saisissant de tâche sur la couche nuageuse basse.<br>

La forme, circulaire et déformée par la perspective, la « petite queue lumineuse » décrite par le témoin 1 ainsi que les estimations de dimensions données par les témoins sont des caractéristiques toutes compatibles avec cette hypothèse.<br>

Cependant, elle est mise en défaut par quatre facteurs principaux :<br>
 la couleur du projecteur, qui est blanche et non jaune orangée.<br>
 la luminosité du PAN, décrite comme très forte, voire éblouissante, par les trois témoins. Le témoin 1 décrit par exemple que le paysage alentours était illuminé comme en plein jour, ce qui est strictement impossible à produire avec l'impact d'un projecteur sur des nuages, même situés à basse altitude.<br>
 le risque que prendrait un braconnier à laisser ainsi son projecteur orienté vers le ciel, le rendant facilement repérable par les autorités.<br>
 on pourrait également se demander pourquoi un braconnier « s'amuserait » ainsi avec son projecteur, en le faisant aller et venir dans le ciel pendant 45 minutes.<br>

L'autre hypothèse, mettant en jeu un projecteur de discothèque, est plausible, tout comme pour celle du projecteur d'un braconnier, au regard de l'axe d'observation, en direction d'une zone côtière, de la forme, des dimensions et de la « petite queue lumineuse » décrite par le témoin 1.<br>

Les déplacements décrits par les témoins ainsi que la couleur jaune orangée sont également compatibles avec l'hypothèse ainsi que la date, dans la nuit du samedi au dimanche.<br>

Il existe en revanche des données qui invalident cette hypothèse. Nous retiendrons en particulier :<br>

 la luminosité du PAN, décrite comme très forte, voire éblouissante, par les trois témoins. Le témoin 1 décrit par exemple que le paysage alentours était illuminé comme en plein jour, ce qui n'est pas compatible d'un projecteur sur des nuages, même bas.<br>
 nous sommes hors-saison et aucun établissement pouvant utiliser ce type de projecteur n'est ouvert.<br>
 les distances sont trop importantes pour qu'il puisse s'agir d'un projecteur utilisé par un établissement côtier, sauf à imaginer un dispositif local plus proche, mais il est trop tard pour qu'une quelconque vérification puisse être faite sur place.<br>

Il n'y a donc aucune hypothèse de probabilité suffisante pour expliquer l'observation. Au niveau de la consistance, bien que tous les témoins aient été entendus en Gendarmerie et que le procès-verbal établi en conséquence soit assez complet (cartes et planche photographique), il manque des données importantes telles que des relevés d'azimuts pour chaque témoin (seul le témoin 1 ayant donné l'information) et d'angles d'élévation du PAN.<br>

Dans la méthodologie actuelle GEIPAN, le présent niveau d'étrangeté et de consistance imposent de pratiquer une « enquête terrain » avec le témoin pour une reconstitution et un entretien cognitif. Cette dernière est susceptible d'impacter positivement et négativement l'évaluation d'étrangeté comme de la consistance. Mais elle n'est pas possible pour un cas en revisite si longtemps après. Aussi l'évaluation du présent cas est faite selon les critères actuels de prise en compte de l'étrangeté et de la consistance
 (voir actualité GEIPAN http://www.cnes-geipan.fr/index.php?id=181&no_cache=1&tx_ttnews[backPid]=211&tx_ttnews[tt_news]=209) comme si l'enquête terrain avait été faite et avait été totalement neutre (aucun apport en plus ou moins), ce qui est quelque fois le cas. Par contre, afin de marquer cet écart méthodologique, la classification se fait sur la base ABCD et non sur l'actuelle ABC D1/D2 qui correspond pour le classement inexpliqué à une validation plus forte du caractère inexpliqué.<br>

Ici le cas est la limite entre un cas inexpliqué et un cas inexploitable par manque de consistance dans l'état de dossier faute d'enquête GEIPAN menée sur place.<br>

En conséquence, le cas est classé D : inexpliqué.

";"Observation par trois témoins des évolutions silencieuses d'une masse lumineuse jaune orangé dans le ciel nocturne : phénomène étrange de consistance moyenne ou forte.";O;3;3;;1;;;;;2018-11-12;;;0.65;0.00;;;0.90;;0.75;;0.68;0.00;D;D1-;1980-03-00751
914;"FONTEVRAUD L'ABBAYE (49) 1980";Maine-et-Loire;49;"(D) Département";1980;03;25;"Le  25 mars 1980 à partir de 21h50 plusieurs militaires observent durant une heure un phénomène lumineux particulier. Une boule plus grosse qu'une étoile et de couleur jaunâtre émet des rayons lumineux importants. Elle est observée en direction de l'Ouest avec une position un peu au-dessus de l'horizon sans précision angulaire précise. L'examen de la carte du ciel montre à cette heure Vénus en direction de l'ouest à 11° environ au dessus de l'horizon et qui présente une magnitude importante de -4,22. Sirius est également très visible avec une magnitude de -1,45 mais les témoins ont probablement été abusés par l'observation de Vénus.";"Observation probable de la planète Vénus";O;9;;;;;;;;2008-04-21;;;0.50;0.50;;;;;;;0.28;0.28;B;C;1980-03-00753
916;"LA SOURCE (45) 1980";Loiret;45;"(D) Département";1980;03;27;"Le 27 mars 1980 vers 22h, un automobiliste et sa passagère aperçoivent dans le ciel une masse sombre de forme triangulaire. A chaque extrémités des lumières rouges et blanches clignotantes  donnent l'envergure de l'objet : celle-ci atteint d'après le témoin 50 mètres. L'engin d'abord stationnaire, se  déplace ensuite en s'inclinant lentement et en restant à la fois à 50 m du sol et de la voiture. Reprenant de l'altitude, l'engin s'est ensuite incliné sur la droite puis a disparu dans le ciel à une vitesse importante. Durant les 4 à 5 minutes d'observation et avec les vitres fermées, aucun bruit particulier n'a été entendu. Aucune autre information n'a été recueillie sur ce phénomène qui reste inexpliqué.";"Observation d'un objet volant de forme triangulaire de 50 métres d'envergure, pas de bruit , vitesse variable.";O;2;;;;;;;;2007-03-22;;;0.75;0.25;;;;;;;0.78;0.23;D;D;1980-03-00755
918;"SAINT-REMY-DE-PROVENCE (13) 23.03.1980";Bouches-du-Rhône;13;"(D) Département";1980;03;23;"Le 23 mars 1980 à 22h 20 des personnes alertent la gendarmerie : ils observent des phénomènes lumineux inexpliqués évoluant à la base de la tour-relais de télévision hertzienne du ""Mont Caume"". Se rendant immédiatement sur les lieux et lors de vérifications menées les soirs suivants, il s'avèrera que les phénomènes lumineux viennent de projecteurs de signalisation nouvellement installés au pied de la tour. De plus les gendarmes constateront que d'autres effets lumineux aperçus depuis cet endroit ne sont en fait que les éclairages publics de villages environnants et les phares de véhicules qui se déplacent. Ces signalisations lumineuses sont à cette époque noyées et pertubées régulièrement par de la brume et des conditions climatiques défavorables.";"Observation de phénoménes lumineux identifiés comme étant des projecteurs.";O;4;;;;;;;;2007-03-22;;;0.13;0.13;;;;;;;0.53;0.48;A;A;1980-03-00757
919;"FAY-LE-CLOS (26) 29.03.1980";Drôme;26;"(D) Département";1980;03;29;"Le GEIPAN continue à publier l'ensemble de ses archives sur son site public www.geipan.fr. Dans ses publications, figurent des cas anciens classés à l'époque (A, B, C ou D) et qui font aujourd'hui l'objet d'un réexamen, dans le seul but d'être plus pertinent dans les conclusions, en mettant à profit de nouveaux moyens techniques (logiciels) et l'expérience d'enquête acquise depuis toutes ces dernières années. Ce réexamen aboutit quelquefois à un changement de classification.<br>
Ce cas d'observation précédemment classé D et nommé SAINT-VALLIER (26) 1980 fait partie d'un ensemble de cas réexaminés récemment (voir le compte-rendu d'enquête).<br>

Lors de trajets, plusieurs personnes dans deux voitures observent le déplacement vers l'Ouest d'un phénomène lumineux circulaire dans le ciel. Le PAN est décrit comme une boule très lumineuse de couleur (blanche phosphorescente, orangée, rouge selon les témoins) avec des ""reflets verts"" en forme de ""pieds"". Une fois tous arrivés au même endroit, ils continuent leurs observations jusqu'à ce que le PAN disparaisse derrière les montagnes en direction de le Nord-Ouest. Les observations ont duré entre 5 et 20 minutes.<br>

Les témoins ont très probablement observé VENUS.<br>

La durée d'observation, importante, est classique de ce type de confusion avec un astre.<br>

L'observation s'est déroulée vers le nord-ouest ou l'ouest et à une faible élévation angulaire, ce qui correspond bien à l'emplacement de Vénus aux heures de l'observation, qui était située aux environs de 6° d'élévation, à l'ouest-nord-ouest.<br>

L'apparence du PAN, principalement décrit comme étant blanc, ponctuel et fortement lumineux, correspond parfaitement avec l'hypothèse. Les variations dans le récit de quelques témoins relativement à cette apparence traduisent le fait que Vénus se trouvait très bas sur l'horizon et était sujette aux turbulences atmosphériques pouvant faire varier de façon temporaire et aléatoire sa luminosité et produire des effets de couleurs brefs (rouge, vert) , mais également produire de forts éclats, ce que les témoins traduiront par des « pieds lumineux ».<br>

La perception de déplacement rapide du PAN s'explique par le déplacement des témoins en voiture. L'astre non reconnu défile le long et derrière l'environnement parcouru par le véhicule et est perçu comme un PAN suiveur. D'autres déplacements perçus rapides, mais le témoin étant à l'arrêt résultent de la diminution d'intensité lumineuse de l'astre (épaisseur de voile atmosphérique) que le témoin interprète logiquement comme un déplacement en éloignement du PAN. La perception de déplacement lent du PAN correspond bel et bien au coucher de Vénus et sa disparition à celle de Vénus derrière les montagnes du Forez.<br>

Le seul élément qui pourrait limiter cette hypothèse serait la présence d'un obstacle nuageux empêchant ce soir-là de voir Vénus. Néanmoins, la seule indication disponible étant celle d'un ciel globalement dégagé (2/8) à 35 km, vu la forte correspondance avec Vénus, la probabilité qu'il s'agisse d'un autre phénomène sur fond de nuages cachant Vénus est très faible.<br>

En conclusion, le GEIPAN classe le cas en A, observation très probable de la planète Vénus.";"Longues observations par quatre témoins en voiture du déplacement d'un phénomène très lumineux circulaire dans le ciel et disparition vers l'Ouest : observation de Vénus au coucher.";O;4;4;;1;;;;;2018-11-27;;;0.20;0.00;;;0.80;;0.60;;0.50;0.00;A;A;1980-04-00761
920;"NOGENT-LE-ROTROU (28) 10.03.1980";Eure-et-Loir;28;"(D) Département";1980;03;10;"Le 10 mars 1980 à la fin de leur service, les gendarmes de la brigade d'Authon-du-Perche reçoivent un appel de la brigade voisine leur signalant le témoignage d'un chauffeur de taxi qui a aperçu une lueur étrange sur la route qui va vers Authon. Ils se rendent rapidement sur les lieux mais ne constatent rien de particulier.<br> De retour chez lui, l'un des gendarmes ainsi que son épouse continuent de surveiller le ciel et vers 22h15, ils aperçoivent une lumière de taille plus importante qu'une étoile, et qui a des mouvements totalement erratiques dans le ciel. Cette lumière est en forme de disque orangé.<br> Le gendarme rappelle ses collègues et tous les quatre partent en voiture à la recherche du curieux phénomène. Après l'avoir suivi et perdu de vue plusieurs fois à cause du relief, ils finissent par descendre de voiture à un carrefour. Ils observent alors une grande forme rectangulaire aux coins arrondis avec des rampes lumineuses blanches qui éclairent le paysage environnant ainsi que la voiture.<br> L'un des gendarmes ressent une sensation de chaleur ainsi qu'un fort sentiment de crainte qui plus tard l'empêchera de s'endormir. Les gendarmes rentrent chez eux vers 23h30.<br> Aucune explication n'a pu être trouvée à cette observation dont les caractéristiques des mouvements erratiques et très rapides se retrouvent également dans d'autres témoignages d'observation.";"Observation d'une grande forme rectangulaire avec des rampes lumineuses.";O;1;;;;;;;;2011-12-16;;;0.20;0.00;;;0.40;;0.70;;0.30;0.00;D;A;1980-03-01696
921;"GRANDFONTAINE (25) 03.03.1980";Doubs;25;"(D) Département";1980;03;03;"Le 3 mars 1980 entre 20 heures 30 et 20 heures 45, un couple circulant en voiture observe une boule orange de la taille du soleil couchant. Un peu plus tard, ils ne voient plus cette boule mais ils constatent la présence de la lune, plus blanche.<br> Il est probable que les témoins aient été surpris par une apparence singulière de la lune en début de nuit, éclairée par le soleil couchant.";"Observation d'une boule orange sur l'horizon : observation probable de la lune";O;1;;;;;;;;2015-11-23;;;0.38;0.13;;;;;;;0.65;0.35;B;B;1980-03-01698
922;"OTTMARSHEIM (68) 1980";Haut-Rhin;68;"(D) Département";1980;03;04;"Le 4 mars 1980 vers 21 heures 45, de nombreux témoins signalent avoir observé un phénoméne lumineux 5 fois plus grand et brillant qu'une étoile. Cette boule est plutôt de couleur rouge orangée et reste stationnaire dans le ciel. L'enquête montrera que les conditions étaient exceptionnellement favorables pour l'observation sous un aspect très particulier de  certaines planètes comme Mars.";"Observation probable de Mars";O;7;;;;;;;;2007-03-22;;;0.38;0.13;;;;;;;0.65;0.35;B;B;1980-03-01699
924;"CONFLANS-SAINTE-HONORINE (78) 02.04.1980";Yvelines;78;"(D) Département";1980;04;02;"Le 02 avril 1980 vers 23h 30 des personnes observent dans le ciel une boule lumineuse de la forme d'un ballon de rugby. Cet objet immobile est observé pendant 20 minutes. Puis il se déplace très lentement et un bruit de brassage d'air que les témoins décrivent comme un bruit de ventilateur est entendu. Cette boule s'éloigne plein Ouest. L'observation se poursuivra presque une heure avant d'être abandonnée par les témoins.  Aucun autre témoignage ne sera recueilli sur ce phénomène pour lequel nous manquons d'informations. L'hypothèse de l'évolution de nuit d'un hélicoptère léger est cohérente avec les témoignages et ne doit pas être écartée bien qu'elle n'ait pas été vérifiée.";"Observation d'une boule brillante, immobile avec un bruit de déplacement d'air.";O;4;;;;;;;;2012-08-20;;;0.50;0.50;;;;;;;0.28;0.28;C;C;1980-04-00759
925;"SAINT-USUGE (71) 07.04.1980";Saône-et-Loire;71;"(D) Département";1980;04;07;"Le GEIPAN continue à publier l'ensemble de ses archives sur son site : www.cnes-geipan.fr. Dans ses publications, figurent des cas anciens classés à l'époque (A, B, C ou D) et qui font aujourd'hui l'objet d'un réexamen, dans le seul but d'être plus pertinent dans les conclusions. Grâce à de nouveaux moyens techniques (logiciels) et à l'expérience d'enquête acquise depuis toutes ces dernières années, ce réexamen aboutit quelquefois à de nouvelles remarques voire à un changement de classification.<br>
Ce cas d'observation précédemment classé C et nommé LOUHANS (71) 1980 fait partie d'un ensemble de cas réexaminés récemment.<br>

Le 07 avril 1980 vers 2h du matin, deux personnes (T1 passagère et T2 conductrice) circulant sur la départementale D13 à quelques kilomètres de Saint-Usuge (71) aperçoivent une lumière rouge orangée à très basse altitude. Cette lumière est située approximativement au-dessus de la rivière "" la Seille"" et semble se déplacer en suivant le cours d'eau. Sur la D178 au lieu dit ""Varennes"", le PAN est vu comme une boule, se déplaçant au ras du sol par bonds successifs. Les témoins voient ensuite la boule chuter et s'immobiliser sur un côté de la route. La conductrice s'arrête puis prise de panique recule et fait demi-tour. Alors qu'une voiture arrive en sens inverse, les témoins voient la boule prendre de l'altitude et disparaître. Les témoins se rendent à la gendarmerie. L'observation a duré 10 minutes environ.<br>

Ce cas est consistant (deux témoins), la description du PAN observé est assez précise. La sincérité et la crédibilité des témoins n'ont jamais été mises en doute (voir les notes d'enquête).<br>

Le classement initial en C ne paraît pas du tout justifié.<br>

Le phénomène décrit présente beaucoup de caractéristiques communes (durée d'observation, forme, taille, couleur) avec un objet astronomique parfaitement connu : la Lune au lever.<br>

La Lune était effectivement en train de se lever dans l'axe que les témoins indiquent.<br>

Les perceptions de mouvement du PAN correspondent aux illusions typiques créés par un astre :<br>

Le PAN suit les témoins en mouvement selon une trajectoire parallèle, c'est l'illusion de la boule suiveuse.<br>
- la direction de l'astre est bien sûr fixe en absolu. Quand la voiture du témoin suit un cap à peu près constant, l'astre est fixe par rapport au véhicule et défile le long du paysage. Comme le témoin ne voit pas l'astre mais un PAN et le considère à une distance proche, ce défilement le long du paysage est perçu comme un déplacement du PAN parallèlement au véhicule en reproduisant les marches/arrêts ;<br>
- la perception de déplacement de PAN est introduite par son défilement (apparent) le long du paysage.<br>
En absence totale de paysage (mer, désert), l'illusion ne se produit pas ou peu. Si les repères de paysage sont proches, l'astre défile derrière eux rapidement, s'ils sont loin, le défilement et donc la perception de vitesse de déplacement du PAN est moindre. Il suffit qu'il y ait une alternance de repères plus ou moins proches dans le paysage pour que le témoin perçoive des déplacements du PAN en saccades par bond (« se déplaçant par bonds »). De même, la notion de hauteur du PAN par rapport au paysage situé dessous est relative, une alternance de hauteurs de paysage (mal reconnu) peut induire une perception d'alternance de hauteur absolue du PAN contribuant aussi à la notion de mouvement par bonds du PAN.<br>

Un autre phénomène de mouvement de l'astre peut être créé par sa variation d'intensité lumineuse, elle-même causée par l'évolution du voile atmosphérique devant l'astre (le ciel n'étant pas totalement dégagé). Cette variation est logiquement interprétée par le témoin comme une variation en distance (vers lui ou à l'opposé de lui) du PAN selon des vitesses souvent qualifiées de fulgurantes, en particulier lors de la fuite et de la disparition finale. Cette fuite en distance est alors logiquement décrite comme une fuite dans le ciel ou ""une prise d'altitude"" et le témoin ne voit et ne décrit bien sûr aucune variation de position en site ou azimut (en effet ceux de l'astre sont fixes). Ici, le témoin dit     « la boule s'est élevée à grande vitesse, en obliquant sur la droite par rapport à notre sens de marche ». Effectivement, auparavant le PAN « suivait » les témoins et avait une trajectoire parallèle sur leur droite, la fuite finale en distance du PAN est logiquement perçue comme un éloignement vers la droite du PAN avec donc changement de trajectoire de ce dernier.<br>

Il est à noter l'état de stress et de panique dans lequel sont plongés les témoins : « prise de panique, ma sur a reculé » (T1).<br>

Ce n'est pas la perception visuelle des témoins qui est en cause, mais l'interprétation que les témoins font de leur observation à travers leur ressenti (fatigue, conduite de nuit, panique).<br>

En conséquence, le GEIPAN classe le cas comme PAN A : observation liée à une méprise avec la Lune au lever.
";"Observations nocturnes depuis un véhicule d'une boule lumineuse se déplaçant à ras du sol par bonds successifs : méprises avec la Lune au lever.     ";O;2;2;;1;;;;;2018-10-11;;;0.15;0.00;;;0.80;;0.70;;0.60;0.00;A;A;1980-04-00760
928;"(DPT) BAS-RHIN (67) 11.04.1980";Bas-Rhin;67;"(D) Département";1980;04;11;"Le GEIPAN continue à publier l'ensemble de ses archives sur son site public www.geipan.fr. Dans ses publications, figurent des cas anciens classés à l'époque (A, B, C ou D) et qui font aujourd'hui l'objet d'un réexamen, dans le seul but d'être plus pertinent dans les conclusions. Grâce à de nouveaux moyens techniques (logiciels) et à l'expérience d'enquête acquise depuis toutes ces dernières années, ce réexamen aboutit quelquefois à de nouvelles remarques  voire à un changement de classification explicité dans une note d'enquête. Ce cas d'observation précédemment classé D et nommé SOULTZ SOUS FORETS (67) 1980 fait partie d'un ensemble de cas réexaminés récemment.<br> Dans la nuit du 11 au 12 avril 1980 entre 23h50 et 0h30 plusieurs témoins vont observer longuement et depuis différents lieux un phénomène lumineux dans le ciel. Ce phénomène, statique ou en déplacement lorsque les personnes se déplacent dans leur véhicule, intrigue les témoins.

<br> Les témoignages rapportés par les PV de gendarmerie (N°491 et N°307) présentent les caractéristiques d'une observation d'un astre. Caractéristiques aujourd'hui bien connues du GEIPAN avec l'accumulation de cas expliqués de ce type en particulier au cours des dix dernières années (voir site www.geipan.fr  et recherche de cas avec les phénomènes astres, Vénus, Lune, Soleil ):
<br>  - durée d'observation longue de plus de 30 minutes, faible hauteur dans le ciel et disparition finale du PAN derrière le relief local.

<br>  - position du PAN stable à l'arrêt du témoin et mobile dès lors que le témoin se déplace avec perception d'être suivi par le PAN. Il s'agit de l'illusion de la ""boule suiveuse"". La direction de l'astre est bien sûr fixe en absolu. Quand la voiture suit un cap à peu près constant, l'astre est fixe par rapport au véhicule et défile avec le paysage. Comme le témoin a déjà au préalable été surpris par l'aspect du PAN et le considère à une distance proche, ce défilement le long du paysage est compris comme un déplacement du PAN parallèlement au véhicule en reproduisant la vitesse de ce dernier, ici à gauche des témoins sur la route de Hoelschloch à Merkwiller. Et bien sûr, arrivé à Merkwiller, le PAN  ""contourne l''église"" située à gauche de la direction suivie par la voiture et au carrefour, lorsque le véhicule s'arrête, le PAN reste au niveau du carrefour.
<br>  - non identification par les témoins d'un astre remarquable car très lumineux pourtant présent dans la direction de l'observation, alors que le ciel est décrit comme dégagé et étoilé.<br>

On vérifie qu'il s'agit effectivement d'un astre à savoir Vénus qui, à 23H50, est très visible (magnitude - 4,4) en azimut 301° et à hauteur 6,2°.

<br>  -les  repérages de visées des  témoins T2 et T3 concordent, ils situent le PAN ""au dessus  du Liebfrauenberg""  qui est en fait le château du même nom. T1 utilise un repère moins précis ("" à proximité des radars de la base de  Drachenbronn"") et T3 mentionne à la fin de sa déposition ces mêmes radars tout en répétant que le PAN était au-dessus du Liebfrauenberg  (""Je précise que lorsque la boule était au - dessus du Liebfrauenberg, dans cette direction, elle se trouvait très prês et juste au -dessus des installations radars de la Base Aérienne, à leur gauche."". La formule est confuse, d'autant qu'il y a 20° à 30° d'écart  d'azimut entre les deux repères (selon la largeur du domaine attribuée au château du Liebfrauenberg). On peut penser que T3 a surtout voulu attirer l'attention sur le fait que des radars militaires n'étaient  pas loin de l'OVNI. T4 mentionne ""nous avons pu observer pendant une demi-heure environ l'objet qui se trouvait apparemment en stationnement au-dessus de la base de DRACHENBRONN"". On note que T4 n'est pas originaire des lieux (service militaire) et a pu utiliser la référence  de T1 ou T3 (les témoins étaient tous  ensemble au moins à un moment de l'observation), ce que  traduirait le ""apparemment"",  mais tout en faisant un raccourci, il parle de la base, qui est en direction NE, et non des radars de la base qui sont en direction Nord Ouest Nord.<br>  - en prenant le repérage précis utilisé par T2 et T3 et non infirmé par T1 et T4, à savoir le château du Liebfrauenberg  et comme lieu d'observation le carrefour de Merkwiller ou le lieu-dit  Hattenweg,  la visée correspond à  l'azimut de Venus (~300°). On vérifie que le profil altimétrique dans cette direction  (à  +/- 5° autour) ne cache pas Vénus, l'obstacle le plus en élévation (massif de la forêt de Goersdorf)  se trouvant à 4,2 km (de Hattenberg)  avec un dénivelé de 200 m soit à une élévation relative de  2,7°. Selon cette estimation, le masquage de Vénus intervient à 0H20 alors que les témoins le notent à 0H25 ou 0H30, la variation d'élévation sur 10 mn est de 1,2°. On est parfaitement dans les marges d'erreur d'appréciation ou  de connaissance des heures exactes des éléments d'observation comme des positions précises des témoins au moment de ces observations  (influe sur l'évaluation des masquages).<br>  Le PV de gendarmerie N°491 note dans sa synthèse d'enquête et le dessin associé que le PAN a fait une fuite finale (après une demi-heure de stabilité au-dessus du Liebfrauenberg) vers le Nord EST. Ce qui viendrait en contradiction avec l'hypothèse. Mais T2 et T4 ne mentionnent pas de fuite finale. L'expression utilisée par T2 ""ce dernier est resté jusqu'à 0 heure 30  au dessus du Liebfrauenberg,  J'ignore quelle direction il a prise par la suite, je n'ai pas fait attention."" laisse penser que T2  avait connaissance de témoignages de fuite finale mais n'était pas en mesure de confirmer. T3 mentionne ""cette boule est partie en laissant une traînée jaune, en direction du Nord"".  T3 a pu subir l'illusion classique d'une réduction finale  d'intensité de l'étoile ( en raison de la couche atmosphérique) en l'interprétant comme un éloignement soudain en distance et il aurait approximer une fuite vers le Nord Est (Vénus est alors à 308°) en fuite vers le Nord  comme il approximait déjà Liebfrauenberg et les radars de la base. T1 indique ""L'objet se tenait immobile à proximité des radars de la base de DRACHENBRONN, Nous avons observé ce phénomène jusque zéro heure vingt-cinq à laquelle il s'est éloigné à très grande vitesse vers LOBSANN.  LOBSANN étant en NE, cette indication traduirait une nette fuite finale du PAN franchement vers la droite sans possibilité de l'associer à une fuite en distance comme pour T3. Néanmoins le témoignage de T1 vient en écart des autres sur plus d'un point. Dans la phase en voiture (avec T2 et T4), T1  décrit le PAN ""haut dans le ciel"" alors que T4 et T2 le voient sur la gauche (ou dans une direction fixe équivalente à la gauche) et alors que T4 mentionne que T1 a signalé aux autres le PAN sur sa gauche. T1 est le seul à décrire un PAN en ""deux disques reliés par un trait"". Enfin T1 décrit  une traversée de route par le PAN, le PAN venant de la droite. Cette sensation d'évolution du PAN par rapport à la route a pu se produire mais pas dans ce sens et pas dans ces proportions.  Le cap de la route n'est pas stable, en particulier au niveau du cimetière (zone signalée par T1 comme franchissement de la route par le PAN) , le cap passe de N à NE et donc la direction de Vénus par rapport à la route  passe de la gauche ( cap 10H) pour se caler au voisinage du cap de la route (cap 12h) . Ces éléments de singularité  et/ou d'exagération des sensations de T1 nous conduit à ne pas les retenir.<br>  Les autres éléments d'étrangeté apparente, comme  les changements de couleur, les impressions de baisse de hauteur du PAN par saccade ou escalier, sont classiques de l'observation de Vénus à faible élévation au travers des couches atmosphériques créant les modifications de couleurs.  La première méprise (non reconnaissance du fait de la lueur et des couleurs) est à l'origine de l'erreur d'appréciation  de distance et in fine de  l'illusion de boule suiveuse. L'ensemble se consolide mutuellement en étrangeté.<br>  La forte cohérence d'aspect et de position dans le ciel avec Vénus ne laisse aucun doute. Les quelques éléments qui s'opposeraient (fuite finale vers l'EST) ne peuvent être retenus car ils viennent d'un seul témoin parmi les 4, en singularité ou contradiction avec les trois autres. <br> Enfin aucun des témoins n'a distingué Vénus pendant plus de 30 minutes, alors que le ciel est dégagé et que Venus est dans la direction d'observation et aurait dû être un repère clef pour situer le PAN.<br>  En conséquence le GEIPAN classe le cas en A : observations de Vénus.";"Multiples et longues observations en divers lieux d'observation et en roulant d'un phénomène lumineux de couleur dans le ciel dégagé ; ""illusion de la boule suiveuse"" : observations de Vénus.";O;4;;;;;;;;2017-11-23;;;0.05;0.00;;;0.60;;0.68;;0.42;0.00;A;A;1980-04-00764
929;"METZ (57) 1980";Moselle;57;"(D) Département";1980;04;13;"Le 13 avril 1980 en soirée, deux personnes observent depuis leur résidence des points lumineux  dans le ciel. Ils  se déplacent rapidement à haute altitude dans une direction Nord-Sud. Ces points émettent une lumière blanche clignotante. Aucun autre témoignage n'a été recueilli sur ce phénomène pour lequel nous manquons d'informations. Il est cependant probable qu'il s'agissait d'un passage d'avion en haute altitude.";"Observation de  points  lumineux clignotants, probablement un avion.";O;2;;;;;;;;2007-03-22;;;0.38;0.13;;;;;;;0.65;0.35;B;B;1980-04-00765
930;"PELLERIN (LE) (44) 21.04.1980";Loire-Atlantique;44;"(D) Département";1980;04;21;"Le 21 avril 1980 à11h 55 un témoin entend un sifflement et est effrayé par une gerbe de feu et la chute à quelques mètres de lui d'un objet venant du Nord- Ouest . Il n'entend aucun bruit d'impact et ne voit aucune fumée. Ce  jardinier décrit l'objet comme ayant la grosseur d'un seau d' un diamètre de 20 cm et les couleurs de l'arc en ciel. Les gendarmes appelés sur place constatent des traces au sol : sur un cercle de 100 m de diamètre le sol est recouvert d'une poudre blanchâtre et l'herbe est brûlée. Aucune trace d'impact du type cratère n'est présente au sol. Le lendemain une pièce métallique sera retrouvée.  Il n'a pas été retrouvé trace des résultats d'analyse dans les archives du GEIPAN, ce qui nous conduit à un classement C en attendant d'avoir retrouvé ces pièces.";"Observation brève de la chute d'un objet : traces au sol.";O;1;;;;;;;;2007-03-22;;;0.50;0.50;;;;;;;0.28;0.28;C;C;1980-04-00766
931;"VEZZANI (2B) 1980";Haute-Corse;2B;"(D) Département";1980;04;27;"Le 27 avril 1980 un témoin observe un phénomène particulier alors qu'il s'apprête à rentrer chez lui vers 0h 30. Une boule rouge-orangée de la grosseur d'un ballon de football s'approche vers lui et s'arrète à 5 mètres de la maison. Cet objet brille fortement d'un éclat métallique. Réveillant d'autres personnes chez lui , ils vont  également observer cette boule lumineuse. Effrayés, ils décideront de rentrer se coucher. Le lendemain aucune trace suspecte ne sera remarquée sur le devant de la porte. Aucun autre témoignage ne sera recueilli sur ce phénomène pour lequel nous manquons d'informations.";"Obsevation d'une boule lumineuse au sol.";O;2;;;;;;;;2007-03-22;;;0.50;0.50;;;;;;;0.28;0.28;C;C;1980-05-00767
932;"LE CHESNAY (78) 1980";Ile-de-France;IDF;"(R) Région";1980;04;05;"Le  05 avril 1980 vers 22 heures 45, un témoin observe une boule lumineuse blanche montant par saccades dans le ciel laissant derrière elle une trainée blanche.  Après avoir monté, l'objet est parti à l'horizontale à très grande vitesse avant de disparaitre. L'enquête n'a pas permis d'identifier le phénomène observé.";"Observation de la montée vers le ciel d'une boule blanche qui part ensuite à l'horizontale à très grande vitesse.";O;2;;;;;;;;2007-03-22;;;0.75;0.25;;;;;;;0.78;0.23;D;D;1980-04-01695
935;"FLIXECOURT (80) 1980";Somme;80;"(D) Département";1980;05;08;"Le 8 mai 1980 à 23h 30 des gendarmes sont appelés sur les lieux de l'apparition d'un phénomène particulier. Un témoin,  fortement impressionné,  affirme que sa chambre a soudainement été éclairée par une forte lumière, qu'il a ressenti dans cette pièce la présence d'une forme humanoïde et que par la fenètre lui et sa soeur ont pu voir le déplacement d'un objet lumineux . Les gendarmes n'ont  pas recueilli de traces ou d'autres témoignages dans le secteur confirmant les dires de ces personnes. D'autres témoins présents à leur domicile dans des pièces correctement orientées auraient du voir le phénomène compte tenu de l'ampleur décrite. Ce qui n'a pas été le cas. Les chiens de garde des témoins, d'ordinaire très agressifs la nuit à la moindre lumière, n'ont pas bougé lors de ce phénomène. Enfin, l'enquête de la gendarmerie a montré une certaine fragilité du témoin. L'hyphothèse la plus probable est donc que le témoin a probablement été abusé par des phénomènes lumineux provenant de véhicules facilement visibles depuis la fenêtre de la chambre alors qu'il se trouvait sans doute dans un état de sensibilité particulière aux phénomènes surnaturels.";"Observation d'un engin en forme d'assiette .Impression de présence humaine dans la chambre du témoin.";O;2;;;;;;;;2007-03-22;;;0.38;0.13;;;;;;;0.65;0.35;B;B;1980-05-00768
