url,place,dateTime,description,sources,id,place.name,place.org.dirName,place.org.code,place.org.places,place.org.kind,place.org.parent,place.place,place.org,place.place.locations,place.place.elevation,place.place.dirName,place.place.data,place.org.parent.dirName,place.org.parent.code,place.org.parent.places,place.org.parent.kind,place.org.parent.parent.dirName,place.org.parent.parent.code,place.org.parent.parent.places,place.org.parent.parent.kind,place.org.parent.parent.parent.dirName,place.org.parent.parent.parent.code,place.org.parent.parent.parent.places,place.org.parent.parent.parent.kind,place.org.parent.parent.parent.parent,place.org.parent.parent.parent,place.org.parent.parent
https://rr0.org/time/1/9/5/4/02/index.html#1954-02T14:00,Lombez (Gers),,"",,,,1954-02T14:00,", après avoir observé un engin immobile à très basse altitude, à la verticale d'un pont, Mme Jandot et 3 autres témoins anonymes se séparent en silence, comportement que Mme Jandot elle-même ne s'explique pas, au point de le trouver anormal. Effet psychique ?.","LDLN n° 176,s2,"""",p. 15,",1954-02T14:00
https://rr0.org/time/1/9/5/4/02/index.html,Todd River Downs (Australie centrale),,"",,,,1954-02,"A , un indigène longe à cheval une petite crête lorsqu'un objet sphérique de 13 m de diamètre environ me désarçonna presque ; il s'éleva tout à coup avec un souffle puissant, en grondant et en émettant 4 colonnes de fumée.","Wilkins U. 211,s5,"""",,",1954-02
https://rr0.org/time/1/9/5/4/02/index.html#1954-02-24,,1954-02-24,Le président Dwight David Eisenhower approuve la recommandation du NSC de construction de la Ligne DEW.,"",1954-02-24
https://rr0.org/time/1/9/5/4/02/index.html#1954-02-26T14:30,Newburyport (Massachusetts),,"",,,,1954-02-26T14:30,", l'architecte R. M. Pierce, l'ingénieur de la marine George Avery et une autre personne observent un disque argenté, avec une bande blanche, émettant un très fort grondement durant 30 à 60 s.","Cas Blue Book n° 2913 non résolu,s7,"""",,",1954-02-26T14:30
https://rr0.org/time/1/9/5/4/02/index.html,Peakskill (New York),,"",,,,1954-02,"A , M. et Mme Forster voient un engin au sol. Auprès de l'appareil se tient une femme portant des habits lumineux, une sorte de capuchon et des verres épais. Elle tient un tube dans une main et une boîte dans l'autre. Mme Forster, commotionnée, doit être prise en charge par un hôpital.",",s8,""""""Barker, Gray Roscoe"""""",,",1954-02