url,place,time,description,sources,id,place.name,place.org.name,place.org.surname,place.org.title,place.org.time,place.org.deprecated,place.org.note,place.org.place,place.org.description,place.org.sources,place.org.tags,place.org.image,place.org.id,place.org.dirName,place.org.url,place.org.events,place.org.type,place.org.places,place.org.kind,place.org.parent,place.place,place.org,place.place.name,place.place.surname,place.place.title,place.place.time,place.place.deprecated,place.place.note,place.place.place,place.place.description,place.place.sources,place.place.tags,place.place.image,place.place.id,place.place.dirName,place.place.url,place.place.events,place.place.type,place.place.locations,place.place.elevation,place.org.parent.name,place.org.parent.surname,place.org.parent.title,place.org.parent.time,place.org.parent.deprecated,place.org.parent.note,place.org.parent.place,place.org.parent.description,place.org.parent.sources,place.org.parent.tags,place.org.parent.image,place.org.parent.id,place.org.parent.dirName,place.org.parent.url,place.org.parent.events,place.org.parent.type,place.org.parent.places,place.org.parent.kind,place.org.parent.parent.name,place.org.parent.parent.surname,place.org.parent.parent.title,place.org.parent.parent.time,place.org.parent.parent.deprecated,place.org.parent.parent.note,place.org.parent.parent.place,place.org.parent.parent.description,place.org.parent.parent.sources,place.org.parent.parent.tags,place.org.parent.parent.image,place.org.parent.parent.id,place.org.parent.parent.dirName,place.org.parent.parent.url,place.org.parent.parent.events,place.org.parent.parent.type,place.org.parent.parent.places,place.org.parent.parent.kind,place.org.parent.parent.parent.name,place.org.parent.parent.parent.surname,place.org.parent.parent.parent.title,place.org.parent.parent.parent.time,place.org.parent.parent.parent.deprecated,place.org.parent.parent.parent.note,place.org.parent.parent.parent.place,place.org.parent.parent.parent.description,place.org.parent.parent.parent.sources,place.org.parent.parent.parent.tags,place.org.parent.parent.parent.image,place.org.parent.parent.parent.id,place.org.parent.parent.parent.dirName,place.org.parent.parent.parent.url,place.org.parent.parent.parent.events,place.org.parent.parent.parent.type,place.org.parent.parent.parent.places,place.org.parent.parent.parent.kind,place.org.parent.parent.parent.parent,place.org.parent.parent.parent,place.org.parent.parent
https://rr0.org/time/1/8/8/8/index.html#1888-03,Manti,,,,,,,,,,,,,,,,"",place,"",,1888-03,"Boules de feu observées par le 30 juillet le mercredi 28 À , observation d'une croix dorée sur la face de la Lune.","Année scientifique et industrielle < Peinture d'un artiste inconnu (Imp. Lemercier et Cie,s1,""""""Figuier, Louis"""""",""Paris) in Desbaux, Emile: La Physique Populaire, Bibliothèque Camille Flammarion, Paris, 1891, p. 424-425. Domaine public, disponible auprès de l'Agence Martienne et de la Mary Evans Picture Library"",,""A Cross Moon"",s2,"""",Ogden Standard Examiner,1888-03-31",1888-03
https://rr0.org/time/1/8/8/8/index.html#1888-05,Nouvelle-Zélande,,,,,,,,,,,,,,,,"",place,"",,1888-05,"le vendredi 4 En , observation d'un objet à noyau ovale avec des flammes à bandes noires suggestives d'une structure. A Findlay (Ohio), des centaines de gens observent dans le ciel du nord des lueurs rougeâtres former une main géante.","Nature,s3,"""",42-402,,""A Strange Spectacle"",s4,"""",Patriot de Barnstable (Massachusetts),1888-05-29",1888-05
https://rr0.org/time/1/8/8/8/index.html#1888-06,New York (USA),,,,,,,,,,,,ny,org/us/ny,,"",org,",,,,,,,,,,,,,,"""",place,""43,-75"",",region,,,,,,,,,,,,us,org/us,,"",org,"",country,,,,,,,,,,,,,,,,"",place,"43,-75",,1888-06,"le mardi 26 13:05 A , observation d'une boule de feu émettant beaucoup d'étincelles et explosant.","""A Mysterious Ball of Fire"",s5,"""",Sentinel de Milwaukee (Wisconsin),",1888-06$org_us_ny
https://rr0.org/time/1/8/8/8/index.html#1888-07,"Vladicaucase, près de Saint Pétersbourg (Russie)",,,,,,,,,,,,,,,,"",place,"",,1888-07,"le lundi 30 vers 1888 18 h A , M. Agé observe des 3 boules brillantes : une grande jaunâtre, ayant l'éclat de l'or, et 2 petites boules pourprées, sur les côtés de la grande. Les pentes du ravin étaient éclairées d'une lumière pourprée. Environ 3 mn après, les boules deviennent plus petites, et disparaissent instantanément, sans aucun bruit.","L'Année scientifique et industrielle,s6,""""""Figuier, Louis"""""",""32ème année (1888), Paris, 1889, pp. 66-67"",",1888-07
https://rr0.org/time/1/8/8/8/index.html#1888-08,,1888-08,"le mardi 14 Au Cap de Bonne Espérance, pluie si noire qu'elle est décrite comme une douche d'encre. On la décrit comme constituée de particules volcaniques et cosmiques","Dover,s7,""""""La Nature, 1888, 2-406 < The Complete Books of Charles Fort. New York"""""",""1974, p. 29 < Fitch, Donna K., Strange: August Fortean Events"",,Almanach Hachette 1902.,s8,"""",,",1888-08
https://rr0.org/time/1/8/8/8/index.html#1888-10,,1888-10,Le lac Long est labourée par une boule de feu de taille considérable.,"""Plowed by Fire"",s9,"""",Semi Weekly,1888-10-09",1888-10