description,events,id,place,sources,time,type,url,place.name,place.org,place.place.dirName,place.place.elevation,place.place.events,place.place.id,place.place.locations,place.org.dirName,place.org.events,place.org.id,place.org.kind,place.org.parent.dirName,place.org.parent.events,place.org.parent.id,place.org.parent.kind,place.org.parent.parent.dirName,place.org.parent.parent.events,place.org.parent.parent.id,place.org.parent.parent.kind,place.org.parent.parent.parent,place.org.parent.parent.places,place.org.parent.parent.type,place.org.parent.places,place.org.parent.type,place.org.places,place.org.type,place.org.parent,place.place,place.org.parent.parent
"Nostradamus n° 89 du 20, titrant sur La soucoupe volante de Cherbourg Vague d'observations en France.","",1973-12,,"",1973-12,sighting,https://rr0.org/time/1/9/7/3/12/index.html
"le Observation de M. G. Jean et de son fils sur la plage de Carteret (Normandie). Le ven 07, des gens trouvent sur une plage voisine de celle de Carteret un équipement de plongée complet, avec contrôleur de radioactivité, signaux sonores, pantalons et vestes avec des étiquettes en anglais.","",1973-12-02T05:30,,"",1973-12-02T05:30,sighting,https://rr0.org/time/1/9/7/3/12/index.html#1973-12-02T05:30
"le Dans les bois de , à 2 km du lac de la Trappe, un chasseur voit 1 énorme cigare survolant les collines à une vitesse vertigineuse et toujours dans le silence le plus total.","",1973-12-28T08:15,Chambarant (France),,,,"",,"",""""","""",s1,"""",Le Dauphiné Libéré,20,""Une section de recherche sur les ovnis à Saint-Marcellin""",1973-12-28T08:15,sighting,https://rr0.org/time/1/9/7/3/12/index.html#1973-12-28T08:15
"le Depuis la colline Ste-Eutrope, dominant une bonne partie de ce secteur de provençal, témoin (capitaine de réserve de l'armée de l'air, habitant Orange dans le Vaucluse) et épouse, très intéressés par les déplacements de la comète Kohoutek - à cette époque-là que la fameuse comète était visible depuis une partie de l'Europe - scrutent le ciel depuis leur domicile lorsqu'ils distinguent très nettement au-dessus de Marcoule (commune distante d'Orange de quelques dizaines de km), un peu au-dessus de l'horizon, 1 lueur aux dominantes rouges, de la taille et de la forme d'un cigare, se déplaçant très lentement ; une lueur beaucoup plus rouge brille à l'une des extrémités du phénomène, qui disparait vers 20:00, masqué par un écran de nuages.","",1973-12-30T19:45,,"""""""Troadec, J.-P."""""","""",s2,"""",RUP,19,""'Les dossiers secrets' de l'Armée de l'Air française""",1973-12-30T19:45,sighting,https://rr0.org/time/1/9/7/3/12/index.html#1973-12-30T19:45
"le témoin voit un cigare de 30 m de haut sur 5 m de large se poser au bord de la Nationale 347 qui longe l'aérodrome de Lens (Pas-de-Calais). Dans un bruit, l'objet bascule et disparaît en quelques secondes.","",1973-12-31,,""""","""",s3,"""",,[object Object],",1973-12-31,sighting,https://rr0.org/time/1/9/7/3/12/index.html#1973-12-31