description,events,eventType,id,place,sources,time,type,url,place.dirName,place.elevation,place.events,place.id,place.locations,place.name,place.org._parent,place.org.events,place.org.id,place.org.kind,place.org.places,place.org.type,place.org._parent._parent._parent._parent,place.org._parent._parent._parent.events,place.org._parent._parent._parent.id,place.org._parent._parent._parent.kind,place.org._parent._parent._parent.places,place.org._parent._parent._parent.type,place.org._parent._parent.events,place.org._parent._parent.id,place.org._parent._parent.kind,place.org._parent._parent.places,place.org._parent._parent.type,place.org._parent.events,place.org._parent.id,place.org._parent.kind,place.org._parent.places,place.org._parent.type,place.org._parent._parent,place.org._parent._parent._parent
"en Couverture du n° 10, vol. 1 de Air Wonder Stories Apparition d'un avion mystère","",sighting,1930-03$,,""""","""",s1,"""",,,Gernsback publications < Collection Les Treece-Sainclair < UFOPOP,"""","""",s2,"""",""Plattsburg Sentinel de Plattsburg (New York), 4 mars 1930"",01,""Mystery Plane at Henderson Harbor""",1930-03,event,https://rr0.org/time/1/9/3/0/index.html#1930-03
"Les 30 habitants du petit village esquimau d' disparaissent. Dans cette région, les conditions de vie sont particulièrement éprouvantes, et l'on retrouve seulement une demi-douzaine de chiens encore attachés, morts de faim. Les tombes ont même été ouvertes et les cadavres qu'elles contenaient ont également disparu.","",sighting,1930$Angikumi (Canada),,,"",,"",Angikumi (Canada),"",1930,event,https://rr0.org/time/1/9/3/0/index.html
"Un appareil qui transporte des hommes d'affaires pénètre dans un nuage sombre - le seul parcourant le ciel. Des fermiers le voient brusquement en retomber, une aile en partie arrachée. Les réservoirs d'essence s'en détachent et tombent. Il n'y a eu aucun éclair ni coup de tonnerre, et le drame s'est produit dans le silence. Comme la foudre ne peut arracher l'aile d'un avion, que s'est-il passé ? L'avion a-t-il rencontré un corps solide à l'intérieur du nuage sombre, qu'il aurait percuté ?","",sighting,1930$,,"",1930,event,https://rr0.org/time/1/9/3/0/index.html
Le docteur Henry Coanda commence ses travaux sur les formes aérodynamiques lenticulaires.,"",sighting,1930$,,"",1930,event,https://rr0.org/time/1/9/3/0/index.html
"en Couverture du n° 1, vol. 3 d'hiver du trimestriel Amazing Stories A l'occasion du tremblement de terre de , on aperçoit des lueurs 1 heure durant après qu'il se soit déclaré. Elles sont tantôt irradiées comme les rayons du Soleil levant, tantôt comme les feux d'un projecteur, tant comme des boules de feu, rapportera Frank Lane. On voit aussi des boules de lumière très brillantes, disposées ""en ligne"", bleuâtres, jaunes ou violacées. Elles brillent d'un éclat tellement vif qu'à 50 km environ de l'épicentre, elles paraissent plus brillantes que la Lune ainsi qu'à Tokyo où de nombreux témoins déclarent qu'ils ont pu discerner des ""objets"" sous leur éclairage. On distingue ces lueurs depuis une distance de 110 km.","",sighting,1930-11$Idu (Japon),,,"",,"",Idu (Japon),""""","""",s3,"""",,,Collection Les Treece-Sainclair < UFOPOP",1930-11,event,https://rr0.org/time/1/9/3/0/index.html#1930-11
"en Jules B. (42 ans, auteur d'une observation en janvier 1906), rentre chez lui par la route qui contourne une colline par le nord. Soudain il voit sortir du fossé un petit être qui traverse la route et escalade le bord droit du fossé à la vitesse d'une personne qui marche normalement. Mais ses jambes sont collées l'une contre l'autre et immobiles. Il glisse sur le sol et se volatilise instantanément sur place une fois arrivé de l'autre côté","",sighting,1930$Toulx-Sainte Croix,,,"",,"",Toulx-Sainte Croix,""""","""",s4,"""",,130,""Pleins feux sur la Creuse"","""","""",s5,"""",Info OVNI,04,Catalogue Creuse",1930,event,https://rr0.org/time/1/9/3/0/index.html#1930
"En 1930 ou plus tard, un soir sombre Couverture du d'hiver de Science Wonder À Ranveig Alstad observe 2 objets lumineux faire des cercles au-dessus de Setermoen et Lifjell.","",sighting,1930$Setermoen (Norvège),,,"",,"",Setermoen (Norvège),""""","""",s6,"""",,,Collection Les Treece-Sainclair < UFOPOP,"""","""",s7,"""",,1966-12-10,Fremover,"""","""",s8,"""",1/1967,10,UFO-NYT",1930,event,https://rr0.org/time/1/9/3/0/index.html
Dans les années 1930s Observation en Norvège.,"",sighting,1930$,,""""","""",s9,"""",""1966-11-10, ou plus tard"",,Øvre SmÅlenene",1930,event,https://rr0.org/time/1/9/3/0/index.html