url,place,time,description,sources
https://rr0.org/time/1/9/9/0/08/index.html,,1990-08,Invasion du Koweït.,""
https://rr0.org/time/1/9/9/0/08/index.html,,1990-08,"Une des photos de Calvine Au-dessus de Calvine , à 20 miles au nord de Pitlochry (Perthshire, Grande Bretagne), photo de Calvine.",""
https://rr0.org/time/1/9/9/0/08/index.html,,1990-08,Milieu du mois La presse cesse brutalement de parler de l'affaire des six de Gulf Breeze.,""
https://rr0.org/time/1/9/9/0/08/index.html,,1990-08,"A Lassay-les-Châteaux (Mayenne), le propriétaire d'une ferme observe au-dessus d'un batiment 1 forme stationnaire rouge puis 1 autre verte. Effrayé il rentre à la maison Un feu d'artifice a été tiré le même jour dans le même créneau horaire et est peut-être à l'origine de l'observation. L'année suivante afin de valider cette hypothèse, les gendarmes reviennent à la ferme afin de constater les effets du feu d'artifice. Le témoin n'a pas reconnu les observations de l'année précedente mais il n'était pas placé dans les mêmes conditions (il savait ce qu'il allait voir) et l'hypothèse du feu d'artifice reste privilégiée SEPRA: PAN classé B.",""
https://rr0.org/time/1/9/9/0/08/index.html,,1990-08,"A Langogne (Lozère), 1 témoin observe pendant 30 à 40 s 1 éclat lumineux très vif cadencé à 3 s environ qui se déplace très rapidement SEPRA: PAN classé C.",""
https://rr0.org/time/1/9/9/0/08/index.html,,1990-08,"A Cabo Rojo, route 101 (Porto Rico), Miguel Figueroa, qui s'approche en voiture voit 5 petites créatures de couleur grise, avec des corps extrêmement minces, de grosses têtes, des oreilles pointues, une fente en guise de bouche, un nez minuscule et d'immenses yeux en amande tout blanc. Figueroa observe des faisceaux lumineux aveuglants sortant des yeux qui l'ont incité s'arrêter. Ces entités sautent d'un pont pour longer une rivière qui débouche sur une lagune. Ils laissent des empreintes de pieds avec 3 doigts. Aucun ovni n'est aperçu. Les entités seront revues régulièrement dans le même secteur Good, T.: 1992, p. 107 Greslé, J.-G.: 1993, (dessin) pp. 203-204 Good, T.: 1994, pp. 248-253.",""