url,place,time,description,sources,id,place.name,place.org.type,place.org.dirName,place.org.events,place.org.id,place.org.places,place.org.kind,place.org.parent,place.place,place.org,place.place.id,place.place.events,place.place.locations,place.place.elevation,place.place.dirName,place.org.parent.type,place.org.parent.dirName,place.org.parent.events,place.org.parent.id,place.org.parent.places,place.org.parent.kind,place.org.parent.parent.type,place.org.parent.parent.dirName,place.org.parent.parent.events,place.org.parent.parent.id,place.org.parent.parent.places,place.org.parent.parent.kind,place.org.parent.parent.parent.type,place.org.parent.parent.parent.dirName,place.org.parent.parent.parent.events,place.org.parent.parent.parent.id,place.org.parent.parent.parent.places,place.org.parent.parent.parent.kind,place.org.parent.parent.parent.parent,place.org.parent.parent.parent,place.org.parent.parent
https://rr0.org/time/1/9/5/2/01/index.html#1952-01T22:30,,1952-01T22:30,"en A Weston (Wyoming), 1 rancher de 38 ans voit une étoile filante s'arrêter brusquement dans l'air entre lui et la montagne. Il observe qu'elle tournait dans le sens des aiguilles d'une montre, a une ouverture rouge qui fait périodiquement face à l'observateur. Elle descend en direction de la rivière Little Powder et remonte. Le témoin tourne sa voiture pour envoyer des signaux lumineux auxquels l'objet semble répondre en arrêtant son ouverture rouge face à l'endroit où se trouvait le témoin. Le tournoiement reprend, l'objet monte et descend. Un engin identique arrive, et ils s'éloignèrent tous 2 dans la vallée, hors de vue.",""""",,s1,"""",,,""""",1952-01T22:30
https://rr0.org/time/1/9/5/2/01/index.html#1952-01-20,la base de Fairchild,,,"","",,,1952-01-20,"le Spokane (Washington DC), 2 sergents-chefs — spécialistes du renseignement — observent à 3 km de distance un discoïde blanc-bleuté à longue queue bleue évoluant à 200 km/h sans aucun bruit. Ils volent sous un plafond nuageux de 1400 m ce qui exclut l'hypothèse du météore.","",1952-01-20
https://rr0.org/time/1/9/5/2/01/index.html#1952-01-21,,1952-01-21,"le A la base de Mitchel (New York), un pilote d'un TBM de la Navy prend en chasse un objet blanc circulaire en forme de dôme qui accélère et disparaît.","",1952-01-21
https://rr0.org/time/1/9/5/2/01/index.html#1952-01-22,,1952-01-22,le Le radar au sol du Nord de l'Alaska ainsi que les radars embarqués de 3 intercepteurs F-94 repèrent un objet non-identifié.,"",1952-01-22
https://rr0.org/time/1/9/5/2/01/index.html#1952-01-29,,1952-01-29,"le A Wonsan (Corée), un B-29 vole de pair avec un objet discoïdal orange brillant L'équipage d'un autre B-29 fait une observation similaire la même nuit à 80 miles, au-dessus de Sunchon.","",1952-01-29
https://rr0.org/time/1/9/5/2/01/index.html#1952-01-30,,1952-01-30,"le En Corée, un ovni ressemblant à une grande roue horizontale émettant de la lumière orange et crachant des flammes bleues de son pourtour, est visibile pendant quelques mn (= observations de la veille ?).","",1952-01-30
https://rr0.org/time/1/9/5/2/01/index.html,,1952-01,Création de l'APRO.,"",1952-01