url,place,time,description,sources,id,place.name,place.org.name,place.org.surname,place.org.title,place.org.time,place.org.deprecated,place.org.note,place.org.place,place.org.description,place.org.sources,place.org.tags,place.org.image,place.org.id,place.org.dirName,place.org.url,place.org.events,place.org.type,place.org.parent,place.org.places,place.org.kind,place.place,place.org,place.place.name,place.place.surname,place.place.title,place.place.time,place.place.deprecated,place.place.note,place.place.place,place.place.description,place.place.sources,place.place.tags,place.place.image,place.place.id,place.place.dirName,place.place.url,place.place.events,place.place.type,place.place.parent,place.place.locations,place.place.elevation,place.org.parent.name,place.org.parent.surname,place.org.parent.title,place.org.parent.time,place.org.parent.deprecated,place.org.parent.note,place.org.parent.place,place.org.parent.description,place.org.parent.sources,place.org.parent.tags,place.org.parent.image,place.org.parent.id,place.org.parent.dirName,place.org.parent.url,place.org.parent.events,place.org.parent.type,place.org.parent.parent.name,place.org.parent.parent.surname,place.org.parent.parent.title,place.org.parent.parent.time,place.org.parent.parent.deprecated,place.org.parent.parent.note,place.org.parent.parent.place,place.org.parent.parent.description,place.org.parent.parent.sources,place.org.parent.parent.tags,place.org.parent.parent.image,place.org.parent.parent.id,place.org.parent.parent.dirName,place.org.parent.parent.url,place.org.parent.parent.events,place.org.parent.parent.type,place.org.parent.parent.parent.name,place.org.parent.parent.parent.surname,place.org.parent.parent.parent.title,place.org.parent.parent.parent.time,place.org.parent.parent.parent.deprecated,place.org.parent.parent.parent.note,place.org.parent.parent.parent.place,place.org.parent.parent.parent.description,place.org.parent.parent.parent.sources,place.org.parent.parent.parent.tags,place.org.parent.parent.parent.image,place.org.parent.parent.parent.id,place.org.parent.parent.parent.dirName,place.org.parent.parent.parent.url,place.org.parent.parent.parent.events,place.org.parent.parent.parent.type,place.org.parent.parent.parent.parent,place.org.parent.parent.parent.places,place.org.parent.parent.parent.kind,place.org.parent.parent.places,place.org.parent.parent.kind,place.org.parent.places,place.org.parent.kind,place.org.parent.parent.parent,place.org.parent.parent
https://rr0.org/time/1/9/7/4/04/index.html,,1974-04,"Couverture du Science & Vie d'avril Science & Vie fait sa couverture sur les soucoupes volantes et publie un article sur un détecteur de soucoupes, et indique que David R. Saunders a répertorié dans son fichier près de 35000 témoignages d'observation d'ovnis.","""Le détecteur de 'soucoupes volantes"",s1,"""",""Science & Vie n° 679, p. 64"",",1974-04
https://rr0.org/time/1/9/7/4/04/index.html#1974-04-02,,1974-04-02,le Décès de Georges Pompidou.,"",1974-04-02
https://rr0.org/time/1/9/7/4/04/index.html#1974-04-13,Bayside (New York),,,,,,,,,,,,,,,,"",place,,"",,1974-04-13,"le Apparition supposée de la Sainte Vierge à , qui aurait déclaré : Dieu le Père trouve nécessaire que vous informiez les hommes de science que les véhicules connus sous le nom d'OVNIs sont envoyés par l'enfer pour tromper et déconcerter l'humanité en la faisant rechercher un autre monde, celui de ces ""extraterrestres"", qui n'existe pas.","",1974-04-13
https://rr0.org/time/1/9/7/4/04/index.html#1974-04-20,Charleroi (Belgique),,,,,,,,,,,,,,,,"",place,,"",,1974-04-20,"le La nuit, dans la région de , un son modulé parfois insoutenable se fait entendre en une vingtaine de lieux différents pendant 1 heure. Plusieurs personnes relèvent aussi une lumière insolite, quand d'autres décrivent le plus souvent un objet en forme de disque, avançant régulièrement à hauteur d'arbre. Des sensations physiologiques (maux de tête, fourmillements, etc.), une panne de téléviseur, un effet sur la végétation seront aussi notés.","",1974-04-20
https://rr0.org/time/1/9/7/4/04/index.html#1974-04-25,Kapiolani Park (Hawaï),,,,,,,,,,,,,,,,"",place,,"",,1974-04-25,le Observation à Hawaï le 25 avril Observation de Tsutomu Nakayama à.,"",1974-04-25