description,events,id,place,sources,time,type,url,place.name,place.org,place.place.dirName,place.place.elevation,place.place.events,place.place.id,place.place.locations,place.org.dirName,place.org.events,place.org.id,place.org.kind,place.org.parent,place.org.places,place.org.type,place.place,place.org.parent.dirName,place.org.parent.events,place.org.parent.id,place.org.parent.kind,place.org.parent.parent,place.org.parent.places,place.org.parent.type,place.org.parent.parent.dirName,place.org.parent.parent.events,place.org.parent.parent.id,place.org.parent.parent.kind,place.org.parent.parent.parent,place.org.parent.parent.places,place.org.parent.parent.type
"Couverture du Science & Vie d'avril Science & Vie fait sa couverture sur les soucoupes volantes et publie un article sur un détecteur de soucoupes, et indique que David R. Saunders a répertorié dans son fichier près de 35000 témoignages d'observation d'ovnis.","",1974-04,,""""","""",s1,"""",Science & Vie n° 679,64,""Le détecteur de 'soucoupes volantes""",1974-04,sighting,https://rr0.org/time/1/9/7/4/04/index.html
le Décès de Georges Pompidou.,"",1974-04-02,,"",1974-04-02,sighting,https://rr0.org/time/1/9/7/4/04/index.html#1974-04-02
"le Apparition supposée de la Sainte Vierge à , qui aurait déclaré : Dieu le Père trouve nécessaire que vous informiez les hommes de science que les véhicules connus sous le nom d'OVNIs sont envoyés par l'enfer pour tromper et déconcerter l'humanité en la faisant rechercher un autre monde, celui de ces ""extraterrestres"", qui n'existe pas.","",1974-04-13,Bayside (New York),,,,"",,"","",1974-04-13,sighting,https://rr0.org/time/1/9/7/4/04/index.html#1974-04-13
"le La nuit, dans la région de , un son modulé parfois insoutenable se fait entendre en une vingtaine de lieux différents pendant 1 heure. Plusieurs personnes relèvent aussi une lumière insolite, quand d'autres décrivent le plus souvent un objet en forme de disque, avançant régulièrement à hauteur d'arbre. Des sensations physiologiques (maux de tête, fourmillements, etc.), une panne de téléviseur, un effet sur la végétation seront aussi notés.","",1974-04-20,Charleroi (Belgique),,,,"",,"","",1974-04-20,sighting,https://rr0.org/time/1/9/7/4/04/index.html#1974-04-20
le Observation à Hawaï le 25 avril Observation de Tsutomu Nakayama à.,"",1974-04-25,Kapiolani Park (Hawaï),,,,"",,"","",1974-04-25,sighting,https://rr0.org/time/1/9/7/4/04/index.html#1974-04-25