url,place,time,description,sources,id,place.name,place.org.name,place.org.surname,place.org.title,place.org.time,place.org.deprecated,place.org.note,place.org.place,place.org.description,place.org.sources,place.org.tags,place.org.image,place.org.id,place.org.dirName,place.org.url,place.org.events,place.org.type,place.org.places,place.org.kind,place.org.parent,place.place,place.org,place.place.name,place.place.surname,place.place.title,place.place.time,place.place.deprecated,place.place.note,place.place.place,place.place.description,place.place.sources,place.place.tags,place.place.image,place.place.id,place.place.dirName,place.place.url,place.place.events,place.place.type,place.place.locations,place.place.elevation,place.org.parent.name,place.org.parent.surname,place.org.parent.title,place.org.parent.time,place.org.parent.deprecated,place.org.parent.note,place.org.parent.place,place.org.parent.description,place.org.parent.sources,place.org.parent.tags,place.org.parent.image,place.org.parent.id,place.org.parent.dirName,place.org.parent.url,place.org.parent.events,place.org.parent.type,place.org.parent.places,place.org.parent.kind,place.org.parent.parent.name,place.org.parent.parent.surname,place.org.parent.parent.title,place.org.parent.parent.time,place.org.parent.parent.deprecated,place.org.parent.parent.note,place.org.parent.parent.place,place.org.parent.parent.description,place.org.parent.parent.sources,place.org.parent.parent.tags,place.org.parent.parent.image,place.org.parent.parent.id,place.org.parent.parent.dirName,place.org.parent.parent.url,place.org.parent.parent.events,place.org.parent.parent.type,place.org.parent.parent.places,place.org.parent.parent.kind,place.org.parent.parent.parent.name,place.org.parent.parent.parent.surname,place.org.parent.parent.parent.title,place.org.parent.parent.parent.time,place.org.parent.parent.parent.deprecated,place.org.parent.parent.parent.note,place.org.parent.parent.parent.place,place.org.parent.parent.parent.description,place.org.parent.parent.parent.sources,place.org.parent.parent.parent.tags,place.org.parent.parent.parent.image,place.org.parent.parent.parent.id,place.org.parent.parent.parent.dirName,place.org.parent.parent.parent.url,place.org.parent.parent.parent.events,place.org.parent.parent.parent.type,place.org.parent.parent.parent.places,place.org.parent.parent.parent.kind,place.org.parent.parent.parent.parent,place.org.parent.parent.parent,place.org.parent.parent
https://rr0.org/time/1/9/8/9/09/index.html,,1989-09,L'émission préparée par Stanton T. Friedman sur le crash de Roswell mobilise près de 28 millions d'américains sur NBC.,"",1989-09
https://rr0.org/time/1/9/8/9/09/index.html,Nashville (Tennessee),,,,,,,,,,,,,,,,"",place,"",,1989-09,"A , un militaire de l'U.S. Navy observe un ovni présentant une forme de disque très structuré avec des rayons et une série de hublots lumineux.","",1989-09
https://rr0.org/time/1/9/8/9/09/index.html#1989-09-04T04:30,Tuiles (Tarn),,,,,,,,,,,,,,,,"",place,"",,1989-09-04T04:30,"le Aux , 1 homme souffrant d'insomnie voit à travers sa fenêtre ouverte une forte lueur. Il se lève et voit en contrebas dans un champ de luzerne un carré lumineux de 10 m de côté environ. Cette lueur vient de 1 objet stationnaire au-dessus du toit en forme de toupie à multiples facettes. Au bout de 30 secondes environ, le phénomène disparaît brutalement sans aucun bruit ni odeur. Le témoin constate le lendemain que les tuiles (de type canal) sont brunâtres à l'endroit où le phénomène était stationné et qu'elles se sont déplacées créant une gouttière. L'entrepreneur qui réalise la réparation du toit confirmera que les tuiles étaient vrillées dans le sens des aiguilles d'une montre sur 3 à 5 m de longueur et que le faîtage était affaissé à l'endroit de l'observation de l'engin (L'enquête du SEPRA n'a pas permis de trouver une explication à cette observation).",",s1,""SEPRA"",,",1989-09-04T04:30
https://rr0.org/time/1/9/8/9/09/index.html#1989-09-06,,1989-09-06,le Amarrage du module Kvant 2 à Mir.,"",1989-09-06
https://rr0.org/time/1/9/8/9/09/index.html#1989-09-27T18:30,"Voronej (ville au sud de Moscou, URSS)",,,,,,,,,,,,,,,,"",place,"",,1989-09-27T18:30,le atterrissage d'un ovni dans un parc.,"",1989-09-27T18:30