description,events,id,place,sources,time,type,url,place.name,place.org,place.place.dirName,place.place.elevation,place.place.events,place.place.id,place.place.locations,place.org.dirName,place.org.events,place.org.id,place.org.kind,place.org.parent,place.org.places,place.org.type,place.place,place.org.parent.dirName,place.org.parent.events,place.org.parent.id,place.org.parent.kind,place.org.parent.parent,place.org.parent.places,place.org.parent.type,place.org.parent.parent.dirName,place.org.parent.parent.events,place.org.parent.parent.id,place.org.parent.parent.kind,place.org.parent.parent.parent,place.org.parent.parent.places,place.org.parent.parent.type
"Couverture du n° 1 de Flying Saucers ce mois-ci William T. Powers, membre de l'équipe du Dr. Josef Allen Hynek à la , était à Grand Haven la plupart du vendredi à enquêêr les observations de Grand Haven. Le Dr. Hynek fut commissionné par l'Air Force pour mener une enquête indépendante sur de telles observations.","",1967-04,"Northwestern University, Evanston (Illinois)",,,,"",,"",""""","""",s1,"""",,,",1967-04,sighting,https://rr0.org/time/1/9/6/7/04/index.html
"le Cadillac (AP) - La police a rapporté un ruée d'observations d'objets volants non identifiés dans une région de 3 comtés au Nord-Ouest du Michigan vendredi soir. Un officier de police de Cadillac et d'autres personnes ont signalé les observations à dans Grand Traverse City dans le comté de Grand Traverse, Reed City dans le comté d'Osceola et Cadillac dans le comté de Wexford. Cadillac est à peu près à mi-chemin entre Traverse City et Reed City, une distance de 161 km environ. Les signalements arrivèrent 3 jours après des signalements semblables à Grand Haven sur le Lake Michigan et des heures après qu'un enquêteur de la Northwestern University ait quitté le Michigan après avoir examiné les rapports de Grand Haven. J'ai vu quelque chose, mais je ne sais pas ce que c'était, dit le patrouilleur Harry Hagstrom de Cadillac. Hagstrom dit que l'objet était blanc brillant et apparut dans un ciel clair au-dessus du Lac Cadillac. Il dit que 2 autres officiers de police vérifièrent l'observation. Il semblait changer de directions, dit Hagstrom. Haut, bas, gauche, droite puis resta stationnaire pendant un moment. Il était blanc brillant la 1ʳᵉ fois que je le voyais, mais la couleur s'atténuant vers un blanc plus mat, puis rouge, puis vert. C'était une nuit très claire et toutes les étoiles étaient brillantes, ajouta-t-il, Mais je suis sûr que ce n'était pas une étoile. En dehors de ça, je ne sais pas ce que c'était.","",1967-04-04,Traverse City,,,,"",,"","",1967-04-04,sighting,https://rr0.org/time/1/9/6/7/04/index.html#1967-04-04
"le Aux Salt Flats de , après qu'un homme ait prétendu tre en communication télépathique avec des extraterrestres et proclamé que ces derniers atterriraient à cet endroit, James E. Wadsworth, au nom du projet Colorado, ainsi que plusieurs patrouilleurs et a brass band attendent sur la scène à l'heure dite. Afin d'exclure toute confusion entre les fuseaux horaires de l'heure prédite, le groupe attend jusqu'à le samedi 15 12:30 , sans rien voir arriver.","",1967-04-15T11:00,Bonneville (Utah),,,,"",,"",""""","""",s2,"""",Scientific Study of Unidentified Flying Objects,1968,Cas 19 - Prédiction psychique d'un atterrissage d'ovni",1967-04-15T11:00,sighting,https://rr0.org/time/1/9/6/7/04/index.html#1967-04-15T11:00
"le , un directeur d'école rentre chez lui en voiture sur une route déserte lorsqu'il remarque une lueur énorme (qu'il estime ne pas dépasser 91 m de diamètre) : Je rentrais chez moi après une réunion de l'Association parents-enseignants ; il faisait nuit et je roulais dans la campagne (...). J'ai soudain remarqué une lueur au-dessus de la colline — et j'ai pensé, tiens, c'est un de ces vieux coucous (un C-47) qui a dévié de sa route et qui va atterrir dans ce champ de maïs (...). Et puis cet objet incroyable - ayant un peu la forme d'un casque de la 1ʳᵉ guerre — est passé au-dessus de la colline... Alors j'ai ralenti... Je n'arrivais pas à comprendre comment un avion pouvait suivre une trajectoire de plané — lorsque cet énorme objet, dont j'estime qu'il dépassait 90 m, s'est détaché de la colline et est demeuré au-dessus de moi pendant une fraction de seconde comme un appareil qui change de cap ; puis il s'est dirigé vers l'aérodrome... C'était une lumière terriblement forte. Le toit de la voiture ne semblait même plêe écran. C'est incroyable, une lumière aussi intense. Quand je regardais mes mains, c'était comme une photo aux rayons X. Rejoignant ses amis enseignants dans une voiture qui suivait, le groupe voit l'ovni survoler des lignes de tension pendant 10 minutes environ. Des témoins à l'aéroport et sur un vol en arrivance signalèrent également l'objet. pendant en 15 par des témoins multiples..","",1967-04-17T21:00,Jefferson City (Missouri),,,,"",,"",""""","""",s3,"""",,,,""""""Hendry, Allan"""""","""",s4,"""",,10,1979",1967-04-17T21:00,sighting,https://rr0.org/time/1/9/6/7/04/index.html#1967-04-17T21:00
"le , M. témoin rentre chez lui en voiture lorsqu'il voit un objet sur la route à 70 m : 1 cylindre vertical de 5 m de diamètre, soutenu par 4 pieds, avec une demi-sphère à son sommet. L'objet est gris et sa base est à 1 m au-dessus du du pavement. Lorsque le témoin allume ses feux de route, l'appareil dégage une lumière verticale et s'evanoui. La route brûle pendant 15 minutes. M. Martin, qui vit non loin de là, voit également la lumière. Des trous, traces de brûlures et allumettes calcinées sont notées sur le site.","",1967-04-21T21:00,South Hill (Virginie),,,,"",,"","""""""Cas Blue Book n° 11677 non résolu < Vallée, Jacques"""""","""",s5,"""",,1969,",1967-04-21T21:00,sighting,https://rr0.org/time/1/9/6/7/04/index.html#1967-04-21T21:00
le Déclaration du docteur James E. McDonald devant la société américaine des directeurs de journaux.,"",1967-04-22,,"",1967-04-22,sighting,https://rr0.org/time/1/9/6/7/04/index.html#1967-04-22
le Le cosmonaute Komarov disparaît dans l'accident de Soyouz 1.,"",1967-04-24,,"",1967-04-24,sighting,https://rr0.org/time/1/9/6/7/04/index.html#1967-04-24
"le , témoin voit 1 phénomène sombre de 1 m de diamètre et 1,5 m de haut, avec des lumières clignotantes vertes et blanches. A 1 m du sol, 6 pieds sortent, et il atterrit sur une pelouse près de la société National Grocers. Le vrombissement du phénomène s'arrête, et le témoin prend peur et s'enfuit en courant. La police trouve 6 empreintes sur le site.","",1967-04-26T21:00,Kitchener (Canada),,,,"",,"",""""","""",s6,"""",67 < Vallée 1969,177,SS < S Summer",1967-04-26T21:00,sighting,https://rr0.org/time/1/9/6/7/04/index.html#1967-04-26T21:00
"le 1er vol habité de Soyouz 1. Le cosmonaute Kormarov périt à l'atterissage. le jeudi 27 22 h A , 4 garçons avec des jumelles observent un objet descendre avec des mouvements oscillants, illuminant les bois à 1 km de distance. Il a une forme de conque, avec le dessous bleu, et un sommet qui passe du rouge à l'orange au blanc.","",1967-04-27,Lake (Wisconsin),,,,"",,"","""Blue Book < Vallée"","""",s7,"""",,1969,",1967-04-27,sighting,https://rr0.org/time/1/9/6/7/04/index.html#1967-04-27