description,events,eventType,id,place,sources,time,type,url,place.dirName,place.elevation,place.events,place.id,place.locations,place.name,place.sources,place.type
", observation d'un objet laissant des traces de brûlures.","",sighting,1998-09-06T20:00$VoreppeIsere,,,"",,"","Voreppe, Isère","",place,"",1998-09-06T20:00,event,https://rr0.org/time/1/9/9/8/09/index.html#1998-09-06T20:00
L'équipage d'un vol en direction de Dijon est croisé assez haut au-dessus de lui par 2 points lumineux qui sont identifiés tout d'abord comme un trafic militaire. Ces points ont toutefois une trajectoire bizarre qui monte et descend et effectue de nombreux zig-zags (L'armée de l'air de son côté confirme qu'aucun trafic militaire n'est présente dans le zone. Par ailleurs aucun détection radar n'a été constatée. L'enquête n'a pas permis d'indentifier cette observation).,"",sighting,1998-09-12T21:53$,,"""SEPRA"","""",s1,"""",,PAN classé D",1998-09-12T21:53,event,https://rr0.org/time/1/9/9/8/09/index.html#1998-09-12T21:53
"Un signal est détecté par le radiotélescope d'Arecibo et vérifié par le télescope de 250 pieds de Jodrell Bank, semblant venir d'une étoile naine de type M de EQ Pegasi, à 22 années-lumière de la Terre, avant que l'on s'aperçoive qu'il est toujours reçu lorsque l'on pointe le radiotélescope ailleurs : il s'agissait probablement d'un satellite de communication.","",sighting,1998~-09~-15~T00~:00$,,"""""""Shostak, Seth"""""","""",s2,"""",,""A false alarm for SETI searchers""",1998~-09~-15~T00~:00,event,https://rr0.org/time/1/9/9/8/09/index.html#1998~-09~-15~T00~:00
", observation d'une lumière bleue-blanche ""étincelante"" décrite comme sautissant ici et là dans le ciel sans s'éloigner.","",sighting,1998-09-16$BlackridgeEcosse,,,"",,"",Blackridge (Ecosse),"",place,"""""""Mather, Adrian"""",""""Jacobs, Bill"""""","""",s3,"""",,""Lothian X-Files revealed""",1998-09-16,event,https://rr0.org/time/1/9/9/8/09/index.html#1998-09-16
Plusieurs témoins observent 3 points lumineux alignés ainsi que 1 globe encore plus lumineux entre le 2ᵉ et 3ᵉ point (L'enquète montrera qu'il s'agit probablement de la planète Jupiter et de 3 de ses satellites qui resteront tout l'hiver dans une conjoncture favorable à leur observation).,"",sighting,1998-09-18$,,"""SEPRA"","""",s4,"""",,PAN classé B",1998-09-18,event,https://rr0.org/time/1/9/9/8/09/index.html#1998-09-18
", 1 témoin observe dans le ciel 1 objet rond et lumineux de couleur jaunâtre. L'objet est à flanc de colline et se déplace très lentement. Au bout de 5 bonnes mn, l'objet est parti à très grande vitesse avant de disparaître.","",sighting,1998-09-27T03:00$MartiguesBouchesduRhone,,,"",,"",Martigues (Bouches-du-Rhône),"",place,"""SEPRA"","""",s5,"""",,PAN classé D",1998-09-27T03:00,event,https://rr0.org/time/1/9/9/8/09/index.html#1998-09-27T03:00