description,events,id,place,sources,time,type,url,place.name,place.org,place.place.dirName,place.place.elevation,place.place.events,place.place.id,place.place.locations,place.org.dirName,place.org.events,place.org.id,place.org.kind,place.org.parent.dirName,place.org.parent.events,place.org.parent.id,place.org.parent.kind,place.org.parent.parent.dirName,place.org.parent.parent.events,place.org.parent.parent.id,place.org.parent.parent.kind,place.org.parent.parent.parent,place.org.parent.parent.places,place.org.parent.parent.type,place.org.parent.places,place.org.parent.type,place.org.places,place.org.type,place.org.parent,place.place,place.org.parent.parent
"Couverture de Scientific American cette année-là Janvier ou février Une boule lumineuse est aperçue dans l'est de la France. Il fut signalé aussi en Angleterre (éclairant le sol avec un puissant projecteur) , dans l'est de l'Europe et en Russie où on tira même dessus au fusil.","",1905,,""""","""",s1,"""",Constitution de Atlanta,12,""Mystic Phenomena Of Welsh Revival""",1905,sighting,https://rr0.org/time/1/9/0/5/index.html
"en le dimanche 2 avril en 20 A , on aperçoit, venant du large et à une altitude qui ne peut être — même approximativement — déterminée, une énorme boule lumineuse qui, après avoir décrit une courbe au-dessus de la ville. en 23 la boule disparaît dans la direction d'où elle était venue. Le vice-amiral-préfet maritime fait fonctionner les projecteurs électriques de la digue, mais leurs rayons ne sont pas suffisamment puissants et la tentative ne donna aucun résultat. Certaines personnes, dont des officiers de marine, affirment avoir vu la lumière de ce météore prendre des teintes rouges et vertes. À l'observatoire de l'arsenal, on se perd en conjectures et, à tout hasard, le vice-amiral Besson a donné des ordres pour que les torpilleurs se tiennent, la nuit prochaine et les suivantes, prêts à appareiller si ce visiteur mystérieux reparaît, et à le suivre dans ses évolutions pour essayer d'en pénétrer le mystère. Dans un dessin qui l'occupe entièrement, la couverture du n° 1985 d'un autre périodique - Le Bon Journal du 16 avril - montre une foule nombreuse réunie sur les quais. On voit distinctement la Lune en croissant, mais aussi une sphère nettement plus importante, car sans doute toute proche, qu'un projecteur essaie vainement d'atteindre. L'objet y est décrit comme ""une énorme Lune dont les couleurs sont changeantes.. Toutes les autorités du port tiennent conseil et, durant 3 nuits, montent le quart sur la place Napoléon. De leurs observations, il résulte qu'il faut renoncer à l'hypothèse d'un ballon ou de signaux en mer, et qu'il s'agissait incontestablement d'un phénomène cosmique auquel demeurait étrangère toute participation humaine. Nombre de journaux et publications signalent l'événement, y compris le Bulletin de la Société des Astronomes Français, qui considère que ce gros objet lumineux n'était autre que la planète Venus.","",1905-04,Cherbourg (France),,,,"",,"",""""","""",s2,"""",,03,Le Matin,"""","""",s3,"""",,09,Le Matin",1905-04,sighting,https://rr0.org/time/1/9/0/5/index.html#1905-04
"Eté Le docteur I. P. de Craovia voit à près de Radauti un objet allongé en forme de soucoupe, plus gros que la Lune. Il émet puissamment sa propre lumière et vole horizontalement vers l'ouest. en août le mardi 1 août la nuit Depuis le village de Walhonding (à 10 miles au nord de Sandursky, Ohio) un joailler local et 2 compagnons voient un aéronef au sud-est affichant 3 lumières rouges à l'arrière et 1 verte à la proue. le mercredi 2 août à 01:30 J. A. Jackson, respectable citoyen de Silshee (Californie), se rend dans ses ""commodités extérieures"" lorsqu'il voit une lumière très brillante dans le ciel. Elle semble être rattachée à un ""vaisseau aérien"" de 20 m doté d'ailes. La mystérieuse machine paraissait mue par ses seules ailes, elle montait et descendait au rythme des battements d'ailes comme un oiseau gigantesque. D'autres habitants de la région assurent avoir vu la même chose.","",1905,Horodnicul de Sus (Roumanie),,,,"",,"",""""","""",s4,"""",Star Journal de Sandusky (Ohio),02,""Here's An Old Friend"","""","""",s5,"""",,04,Brawley News",1905,sighting,https://rr0.org/time/1/9/0/5/index.html
"Près de , des gens partent en expédition pour tenter de déterminer l'origine de la lumière fantomatique.","",1905,Lethbridge (Alberta),,,,"",,"",""""","""",s6,"""",Herald de Lethbridge (Alberta),15,""A Mysterious Light""",1905,sighting,https://rr0.org/time/1/9/0/5/index.html
en le mercredi 29 novembre Un bolide de diamètre lunaire est visible durant 2 h.,"",1905-11,,""""","""",s7,"""",,1906,BSAF",1905-11,sighting,https://rr0.org/time/1/9/0/5/index.html#1905-11
en le jeudi 28 décembre 1905 peu après le coucher du soleil Différents témoins voient pendant 10 mn une croix rouge profond à travers un banc de nuages.,"",1905-12,,""""","""",s8,"""",Evening Times de Cumberland (Maryland),29,""Red Cross In The Sky""",1905-12,sighting,https://rr0.org/time/1/9/0/5/index.html#1905-12
"A Portland (Oregon), un objet ""étrange"" descend des hauts nuages et vient survoler la ville.","",1905,,""""","""",s9,"""",,04-36,",1905,sighting,https://rr0.org/time/1/9/0/5/index.html