url,place,time,description,sources
https://rr0.org/time/1/8/7/9/index.html,,1879,"1879-05-15 21:40 Dans le Golfe Persique, des passagers du navire Vultur observent pendant 35 mn 2 roues immenses tournoyant dans l'air et descendant lentement vers la surface de l'eau. Ils estiment leur diamètre à 40 m, et la distance entre les 2 objets à 150 m. Leur vitesse semble approcher les 80 km/h Round up 17 Vallée, J.: Anatomy 12, traduit Chroniques des apparitions extraterrestres, J'ai Lu, 1974, pp. 252 < Piens, C. & Scornaux, J.: A la recherche des ovnis, 1976, p. 182.",""
https://rr0.org/time/1/8/7/9/index.html,,1879,"1879-06-07 À Genève Neuchatel, Zug et Milan, observation d'un météore brillant se déplaçant en ""zigzag"" ou sinueux. 4 mn plus tard il disparaît et une explosion est entendue. Presque au même moment, une pluie d'aérolites tombe dans le Lac Lugano, provoquant d'énormes vagues manquant de retourner des bateaux de pêche Gazette de Lausanne Cabinet of Curiosities.",""
https://rr0.org/time/1/8/7/9/index.html,,1879,"1879-09-05 Observation d'un météore ""That Meteor"", Ogden Standard Examiner de Ogden (Utah), 10 septembre 1879. 10 A Reno (Nevada), un météore laisse une traînée lumineuse ""A Very Curious Appearance In The Sky Friday Evening"" Weekly Reno Gazette de Reno (Nevada), 11 septembre 1879. 1879-09-28/1879-09-29 1879-09-28 18:30 A Bunker Hill (Illinois), on voit passer ce que l'on pense être le ballon du professeur Wise, qui se dirige presque droit vers le nord. Il est vu plus tard dans la soirée à 10 miles environ de distance entre Bunker Hill et Carlinville. On pense qu'il se serait écrasé dans une région sauvage et inhabitée Correspondant du Globe-Democrat à Bunker Hill (Ills.) < ""The Missing Aeronauts"", Morning Herald de Titusville (Pennsylvanie), 4 octobre 1879. la nuit Le PathFinder, le ballon du professeur John Wise, lancé depuis la ville de Louisiania (Missouri), tombe dans le Lac Michigan, juste au large de la berge de l'Indiana.",""
https://rr0.org/time/1/8/7/9/index.html,,1879,"1879-10-09 Tôt le matin A Albion (Michigan), on voit un vaisseau aérien se déplacer vers le sud-ouest ""Editorial Notes"", Herald de St. Joseph (Michigan), 11 octobre 1879. ~15:00 A Pontiac (Michigan, à 30 miles au nord-ouest de Detroit), un homme voit un grand ballon bien haut dépasser cette ville, allant d'ouest en est. Il peut voir le panier, mais pas distinguer ceux qui s'y trouvent. Il pense qu'il s'agit du ballon de Wise A tort puisqu'il s'est écrasé 2 semaines plus tôt""The Lost Balloonists"", Herald de St. Joseph (Michigan), 11 octobre 1879. 1879-10-10 tôt le matin A Dubuque (Iowa), plusieurs personnes observent ce qui semble être un grand ballon très haut dans le ciel passer au-dessus de la ville ""The Balloon Again"", The Inter Ocean de Chicago (Illinois), 11 octobre 1879. 1879-10-28 Le matin A Augusta (Maine), on voit passer au-dessus de la ville à grande hauteur un ballon vers le nord-ouest ""Illinois"", Daily Kennebec Journal de Augusta (Maine), 29 octobre 1879. L'après-midi A Augusta (Maine), on voit passer au-dessus de la ville allant vers l'est, à une altitude bien inférieure à celui du matin, l'habitacle étant clairement visible, et certaines personnes déclarant avoir pu voir des objets sombres dans l'habitacle ""Illinois"", Daily Kennebec Journal de Augusta (Maine), 29 octobre 1879. Certains pensent qu'il s'agit du PathFinder Article de l'Iowa State Reporter de Waterloo, 29 octobre 1879 Ce qui est impossible, puisqu'il s'est écrasé un mois plus tôt.",""
https://rr0.org/time/1/8/7/9/index.html,,1879,"En Espagne, découverte des peintures rupestres de la grotte d'Altamira.",""