url,place,time,description,sources,id,place.name,place.org.name,place.org.surname,place.org.title,place.org.time,place.org.deprecated,place.org.note,place.org.place,place.org.description,place.org.sources,place.org.tags,place.org.image,place.org.id,place.org.dirName,place.org.url,place.org.events,place.org.type,place.org.parent,place.org.places,place.org.kind,place.place,place.org,place.place.name,place.place.surname,place.place.title,place.place.time,place.place.deprecated,place.place.note,place.place.place,place.place.description,place.place.sources,place.place.tags,place.place.image,place.place.id,place.place.dirName,place.place.url,place.place.events,place.place.type,place.place.parent,place.place.locations,place.place.elevation,place.org.parent.name,place.org.parent.surname,place.org.parent.title,place.org.parent.time,place.org.parent.deprecated,place.org.parent.note,place.org.parent.place,place.org.parent.description,place.org.parent.sources,place.org.parent.tags,place.org.parent.image,place.org.parent.id,place.org.parent.dirName,place.org.parent.url,place.org.parent.events,place.org.parent.type,place.org.parent.parent.name,place.org.parent.parent.surname,place.org.parent.parent.title,place.org.parent.parent.time,place.org.parent.parent.deprecated,place.org.parent.parent.note,place.org.parent.parent.place,place.org.parent.parent.description,place.org.parent.parent.sources,place.org.parent.parent.tags,place.org.parent.parent.image,place.org.parent.parent.id,place.org.parent.parent.dirName,place.org.parent.parent.url,place.org.parent.parent.events,place.org.parent.parent.type,place.org.parent.parent.parent.name,place.org.parent.parent.parent.surname,place.org.parent.parent.parent.title,place.org.parent.parent.parent.time,place.org.parent.parent.parent.deprecated,place.org.parent.parent.parent.note,place.org.parent.parent.parent.place,place.org.parent.parent.parent.description,place.org.parent.parent.parent.sources,place.org.parent.parent.parent.tags,place.org.parent.parent.parent.image,place.org.parent.parent.parent.id,place.org.parent.parent.parent.dirName,place.org.parent.parent.parent.url,place.org.parent.parent.parent.events,place.org.parent.parent.parent.type,place.org.parent.parent.parent.parent,place.org.parent.parent.parent.places,place.org.parent.parent.parent.kind,place.org.parent.parent.places,place.org.parent.parent.kind,place.org.parent.places,place.org.parent.kind,place.org.parent.parent.parent,place.org.parent.parent
https://rr0.org/time/1/8/7/9/index.html#1879-05,,1879-05,"en le jeudi 15 21:40 Dans le Golfe Persique, des passagers du navire Vultur observent pendant 35 mn 2 roues immenses tournoyant dans l'air et descendant lentement vers la surface de l'eau. Ils estiment leur diamètre à 40 m, et la distance entre les 2 objets à 150 m. Leur vitesse semble approcher les 80 km/h.","Round up 17,s1,"""",,,Anatomy 12,s2,""""""Vallée, J."""""",""traduit Chroniques des apparitions extraterrestres, J'ai Lu, 1974, pp. 252 < Piens, C. & Scornaux, J.: A la recherche des ovnis, 1976, p. 182"",",1879-05
https://rr0.org/time/1/8/7/9/index.html#1879-06,Genève,,,,,,,,,,,,,,,,"",place,,"",,1879-06,"en le samedi 7 À Neuchatel, Zug et Milan, observation d'un météore brillant se déplaçant en ""zigzag"" ou sinueux. 4 mn plus tard il disparaît et une explosion est entendue. Presque au même moment, une pluie d'aérolites tombe dans le Lac Lugano, provoquant d'énormes vagues manquant de retourner des bateaux de pêche.","Gazette de Lausanne,s3,"""",,,49,s4,""""""Chris Chatfield's Cabinet of Curiosities, www.phenomena.org.uk, lundi 29 août 2011 à 22"""""",,",1879-06
https://rr0.org/time/1/8/7/9/index.html#1879-09,Reno (Nevada),,,,,,,,,,,,,,,,"",place,,"",,1879-09,"en le vendredi 5 Observation d'un météore en octobre 1879 A , un météore laisse une traînée lumineuse. le dimanche 28 à le lundi 29 le dimanche 28 18:30 A Bunker Hill (Illinois), on voit passer ce que l'on pense être le ballon du professeur Wise, qui se dirige presque droit vers le nord. Il est vu plus tard dans la soirée à 10 miles environ de distance entre Bunker Hill et Carlinville. On pense qu'il se serait écrasé dans une région sauvage et inhabitée. la nuit Le PathFinder, le ballon du professeur John Wise, lancé depuis la ville de Louisiania (Missouri), tombe dans le Lac Michigan, juste au large de la berge de l'Indiana.","""That Meteor"",s5,"""",Ogden Standard Examiner de Ogden (Utah),-10,""A Very Curious Appearance In The Sky Friday Evening"" Weekly Reno Gazette de Reno (Nevada),s6,"""",,-11,Correspondant du Globe-Democrat à Bunker Hill (Ills.) < ""The Missing Aeronauts"",s7,"""",""Morning Herald de Titusville (Pennsylvanie), 4 octobre 1879"",",1879-09
https://rr0.org/time/1/8/7/9/index.html#1879-10,Albion (Michigan),,,,,,,,,,,,,,,,"",place,,"",,1879-10,"en le jeudi 9 en 1879 A , on voit un vaisseau aérien se déplacer vers le sud-ouest. vers 1879 15 h A Pontiac (Michigan, à 30 miles au nord-ouest de Detroit), un homme voit un grand ballon bien haut dépasser cette ville, allant d'ouest en est. Il peut voir le panier, mais pas distinguer ceux qui s'y trouvent. Il pense qu'il s'agit du ballon de Wise (A tort puisqu'il s'est écrasé 2 semaines plus tôt). le vendredi 10 tôt le matin A Dubuque (Iowa), plusieurs personnes observent ce qui semble être un grand ballon très haut dans le ciel passer au-dessus de la ville. le mardi 28 Le matin A Augusta (Maine), on voit passer au-dessus de la ville à grande hauteur un ballon vers le nord-ouest. L'après-midi A Augusta (Maine), on voit passer au-dessus de la ville allant vers l'est, à une altitude bien inférieure à celui du matin, l'habitacle étant clairement visible, et certaines personnes déclarant avoir pu voir des objets sombres dans l'habitacle. Certains pensent qu'il s'agit du PathFinder (Ce qui est impossible, puisqu'il s'est écrasé un mois plus tôt).","""Editorial Notes"",s8,"""",Herald de St. Joseph (Michigan),-11,""The Lost Balloonists"",s9,"""",Herald de St. Joseph (Michigan),-11,""The Balloon Again"",s10,"""",The Inter Ocean de Chicago (Illinois),-11,""Illinois"",s11,"""",Daily Kennebec Journal de Augusta (Maine),-29,""Illinois"",s12,"""",Daily Kennebec Journal de Augusta (Maine),-29,Article de l'Iowa State Reporter de Waterloo,s13,"""",,-29",1879-10
https://rr0.org/time/1/8/7/9/index.html,Espagne,,,,,,,,,,,,,,,,"",place,,"",,1879,"En , découverte des peintures rupestres de la grotte d'Altamira.","",1879