description,events,eventType,id,place,sources,time,type,url,place.dirName,place.elevation,place.events,place.id,place.locations,place.name,place.sources,place.type
"à 21 De très nombreux témoins observent le passage très rapide d'une boule blanche très lumineuse avec une trainée jaune et verte. Le phénomène lumineux a duré 30 s environ et est décrit dans les mêmes termes depuis le Cantal jusqu'en Alsace. Le phénomène semble s'être déplacé vers le nord-ouest. (Ce phénomène de grande ampleur, vu par de nombreux témoins dans l'Est de la France est probablement une rentrée atmosphérique).","",sighting,1996-08-01T21:30$,,""""","""",s1,"""",,GEPAN",1996-08-01T21:30,event,https://rr0.org/time/1/9/9/6/08/index.html#1996-08-01T21:30
"à 3, 4 témoins observent des lumières se déplaçant en cercle à grande vitesse. L'enquête ainsi que les témoignages montreront qu'ils s'agit probablement de l'observation des effets d'un projecteur laser utilisé lors d'une fête dans un village voisin.","",sighting,1996-08-09T02:30$PeriCorseDuSud,,,"",,"",Peri (Corse du Sud),"",place,"""SEPRA"","""",s2,"""",,PAN classé B",1996-08-09T02:30,event,https://rr0.org/time/1/9/9/6/08/index.html#1996-08-09T02:30
"30 à 1 A , 1 témoin et son épouse observent 1 phénoméne lumineux circulaire se déplaçant lentement de droite à gauche. Les témoins observent ce phénomène pendant 45 mn environ et vont se coucher alors que le phénomène est toujours présent (L'enquête montrera que la direction de l'observation correspond à celle d'une discothèque utilisant un projecteur laser publicitaire. Le phénomène observé était donc sans doute l'effet de ce projecteur sur les nuages). 5 Un certain John Weyleigh filme la vidéo de Oliver Castle montrant la formation de crop circles par des lumières en vol.","",sighting,1996-08-11$SoulaineDhuysAube,,,"",,"",Soulaine Dhuys (Aube),"",place,"""SEPRA"","""",s3,"""",,PAN classé B",1996-08-11,event,https://rr0.org/time/1/9/9/6/08/index.html#1996-08-11
"Claudie André-Deshays, 1ère française dans l'espace, reste 15 jours à bord de Mir.","",sighting,1996-08-17$,,"",1996-08-17,event,https://rr0.org/time/1/9/9/6/08/index.html#1996-08-17
"4 Une patrouille de police, stationnée à Centurion, à quelques kms de Prétoria (Afrique du Sud), observe une forte lumière entourée de petites luminosités rouges disposées en cercle. Elle prend l'objet en chasse sur une centaine de km. 5 La patrouille est relayée par un hélicoptère de la police qui débute sa poursuite au-dessus de la banlieue de Mamelodi. Le phénomène, qui jusque-là avait évolué lentement, prend rapidement de l'altitude avant de disparaître sans avoir été inquiété.","",sighting,1996-08-28$,,"",1996-08-28,event,https://rr0.org/time/1/9/9/6/08/index.html#1996-08-28
", 1 témoin observe durant 1 h plusieurs points lumineux qu'il n'identifie pas à des étoiles.","",sighting,1996-08-31T22:15$MarseilleBouchesduRhone,,,"",,"",Marseille (Bouches-du-Rhône),"",place,"""GEPAN"","""",s4,"""",,Cas de type C",1996-08-31T22:15,event,https://rr0.org/time/1/9/9/6/08/index.html#1996-08-31T22:15