description,events,id,place,sources,time,type,url,place.name,place.org,place.place.dirName,place.place.elevation,place.place.events,place.place.id,place.place.locations,place.org.dirName,place.org.events,place.org.id,place.org.kind,place.org.parent,place.org.places,place.org.type,place.place
en,"",1954-01,,"",1954-01,sighting,https://rr0.org/time/1/9/5/4/index.html#1954-01
en,"",1954-02,,"",1954-02,sighting,https://rr0.org/time/1/9/5/4/index.html#1954-02
"Printemps en en avril un jour en 2 À , un témoin observe l'occupant d'une soucoupe atterrie saisir un objet tubulaire accroche à son ventre (ceinture ?) et le diriger vers lui, qui se sent paralysé. Puis, le témoin perd conscience. Lorsqu'il reprend ses esprits, la soucoupe à décollé et s'éloigne du témoin. en 3 A Mattydale (New York), dans cette banlieue de Syracuse, un spécialiste en information et sa femme voient un objet d'environ 6 m de diamètre posé au sol. Plusieurs hommes l'examinent et en prennent des photos. Le lendemain, un officier leur dit qu'il s'agit d'un secret militaire. Plus tard, la police nie toute l'affaire. en mai","",1954-03,Menton                 (Alpes-de-Haute-Provence),,,,"",,"",""""","""",s1,"""",,08,LDLN n° 126,"""","""",s2,"""",Michel,169,Figuet",1954-03,sighting,https://rr0.org/time/1/9/5/4/index.html#1954-03
"en juin Augmentation importante des observations en et en Italie. Outre l'Europe, sont aussi concernés les Etats-Unis, l'Amérique du Sud, l'Afrique occidentale, la Nouvelle-Zélande et l'Australie. Le matin A Trois-Fonds (Creuse), un témoin anonyme roule à bicyclette lorsqu'il fait une RR3. Il est plongé dans un état de stupeur et à l'impression de pédaler dans le vide. Son état de stupeur dure quelques jours. en juillet en août","",1954,France,,,,"",,"","""""""Figuet, Michel"""""","""",s3,"""",,,",1954,sighting,https://rr0.org/time/1/9/5/4/index.html
en septembre en octobre en novembre,"",1954,,"",1954,sighting,https://rr0.org/time/1/9/5/4/index.html
en décembre 1954,"",1954,,"",1954,sighting,https://rr0.org/time/1/9/5/4/index.html
"Parution de Lueurs sur les soucoupes volantes, d'Aimé Michel.","",1954,,"",1954,sighting,https://rr0.org/time/1/9/5/4/index.html
Création du Civilian Saucer Intelligence à New York.,"",1954,,"",1954,sighting,https://rr0.org/time/1/9/5/4/index.html
"Prétendu lancement du projet Sigma, dont la mission serait d'établir le contact avec des extraterrestres.","",1954,,"",1954,sighting,https://rr0.org/time/1/9/5/4/index.html