url,place,time,description,sources,id,place.name,place.org.name,place.org.surname,place.org.title,place.org.time,place.org.deprecated,place.org.note,place.org.place,place.org.description,place.org.sources,place.org.tags,place.org.image,place.org.id,place.org.dirName,place.org.url,place.org.events,place.org.type,place.org.places,place.org.kind,place.org.parent,place.place,place.org,place.place.name,place.place.surname,place.place.title,place.place.time,place.place.deprecated,place.place.note,place.place.place,place.place.description,place.place.sources,place.place.tags,place.place.image,place.place.id,place.place.dirName,place.place.url,place.place.events,place.place.type,place.place.locations,place.place.elevation,place.org.parent.name,place.org.parent.surname,place.org.parent.title,place.org.parent.time,place.org.parent.deprecated,place.org.parent.note,place.org.parent.place,place.org.parent.description,place.org.parent.sources,place.org.parent.tags,place.org.parent.image,place.org.parent.id,place.org.parent.dirName,place.org.parent.url,place.org.parent.events,place.org.parent.type,place.org.parent.places,place.org.parent.kind,place.org.parent.parent.name,place.org.parent.parent.surname,place.org.parent.parent.title,place.org.parent.parent.time,place.org.parent.parent.deprecated,place.org.parent.parent.note,place.org.parent.parent.place,place.org.parent.parent.description,place.org.parent.parent.sources,place.org.parent.parent.tags,place.org.parent.parent.image,place.org.parent.parent.id,place.org.parent.parent.dirName,place.org.parent.parent.url,place.org.parent.parent.events,place.org.parent.parent.type,place.org.parent.parent.places,place.org.parent.parent.kind,place.org.parent.parent.parent.name,place.org.parent.parent.parent.surname,place.org.parent.parent.parent.title,place.org.parent.parent.parent.time,place.org.parent.parent.parent.deprecated,place.org.parent.parent.parent.note,place.org.parent.parent.parent.place,place.org.parent.parent.parent.description,place.org.parent.parent.parent.sources,place.org.parent.parent.parent.tags,place.org.parent.parent.parent.image,place.org.parent.parent.parent.id,place.org.parent.parent.parent.dirName,place.org.parent.parent.parent.url,place.org.parent.parent.parent.events,place.org.parent.parent.parent.type,place.org.parent.parent.parent.places,place.org.parent.parent.parent.kind,place.org.parent.parent.parent.parent,place.org.parent.parent.parent
https://rr0.org/time/1/5/9/0/index.html#1590-01,Konstanz,,,,,,,,,,,,,,,,"",place,"",,1590-01,"le le lendemain la nuit A , merveilleuse figure dans le ciel (Aurore boréale ? ).","""Auroral Annotations"",s1,""""""Hellman, 1921, p. 19, 89 < Silverman, Sam"""""",,",1590-01
https://rr0.org/time/1/5/9/0/index.html#1590-03,Augsburg,,,,,,,,,,,,,,,,"",place,"",,1590-03,"le jeudi 8 De 20:00 à 02:00 A , figure effrayante dans le ciel. Rayons flamboyants au-dessus des nuages, à leur maximum vers 1590 23 h (Aurore boréale probable). le mardi 30 (lendemain du jour des Cendres) A Baulme, abbaye Imperiale et bien renommée au Comté de Bourgogne, (où je fais ma demeure ordinaire avec le Réverend Seigneur de Montirnò, grand prieur dudit lieu) laquelle est posée en un fond, et enclose de tous côtés de hauts rochers ou plustôt boulevards, entez sur le sommet des montagnes, mais si bien unis et elaborés naturellement, qu'il est advis que l'artifice des mains humaines y soit entrevenu, et qu'on les ait taillé à pointe de marteau. Et comme j'avais resolu d'aller à la foire de Lons le saulnier (ville digne de remarque, tant pour sa belle et bonne situation que par le grand train de marchandise qu'on y traffique) proche de ladite Abbaye de 2 petites lieues, laquelle se tenait lors, m'étant levé environ 1/2 h avant l'aube, je suis sorti au jardin et vergier de mon logis, et selon ma coutûme, continué depuis ma jeunesse d'observer de nuit la face du ciel, levant les yeux en l'air, j'ai apperceu du côté est 2 troupes de gens de pied armés de mourions épées et lances, tournoyants en forme de limaçon, et cheminant en bel ordre et équipage contre le septentrion, ce qui m'étonna étrangement. C'est pourquoi voulant découvrir plus à plein que c'était, et voyant que les divers obstacles de l'abbaye et des maisons des religieux ne me permettaient la totale vue de la demi-sphère céleste, en compagnie de messieurs le Prieur de S. Adegrin, le Doyen et le Sellerier, qui tous 3 ont les jambes à commandement, je suis monté pas à pas avec plusieurs autres villageois, un peu plus haut que l'Eglise de S. Jean, vers une croix de pierre, communément nommée la croix de monget, laquelle regarde droit le bourg et l'abbaye des Dames Religieuses de Chastel Charlon (où il y a un Château d'ancien édifice dont ledit bourg et abbaye prennent leur nom) lequel du temps de Louis 11ème Roi de France, et du Seigneur de Craon (qui le ruina, ensemble les autres forteresses et maisons des gentils hommes Comtois mal défendues) était beaucoup plus fort et assuré qu'il n'est pour ce jourd'hui. Car depuis alors la longue paix du pays (qui comme ennemie de tous desseins guerriers, anéantit et perd petit à petit les œuvres et actions des guerres) à fait que peu à peu ce chasteau s'est ruiné. Etant donc, dis-je monté vers la susdite croix, je vis avec mes assistants droit sur le plant dudit Chastel Charlon lesdites troupes armées à plaisir desquelles chacune semblait avoir cent pas de front, et demeurèrent presque 1/4 h en cest estre, comme se preparant pour s'entrechoquer, et puis soudain se ruèrent à l'escarmouche les uns parmi les autres d'une grande fureur. Ce que donna grand épouvantement aux spectateurs, les tirant et ravissant en grande admiration, extrême frayeur et crainte, de sorte que aucun de nôtre compagnie se sauvèrent vistement, pensant déja avoir les fourriers à leurs portes pour loger cette gendarmerie : autres qui scavoyent que tel exercice était à la solde d'un monarque plus puissant que tous ceux de la terre, referoyent cela au conseil de la majesté divine. A la fin l'issue de cette guerre fut telle, que après avoir donné plusieurs estramaçons les uns aux autres et s'être bien entrebatus avec leurs lances, la première des armées disparut sur la ville d'Arlay, et l'autre sur Poligny, survenant une nuée espesse tirant sur le rouge, qui les enveloppa, et fit perdre de vue tous les combattants, ne restant que quelque petit bataillon des nuées poussées et agitées des vents, qui rendaient grosses gouttes de pur sang, qui arrosaient la terre à plomb (nous semblait-il) sur plus de 3 ou 4 lieux, sans apparence d'autre chose quelconque.","""Auroral Annotations"",s2,""""""Hellman, 1921, p. 19, 89 < Silverman, Sam"""""",,,Description du grand,s3,""Guyot Maillard"",""horrible, et effroyable meteore, et vision prodigieuse de deux armees apparues en l'air au dessus de Chastel Charlon en la Franche Comté de Bourgongne, & plusieurs autres endroits des Gaules, le Ieudy, lendemain du iour des Cendres 8. du Moys de Mars 1590..., s.l., 1590 < Bibliothèque municipale de Lyon, Rés 315946 = BNF BN-8-LB35-1322 = Auxerre C 2559 8 T.14 p.29° = Besançon 257598 (fonds ancien) < Deliyannis, Y.: """"1590, March 8th : Chastel Charlon (Château Chalon, France)"""", Magonia Exchange"",",1590-03
https://rr0.org/time/1/5/9/0/index.html#1590-07,Guermingen,,,,,,,,,,,,,,,,"",place,"",,1590-07,"le jeudi 25 12 h Entre et Assenoncour (Alsace) (Contrairment à à Assen en Drenthe (Pays-Bas) citée par la 1ʳᵉ source), Nicolette Lang-Bernhard voit un groupe d'hommes et de femmes - supposés être des sorcier(e)s - dansent : la preuve incontestable et finale de la vérité de l'événement était le fait que le lieu où cette danse avait été promulguée fut retrouvée... foulée en un anneau comme on en trouve dans un cirque lorsque des chevaux courent autour en un cercle, et parmi les autres traces étaient marques récentes des sabots de chèvres et bœufs.","Journal of Meteorology,s4,""Plot (Robert Plott?)"",""1696 < Wilson, Terry: The Secret History of Crop Circles, décembre 1998"",,Daemonolatreia,s5,""""""Remy, Nicolas"""""",""1595, réédité """"Demonolatry, edited with introduction and notes by Montague Summers"""", Rodker, 1930, réédition facsimilé de Frederick Muller, 1970, pp. 50-51 < Pajmans, Theo: """"Research crop circle Assen 1590"""""",2003",1590-07
https://rr0.org/time/1/5/9/0/index.html#1590-11,Donauworth,,,,,,,,,,,,,,,,"",place,"",,1590-11,"le lundi 12 à le vendredi 16 A , merveilleuses figures et signes dans le ciel. Une gravure montre des nuages flamboyant (Des aurores boréales possibles).","""Auroral Annotations"",s6,""""""Hellman, 1921, p. 19, 89 < Silverman, Sam"""""",,",1590-11
https://rr0.org/time/1/5/9/0/index.html,Ecosse,,,,,,,,,,,,,,,,"",place,"",,1590,"En , des paysans informent le comte (représentant du roi) qu'un grand objet tubulaire a été vu survolant leur ville. Il est resté sans bouger dans le ciel pendant plusieurs mn avant de disparaître.","""Scotland 1590: Tubular object in the sky?"",s7,""""""Aubeck, C."""""",""Magonia Exchange, 7 mai 2007"",",1590
https://rr0.org/time/1/5/9/0/index.html,Augsburg,,,,,,,,,,,,,,,,"",place,"",,1590,"A , choses vue dans le ciel (Peut-être l'aurore boréale du 8 mars).","""Auroral Annotations"",s8,""""""Hellman, 1921, p. 19, 89 < Silverman, Sam"""""",,",1590