url,place,time,description,sources,id,place.name,place.org.name,place.org.surname,place.org.title,place.org.time,place.org.deprecated,place.org.note,place.org.place,place.org.description,place.org.sources,place.org.tags,place.org.image,place.org.id,place.org.dirName,place.org.url,place.org.events,place.org.type,place.org.places,place.org.kind,place.org.parent,place.place,place.org,place.place.name,place.place.surname,place.place.title,place.place.time,place.place.deprecated,place.place.note,place.place.place,place.place.description,place.place.sources,place.place.tags,place.place.image,place.place.id,place.place.dirName,place.place.url,place.place.events,place.place.type,place.place.locations,place.place.elevation,place.org.parent.name,place.org.parent.surname,place.org.parent.title,place.org.parent.time,place.org.parent.deprecated,place.org.parent.note,place.org.parent.place,place.org.parent.description,place.org.parent.sources,place.org.parent.tags,place.org.parent.image,place.org.parent.id,place.org.parent.dirName,place.org.parent.url,place.org.parent.events,place.org.parent.type,place.org.parent.places,place.org.parent.kind,place.org.parent.parent.name,place.org.parent.parent.surname,place.org.parent.parent.title,place.org.parent.parent.time,place.org.parent.parent.deprecated,place.org.parent.parent.note,place.org.parent.parent.place,place.org.parent.parent.description,place.org.parent.parent.sources,place.org.parent.parent.tags,place.org.parent.parent.image,place.org.parent.parent.id,place.org.parent.parent.dirName,place.org.parent.parent.url,place.org.parent.parent.events,place.org.parent.parent.type,place.org.parent.parent.places,place.org.parent.parent.kind,place.org.parent.parent.parent.name,place.org.parent.parent.parent.surname,place.org.parent.parent.parent.title,place.org.parent.parent.parent.time,place.org.parent.parent.parent.deprecated,place.org.parent.parent.parent.note,place.org.parent.parent.parent.place,place.org.parent.parent.parent.description,place.org.parent.parent.parent.sources,place.org.parent.parent.parent.tags,place.org.parent.parent.parent.image,place.org.parent.parent.parent.id,place.org.parent.parent.parent.dirName,place.org.parent.parent.parent.url,place.org.parent.parent.parent.events,place.org.parent.parent.parent.type,place.org.parent.parent.parent.places,place.org.parent.parent.parent.kind,place.org.parent.parent.parent.parent,place.org.parent.parent.parent,place.org.parent.parent
https://rr0.org/time/1/9/4/8/12/index.html,Moscou (Russie),,,,,,,,,,,,,,,,"",place,"",,1948-12,"Au-dessus de , un certain nombre d'objets longs, à la forme de poisson sont observés, réfléchissant la lumière du Soleil.","Vallée,s1,"""",""Anatomy of Phenomenon, p. 54"",",1948-12
https://rr0.org/time/1/9/4/8/12/index.html#1948-12,,1948-12,en Observation de Lincoln LaPaz.,"",1948-12
https://rr0.org/time/1/9/4/8/12/index.html#1948-12-27,San Juan (Puerto Rico),,,,,,,,,,,,,,,,"",place,"",,1948-12-27,"le (28?) Le vol commercial d'un DC-3A depuis vers Miami (Floride), piloté par le capitaine Robert Lindquist avec 36 (32?) personnes à bord, s'""évapore"" en vue de Miami, dans le ""triangle des Bermudes"". Nous approchons la piste à seulement 50 miles au Sud, dit le pilote à la tour de contrôle. Nous pouvons voir les lumières de Miami maintenant. Tout est correct. Attendons les instructions d'atterrissage. Le DC-3A disparaît de l'écran radar quelques secondes plus tard. Le point où l'appareil se serait écrasé est au-dessus de Florida Keys, où des eaux claires de seulement 20 pieds de profondeur auraient laissé le DC-3A visible. Une enquête officielle est menée pour comprendre comment le pilote expérimenté peut disparaître par une nuit claire et calme. Les équipes de recherchent inspectent le lieu où l'avion est supposé s'être écrasé, mais aucune trace de l'appareil n'est trouvée dans l'eau de 20 pieds de profondeur.",",s3,"""",,",1948-12-27
https://rr0.org/time/1/9/4/8/12/index.html,,1948-12,Construction des installations souterraines secrètes de Los Alamos.,"",1948-12
https://rr0.org/time/1/9/4/8/12/index.html,,1948-12,Election de Harry S. Truman à la Présidence des Etats-Unis.,"",1948-12