url,place,time,description,sources,id,place.name,place.org.dirName,place.org.code,place.org.places,place.org.kind,place.org.parent,place.place,place.org,place.place.locations,place.place.elevation,place.place.dirName,place.place.events,place.org.parent.dirName,place.org.parent.code,place.org.parent.places,place.org.parent.kind,place.org.parent.parent.dirName,place.org.parent.parent.code,place.org.parent.parent.places,place.org.parent.parent.kind,place.org.parent.parent.parent.dirName,place.org.parent.parent.parent.code,place.org.parent.parent.parent.places,place.org.parent.parent.parent.kind,place.org.parent.parent.parent.parent,place.org.parent.parent.parent,place.org.parent.parent
https://rr0.org/time/2/0/0/2/09/index.html#2002-09-02T22:00,"Nantes, Loire Atlantique",,"",,,,2002-09-02T22:00,"à septembre 2002 à 22:25, 1 témoin observe une série de points lumineux se succédant depuis l'horizon jusqu'à un point où ils tombaient. Un triangle avec des points lumineux a été observé également. Aucun bruit n'a été entendu.",",s1,""SEPRA"",,",2002-09-02T22:00
https://rr0.org/time/2/0/0/2/09/index.html#2002-09-04,"région des  Laurentides, au nord de Montréal, Canada",,"",,,,2002-09-04,"Dans la , un témoin fait un observation d'ovni. En 2008 il demandera au ministre de la Défense de son pays de vérifier son observation, sans succès.","A la demande d'un citoyen,s2,""Dépêche AFP"",""le Canada vérifie s'il y a des Ovnis dans le ciel"""", Yahoo Actualités, 9 avril 2008"",",2002-09-04
https://rr0.org/time/2/0/0/2/09/index.html#2002-09-21,"Petite île, Réunion",,"",,,,2002-09-21,"au le dimanche 22, un couple de témoins est réveillé par 1 bruit sourd qui devient insupportable et qui se termine par 3 violentes explosions. L'ensemble du phénomène a duré 3 s environ. Curieusement leurs enfants n'ont pas été réveillés et leur voisin n'a rien entendu.",",s3,""SEPRA"",,",2002-09-21
https://rr0.org/time/2/0/0/2/09/index.html#2002-09-25,"Vitimsky, à 30 km du gros bourg de Mama, Sibérie orientale",,"",,,,2002-09-25,"le mercredi 25 01:50 A , les villageois sont réveillés en sursaut. Eclats de verre, vaisselle brisée, puis un sourd grondement. L'espace d'un instant, beaucoup croient à un important tremblement de terre. Mais l'éblouissant éclair qui a illuminé le ciel efface tous les doutes. L'événement n'était pas terrestre mais céleste. Quelque chose est tombé du ciel. Immédiatement, toutes les éventualités sont envisagées. Le journaliste Evguénii Pouchkarev, du quotidien local n° 1, cite un militaire désireux de rester anonyme, pour qui il s'agit peut-être de la chute dêsile qui s'est écarté de sa trajectoire nominale. La thèse du débris spatial est vite écartée : En effet, les satellites de surveillance repèrent et suivent sur plusieurs orbites tous les objets issus de la désintégration d'un engin spatial, explique Fernand Alby, du CNES. Pour valider la thèse d'un aérolithe, il faut trouver un fragment de météorite. Les américains, eux, ont déterminé grâce à leurs satellites le point d'impact ainsi que son énergie, estimée à 0,2 kilotonne de TNT. Des satellites du DoD suivent un objet traverser l'atmosphère entre 62 et 30 km d'altitude, au-dessus de la Sibérie orientale.","Ciel et Espace,s4,"""",,",2002-09-25
https://rr0.org/time/2/0/0/2/09/index.html#2002-09-26T03:30,"Pouzin, Ardèche",,"",,,,2002-09-26T03:30,"Au , 1 témoin observe 3 barres lumineuses verticales ayant des mouvements variés. Le témoin note qu'il a été appelé par une voix à aller voir le phénomène.",",s5,""SEPRA"",,",2002-09-26T03:30
https://rr0.org/time/2/0/0/2/09/index.html#2002-09-27T14:48,Pas-de-Calais,,"",,,,2002-09-27T14:48,"Au-dessus du , l'équipage d'un A-320 effectuant un vol Teneriffe-Bruxelles observe 1 objet rond qu'il qualifie lui-même de ballon (Probablement un ballon météo).",",s6,""SEPRA"",,",2002-09-27T14:48