description,events,eventType,id,place,sources,time,type,url,place.dirName,place.elevation,place.events,place.id,place.locations,place.name,place.org._parent,place.org.events,place.org.id,place.org.kind,place.org.places,place.org.type,place.org._parent._parent._parent._parent,place.org._parent._parent._parent.events,place.org._parent._parent._parent.id,place.org._parent._parent._parent.kind,place.org._parent._parent._parent.places,place.org._parent._parent._parent.type,place.org._parent._parent.events,place.org._parent._parent.id,place.org._parent._parent.kind,place.org._parent._parent.places,place.org._parent._parent.type,place.org._parent.events,place.org._parent.id,place.org._parent.kind,place.org._parent.places,place.org._parent.type,place.org._parent._parent._parent,place.org._parent._parent
Récupération par les États-Unis de 7 corps suite à un crash en Afghanistan.,"",sighting,1988-11$,,"",1988-11,event,https://rr0.org/time/1/9/8/8/11/index.html
"le à le samedi 12 Photo des participants au congrès devant les locaux de la SOBEPS. On y distingue notamment Michel Bougard, Patrick Ferryn, Auguste Meessen, Richard F. Haines, Jean-Luc Rivera, Bertrand Méheust, Edoardo Russo, Pierre Lagrange, Jaques Scornaux, Lucien Clerebaut, Jacques Vallée, Vladimir Rubtsov, Hilary Evans, Robert Dehon À , 1er congrès ufologique européen.","",sighting,1988-11-11$Bruxelles (Belgique),,,"",,"",Bruxelles (Belgique),"",1988-11-11,event,https://rr0.org/time/1/9/8/8/11/index.html#1988-11-11
le La navette russe Bourane effectue un vol sans pilote.,"",sighting,1988-11-15$,,"",1988-11-15,event,https://rr0.org/time/1/9/8/8/11/index.html#1988-11-15
le 2 chasseurs à réaction sont"enlevés" par un ovni au-dessus de l'île de Porto Rico. Un événement semblable - mais bien distinct - sera observé le 28 décembre.,"",sighting,1988-11-16$,,"",1988-11-16,event,https://rr0.org/time/1/9/8/8/11/index.html#1988-11-16
le 1ʳᵉ sortie dans l'espace d'un européen (Jean-Loup Chrétien).,"",sighting,1988-11-26$,,"",1988-11-26,event,https://rr0.org/time/1/9/8/8/11/index.html#1988-11-26
