description,events,id,place,sources,time,type,url,place.name,place.org,place.place.dirName,place.place.elevation,place.place.events,place.place.id,place.place.locations,place.org.dirName,place.org.events,place.org.id,place.org.kind,place.org.parent,place.org.places,place.org.type,place.place,place.org.parent.dirName,place.org.parent.events,place.org.parent.id,place.org.parent.kind,place.org.parent.parent.dirName,place.org.parent.parent.events,place.org.parent.parent.id,place.org.parent.parent.kind,place.org.parent.parent.parent.dirName,place.org.parent.parent.parent.events,place.org.parent.parent.parent.id,place.org.parent.parent.parent.kind,place.org.parent.parent.parent.parent,place.org.parent.parent.parent.places,place.org.parent.parent.parent.type,place.org.parent.parent.places,place.org.parent.parent.type,place.org.parent.places,place.org.parent.type,place.org.parent.parent,place.org.parent.parent.parent
"le Sur le lac Ontario, à , alors qu'un couple pique-nique sur la plage, l'air se met à vibrer. Ils voient en se cachant un disque posé sur le lac, hublots en couronne, avec un ""mât"" central terminé par un cerceau comme un goniomètre. Des êtres tournent à espace régulier sur le bord. Il s'arrêtent pour regarder dans la direction des témoins, mais regardent en fait un cerf au-dessus d'eux. Les êtres rentrent et le disque s'arrache de l'eau à la verticale, laissant sous lui une eau rougeâtre aux reflets dorés.","",1950-07-02,Sawbill Bay,,,,"",,"",""""","""",s1,"""",,,Lob et Gigi",1950-07-02,case,https://rr0.org/time/1/9/5/0/07/index.html#1950-07-02
"le A l'Arsenal de , 2 employés expérimentés de l'Arsenal, dont M. Washburn, observent un objet ressemblant à un ""bowtie"", semblant fait d'aluminium poli, voler tout droit, puis 1 triangle faire 1/4 de tour dans la direction opposée et retournée à sa position d'origine. L'objet fait ensuite un virage à angle droit et accélère au loin après au moins 30 s.","",1950-07-13T17:00,Redstone     (Alabama ou Georgie         ?),,,,"",,"",""""","""",s2,"""",,758,",1950-07-13T17:00,case,https://rr0.org/time/1/9/5/0/07/index.html#1950-07-13T17:00
"le , M. Campello et d'autres témoins en voiture voient 2 énormes objets argentés sur le côté de la route, un sur un coteau, l'autre sur un terrain plat à environ 50 m du 1er. Les témoins approchèrent à 600 m des 2 objets qui s'éloignent à une vitesse incroyable, causant un fort déplacement d'air qui secoue leur voiture.","",1950-07-20,Porto Novo (Brésil),,,,"",,"",""""","""",s3,"""",,30,",1950-07-20,case,https://rr0.org/time/1/9/5/0/07/index.html#1950-07-20
le Inauguration de Cap Canaveral.,"",1950-07-24,,"",1950-07-24,case,https://rr0.org/time/1/9/5/0/07/index.html#1950-07-24
"le Des objets de forme ronde apparaissent au-dessus de la centrale atomique de Hanford, à l'altitude de 4600 m. Une tentative d'interception par des chasseurs de l'USAF échoue.","",1950-07-30,,"",1950-07-30,case,https://rr0.org/time/1/9/5/0/07/index.html#1950-07-30