url,place,time,description,sources
https://rr0.org/time/1/9/5/0/07/index.html,,1950-07,"Sur le lac Ontario, à Sawbill Bay, alors qu'un couple pique-nique sur la plage, l'air se met à vibrer. Ils voient en se cachant un disque posé sur le lac, hublots en couronne, avec un ""mât"" central terminé par un cerceau comme un goniomètre. Des êtres tournent à espace régulier sur le bord. Il s'arrêtent pour regarder dans la direction des témoins, mais regardent en fait un cerf au-dessus d'eux. Les êtres rentrent et le disque s'arrache de l'eau à la verticale, laissant sous lui une eau rougeâtre aux reflets dorés Lob et Gigi.",""
https://rr0.org/time/1/9/5/0/07/index.html,,1950-07,"A l'Arsenal de Redstone (Alabama ou Georgie ?), 2 employés expérimentés de l'Arsenal, dont M. Washburn, observent un objet ressemblant à un ""bowtie"", semblant fait d'aluminium poli, voler tout droit, puis 1 triangle faire 1/4 de tour dans la direction opposée et retournée à sa position d'origine. L'objet fait ensuite un virage à angle droit et accélère au loin après au moins 30 s Cas Blue Book n° 758 non expliqué.",""
https://rr0.org/time/1/9/5/0/07/index.html,,1950-07,"A Houston (Texas), une station de télévision dont la marque d'identification (mire) est constituée des 4 lettres KLEE change de nom et devient KPRC TV. Or, contre toute attente, l'ancienne marque KLEE continuera a apparaître sur divers écrans jusqu'en , non seulement autour de Houston, mais aussi dans d'autres états aussi éloignés que New York et mpeme en Angleterre, où le système de transmission est pourtant différent. Ces réceptions impossibles décalées sont à ranger dans toute une gamme d'échos retardés TV et radio, jamais totalement élucidés.",""
https://rr0.org/time/1/9/5/0/07/index.html,,1950-07,"A Porto Novo (Brésil), M. Campello et d'autres témoins en voiture voient 2 énormes objets argentés sur le côté de la route, un sur un coteau, l'autre sur un terrain plat à environ 50 m du 1er. Les témoins approchèrent à 600 m des 2 objets qui s'éloignent à une vitesse incroyable, causant un fort déplacement d'air qui secoue leur voiture SBEDV 30.",""
https://rr0.org/time/1/9/5/0/07/index.html,,1950-07,Inauguration de Cap Canaveral.,""
https://rr0.org/time/1/9/5/0/07/index.html,,1950-07,"Des objets de forme ronde apparaissent au-dessus de la centrale atomique de Hanford, à l'altitude de 4600 m. Une tentative d'interception par des chasseurs de l'USAF échoue.",""