url,place,time,description,sources,id,place.name,place.org.name,place.org.surname,place.org.title,place.org.time,place.org.deprecated,place.org.note,place.org.place,place.org.description,place.org.sources,place.org.tags,place.org.image,place.org.id,place.org.dirName,place.org.url,place.org.events,place.org.type,place.org.parent,place.org.places,place.org.kind,place.place,place.org,place.place.name,place.place.surname,place.place.title,place.place.time,place.place.deprecated,place.place.note,place.place.place,place.place.description,place.place.sources,place.place.tags,place.place.image,place.place.id,place.place.dirName,place.place.url,place.place.events,place.place.type,place.place.parent,place.place.locations,place.place.elevation,place.org.parent.name,place.org.parent.surname,place.org.parent.title,place.org.parent.time,place.org.parent.deprecated,place.org.parent.note,place.org.parent.place,place.org.parent.description,place.org.parent.sources,place.org.parent.tags,place.org.parent.image,place.org.parent.id,place.org.parent.dirName,place.org.parent.url,place.org.parent.events,place.org.parent.type,place.org.parent.parent.name,place.org.parent.parent.surname,place.org.parent.parent.title,place.org.parent.parent.time,place.org.parent.parent.deprecated,place.org.parent.parent.note,place.org.parent.parent.place,place.org.parent.parent.description,place.org.parent.parent.sources,place.org.parent.parent.tags,place.org.parent.parent.image,place.org.parent.parent.id,place.org.parent.parent.dirName,place.org.parent.parent.url,place.org.parent.parent.events,place.org.parent.parent.type,place.org.parent.parent.parent.name,place.org.parent.parent.parent.surname,place.org.parent.parent.parent.title,place.org.parent.parent.parent.time,place.org.parent.parent.parent.deprecated,place.org.parent.parent.parent.note,place.org.parent.parent.parent.place,place.org.parent.parent.parent.description,place.org.parent.parent.parent.sources,place.org.parent.parent.parent.tags,place.org.parent.parent.parent.image,place.org.parent.parent.parent.id,place.org.parent.parent.parent.dirName,place.org.parent.parent.parent.url,place.org.parent.parent.parent.events,place.org.parent.parent.parent.type,place.org.parent.parent.parent.parent,place.org.parent.parent.parent.places,place.org.parent.parent.parent.kind,place.org.parent.parent.places,place.org.parent.parent.kind,place.org.parent.places,place.org.parent.kind,place.org.parent.parent.parent,place.org.parent.parent
https://rr0.org/time/1/9/9/7/12/index.html#1997-12-07,,1997-12-07,"L'ovni photographié par David Spoor le 7 le David Spoor se trouve dans son jardin derrière sa maison, quand un ovni apparaît. Spoor porte son appareil photo sur lui et peut prendre plusieurs prises de vue nettes (ci-contre). L'objet fait du surplace pendant un moment avant de disparaître derrière des buissons. Puis il réapparaît pour disparaître à nouveau derrière des maisons. Spoor estime qu'il mesure entre 12 et 15 m de large, mais ne peut l'affirmer avec certitude. Peu de temps après, l'objet est observé au nord-est ; il vole alors au-dessus de la mer. Toujours selon Spoor, il reste stationnaire un moment, puis se déplace à une vitesse de 70 à 80 km/h. La lumière semble provenir de l'intérieur de l'ovni. Spoor écarte l'hypothèse selon laquelle le vaisseau serait en fait la planète Vénus ; il affirme en effet que la planète était visible ce jour-là, mais de l'autre côté du ciel.","",1997-12-07
https://rr0.org/time/1/9/9/7/12/index.html#1997-12-11T23:00,Brienne-le-Château (Aube),,,,,,,,,,,,,,,,"",place,,"",,1997-12-11T23:00,"le , des flash lumineux silencieux sont observés par des militaires. Simultanément des coupures brèves de courant sont observées. Ces coupures sont confirmées par EDF du fait d'incident sur la ligne 33 kV desservant le secteur. Compte tenu de la simultanéité des faits et des directions des flash observés par les 3 témoins situés à 3 endroits différents par rapport au passage de la ligne à haute tension, il est probable que les flash observés se soient produits sur la ligne au moment des incidents relevés sur cette ligne.",",s1,""SEPRA"",,",1997-12-11T23:00
https://rr0.org/time/1/9/9/7/12/index.html#1997-12-14T17:00,Narbonne (Aude),,,,,,,,,,,,,,,,"",place,,"",,1997-12-14T17:00,"le , 1 témoin en voiture aperçoit 1 phénomène lumineux qu'il ne s'explique pas. Il a la présence d'esprit de filmer le phénomène (qui est probablement d'origine nuageux Après visionnage de la cassette celle-ci sera rendue à son propriétaire qui souhaitait en faire un usage commercial).",",s2,""SEPRA"",,",1997-12-14T17:00
https://rr0.org/time/1/9/9/7/12/index.html#1997-12-23,"Guangdong (périphérie de Canton, Chine)",,,,,,,,,,,,,,,,"",place,,"",,1997-12-23,"le Des centaines d'ouvriers chinois travaillant dans la province de observent un phénomène de forme ovale avec une série de hublots entourés d'un halo de lumière survolant une zone industrielle où se trouvent de nombreuses usines. Le phénomène, visible durant plusieurs minutes, émet un rayon lumineux vers le sol. Il disparaît ensuite à une vitesse vertigineuse.","",1997-12-23
https://rr0.org/time/1/9/9/7/12/index.html#1997-12-27T07:45,Cergy (Val d'Oise),,,,,,,,,,,,,,,,"",place,,"",,1997-12-27T07:45,"le , un automobiliste observe la chute à grande vitessse d'un objet en flamme. Le phénomène est silencieux et très bref, environ 3 secondes. Il est de couleur bleue-jaune. Un autre témoin rapporte également le même phénomène (La description faite par les témoins conduit à retenir l'hypothèse d'une rentrée atmosphérique).",",s3,""SEPRA"",,",1997-12-27T07:45