description,events,eventType,id,place,sources,time,type,url,place.dirName,place.elevation,place.events,place.id,place.locations,place.name,place.org._parent,place.org.events,place.org.id,place.org.kind,place.org.places,place.org.type,place.org._parent._parent._parent._parent,place.org._parent._parent._parent.events,place.org._parent._parent._parent.id,place.org._parent._parent._parent.kind,place.org._parent._parent._parent.places,place.org._parent._parent._parent.type,place.org._parent._parent.events,place.org._parent._parent.id,place.org._parent._parent.kind,place.org._parent._parent.places,place.org._parent._parent.type,place.org._parent.events,place.org._parent.id,place.org._parent.kind,place.org._parent.places,place.org._parent.type,place.org._parent._parent,place.org._parent._parent._parent
"le la nuit, une lumière bigarrée brillante est observée au-dessus de la ville, avec une traînée de fumée et le son du tonnerre. Sa traînée lumineuse persiste durant 10 mn.","",sighting,1946-06-09$Helsinkin (Finlande),,,"",,"",Helsinkin (Finlande),"",1946-06-09,event,https://rr0.org/time/1/9/4/6/06/index.html#1946-06-09
"le la nuit Même phénomène que la veille, mais les journaux indiquent que l'objet a fait demi-tour pour revenir dans la direction d'où il venait.","",sighting,1946-06-10$,,"",1946-06-10,event,https://rr0.org/time/1/9/4/6/06/index.html#1946-06-10
"le Début de soirée Au-dessus d', observation d'un phénomène céleste à l'apparence d'une bombe sur une course descendante, mais sans échappement. L'état-major suédois demande à l'armée de signaler leurs observations via les canaux officiels, admettant être au courant du phénomène depuis mai.","",sighting,1946-06-12$Eskilstuna (Suède),,,"",,"",Eskilstuna (Suède),""""","""",s1,"""",""Morgon-Tidningen de Stockholm (Suède), 13 juin 1946"",05,""Sky Phenomenon in Eskilstuna""",1946-06-12,event,https://rr0.org/time/1/9/4/6/06/index.html#1946-06-12
"le Dans le sud de la , observation d'un météore rouge flamboyant.","",sighting,1946-06-20T22:20$Finlande,,,"",,"",Finlande,""""","""",s2,"""",""Morgon-Tidningen de Stockholm (Suède), 22 juin 1946"",06,""Flaming Red Meteor In Southern Finland""",1946-06-20T22:20,event,https://rr0.org/time/1/9/4/6/06/index.html#1946-06-20T22:20
"le en 20, observation d'un long objet gris illuminé à l'avant qui disparaît dans un nuage de fumée.","",sighting,1946-06-30$Gavle (Suède),,,"",,"",Gavle (Suède),""""","""",s3,"""",""Morgon-Tidningen de Stockholm (Suède), mardi 2 juillet 1946"",03,""Mysterious Plane Over Gavle""",1946-06-30,event,https://rr0.org/time/1/9/4/6/06/index.html#1946-06-30