description,events,eventType,id,place,sources,time,type,url,place.dirName,place.elevation,place.events,place.id,place.locations,place.name,place.sources,place.type
"N° spécial, HS de Pif Gadget publié par les éditions Vaillant. Le gadget est un ""dirigeable solaire"" : une grosse saucisse aux couleurs de Pif et de RTL. Caractéristiques : 3 mètres de long, 70 cm de diamètre, réalisée en polyéthylène de 5 microns. le , 2 témoins devant leur habitation aperçoivent un phénomène lumineux dans le ciel. Ils appellent aussitôt leurs voisines et la gendarmerie. Tous constatent la présence à très basse altitude d'un objet circulaire de couleur claire, d'environ 30 ou 40 cm de diamètre. Cet objet fixe sera observé durant 1 heure puis les gendarmes feront la même observation dans une autre commune. Aucune trace ne sera relevée sur le sol ou sur les habitations environnantes et aucun fait particulier concernant l'attitude des animaux du secteur n'a été porté à la connaissance des gendarmes (Une vérification avec un logiciel d'astronomie incite le GEPAN à penser que les témoins ont probablement fait une observation astronomique de la lune, particulièrement basse sur l'horizon en cette période de l'année).","",sighting,1981-07-01T00:30$YvetotSeineMaritime,,,"",,"","Yvetot, Seine Maritime","",place,"""GEPAN"","""",s1,"""",,PAN classé B",1981-07-01T00:30,event,https://rr0.org/time/1/9/8/1/07/index.html#1981-07-01T00:30
"le , pendant le feu d'artifice de la fête nationale, observation d'un cône orange à 300 m du sol.","",sighting,1981-07-14$CormeilleenParisisValDOise,,,"",,"",Cormeille-en-Parisis (Val d'Oise),"",place,""""","""",s2,"""",,Gazette du Val d'Oise",1981-07-14,event,https://rr0.org/time/1/9/8/1/07/index.html#1981-07-14
"vers le Plusieurs témoins sur un bateau aperçoivent au-dessus de l'île de 1 phénomène volant plus gros qu'une étoile, de la forme d'une torche, et blanc-vert. Durant l'observation qui a duré plusieurs s, le phénomène s'est déplacé lentement et sur une trajectoire horizontale.","",sighting,1981~-07~-16~T23~:45$PortCrosVar,,,"",,"",Port-Cros (Var),"",place,"""GEPAN"","""",s3,"""",,PAN classé C",1981~-07~-16~T23~:45,event,https://rr0.org/time/1/9/8/1/07/index.html#1981~-07~-16~T23~:45
"le Dans 14 provinces du sud-ouest et nord-ouest de la près de 10 millions de personnes voient dans le ciel dégagé comme une étoile qui devient de plus en plus brillante, et semble osciller. Puis une une sorte de bande nuageuse lumineuse se forme autour du point lumineux, dessinant une spirale à une altitude de 650 km et une vitesse de 1,6 km/s avant de disparaître. (Probablement un tir de missile/fusée tournant dans le ciel)","",sighting,1981-07-24T22:38$Chine,,,"",,"",Chine,"",place,"""Long Ruyi"","""",s4,"""",,FTD < Professor Wang Sichao",1981-07-24T22:38,event,https://rr0.org/time/1/9/8/1/07/index.html#1981-07-24T22:38
"vers le , 2 témoins aperçoivent dans le ciel 2 points lumineux. Ils se déplacent parallèlement puis effectuent des changements de trajectoire avant de revenir à leur point de départ. L'observation qui a duré environ 10 minutes a permis d'assister à plusieurs allers et venues. Les phénomènes se dirigent soudain rapidement vers l'ouest pour disparaître. Aucun bruit n'a été entendu lors de l'observation. Aucun autre témoignage n'a été recueilli.","",sighting,1981~-07~-27~T23~:30$PloermelMorbihan,,,"",,"",Ploermel (Morbihan),"",place,"""GEPAN"","""",s5,"""",,PAN classé C",1981~-07~-27~T23~:30,event,https://rr0.org/time/1/9/8/1/07/index.html#1981~-07~-27~T23~:30