url,place,time,description,sources,id,place.name,place.org.name,place.org.surname,place.org.title,place.org.time,place.org.deprecated,place.org.note,place.org.place,place.org.description,place.org.sources,place.org.tags,place.org.image,place.org.id,place.org.dirName,place.org.url,place.org.events,place.org.type,place.org.places,place.org.kind,place.org.parent,place.place,place.org,place.place.name,place.place.surname,place.place.title,place.place.time,place.place.deprecated,place.place.note,place.place.place,place.place.description,place.place.sources,place.place.tags,place.place.image,place.place.id,place.place.dirName,place.place.url,place.place.events,place.place.type,place.place.locations,place.place.elevation,place.org.parent.name,place.org.parent.surname,place.org.parent.title,place.org.parent.time,place.org.parent.deprecated,place.org.parent.note,place.org.parent.place,place.org.parent.description,place.org.parent.sources,place.org.parent.tags,place.org.parent.image,place.org.parent.id,place.org.parent.dirName,place.org.parent.url,place.org.parent.events,place.org.parent.type,place.org.parent.places,place.org.parent.kind,place.org.parent.parent.name,place.org.parent.parent.surname,place.org.parent.parent.title,place.org.parent.parent.time,place.org.parent.parent.deprecated,place.org.parent.parent.note,place.org.parent.parent.place,place.org.parent.parent.description,place.org.parent.parent.sources,place.org.parent.parent.tags,place.org.parent.parent.image,place.org.parent.parent.id,place.org.parent.parent.dirName,place.org.parent.parent.url,place.org.parent.parent.events,place.org.parent.parent.type,place.org.parent.parent.places,place.org.parent.parent.kind,place.org.parent.parent.parent.name,place.org.parent.parent.parent.surname,place.org.parent.parent.parent.title,place.org.parent.parent.parent.time,place.org.parent.parent.parent.deprecated,place.org.parent.parent.parent.note,place.org.parent.parent.parent.place,place.org.parent.parent.parent.description,place.org.parent.parent.parent.sources,place.org.parent.parent.parent.tags,place.org.parent.parent.parent.image,place.org.parent.parent.parent.id,place.org.parent.parent.parent.dirName,place.org.parent.parent.parent.url,place.org.parent.parent.parent.events,place.org.parent.parent.parent.type,place.org.parent.parent.parent.places,place.org.parent.parent.parent.kind,place.org.parent.parent.parent.parent,place.org.parent.parent.parent,place.org.parent.parent
https://rr0.org/time/1/8/8/1/index.html#1881-06,Melbourne et Sidney (Australie),,,,,,,,,,,,,,,,"",place,"",,1881-06,"en le samedi 11 04 h Lors d'un voyage entre , les princes Albert Victor et George, tous 2 fils du Prince de Galles (futur Edouard 7) : Au cours de la traversée, l'homme de veille leur signala (...) une étrange lumière dans le ciel, comme celle d'un vaisseau fantôme tout embrasé. 12 autres membres de l'équipage de La Bacchante la voient également.",",s1,"""",,,,s2,""""""Fort, C."""""",,637,Anatomy 12,s3,"""",,",1881-06
https://rr0.org/time/1/8/8/1/index.html#1881-07,Minnesota,,,,,,,,,,,,,,,,"",place,"",,1881-07,"en le lundi 25 20:30 Dans le , observation d'un météore particulièrement lent.","""The Minnesota Meteor"",s4,"""",New York Times,1881",1881-07
https://rr0.org/time/1/8/8/1/index.html#1881-09,"Minneapolis (Minnesota, près de la frontière ouest du         Wisconsin",,,,,,,,,,,,,,,,"",place,"",,1881-09,"en le lundi 12 A , décollage du ballon du professeur King en direction de New York, 6 jours après la date fixée pour le départ. Le gonflement du ballon a pris toute la journée.","""Prof. King's Balloon Starts; The Beginning of the Voyage of the Great North-West to the East"",s5,"""",New York Times,-13",1881-09
https://rr0.org/time/1/8/8/1/index.html#1881-10,Wisconsin (USA),,,,,,,,,,,,,,,,"",place,"",,1881-10,"en Dans l'est du , Scientific American rapporte une pluie d'énormes toiles d'araignées.. de texture solide et très blanches.. partout de 60 pieds de long à de simples points. Il n'y avait aucune présence connue d'araignées dans la région. Ven 14 King et son compagnon de voyage sont retrouvés en pleine nature à 65 miles au nord de Chippewa Falls (dans le comté de Barron, à 185 miles au nord de Madison). le lundi 17 20 h ou 21:00 Au-dessus de Fargo (Dakota du Nord), observation de ce qu'on pense être le ballon du professeur King.","""The Balloon Safe"",s6,"""",Daily Northwestern de Oshkosh (Wisconsin),-21,""King's Balloon"",s7,"""",Daily Gazette de Janesville (Wisconsin),-18",1881-10
https://rr0.org/time/1/8/8/1/index.html,Waterloo,,,,,,,,,,,,,,,,"",place,"",,1881,"Fin septembre/début novembre, un habitant voit une étoile se déplacer et faire des pauses, puis disparaître.","Article de l' Iowa State Reporter de Waterloo,s8,"""",9 novembre 1881,",1881
https://rr0.org/time/1/8/8/1/index.html#1881-12,"Sandhurst (Victoria, Australie)",,,,,,,,,,,,,,,,"",place,"",,1881-12,"en le mercredi 7 Près de , par un temps orageux, plusieurs personnes sont dérangées par une boule de feu fonçant à travers la ville.","""A Ball of Fire"",s9,"""",Argus de Grey River New Zealand),-24",1881-12