url,place,dateTime,description,sources,id
https://rr0.org/time/1/8/8/1/index.html,,1881,"06-11 04:00 Lors d'un voyage entre Melbourne et Sidney (Australie), les princes Albert Victor et George, tous 2 fils du Prince de Galles (futur Edouard 7) : Au cours de la traversée, l'homme de veille leur signala (...) une étrange lumière dans le ciel, comme celle d'un vaisseau fantôme tout embrasé. 12 autres membres de l'équipage de La Bacchante la voient également The Cruise of the Bacchante Fort, C.: 637 Anatomy 12.","",1881
https://rr0.org/time/1/8/8/1/index.html,,1881,"07-25 20:30 Dans le Minnesota, observation d'un météore particulièrement lent ""The Minnesota Meteor"", New York Times, 1881.","",1881
https://rr0.org/time/1/8/8/1/index.html,,1881,"09-12 A Minneapolis (Minnesota, près de la frontière ouest du Wisconsin, décollage du ballon du professeur King en direction de New York, 6 jours après la date fixée pour le départ. Le gonflement du ballon a pris toute la journée ""Prof. King's Balloon Starts; The Beginning of the Voyage of the Great North-West to the East"", New York Times, 13 septembre 1881.","",1881
https://rr0.org/time/1/8/8/1/index.html,,1881,"Dans l'est du Wisconsin (USA), Scientific American rapporte une pluie d'énormes toiles d'araignées.. de texture solide et très blanches.. partout de 60 pieds de long à de simples points. Il n'y avait aucune présence connue d'araignées dans la région. Ven 14 King et son compagnon de voyage sont retrouvés en pleine nature à 65 miles au nord de Chippewa Falls (dans le comté de Barron, à 185 miles au nord de Madison) ""The Balloon Safe"", Daily Northwestern de Oshkosh (Wisconsin), 21 octobre 1881. 10-17 20:00 ou 21:00 Au-dessus de Fargo (Dakota du Nord), observation de ce qu'on pense être le ballon du professeur King ""King's Balloon"", Daily Gazette de Janesville (Wisconsin), 18 octobre 1881.","",1881
https://rr0.org/time/1/8/8/1/index.html,,1881,"Fin septembre/début novembre A Waterloo, un habitant voit une étoile se déplacer et faire des pauses, puis disparaître Article de l' Iowa State Reporter de Waterloo, 9 novembre 1881.","",1881
https://rr0.org/time/1/8/8/1/index.html,,1881,"12-07 Près de Sandhurst (Victoria, Australie), par un temps orageux, plusieurs personnes sont dérangées par une boule de feu fonçant à travers la ville ""A Ball of Fire"", Argus de Grey River New Zealand), 24 janvier 1882.","",1881