url,place,dateTime,description,sources,id,place.name,place.org.dirName,place.org.code,place.org.places,place.org.kind,place.org.parent,place.place,place.org,place.place.locations,place.place.elevation,place.place.dirName,place.place.data,place.org.parent.dirName,place.org.parent.code,place.org.parent.places,place.org.parent.kind,place.org.parent.parent.dirName,place.org.parent.parent.code,place.org.parent.parent.places,place.org.parent.parent.kind,place.org.parent.parent.parent.dirName,place.org.parent.parent.parent.code,place.org.parent.parent.parent.places,place.org.parent.parent.parent.kind,place.org.parent.parent.parent.parent,place.org.parent.parent.parent,place.org.parent.parent
https://rr0.org/time/1/9/7/2/04/index.html#1972-04-16,,1972-04-16,Lancement de la mission Apollo 16.,"",1972-04-16
https://rr0.org/time/1/9/7/2/04/index.html#1972-04-21,,1972-04-21,Les astronautes de Apollo 16 se posent près du cratère Descartes.,"",1972-04-21
https://rr0.org/time/1/9/7/2/04/index.html#1972-04-27,,1972-04-27,Retour de la mission Apollo 16.,"",1972-04-27
https://rr0.org/time/1/9/7/2/04/index.html,,1972-04,"On reparle de ""Zoé"", petit corps céleste de moins de 800 km de diamètre évoluant entre le Soleil et Mercure, découvert quelque temps auparavant par l'astronome américain Henry Courteen et à l'existence confirmée par la NASA et l'observatoire Smithsonian.","",1972-04
https://rr0.org/time/1/9/7/2/04/index.html,Montflanquin (Lot-et-Garonne),,"",,,,1972-04,"Près de et du lieu-dit ""le fer à mulet"", Maxime est en voiture avec un ami lorsque au détour d'un virage un objet ""trapézoïdal"" très sombre (aucune lumière) d'apparence métallique très primaire, peut-être avec des rivets, avec comme des hublots) posé décolle et passe devant eux très rapidement (en 3 s avec un léger chuintement) pour aller survoler la cîme de pruniers au loin, puis d'arbres d'une forêt dense sur 1 km au moins (sans perturber leurs feuillages) jusqu'à une ferme éloignée où il reste stationnaire au niveau de l'antenne TV (il ne sera pas recherché si des problèmes de récéption TV ont été perçus). Alors que Maxime est sorti pour voir, son camarade reste terrorisé, presque hystérique, dans la voiture (Maxime dit pouvoir fournir ses coordonnées). Maxime, étonné de l'absence d'autres témoins, se rendra plus tard à la ferme (qui contient notamment un hangar avec des animaux) pour apprendre que le couple qui l'habite n'avait rien remarqué de spécial. Il déclare regretter de ne pas avoir fait de signalement à la gendarmerie. Il évaluera les dimensions de l'objet d'après la hauteur de la ferme.","""Les Aventuriers de l'Etrange"",s1,"""",Sud Radio,2007-04-14",1972-04
https://rr0.org/time/1/9/7/2/04/index.html#1972-04T22:00,Sainte Soulle,,"",,,,1972-04T22:00,", M. X circule en voiture et se trouve à 2 km de son domicile. Dans un virage à hauteur d'un bois, il aperçoit sur la droite une lueur semblant provenir d'une clairière en bordure de route. Arrivé à proximité, il découvre avec stupeur un très grand objet discoïdal surmonté d'un dôme et posé, semble-t-il, sur 4 pieds. Paniqué le témoin cherche à repartir et s'aperçoit alors que les phares sont éteints et que le véhicule est arrêté et ne veut plus démarrer. Il restera sur place pendant 45 mn. Une paralysie progressive gagne les membres et la voix du témoin. Au terme de son attente forcée, dans le silence le plus absolu, il voit un être minuscule et noirâtre, paraissant mince, 1 m de haut, jaillir du bois qui borde la clairière, sauter sur le rebord du disque puis sauter à nouveau pour se fondre littéralement dans le dôme. Aussitôt l'engin décolle en effectuant une ascension pendulaire, s'immobilise quelques secondes entre 50 et 90 m. Puis, d'un trait lumineux, se dirige vers Marans, les marais de Brie et St Michel par le nord. M. X voit ses phares se rallumer, mais reste choqué. Il est hébété, pleurant au volant de son véhicule, incapable de faire un geste. Il est avril 1972 à 22:50, le détecteur magnétique de M. G. (voisin de M. X) se déclenche émettant une sonnerie discontinue. M. G. s'intéresse aux ovnis et il prend sa voiture. Il trouve M. X. et le ramène chez lui, à demi-inconscient. Ce n'est que le lendemain qu'il pourra raconter son histoire et se souvenir. Il reste cependant frappé d'une amnésie partielle ne se souvenant plus des faits passés il y a 6 mois. La mémoire reviendra plusieurs semaines plus tard. Traces nombreuses. Dont une vache dans le pré près du bois d'où sortait l'humanoïde : le fermier la trouvait morte marquée de trois trous bien nets au milieu du front entre les yeux.","OVNI : Le premier dossier complet des rencontres rapprochées en France,s2,""""""Figuet, M."""",""""Ruchon, Jean-Louis"""""",""Alain Lefeuvre, 1979, pp. 384-386 < Van Overmeire, G. : """"Années 1971 et 1972"""" in """"Chronologie OVNI"""""",",1972-04T22:00