description,events,eventType,id,place,sources,time,type,url,place.dirName,place.elevation,place.events,place.id,place.locations,place.name,place.type
"Près de Sheridan, observation d'une apparition fantômatique en robe blanche avec une lumière brilante.","",sighting,1876$,,""""","""",s1,"""",,""A Horrid Phantom""",1876,event,https://rr0.org/time/1/8/7/6/index.html
"en vers le lundi 14 février À , Estelle Faguette est épuisée par sa maladie. Tout à coup, le diable apparaît au pied de son lit. Il est horrible, lui fait des grimaces, quand la Vierge, portant sur la tête un châle de laine bien blanc, apparaît de l'autre côté de son lit. Elle dit à Satan : Que fais-tu là ? Ne vois-tu pas qu'Estelle est revêtue de ma livrée (scapulaire). Et toi Estelle ne crains rien, tu sais bien que tu es ma fille ! L'apparition se répètera à la même heê 4 jours suivants.","",sighting,1876-02$Pellevoisin,,,"",,"",Pellevoisin,place,"",1876-02,event,https://rr0.org/time/1/8/7/6/index.html#1876-02
"en le vendredi 3 mars à 11 h à en 12 (Le 11 selon les sources) Près de la ferme de M. et Mme Crouch, près d', par un ciel complètement pur, des flocons (gélatineux, à l'apparence de chair) de 5 à 10 cm² (20 cm² ?) tombent en averse dense, recouvrant le sol, les arbres et les clôtures, mais limité sur une bande de terrain de 100 yards de long sur 50 yards de large (Le sujet déclenchera une polémique parmi les savants. Le canular sera envisagé puis écarté. Des échantillons seront envoyés à divers scientifiques qui proposeront des explications, du frai asséché de grenouilles au dégorgement d'oiseaux carnassiers ayant trop mangé. La chair fut envisagée être de l'ouês du mouton. ).","",sighting,1876-03$OlympianSpringscomteDeBathKentucky,,,"",,"","Olympian Springs (comté de Bath, Kentucky)",place,"""""""""""""""Mysterious Shower of Meat"""""""", Scientific American supplement, 2"""""","""",s2,"""",,437,"""","""",s3,"""",,New York Times,"""","""",s4,"""",,Scientific American,"""","""",s5,"""",,""Mystery of the 'Red Rains' in Japan"","""","""",s6,"""",,""Singular Showers""",1876-03,event,https://rr0.org/time/1/8/7/6/index.html#1876-03
"en le jeudi 20 avril Près de , une masse météoritique de fer tombe lors d'une forte chute de pluie.","",sighting,1876-04$WolverhamptonAngleterre,,,"",,"","Wolverhampton, Angleterre",place,"""""""London Times, 1876-04-26 < """"""""Notes."""""""" Nature, 13 (1876-04-27)"""""","""",s7,"""",,530-2",1876-04,event,https://rr0.org/time/1/8/7/6/index.html#1876-04
"en Après-midi A , par un temps calme, chaud et étouffant (et des éclairs occasionnels vus tout au long de la journée), Mme Warry et Melle Warry marchent le long du bord d'une falaise surplombant la mer quand, les entourant de tous côtés et s'étendant de plusieurs pouces à plusieurs pieds au-dessus du sol elles voient de nombreux globes de lumière, de la taille de boules de billard, se déplaçant indépendamment et verticalement, vers le haut et le bas, parfois à moins de quelques pouces d'elles, mais sans qu'on puisse jamais les attraper. Les boules étaient toutes embrasées ; mais non brillantes ; avec une superbe iridescence douce, de teinte riche et chaude. Leur nombre fluctuait continuellement. A un moment des milliers d'entre elles enveloppèrent apparement les observatrices, et quelques minutes plus tard les nombres allaient diminuer à peut-être aussi peu que 20, pour bientôt essaimer à nouveau aussi nombreuses que jamais. Pas le plus petit bruit n'accompagna cette apparition. Les dames voient l'étrange spectacle pendant plus de 1 h avant de rentrer chez elles, laissant les lumières toujours dansantes sur la falaise.","",sighting,1876-08$RingsteadBayCoteSudDeLAngleterre,,,"",,"","Ringstead Bay, côte sud de l'Angleterre",place,"""""""The Quarterly Journal, Royal Meteorological Society < Fitzhugh Talman, Charles"""""","""",s8,"""",,""Unsolved Mysteries of Light""",1876-08,event,https://rr0.org/time/1/8/7/6/index.html#1876-08