description,events,eventType,id,place,sources,time,type,url
"Le télescope spatial James Webb révèle que LHS 3844 b — une super-Terre verrouillée par les marées dont le côté jour atteint des températures assez élevées pour faire fondre les métaux — est un monde aride sans atmosphère détectable, semblable à Mercure.","",sighting,2026-05-04$,,""""","""",s1,"""",,Webb space telescope reveals a scorching “super-Earth” that looks like Mercury | ScienceDaily",2026-05-04,event,https://rr0.org/time/2/0/2/6/05/index.html#2026-05-04
"Des astronomes utilisant le télescope spatial James Webb détectent une galaxie massive, formée moins de 2 milliards d'années après le Big Bang, qui n'a apparemment aucune rotation — un trait habituellement observé uniquement chez des galaxies bien plus anciennes et évoluées. Cette découverte remet en question les théories actuelles selon lesquelles les jeunes galaxies devraient encore tourner sur elles-mêmes depuis leur formation.","",sighting,2026-05-06$,,""""","""",s2,"""",,Webb space telescope finds a giant galaxy that doesn’t spin | ScienceDaily",2026-05-06,event,https://rr0.org/time/2/0/2/6/05/index.html#2026-05-06
"Le Pentagone publie la première tranche de fichiers déclassifiés sur les PANs via le système PURSUE (Presidential Unsealing and Reporting System for UAP Encounters), sur ordre du président Donald Trump. Cette première tranche comprend plus de 160 documents, 28 vidéos et 14 images couvrant la période 1947-2026, incluant des témoignages d'astronautes Apollo et des rapports d'enquêtes militaires. L'AARO conclut qu'aucun des phénomènes documentés n'a d'origine extraterrestre confirmée.","",sighting,2026-05-08$,,""""","""",s3,"""",,Pentagon Launches UAP Transparency Effort With First ""PURSUE"" File Release - The Debrief,"""","""",s4,"""",,Presidential Unsealing and Reporting System for UAP Encounters | U.S. Department of War",2026-05-08,event,https://rr0.org/time/2/0/2/6/05/index.html#2026-05-08
"Des astronomes publient, à partir des données du télescope spatial James Webb, la cartographie la plus claire jamais réalisée de la « toile cosmique » — l'immense structure cachée reliant les galaxies à travers l'espace. En analysant plus de 164 000 galaxies dans le cadre du relevé COSMOS-Web, les chercheurs sont parvenus à retracer ce vaste réseau jusqu'à l'époque où l'univers n'avait qu'un milliard d'années.","",sighting,2026-05-11$,,""""","""",s5,"""",,James Webb telescope reveals the clearest map ever of the Universe’s cosmic web | ScienceDaily",2026-05-11,event,https://rr0.org/time/2/0/2/6/05/index.html#2026-05-11
"Des physiciens japonais annoncent une nouvelle méthode permettant de détecter instantanément les insaisissables « états W » de mécanique quantique. Cette avancée pourrait contribuer à débloquer des communications quantiques plus rapides, la téléportation quantique et de nouveaux systèmes de calcul puissants.","",sighting,2026-05-13$,,""""","""",s6,"""",,Quantum breakthrough could revolutionize teleportation and computing | ScienceDaily",2026-05-13,event,https://rr0.org/time/2/0/2/6/05/index.html#2026-05-13
"Elon Musk et SpaceX lancent depuis Starbase (Texas) leur premier vaisseau Starship de nouvelle génération (V3), dans le cadre du vol d'essai Flight 12. L'étage supérieur déploie 22 simulateurs Starlink et amerrit comme prévu dans l'océan Indien, malgré la perte d'un moteur. Le propulseur Super Heavy (Booster 19) échoue en revanche dans sa manœuvre de retour et se désintègre au-dessus du golfe du Mexique. Il s'agit du premier vol des véhicules Block 3, essentiels au programme lunaire Artemis de la NASA.","",sighting,2026-05-22$,,"""SpaceX Starship Flight 12 launch updates"","""",s7,"""",,Starship V3 Ship makes fiery splashdown in Indian Ocean as planned | Space",2026-05-22,event,https://rr0.org/time/2/0/2/6/05/index.html#2026-05-22
"Le Pentagone publie via le système PURSUE la deuxième tranche de fichiers déclassifiés sur les PANs — la première à rassembler les contributions de plusieurs agences : la CIA, l'ODNI, la NASA et le DOE. Cette tranche comprend 222 documents, dont une cinquantaine de vidéos et autant d'enregistrements audio réclamés par les parlementaires, parmi lesquels la destruction par un chasseur F-16C de l'Air National Guard américaine d'un objet non identifié au-dessus du lac Huron en 2023, une formation de quatre PANs au-dessus de l'Iran et un PAN syrien à l'accélération instantanée. Depuis son lancement le vendredi 8, le site WAR.GOV/UFO a reçu plus d'un milliard de visites.","",sighting,2026-05-22$,,""""","""",s8,"""",,Department of War Publishes Second Release of Unidentified Anomalous Phenomena Files on WAR.GOV/UFO > U.S. Department of War > Release | U.S. Department of War,""2nd batch of Pentagon UAP files"","""",s9,"""",,Over 50 videos to watch",2026-05-22,event,https://rr0.org/time/2/0/2/6/05/index.html#2026-05-22
"La collaboration LIGO–Virgo–KAGRA publie la cinquième version de son catalogue de transitoires d'ondes gravitationnelles (GWTC-5.0) : 161 nouveaux signaux — tous issus de fusions de trous noirs — détectés entre le mois précédent et janvier 2025 (seconde partie du 4e cycle d'observation, O4b), portant à 390 le total des détections confirmées depuis la première en 2015. Ce seul cycle d'observation représente les 3/4 de l'ensemble des détections d'ondes gravitationnelles jamais réalisées. Le catalogue établit plusieurs records : le signal le plus net jamais enregistré (GW250114, rapport signal/bruit de 76,9), la localisation la plus précise d'une fusion dans le ciel (GW240615, environ 6 degrés carrés) et la vérification la plus rigoureuse à ce jour du théorème des aires énoncé en 1971 par Stephen Hawking, selon lequel la surface totale des horizons des trous noirs ne peut pas diminuer.","",sighting,2026-05-26$,,"""https"","""",s10,"""",,//ligo.org/gwtc-5-0-updated-ligo-virgo-kagra-catalog-sets-new-records-in-precision-gravitational-wave-astronomy/,"""","""",s11,"""",,The new LIGO–Virgo–KAGRA Catalog sets new records in precision gravitational astronomy – Virgo",2026-05-26,event,https://rr0.org/time/2/0/2/6/05/index.html#2026-05-26
"Des astronomes annoncent avoir résolu, grâce au télescope spatial James Webb, l'énigme vieille de plusieurs décennies de la rotation de Saturne, dont la vitesse apparente semblait varier dans le temps. L'équipe dirigée par Tom Stallard (université de Northumbria) montre que le phénomène ne traduit aucun changement réel de la rotation de la planète, mais l'action de vents d'altitude : les aurores polaires de Saturne chauffent localement la haute atmosphère, ce qui engendre des vents générant des courants électriques qui entretiennent à leur tour les aurores, formant une « pompe à chaleur » planétaire qui s'auto-alimente.","",sighting,2026-05-29$,,""""","""",s12,"""",,Astronomers finally solve Saturn’s decades-long spin mystery | ScienceDaily",2026-05-29,event,https://rr0.org/time/2/0/2/6/05/index.html#2026-05-29