type,events,url,place,time,description,sources,id,place.name,place.org.type,place.org.dirName,place.org.events,place.org.id,place.org.places,place.org.kind,place.org.parent,place.place,place.org,place.place.id,place.place.events,place.place.locations,place.place.elevation,place.place.dirName,place.org.parent.type,place.org.parent.dirName,place.org.parent.events,place.org.parent.id,place.org.parent.places,place.org.parent.kind,place.org.parent.parent.type,place.org.parent.parent.dirName,place.org.parent.parent.events,place.org.parent.parent.id,place.org.parent.parent.places,place.org.parent.parent.kind,place.org.parent.parent.parent.type,place.org.parent.parent.parent.dirName,place.org.parent.parent.parent.events,place.org.parent.parent.parent.id,place.org.parent.parent.parent.places,place.org.parent.parent.parent.kind,place.org.parent.parent.parent.parent,place.org.parent.parent.parent,place.org.parent.parent
case,"",https://rr0.org/time/1/9/7/6/06/index.html#1976-06-13,"Dulce (comté de Rio Arriba, NM)",,,"","",,,1976-06-13,"le Près de témoin (rancher) découvre une de ses vaches (3 ans) morte mutilée, les organes sexuels, oreille, langue et lèvre inférieure enlevés avec un instrument apparemment précis, et portant une suite mystérieuse d'empreintes de sucion comme des coupelles. Il n'y a pas de signe de lutte hormis les traces étranges, ainsi qu'une substance huileuse sur le sol près de la carcasse. La traînée consiste en une série d'indentations à l'apparence de tripode, chacune faisant à peu près 4 pouces de diamètre et étant à 28 pouces des 2 autres traces. Chaque série de marques de tripodes est décrite comme espacées de 28 pouces. La traînée se terminait à environ 500 pieds de la carcasse de l'animal, comme s'ils elles avaient atterri à cet endroit, étaient allées vers la vache, et étaient revenue à cet endroit à ce point. Le propriétaire revenu sur la zone le jour suivant trouve d'autres dépressions sur les traces de pneu faites par son camion le jour d'avant (Le cas sera enquêté par l'inspecteur de bétail et un policier ).",""""",""Offense/Incident Report"",s1,""""""Valdez, G. L."""""",""15 décembre 1976 < Albuquerque Tribune, 15 juin 1976 < Rommel, K. M., Jr.: """"1976 Incidents"""" in """"A Popular History of Livestock Mutilations in New Mexico, Winter 1975 - Spring 1979"""", Operation Animal Mutilation, Report of the district attorney, 1st judicial district, state of New Mexico, juin 1980"",,""""",1976-06-13
case,"",https://rr0.org/time/1/9/7/6/06/index.html#1976-06-18,Barentin (Seine Maritime),,,"","",,,1976-06-18,"le , 2 personnes observent dans le ciel un phénomène lumineux en forme de cigare et d'une grande longueur, volant à basse altitude et à une vitesse régulière selon une trajectoire NE-SO. Aucun bruit ne sera entendu.",""""",,s2,""GEPAN"",,,""""",1976-06-18
case,"",https://rr0.org/time/1/9/7/6/06/index.html#1976-06-22,Bischwiller (Bas-Rhin (Grand Est (France))),org,org/fr/ges/67/67046,"",67046,","""",""48.76777777777777,7.859999999999999"",,",city,org,org/fr/ges/67,"",67,","""",""48.666666666666664,7.583333333333333"",,",department,org,org/fr/ges,"",ges,","""",""48.598888888888894,7.76"",,",region,org,org/fr,"",fr,"",country,,,"","48.76777777777777,7.859999999999999",,,1976-06-22,"le Lancement de Saliout 5. Elle retombera l'année suivante. Observation a Maspalomas (Gran Canarias). le mardi 22 A , plusieurs personnes en voiture observent les déplacements rapides et silencieux, très haut dans le ciel, d'une lueur rouge qui les intrigue. Ce phénomène stationnaire au-dessus du terminal prétrolier serait passé ensuite au-dessus de la raffinerie de Herrlisheim-Drusenheim puis serait parti en direction du Rhin vers l'Allemagne. Un des témoin prendra plusieurs photographies mais la pellicule s'avèrera inexploitable. 2 employés de la raffinerie ont fait savoir qu'ils avaient vu depuis leur domicile un objet brillant dans la direction Est-Nord-Est indiquée par le premier témoin mais aucun des gardiens de service à la raffinerie n'a aperçu d'objet au-dessus de l'établissement.",""""",,s3,""GEPAN"",,,""""",1976-06-22$org_fr_ges_67_67046
case,"",https://rr0.org/time/1/9/7/6/06/index.html#1976-06-25,,1976-06-25,le à le samedi 26,"",1976-06-25
case,"",https://rr0.org/time/1/9/7/6/06/index.html#1976-06-27,,1976-06-27,le Le général Carlos Castro Cavero déclare dans une interview qu'ils croit que les ovnis sont des engins extraterrestres et que des données sont echangées au niveau mondial à leur sujet.,"",1976-06-27