description,events,eventType,id,place,sources,time,type,url,place.dirName,place.elevation,place.events,place.id,place.locations,place.name,place.sources,place.type
"dimanche 20 mai Lors de l'éruption du , les longerons de bateaux sur des miles à la ronde du volcan sont constellés de corposants. Un capitaine qui se trouve à 10 miles de l'éruption, parlera d'une étrange flamme rosée dans l'éruption venant des nuages, qui semblait toucher les têtes de mâts et yardarms.","",sighting,1883-05$KrakatoaIndonesie,,,"",,"",Krakatoa (Indonésie),"",place,"""""""Fitzhugh Talman, Charles"""""","""",s1,"""",,""Unsolved Mysteries of Light""",1883-05,event,https://rr0.org/time/1/8/8/3/index.html#1883-05
"Au-dessus d'une voie ferrée près de , nombre de personnes observent une rumière récurrente.","",sighting,1883$AmsterdamNewYork,,,"",,"",Amsterdam (New York),"",place,""""","""",s2,"""",,Article du Daily Advertiser de Boston (Massachusetts)",1883,event,https://rr0.org/time/1/8/8/3/index.html
"dimanche 12 août à 08 h à 10 Depuis l'observatoire de , le professeur Don José Arbol y Bonilla (astronome), observe 283 petits phénomènes lumineux passer devant le disque solaire. lundi 13 août à 08:30 à 9 Bonilla et ses associés effectuent des observations semblables à la veille, et compte 116 objets entre la Lune et la Terre. vendredi 17 août A Aarau (Suisse), une pluie de foin tombe ; le foin avait été enlevé par une trombe d'un champ fraîchement fauché.","",sighting,1883-08$ZacatecasMexique,,,"",,"",Zacatecas (Mexique),"",place,"""José A. y Bonilla"","""",s3,"""",,""Passage sur le disque solaire d'un essaim de corpuscules,"""","""",s4,"""",,S.P.A.C.E. n° 49 < LUFORO Bulletin,"""","""",s5,"""",,",1883-08,event,https://rr0.org/time/1/8/8/3/index.html#1883-08
"mardi 16 octobre Nuage forme d'une matière solide, laineuse - Bordeaux, le 18 octobre 1883 - Monsieur, un habitant de la ville libre de Montussan (Gironde), m'informe d'un phénomène dont, lundi dernier, il a été témoin. Le 16 octobre dans l'après-midi, par un temps humide et un vent violent, il a vu, flottant dans l'air, un nuage épais de touffes blanches. Ces touffes, dont certaines étaient de la taille d'un poing, se brisèrent lentement et s'accrochèrent sur les branches des arbres ou tombèrent au sol. Ces touffes, dit le témoin, semblaient être d'ouate ou de laine. Cette averse dura près de 2 heures. Un échantillon de ces touffes me fut apporté. Je vous le transmet ci-joint dans l'espoir que ce phénomène vous intéressera. Cela me semble avoir une certaine similitude avec l'averse de foin mentionnée dans un des derniers numéros de La Nature. Je vous transmet cet incident simplement tel qu'il m'a été raconté. Sincèrement, etc. Francis Dussaut. Note - La matière que notre correspondant nous a envoyé est blanche : elle brûle sous une flamme. Vu à travers un microscope, elle est formée de filaments emmêlés semblables aux fils de la Vierge, de sorte qu'il pourrait se révéler que le nuage en question ait constitué une agglomération extraordinaire. G.T.. mercredi 24 octobre A , un météore tombe sur une machine à scier, semblable à un pied de biche.","",sighting,1883-10$VillaldamaMexique,,,"",,"",Villaldama (Mexique),"",place,""""","""",s6,"""",,La Nature (Correspondance),"""","""",s7,"""",,""Villaldama Vim"","""","""",s8,"""",,""Premila Lie""",1883-10,event,https://rr0.org/time/1/8/8/3/index.html#1883-10
"vendredi 5 octobre Au , un objet lumineux de la taille de Lune est visible durant 90.","",sighting,1883-11$Chili,,,"",,"",Chili,"",place,""""","""",s9,"""",,Fort",1883-11,event,https://rr0.org/time/1/8/8/3/index.html#1883-11
"jeudi 27 décembre 1883 soirée A , observation d'un carré lumineux","",sighting,1883-12$NewcomerstownOhio,,,"",,"",Newcomerstown (Ohio),"",place,""""","""",s10,"""",,""A Mysterious Visitant""",1883-12,event,https://rr0.org/time/1/8/8/3/index.html#1883-12
"par temps clair, des gardes-côtes installés sur le phare de observent les manœuvres de la goélette J.-C. Cousins, longue de 26 m, qui fait route vers l'ouest. Brusquement, elle vire de bord et pique droit sur un banc de sable, les voiles correctement bordées. Au moment du choc contre le banc de sable, les mâts oscillent violemment. Aucune silhouette ne se jette à l'eau. Aucun signal signal de détresse n'est observé et aucune embarcation n'est mise à l'eau. Lorsque l'on monte à bord, le pont est désert. Les embarcations se trouvent toujours sur leurs berceaux et tout est en ordre. Dans la cuisine, le poêle est encore chaud. L'eau dans laquelle des pommes de terre avaient été mises à bouillir s'est évaporée. De plus, un repas est servi dans la cabine, mais personne n'y a touché. Dans le poste d'équipage, le même ordre règne et la dernière inscription sur le journal de bord — datant du lever du jour — ne signale rien de particulier.","",sighting,1883$CanbyOregon,,,"",,"",Canby (Oregon),"",place,"""""""Gaston, P."""""","""",s11,"""",,""De formidables enigmes sur la mer""",1883,event,https://rr0.org/time/1/8/8/3/index.html
"Lors de l'éruption de Perbuatan, dans l' (détroit de la Sonde), 2 astronomes observent un signal émis depuis 61 du Cygne. Certains avancèrent que des intelligences extraterrestres veulent ainsi communiquer avec la Terre. L'explosion pulvérise l'île. Le bruit est entendu jusqu'en Australie, c'est-à-dire à plus de 4000 km, comme si l'on avait entendu de Paris une explosion survenue à New York. Le gigantesque nuage de poussière volcanique soulevé dans la stratosphère fait plusieurs fois le tour du globe au cours des mois qui suivent, dont le premier en une douzaine de jours. Les effets de cette poussière créent des soleils verts. On observe des taches dans le ciel, vert-gris, rouge sang, couleur de cuivre rouge ou de cuivre clair... Un raz de marée, une vague de 40 m de haut, balaye les côtes de Java et Sumatra, engloutissant 300 villes et noyant 36000 personnes.","",sighting,1883$ileDeKrakatau,,,"",,"",île de Krakatau,"",place,"",1883,event,https://rr0.org/time/1/8/8/3/index.html
"En France, les frères Tissandier font voler une machine équipée d'un moteur électrique.","",sighting,1883$,,"",1883,event,https://rr0.org/time/1/8/8/3/index.html