url,place,time,description,sources
https://rr0.org/time/1/8/4/5/index.html,,1845,"1845-03-16 A Shanghai, pluie de poudre olivâtre. 1845-03-29 11:50 A Londres (Angleterre), dans un ciel clair, Ab. Goddart observe une lueur floue jaune clair, stationnaire. Au téléscope le phénomène apparaît comme un brouillard composé de 4 lumières étincelantes comme des étoiles oranges en son centre. Le phénomène disparaît au bout de 2 mn Journal anglais < L'inst. n° 590 < Annalen der Physik und Chemie, Erg. IV, Leipzig, 1854, p. 107 < Deliyannis, Y.: ""Re: 1845: an orange foggy light in London according to Adamski and Leslie..."", Magonia Exchange, 22 juillet 2008 Leslie, D. & Adamski, G.: Les Soucoupes Volantes ont atterri, J'ai Lu 1971, p. 35 Inforespace n° 4, 1972, p. 39.",""
https://rr0.org/time/1/8/4/5/index.html,,1845,"1845-04-01 En Lithuanie, un orage est accompagné de la chute de grandes masses gélatineuses.",""
https://rr0.org/time/1/8/4/5/index.html,,1845,"1845-05-11 Le signor Capocci de l'observatoire de Capodimonte à Naples (Italie) fait une observation Docteur Wolf de l'observatoire de Zurich (Suisse), 1863.",""
https://rr0.org/time/1/8/4/5/index.html,,1845,"1845-06-07 A Darmstadt, chute de mâchefer ordinaire. 1845-06-18 Du brigantin Victoria au large d'Adalie (Asie mineure), on voit à 40 m, 3 corps lumineux sortir de l'océan et rester visibles P10M. 30 mn après le coucher du soleil A Ainab, sur le mont Liban, on voit un météore composé de 2 corps, chacun en apparence 5 fois au moins aussi gros que la Lune, avec des appendices semblables à de grands pavillons agités par la brise et qui semblent les réunir. Ce grand météore reste visible pendant P1H. Il s'avance vers l'est et disparait graduellement ; la Lune s'est levée à peu près 1 h auparavant Sestier: La Foudre et ses formes, t. 1, p. 204 < Flammarion, Camille: Etudes et Lecture sur L'Astronomie, Tome 5, 1874, p. 151",""
https://rr0.org/time/1/8/4/5/index.html,,1845,"1845-10-16,1845-10-17 Une terrifiante pluie rouge s'abat sur la France.",""
https://rr0.org/time/1/8/4/5/index.html,,1845,"En Asie mineure, pendant un orage, de grandes masses gélatineuses tombent.",""