url,place,time,description,sources,id,place.name,place.org.name,place.org.surname,place.org.title,place.org.time,place.org.deprecated,place.org.note,place.org.place,place.org.description,place.org.sources,place.org.tags,place.org.image,place.org.id,place.org.dirName,place.org.url,place.org.events,place.org.type,place.org.places,place.org.kind,place.org.parent,place.place,place.org,place.place.name,place.place.surname,place.place.title,place.place.time,place.place.deprecated,place.place.note,place.place.place,place.place.description,place.place.sources,place.place.tags,place.place.image,place.place.id,place.place.dirName,place.place.url,place.place.events,place.place.type,place.place.locations,place.place.elevation,place.org.parent.name,place.org.parent.surname,place.org.parent.title,place.org.parent.time,place.org.parent.deprecated,place.org.parent.note,place.org.parent.place,place.org.parent.description,place.org.parent.sources,place.org.parent.tags,place.org.parent.image,place.org.parent.id,place.org.parent.dirName,place.org.parent.url,place.org.parent.events,place.org.parent.type,place.org.parent.places,place.org.parent.kind,place.org.parent.parent.name,place.org.parent.parent.surname,place.org.parent.parent.title,place.org.parent.parent.time,place.org.parent.parent.deprecated,place.org.parent.parent.note,place.org.parent.parent.place,place.org.parent.parent.description,place.org.parent.parent.sources,place.org.parent.parent.tags,place.org.parent.parent.image,place.org.parent.parent.id,place.org.parent.parent.dirName,place.org.parent.parent.url,place.org.parent.parent.events,place.org.parent.parent.type,place.org.parent.parent.places,place.org.parent.parent.kind,place.org.parent.parent.parent.name,place.org.parent.parent.parent.surname,place.org.parent.parent.parent.title,place.org.parent.parent.parent.time,place.org.parent.parent.parent.deprecated,place.org.parent.parent.parent.note,place.org.parent.parent.parent.place,place.org.parent.parent.parent.description,place.org.parent.parent.parent.sources,place.org.parent.parent.parent.tags,place.org.parent.parent.parent.image,place.org.parent.parent.parent.id,place.org.parent.parent.parent.dirName,place.org.parent.parent.parent.url,place.org.parent.parent.parent.events,place.org.parent.parent.parent.type,place.org.parent.parent.parent.places,place.org.parent.parent.parent.kind,place.org.parent.parent.parent.parent,place.org.parent.parent.parent
https://rr0.org/time/1/8/4/5/index.html#1845-03,Shanghai,,,,,,,,,,,,,,,,"",place,"",,1845-03,"en le dimanche 16 A , pluie de poudre olivâtre. le samedi 29 11:50 A Londres (Angleterre), dans un ciel clair, Ab. Goddart observe une lueur floue jaune clair, stationnaire. Au téléscope le phénomène apparaît comme un brouillard composé de 4 lumières étincelantes comme des étoiles oranges en son centre. Le phénomène disparaît au bout de 2 mn.","""Re: 1845: an orange foggy light in London according to Adamski and Leslie..."",s1,""""""Journal anglais < L'inst. n° 590 < Annalen der Physik und Chemie, Erg. IV, Leipzig, 1854, p. 107 < Deliyannis, Y."""""",Magonia Exchange,-22,Les Soucoupes Volantes ont atterri,s2,""""""Leslie, D."""",""""Adamski, G."""""",""J'ai Lu 1971, p. 35"",,Inforespace n° 4,s3,"""",""1972, p. 39"",",1845-03
https://rr0.org/time/1/8/4/5/index.html#1845-04,Lithuanie,,,,,,,,,,,,,,,,"",place,"",,1845-04,"en le le lendemain En , un orage est accompagné de la chute de grandes masses gélatineuses.","",1845-04
https://rr0.org/time/1/8/4/5/index.html#1845-05,Naples (Italie),,,,,,,,,,,,,,,,"",place,"",,1845-05,en le dimanche 11 Le signor Capocci de l'observatoire de Capodimonte à fait une observation.,"Docteur Wolf de l'observatoire de Zurich (Suisse),s4,"""",,1863",1845-05
https://rr0.org/time/1/8/4/5/index.html#1845-06,Darmstadt,,,,,,,,,,,,,,,,"",place,"",,1845-06,"en le samedi 7 A , chute de mâchefer ordinaire. le mercredi 18 Du brigantin Victoria au large d'Adalie (Asie mineure), on voit à 40 m, 3 corps lumineux sortir de l'océan et rester visibles 10 minutes. le jeudi 30 A Ainab, sur le mont Liban, on voit un météore composé de 2 corps, chacun en apparence 5 fois au moins aussi gros que la Lune, avec des appendices semblables à de grands pavillons agités par la brise et qui semblent les réunir. Ce grand météore reste visible pendant 1 heure. Il s'avance vers l'est et disparait graduellement ; la Lune s'est levée à peu près 1 h auparavant","La Foudre et ses formes,s5,""Sestier"",""t. 1, p. 204 < Flammarion, Camille: Etudes et Lecture sur L'Astronomie, Tome 5, 1874, p. 151"",",1845-06
https://rr0.org/time/1/8/4/5/index.html#1845-10,,1845-10,en le jeudi 16 Une terrifiante pluie rouge s'abat sur la France.,"",1845-10
https://rr0.org/time/1/8/4/5/index.html,,1845,"En Asie mineure, pendant un orage, de grandes masses gélatineuses tombent.","",1845