type,events,url,place,time,description,sources,id,place.name,place.org,place.place.id,place.place.events,place.place.locations,place.place.elevation,place.place.dirName,place.org.type,place.org.dirName,place.org.events,place.org.id,place.org.places,place.org.kind,place.org.parent.type,place.org.parent.dirName,place.org.parent.events,place.org.parent.id,place.org.parent.places,place.org.parent.kind,place.org.parent.parent.type,place.org.parent.parent.dirName,place.org.parent.parent.events,place.org.parent.parent.id,place.org.parent.parent.places,place.org.parent.parent.kind,place.org.parent.parent.parent.type,place.org.parent.parent.parent.dirName,place.org.parent.parent.parent.events,place.org.parent.parent.parent.id,place.org.parent.parent.parent.places,place.org.parent.parent.parent.kind,place.org.parent.parent.parent.parent,place.org.parent,place.place,place.org.parent.parent.parent,place.org.parent.parent
case,"",https://rr0.org/time/1/9/6/3/05/index.html#1963-05-07,,1963-05-07,2 moteurs et le fuselage arrière déchiqueté de l'A-12 écrasé le 24 le Lancement du satellite Telstar 2.,""""",CIA < Pangloss Films < ""Stranded Far From Area 51"",s1,"""",National Geographic,20,""""",1963-05-07
case,"",https://rr0.org/time/1/9/6/3/05/index.html#1963-05-09,,1963-05-09,"le Signature de l'Accord de Statut des Forces entre entre le Gouvernement Australien et le Gouvernement des USA, concernant le Status des Forces des Etats-Unis en Australie.",""""",,s2,"""",,1963,"""","""",,s3,"""",,1966,""""",1963-05-09
case,"",https://rr0.org/time/1/9/6/3/05/index.html#1963-05-15,,1963-05-15,"le Leroy Gordon Cooper effectue 22 orbites à bord de la dernière capsule Mercury, battant ainsi le le record du plus long vol spatial : 34 h et 20 mn, à bord de Faith-7. Lors de l'orbite finale, il avertit la station radio à Terre près de Perth qu'un objet verdâtre s'approche de lui en se déplaçant d'Est en Ouest, dans le sens contraire des orbites effectuée par l'homme à cette époque. Le phénomène est également repéré par le matériel de détection de Perth. NBC propage le rapport et prévoit d'interviewer Cooper, qui ne dit rien et renvoie aux la déclaration officielle annoncée par la NASA. Mais aucune déclaration de viendra de la NASA.","",1963-05-15
case,"",https://rr0.org/time/1/9/6/3/05/index.html#1963-05-18,New Plymouth (Nouvelle Zélande),,,"","",,,1963-05-18,le Observation à.,""""",,s4,"""",,8360,""""",1963-05-18
case,"",https://rr0.org/time/1/9/6/3/05/index.html#1963-05-22,Pequannock (New Jersey),,,"","",,,1963-05-22,le Observation à.,""""",,s5,"""",,8363,""""",1963-05-22
case,"",https://rr0.org/time/1/9/6/3/05/index.html#1963-05-24,Wendover (Utah) s6McIninch,,,"","",,,1963-05-24,"le Un A-12/Oxcart (n° 123) testé depuis Groom Lake s'écrase à cause des gelures du pilote à 14 miles au sud de. Le pilote, Ken Collins, s'éjecte et atterrit sain et sauf, avant d'être récupéré par 3 hommes du coin. Il leur raconte qu'il pilotait un F-105 qui embarquait une arme nucléaire. 100 hommes sont dépéchés pour nettoyer la zone du crash. Il sera dit à la presse qu'un F-105 s'était écrasé, et en 2011, l'Air Force liste toujours l'incident comme tel.",""""",Area 51,s7,""""""Jacobsen, Annie"""""",""Orion (Londres), 2011"",197,""""",1963-05-24