url,place,time,description,sources,id,place.name,place.org.name,place.org.surname,place.org.title,place.org.time,place.org.deprecated,place.org.note,place.org.place,place.org.description,place.org.sources,place.org.notes,place.org.tags,place.org.image,place.org.id,place.org.dirName,place.org.url,place.org.events,place.org.type,place.org.parent,place.org.places,place.org.kind,place.place,place.org,place.place.name,place.place.surname,place.place.title,place.place.time,place.place.deprecated,place.place.note,place.place.place,place.place.description,place.place.sources,place.place.notes,place.place.tags,place.place.image,place.place.id,place.place.dirName,place.place.url,place.place.events,place.place.type,place.place.parent,place.place.locations,place.place.elevation,place.org.parent.name,place.org.parent.surname,place.org.parent.title,place.org.parent.time,place.org.parent.deprecated,place.org.parent.note,place.org.parent.place,place.org.parent.description,place.org.parent.sources,place.org.parent.notes,place.org.parent.tags,place.org.parent.image,place.org.parent.id,place.org.parent.dirName,place.org.parent.url,place.org.parent.events,place.org.parent.type,place.org.parent.parent.name,place.org.parent.parent.surname,place.org.parent.parent.title,place.org.parent.parent.time,place.org.parent.parent.deprecated,place.org.parent.parent.note,place.org.parent.parent.place,place.org.parent.parent.description,place.org.parent.parent.sources,place.org.parent.parent.notes,place.org.parent.parent.tags,place.org.parent.parent.image,place.org.parent.parent.id,place.org.parent.parent.dirName,place.org.parent.parent.url,place.org.parent.parent.events,place.org.parent.parent.type,place.org.parent.parent.parent.name,place.org.parent.parent.parent.surname,place.org.parent.parent.parent.title,place.org.parent.parent.parent.time,place.org.parent.parent.parent.deprecated,place.org.parent.parent.parent.note,place.org.parent.parent.parent.place,place.org.parent.parent.parent.description,place.org.parent.parent.parent.sources,place.org.parent.parent.parent.notes,place.org.parent.parent.parent.tags,place.org.parent.parent.parent.image,place.org.parent.parent.parent.id,place.org.parent.parent.parent.dirName,place.org.parent.parent.parent.url,place.org.parent.parent.parent.events,place.org.parent.parent.parent.type,place.org.parent.parent.parent.parent,place.org.parent.parent.parent.places,place.org.parent.parent.parent.kind,place.org.parent.parent.places,place.org.parent.parent.kind,place.org.parent.places,place.org.parent.kind,place.org.parent.parent.parent,place.org.parent.parent
https://rr0.org/time/1/9/5/2/07/28/index.html#1952-07-28T02:15,New York City,,,,,,,,,,,,,,,,,"",place,,"",,1952-07-28T02:15,"La photographie de August C. Roberts à ce jour-là, expliquée par la suite comme un reflet d'objectif (lens flare) le A la base de l'USAF de MacChord (Washington), le sergent/T Walstead et le S/sergent Calkins du 635ème escadron AC&W observent 1 boule pulsant un bleu-vert terne, de la taille d'une pièce de 10 cents à bout de bras, voler très rapidement et horizontalement.","Cas Blue Book n° 1708 non expliqué,s1,"""",,",1952-07-28T02:15
https://rr0.org/time/1/9/5/2/07/28/index.html#1952-07-28T06:00,MacGuire (New Jersey),,,,,,,,,,,,,,,,,"",place,,"",,1952-07-28T06:00,"le A la base USAF de , l'opérateur de Contrôle d'Approche au Sol et sergent/M W. F. Dees ainsi que des personnes dans la tour de contrôle de la base détectent un grand groupe d'échos très distincts. L'observation visuelle est celle d'objets allongés sans ailes ni empennage, effectuant un tour très rapide et ayant adopté à un moment une formation en échelon. L'épisode entier dure 55 minutes.","Cas Blue Book n° 1707 non expliqué,s2,"""",,",1952-07-28T06:00
https://rr0.org/time/1/9/5/2/07/28/index.html,Jersey City (New Jersey),,,,,,,,,,,,,,,,,"",place,,"",,1952-07-28,"A , August Roberts, en compagnie de James Leyden, en poste sur une tour de surveillance du ciel du GOC, photographie 1 phénomène ayant l'aspect d'un disque lumineux orange qui oscille bord sur bord.","Black-out sur les Soucoupes Volantes,s3,""""""Guieu, J."""""",""Fleuve Noir 1956, pp. 39, 64 et 65"",,""In the Beginning..."" in Schockingly Close to the Truth!,s4,""""""Moseley, J. W."""",""""Pflock, K. T."""""",p. 31,",1952-07-28
https://rr0.org/time/1/9/5/2/07/28/index.html,,1952-07-28,Winston Churchill se soucie du phénomène ovni et interroge le Ministre de l'Air britannique sur le sujet.,"",1952-07-28
https://rr0.org/time/1/9/5/2/07/28/index.html#1952-07-28T22:20,Heidelberg (Allemagne de l'Ouest),,,,,,,,,,,,,,,,,"",place,,"",,1952-07-28T22:20,"le , le sergent B. C. Grassmoen et le WAC Pfc. A. P. Turner observent 1 objet en forme de soucoupe semblant de métal léger émettant des éclairs de lumière blanche, voler lentement, faire un tour à 90° et effectuer une ascension rapide au bout de 4 à 5 mn.","Cas Blue Book n° 1700 non expliqué,s5,"""",,",1952-07-28T22:20
https://rr0.org/time/1/9/5/2/07/28/index.html,,1952-07-28,"Dans le Wisconsin et le Minessota, le radar d'Interception de Contrôle au sol, un pilote de l'USAF et des membres dur GOC repèrent diverses objets non-identifiés.","",1952-07-28
https://rr0.org/time/1/9/5/2/07/28/index.html,,1952-07-28,Article du Washington Post.,"",1952-07-28