url,place,dateTime,description,sources,id,place.name,place.org.dirName,place.org.code,place.org.places,place.org.kind,place.org.parent,place.place,place.org,place.place.locations,place.place.elevation,place.place.dirName,place.place.data,place.org.parent.dirName,place.org.parent.code,place.org.parent.places,place.org.parent.kind,place.org.parent.parent.dirName,place.org.parent.parent.code,place.org.parent.parent.places,place.org.parent.parent.kind,place.org.parent.parent.parent.dirName,place.org.parent.parent.parent.code,place.org.parent.parent.parent.places,place.org.parent.parent.parent.kind,place.org.parent.parent.parent.parent,place.org.parent.parent.parent,place.org.parent.parent
https://rr0.org/time/1/9/1/3/index.html#1913-01,Dover,,"",,,,1913-01,"Un ""aéronef fantôme"" tel qu'il aurait été photographié cette année-là avril 1913 A , 3 pêcheurs voient un dirigeable, doté d'une lumière, s'approcher de la mer et voler vers le nord-est (vers l'Atlantique ?). Il vole à grande vitesse malgré un fort vent d'ouest. mai 1914 à 16:45 Le capitaine L. Lindsay, commissaire de police de la Glamorganshire (Wales), voit un aéronef voler au-dessus de Cardiff, traînant derrière lui une grande masse de fumée et remarque qu'il est bien plus gros et plus rapide que le dirigeable local de marque Willow. 30 mn plus tard, Steven Morgan voit un engin semblable traîî de la fumée au-dessus de Merthyr, 48 km plus loin — ce qui implique une très grande vitesse de déplacement pour un dirigeable de l'époque. Le soir A Dunedin (Nouvelle Zélande), observation d'un aéronef passant au-dessus de la ville. ""L'ombre noire de l'aéronef"", carte de cette année-là décrivant la portée, depuis la base supposée de dirigeables de Heligoland (Allemagne) des Zeppelins (cercle le plus externe à 600 miles) et des aéroplanes (300 miles) Une ville de la province canadienne de Saskatchewan est le théâtre d'un défilé de lumières rougeoyantes observé par des centaines de témoins. On commence à parler d'aéroplanes fantômes et non plus de dirigeables comme dans les années précédentes.","""The Phantom Airships of 1913"",s1,""""""Clark, Jerome E."""",""""Farish, Lucius"""""",""UFO Report de Saga, vol. 1, n° 6, Eté 1974, p. 36."",,UFO: The Complete Sightings,s2,""""""Brookesmith, Peter"""""",""Barnes & Noble Inc., New York, N.Y., 1995, p. 28 < Trainor, Joseph: UFO Roundup, vol 7, n° 4"",,Otago Daily Times < ""That Mysterious Airship"",s3,"""",Argus de Grey River (Nouvelle-Zélande),,""Nearly a century of circles"",s4,"""",Airminded,",1913-01
https://rr0.org/time/1/9/1/3/index.html,Sheboygan (Wisconsin),,"",,,,1913,"Un grand objet en forme de cigare survole lentement Milwaukee et , faisant clignoter ses projecteurs sur les rues et les habitations, puis se retire vers le Lac Michigan.","UFO Roundup,s5,"""",4-36,",1913
https://rr0.org/time/1/9/1/3/index.html#1913-02,Yorkshire,,"",,,,1913-02,"septembre 1913 On observe une procession de météores en formation passer à l'horizontale au-dessus du Canada et de l'est de Etats-Unis. Ils restent visibles sur un parcours de plus de 9000 km. Tout au long de leur parcours, on entend de grosses explosions, des détonations, et on ressent des secousses sismiques. Observations dans le. Premières observations en Belgique et en Hollande. En France, on accuse des dirigeables allemands d'espionner la frontière orientale. mardi 21 21 h ou 1913 21:30 Des lumières et des engins sont observés au-dessus de Warnwickshire et de Norfolk. Un airship est observé par deux hommes draguant la rRiver Ouse à Beningborough (Yorkshire). Les hommes revoient l'airship à 4 h du matin le jour suivant et l'observent durant 30 mn.","Chant (professeur),s6,"""",,",1913-02
https://rr0.org/time/1/9/1/3/index.html#1913-03,Tarnowitz (Prusse),,"",,,,1913-03,"avril 1913 Les apparitions débutent en Allemagne. Un dirigeable visite. Au lac Schwielow, un dirigeable en feu est observé s'écrasant dans la forêêhe. Cependant, après de sérieuses recherches, on ne retrouve aucune épave..","""Meteor Explodes At Sea / Gives Passengers on Steamship a Bad Fright"",s7,"""",""Tribune de New York 30 mars 1913, p. 11"",",1913-03
https://rr0.org/time/1/9/1/3/index.html#1913-05,"Shelby (Yorkshire, Angleterre)",,"",,,,1913-05,"juin 1914 A , un appareil aérien est observé faisant de la reconnaissance pendant 1 h.","""Air Spies Startle Britain"",s8,"""",Evening Gazette de Indiana (Pennsylvanie),",1913-05
https://rr0.org/time/1/9/1/3/index.html,,1913,Train express dont les fenêtres sont illuminées.,",s9,""""""Denning, W. F. (astronome)"""""",,,Pottier,s10,"""",,1974",1913
https://rr0.org/time/1/9/1/3/index.html#1913-06,Benton Harbor (Michigan),,"",,,,1913-06,"Eté jeudi 23 05:30 Près de , observation d'un ""zeppelin"". juillet 1913 juin 1913 ou juillet 1913 Près de la rivière Saint Joseph (près de Benton Harbor, Michigan), observation d'un grand aéronef. Fin de l'été entre 1913 21 h et 1913 22 h En Moravie (Tchécoslovaquie), un jeune homme de 20 ans voyage depuis Brnoyto Zidence par temps clair, voit 6 objets très haut dans le ciel ressemblant à de grandes étoiles rouges flamboyantes, se déplaçant sans bruit autour d'un point fixe dans le sens des aiguilles d'une montre. Cette formation d'""étoiles"" suit une orbite elliptique d'un diamètre apparent de 1 m (le témoin détermine cela en tendant son bras). Il observe le phénomène durant 6 à 8 mn, puis reprend son chemin sans attendre la fin.","""Phantom Airship Rides High In Skies"",s11,"""",News-Palladium de Benton Harbor (Michigan),,""Phantom Ships Float On High"",s12,"""",News-Palladium de Benton Harbor (Michigan),,Phénomènes Spatiaux n° 11,s13,""""""Chaloupek, H."""""",,1967",1913-06
https://rr0.org/time/1/9/1/3/index.html#1913T20:00,Auggedal (Norvège),,"",,,,1913T20:00,"Automne , des personnes voient une boule lumineuse arriver du sud avec un sifflement dans leur direction. Elle passe entre eux et une grange, à 10 m. La boule est de la taille d'un ballon de rugby, et le passage entre la grange et les témoins se fait à une hauteur de 5 à 6 m au-dessus du sol. Puis la boule remonte et disparaît au-dessus d'une colline. L'objet brillait fortement. Les témoins sont P.O. Møller, Tor Flatum et Gunn Berget. La totalité de l'observation a duré 40 s environ, durant lesquelles la boule lumineuse a parcouru une dizaine de km.","UFO report form,s14,"""",,",1913T20:00