url;place;dateTime;description;sources;id;place.name;place.org;place.place.locations;place.place.elevation;place.place.dirName;place.place.data
https://rr0.org/time/1/9/7/2/12/index.html;;1972-12;Lancement de la mission Apollo 17.;"";1972-12
https://rr0.org/time/1/9/7/2/12/index.html;;1972-12;1972-12-10 17:30 A Imjarvi (Finlande) Aarno Heinonen marche dans une région boisýe en chemin pour rendre visite à un voisin lorsqu'il repýre un objet en survol avec un dýme rouge brillant au sommet. L'objet semble atterrir parmis des bouleaux voisins. Le témoin effrayý court à la maison de son voisin. 1972-12-10 19:30 En rentrant chez lui il rencontre un vent très fort à l'endroit-même où il a vu l'objet. Le vent devient plus fort et le témoin voit une humanoïde femelle habillée de výtements jaunes luisants approcher depuis des arbres voisins. L'être semble flotter au-dessus du sol, un rayon de lumière brillant sortant de ses chaussures. Elle dit au témoin de ne pas avoir peur. Pendant cet incident le témoin reçoit une étrange pierre en forme d'oeuf HC addition # 859 Anders Liljegren, FSR Vol. 26 # 5;"";1972-12
https://rr0.org/time/1/9/7/2/12/index.html;;1972-12;Apollo 17 se pose près du cratýre Littrow. L'astronaute-gýologue Harrison Schmitt aperýoit un ýclair à la surface de la Lune.;"";1972-12
https://rr0.org/time/1/9/7/2/12/index.html;;1972-12;Retour de la mission Apollo 17. Fin du programme lunaire habitý.;"";1972-12
https://rr0.org/time/1/9/7/2/12/index.html;;1972-12;La famille Mýchinaud disparaýt alors qu'elle se rend à Boutiers (Charente) en voiture, après un rýveillon passé chez des amis à Cognac, à 4 km de là.;"";1972-12
https://rr0.org/time/1/9/7/2/12/index.html;;1972-12;Mort de Harry Truman.;"";1972-12