description,events,eventType,id,place,sources,time,type,url,place.dirName,place.elevation,place.events,place.id,place.locations,place.name,place.org._parent,place.org.events,place.org.id,place.org.kind,place.org.places,place.org.type,place.org._parent._parent._parent._parent,place.org._parent._parent._parent.events,place.org._parent._parent._parent.id,place.org._parent._parent._parent.kind,place.org._parent._parent._parent.places,place.org._parent._parent._parent.type,place.org._parent._parent.events,place.org._parent._parent.id,place.org._parent._parent.kind,place.org._parent._parent.places,place.org._parent._parent.type,place.org._parent.events,place.org._parent.id,place.org._parent.kind,place.org._parent.places,place.org._parent.type,place.org._parent._parent,place.org._parent._parent._parent
"en Couverture de Wonder Stories Quaterly n° 3, vol. 3 du printemps Aux Etats-Unis, plus de 13 millions de chômeurs, et presque toutes les banques sont fermées.","",sighting,1932-03$,,""""","""",s1,"""",Jim < UFOPOP,,Klotz",1932-03,event,https://rr0.org/time/1/9/3/2/index.html#1932-03
en Disparition de l'équipage du Baychino.,"",sighting,1932-04$,,"""""""Gaston, P."""""","""",s2,"""",""chap. 1 de Disparitions Mystérieuses, 1973"",46,""De formidables enigmes sur la mer""",1932-04,event,https://rr0.org/time/1/9/3/2/index.html#1932-04
en le mardi 3 mai Mort de Charles Hoyt Fort. Photo de Sutton.,"",sighting,1932-05$,,"",1932-05,event,https://rr0.org/time/1/9/3/2/index.html#1932-05
"Au large des côtes du , l'avion du lieutenant-colonel Peter Grunnet et du lieutenant Tage Anderson de la RDAF est suivi par un ovni. Cela ne ressemblait en rien aux machines de l'époque, se souvient Grunnet, c'était de forme hexagonale, plat, en aluminium, avec une surface complètement lisse et dépourvue de rivets. Ca m'a fait froid dans le dos, je ne sais pas pourquoi. Quel que soit l'être qui se trouvait à bord du vaisseau, c'est comme si j'avais senti sa présence... une présence hostile...","",sighting,1932$Groenland,,,"",,"",Groenland,"",1932,event,https://rr0.org/time/1/9/3/2/index.html
Nov Réélection de Franklin Delano Roosevelt.,"",sighting,1932$,,"",1932,event,https://rr0.org/time/1/9/3/2/index.html