url;place;dateTime;description;sources;id
https://rr0.org/time/1/9/4/9/02/index.html;;1949-02;Le journaliste Sidney Shallet est contacté par les gens du projet Grudge pour décrédibiliser le phénomène ovni.;"";1949-02
https://rr0.org/time/1/9/4/9/02/index.html;;1949-02;A Los Alamos (Nouveau-Mexique), lors d'une conférence de scientifiques, on conclut que le phénomène des boules de feu vertes est un phénomène naturel, de nature cependant inconnue.;"";1949-02
https://rr0.org/time/1/9/4/9/02/index.html;;1949-02;A Nule (Chili) près de Valparaiso, un couple et leurs 2 filles sont réveillés par une lueur intense éclairant à travers les volets. Ils voient un octaèdre de 5 ou 6 m de diamètre se balancer dans l'air puis se poser sur la plage, sur 3 béquilles. L'objet à la forme d'une coupole en dôme et possède des sortes de hublots bleu brillants. Un rayon lumineux en jaillit et 3 êtres en descendent. Ils sont grands, en combinaison, et déterrent (enterrent ?) chacun 10 tubes de 25 cm de long sur 10 de diamètre avant de rentrer dans leur appareil. Tout ceci durera 4 h 38. Une montre s'arrêtera, et la peau desquame 3 jours Doc. LDLN, R. Otahi, 1973.;"";1949-02
https://rr0.org/time/1/9/4/9/02/index.html;;1949-02;Le projet Sign est transformé en projet Grudge.;"";1949-02
https://rr0.org/time/1/9/4/9/02/index.html;;1949-02;Le général Charles P. Cabell, patron des services de renseignement de l'USAF, signe un mémorandum diffusé à différentes agences spécialisées dans les informations relatives à la défense nationale (FBI, CIA, etc.) ainsi qu'à tous les grands services et unités de l'armée de l'Air des Etats-Unis du monde entier. Ce mémo énonce les besoins en informations de l'USAF sur les observations d'ovnis.;"";1949-02
https://rr0.org/time/1/9/4/9/02/index.html;;1949-02;Une conférence secrète est tenue à Los Alamos pour discuter du phénomène ovni, en particulier les boules de feu vertes qui ont été largement signalées dans la région. Parmi les scientifiques et militaires présents se trouve Edward Teller et Lincoln LaPaz, dont l'opinion d'expert est demandée au cours de la conférence Good 1987.;"";1949-02
https://rr0.org/time/1/9/4/9/02/index.html;;1949-02;"la nuit En France, Alain Bérard voit un grand objet brillant, d'une intensité semblable à la lumière d'un éclair vert, posé à terre non loin de sa ferme. Puis l'objet devient sombre. Alors qu'il s'en approchait, le témoin voit 3 personnages aves des jambes courtes et épaisses, apparemment sans tête ; effrayé, il tira sur eux 3 fois ; Un moment aprés l'objet décolle verticalement Oltre il Cielo, Missili e Razzi, vol I, p. 445.";"";1949-02
https://rr0.org/time/1/9/4/9/02/index.html;;1949-02;Un mémo de l'AFOIA rédigé par le major Boggs confirme le rapport du projet Sign du 25 janvier.;"";1949-02
https://rr0.org/time/1/9/4/9/02/index.html;;1949-02;A Pucusana (Pérou), C.A.V. (employé d'une compagnie pétrolière, 30 ans) roule vers Lima, lorsqu'il aperçoit, sur une hauteur, un disque brillant. Il s'avance pied dans sa direction pendant 10 mn. Arrivé à 20 m de l'objet, 3 personnages en sortent. Ils ressemblent à des momies, ont les jambes accolées, et un seul "pied" de grande dimension. Ils paraissent glisser sur le sol et sont couverts d'une étrange peau pelucheuse. Ils demandent au témoin où ils se trouvaient et ont une longue discussion avec lui, puis l'emmenèrent faire un voyage à bord de leur appareil Lor.III, 122.;"";1949-02