url,place,dateTime,description,sources,id,place.name,place.org.dirName,place.org.code,place.org.places,place.org.kind,place.org.parent,place.place,place.org,place.place.locations,place.place.elevation,place.place.dirName,place.place.data,place.org.parent.dirName,place.org.parent.code,place.org.parent.places,place.org.parent.kind,place.org.parent.parent.dirName,place.org.parent.parent.code,place.org.parent.parent.places,place.org.parent.parent.kind,place.org.parent.parent.parent.dirName,place.org.parent.parent.parent.code,place.org.parent.parent.parent.places,place.org.parent.parent.parent.kind,place.org.parent.parent.parent.parent,place.org.parent.parent.parent,place.org.parent.parent
https://rr0.org/time/1/9/4/7/12/index.html,,1947-12,"""Le retour de l'homme vert"" dans le n° 11, vol. 21 de Amazing Stories de décembre L'anglais Hogdson observe des points lumineux sur la face obscure de la Lune.","Ziff-Davis publications < Collection Les Treece-Sainclair < UFOPOP,s1,"""",,",1947-12
https://rr0.org/time/1/9/4/7/12/index.html,,1947-12,"Suite à Highjump, l'opération Windmill commence.","",1947-12
https://rr0.org/time/1/9/4/7/12/index.html,,1947-12,"Finne Ronne, meneur d'une expédition américaine privée en Antarctique, est basé sur l'Ile Stonington. Il survole les rivages du sud, et est le 1er à voir les montagnes du côté Ouest du Filchner Ice Shelf.","",1947-12
https://rr0.org/time/1/9/4/7/12/index.html#1947-12-08,Ile Bouchard,,"",,,,1947-12-08,A l'apparition mariale.,"",1947-12-08
https://rr0.org/time/1/9/4/7/12/index.html#1947-12-30,,1947-12-30,"James Vincent Forrestal crée par décret une commission d'enquête sur les observations d'ovnis, le projet Sign, chargé de collecter le maximum d'information possible sur ces appareils, leurs caractéristiques et leurs motivations.",",s2,""""""Vallée, Jacques"""""",,1966",1947-12-30