url;place;dateTime;description;sources;id
https://rr0.org/time/1/9/4/7/12/index.html;;1947-12;"Le retour de l'homme vert" dans le n° 11, vol. 21 de Amazing Stories de décembre Ziff-Davis publications < Collection Les Treece-Sainclair < UFOPOP L'anglais Hogdson observe des points lumineux sur la face obscure de la Lune.;"";1947-12
https://rr0.org/time/1/9/4/7/12/index.html;;1947-12;Suite à Highjump, l'opération Windmill commence.;"";1947-12
https://rr0.org/time/1/9/4/7/12/index.html;;1947-12;Finne Ronne, meneur d'une expédition américaine privée en Antarctique, est basé sur l'Ile Stonington. Il survole les rivages du sud, et est le 1er à voir les montagnes du côté Ouest du Filchner Ice Shelf.;"";1947-12
https://rr0.org/time/1/9/4/7/12/index.html;;1947-12;A l'Ile Bouchard, apparition mariale.;"";1947-12
https://rr0.org/time/1/9/4/7/12/index.html;;1947-12;James Vincent Forrestal crée par décret une commission d'enquête sur les observations d'ovnis, le projet Sign, chargé de collecter le maximum d'information possible sur ces appareils, leurs caractéristiques et leurs motivations Vallée, Jacques : 1966.;"";1947-12