description,events,eventType,id,place,sources,time,type,url,place.dirName,place.elevation,place.events,place.id,place.locations,place.name,place.type
"le , observation d'Hideichi Amano.","",sighting,1978-10-03$SayamaJapon,,,"",,"",Sayama (Japon),place,"",1978-10-03,event,https://rr0.org/time/1/9/7/8/10/index.html#1978-10-03
"le , 2 témoins voient au-dessus des champs face à leur habitation une sphère lumineuse de couleur feu et stationnaire. Un cercle rouge non complet entoure l'objet. Le phénomène d'une luminosité variable dure 10 minutes environ avant de disparaître progressivement dans la nuit. Aucun bruit n'est entendu durant l'observation et la disparition du phénomène.","",sighting,1978-10-08T22:20$CambraiNord,,,"",,"",Cambrai (Nord),place,"""GEPAN"","""",s1,"""",,PAN classé C",1978-10-08T22:20,event,https://rr0.org/time/1/9/7/8/10/index.html#1978-10-08T22:20
"vers le Sur et Reims, 2 personnes observent le passage d'un phénomène de forme allongée qui les intrigue. Des lumières colorées sont également aperçues (Aucun phénomène anormal n'a été détecté au centre de détection satellite de l'Aube. Le service technique de l'aérodrome de Barberey-Saint-Sulpice informera la gendarmerie qu'aucune observation inhabituelle n'a été signalée pour ces jours là. Ces témoins ont probablement observé le passage d'un aéronef).","",sighting,1978~-10~-13~T20~:00$Troyes,,,"",,"",Troyes,place,"""GEPAN"","""",s2,"""",,PAN classé B",1978~-10~-13~T20~:00,event,https://rr0.org/time/1/9/7/8/10/index.html#1978~-10~-13~T20~:00
le à en 20 1 des 2 témoins du 13 fait une observation similaire.,"",sighting,1978-10-18T19:00$,,"",1978-10-18T19:00,event,https://rr0.org/time/1/9/7/8/10/index.html#1978-10-18T19:00
"le le samedi 21 18:19 A , Frederik Valentich décolle pour King Island (Détroit de Bass, Australie). le samedi 21 19:06 Frederik Valentich appelle le contrôle au sol de Melbourne pour lui signaler qu'un appareil non identifiable vole autour de lui. La communication s'interrompt. le samedi 21 19:28 Les recherches pour retrouver l'appareil de Frederik Valentich commencent et dureront une semaine, sans succès.","",sighting,1978-10-21$MoorabbinMelbourneAustralie,,,"",,"","Moorabbin (Melbourne, Australie)",place,"",1978-10-21,event,https://rr0.org/time/1/9/7/8/10/index.html#1978-10-21
"le , Michel Roberts voit un phénomène de forme triangulaire, entouré de lumières","",sighting,1978-10-23T18:35$HinckleysHollycroftHill,,,"",,"",Hinckley’s Hollycroft Hill,place,"""""""Roberts, Michel"""""","""",s3,"""",,""Burbage historian recalls Hinckley's UFO""",1978-10-23T18:35,event,https://rr0.org/time/1/9/7/8/10/index.html#1978-10-23T18:35
le La Une de The Australian sur la disparition de Frederik Valentich,"",sighting,1978-10-25$,,"",1978-10-25,event,https://rr0.org/time/1/9/7/8/10/index.html#1978-10-25
"le , 2 pêcheurs voient un objet lumineux en forme de cloche sortir de la mer avec un son métallique et s'envoler à 50 m d'eux.","",sighting,1978-10-27T18:40$FalconeprincipauteDePiombinoItalie,,,"",,"","Falcone (principauté de Piombino, Italie)",place,""""","""",s4,"""",,",1978-10-27T18:40,event,https://rr0.org/time/1/9/7/8/10/index.html#1978-10-27T18:40