description,events,eventType,id,place,sources,time,type,url,place.dirName,place.elevation,place.events,place.id,place.locations,place.name,place.sources,place.type
.,"",sighting,1894$,,""""","""",s1,"""",,""Sighted A Big Meteor / Captain McKee Treated to a Remarkable Scene at Sea. / Says It Blazed Like A Big Sun""",1894,event,https://rr0.org/time/1/8/9/4/index.html
"Dans le , un météore gigantesque tombe au sol.","",sighting,1894-02$Nevada,,,"",,"",Nevada,"",place,""""","""",s2,"""",,""A Gigantic Meteor Found""",1894-02,event,https://rr0.org/time/1/8/9/4/index.html#1894-02
"Début du mois A , pluie de milliers de méduses de la taille d'un shilling (au même moment) A Wigan (Angleterre), pluie de grenouilles","",sighting,1894-08$BathAngleterre,,,"",,"",Bath (Angleterre),"",place,"""""""Notes and Queries, 8-6-190 < The Complete Books of Charles Fort. New York"""""","""",s3,"""",,Dover,""""""Notes and Queries, 8-6-190 < The Complete Books of Charles Fort. New York"""""","""",s4,"""",,Dover",1894-08,event,https://rr0.org/time/1/8/9/4/index.html#1894-08
(1ʳᵉ ?) Photographie de foudre en boule.,"",sighting,1894$,,""""","""",s5,"""",,""A Remarkable Lightning Photograph""",1894,event,https://rr0.org/time/1/8/9/4/index.html
"Découverte d'un prétendu géant indien momifié, supposé avoir été découvert par une équipée de prospecteurs dans une grotte près de. En fait un canular composé principalement de toile de jute et de ferraille.","",sighting,1894$SanDiegoCalifornie,,,"",,"",San Diego (Californie),"",place,""""","""",s6,"""",,""Scientific Hoaxes that Have Fooled the World""",1894,event,https://rr0.org/time/1/8/9/4/index.html