description,events,eventType,id,place,sources,time,type,url,place.dirName,place.elevation,place.events,place.id,place.locations,place.name,place.org._parent,place.org.events,place.org.id,place.org.kind,place.org.places,place.org.type,place.org._parent._parent._parent._parent,place.org._parent._parent._parent.events,place.org._parent._parent._parent.id,place.org._parent._parent._parent.kind,place.org._parent._parent._parent.places,place.org._parent._parent._parent.type,place.org._parent._parent.events,place.org._parent._parent.id,place.org._parent._parent.kind,place.org._parent._parent.places,place.org._parent._parent.type,place.org._parent.events,place.org._parent.id,place.org._parent.kind,place.org._parent.places,place.org._parent.type,place.org._parent._parent,place.org._parent._parent._parent
"Couverture de Fate ce mois-là sur les ""rencontres rapprochées"" et une interview de Jacques Vallée sur l'hypothèse du ""système de contrôle"" vers le (et non le jeudi 23 comme le déclareront en premier lieu des témoins) A , plusieurs personnes observent dans le ciel le passage rapide d'un ovale brillant avec une trajecoire rectiligne. Aucun bruit et aucune trainée ne sont remarqués.","",sighting,"1978~-02~-14~T16~:00$Poya (Nouvelle Calédonie, Outre Mer)",,,"",,"","Poya (Nouvelle Calédonie, Outre Mer)","""GEPAN"","""",s1,"""",,,PAN classé C",1978~-02~-14~T16~:00,event,https://rr0.org/time/1/9/7/8/02/index.html#1978~-02~-14~T16~:00
le Explosion aérienne encore non identifiée.,"",sighting,1978-02-15$,,"",1978-02-15,event,https://rr0.org/time/1/9/7/8/02/index.html#1978-02-15
"le Photographies d'un ovni à Kawaga, Miki-Cho (Japon).","",sighting,1978-02-04T15:00$,,"",1978-02-04T15:00,event,https://rr0.org/time/1/9/7/8/02/index.html#1978-02-04T15:00
"vers le , 1 témoin voit en direction du sud-est une sphère de couleur rouge très vif. Située juste au-dessus de l'horizon cette sphère descent progressivement vers le sol puis disparaît en lassant une trainée de flammes. L'observation a duré 1 mn 1/2 environ. (Aucun autre témoignage n'a été recueilli par le GEPAN).","",sighting,"1978~-02~-12~T19~:30$La Réole (Gironde, Aquitaine)",,,"",,"","La Réole (Gironde, Aquitaine)","""GEPAN"","""",s2,"""",,,PAN classé C",1978~-02~-12~T19~:30,event,https://rr0.org/time/1/9/7/8/02/index.html#1978~-02~-12~T19~:30
"le ""Le Grolleau"" (N11), une personne, à l'arrêt dans sa voiture, voit un cigare horizontal monter lentement. D'un coté, il a l'aspect d'une boule de fumée lumineuse. Le phénomène semble pivoter et éclaire le paysage en blanc comme en plein jour. Un son comme coup de canon retentit alors, détournant l'attention du témoin qui lorsqu'il regarde de nouveau vers le phénomène et constate qu'il a disparu. Seul un trait rouge file dans le ciel. (Eric Maillot proposera une explication par la pleine Lune, à la position du phénomène observée, pouvant être à un moment masquée par un nuage. Le bruit serait attribuable à une cause distincte (pot d'échammpement, pétard, etc.))","",sighting,1978-02-21$Sainte Soulle,,,"",,"",Sainte Soulle,""""","""",s3,"""",,205,",1978-02-21,event,https://rr0.org/time/1/9/7/8/02/index.html#1978-02-21
le Lancement du 1er satellite Navstar du réseau américain GPS.,"",sighting,1978-02-22$,,"",1978-02-22,event,https://rr0.org/time/1/9/7/8/02/index.html#1978-02-22
"le à en 19, une automobiliste et son fils aperçoivent un phénomène très lumineux avec des fenètres ovales semblant 2 m du sol. De couleur orange à la forme d'une banane avec les extrémités tournées vers le haut qui émettent des étincelles orange et bleues, il ""décolle"" en prenant de la vitesse selon une trajectoire nord-sud puis se stabilise avant de disparaître instantanément. L'observation a duré 3 minutes durant laquelle aucun bruit particulier n'a été entendu. Aucune trace n'a été découverte sur les lieux.","",sighting,"1978-02-28T19:30$Chabeuil (Drôme, Rhône Alpes)",,,"",,"","Chabeuil (Drôme, Rhône Alpes)","""GEPAN"","""",s4,"""",,,PAN classé D",1978-02-28T19:30,event,https://rr0.org/time/1/9/7/8/02/index.html#1978-02-28T19:30