description,events,eventType,id,place,sources,time,type,url,place.dirName,place.elevation,place.events,place.id,place.locations,place.name,place.type
"en le dimanche 8 juin A , observation mariale.","",sighting,1873-06$SaintBauzilleDeLaSylve,,,"",,"",Saint-Bauzille de la Sylve,place,"",1873-06,event,https://rr0.org/time/1/8/7/3/index.html#1873-06
"le à en 21 Par une nuit dégagée de tout nuage, observation d'un météore au-dessus de la Mer du Nord, puis de la côte est de l'Écosse et de l'Angleterre ainsi que la Manche. Les analyses modernes des observations indiqueront que le météore est entré dans l’atmosphère terrestre. Il s’est finalement brisé après avoir voyagé dans l'atmosphère sur environ 1610 km, jusqu'au sud-est de la France ou au nord de l’Italie.","",sighting,1873-08-18T21:15$,,"""M. Beech"","""",s1,"""",,""The Great Meteor of 18 August 1783""",1873-08-18T21:15,event,https://rr0.org/time/1/8/7/3/index.html#1873-08-18T21:15
"en le mercredi 3 septembre Worson est un cordonnier vivant dans le. Ayant tendance à se vanter de sa capacité en tant que coureur de fond, il est défié par 2 amis le marchand de tissu Barham Wise et le photographe Hamerson Burns, de courrir 64 km de Leamington à Coventry. Worson accepte et commence à courir tandis que ses amis le suivent de près dans un chariot tiré par des chevaux. Worson court sans problème pendant plusieurs miles, parlant même sur le chemin avec ses amis. Soudain, alors qu'il n'est à une demi-douzaine de yards d'eux et, alors qu'ils ont leurs yeux fixés sur lui, Worson semble trébucher au milieu de la route. Il tombe alors en avant et, alors qu'il chute, émet un horrible cri de terreur. Il disparaît alors complètement. Burns et Wise cherchent frénétiquement, mais ne peuvent trouver une trace de leur ami qui semble s'être évaporé dans l'air juste devant leurs yeux. Une recherche intensive ultérieure de la zone dégagea des résultats similaires, et Corson ne fut plus jamais revu.","",sighting,1873-09$WarwickshireAngleterre,,,"",,"",Warwickshire (Angleterre),place,"",1873-09,event,https://rr0.org/time/1/8/7/3/index.html#1873-09
"en le dimanche 30 novembre À , plusieurs observateurs voient au nord, au-dessous de la Grande Ourse, un ""météore"" d'abord immobile, puis qui se met en marche, s'approche de φ jusqu'à la toucher, s'en éloigne en décrivant diverses oscillations et disparait à l'est après tous ces zigzags. M. Vinot, qui en a reçu la description dans son Journal du Ciel, reçoit la confirmation de cette observation ; le météore était rouge comme Mars.","",sighting,1873-11$Poissy,,,"",,"",Poissy,place,"""""""Flammarion, C."""""","""",s2,"""",,Etudes et Lecture sur L'Astronomie",1873-11,event,https://rr0.org/time/1/8/7/3/index.html#1873-11
"en le lundi 8 décembre 1873 M. et Mme Thomas B. Cumpston arrivent à pour de courtes vacances. Ils restent à l'hôtel Victoria. Tôt dans la soirée, ils entendent des sons forts et étranges dans leur chambre ou près d'elle. Ils s'en plaignent à la landlady, qui entend aussi les bruits, mais ne sait quoi en dire. Après que les bruits ont cessé ils se retirent dans leur lit pour la luit, mais sont réveillés vers le lundi 8 décembre 1873 à 03 h par les mêmes bruits, cette fois accompagnés de l'incroyable sensation que le sol se dérobe sous eux. Le couple crie à l'aide et ne peut rien faire d'autre que remarquer combien leurs cris sonnent étrangement, se répercutant bizarrement et répétés par des présences qu'ils ne voient pas. Le sol s'ouvre alors et Cumpston sent qu'il est attiré à l'intérieur. Mme Cumpston parvient à le tirer dehors et tous 2 s'enfuient en hâte par une fenêtre proche. Ils sont paniqués au-delà de toute imagination et ont l'impression confuse que des criminels ont comme essayé de les enlever. Ils volent jusqu'à la gare voisine où ils sont bientôt arrêtés par la police locale pour trouble à l'ordre public. La landlady témoigne auprès de la police avoir effectivement entendu les bruits inhabituels, mais ne s'en souvient pas de manière significative. La police vérifie la chambre des Cumpston et ne trouve rien sortant de l'ordinaire. La cour conclut que les Cumpston ont souffert d'une ""hallucination collective"" et les laisse partir.","",sighting,1873-12$citybristolVA,,,"",,"",,place,"",1873-12,event,https://rr0.org/time/1/8/7/3/index.html#1873-12