url,place,time,description,sources,id,place.name,place.org.name,place.org.surname,place.org.title,place.org.time,place.org.deprecated,place.org.note,place.org.place,place.org.description,place.org.sources,place.org.tags,place.org.image,place.org.id,place.org.dirName,place.org.url,place.org.events,place.org.type,place.org.parent,place.org.places,place.org.kind,place.place,place.org,place.place.name,place.place.surname,place.place.title,place.place.time,place.place.deprecated,place.place.note,place.place.place,place.place.description,place.place.sources,place.place.tags,place.place.image,place.place.id,place.place.dirName,place.place.url,place.place.events,place.place.type,place.place.parent,place.place.locations,place.place.elevation,place.org.parent.name,place.org.parent.surname,place.org.parent.title,place.org.parent.time,place.org.parent.deprecated,place.org.parent.note,place.org.parent.place,place.org.parent.description,place.org.parent.sources,place.org.parent.tags,place.org.parent.image,place.org.parent.id,place.org.parent.dirName,place.org.parent.url,place.org.parent.events,place.org.parent.type,place.org.parent.parent.name,place.org.parent.parent.surname,place.org.parent.parent.title,place.org.parent.parent.time,place.org.parent.parent.deprecated,place.org.parent.parent.note,place.org.parent.parent.place,place.org.parent.parent.description,place.org.parent.parent.sources,place.org.parent.parent.tags,place.org.parent.parent.image,place.org.parent.parent.id,place.org.parent.parent.dirName,place.org.parent.parent.url,place.org.parent.parent.events,place.org.parent.parent.type,place.org.parent.parent.parent.name,place.org.parent.parent.parent.surname,place.org.parent.parent.parent.title,place.org.parent.parent.parent.time,place.org.parent.parent.parent.deprecated,place.org.parent.parent.parent.note,place.org.parent.parent.parent.place,place.org.parent.parent.parent.description,place.org.parent.parent.parent.sources,place.org.parent.parent.parent.tags,place.org.parent.parent.parent.image,place.org.parent.parent.parent.id,place.org.parent.parent.parent.dirName,place.org.parent.parent.parent.url,place.org.parent.parent.parent.events,place.org.parent.parent.parent.type,place.org.parent.parent.parent.parent,place.org.parent.parent.parent.places,place.org.parent.parent.parent.kind,place.org.parent.parent.places,place.org.parent.parent.kind,place.org.parent.places,place.org.parent.kind,place.org.parent.parent.parent,place.org.parent.parent
https://rr0.org/time/1/9/7/6/01/index.html#1976-01-01,Saint-Richaumont (Aisne),,,,,,,,,,,,,,,,"",place,,"",,1976-01-01,"le , par une nuit noire, plusieurs personnes dans un transport en commun voient une forme circulaire baignée dans une vive lueur traverser rapidement le ciel du nord-est au sud-ouest, sans entendre aucun bruit.",",s1,""GEPAN"",,",1976-01-01
https://rr0.org/time/1/9/7/6/01/index.html#1976-01-06,,1976-01-06,"le le mardi 6 23:30 Mona Stafford, Louise Smith et Elaine Thomas sont parties à Lancaster fêter l'anniversaire de Mona. Elles se trouvent près de Stanford (Kentucky), retournant à Liberty sur l'étroite et sinueuse route 78. Un ovni rouge, qui fait peut-être 30 m de diamètre, apparaît dans le ciel à l'Est. Il est surmonté d'un dôme blanc bleuâtre où brille une lumière aveuglante. L'ovni envoie des rayons de lumière bleue et l'un d'eux illumine la voiture. Louise, la conductrice, arrête le véhicule. Mona tente de sortir, mais est paralysée. Louise redémarre et, comme les 2 protagonistes s'approchent d'un tunnel creusé dans la roche, la voiture échappe à son contrôle, fonçant à 140 km/h sur une route en ligne droite, longue et sans circulation, qui n'a aucun rapport avec la véritable route 78. Le trio ressent une ardente chaleur. le mardi 6 01:25 Les choses reviennent à la normale et elles arrivent à la caravane qui sert de domicile à Louise, 90 mn plus tard que prévu. Les jours qui suivront, elles souffriront toutes 3 de sensations de brûlures et de perte de poids. Les 3 amies passeront au détecteur de mensonges. Durant une régression sous hypnose, Mona Stafford fera la description détaillée d'un enlèvement au cours duquel son corps a été recouvert d'un liquide douloureux et un tube enfoncé dans son estomac.","",1976-01-06
https://rr0.org/time/1/9/7/6/01/index.html,Domène (Isère,,,,,,,,,,,,,,,,"",place,,"",,1976-01,"A ), observation d'une soucoupe et d'un géant blond.","""Extraterrestres parmi nous ?"",s2,"""",Le Parisien Libéré,1976-01-13",1976-01
https://rr0.org/time/1/9/7/6/01/index.html#1976-01-17,Vimy (Pas-de-Calais),,,,,,,,,,,,,,,,"",place,,"",,1976-01-17,"le , un cultivateur observe pendant 1 minute au-dessus des bois le passage lent et sans bruit d'Est en Ouest un phénomène qui semble allumer un projecteur puissant balayant la plaine. Le témoin part chercher son fils mais à leur retour le phénomène a disparu (Malgré l'enquête de gendarmerie, aucun autre témoignage ou informations ne seront recueillis.).",",s3,""GEPAN"",,",1976-01-17
https://rr0.org/time/1/9/7/6/01/index.html#1976-01-21,,1976-01-21,le 1er vol commercial du Concorde.,"",1976-01-21
https://rr0.org/time/1/9/7/6/01/index.html#1976-01-30,,1976-01-30,"le Une femme observe un phénomène ressemblant à une étoile, juste plus brillante, positionnée dans le ciel du sud-ouest — exactement là où Vénus était située à ce moment. Elle ne voit pas Vénus à côté de cet objet. Elle regarde alors la lumière descendre graduellement sur l'horizon en une période de 1 h de temps — ce qui est exactement ce que ferait Vénus. Elle perçoit ce mouvement de coucher comme saccadé ; son mari pense qu'il s'agissait seulement d'une étoile, mais elle l'encourage à percevoir la descente saccadée également, ce qui finit par attiser son excitation. Après l'avoir contemplée pendant suffisamment longtemps, la femme devient convaincue qu'elle regarde la fenêtre éclairée d'un ovni et qu'elle peut voir les têtes rondes des occupants à l'intérieur, des têtes avec des visages de couleur argentée. Elle fait alors en sorte de voir cette apparition à la même place chaque nuit les nuits suivantes. Elle répondra à Allan Hendry, qui lui dira qu'il s'agissait de Vénus : Vous parlez à une femme de 54 ans. Je sais à quoi ressemblent les étoiles !","",1976-01-30