url,place,time,description,sources
https://rr0.org/time/1/9/9/4/09/index.html,,1994-09,"A Saint Gervais-sur-Mare (Hérault), observation fugitive de phénomènes lumineux dans le ciel. Les 2 témoins décrivent des phénomènes différents et les jours ne correspondent pas non plus SEPRA: PAN classé C.",""
https://rr0.org/time/1/9/9/4/09/index.html,,1994-09,"A la Roche-Guyon (Val d'Oise), observation de 1 lumière vive statique au-dessus de la centrale électrique de Porcheville. Montée lente à 45 ° Gazette du Val d'Oise, 1997-07-16.",""
https://rr0.org/time/1/9/9/4/09/index.html,,1994-09,"A Saint-Vallier-de-Thiey (Alpes Maritimes), observation par 3 témoins en voiture du passage fugitif d'une forme lumineuse ovoïde. Ces personnes étaient précisément à la recherche d'OVNI. L'un des témoins est cependant sceptique et pense qu'il s'agit d'une simple illumination par les phares d'un véhicule. Le vol la même nuit de matériel dans un chantier voisin peut accréditer cette thèse mais aucune autre information n'est disponible SEPRA: PAN classé C.",""
https://rr0.org/time/1/9/9/4/09/index.html,,1994-09,"A Hessdalen (Norvège), observation (ci-contre). Observation du 15 à Hessdalen",""
https://rr0.org/time/1/9/9/4/09/index.html,,1994-09,"A Savignac-les-Eglises (Dordogne), un témoin voit 1 lumière vive qui prend une forme géométrique. Aucun bruit n'est remarqué SEPRA: PAN classé C. A Ruwa (Zimbabwe), rencontre une soixantaine d'enfants près d'une école.",""
https://rr0.org/time/1/9/9/4/09/index.html,,1994-09,"Le projet SETI est exclu du budget de la NASA, et continue avec l'aide de donations privées à un rythme moins soutenu.",""
https://rr0.org/time/1/9/9/4/09/index.html,,1994-09,"A Montrejeau (Haute Garonne), 1 témoin observe depuis sa chambre la retombée rapide de 1 boule bleue derrière une carrière proche. Aucun bruit n'est perçu mais des lueurs bleues montent derrière la montagne après la chute supposée. Le témoin réveille sa compagne qui n'observe que les lueurs derrière la carrière Il s'agit vraisemblablement d'une rentrée atmosphérique SEPRA: PAN classé B.",""