description,events,id,place,sources,time,type,url,place.name,place.org,place.place.dirName,place.place.elevation,place.place.events,place.place.id,place.place.locations,place.org.dirName,place.org.events,place.org.id,place.org.kind,place.org.parent,place.org.places,place.org.type,place.place,place.org.parent.dirName,place.org.parent.events,place.org.parent.id,place.org.parent.kind,place.org.parent.parent.dirName,place.org.parent.parent.events,place.org.parent.parent.id,place.org.parent.parent.kind,place.org.parent.parent.parent,place.org.parent.parent.places,place.org.parent.parent.type,place.org.parent.places,place.org.parent.type,place.org.parent.parent,place.org.parent.parent.parent.dirName,place.org.parent.parent.parent.events,place.org.parent.parent.parent.id,place.org.parent.parent.parent.kind,place.org.parent.parent.parent.parent,place.org.parent.parent.parent.places,place.org.parent.parent.parent.type
le Eric Gairy prend la parole au cours de la 30ᵉ session de l'Assemblée Générale de l'ONU.,"",1975-10-07,,"",1975-10-07,sighting,https://rr0.org/time/1/9/7/5/10/index.html#1975-10-07
le Le Japon lance la 1ʳᵉ fusée N 1.,"",1975-10-09,,"",1975-10-09,sighting,https://rr0.org/time/1/9/7/5/10/index.html#1975-10-09
"le , 9 observations sont transmises dans la nuit au NORA D.","",1975-10-16,Great Falls (Montana),,,,"",,"","",1975-10-16,sighting,https://rr0.org/time/1/9/7/5/10/index.html#1975-10-16
le 1ʳᵉ photo du sol de Vénus par Venera 9.,"",1975-10-22,,"",1975-10-22,sighting,https://rr0.org/time/1/9/7/5/10/index.html#1975-10-22
le enlèvement de David Stephens et Glen Gray.,"",1975-10-27T03:00,Norway (Maine),,,,"",,"","",1975-10-27T03:00,sighting,https://rr0.org/time/1/9/7/5/10/index.html#1975-10-27T03:00
"le Un ovni vrombissant, émettant une lumière stroboscopique blanche et des lumières oranges et rougeâtres, s'approche à moins de 300 m d'un entrepôt d'armes nucléaires de la base de l'Air Force de. Durant les en 90 que dure la visite de l'ovni, il est traqué par le radar.","",1975-10-27T20:00,Loring (Maine),,,,"",,"","",1975-10-27T20:00,sighting,https://rr0.org/time/1/9/7/5/10/index.html#1975-10-27T20:00
le Le radar de la base de détecte un inconnu qui se dirige une fois de plus vers l'entrepôt d'armes. Un hélicoptère échoue dans sa tentative de contact visuel avec l'ovni.,"",1975-10-29,Loring (Maine),,,,"",,"","",1975-10-29,sighting,https://rr0.org/time/1/9/7/5/10/index.html#1975-10-29
"le Un ovni est repéré à 3 occasions différentes, mais un hélicoptère est envoyé pour l'intercepter ne peut prendre contact avec lui.","",1975-10-30,,"",1975-10-30,sighting,https://rr0.org/time/1/9/7/5/10/index.html#1975-10-30
"le Comme la veille, des ovnis volent en formation au-dessus d'un entrepôt d'armes de la base USAF de. Un avion décolle pour les intercepter, mais échoue également à prendre contact.","",1975-10-31,Wirtsmith (Michigan),,,,"",,"","",1975-10-31,sighting,https://rr0.org/time/1/9/7/5/10/index.html#1975-10-31