url,place,time,description,sources,id,place.name,place.org.type,place.org.dirName,place.org.events,place.org.id,place.org.places,place.org.kind,place.org.parent,place.place,place.org,place.place.id,place.place.events,place.place.locations,place.place.elevation,place.place.dirName,place.org.parent.type,place.org.parent.dirName,place.org.parent.events,place.org.parent.id,place.org.parent.places,place.org.parent.kind,place.org.parent.parent.type,place.org.parent.parent.dirName,place.org.parent.parent.events,place.org.parent.parent.id,place.org.parent.parent.places,place.org.parent.parent.kind,place.org.parent.parent.parent.type,place.org.parent.parent.parent.dirName,place.org.parent.parent.parent.events,place.org.parent.parent.parent.id,place.org.parent.parent.parent.places,place.org.parent.parent.parent.kind,place.org.parent.parent.parent.parent,place.org.parent.parent.parent,place.org.parent.parent
https://rr0.org/time/1/9/5/4/04/index.html#1954-04-21,Puy-de-Dôme (France),,,"","",,,1954-04-21,"le Dans le , observation",""""",Paris-Match n° 266,s4,""""""Michel, A."""""",""p. 74, 1er au 8 mai 1954 < Seray, Patrice: """"Vague 1954 - L'affaire toulonnaise ou un cas sidérant..."""""",,""""",1954-04-21
https://rr0.org/time/1/9/5/4/04/index.html#1954-04-22T14:00,l'Ile San Nicholas (Californie),,,"","",,,1954-04-22T14:00,"le Le personnel militaire américain voit un objet en forme de cigare, de couleur grise, s'apprêtant è atterrir sur le sol de. De la fumée s'élève quand l'objet atterrit. Les recherches ne donnent aucun résultat.",""""",,s5,"""",,,"""","""",cas n° 2,s6,""""""Vallée, Jacques"""""",""Rapport sur l'analyse de 200 observations documentées faites en 1954"",,""""",1954-04-22T14:00
https://rr0.org/time/1/9/5/4/04/index.html#1954-04-23T09:30,Pittsfield (Maine),,,"","",,,1954-04-23T09:30,"le è F. E. Robinson et sa femme observent durant 4 mn un objet comme un dollar argenté avec un dôme et une lumière pulsante émettant un son ressemblant è un essaim d'abeilles. Il plane et s'incline, vole horizontalement, puis s'élève verticalement sans se pencher. Les pierres en-dessous bougent.",""""",Cas Blue Book n° 2974 non résolu,s7,"""",,,""""",1954-04-23T09:30
https://rr0.org/time/1/9/5/4/04/index.html#1954-04-24,Hartland (Maine),,,"","",,,1954-04-24,"le en avril 1954 à 18:10 à , D. Robinson observe durant 15 mn un grand objet argenté et oblong avec un dôme et une lumière pulsante voler droit puis s'élever. En Corrèze (France), observation",""""",Cas Blue Book non résolu,s8,"""",,,"""","""",Paris-Match n° 266,s9,""""""Michel, A."""""",""p. 74, 1er au 8 mai 1954 < Seray, Patrice: """"Vague 1954 - L'affaire toulonnaise ou un cas sidérant..."""""",,""""",1954-04-24
https://rr0.org/time/1/9/5/4/04/index.html#1954-04-26T19:35,Athens (Georgie),,,"","",,,1954-04-26T19:35,"le à C. CarteyH. Hopkins, sa femme et sa fille observent pendant 10 s entre 15 et 20 objets jaunes voler dans un axe sud-nord en formation en V.",""""",Cas Blue Book n° 2983 non résolu,s10,"""",,,""""",1954-04-26T19:35
https://rr0.org/time/1/9/5/4/04/index.html#1954-04,Bois-du-Champ (Vosges),,,"","",,,1954-04,"après-midiRoger Rougeolle et Gilbert Doridant voient un gigantesque ovni en forme de dirigeable, immobile è quelques cm du sol. Sa coque è l'air d'être en acier et pour s'en assurer, Rougeolle s'en approche au plus près et tente de lui donner un coup du plat de sa hache. Il se retrouve projeté è quelques mètres en arrière par une force répartie uniformément sur son corps. Le témoins estime avoir ressenti un effet de paralysie qui l'immobilise jusqu'au départ de l'objet.",""""",LDLN N° 275-276,s11,"""",p. 27,,""""",1954-04
https://rr0.org/time/1/9/5/4/04/index.html#1954-04,Près de Flavigny-sur-Ozerain,,,"","",,,1954-04,", un couple, en excursion botanique, rencontre une énorme masse carrée et métallique qui se tient 1 s au-dessus de leurs têtes avant de s'évanouir.",""""",""Dans notre ciel et sur notre sol"" in ""Soucoupes Volantes"",s12,""""""Marey, George"""""",""Forces Aériennes Françaises (revue Mensuelle de l'Armée de l'Air) n° 245, mars 1968"",,""""",1954-04