url,place,time,description,sources,id,place.name,place.org.name,place.org.surname,place.org.title,place.org.time,place.org.deprecated,place.org.note,place.org.place,place.org.description,place.org.sources,place.org.notes,place.org.tags,place.org.image,place.org.id,place.org.dirName,place.org.url,place.org.events,place.org.type,place.org.parent,place.org.places,place.org.kind,place.place,place.org,place.place.name,place.place.surname,place.place.title,place.place.time,place.place.deprecated,place.place.note,place.place.place,place.place.description,place.place.sources,place.place.notes,place.place.tags,place.place.image,place.place.id,place.place.dirName,place.place.url,place.place.events,place.place.type,place.place.parent,place.place.locations,place.place.elevation,place.org.parent.name,place.org.parent.surname,place.org.parent.title,place.org.parent.time,place.org.parent.deprecated,place.org.parent.note,place.org.parent.place,place.org.parent.description,place.org.parent.sources,place.org.parent.notes,place.org.parent.tags,place.org.parent.image,place.org.parent.id,place.org.parent.dirName,place.org.parent.url,place.org.parent.events,place.org.parent.type,place.org.parent.parent.name,place.org.parent.parent.surname,place.org.parent.parent.title,place.org.parent.parent.time,place.org.parent.parent.deprecated,place.org.parent.parent.note,place.org.parent.parent.place,place.org.parent.parent.description,place.org.parent.parent.sources,place.org.parent.parent.notes,place.org.parent.parent.tags,place.org.parent.parent.image,place.org.parent.parent.id,place.org.parent.parent.dirName,place.org.parent.parent.url,place.org.parent.parent.events,place.org.parent.parent.type,place.org.parent.parent.parent.name,place.org.parent.parent.parent.surname,place.org.parent.parent.parent.title,place.org.parent.parent.parent.time,place.org.parent.parent.parent.deprecated,place.org.parent.parent.parent.note,place.org.parent.parent.parent.place,place.org.parent.parent.parent.description,place.org.parent.parent.parent.sources,place.org.parent.parent.parent.notes,place.org.parent.parent.parent.tags,place.org.parent.parent.parent.image,place.org.parent.parent.parent.id,place.org.parent.parent.parent.dirName,place.org.parent.parent.parent.url,place.org.parent.parent.parent.events,place.org.parent.parent.parent.type,place.org.parent.parent.parent.parent,place.org.parent.parent.parent.places,place.org.parent.parent.parent.kind,place.org.parent.parent.places,place.org.parent.parent.kind,place.org.parent.places,place.org.parent.kind,place.org.parent.parent.parent,place.org.parent.parent
https://rr0.org/time/1/9/7/1/02/index.html#1971-02-05,,1971-02-05,Photographie du 12 le Les astronautes de Apollo 14 se posent près du cratère Fra Mauro.,"",1971-02-05
https://rr0.org/time/1/9/7/1/02/index.html#1971-02-09,,1971-02-09,le Fin de la mission Apollo 14.,"",1971-02-09
https://rr0.org/time/1/9/7/1/02/index.html#1971-02-12,,1971-02-12,le Observation (ci-contre).,"",1971-02-12
https://rr0.org/time/1/9/7/1/02/index.html#1971-02-20,,1971-02-20,"le Au large de Toulon, le sous-marin Flore Le moteur tombe complètement en panne et il est impossible de le relancer.","",1971-02-20
https://rr0.org/time/1/9/7/1/02/index.html#1971-02-23T18:09,,1971-02-23T18:09,"le En France, l'ONERA lance depuis la base de Biscarosse 1 fusée Tibère qui va être vue dans tout le sud-ouest de la France ainsi qu'en Espagne, produisant beaucoup de signalements d'ovni","La Dépêche de Toulouse,s1,"""",,-25,LDLN n° 113,s2,"""",""août 1971, pp. 20-22 < Sciences & Avenir, septembre 1972, p. 702."",",1971-02-23T18:09