type,events,url,place,time,description,sources,id,place.name,place.org,place.place.id,place.place.events,place.place.locations,place.place.elevation,place.place.dirName,place.org.type,place.org.dirName,place.org.events,place.org.id,place.org.places,place.org.kind,place.org.parent.type,place.org.parent.dirName,place.org.parent.events,place.org.parent.id,place.org.parent.places,place.org.parent.kind,place.org.parent.parent.type,place.org.parent.parent.dirName,place.org.parent.parent.events,place.org.parent.parent.id,place.org.parent.parent.places,place.org.parent.parent.kind,place.org.parent.parent.parent.type,place.org.parent.parent.parent.dirName,place.org.parent.parent.parent.events,place.org.parent.parent.parent.id,place.org.parent.parent.parent.places,place.org.parent.parent.parent.kind,place.org.parent.parent.parent.parent,place.org.parent.parent.parent,place.org.parent,place.place,place.org.parent.parent
case,"",https://rr0.org/time/1/9/7/1/02/index.html#1971-02-05,,1971-02-05,Photographie du 12 le Les astronautes de Apollo 14 se posent près du cratère Fra Mauro.,"",1971-02-05
case,"",https://rr0.org/time/1/9/7/1/02/index.html#1971-02-09,,1971-02-09,le Fin de la mission Apollo 14.,"",1971-02-09
case,"",https://rr0.org/time/1/9/7/1/02/index.html#1971-02-12,,1971-02-12,le Observation (ci-contre).,"",1971-02-12
case,"",https://rr0.org/time/1/9/7/1/02/index.html#1971-02-20,,1971-02-20,"le Au large de Toulon, le sous-marin Flore Le moteur tombe complètement en panne et il est impossible de le relancer.","",1971-02-20
case,"",https://rr0.org/time/1/9/7/1/02/index.html#1971-02-23T18:09,,1971-02-23T18:09,"le En France, l'ONERA lance depuis la base de Biscarosse 1 fusée Tibère qui va être vue dans tout le sud-ouest de la France ainsi qu'en Espagne, produisant beaucoup de signalements d'ovni",""""",La Dépêche de Toulouse,s1,"""",,25,"""","""",LDLN n° 113,s2,"""",""août 1971, pp. 20-22 < Sciences & Avenir, septembre 1972"",702,""""",1971-02-23T18:09