type,events,url,place,time,description,sources,id,place.name,place.org,place.place.id,place.place.events,place.place.locations,place.place.elevation,place.place.dirName,place.org.type,place.org.dirName,place.org.events,place.org.id,place.org.places,place.org.kind,place.org.parent.type,place.org.parent.dirName,place.org.parent.events,place.org.parent.id,place.org.parent.places,place.org.parent.kind,place.org.parent.parent.type,place.org.parent.parent.dirName,place.org.parent.parent.events,place.org.parent.parent.id,place.org.parent.parent.places,place.org.parent.parent.kind,place.org.parent.parent.parent.type,place.org.parent.parent.parent.dirName,place.org.parent.parent.parent.events,place.org.parent.parent.parent.id,place.org.parent.parent.parent.places,place.org.parent.parent.parent.kind,place.org.parent.parent.parent.parent,place.org.parent,place.place,place.org.parent.parent.parent,place.org.parent.parent
case,"",https://rr0.org/time/1/9/9/7/09/index.html#1997-09-07,"Paris, Ile-de-France",,,"","",,,1997-09-07,"le le dimanche 7 01:43 À , un témoin observe de son balcon une forme triangulaire avec deux feux bleus et un vert qui avançe lentement sur une trajectoire rectiligne. L'observation dure 12 s. Aucun bruit n'a été perçu, mais le témoin a ressenti des vibrations dans le corps, et lorsqu'il a voulu prendre une photo, son appareil s'est bloqué. La dimension de l'objet a été estimée par le témoin à 700 m environ. le dimanche 7 02 h A Metz, Moselle, un couple qui regarde un feu d'artifice observe un phénomène lumineux stationnaire sur la droite du feu d'artifice. Simultanément dans une autre commune un autre couple fait la même observation. L'un des temoins filme le phénomène qui semble se tenir très proche à 10 m environ du sol (L'enquête menée conjointement par la gendarmerie et le SEPRA montrera sans ambiguité que le phénomène observé était la lune dans des conditions particulières (ciel nuageux et début d'éclipse)).",""""",Cas de type D,s1,""GEPAN"",,,"""","""",PAN classé A,s2,""SEPRA"",,,""""",1997-09-07
case,"",https://rr0.org/time/1/9/9/7/09/index.html#1997-09-09T21:30,Bagnols-sur-Cèze (Gard),,,"","",,,1997-09-09T21:30,"le et le jeudi 11 21:30, un témoin observe à deux reprises et sensiblement au même endroit une boule lumineuse qui a le même comportement. Le phénomène s'éleve du sol pendant 1 ou 2 mn puis, après quelques instants d'immobilité, part à l'horizontale avant de disparaître. Le phénomène reste silencieux.",""""",PAN classé D,s3,""SEPRA"",,,""""",1997-09-09T21:30
case,"",https://rr0.org/time/1/9/9/7/09/index.html#1997-09-11,"Billom, Puy-de-Dôme",,,"","",,,1997-09-11,"le le vendredi 12 ainsi que le lendemain en septembre 1997, des témoins signalent 1 point lumineux scintillant dans le ciel. Le phénomène est silencieux, se déplaçant très lentement dans le ciel et de la taille d'une étoile. Il produit un halo rouge et scintille de plusieurs couleurs. L'observation dure 1 h 30 environ Cette observation est probablement celle de la course d'un astre.",""""",Cas classé B,s4,""SEPRA"",,,""""",1997-09-11
case,"",https://rr0.org/time/1/9/9/7/09/index.html#1997-09-13T22:00,"Bouzonville, Moselle",,,"","",,,1997-09-13T22:00,"L'observation du 27 près de Bethal le , 1 témoin observe 1 point lumineux très brillant à côté de la lune, se déplaçant très vite et semblant en faire le tour.",""""",Cas de type C,s5,""SEPRA"",,,""""",1997-09-13T22:00
case,"",https://rr0.org/time/1/9/9/7/09/index.html#1997-09-23,"Bourg Saint Maurice-Chambéry, Savoie",,,"","",,,1997-09-23,"le en septembre 1997, 2 témoins indépendants observent le passage d'une lumière très vive, de forme ovoide avec traînée. Le phénomène est très rapide et disparaît au bout de quelques s. Aucun bruit n'est détecté (Les caractéristiques de l'observation conduisent à privilégier l'hypothèse d'une rentrée atmosphérique).",""""",PAN classé A,s6,""SEPRA"",,,""""",1997-09-23
case,"",https://rr0.org/time/1/9/9/7/09/index.html#1997-09-27,,1997-09-27,le Photographie (ci-contre) près de Bethal (New York).,"",1997-09-27
case,"",https://rr0.org/time/1/9/9/7/09/index.html#1997-09-29,Dié (Drôme),,,"","",,,1997-09-29,"le Début des réunions du symposium de Pocantico (New York). le lundi 29 12:15 A , un témoin en voiture observe durant quelques instants une boule de feu avec trainée de fumée noire (La description faite par le témoin conduit à privilégier l'hypothèse d'une rentrée atmosphérique).",""""",PAN classé B,s7,""SEPRA"",,,""""",1997-09-29