url,place,time,description,sources,id,place.name,place.org.name,place.org.surname,place.org.title,place.org.time,place.org.deprecated,place.org.note,place.org.place,place.org.description,place.org.sources,place.org.tags,place.org.image,place.org.id,place.org.dirName,place.org.url,place.org.events,place.org.type,place.org.places,place.org.kind,place.org.parent,place.place,place.org,place.place.name,place.place.surname,place.place.title,place.place.time,place.place.deprecated,place.place.note,place.place.place,place.place.description,place.place.sources,place.place.tags,place.place.image,place.place.id,place.place.dirName,place.place.url,place.place.events,place.place.type,place.place.locations,place.place.elevation,place.org.parent.name,place.org.parent.surname,place.org.parent.title,place.org.parent.time,place.org.parent.deprecated,place.org.parent.note,place.org.parent.place,place.org.parent.description,place.org.parent.sources,place.org.parent.tags,place.org.parent.image,place.org.parent.id,place.org.parent.dirName,place.org.parent.url,place.org.parent.events,place.org.parent.type,place.org.parent.places,place.org.parent.kind,place.org.parent.parent.name,place.org.parent.parent.surname,place.org.parent.parent.title,place.org.parent.parent.time,place.org.parent.parent.deprecated,place.org.parent.parent.note,place.org.parent.parent.place,place.org.parent.parent.description,place.org.parent.parent.sources,place.org.parent.parent.tags,place.org.parent.parent.image,place.org.parent.parent.id,place.org.parent.parent.dirName,place.org.parent.parent.url,place.org.parent.parent.events,place.org.parent.parent.type,place.org.parent.parent.places,place.org.parent.parent.kind,place.org.parent.parent.parent.name,place.org.parent.parent.parent.surname,place.org.parent.parent.parent.title,place.org.parent.parent.parent.time,place.org.parent.parent.parent.deprecated,place.org.parent.parent.parent.note,place.org.parent.parent.parent.place,place.org.parent.parent.parent.description,place.org.parent.parent.parent.sources,place.org.parent.parent.parent.tags,place.org.parent.parent.parent.image,place.org.parent.parent.parent.id,place.org.parent.parent.parent.dirName,place.org.parent.parent.parent.url,place.org.parent.parent.parent.events,place.org.parent.parent.parent.type,place.org.parent.parent.parent.places,place.org.parent.parent.parent.kind,place.org.parent.parent.parent.parent,place.org.parent.parent.parent,place.org.parent.parent
https://rr0.org/time/1/9/7/6/09/index.html#1976-09-03,,1976-09-03,Couverture de Argosy UFO vol. 1 n° 2 ce mois-là le Le "lander" de Vicking 2 se pose sur Mars à Utopia Planitia.,"",1976-09-03
https://rr0.org/time/1/9/7/6/09/index.html#1976-09-09,,1976-09-09,le Mort de Mao.,"",1976-09-09
https://rr0.org/time/1/9/7/6/09/index.html#1976-09-10,Colusa (Californie),,,,,,,,,,,,,,,,"",place,"",,1976-09-10,"le témoin observe un disque à coupole, avec tous ses détails, qui plane non loin de chez lui. Un faisceau lumineux vertical semble être coupé au couteau. Plus loin, deux autres ovnis créent un arc électrique avec une ligne haute tension. Pecha ressent des effets d'électricité statique. La végétation sera affectée.","",1976-09-10
https://rr0.org/time/1/9/7/6/09/index.html#1976-09-11,Maine (USA),,,,,,,,,,,,me,org/us/me,,"",org,",,,,,,,,,,,,,,"""",place,""43.06666666666667,-66.95"",,,,,,,,,,,,,,,,"""",place,""47.46666666666667,-71.11666666666666"",",region,,,,,,,,,,,,us,org/us,,"",org,"",country,,,,,,,,,,,,,,,,"",place,"43.06666666666667,-66.95",,1976-09-11,le Dans le Herbert Hopkins reçoit la visite d'un MIB alors qu'il enquête sur un cas d'apparition d'ovni dans le Maine. Sa belle-fille et son fils recevront également une visite.,"",1976-09-11$org_us_me
https://rr0.org/time/1/9/7/6/09/index.html#1976-09-19,,1976-09-19,"le le dimanche 19 30 à le dimanche 19 01:40 Observation de Téhéran. le dimanche 19 04 h ou le dimanche 19 05 h Un ovni (celui de Téhéran ?) est vu en train de voler, à peu près parallèlement à la côte Atlantique, au-dessus du Maroc (Afrique du Nord). Durant 1 h, depuis environ 01:00, un ovni brillant et laissant des étincelles dans son sillage vole lentement à une altitude estimée à 1000 m, survolant le Maroc du sud au nord. Des rapports émanent d'Agadir, de Kalaa Sraghna, d'Essaouira, de Casablanca, de Rabat et de Fez. L'ovni vu de loin ressemblait à un disque et de plus près à un cylindre.","",1976-09-19