description,events,id,place,sources,time,type,url,place.name,place.org,place.place.dirName,place.place.elevation,place.place.events,place.place.id,place.place.locations,place.org.dirName,place.org.events,place.org.id,place.org.kind,place.org.parent,place.org.places,place.org.type,place.place,place.org.parent.dirName,place.org.parent.events,place.org.parent.id,place.org.parent.kind,place.org.parent.parent.dirName,place.org.parent.parent.events,place.org.parent.parent.id,place.org.parent.parent.kind,place.org.parent.parent.parent,place.org.parent.parent.places,place.org.parent.parent.type,place.org.parent.places,place.org.parent.type,place.org.parent.parent
le le réseau ARPANET bascule du protocole initial NCP (Network Control Protocol) vers TCP/IP.,"",1983-01-01,,"",1983-01-01,sighting,https://rr0.org/time/1/9/8/3/01/index.html#1983-01-01
"le , plusieurs témoins voient 1 boule de couleur jaune qui se déplace silencieusement à très basse altitude. Cette boule est suivie d'un ensemble de flammèches bleues de petites taille. L'ensemble se désintègre soudainement faisant penser aux témoins à une chute à proximité du lieu d'observation. Aussitôt les autorités prévenues plusieurs ratissages dans les environs vont avoir lieu, mais en vain (Il est probable que les témoins aient observé une rentrée atmosphérique).","",1983-01-12T18:30,Saint Amant-Roche Savine (Puy-de-Dôme),,,,"",,"","""GEPAN"","""",s1,"""",,,",1983-01-12T18:30,sighting,https://rr0.org/time/1/9/8/3/01/index.html#1983-01-12T18:30
"le Dans l'ouest de la France, de nombreuses personnes voient un bâton lumineux dans le ciel.","",1983-01-24T08:05,,""""","""",s3,"""",,,""Mystérieux Bâton Lumineux"",""""""L'OVNI XXXXXXXXXXXXX"","""",s4,"""",,,une affaire prise (très) au sérieux"","""","""",s5,"""",,,""Un mystérieux ""bâton lumineux"" tombé du ciel recherché par les gendarmes dans l'ouest""",1983-01-24T08:05,sighting,https://rr0.org/time/1/9/8/3/01/index.html#1983-01-24T08:05
"le Lancement du satellite d'astronomie infrarouge Iras. le mercredi 26 06:55 à en le mois précédent Dans les , plusieurs témoins voient 1 boule lumineuse blanche se déplaçant horizontalement. Cette boule est suivie d'une trainée colorée. Les observations entre en le mois précédent permettent aux témoins de remarquer l'absence totale de bruit et une vitesse très importante. Ce phénomène va disparaître dans le paysage (Aucune autre information n'a pu être recueillie sur ce phénomène, qui d'après les témoignages s'apparente à une rentrée atmosphérique).","",1983-01-26$org_fr_pac_13,Bouches-du-Rhône (Provence-Alpes-Côte d'Azur (France)),org/fr/pac/13,"",13,department,org/fr/pac,"",pac,region,org/fr,"",fr,country,,"",org,",,"""",,""44,6""",org,",,"""",,""43.5,5.166666666666667""",org,,,"",,"43.5,5.166666666666667","""GEPAN"","""",s6,"""",,,",1983-01-26,sighting,https://rr0.org/time/1/9/8/3/01/index.html#1983-01-26
"le , 1 automobiliste aperçoit sur sa droite 1 objet en forme de toupie. Cet engin se trouve à 2 ou 3 m au-dessus du sol et émet des lumières rouges et vertes de faible intensité. Cet objet zigzague avant se l'élever en spirales très haut dans les airs et de disparaître.","",1983-01-28T00:10,Evrecy (Basse Normandie),,,,"",,"","""GEPAN"","""",s7,"""",,,",1983-01-28T00:10,sighting,https://rr0.org/time/1/9/8/3/01/index.html#1983-01-28T00:10
"le , 2 agriculteurs voient 1 phénomène lumineux bleuté particulier. 1 des témoins voit arriver une boule de feu de la grosseur d'un ballon : celle-ci se déplace horizontalement, émet un sifflement puis explose, affolant le bétail. Malgré des recherches de traces au sol, aucune autre information ne sera recueillie sur ce phénomène, dont la description fait penser à une manifestation de foudre.","",1983-01-29,Cerisy-la-Salle (Basse Normandie),,,,"",,"","""GEPAN"","""",s8,"""",,,",1983-01-29,sighting,https://rr0.org/time/1/9/8/3/01/index.html#1983-01-29
"À , 2 phénomènes à l'apparence triangulaire sont observés dérivant dans le ciel.","",1983-01,Swansea (Wales),,,,"",,"","""Darren Devine"","""",s9,"""",Wales Online,2013-03-28,""Released files cast light on famous Welsh ‘UFO’ sighting""",1983-01,sighting,https://rr0.org/time/1/9/8/3/01/index.html