type,events,url,place,time,description,sources,id,place.name,place.org,place.place.id,place.place.events,place.place.locations,place.place.elevation,place.place.dirName,place.org.type,place.org.dirName,place.org.events,place.org.id,place.org.places,place.org.kind,place.org.parent.type,place.org.parent.dirName,place.org.parent.events,place.org.parent.id,place.org.parent.places,place.org.parent.kind,place.org.parent.parent,place.org.parent,place.place,place.org.parent.parent.type,place.org.parent.parent.dirName,place.org.parent.parent.events,place.org.parent.parent.id,place.org.parent.parent.places,place.org.parent.parent.kind,place.org.parent.parent.parent,place.org.parent.parent.parent.type,place.org.parent.parent.parent.dirName,place.org.parent.parent.parent.events,place.org.parent.parent.parent.id,place.org.parent.parent.parent.places,place.org.parent.parent.parent.kind,place.org.parent.parent.parent.parent
case,"",https://rr0.org/time/1/9/5/8/10/index.html#1958-10-01,,1958-10-01,le Création de la NASA.,"",1958-10-01
case,"",https://rr0.org/time/1/9/5/8/10/index.html#1958-10-02,Stroudsburg (Pennsylvanie),,,"","",,,1958-10-02,le Observation à,""""",,s1,"""",,6089,""""",1958-10-02
case,"",https://rr0.org/time/1/9/5/8/10/index.html,,1958-10,Le major Robert J. Friend succède au capitaine George T. Gregory à la tête du projet Blue Book.,"",1958-10
case,"",https://rr0.org/time/1/9/5/8/10/index.html#1958-10-25,Yucca Valley,,,"","",,,1958-10-25,"le Depuis , un homme se rend Pentagone pour déposer une bobine de film de en 6 montrant un objet non identifié, déclarant qu'il s'agit d'une preuve des ovnis. Le projet Blue Book, sans pouvoir identifier l'objet, concluera à un canular via un reflet.",""""",,s2,"""",,10073,""""",1958-10-25
case,"",https://rr0.org/time/1/9/5/8/10/index.html#1958-10-26T22:30,Loch Raven (Maryland),,,"","",,,1958-10-26T22:30,"le , 2 témoins dont la voiture est mise en panne observent un ovni pendant en 1. L'objet émet un faisceau de lumière blanche puisssant qui provoque une sensation de chaleur sur leurs visages (ils seront brûlés au 1er dégré et hospitalisés), puis part à la verticale en 5 : Peu après avoir franchit la digue... le point se dresse, à 200 m ou 250 m de là... Nous avons donc vu, à cette distance, ce qui nous paraissait être un grand objet oblong et aplati suspendu entre 30 et 45 m au-dessus de la superstructure du pont qui franchit le lac. Nous avons ralenti puis nous avons décidé de nous rapprocher et d'examiner l'objet... Lorsque nous sommes arrivés à 25 m du pont, la voiture nous a lâchés complètement. On aurait dit que cela venait des circuits électriques ; les lumières du tableau de bord et des phares se sont éteints, le moteur s'est tu. M. S., qui conduisait, a serré les freins (le moteur ne tournant plus) et a manoeuvré 1 ou 2 fois la clé de contact. Le moulin demeurait muet ; alors là, nous avons vraiment commencé à avoir peur... Nous l'avons contemplé... pendant peut-être en 30 et puis, bien que je ne sois pas sûr de l'ordre des événements, il a semblé émettre un très brillant faisceau de lumière blanche, et tous les 2 nous avons senti la chaleur sur notre visage... En même temps, nous avons entendu un bruit assez fort, que j'ai pris pour une explosion sourde... Et puis, très vite... l'objet a démarré en montant verticalement. Pour autant que nous ayons pu en juger, il n'a pas changé de position (d'aspect) durant son ascension. La seule différence c'est qu'il était très lumineux et que ses bords devenaient imprécis si bien que, au fut et à mesure que ses bords devenaient imprécis si bien que, au fur et à mesure qu'il grimpait, on ne distinguait plus sa forme. Il a disparu en 5. Nous avons vraiment eu peur... Il nous a fallu peut-être 1/4 h pour retourner jusqu'à un poste téléphonique.",""""",,s3,"""",,2003,""""",1958-10-26T22:30
case,"",https://rr0.org/time/1/9/5/8/10/index.html#1958-10-27,Lock Raven Dam (Maryland),,,"","",,,1958-10-27,le Observation à.,""""",,s4,"""",,6148,""""",1958-10-27
case,"",https://rr0.org/time/1/9/5/8/10/index.html#1958-10-31,Igaupe (Bresil),,,"","",,,1958-10-31,"le A , un disque plonge dans la rivière Péropava après avoir heurté un palmier dans un sifflement intense devant un groupe de témoins. Hermann Oberth écrit : Je suis convaincu que les soucoupes volantes sont pilotées par des formes de vie supérieures, des êtres intelligents qui observent la Terre depuis longtemps.","",1958-10-31